pathway	pval	padj	ES	NES	nMoreExtreme	size	leadingEdge
REACTOME_NETRIN_1_SIGNALING	0.379818594104308	0.773813171772355	0.331013678938272	1.06589861484795	334	32	SRC, MYO10, MAPK11, RGMB, FYN, ABLIM2, DOCK1, EZR
REACTOME_NICOTINATE_METABOLISM	0.376047904191617	0.772579733980498	0.359835216266597	1.06467901121747	313	22	NADSYN1, NNMT, PARP10, NAPRT, NADK, PARP16, NAMPT, PARP4, NT5E, PARP9
REACTOME_NOSTRIN_MEDIATED_ENOS_TRAFFICKING	0.417177914110429	0.803397369874464	0.575496555975766	1.06183121209101	271	4	NOSTRIN, CAV1, WASL
REACTOME_SIGNALING_BY_TGF_BETA_RECEPTOR_COMPLEX	0.378935939196526	0.773440171984169	0.297909213955972	1.06152701213174	348	61	F11R, TGFB1, CCNT2, WWTR1, SERPINE1, RHOA, MYC, RPS27A, PPP1R15A, TGFBR2, TGIF1, CCNC, CBL, JUNB, FKBP1A, TRIM33, CCNT1, ARHGEF18, UBA52, XPO1
REACTOME_BIOSYNTHESIS_OF_SPECIALIZED_PRORESOLVING_MEDIATORS_SPMS	0.4099560761347	0.800805683435101	0.533850483273312	1.06127437219826	279	5	ALOX5, GPX4, PTGR1, EPHX2
REACTOME_SIGNALING_BY_FLT3_FUSION_PROTEINS	0.375308641975309	0.772579733980498	0.381274181499994	1.06101749534898	303	17	CDKN1A, PIM1, ETV6, STAT5A, NRAS
REACTOME_SIGNALING_BY_NUCLEAR_RECEPTORS	0.369653767820774	0.768143414948278	0.266187164176047	1.06053389705665	362	168	CYP26B1, MOV10, ABCA1, SPHK1, SRC, TLE3, MMP2, ABCG1, PLTP, GNB4, POU2F1, SREBF1, SCD, AREG, MYC, APOD, JUND, RUNX1, ZNF217, JUN, ZDHHC21, GNB1, IGF1R, CAV2, GNAI2, FASN, NRAS, CXCL12, CHD1, POLR2H, CPT1A, FOXO3, HSP90AB1, SMC1A, NR1H3, DDX5, KAT5, CCNT1, HSPB1, GNAI3, TBL1XR1, GNB2, GTF2F1, CBFB, GNG12, ERBB4, POLR2A, TNRC6A, CREB1, XPO1, ALDH1A3, KRAS, SHC1, KCTD6, PDK4, AGO3, APOC1, AKT3, ATF2, PIK3R3, RDH11, SP1
REACTOME_NRAGE_SIGNALS_DEATH_THROUGH_JNK	0.371004566210046	0.768688149665615	0.321847981752309	1.06003758019291	324	37	PLEKHG2, ARHGEF10, NGFR, BCL2L11, ARHGEF15, VAV2, ARHGEF17, ARHGEF7, ARHGEF1, TIAM2, MAGED1, MCF2L, AATF, ARHGEF18, ARHGEF9, ARHGEF12, PREX1
REACTOME_INTERLEUKIN_7_SIGNALING	0.40620957309185	0.797392732291635	0.423149407646373	1.0598124866578	313	11	SOCS2, STAT5A, BRWD1, SMARCA4, STAT3, PIK3R3, IRS2, STAT5B
REACTOME_MRNA_EDITING	0.412903225806452	0.801298627788694	0.625285546868262	1.05978660575385	255	3	ADARB1, ADAR
REACTOME_SEMA3A_PLEXIN_REPULSION_SIGNALING_BY_INHIBITING_INTEGRIN_ADHESION	0.408111533586819	0.79946671375596	0.409450908862119	1.05917995834443	321	12	FES, PLXNA3, FYN, RRAS, FARP2
REACTOME_SEMA3A_PAK_DEPENDENT_AXON_REPULSION	0.380530973451327	0.774268034670246	0.395671040403239	1.05857553380638	300	14	FES, PLXNA3, FYN, CFL1, HSP90AB1
REACTOME_CRMPS_IN_SEMA3A_SIGNALING	0.4106463878327	0.800805683435101	0.409113856920627	1.05830806221813	323	12	FES, PLXNA3, FYN, DPYSL2
REACTOME_SIGNALING_BY_LEPTIN	0.414569536423841	0.801298627788694	0.444250958418683	1.05784103906382	312	9	STAT5A, SOCS3, STAT3, IRS2, SH2B1, STAT5B
REACTOME_METABOLIC_DISORDERS_OF_BIOLOGICAL_OXIDATION_ENZYMES	0.382173382173382	0.774712680497866	0.37239188487966	1.05775777826791	312	18	CYP26B1, FDXR, CYP1B1, GSS, SLC35D1, CYP2R1, FMO3, AHCY
REACTOME_RUNX3_REGULATES_BCL2L11_BIM_TRANSCRIPTION	0.419354838709677	0.803678825275326	0.621350720124562	1.05311753000147	259	3	BCL2L11, FOXO3, SMAD3
REACTOME_RHO_GTPASES_ACTIVATE_PKNS	0.401156069364162	0.79161293093059	0.337349538978846	1.05301716910879	346	27	MYH9, KDM4C, RHOA, YWHAH, MYL12B, PKN3, YWHAZ, YWHAQ, MYL9, MYL6, PKN2, RHOB, PPP1R12A
REACTOME_TNF_RECEPTOR_SUPERFAMILY_TNFSF_MEMBERS_MEDIATING_NON_CANONICAL_NF_KB_PATHWAY	0.411279229711142	0.800805683435101	0.461718238468182	1.05212111133187	298	8	TRAF2, LTBR, BIRC3, CD40, MAP3K14, TNFSF12
REACTOME_POST_CHAPERONIN_TUBULIN_FOLDING_PATHWAY	0.422516556291391	0.806807851157143	0.441774219723822	1.05194348097236	318	9	TBCD, TBCA, ARL2, TBCB, TUBA1A
REACTOME_PEPTIDE_HORMONE_METABOLISM	0.398392652123995	0.790771178637201	0.325215036964485	1.05181209211495	346	34	SLC30A7, RAB27A, ATP6AP2, ENPEP, GNB1, INHBB, TCF7L2, SEC11C, EXOC3
REACTOME_PEPTIDE_HORMONE_BIOSYNTHESIS	0.423572744014733	0.807850185271473	0.800252967503405	1.05168978813804	229	1	INHBB
REACTOME_CLEC7A_INFLAMMASOME_PATHWAY	0.419354838709677	0.803678825275326	0.620474892954457	1.05163310435229	259	3	MALT1, RELA, NFKB1
REACTOME_NEGATIVE_REGULATORS_OF_DDX58_IFIH1_SIGNALING	0.391405342624855	0.782517023959647	0.336322864255079	1.05106676276757	336	28	IRF3, NLRC5, UBE2L6, TRIM4, RPS27A, TRIM25, ATG12, UBA52, UBA7, DDX58, PIN1
REACTOME_NUCLEAR_EVENTS_KINASE_AND_TRANSCRIPTION_FACTOR_ACTIVATION	0.401557285873192	0.79161293093059	0.306155937937994	1.04978860523267	360	46	PPP2R1B, MAPK11, ID4, F3, JUND, NAB1, NAB2, EGR3, DUSP6, JUNB, RRAD, DUSP4, EGR1, PPP2R1A, CREB1, MEF2D, ATF2, TCF12, ID3
REACTOME_SIGNALLING_TO_RAS	0.393173198482933	0.783870495212195	0.391411171522012	1.047178710399	310	14	SRC, MAPK11, SHC2, NRAS, KRAS, SHC1
REACTOME_HIGHLY_CALCIUM_PERMEABLE_POSTSYNAPTIC_NICOTINIC_ACETYLCHOLINE_RECEPTORS	0.427255985267035	0.811911843915426	0.795971978984238	1.04606372726533	231	1	CHRNA1
REACTOME_HIGHLY_CALCIUM_PERMEABLE_NICOTINIC_ACETYLCHOLINE_RECEPTORS	0.427255985267035	0.811911843915426	0.795971978984238	1.04606372726533	231	1	CHRNA1
REACTOME_VITAMIN_D_CALCIFEROL_METABOLISM	0.427753934191702	0.811911843915426	0.503160772496143	1.04589335360562	298	6	VDR, CYP2R1, UBE2I, SUMO2, PIAS4, LGMN
REACTOME_NETRIN_MEDIATED_REPULSION_SIGNALS	0.438650306748466	0.820895294745672	0.566643270760023	1.04549628449847	285	4	SRC, UNC5B, NTN1
REACTOME_SOS_MEDIATED_SIGNALLING	0.430615164520744	0.814999553296295	0.502689883553353	1.04491454197627	300	6	NRAS, KRAS, IRS2
REACTOME_SIGNAL_AMPLIFICATION	0.413151364764268	0.801298627788694	0.376817908649895	1.04370986438845	332	16	SRC, GNB4, GNB1, GNAI2, AAMP, GNAI3, GNB2, GNG12
REACTOME_OTHER_SEMAPHORIN_INTERACTIONS	0.403286978508217	0.794033939027995	0.390082557268104	1.04362414511764	318	14	SEMA4A, PTPRC, SEMA6A
REACTOME_RHO_GTPASES_ACTIVATE_ROCKS	0.396825396825397	0.79015673355296	0.367383177877236	1.04353083346596	324	18	LIMK2, MYH9, RHOA, MYL12B, ROCK1, CFL1
REACTOME_DEFECTIVE_RIPK1_MEDIATED_REGULATED_NECROSIS	0.438709677419355	0.820895294745672	0.614533594411675	1.04156329121178	271	3	TRAF2, RIPK1, TRADD
REACTOME_CREATION_OF_C4_AND_C2_ACTIVATORS	0.413165266106443	0.801298627788694	0.478552021538254	1.04154264941472	294	7	C1R, C1S, C1QB, C1QC, C1QA
REACTOME_MITOCHONDRIAL_IRON_SULFUR_CLUSTER_BIOGENESIS	0.430925221799747	0.814999553296295	0.402600394620414	1.04145884152158	339	12	FDXR, SLC25A37, LYRM4, SLC25A28
REACTOME_REGULATION_OF_TNFR1_SIGNALING	0.40650406504065	0.797392732291635	0.333073521581578	1.04091200836952	349	28	SPPL2B, TRAF1, TRAF2, RPS27A, CFLAR, RACK1, BIRC3, RIPK1, SHARPIN, UBA52
REACTOME_DAG_AND_IP3_SIGNALING	0.413832199546485	0.801298627788694	0.322892267131882	1.03974682069005	364	32	CAMKK2, ITPR3, ADCY4, ADCY3, ITPR1, PDE1A, PRKX, CAMK2B, CAMKK1, PRKAR1A, CAMK2D
REACTOME_TRANSCRIPTIONAL_REGULATION_BY_TP53	0.392	0.782517023959647	0.254589080036406	1.03961078466508	391	283	TNFRSF10B, MOV10, DDB2, FAS, PML, BBC3, CDKN1A, WRN, MDC1, CCNT2, TAF1, PPP2R1B, G6PD, COX6A1, NELFE, MDM2, CASP2, TP53INP1, PIDD1, NPM1, L3MBTL1, BANP, RFC2, MRE11, NDRG1, TP53, ATM, BRD1, CNOT3, MAPK11, CDK2, PTEN, RRAGB, NELFA, GADD45A, GLS, SESN3, RPS27A, BNIP3L, TP63, MDM4, RAD51D, RFC4, YWHAH, BAX, TSC2, FANCC, JUN, PERP, PRKAA1, CNOT6L, PLAGL1, PRELID1, BCL6, CNOT9, PMS2, PIP4K2A, SUPT5H, POLR2H, NELFB, TAF10, TAF9B, RRM2B, YWHAZ, TAF4B, GTF2H4, COX7A2L, CASP10, TAF12, KAT5, CCNT1, YWHAQ, SUPT16H, GATAD2A, KAT6A, PPP2R1A, TAF4, TP53I3, CENPJ, GTF2F1, EHMT2, PRMT5, UBA52, RAD9A, NELFCD, POLR2A, RICTOR, TNRC6A, BARD1, STK11, TAF9, CDK13, ELL, AGO3, PIN1, IGFBP3, PRKAA2, MSH2, CSNK2A2, SESN2, AKT3, ATF2, JMY, TXN, ATRIP, GATAD2B, PCNA, RAD50
REACTOME_NUCLEAR_ENVELOPE_NE_REASSEMBLY	0.429988974641676	0.814999553296295	0.297464660028001	1.03953009757704	389	53	NUP107, TMPO, CHMP4A, NUP85, IST1, NUP155, NUP160, NUP93, POM121, RANGAP1, CHMP2A, EMD, PPP2R1A, NUP205, NUP35, TUBA1A, NUP43, NUP54, NUP133, LEMD3, LEMD2, ANKLE2, UBE2I, RCC1, RAN, NUP98, NUP62, SEH1L, CC2D1B, LBR
REACTOME_NF_KB_IS_ACTIVATED_AND_SIGNALS_SURVIVAL	0.433460076045627	0.81783945218144	0.401424208873941	1.03841624876384	341	12	NGFR, RPS27A, RELA, UBA52, TRAF6, NFKBIA, NFKB1, SQSTM1
REACTOME_THROMBIN_SIGNALLING_THROUGH_PROTEINASE_ACTIVATED_RECEPTORS_PARS	0.416873449131514	0.803397369874464	0.374889514348424	1.03836859979175	335	16	SRC, GNB4, GNB1, GNB2, GNG12, ARRB2, F2RL3, ARRB1, F2R, GNAQ
REACTOME_RUNX1_REGULATES_TRANSCRIPTION_OF_GENES_INVOLVED_IN_INTERLEUKIN_SIGNALING	0.455521472392638	0.833157894736842	0.56071397036067	1.03455631246125	296	4	RUNX1, ELF1, CBFB
REACTOME_HS_GAG_BIOSYNTHESIS	0.421836228287841	0.806481581376392	0.373369821319756	1.0341593555694	339	16	NDST2, GPC3, EXT2, SDC2, HS6ST3, AGRN, HSPG2, SDC3, SDC4
REACTOME_APOPTOSIS	0.419917864476386	0.80378473937862	0.264576281711524	1.03364708922808	408	133	TNFRSF10B, FAS, HMGB2, PSMB8, BBC3, GSDMD, BCL2L1, DBNL, PSMB9, TP53, BCL2L11, TRAF2, VIM, TJP2, RPS27A, TP63, YWHAH, CFLAR, BAX, PSME1, DAPK1, SPTAN1, DYNLL1, GSN, TLR4, DAPK3
REACTOME_PURINE_SALVAGE	0.434670116429495	0.819146183699871	0.412080286638527	1.03208896288947	335	11	HPRT1, AMPD2, GMPR2, APRT, DGUOK, AMPD3
REACTOME_PRE_NOTCH_EXPRESSION_AND_PROCESSING	0.426801801801802	0.811911843915426	0.305620378778246	1.03166839010153	378	41	MOV10, POGLUT1, RBPJ, NOTCH2, TP53, KAT2A, RUNX1, SIRT6, JUN, NOTCH1, MAML2
REACTOME_RETROGRADE_NEUROTROPHIN_SIGNALLING	0.450331125827815	0.83182517174496	0.432635649194757	1.03018290902348	339	9	AP2A2, AP2B1, DNM1, AP2A1, AP2M1, DNAL4, AP2S1, CLTC
REACTOME_COMPETING_ENDOGENOUS_RNAS_CERNAS_REGULATE_PTEN_TRANSLATION	0.447042640990371	0.828843002213189	0.451658012586759	1.0291967926614	324	8	MOV10, TNRC6A, AGO3, TNRC6C
REACTOME_SIGNALING_BY_SCF_KIT	0.414117647058824	0.801298627788694	0.335209531822283	1.02901374525793	351	26	SRC, FES, FYN, STAT5A, CBL, NRAS, FER, PTPRU, STAT3
REACTOME_ESTROGEN_BIOSYNTHESIS	0.462246777163904	0.8390473617956	0.782934423039502	1.02892981460752	250	1	HSD17B11
REACTOME_RUNX2_REGULATES_GENES_INVOLVED_IN_CELL_MIGRATION	0.462664714494876	0.8390473617956	0.517276039006445	1.02832500999856	315	5	ITGA5, CBFB, AKT3, AKT1, AKT2
REACTOME_SUMOYLATION_OF_TRANSCRIPTION_COFACTORS	0.444316877152698	0.827474842979672	0.317648816325925	1.02734138364609	386	34	NPM1, DDX17, PHC3, CBX4, UHRF2, TRIM28, RING1, PCGF2, DDX5, SAFB, MBD1, PHC2, ZNF350
REACTOME_RAB_GEFS_EXCHANGE_GTP_FOR_GDP_ON_RABS	0.43863393810032	0.820895294745672	0.279141646971795	1.02661914502275	410	74	RIN1, RAB27A, GDI1, TRAPPC6A, HPS4, RAB3IL1, TRAPPC2, DENND6A, RIN2, RAB31, SBF2, SBF1, RAB13, ALS2CL, DENND4A, RIN3, DENND3
REACTOME_RNA_POLYMERASE_II_TRANSCRIBES_SNRNA_GENES	0.451716738197425	0.832441905199678	0.283741593147208	1.02572476604617	420	66	NABP1, CCNT2, POU2F1, ELL2, SNAPC4, INTS4, SRRT, INTS2, PCF11, NCBP1, SUPT5H, POLR2H, INTS1, CCNT1, INTS3, GTF2F1, POLR2A, TAF9, NCBP2, ELL, INTS5, SNAPC2, SP1, INTS6, GTF2B, RPRD1B, CDK9
REACTOME_NEUROTRANSMITTER_RECEPTORS_AND_POSTSYNAPTIC_SIGNAL_TRANSMISSION	0.447145877378436	0.828843002213189	0.27339836402259	1.02497565567811	422	85	SRC, MDM2, GABBR1, GNB4, CAMKK2, ADCY4, ADCY3, PPM1F, AP2A2, CAMK1, ARHGEF7, PRKX, PRKAA1, GNB1, MYO6, CAMK2B, GNAI2, NRAS, CHRNA1, CAMKK1, LIN7C, PRKAR1A, CAMK2D, GNAI3, GNB2, AP2B1, PLCB2, TUBA1A, GNG12, ARHGEF9, CHRNG, ERBB4, CREB1, KRAS, CHRND, PRKAA2
REACTOME_ZINC_EFFLUX_AND_COMPARTMENTALIZATION_BY_THE_SLC30_FAMILY	0.468521229868228	0.842567183284722	0.515532907929736	1.02485973199085	319	5	SLC30A7, SLC30A2, SLC30A1, SLC30A5
REACTOME_SEMAPHORIN_INTERACTIONS	0.45414364640884	0.833157894736842	0.294368167949137	1.02461794244763	410	52	LIMK2, SEMA4A, MYH9, FES, PTPRC, PLXNA3, SEMA6A, RHOA, FYN, MYL12B, DPYSL2, ROCK1, CFL1, RRAS, HSP90AB1, FARP2, PLXNB1, ARHGEF12, MYL9, MYL6, NRP1, ITGA1, DPYSL3
REACTOME_FLT3_SIGNALING_BY_CBL_MUTANTS	0.469985358711567	0.842567183284722	0.514625259851884	1.02305536227652	320	5	RPS27A, CBL, UBA52
REACTOME_TRANSPORT_OF_INORGANIC_CATIONS_ANIONS_AND_AMINO_ACIDS_OLIGOPEPTIDES	0.458797327394209	0.836584853893711	0.295277533029884	1.02277517415797	411	50	SLC12A7, SLC12A4, SLC20A1, SLC9A5, SLC7A1, SLC26A11, SLC25A29, SLC1A5, CTNS, SLC7A6, SLC36A1, SRI, SLC8B1, SLC43A2, SLC26A2, SLC9A9, SLC9A1, SLC15A3, SLC7A8, SLC43A1, SLC8A3
REACTOME_NON_INTEGRIN_MEMBRANE_ECM_INTERACTIONS	0.437639198218263	0.820895294745672	0.300825923534842	1.02274766320079	392	43	TGFB1, LAMA5, ACTN1, TNC, THBS1, COL4A2, LAMA4, COL4A5, FGF2, COL4A6, SDC2, LAMB1, COL4A1, DMD, AGRN, LAMC1, LAMA2, HSPG2, COL1A1, SDC3, SDC4, COL5A1, LAMC2, COL1A2, PDGFB, FN1, COL4A3, TRAPPC4, DDR2
REACTOME_PLATELET_AGGREGATION_PLUG_FORMATION	0.438175270108043	0.820895294745672	0.354304921533704	1.02259274237665	364	19	SRC, RAPGEF3, RAP1B, VWF, ADRA2B, SHC1, COL1A1, PTK2, COL1A2, FN1, ADRA2C, TLN1, AKT1
REACTOME_RHOQ_GTPASE_CYCLE	0.449227373068433	0.830755761176786	0.294396975126509	1.02201595492017	406	49	CPNE8, STOM, SRGAP2, ARHGAP33, CDC42EP1, SYDE1, IQGAP1, GJA1, ARHGAP32, ARHGEF7, DLC1, SLC1A5
REACTOME_ABERRANT_REGULATION_OF_MITOTIC_G1_S_TRANSITION_IN_CANCER_DUE_TO_RB1_DEFECTS	0.455006337135615	0.833157894736842	0.39474831587589	1.02114684743991	358	12	CDKN1A, CDK2, CCND2, CCND3, CDK6
REACTOME_FGFR1B_LIGAND_BINDING_AND_ACTIVATION	0.47741935483871	0.849162740123233	0.601555796963846	1.01956742712011	295	3	FGF2, FGFR1, FGF1
REACTOME_METABOLISM_OF_ANGIOTENSINOGEN_TO_ANGIOTENSINS	0.46887417218543	0.842567183284722	0.428096614368321	1.01937465475604	353	9	ATP6AP2, ENPEP, CTSD, CES1, AGT, ANPEP
REACTOME_P75_NTR_RECEPTOR_MEDIATED_SIGNALLING	0.464592274678112	0.839554304583848	0.281090512630825	1.01881979432001	432	68	PLEKHG2, ARHGEF10, NGFR, CASP2, ARHGDIA, BCL2L11, ARHGEF15, VAV2, ARHGEF17, RHOA, RPS27A, ARHGEF7, ARHGEF1, MYD88, TIAM2, ITGB3BP, RELA, MAGED1, MCF2L, AATF, BEX3, ARHGEF18, UBA52, ARHGEF9, ARHGEF12, PREX1, TRAF6
REACTOME_STABILIZATION_OF_P53	0.454646017699115	0.833157894736842	0.294981546120457	1.01877571187371	410	48	PSMB8, MDM2, PSMB9, TP53, ATM, RPS27A, MDM4, PSME1
REACTOME_RECOGNITION_AND_ASSOCIATION_OF_DNA_GLYCOSYLASE_WITH_SITE_CONTAINING_AN_AFFECTED_PURINE	0.46078431372549	0.838415596123507	0.467533318370347	1.01756103660338	328	7	ACD, TERF2, TERF2IP, TERF1, OGG1, TINF2
REACTOME_SYNTHESIS_OF_DNA	0.455789473684211	0.833157894736842	0.267546958687247	1.01575872530629	432	94	MCM3, PSMB8, POLE, RFC2, PSMB9, POLD1, CDK2, MCM5, ANAPC7, ANAPC2, LIG1, RPS27A, RFC4, POLD2, PSME1, MCM2, PSME2, POLD3, MCM7, MCM6, ORC2
REACTOME_ACYL_CHAIN_REMODELLING_OF_PG	0.473177441540578	0.845080634880163	0.445573041142841	1.01533091866162	343	8	PLA2G4B, PLA2R1, PLA2G2A, LPCAT4
REACTOME_PEXOPHAGY	0.459249676584735	0.836584853893711	0.405306045758841	1.01512231956636	354	11	ATM, RPS27A, UBA52, EPAS1, MAP1LC3B, NBR1, SQSTM1
REACTOME_DISEASES_OF_CARBOHYDRATE_METABOLISM	0.450867052023121	0.831844456121913	0.325004890038112	1.01448405796075	389	27	IDUA, GUSB, SGSH, GAA, RPS27A
REACTOME_HIGHLY_SODIUM_PERMEABLE_POSTSYNAPTIC_ACETYLCHOLINE_NICOTINIC_RECEPTORS	0.466003316749585	0.841143957143208	0.670234504232753	1.01417989106166	280	2	CHRNG, CHRND
REACTOME_SIGNALING_BY_NOTCH1_PEST_DOMAIN_MUTANTS_IN_CANCER	0.475717439293598	0.84708740877589	0.291916576269828	1.01340510827338	430	49	RBPJ, HDAC7, KAT2A, MYC, RPS27A, JAG1, HDAC6, CCNC, NOTCH1, MAML2, DLL1, DLL4, MIB1, JAG2, ADAM10, TBL1XR1, UBA52
REACTOME_TLR3_MEDIATED_TICAM1_DEPENDENT_PROGRAMMED_CELL_DEATH	0.484346224677716	0.8553515398855	0.77086981903094	1.01307455214805	262	1	RIPK1
REACTOME_DEADENYLATION_DEPENDENT_MRNA_DECAY	0.463251670378619	0.8390473617956	0.295680068753237	1.0108913954936	415	45	PAN2, PAN3, CNOT3, EXOSC5, EXOSC9, PABPC1, EIF4A3, CNOT6L, SKIV2L, EXOSC4, CNOT9, LSM7, DCP1B, EXOSC8, EXOSC6, XRN1, EXOSC1, EIF4A2, DIS3, LSM6
REACTOME_HOST_INTERACTIONS_OF_HIV_FACTORS	0.478170478170478	0.849544182877516	0.264365939739772	1.01068915188005	459	108	PSMB8, SLC25A6, NPM1, PSMB9, NUP107, SLC25A5, NUP85, B2M, NUP155, POM121C, AP2A2, NUP160, RPS27A, PPIA, FYN, NUP93, PSME1, AAAS, POM121, PSME2, RANGAP1, NUP50, RAE1, CCNT1, NUP205, NUP35, AP2B1, ELMO1, UBA52, NUP43, NUP54, PSMB1, RANBP1, XPO1, NUP133, TPR, NUP153, AP2A1, RCC1, RAN, ARF1, CDK9, AP2M1, NUP98, PACS1, NUP88, NUP62, NUP214, SEH1L
REACTOME_PROCESSING_OF_DNA_DOUBLE_STRAND_BREAK_ENDS	0.463251670378619	0.8390473617956	0.295418924313542	1.00999857688671	415	45	WRN, MDC1, RFC2, MRE11, ATM, CDK2, RPS27A, RFC4, TIMELESS, SIRT6
REACTOME_TP53_REGULATES_TRANSCRIPTION_OF_GENES_INVOLVED_IN_G2_CELL_CYCLE_ARREST	0.468948035487959	0.842567183284722	0.390311948821852	1.00967071936254	369	12	TP53, GADD45A, BAX
REACTOME_BIOSYNTHESIS_OF_EPA_DERIVED_SPMS	0.496774193548387	0.856448526255544	0.594945889968299	1.00836440006432	307	3	ALOX5, GPX4, HPGD
REACTOME_GOLGI_ASSOCIATED_VESICLE_BIOGENESIS	0.471046770601336	0.843514748712574	0.294811234127273	1.00792096379965	422	45	PIK3C2A, NECAP1, FTL, NAPA, GAK, HIP1R, TPD52L1, PICALM, TXNDC5, AP3S1, RAB5C, BLOC1S4, SNX5, VAMP2, ARRB1, CPD, VAMP8, OCRL, BLOC1S3, PUM1, ARF1
REACTOME_SIGNALING_BY_NODAL	0.48476821192053	0.8553515398855	0.422926766848639	1.00706432257018	365	9	ACVR1B, FOXO3, ACVR2B, SMAD3, ACVR2A
REACTOME_THE_ROLE_OF_NEF_IN_HIV_1_REPLICATION_AND_DISEASE_PATHOGENESIS	0.455334987593052	0.833157894736842	0.363499844195048	1.00682150285625	366	16	B2M, AP2A2, FYN, AP2B1, ELMO1, AP2A1, ARF1, AP2M1, PACS1
REACTOME_REGULATION_OF_SIGNALING_BY_NODAL	0.498387096774194	0.856448526255544	0.593324250681199	1.00561590922771	308	3	ACVR1B, ACVR2B, ACVR2A
REACTOME_FANCONI_ANEMIA_PATHWAY	0.454545454545455	0.833157894736842	0.341742160718051	1.00536034171641	379	21	EME2, RPS27A, FANCC, FAAP100, FAAP20, WDR48, DCLRE1A, UBA52, FANCE, ATRIP, SLX4
REACTOME_TICAM1_DEPENDENT_ACTIVATION_OF_IRF3_IRF7	0.488308115543329	0.8553515398855	0.441115925983144	1.00517445403785	354	8	IRF3, RPS27A, IRF7, UBA52
REACTOME_TFAP2A_ACTS_AS_A_TRANSCRIPTIONAL_REPRESSOR_DURING_RETINOIC_ACID_INDUCED_CELL_DIFFERENTIATION	0.498387096774194	0.856448526255544	0.593032308291164	1.00512110067798	308	3	NPM1, NOP2, HSPD1
REACTOME_SYNTHESIS_OF_EPOXY_EET_AND_DIHYDROXYEICOSATRIENOIC_ACIDS_DHET	0.498387096774194	0.856448526255544	0.592883258416786	1.00486847839806	308	3	CYP1B1, CYP2J2, EPHX2
REACTOME_TRAFFICKING_OF_MYRISTOYLATED_PROTEINS_TO_THE_CILIUM	0.498387096774194	0.856448526255544	0.5926561017952	1.00448347422489	308	3	NPHP3, ARL3, UNC119B
REACTOME_P75NTR_SIGNALS_VIA_NF_KB	0.456384323640961	0.833283026901547	0.375361172328354	1.00423865482479	360	14	NGFR, RPS27A, MYD88, RELA, UBA52, TRAF6, NFKBIA, NFKB1, SQSTM1
REACTOME_SIGNALING_BY_ERBB2	0.469457013574661	0.842567183284722	0.302594742676626	1.00419530863106	414	38	SRC, PTPN18, RHOA, RPS27A, FYN, PTPN12, NRAS, ERBB3, UBA52, ERBB4, CDC37, DIAPH1, KRAS, SHC1, ERBIN, AKT3
REACTOME_REGULATION_OF_PTEN_GENE_TRANSCRIPTION	0.486754966887417	0.8553515398855	0.290912410288483	1.00301277216015	440	47	TP53, HDAC7, PTEN, RRAGB, EZH2, PHC3, CBX4, JUN, PPARG, RING1, EGR1, GATAD2A, ATN1, PHC2, ATF2, GATAD2B, HDAC5, MTA2, CHD3, RBBP4, SUZ12
REACTOME_RUNX1_AND_FOXP3_CONTROL_THE_DEVELOPMENT_OF_REGULATORY_T_LYMPHOCYTES_TREGS	0.498387096774194	0.856448526255544	0.59160866349329	1.00270818757661	308	3	RUNX1, CBFB, NFATC2
REACTOME_LATE_ENDOSOMAL_MICROAUTOPHAGY	0.474056603773585	0.845080634880163	0.328605116623994	1.00227294590683	401	25	IFT88, CHMP4A, VIM, RPS27A, HDAC6, VPS28, CHMP2A, HBB, UBA52
REACTOME_HDL_CLEARANCE	0.487562189054726	0.8553515398855	0.661933386737149	1.00161887490356	293	2	SCARB1, HDLBP
REACTOME_MODULATION_BY_MTB_OF_HOST_IMMUNE_SYSTEM	0.494992846924177	0.856448526255544	0.481849323792712	1.0015943864106	345	6	B2M, RPS27A, UBA52, MRC1
REACTOME_CHYLOMICRON_CLEARANCE	0.487562189054726	0.8553515398855	0.660558083775441	0.999537805368839	293	2	LDLR, LDLRAP1
REACTOME_GLUTAMATE_NEUROTRANSMITTER_RELEASE_CYCLE	0.480946123521682	0.852284014221133	0.408493811076219	0.999157883732595	365	10	CPLX1, GLS
REACTOME_REGULATION_OF_RUNX3_EXPRESSION_AND_ACTIVITY	0.497787610619469	0.856448526255544	0.289282759303504	0.999093851524762	449	48	SRC, PSMB8, TGFB1, MDM2, PSMB9, RPS27A, PSME1
REACTOME_S_PHASE	0.491228070175439	0.856448526255544	0.256717555024135	0.998326946048466	475	126	MCM3, PSMB8, CDKN1A, POLE, LIN37, RFC2, PSMB9, POLD1, CDK2, MCM5, ANAPC7, ANAPC2, LIG1, MYC, RPS27A, RFC4, CDC25B, POLD2, PSME1, MCM2
REACTOME_VLDL_ASSEMBLY	0.487562189054726	0.8553515398855	0.659628296195388	0.998130877106127	293	2	P4HB, APOC1
REACTOME_CELLULAR_HEXOSE_TRANSPORT	0.502063273727648	0.856448526255544	0.437398401739039	0.996703301258422	364	8	SLC2A3, SLC50A1, SLC2A1
REACTOME_INTERLEUKIN_1_FAMILY_SIGNALING	0.507820646506778	0.857015014307281	0.261059399392319	0.994639368331914	486	102	NFKB2, IL18BP, PSMB8, MAP3K8, SAA1, PTPN18, NOD1, GSDMD, PSMB9, IRAK3, RPS27A, IL1R1, PELI1, PTPN12, PELI2, PSME1, IL1RL1, MYD88, IRAK4, ALOX5, PSME2, PTPN23, APP, RELA
REACTOME_MRNA_CAPPING	0.490566037735849	0.856448526255544	0.326084680545684	0.994585406165718	415	25	NCBP1, SUPT5H, POLR2H, RNMT, GTF2H4, GTF2F1, POLR2A, NCBP2, ERCC2, POLR2I, GTF2H1, POLR2G, GTF2H3, RNGTT, CCNH, POLR2C
REACTOME_TRYPTOPHAN_CATABOLISM	0.52415812591508	0.867366095087533	0.499941388046508	0.993864385926476	357	5	AFMID, SLC3A2, KYAT3
REACTOME_SUMOYLATION_OF_TRANSCRIPTION_FACTORS	0.489003880983182	0.8553515398855	0.396784321982771	0.993778961635268	377	11	MDM2, TP53, UBE2I, PIAS3, SUMO2, PIAS4
REACTOME_IKBA_VARIANT_LEADS_TO_EDA_ID	0.509298998569385	0.85859458438268	0.477629717263959	0.992823316278566	355	6	NFKB2, RELA, NFKBIA, NFKB1
REACTOME_PHASE_II_CONJUGATION_OF_COMPOUNDS	0.5	0.856448526255544	0.291371226764578	0.991711630230085	445	44	MGST1, NNMT, TRMT112, UGDH, MAT2A, MTR, ABHD14B, GSS, SLC35D1, GSTO1, SLC26A2, AS3MT, AHCY, SLC35B3, PAPSS1, CNDP2, PAPSS2, GSTM2, GSTM5
REACTOME_SIGNALING_BY_ALK_IN_CANCER	0.506622516556291	0.857015014307281	0.287503723150941	0.991260242483392	458	47	MYH9, EML4, NPM1, EIF2AK3, RPS6, MSN, CEBPB, RRBP1, STAT5A, PRKAR1A, JUNB, STAT3, RNF213, HIP1, TPR, SHC1, KLC1, FRS3, SEC31A
REACTOME_RHO_GTPASES_ACTIVATE_RHOTEKIN_AND_RHOPHILINS	0.506134969325153	0.857015014307281	0.53712895377129	0.991040314854923	329	4	RHOA, TAX1BP3, RHOB, RTKN
REACTOME_DEFECTIVE_B4GALT1_CAUSES_B4GALT1_CDG_CDG_2D	0.507668711656442	0.857015014307281	0.537006223178165	0.990813868366051	330	4	LUM, PRELP, B4GALT1, FMOD
REACTOME_MECP2_REGULATES_TRANSCRIPTION_OF_NEURONAL_LIGANDS	0.530014641288433	0.867366095087533	0.497664006229317	0.989337037850521	361	5	DLL1, CREB1, SIN3A, MECP2, HDAC1
REACTOME_CHROMATIN_MODIFYING_ENZYMES	0.520854526958291	0.865415743104099	0.247653631638699	0.988260323388009	511	171	NFKB2, ACTB, PRMT7, PHF8, KDM4C, BRD1, RUVBL2, EZH2, YEATS2, KAT2A, OGT, KDM5A, KMT5C, KMT2B, JADE1, ACTL6A, KMT2E, EP400, RPS2, SMYD3, JADE2, RELA, KDM5B, NSD3, TAF10, BRWD1, MBIP, SMARCA4, KDM6A, TAF12, KAT5, BRD8, ATXN7, KAT8, GATAD2A, JADE3, KAT6A, TBL1XR1, RUVBL1, EHMT2, PRMT5, SAP18, SETD1B, KMT2A, KDM6B, SUPT7L, TAF9, SETDB1, ARID2, HAT1, ING3, USP22, ATF2, DOT1L, TRRAP, SMARCD3, GATAD2B, ARID4B, TADA2A, ATF7IP, HMG20B, NFKB1, BRPF1, SUV39H1, MTA2, UTY, ARID5B, CHD3, ELP4, SUPT20H, EHMT1, RBBP4, MORF4L2, SUZ12, CDK4, PHF2, AEBP2, RIOX2
REACTOME_CELL_CYCLE	0.557442557442557	0.879792191856	0.238024932561223	0.987466445111174	557	432	MSH5, HAUS5, CHTF18, SRC, MCM3, PSMB8, EML4, CDKN1A, WRN, POLE, MDC1, PPP2R1B, CSNK1E, PHF8, OFD1, MDM2, LIN37, TUBGCP2, NPM1, RTEL1, CEP131, ACD, MAU2, RFC2, MRE11, PSMB9, POLD1, NUP107, TP53, TMPO, ATM, RUVBL2, CNTRL, CDK2, MCM5, CHMP4A, NUP85, ANAPC7, STN1, IST1, TUBGCP6, ANAPC2, NUP155, LIG1, POM121C, MYC, NUP160, RPS27A, LPIN3, MDM4, HAUS4, RFC4, CDC25B, YWHAH, CCND2, KNTC1, CEP192, NUP93, POLD2, PSME1, SYNE2, CENPC, CEP290, RCC2, MCM2, AAAS, DYNLL1, DIDO1, POM121, SFI1, NDEL1, PSME2, ITGB3BP, TERF2, RANGAP1, STAG3, NUP50, TERF2IP, ODF2, ALMS1, LPIN2, POLD3, CEP78, CEP164, POLR2H, MCM7, NUDC, CHMP2A, UIMC1, MAD1L1, NUMA1, MCM6, ORC2, EMD, YWHAZ, HSP90AB1, SMC1A, RAE1, NHP2, KAT5, YWHAQ, CENPP, BUB3, PPP2R1A, POLA2, NUP205, NIPBL, NUP35, CENPJ, RUVBL1, PPP2R2D, TUBA1A, CCND3, RPS27, UBA52, PHLDA1, NUP43, RAD9A, ABL1, NEK9, POLR2A, ORC3, TERF1, NUP54, BARD1, PSMB1, XPO1, CDK5RAP2, MZT2B, SDCCAG8, TUBGCP3
REACTOME_RNA_POLYMERASE_III_TRANSCRIPTION_INITIATION_FROM_TYPE_3_PROMOTER	0.503537735849057	0.857015014307281	0.325698541975539	0.985020128132039	426	24	POU2F1, SNAPC4, POLR1C, POLR2H, BDP1, SNAPC2, POLR3H, POLR3C, TBP, CRCP, POLR3B, POLR3D, SNAPC5, ZNF143
REACTOME_SIGNALING_BY_BMP	0.494019138755981	0.856448526255544	0.334764532011428	0.984833078805331	412	21	FSTL1, CHRDL1, SMAD1, ZFYVE16, ACVR2B, SKI, SMAD5, BMP2, ACVRL1, ACVR2A, NOG, SMURF2, SMAD9, UBE2D3
REACTOME_SYNTHESIS_OF_VERY_LONG_CHAIN_FATTY_ACYL_COAS	0.473551637279597	0.845080634880163	0.362134314411982	0.984687244096652	375	15	ACSL5, SLC27A3, ELOVL5, HACD3, ACSL3, HACD2, ACSF3, ACSL4
REACTOME_TGF_BETA_RECEPTOR_SIGNALING_ACTIVATES_SMADS	0.485882352941176	0.8553515398855	0.32076416733871	0.984669902980981	412	26	TGFB1, RPS27A, PPP1R15A, TGFBR2, CBL, FKBP1A, UBA52, XPO1
REACTOME_CELL_CYCLE_CHECKPOINTS	0.526422764227642	0.867366095087533	0.246399004915434	0.984215974822083	517	175	MCM3, PSMB8, CDKN1A, WRN, MDC1, PPP2R1B, MDM2, RFC2, MRE11, PSMB9, NUP107, TP53, ATM, CDK2, MCM5, NUP85, ANAPC7, ANAPC2, NUP160, RPS27A, MDM4, RFC4, YWHAH, KNTC1, PSME1, CENPC, RCC2, MCM2, DYNLL1, NDEL1, PSME2, ITGB3BP, RANGAP1, MCM7, NUDC, UIMC1, MAD1L1, MCM6, ORC2, YWHAZ, KAT5, YWHAQ, CENPP, BUB3, PPP2R1A, RPS27, UBA52, NUP43, RAD9A, ORC3, BARD1, PSMB1, XPO1
REACTOME_TRANSPORT_OF_VITAMINS_NUCLEOSIDES_AND_RELATED_MOLECULES	0.495808383233533	0.856448526255544	0.329961729872112	0.983813357166305	413	23	SLC25A6, SLC33A1, SLC25A5, APOD, SLCO2A1, SLC35D1, SLC16A2, ARL2, SLC35A2, SLC35B3, SLCO3A1
REACTOME_GLUCURONIDATION	0.535871156661786	0.867366095087533	0.494797182187002	0.983637901142702	365	5	UGDH, SLC35D1
REACTOME_OVARIAN_TUMOR_DOMAIN_PROTEASES	0.499423298731257	0.856448526255544	0.311782183043732	0.983634172062611	432	29	NOD1, TP53, PTEN, TRIM4, RHOA, RPS27A, TRIM25
