pathway	pval	padj	ES	NES	nMoreExtreme	size	leadingEdge
REACTOME_RESPONSE_OF_EIF2AK4_GCN2_TO_AMINO_ACID_DEFICIENCY	0.00106157112526539	0.088997582504076	0.542872933903306	2.04298980301354	0	90	RPL3, RPL12, RPS8, RPL36A, RPL31, RPL10A, RPS6, RPL15, RPS9, RPS19, RPS27A, RPL35A, RPL35, RPL36, RPS17, RPL24, RPL11, RPL34, RPL28, CEBPB, RPL13, RPL19, RPL37, RPL17, RPS5, RPL7A, RPL13A, RPL18A, RPS18, RPL26, FAU, RPL7, RPS11, RPS2, RPL9, RPL14, RPS4X, RPS16, RPS24, RPL23A, RPL4, RPL41, RPL23, RPL29, RPL32, DDIT3, RPS12, RPS21, RPS25, RPS15, RPS7, RPS3, RPL6, EIF2S3, GCN1, RPL5, RPS3A, RPS27, UBA52, RPLP2, RPL22, RPS23, RPLP0, RPS10, RPS13, ATF2, RPL27, RPL37A, RPS20
REACTOME_EUKARYOTIC_TRANSLATION_ELONGATION	0.00106269925611052	0.088997582504076	0.544138822715948	2.03209671347027	0	83	EEF1A1, RPL3, RPL12, RPS8, RPL36A, RPL31, RPL10A, RPS6, RPL15, RPS9, RPS19, RPS27A, RPL35A, RPL35, RPL36, RPS17, RPL24, RPL11, RPL34, RPL28, RPL13, RPL19, RPL37, RPL17, RPS5, RPL7A, RPL13A, RPL18A, RPS18, RPL26, FAU, RPL7, RPS11, RPS2, RPL9, RPL14, RPS4X, RPS16, RPS24, RPL23A, RPL4, RPL41, RPL23, RPL29, EEF2, RPL32, RPS12, RPS21, RPS25, RPS15, RPS7, RPS3, RPL6, RPL5, RPS3A, RPS27, UBA52, RPLP2, RPL22, RPS23, RPLP0, RPS10, RPS13, RPL27, RPL37A, RPS20
REACTOME_SELENOAMINO_ACID_METABOLISM	0.00105263157894737	0.088997582504076	0.533798109579784	2.02659783545323	0	94	RPL3, RPL12, RPS8, NNMT, RPL36A, RPL31, RPL10A, RPS6, RPL15, RPS9, RPS19, RPS27A, RPL35A, RPL35, RPL36, RPS17, RPL24, RPL11, RPL34, RPL28, RPL13, RPL19, RPL37, RPL17, RPS5, RPL7A, RPL13A, RPL18A, RPS18, RPL26, FAU, RPL7, RPS11, RPS2, RPL9, SEPSECS, RPL14, RPS4X, RPS16, RPS24, RPL23A, RPL4, HNMT, RPL41, RPL23, RPL29, RPL32, RPS12, RPS21, RPS25, RPS15, RPS7, RPS3, RPL6, RPL5, RPS3A, RPS27, UBA52, RPLP2, RPL22, AHCY, RPS23, RPLP0, RPS10, RPS13, RPL27, RPL37A, RPS20, PAPSS1, EEF1E1, PAPSS2, RPS14
REACTOME_NONSENSE_MEDIATED_DECAY_NMD	0.00104275286757039	0.088997582504076	0.524290677012402	1.99755361814132	0	102	RPL3, RPL12, SMG1, RPS8, RPL36A, RPL31, RPL10A, RPS6, RPL15, RPS9, RPS19, RPS27A, RPL35A, RPL35, RPL36, RPS17, RPL24, RPL11, RPL34, RPL28, RPL13, RPL19, RPL37, PABPC1, EIF4A3, RPL17, UPF1, RPS5, NCBP1, RPL7A, RPL13A, RPL18A, RPS18, RPL26, FAU, RPL7, RPS11, RPS2, RPL9, RNPS1, RPL14, RPS4X, RPS16, RPS24, RPL23A, RPL4, RPL41, CASC3, RPL23, RPL29, UPF3A, RPL32, RPS12, RPS21, RPS25, RPS15, RPS7, PPP2R1A, RPS3, RPL6, RBM8A, RPL5, RPS3A, RPS27, UBA52, RPLP2, RPL22, NCBP2, RPS23, RPLP0, RPS10, MAGOH, RPS13, RPL27, RPL37A, RPS20
REACTOME_SRP_DEPENDENT_COTRANSLATIONAL_PROTEIN_TARGETING_TO_MEMBRANE	0.0010515247108307	0.088997582504076	0.517091785519784	1.96375418401975	0	100	RPL3, RPL12, RPS8, RPL36A, RPL31, RPL10A, RPS6, RPL15, RPS9, RPS19, RPS27A, RPL35A, RPL35, RPL36, RPS17, RPL24, RPL11, RPL34, RPL28, RPL13, RPL19, RPL37, RPL17, RPS5, RPL7A, RPL13A, RPL18A, RPS18, RPL26, FAU, RPL7, RPS11, RPS2, RPL9, SSR4, RPL14, RPS4X, RPS16, RPS24, RPL23A, RPL4, SEC11C, RPL41, RPL23, RPL29, RPL32, RPS12, RPS21, SEC61B, RPS25, SSR1, RPS15, RPS7, RPS3, RPL6, RPL5, DDOST, RPS3A, RPS27, UBA52, RPLP2, RPL22, RPS23, RPLP0, RPS10
REACTOME_TRANSPORT_OF_MATURE_TRANSCRIPT_TO_CYTOPLASM	0.00107296137339056	0.088997582504076	0.535772174728698	1.95920718766377	0	72	SRSF5, SRRM1, DDX39B, SRSF1, SYMPK, SRSF11, NUP107, SRSF3, SRSF7, SRSF6, NUP85, NUP155, POM121C, NUP160, SRSF2, POLDIP3, NUP93, AAAS, EIF4A3, NXT1, NCBP1, POM121, CPSF1, DDX39A, NUP50, U2AF1L4, RNPS1, U2AF2, SARNP, CASC3, SRSF9, RAE1, DHX38, NUP205, CPSF4, NUP35, RBM8A, WDR33, NUP43, NUP54, SRSF4, NCBP2, NUP133, TPR, THOC2, NUP153, MAGOH
REACTOME_EUKARYOTIC_TRANSLATION_INITIATION	0.00104275286757039	0.088997582504076	0.500806193148116	1.91369147211763	0	109	RPL3, RPL12, RPS8, RPL36A, RPL31, RPL10A, RPS6, EIF3G, RPL15, RPS9, RPS19, RPS27A, EIF3D, RPL35A, RPL35, RPL36, RPS17, RPL24, RPL11, RPL34, RPL28, RPL13, RPL19, RPL37, PABPC1, EIF3E, EIF4H, RPL17, RPS5, RPL7A, RPL13A, RPL18A, RPS18, RPL26, FAU, RPL7, RPS11, RPS2, RPL9, RPL14, RPS4X, RPS16, RPS24, RPL23A, RPL4, EIF3H, RPL41, RPL23, RPL29, RPL32, RPS12, RPS21, RPS25, RPS15, EIF3C, RPS7, RPS3, RPL6, EIF2S3, RPL5, RPS3A, EIF2B4, RPS27, UBA52, RPLP2, EIF3B, EIF2B1, RPL22, EIF4A2, RPS23, RPLP0, RPS10
REACTOME_RRNA_PROCESSING	0.00101626016260163	0.088997582504076	0.477395905407232	1.90690979688701	0	175	RPL3, ERI1, WDR75, RPL12, RBM28, CSNK1E, RPS8, RPL36A, RPL31, RPL10A, RPS6, NOP56, RPL15, NAT10, RPS9, NOP58, RPS19, RPS27A, RPL35A, EXOSC5, RPL35, RPL36, RPS17, TRMT112, RPL24, RPL11, RPL34, RPL28, EXOSC9, RPL13, RPL19, RPL37, RRP7A, PDCD11, TBL3, RPL17, NOB1, RPS5, RPL7A, EXOSC10, RPL13A, RPL18A, RPS18, NOL12, RPL26, FAU, RPL7, RPS11, RPS2, EXOSC4, RPL9, RRP1, RPL14, RPS4X, RPS16, RPS24, RPL23A, BYSL, RPL4, BOP1, GNL3, RPL41, RPL23, RPL29, EXOSC8, RPL32, NOP2, NHP2, TEX10, RPS12, HEATR1, RPS21, NIP7, EXOSC6, RPS25, ELAC2, RPS15, RPS7, RPS3, RPL6, EMG1, NCL, RIOK1, RPL5, RPS3A, RPS27, UBA52, EXOSC1, UTP20, NOL9, WDR43, RPLP2, WDR36, PELP1, RPL22, RCL1, PES1, RPS23, DDX21, RPLP0, NOL6, RPS10, CSNK1D, WDR3, DIS3, RPP40, RPS13, NOP14, UTP18, RPL27, RPL37A, RPS20, DCAF13, DDX49, RPS14, UTP4, RPSA, GAR1, RPL27A, ISG20L2, DIMT1, TFB1M, RPL21, HSD17B10, RPL30, DKC1, RPL36AL
REACTOME_INFLUENZA_INFECTION	0.00102774922918808	0.088997582504076	0.481656936034425	1.88748921306187	0	138	RPL3, TGFB1, RPL12, SLC25A6, NUP107, RPS8, RPL36A, RPL31, NUP85, RPL10A, RPS6, RPL15, NUP155, RPS9, POM121C, RPS19, NUP160, RPS27A, RPL35A, RPL35, RPL36, RPS17, RPL24, RPL11, NUP93, RPL34, RPL28, RPL13, RPL19, RPL37, AAAS, RPL17, PABPN1, RPS5, POM121, RPL7A, RPL13A, RPL18A, RPS18, RPL26, FAU, RPL7, RPS11, RPS2, NUP50, RPL9, RPL14, RPS4X, RPS16, RPS24, RPL23A, RPL4, POLR2H, RPL41, RPL23, RPL29, RPL32, RAE1, RPS12, RPS21, RPS25, RPS15, RPS7, NUP205, RPS3, RPL6, CPSF4, NUP35, RPL5, GTF2F1, RPS3A, RPS27, UBA52, NUP43, POLR2A, NUP54, RPLP2, XPO1, EIF2AK2, RPL22, CALR, NUP133, TPR, RPS23, RPLP0, RPS10, NUP153
REACTOME_RNA_POLYMERASE_II_TRANSCRIPTION_TERMINATION	0.00109051254089422	0.088997582504076	0.527000210614557	1.86872153971715	0	57	SRSF5, SRRM1, DDX39B, SRSF1, SYMPK, SRSF11, CPSF7, SRSF3, SRSF7, SRSF6, CSTF3, SRSF2, POLDIP3, LSM11, EIF4A3, PABPN1, PCF11, NCBP1, CPSF1, DDX39A, U2AF1L4, RNPS1, U2AF2, SARNP, CASC3, SRSF9, NUDT21, SNRPB, DHX38, CPSF4, RBM8A, WDR33, ZNF473, SRSF4, NCBP2, THOC2, MAGOH
REACTOME_TP53_REGULATES_TRANSCRIPTION_OF_CELL_DEATH_GENES	0.00232288037166086	0.118616762204488	0.592553767136199	1.85183237889295	1	28	TNFRSF10B, FAS, BBC3, CASP2, TP53INP1, PIDD1, NDRG1, TP53, ATM, BNIP3L, TP63, BAX, PERP, PRELID1, BCL6
REACTOME_CELL_CELL_JUNCTION_ORGANIZATION	0.00118063754427391	0.088997582504076	0.632418108282603	1.85064027821802	0	20	ACTG1, CLDN15, CDH11, F11R, ACTB, CTNND1, CLDN5, AFDN, NECTIN2
REACTOME_REGULATED_NECROSIS	0.00225733634311512	0.118616762204488	0.552509025605292	1.84439239041457	1	39	TNFRSF10B, FAS, FLOT2, CASP4, GSDMD, MLKL, TP53, TRAF2, CHMP4A, RPS27A, TP63, PELI1, IRF1, OGT, CFLAR, BAX, SDCBP, BIRC3, CHMP2A, RIPK1
REACTOME_TP53_REGULATES_TRANSCRIPTION_OF_GENES_INVOLVED_IN_CYTOCHROME_C_RELEASE	0.00127388535031847	0.09166184134337	0.694346892783217	1.82088195354477	0	13	BBC3, TP53INP1, TP53, ATM, BNIP3L, TP63, BAX, PRELID1
REACTOME_COMPLEMENT_CASCADE	0.00118063754427391	0.088997582504076	0.616428903710291	1.80385119104507	0	20	CFB, C1R, SERPING1, CD81, PROS1, CFI, C1S, C8G, C7, C3
REACTOME_ACTIVATION_OF_THE_MRNA_UPON_BINDING_OF_THE_CAP_BINDING_COMPLEX_AND_EIFS_AND_SUBSEQUENT_BINDING_TO_43S	0.00218579234972678	0.118616762204488	0.505786269429434	1.78883664241441	1	56	RPS8, RPS6, EIF3G, RPS9, RPS19, RPS27A, EIF3D, RPS17, PABPC1, EIF3E, EIF4H, RPS5, RPS18, FAU, RPS11, RPS2, RPS4X, RPS16, RPS24, EIF3H, RPS12, RPS21, RPS25, RPS15, EIF3C, RPS7, RPS3, EIF2S3, RPS3A, RPS27, EIF3B, EIF4A2, RPS23, RPS10, RPS13, RPS20, RPS14, EIF3I, EIF3M, RPSA
REACTOME_COLLAGEN_BIOSYNTHESIS_AND_MODIFYING_ENZYMES	0.00225733634311512	0.118616762204488	0.534098225261811	1.78293323141213	1	39	COL7A1, PPIB, P3H3, COLGALT1, COL12A1, COL6A3, COL18A1, PCOLCE, SERPINH1, BMP1, COL6A2, COL27A1, COL4A2, ADAMTS2, PLOD3, COL4A5, COL4A6, PLOD2, CRTAP, COL6A1, P4HB, COL4A1
REACTOME_EXTRACELLULAR_MATRIX_ORGANIZATION	0.0010183299389002	0.088997582504076	0.447321512916242	1.78220324334117	0	168	VCAN, MUSK, F11R, MMP2, TGFB1, CAPN2, COL7A1, VCAM1, PPIB, HTRA1, LAMA5, CD47, ADAMTS1, ACTN1, SERPINE1, CAPN15, P3H3, LRP4, ADAMTS9, JAM3, ADAM15, FBLN5, ITGA5, ICAM2, PHYKPL, COLGALT1, COL12A1, COL6A3, CD44, TNC, ITGAM, MMP14, ADAMTS4, LOXL4, ITGA9, SH3PXD2A, COL18A1, EMILIN1, CTSK, PXDN, THBS1, PCOLCE, SERPINH1, A2M, TIMP2, BGN, BMP1, ICAM1, COL6A2, LOX, COL27A1, MFAP4, COL4A2, LAMA4, EFEMP1, PECAM1, ADAMTS2, ITGA3, APP, PLOD3, CAPNS1, COL4A5, ADAMTS5, LTBP2, FGF2, PTPRS, CAPN10, COL4A6, CTSL, ADAM10, PLOD2, VWF, LTBP3, CRTAP, SDC2, COL6A1, LAMB1, NID2
REACTOME_RIPK1_MEDIATED_REGULATED_NECROSIS	0.00359281437125748	0.14039911308204	0.599677749156547	1.77432414660626	2	22	TNFRSF10B, FAS, FLOT2, MLKL, TRAF2, RPS27A, PELI1, OGT, CFLAR, SDCBP, BIRC3, RIPK1
REACTOME_INTERLEUKIN_4_AND_INTERLEUKIN_13_SIGNALING	0.00216216216216216	0.118616762204488	0.496419059139476	1.76990435417681	1	60	IL4R, MMP2, SAA1, TGFB1, CDKN1A, BCL2L1, VCAM1, STAT6, POU2F1, LAMA5, TP53, PIM1, CEBPD, ANXA1, HIF1A, VIM, S1PR1, MYC, ITGAM, ICAM1, ALOX5, BCL6, SOCS3, FGF2, JUNB, FOXO3, MCL1, HSP90B1, FSCN1, STAT3
REACTOME_PROCESSING_OF_CAPPED_INTRON_CONTAINING_PRE_MRNA	0.00100401606425703	0.088997582504076	0.436625865761464	1.76584129545387	0	208	SRSF10, SRSF5, SRRM1, DDX39B, RBM5, SNRPA, PPIH, HNRNPM, SRSF1, PRPF3, PTBP1, HNRNPA1, SNRNP70, HNRNPA3, SYMPK, SRSF11, XAB2, NUP107, HNRNPU, SF3A2, CPSF7, RNPC3, SRSF3, SRSF7, SRSF6, RBMX, PPIL4, CSTF3, NUP85, AQR, HNRNPH1, NUP155, POM121C, NUP160, HNRNPL, SRSF2, POLDIP3, HNRNPC, NUP93, PRPF38A, U2SURP, SF3B3, SRRT, AAAS, SNRNP40, SF1, EIF4A3, NXT1, PABPN1, PCF11, NCBP1, POM121, PRPF6, SNRNP200, CPSF1, DDX39A, NUP50, U2AF1L4, RNPS1, HNRNPD, DHX9, LSM7, SRRM2, U2AF2, HNRNPR, POLR2H, SARNP, CASC3, SRSF9, RAE1, NUDT21, DDX5, HNRNPH2, HNRNPF, SNRPB, SART1, CHERP, DHX38, NUP205, CPSF4, NUP35, RBM8A, WDR33, SF3B2, GTF2F1, HNRNPUL1, NUP43, SF3B1, POLR2A, NUP54, PPWD1, SRSF4, HNRNPA0, NCBP2, NUP133, TPR, THOC2, LSM8, FUS, NUP153, METTL14, MAGOH, HNRNPK, LSM6
REACTOME_RESOLUTION_OF_D_LOOP_STRUCTURES	0.00358851674641148	0.14039911308204	0.5998789690254	1.7647647689143	2	21	XRCC3, EME2, WRN, SPIDR, RTEL1, MRE11, ATM, RAD51D
REACTOME_CELLULAR_RESPONSE_TO_STARVATION	0.00102669404517454	0.088997582504076	0.445227894817123	1.73941713347776	0	133	RPL3, TCIRG1, RPL12, SZT2, RPS8, RPL36A, RPL31, RPL10A, RRAGB, RPS6, RPL15, RPS9, RPS19, RPS27A, RPL35A, RPL35, RPL36, RPS17, RPL24, RPL11, RPL34, RPL28, CEBPB, RPL13, RPL19, RPL37, RPL17, RPS5, RPL7A, RPL13A, RPL18A, RPS18, RPL26, FAU, RPL7, RPS11, RPS2, RPL9, RPL14, RPS4X, RPS16, RPS24, RPL23A, RPL4, RPL41, RPL23, RPL29, RPL32, DDIT3, RPS12, RPS21, RPS25, RPS15, RPS7, RPS3, RPL6, EIF2S3, GCN1, RPL5, RPS3A, RPS27, UBA52, WDR24, NPRL2, RPLP2, RPL22, KPTN, ATP6V0D1, RPS23, RPLP0, RPS10, RPS13, SESN2, ATF2, RPL27, RPL37A, RPS20
REACTOME_INTERFERON_GAMMA_SIGNALING	0.0022271714922049	0.118616762204488	0.505313069672936	1.71796285080783	1	43	PML, IRF3, CIITA, VCAM1, GBP2, TRIM22, B2M, SP100, TRIM38, CD44, IRF1, IFI30, GBP1, TRIM25, TRIM35, TRIM21, ICAM1, TRIM2, CAMK2B, SOCS3, CAMK2D, MT2A, IRF7
REACTOME_CASPASE_ACTIVATION_VIA_EXTRINSIC_APOPTOTIC_SIGNALLING_PATHWAY	0.00488400488400488	0.152431391429947	0.604098941095633	1.71590837430253	3	18	TNFRSF10B, FAS, TRAF2, CFLAR, DAPK1, TLR4, DAPK3, DAPK2, MAGED1, RIPK1
REACTOME_MRNA_SPLICING	0.00102040816326531	0.088997582504076	0.427727539316128	1.70018399457877	0	164	SRSF10, SRSF5, SRRM1, RBM5, SNRPA, PPIH, HNRNPM, SRSF1, PRPF3, PTBP1, HNRNPA1, SNRNP70, HNRNPA3, SYMPK, SRSF11, XAB2, HNRNPU, SF3A2, CPSF7, RNPC3, SRSF3, SRSF7, SRSF6, RBMX, PPIL4, CSTF3, AQR, HNRNPH1, HNRNPL, SRSF2, HNRNPC, PRPF38A, U2SURP, SF3B3, SRRT, SNRNP40, SF1, EIF4A3, PABPN1, PCF11, NCBP1, PRPF6, SNRNP200, CPSF1, U2AF1L4, RNPS1, HNRNPD, DHX9, LSM7, SRRM2, U2AF2, HNRNPR, POLR2H, CASC3, SRSF9, NUDT21, DDX5, HNRNPH2, HNRNPF, SNRPB, SART1, CHERP, DHX38, CPSF4, RBM8A, WDR33, SF3B2, GTF2F1, HNRNPUL1, SF3B1, POLR2A, PPWD1, SRSF4, HNRNPA0, NCBP2, LSM8, FUS, MAGOH, HNRNPK, LSM6, PPIE, PAPOLA, CRNKL1, PRPF4, PDCD7
REACTOME_EICOSANOID_LIGAND_BINDING_RECEPTORS	0.00292825768667643	0.14039911308204	0.855205146353084	1.70011516938522	1	5	LTB4R, PTGFR, PTGIR, PTGER4
REACTOME_MUCOPOLYSACCHARIDOSES	0.00388098318240621	0.145656974604343	0.676858560584714	1.69524792247469	2	11	IDUA, GUSB, SGSH
REACTOME_SENSORY_PROCESSING_OF_SOUND_BY_OUTER_HAIR_CELLS_OF_THE_COCHLEA	0.00707547169811321	0.157753122508637	0.553454297454696	1.68808165506881	5	25	ACTG1, KCNQ4, MYH9, ACTB, MSN, EPB41L3, MYO1C, TWF1, SPTAN1, EZR, GSN
REACTOME_CATION_COUPLED_CHLORIDE_COTRANSPORTERS	0.00306748466257669	0.14039911308204	0.914141817573005	1.68665529636549	1	4	SLC12A7, SLC12A4
REACTOME_MEIOTIC_RECOMBINATION	0.00881612090680101	0.16677201854193	0.616789340576091	1.67712523168715	6	15	MSH5, MRE11, ATM, CDK2
REACTOME_INTERACTIONS_OF_REV_WITH_HOST_CELLULAR_PROTEINS	0.0034443168771527	0.14039911308204	0.518169548577892	1.67586653448465	2	34	NPM1, NUP107, NUP85, NUP155, POM121C, NUP160, NUP93, AAAS, POM121, RANGAP1, NUP50, RAE1, NUP205, NUP35, NUP43, NUP54, RANBP1, XPO1, NUP133, TPR, NUP153, RCC1, RAN, NUP98, NUP88, NUP62, NUP214, SEH1L
REACTOME_TRANSCRIPTIONAL_REGULATION_OF_GRANULOPOIESIS	0.00717703349282297	0.157795055821372	0.565266804275614	1.66294034752224	5	21	CEBPA, PML, CDKN1A, CDK2, FLI1, MYC, CSF3R, RUNX1, CEBPB, STAT3, CBFB, KMT2A, CREB1
REACTOME_TP53_REGULATES_TRANSCRIPTION_OF_DEATH_RECEPTORS_AND_LIGANDS	0.00840336134453781	0.164228654424733	0.763877379375539	1.66253789292409	5	7	TNFRSF10B, FAS, TP53, TP63
REACTOME_PLASMA_LIPOPROTEIN_REMODELING	0.00884955752212389	0.16677201854193	0.621192593215991	1.66193431869572	6	14	LCAT, LMF1, ABCG1, PLTP, LMF2, MBTPS1, ANGPTL4, P4HB, LIPG, PCSK5
REACTOME_NUCLEAR_PORE_COMPLEX_NPC_DISASSEMBLY	0.00570776255707763	0.152431391429947	0.520155153776504	1.65812585690369	4	30	NUP107, NUP85, NUP155, POM121C, NUP160, NUP93, AAAS, POM121, NUP50, RAE1, NUP205, NUP35, NUP43, NEK9, NUP54, NUP133, TPR, NUP153, NEK6, NUP98, NUP88, NUP62, NUP214, SEH1L
REACTOME_RHOBTB2_GTPASE_CYCLE	0.00837320574162679	0.164228654424733	0.563001153028607	1.65627510052106	6	21	ACTG1, SRRM1, DDX39B, PHIP, ACTN1, RBMX, HNRNPC, TWF1, MYO6, TMOD3, HSP90AB1, CDC37, RHOBTB2, DBN1, MSI2, CCT6A
REACTOME_METABOLISM_OF_RNA	0.000999000999000999	0.088997582504076	0.396585348828109	1.65625273721268	0	568	RPL3, SRSF10, SRSF5, SRRM1, DDX39B, ADAT2, TRMT11, TRMT44, RBM5, ERI1, QTRT1, SNRPA, PSMB8, PPIH, WDR75, HNRNPM, RPL12, RBM28, SRSF1, PRPF3, CSNK1E, PTBP1, HNRNPA1, PAN2, SNRNP70, PAN3, NSUN6, HNRNPA3, SYMPK, SRSF11, PSMB9, ZFP36, THADA, ADARB1, SMG1, XAB2, NUP107, HNRNPU, RPS8, SF3A2, CPSF7, RNPC3, RPL36A, SRSF3, SRSF7, SRSF6, RBMX, PPIL4, CNOT3, MAPK11, ZFP36L1, RPL31, CSTF3, NUP85, RPL10A, TRMT5, RPS6, AQR, NOP56, HNRNPH1, RPL15, GEMIN8, NUP155, NAT10, RPS9, NOP58, POM121C, RPS19, TSEN54, NUP160, RPS27A, RPL35A, EXOSC5, RPL35, HNRNPL, RPL36, RPS17, TRMT112, RPL24, SRSF2, POLDIP3, HNRNPC, RPL11, NUP93, PRPF38A, LSM11, RPL34, U2SURP, PSME1, SF3B3, RPL28, ANP32A, ADAR, EXOSC9, RPL13, SRRT, RPL19, RPL37, AAAS, SNRNP40, PABPC1, RRP7A, SF1, PDCD11, TBL3, TYW5, EIF4A3, RPL17, CNOT6L, SKIV2L, NOB1, NXT1, UPF1, PABPN1, PCF11, RPS5, NCBP1, POM121, RPL7A, EXOSC10, RPL13A, METTL1, RPL18A, PSME2, RPS18, PRPF6, NOL12, RPL26, FAU, SNRNP200, RPL7, THG1L, CPSF1, DDX39A, RPS11, RPS2, EXOSC4, NUP50, U2AF1L4, CNOT9, PUS1, RPL9, RNPS1, HNRNPD, RRP1, RPL14, RPS4X, RPS16, RPS24, RPL23A, BYSL, DHX9, LSM7, SUPT5H, SRRM2, RPL4, U2AF2, DCP1B, BOP1, HNRNPR, POLR2H, GNL3, SARNP, RNMT, RPL41, CASC3, POP1, RPL23, SRSF9, RPL29, UPF3A, YWHAZ, EXOSC8, QTRT2, GTF2H4, RPL32, NOP2, RAE1, NHP2, TEX10, RPS12, NUDT21, DDX5, HEATR1, RPS21, HNRNPH2, NIP7, EXOSC6, HNRNPF, SNRPB, SART1, RPS25, ELAC2, CHERP, DHX38, RPS15, XRN1, HSPB1, GEMIN4, RPS7, PPP2R1A, NUP205, RPS3, RPL6, CPSF4, EMG1, NCL, NUP35, RIOK1, RBM8A, WDR33, GTPBP3, SF3B2, CTU1, RPL5, GTF2F1, HNRNPUL1, RPS3A, ZNF473, RPS27, PRMT5, UBA52, NUP43, SF3B1, TNFSF13, POLR2A, EXOSC1, NUP54, PPWD1, UTP20, NOL9, GEMIN2, WDR43, SRSF4, RPLP2, TRIT1, PSMB1, HNRNPA0, XPO1, WDR36, PELP1, RPL22, RCL1, NCBP2, EIF4A2, NUP133, WDR4, TPR, PES1, THOC2, RPS23, TYW1, DDX21, RPLP0, KHSRP, NOL6, RPS10, CSNK1D, WDR3, LSM8, FUS, NUP153, METTL14, TRMU, MAGOH, DIS3, RPP40, HNRNPK, LSM6
REACTOME_O_GLYCOSYLATION_OF_TSR_DOMAIN_CONTAINING_PROTEINS	0.0106257378984652	0.180866054766348	0.565851518558002	1.65584697531514	8	20	THBS2, ADAMTS1, POFUT2, ADAMTS9, ADAMTS13, ADAMTS4, THBS1, ADAMTS17, ADAMTS2, ADAMTS5
REACTOME_RUNX3_REGULATES_CDKN1A_TRANSCRIPTION	0.00585651537335286	0.152431391429947	0.832354867132495	1.65468968698106	3	5	TGFB1, CDKN1A, TP53
REACTOME_EXPORT_OF_VIRAL_RIBONUCLEOPROTEINS_FROM_NUCLEUS	0.00570776255707763	0.152431391429947	0.517197816886997	1.64869859903945	4	30	NUP107, NUP85, NUP155, POM121C, NUP160, NUP93, AAAS, POM121, NUP50, RAE1, NUP205, NUP35, NUP43, NUP54, XPO1, NUP133, TPR, NUP153, RAN, NUP98, NUP88, NUP62, NUP214, SEH1L
REACTOME_CASPASE_ACTIVATION_VIA_DEATH_RECEPTORS_IN_THE_PRESENCE_OF_LIGAND	0.0105124835742444	0.180866054766348	0.672759823722243	1.64554092009293	7	10	TNFRSF10B, FAS, TRAF2, CFLAR, TLR4, RIPK1
REACTOME_PARASITE_INFECTION	0.0066815144766147	0.1547157517511	0.482455334002822	1.64025114475547	5	43	ACTG1, MYH9, SRC, ACTB, ARPC1B, FGR, MYO10, CYFIP1, VAV2, MYO1C, FYN, DOCK1, ARPC5, NCKIPSD, WIPF1, MYO9B
REACTOME_REGULATION_OF_EXPRESSION_OF_SLITS_AND_ROBOS	0.00102040816326531	0.088997582504076	0.415510560185595	1.63906195853985	0	145	RPL3, PSMB8, RPL12, ROBO3, PSMB9, RPS8, RPL36A, RPL31, RPL10A, RPS6, RPL15, RPS9, ZSWIM8, RPS19, RPS27A, RPL35A, RPL35, RPL36, RPS17, RPL24, RPL11, RPL34, PSME1, RPL28, RPL13, RPL19, RPL37, PABPC1, EIF4A3, RPL17, RPS5, NCBP1, RPL7A, RPL13A, RPL18A, PSME2, RPS18, RPL26, FAU, RPL7, RPS11, RPS2, RPL9, RNPS1, RPL14, RPS4X, RPS16, RPS24, RPL23A, RPL4, COL4A5, RPL41, CASC3, RPL23, RPL29, UPF3A, RPL32, RPS12, RPS21, RPS25, RPS15, RPS7, RPS3, RPL6, RBM8A, RPL5, RPS3A, RPS27, UBA52, RPLP2, PSMB1, RPL22, NCBP2, RPS23, RPLP0, RPS10, MAGOH, RPS13, RPL27, RPL37A, RPS20, LDB1
REACTOME_NUCLEAR_IMPORT_OF_REV_PROTEIN	0.00684150513112885	0.1547157517511	0.511906157227488	1.63712447918738	5	31	NPM1, NUP107, NUP85, NUP155, POM121C, NUP160, NUP93, AAAS, POM121, NUP50, RAE1, NUP205, NUP35, NUP43, NUP54, NUP133, TPR, NUP153, RCC1, RAN, NUP98, NUP88, NUP62, NUP214, SEH1L
REACTOME_REGULATION_OF_GLUCOKINASE_BY_GLUCOKINASE_REGULATORY_PROTEIN	0.0138728323699422	0.195576970595503	0.523395566160314	1.63374913471214	11	27	NUP107, NUP85, NUP155, POM121C, NUP160, NUP93, AAAS, POM121, NUP50, RAE1, NUP205, NUP35, NUP43, NUP54, NUP133, TPR, NUP153, NUP98, NUP88, NUP62, NUP214, SEH1L
REACTOME_COLLAGEN_FORMATION	0.00220994475138122	0.118616762204488	0.469010885692041	1.63250317461756	1	52	COL7A1, PPIB, P3H3, COLGALT1, COL12A1, COL6A3, LOXL4, COL18A1, PXDN, PCOLCE, SERPINH1, BMP1, COL6A2, LOX, COL27A1, COL4A2, ADAMTS2, PLOD3, COL4A5, COL4A6, CTSL, PLOD2, CRTAP, COL6A1, P4HB, COL4A1
REACTOME_SIGNALING_BY_NOTCH1_T_7_9_NOTCH1_M1580_K2555_TRANSLOCATION_MUTANT	0.0112044817927171	0.186702049240749	0.74924484744729	1.63069097683918	7	7	JAG1, NOTCH1, DLL1, DLL4, JAG2, ADAM10
REACTOME_ADHERENS_JUNCTIONS_INTERACTIONS	0.0140127388535032	0.195576970595503	0.621299123509037	1.62931867847214	10	13	ACTG1, CDH11, ACTB, CTNND1, AFDN, NECTIN2
REACTOME_CELL_CELL_COMMUNICATION	0.00429184549356223	0.147077952243798	0.450687728075448	1.62923440061265	3	66	ACTG1, CLDN15, CDH11, PTK2B, SRC, F11R, ACTB, PARVA, CTNND1, ACTN4, CLDN5, CD47, FBLIM1, ACTN1, AFDN, IQGAP1, NECTIN2, FYN, SPTAN1, PXN, ILK, FLNA, SKAP2
REACTOME_GPCR_LIGAND_BINDING	0.00426894343649947	0.147077952243798	0.441669824912625	1.62118857953235	3	73	LTB4R, PTGFR, ACKR1, PTGIR, ADM, SAA1, LPAR1, RAMP3, GABBR1, GNB4, ANXA1, S1PR1, CXCR4, PTGER4, C3, GPR4, LPAR6, EDNRB, GNB1, WNT2B, PTCH1, FZD6, AGTR1, RAMP1, CXCL12, APP, ECE1, CNR1, GNB2, CD55, GNG12, ADGRE5, OPN4, ADRA2B, FZD8, F2RL3, CMKLR1, WNT11, CXCL2, FZD3, CCL2, EDNRA
REACTOME_LEISHMANIA_INFECTION	0.00312174817898023	0.14039911308204	0.422303064867743	1.62008190216673	2	112	ACTG1, NFKB2, MYH9, PTGIR, SRC, ADM, ACTB, GSDMD, RAMP3, GNB4, NOXA1, ARPC1B, FGR, MYO10, ITPR3, CYFIP1, ADCY4, ADCY3, ITPR1, VAV2, RHBDF2, PLCG2, PTGER4, MYO1C, FYN, C3, DOCK1, PRKX, JUN, GNB1, ARPC5, NCKIPSD, RAMP1, GNAI2, WIPF1, TXNIP, MYO9B, APP, RELA, PRKAR1A, NT5E, HSP90AB1
REACTOME_SUMOYLATION_OF_RNA_BINDING_PROTEINS	0.00788288288288288	0.164228654424733	0.477554500537791	1.61205834743448	6	41	NUP107, NUP85, NUP155, PHC3, NOP58, POM121C, CBX4, NUP160, HNRNPC, NUP93, AAAS, POM121, NUP50, RING1, PCGF2, RAE1, NUP205, NUP35, PHC2, NUP43, NUP54, NUP133, TPR, NUP153, HNRNPK, UBE2I, NUP98, NUP88, NUP62, NUP214, SEH1L
REACTOME_SUMOYLATION_OF_UBIQUITINYLATION_PROTEINS	0.00681044267877412	0.1547157517511	0.492747970286414	1.61123837272265	5	35	PML, MDM2, NUP107, NUP85, NUP155, POM121C, NUP160, NUP93, AAAS, POM121, TRIM27, VHL, NUP50, RAE1, NUP205, NUP35, NUP43, NUP54, NUP133, TPR, NUP153, UBE2I, NUP98, NUP88, NUP62, NUP214, SEH1L
REACTOME_DEGRADATION_OF_THE_EXTRACELLULAR_MATRIX	0.00535331905781585	0.152431391429947	0.443157834069041	1.60509050353932	4	67	MMP2, CAPN2, COL7A1, HTRA1, LAMA5, ADAMTS1, CAPN15, ADAMTS9, ADAM15, PHYKPL, COL12A1, COL6A3, CD44, MMP14, ADAMTS4, COL18A1, CTSK, A2M, TIMP2, BMP1, COL6A2, COL4A2, CAPNS1, COL4A5, ADAMTS5, CAPN10, COL4A6, CTSL, ADAM10, COL6A1, LAMB1
REACTOME_TRANSCRIPTIONAL_REGULATION_BY_SMALL_RNAS	0.00776053215077605	0.164228654424733	0.470527357353933	1.60137330550175	6	42	NUP107, NUP85, NUP155, POM121C, NUP160, NUP93, AAAS, POM121, NUP50, IPO8, POLR2H, RAE1, NUP205, NUP35, NUP43, POLR2A, NUP54, TNRC6A, NUP133, TPR, NUP153, RAN, NUP98, NUP88, NUP62, NUP214, SEH1L
REACTOME_HDL_ASSEMBLY	0.0143061516452074	0.196927287429247	0.770071919303921	1.60070726142402	9	6	ABCA1, ZDHHC8, A2M, BMP1
REACTOME_TP53_REGULATES_TRANSCRIPTION_OF_DNA_REPAIR_GENES	0.00554323725055432	0.152431391429947	0.460709425254586	1.59722423599733	4	51	DDB2, MDC1, CCNT2, NELFE, TP53, ATM, NELFA, RAD51D, FANCC, JUN, PMS2, SUPT5H, POLR2H, NELFB, GTF2H4, CCNT1, SUPT16H, GTF2F1, NELFCD, POLR2A, CDK13, ELL, MSH2, ATF2
REACTOME_HDL_REMODELING	0.00613496932515337	0.152431391429947	0.864459084801426	1.59498719546888	3	4	LCAT, ABCG1, PLTP
REACTOME_ANTI_INFLAMMATORY_RESPONSE_FAVOURING_LEISHMANIA_PARASITE_INFECTION	0.00554323725055432	0.152431391429947	0.459439911593787	1.59282298463192	4	51	MYH9, PTGIR, SRC, ADM, RAMP3, GNB4, FGR, ITPR3, ADCY4, ADCY3, ITPR1, RHBDF2, PLCG2, PTGER4, FYN, PRKX, GNB1, RAMP1, GNAI2
REACTOME_VIRAL_MESSENGER_RNA_SYNTHESIS	0.0124434389140271	0.192593133318734	0.479789300419522	1.59223574193935	10	38	NUP107, NUP85, NUP155, POM121C, NUP160, NUP93, AAAS, POM121, NUP50, POLR2H, RAE1, NUP205, NUP35, GTF2F1, NUP43, POLR2A, NUP54, NUP133, TPR, NUP153, NUP98, NUP88, NUP62, NUP214, SEH1L
REACTOME_TRANSPORT_OF_MATURE_MRNAS_DERIVED_FROM_INTRONLESS_TRANSCRIPTS	0.0111982082866741	0.186702049240749	0.472143017521667	1.59097625902955	9	40	SYMPK, NUP107, NUP85, NUP155, POM121C, NUP160, NUP93, AAAS, NCBP1, POM121, CPSF1, NUP50, RAE1, NUP205, CPSF4, NUP35, WDR33, NUP43, NUP54, NCBP2, NUP133, TPR, NUP153, NUP98, NUP88, NUP62, NUP214, SEH1L, FIP1L1, NXF1, ALYREF, SLBP, CPSF3
REACTOME_FGFR2_ALTERNATIVE_SPLICING	0.0167464114832536	0.217407725321888	0.540161697163479	1.58908443518163	13	21	HNRNPM, PTBP1, HNRNPA1, HNRNPH1, NCBP1, POLR2H, HNRNPF, GTF2F1, POLR2A, NCBP2, TIA1
REACTOME_CELL_JUNCTION_ORGANIZATION	0.00997782705099778	0.179487502519653	0.465801584103105	1.58528980469473	8	42	ACTG1, CLDN15, CDH11, F11R, ACTB, PARVA, CTNND1, CLDN5, FBLIM1, ACTN1, AFDN, NECTIN2, PXN, ILK, FLNA
REACTOME_RHOBTB_GTPASE_CYCLE	0.0124716553287982	0.192593133318734	0.492195527795984	1.5849210008325	10	32	ACTG1, SRRM1, DDX39B, PHIP, CPSF7, ACTN1, RBMX, VIM, HNRNPC, TWF1, GPS1, MYO6, TMOD3, ROCK1
REACTOME_REGULATION_BY_C_FLIP	0.0182072829131653	0.221058511381092	0.728037474514824	1.58453427412543	12	7	TNFRSF10B, FAS, TRAF2, CFLAR, RIPK1
REACTOME_RESOLUTION_OF_D_LOOP_STRUCTURES_THROUGH_SYNTHESIS_DEPENDENT_STRAND_ANNEALING_SDSA	0.0234567901234568	0.252383916912144	0.566605281278699	1.576760624149	18	17	XRCC3, WRN, RTEL1, MRE11, ATM, RAD51D
REACTOME_DISEASES_ASSOCIATED_WITH_N_GLYCOSYLATION_OF_PROTEINS	0.0202788339670469	0.234316745765221	0.606164701510371	1.5680451292192	15	12	MAN1B1, ALG13, MOGS, ALG8, ALG2, ALG9, ALG6
REACTOME_PURINERGIC_SIGNALING_IN_LEISHMANIASIS_INFECTION	0.0251889168765743	0.253974875258708	0.575818444515196	1.56572038236796	19	15	NFKB2, GSDMD, C3, TXNIP, APP, RELA, NT5E, HSP90AB1
REACTOME_INTERFERON_SIGNALING	0.00206825232678387	0.118616762204488	0.405091361914282	1.56512823363918	1	120	PML, PSMB8, IRF3, IFITM2, CIITA, VCAM1, IFITM3, GBP2, STAT2, NUP107, TRIM22, NUP85, B2M, SP100, UBE2L6, TRIM38, NUP155, POM121C, NUP160, RPS27A, CD44, IRF1, NUP93, IFI30, ADAR, GBP1, AAAS, TRIM25, TRIM35, EIF4A3, TRIM21, POM121, ICAM1, FLNA, TRIM2, CAMK2B, NUP50, IFIT5, SOCS3, CAMK2D, IFNAR2, RAE1, EGR1, MT2A, IRF7, BST2, NUP205, NUP35, UBA52, NUP43, TRIM62, NUP54, IFNGR1, IP6K2, EIF2AK2, EIF4A2, UBA7, NUP133, TPR, ABCE1, IFNGR2, DDX58, NUP153, PIN1
REACTOME_TRANSPORT_OF_THE_SLBP_DEPENDANT_MATURE_MRNA	0.0171037628278221	0.217407725321888	0.484587054336763	1.56397440249411	14	33	NUP107, NUP85, NUP155, POM121C, NUP160, NUP93, AAAS, NCBP1, POM121, NUP50, RAE1, NUP205, NUP35, NUP43, NUP54, NCBP2, NUP133, TPR, NUP153, NUP98, NUP88, NUP62, NUP214, SEH1L, NXF1, ALYREF, SLBP, NUP188
REACTOME_TNFS_BIND_THEIR_PHYSIOLOGICAL_RECEPTORS	0.0131771595900439	0.192782333360396	0.786569110780482	1.56366935197983	8	5	TNFRSF6B, EDA2R, TNFRSF14
REACTOME_SENSORY_PROCESSING_OF_SOUND	0.0171037628278221	0.217407725321888	0.483984520676326	1.56202976279907	14	33	ACTG1, KCNQ4, MYH9, ACTB, MSN, EPB41L3, MYO1C, TWF1, CAPZA1, SPTAN1, EZR, DNAJC5, GSN
