pathway	pval	padj	ES	NES	nMoreExtreme	size	leadingEdge
REACTOME_RESPONSE_OF_EIF2AK4_GCN2_TO_AMINO_ACID_DEFICIENCY	0.00100806451612903	0.0425686395783473	0.563256982883041	2.13893003455111	0	90	RPL3, RPL12, RPS8, RPS6, RPL36A, RPL31, RPS19, RPL35, RPS27A, RPL34, RPS9, RPL24, RPS17, RPL35A, RPL36, RPL10A, RPL11, RPL15, RPL13, RPL17, RPL28, RPS18, RPS4X, RPL26, RPL19, RPL13A, RPS11, RPL7A, DDIT3, RPL7, ASNS, RPL37, RPL32, RPS7, RPS2, RPL18A, RPL23, RPS24, RPL9, RPS16, RPS27, RPS3, FAU, CEBPB, RPS3A, RPS5, RPL29, RPL5, RPS12, RPS21, RPL6, RPL14, RPS15, RPS20, RPL41, RPL4, RPL23A, RPLP2, RPS10, RPL27A, EIF2S3, ATF2, RPLP0, RPS25, RPS13, RPL27, RPL22, RPS14, UBA52
REACTOME_EUKARYOTIC_TRANSLATION_ELONGATION	0.00100908173562059	0.0425686395783473	0.559361340160432	2.109187000232	0	83	EEF1A1, RPL3, RPL12, RPS8, RPS6, RPL36A, RPL31, RPS19, RPL35, RPS27A, RPL34, RPS9, RPL24, RPS17, RPL35A, RPL36, RPL10A, RPL11, RPL15, RPL13, RPL17, RPL28, RPS18, RPS4X, RPL26, RPL19, RPL13A, RPS11, RPL7A, RPL7, RPL37, RPL32, RPS7, RPS2, RPL18A, RPL23, RPS24, RPL9, RPS16, RPS27, RPS3, FAU, RPS3A, RPS5, RPL29, RPL5, RPS12, RPS21, RPL6, RPL14, RPS15, RPS20, RPL41, RPL4, RPL23A, RPLP2, RPS10, RPL27A, RPLP0, RPS25, RPS13, RPL27, RPL22, RPS14, UBA52
REACTOME_SRP_DEPENDENT_COTRANSLATIONAL_PROTEIN_TARGETING_TO_MEMBRANE	0.00100806451612903	0.0425686395783473	0.541748505685334	2.07112050511609	0	100	RPL3, RPL12, RPS8, RPS6, RPL36A, RPL31, RPS19, RPL35, RPS27A, RPL34, RPS9, RPL24, RPS17, RPL35A, RPL36, RPL10A, RPL11, RPL15, RPL13, RPL17, RPL28, RPS18, RPS4X, RPL26, SSR4, RPL19, RPL13A, RPS11, RPL7A, RPL7, RPL37, SEC61B, RPL32, RPS7, RPS2, RPL18A, RPL23, RPS24, RPL9, RPS16, RPS27, SSR1, RPS3, FAU, RPS3A, RPS5, RPL29, RPL5, RPS12, RPS21, RPL6, RPL14, RPS15, RPS20, SEC11C, RPL41, RPL4, RPL23A, RPLP2, RPS10, RPL27A, RPLP0, RPS25, TRAM1, RPS13, RPL27, RPL22, RPS14, UBA52
REACTOME_SELENOAMINO_ACID_METABOLISM	0.00100603621730382	0.0425686395783473	0.54254016214886	2.06964425945972	0	94	RPL3, RPL12, NNMT, RPS8, RPS6, RPL36A, RPL31, RPS19, RPL35, RPS27A, RPL34, RPS9, RPL24, RPS17, RPL35A, RPL36, RPL10A, RPL11, RPL15, RPL13, RPL17, HNMT, RPL28, RPS18, RPS4X, RPL26, RPL19, RPL13A, RPS11, RPL7A, SEPSECS, RPL7, RPL37, RPL32, RPS7, RPS2, RPL18A, RPL23, RPS24, RPL9, RPS16, RPS27, RPS3, FAU, RPS3A, RPS5, RPL29, RPL5, RPS12, RPS21, RPL6, RPL14, RPS15, RPS20, RPL41, PAPSS2, RPL4, RPL23A, RPLP2, RPS10, RPL27A, RPLP0, RPS25, RPS13, RPL27, RPL22, PAPSS1, RPS14, UBA52, RPSA, RPL37A, RPS23, SCLY, RPL21
REACTOME_NONSENSE_MEDIATED_DECAY_NMD	0.00100603621730382	0.0425686395783473	0.527502310855099	2.022221482886	0	102	RPL3, RPL12, RPS8, RPS6, RPL36A, RPL31, RPS19, RPL35, RPS27A, RPL34, RPS9, RPL24, RPS17, RPL35A, RPL36, RPL10A, RPL11, PABPC1, RPL15, RPL13, RPL17, RPL28, SMG1, RPS18, RPS4X, RPL26, RPL19, RPL13A, RPS11, RPL7A, RPL7, RPL37, CASC3, RPL32, RPS7, RPS2, RPL18A, RPL23, RPS24, RPL9, RPS16, UPF3A, RPS27, RPS3, FAU, RPS3A, RPS5, EIF4A3, RPL29, RPL5, RPS12, RPS21, NCBP1, RPL6, RPL14, RPS15, RPS20, RPL41, RPL4, RPL23A, RPLP2, RPS10, RPL27A, RNPS1, RPLP0, UPF1, RPS25, RPS13, RPL27, RPL22, RPS14, UBA52, RPSA, MAGOH, RPL37A, RPS23, NCBP2, RPL21
REACTOME_COMPLEMENT_CASCADE	0.00110253583241455	0.0425686395783473	0.661497978166939	2.01318519567149	0	20	CFB, C1R, SERPING1, C1S, PROS1, C3, CD81, CFI, C7, C8G, CLU, CFD, C1QB, CFH, C1QC, C1QA
REACTOME_DEGRADATION_OF_THE_EXTRACELLULAR_MATRIX	0.00101936799184506	0.0425686395783473	0.54432925895661	2.0085028623812	0	67	MMP2, COL12A1, HTRA1, CTSK, CD44, CAPN2, MMP14, TIMP2, COL1A1, COL6A3, CAPN15, COL7A1, ADAM15, ADAMTS9, LAMA5, ADAMTS4, COL6A2, ADAMTS5, BMP1, ADAMTS1, COL4A2, A2M, COL6A1, PHYKPL, COL18A1, FBN1, LAMB1, COL16A1, COL4A1, DCN, NID1, CAPN5, FN1, COL8A1, COL5A1, CAPN10, HSPG2, ADAM10, LAMC1, CAPNS1, COL1A2
REACTOME_INTEGRIN_CELL_SURFACE_INTERACTIONS	0.00103092783505155	0.0425686395783473	0.553759849971332	1.99046118452033	0	52	VCAM1, ITGAM, CD44, F11R, JAM3, COL1A1, COL6A3, ITGA5, COL7A1, ITGA9, THBS1, TNC, COL6A2, COL4A2, COL6A1, ICAM2, COL18A1, LUM, PECAM1, FBN1, CD47, ITGA3, COL16A1, COL4A1, ITGB2, FN1, COL8A1, COL5A1, ICAM1, ITGA11, HSPG2, VWF, COL1A2, AGRN, ITGA1, KDR
REACTOME_EXTRACELLULAR_MATRIX_ORGANIZATION	0.001001001001001	0.0425686395783473	0.502880924824629	1.98549886171455	0	168	MUSK, MMP2, TGFB1, VCAN, LOX, COL12A1, HTRA1, VCAM1, CTSK, ITGAM, P3H3, ACTN1, CD44, CAPN2, PPIB, FMOD, MMP14, LTBP2, ADAMTS2, BGN, TIMP2, F11R, JAM3, FBLN5, PCOLCE, COL1A1, COL6A3, ITGA5, FBLN1, CAPN15, EFEMP1, PLOD2, COL7A1, ADAM15, SERPINE1, ADAMTS9, ITGA9, THBS1, LAMA5, TNC, COLGALT1, ADAMTS4, COL6A2, EMILIN1, LOXL4, ADAMTS5, SDC2, PXDN, BMP1, ADAMTS1, SERPINH1, COL4A2, LAMA4, A2M, COL6A1, ICAM2, APP, PHYKPL, COL18A1, LUM, PECAM1, LRP4, FBN1, CD47, LAMB1, ITGA3, FGF2, NID2, COL16A1, COL4A1, DCN, NID1, SH3PXD2A, LAMA2, CAPN5, MFAP4, ITGB2, CRTAP, FN1, PLOD3, COL8A1, COL5A1, COL27A1, ICAM1, DDR2, ITGA11, CAPN10, HSPG2, ADAM10, LAMC1, VWF, CAPNS1, LTBP1, COL1A2, TNXB, FBLN2, AGRN, BMP4, LTBP3, CTSL, ITGA1, KDR
REACTOME_COLLAGEN_BIOSYNTHESIS_AND_MODIFYING_ENZYMES	0.00105263157894737	0.0425686395783473	0.576958298935481	1.97108632481062	0	39	COL12A1, P3H3, PPIB, ADAMTS2, PCOLCE, COL1A1, COL6A3, PLOD2, COL7A1, COLGALT1, COL6A2, BMP1, SERPINH1, COL4A2, COL6A1, COL18A1, COL16A1, COL4A1, CRTAP, PLOD3, COL8A1, COL5A1, COL27A1
REACTOME_EUKARYOTIC_TRANSLATION_INITIATION	0.00100401606425703	0.0425686395783473	0.504517866307224	1.93717308464351	0	109	RPL3, RPL12, RPS8, RPS6, RPL36A, RPL31, RPS19, RPL35, RPS27A, RPL34, RPS9, RPL24, RPS17, RPL35A, RPL36, RPL10A, RPL11, PABPC1, RPL15, EIF3D, RPL13, RPL17, RPL28, RPS18, RPS4X, RPL26, RPL19, RPL13A, RPS11, RPL7A, RPL7, RPL37, RPL32, RPS7, RPS2, RPL18A, RPL23, RPS24, RPL9, RPS16, RPS27, RPS3, FAU, RPS3A, EIF3G, RPS5, RPL29, RPL5, EIF3E, RPS12, RPS21, RPL6, RPL14, RPS15, RPS20, RPL41, RPL4, RPL23A, RPLP2, RPS10, RPL27A, EIF2S3, EIF3H, RPLP0, RPS25, RPS13, RPL27, RPL22, RPS14, EIF2B4, UBA52, EIF2B1, RPSA, EIF4H, RPL37A, RPS23
REACTOME_CLASS_A_1_RHODOPSIN_LIKE_RECEPTORS	0.00103092783505155	0.0425686395783473	0.548689360855885	1.92400680743787	0	44	PTGFR, LTB4R, PTGIR, AVPR1A, ACKR1, LPAR1, SAA1, C3, ANXA1, AGTR1, CXCR4, LPAR6, EDNRB, ECE1, PTGER4, S1PR1, CXCL12, CCL2, APP, EDNRA, CNR1, GPR4, CMKLR1
REACTOME_INTERLEUKIN_4_AND_INTERLEUKIN_13_SIGNALING	0.00102564102564103	0.0425686395783473	0.520953579426019	1.89602588108087	0	60	MMP2, TGFB1, SAA1, VCAM1, IL4R, ITGAM, VIM, BCL2L1, TP53, STAT6, CDKN1A, ANXA1, CEBPD, POU2F1, HIF1A, MYC, LAMA5, S1PR1, FSCN1, CCL2, PIM1, FGF2, ITGB2, MCL1, FN1, JUNB, ICAM1, ALOX5, FOS, HSP90B1, COL1A2, SOCS3
REACTOME_PEPTIDE_LIGAND_BINDING_RECEPTORS	0.00108459869848156	0.0425686395783473	0.589382501061528	1.88310243123256	0	26	AVPR1A, ACKR1, SAA1, C3, ANXA1, AGTR1, CXCR4, EDNRB, ECE1, CXCL12, CCL2, APP, EDNRA
REACTOME_TP53_REGULATES_TRANSCRIPTION_OF_CELL_DEATH_GENES	0.0010752688172043	0.0425686395783473	0.575568697873584	1.86795155151891	0	28	TNFRSF10B, FAS, BBC3, PIDD1, TP53, CASP2, PERP, BNIP3L, NDRG1, TP53INP1, BAX, PRELID1, ATM, CASP10, IGFBP3, TP63, TP53I3, BCL6, RABGGTA, ZNF420
REACTOME_ECM_PROTEOGLYCANS	0.00102774922918808	0.0425686395783473	0.519722213886208	1.84638769987905	0	47	MUSK, TGFB1, VCAN, FMOD, BGN, COL1A1, COL6A3, SERPINE1, ITGA9, LAMA5, TNC, COL6A2, COL4A2, LAMA4, COL6A1, APP, LUM, LRP4, LAMB1, COL4A1, DCN, LAMA2, FN1, COL5A1, HSPG2, LAMC1, COL1A2, TNXB, AGRN
REACTOME_GAP_JUNCTION_DEGRADATION	0.00121802679658952	0.0459080099762195	0.701529859596192	1.84155917641645	0	11	ACTG1, DAB2, ACTB, GJA1, DNM1, MYO6
REACTOME_REGULATION_OF_INSULIN_LIKE_GROWTH_FACTOR_IGF_TRANSPORT_AND_UPTAKE_BY_INSULIN_LIKE_GROWTH_FACTOR_BINDING_PROTEINS_IGFBPS	0.00102880658436214	0.0425686395783473	0.501207247759704	1.83251162851613	0	62	MMP2, VCAN, IGFBP4, CP, FAM20A, GAS6, SHISA5, C3, CSF1, FSTL1, MXRA8, RCN1, PRKCSH, GPC3, TNC, MBTPS1, SDC2, FSTL3, APOL1, APP, IGFBP7, FBN1, LAMB1, CHRDL1, FUCA2, FN1, IGFBP3, ADAM10, LAMC1, HSP90B1, LTBP1, MGAT4A, CKAP4, BMP4, IGF2, IGFBP2, DNAJC3, MFGE8, MEN1, APLP2, GOLM1
REACTOME_INFLUENZA_INFECTION	0.001001001001001	0.0425686395783473	0.469341637162281	1.83244286769223	0	138	RPL3, TGFB1, RPL12, SLC25A6, RPS8, RPS6, RPL36A, RPL31, NUP85, RPS19, RPL35, NUP107, RPS27A, RPL34, RPS9, RPL24, RPS17, RPL35A, RPL36, RPL10A, RPL11, RPL15, RPL13, RPL17, POM121C, RPL28, RPS18, RPS4X, RPL26, PABPN1, RPL19, RPL13A, NUP160, RPS11, RPL7A, NUP155, RPL7, RPL37, POLR2H, RPL32, NUP54, RPS7, RPS2, RPL18A, RPL23, RPS24, RPL9, RPS16, RPS27, NUP93, RPS3, FAU, RPS3A, RPS5, RPL29, RPL5, NUP50, RPS12, RAE1, RPS21, RPL6, RPL14, RPS15, RPS20, AAAS, NUP205, RPL41, POM121, RPL4, RPL23A, RPLP2, RPS10, RPL27A, NUP35, EIF2AK2, GTF2F1, RPLP0, RPS25, RPS13, RPL27, DNAJC3, RPL22, RPS14, UBA52, CPSF4, RPSA, NUP133, CALR, RPL37A, RPS23
REACTOME_HEPARAN_SULFATE_HEPARIN_HS_GAG_METABOLISM	0.00105932203389831	0.0425686395783473	0.553463642663939	1.83048279105732	0	31	IDUA, VCAN, GUSB, B3GAT3, NDST2, SGSH, BGN, GPC3, SDC2, HGSNAT, DCN, EXT2, HSPG2, B4GALT7, XYLT2, NAGLU, AGRN, GLB1, SDC3, B3GALT6, EXT1, HS6ST3
REACTOME_IMMUNOREGULATORY_INTERACTIONS_BETWEEN_A_LYMPHOID_AND_A_NON_LYMPHOID_CELL	0.00218818380743982	0.0641462030958749	0.581517376221644	1.81370911706415	1	23	VCAM1, C3, B2M, CD81, COL1A1, NPDC1, PILRB, ICAM2, COLEC12, NECTIN2, LILRB5, ITGB2, MICA, ICAM1, COL1A2, CD40, CD99, CD34
REACTOME_COLLAGEN_FORMATION	0.00103092783505155	0.0425686395783473	0.503160029951453	1.80858274443751	0	52	LOX, COL12A1, P3H3, PPIB, ADAMTS2, PCOLCE, COL1A1, COL6A3, PLOD2, COL7A1, COLGALT1, COL6A2, LOXL4, PXDN, BMP1, SERPINH1, COL4A2, COL6A1, COL18A1, COL16A1, COL4A1, CRTAP, PLOD3, COL8A1, COL5A1, COL27A1
REACTOME_SIGNALING_BY_PDGF	0.00104384133611691	0.0425686395783473	0.52349031113765	1.8004847303759	0	40	THBS2, SRC, STAT6, COL6A3, PDGFRA, THBS3, THBS1, PDGFC, COL6A2, PDGFD, PTPN12, COL4A2, COL6A1, PDGFRB, NRAS, PLAT, COL4A1, COL5A1, KRAS, STAT5A
REACTOME_RIPK1_MEDIATED_REGULATED_NECROSIS	0.00330760749724366	0.090274873588564	0.583970332681646	1.80016214460337	2	22	TNFRSF10B, FAS, FLOT2, MLKL, TRAF2, RPS27A, OGT, PELI1, CFLAR, RIPK1, SDCBP, BIRC3, TRADD
REACTOME_TP53_REGULATES_TRANSCRIPTION_OF_GENES_INVOLVED_IN_CYTOCHROME_C_RELEASE	0.00239234449760766	0.0688560243584167	0.649073643920704	1.78020214818755	1	13	BBC3, TP53, BNIP3L, TP53INP1, BAX, PRELID1, ATM
REACTOME_TIGHT_JUNCTION_INTERACTIONS	0.0025974025974026	0.0734230055658627	0.805180648409332	1.77492786497423	1	6	CLDN15, F11R, CLDN5
REACTOME_RNA_POLYMERASE_II_TRANSCRIPTION_TERMINATION	0.00102669404517454	0.0425686395783473	0.488579466747186	1.77220015963895	0	57	SRSF5, SRRM1, DDX39B, SRSF1, SRSF11, SRSF3, SRSF6, SRSF7, CSTF3, SYMPK, DDX39A, CPSF7, POLDIP3, PABPN1, SRSF2, PCF11, CASC3, EIF4A3, WDR33, SRSF9, LSM11, NCBP1, U2AF1L4, NUDT21, SRSF4, U2AF2, CPSF1, PAPOLA, RNPS1, SNRPB, THOC2, DHX38, CPSF4, SARNP, MAGOH, ZNF473, NCBP2, SLBP
REACTOME_CELLULAR_RESPONSE_TO_STARVATION	0.00100200400801603	0.0425686395783473	0.451873983688208	1.75747415823574	0	133	RPL3, TCIRG1, RPL12, SZT2, RPS8, RPS6, RPL36A, RPL31, RPS19, RPL35, RPS27A, RPL34, RPS9, RPL24, RPS17, RPL35A, RPL36, RPL10A, RPL11, RPL15, RPL13, RPL17, RRAGB, RPL28, RPS18, RPS4X, RPL26, RPL19, RPL13A, RPS11, RPL7A, DDIT3, RPL7, ASNS, RPL37, RPL32, RPS7, RPS2, RPL18A, RPL23, RPS24, RPL9, RPS16, RPS27, RPS3, FAU, CEBPB, RPS3A, RPS5, RPL29, RPL5, RPS12, RPS21, RPL6, RPL14, RPS15, RPS20, RPL41, RPL4, RPL23A, ATP6V1C1, RPLP2, RPS10, RPL27A, EIF2S3, ATF2, RPLP0, RPS25, SESN2, RPS13, RPL27, RPL22, RPS14, UBA52, WDR24
REACTOME_ACTIVATION_OF_THE_MRNA_UPON_BINDING_OF_THE_CAP_BINDING_COMPLEX_AND_EIFS_AND_SUBSEQUENT_BINDING_TO_43S	0.00102459016393443	0.0425686395783473	0.483404031567493	1.75351474425788	0	56	RPS8, RPS6, RPS19, RPS27A, RPS9, RPS17, PABPC1, EIF3D, RPS18, RPS4X, RPS11, RPS7, RPS2, RPS24, RPS16, RPS27, RPS3, FAU, RPS3A, EIF3G, RPS5, EIF3E, RPS12, RPS21, RPS15, RPS20, RPS10, EIF2S3, EIF3H, RPS25, RPS13, RPS14, RPSA, EIF4H, RPS23
REACTOME_NCAM_SIGNALING_FOR_NEURITE_OUT_GROWTH	0.00211864406779661	0.0632795011192837	0.521174495606346	1.74939084960197	1	34	SRC, PTPRA, FYN, COL6A3, COL6A2, SPTAN1, COL4A2, COL6A1, NRAS, CACNA1H, CACNA1C, COL4A1, GFRA1, COL5A1, KRAS, PTK2, FGFR1, AGRN, CREB1, PRNP
REACTOME_REGULATED_NECROSIS	0.00210526315789474	0.0632795011192837	0.509851023102487	1.74182498316121	1	39	TNFRSF10B, FAS, CASP4, FLOT2, TP53, GSDMD, MLKL, TRAF2, CHMP4A, BAX, RPS27A, OGT, PELI1, IRF1, CFLAR, RIPK1, SDCBP, BIRC3, TRADD, TP63, CHMP2A, HMGB1, UBA52, PDCD6IP
REACTOME_GAP_JUNCTION_TRAFFICKING_AND_REGULATION	0.00444938820912125	0.105125097537895	0.57664029979882	1.73481948200438	3	19	SRC, ACTG1, DAB2, ACTB, GJA1, DNM1, MYO6, GJA4, TUBA1A, TJP1
REACTOME_CATION_COUPLED_CHLORIDE_COTRANSPORTERS	0.00426136363636364	0.103382967607106	0.887137660758786	1.71423606177339	2	4	SLC12A7, SLC12A4
REACTOME_TRP_CHANNELS	0.00508905852417303	0.111888606163415	0.737727874773271	1.71005763872297	3	7	TRPV1, TRPV2, TRPM7, MLKL, RIPK1
REACTOME_EICOSANOID_LIGAND_BINDING_RECEPTORS	0.00397877984084881	0.100507936507937	0.821116484692658	1.70618031832648	2	5	PTGFR, LTB4R, PTGIR, PTGER4
REACTOME_MET_ACTIVATES_PTK2_SIGNALING	0.0066006600660066	0.128998084993685	0.555225130975029	1.70122619201016	5	21	SRC, COL1A1, LAMA5, LAMA4, LAMB1, ITGA3, LAMA2, FN1, COL5A1, COL27A1, LAMC1, COL1A2, PTK2
REACTOME_ELASTIC_FIBRE_FORMATION	0.0043010752688172	0.103382967607106	0.519795791961956	1.68694607551711	3	28	TGFB1, LOX, LTBP2, FBLN5, ITGA5, FBLN1, EFEMP1, EMILIN1, LOXL4, FBN1, MFAP4, FN1, LTBP1, FBLN2, BMP4, LTBP3, BMP2
REACTOME_PLASMA_LIPOPROTEIN_REMODELING	0.00589622641509434	0.123846033484588	0.605550352191492	1.68612623049761	4	14	LCAT, PLTP, LMF1, LMF2, MBTPS1, ABCG1, PCSK5, ANGPTL4
REACTOME_PLASMA_LIPOPROTEIN_ASSEMBLY_REMODELING_AND_CLEARANCE	0.00207900207900208	0.0632795011192837	0.485597871669152	1.6853899660659	1	42	LCAT, ABCA1, PLTP, LMF1, LMF2, AP2A2, ZDHHC8, MBTPS1, BMP1, A2M, ABCG1, NR1H3, PCSK5, LSR, LIPA, ANGPTL4, APOC1, MYLIP, SOAT1, AP2M1, LDLR, SCARB1, AP2B1, CES3
REACTOME_REGULATION_OF_EXPRESSION_OF_SLITS_AND_ROBOS	0.001001001001001	0.0425686395783473	0.430189247137257	1.68329570099796	0	145	RPL3, PSMB8, ROBO3, RPL12, RPS8, RPS6, RPL36A, RPL31, RPS19, PSMB9, PSME1, RPL35, RPS27A, RPL34, RPS9, RPL24, RPS17, RPL35A, RPL36, RPL10A, RPL11, PSME2, PABPC1, RPL15, RPL13, RPL17, ZSWIM8, RPL28, RPS18, RPS4X, RPL26, RPL19, RPL13A, RPS11, RPL7A, RPL7, RPL37, CASC3, RPL32, RPS7, RPS2, RPL18A, RPL23, RPS24, RPL9, RPS16, UPF3A, RPS27, RPS3, FAU, RPS3A, RPS5, EIF4A3, RPL29, RPL5, RPS12, RPS21, NCBP1, RPL6, RPL14, RPS15, RPS20, RPL41, RPL4, RPL23A, RPLP2, RPS10, RPL27A, RNPS1, RPLP0, RPS25, RPS13, RPL27, RPL22, RPS14, UBA52
REACTOME_GLYCOSAMINOGLYCAN_METABOLISM	0.00101317122593718	0.0425686395783473	0.452153162721538	1.6803948191956	0	72	IDUA, VCAN, GUSB, B3GAT3, NDST2, CHPF, CD44, SGSH, FMOD, BGN, GPC3, CSGALNACT1, SDC2, PRELP, LUM, CHST14, HGSNAT, HEXA, DCN, CHPF2, CHST2, EXT2, ABCC5, HSPG2, SLC26A2, HYAL2, B4GALT7, SLC35B3, PAPSS2, LYVE1, XYLT2, B3GNT2, UST, NAGLU, AGRN, GLB1, CHST1, ST3GAL4, PAPSS1, SLC9A1, SDC3, B3GALT6, EXT1, HS6ST3, CHST7
REACTOME_CHONDROITIN_SULFATE_DERMATAN_SULFATE_METABOLISM	0.00634920634920635	0.127360008581849	0.508997393353516	1.67776672732394	5	30	IDUA, VCAN, B3GAT3, CHPF, BGN, GPC3, CSGALNACT1, SDC2, CHST14, HEXA, DCN, CHPF2, HSPG2, B4GALT7, XYLT2, UST, AGRN, SDC3, B3GALT6, CHST7
REACTOME_REMOVAL_OF_AMINOTERMINAL_PROPEPTIDES_FROM_GAMMA_CARBOXYLATED_PROTEINS	0.00148148148148148	0.0545391903531438	0.939222365057695	1.67683796531494	0	3	GAS6, PROS1
REACTOME_ROLE_OF_PHOSPHOLIPIDS_IN_PHAGOCYTOSIS	0.00937866354044549	0.151494126372706	0.591670031174242	1.67272226904928	7	15	PLPP5, ITPR1, ITPR3, PLCG2, PLD2, PLD3, PLD1, PRKCD, PLA2G6
REACTOME_TRANSPORT_OF_MATURE_TRANSCRIPT_TO_CYTOPLASM	0.00101317122593718	0.0425686395783473	0.449571355250949	1.67079971679352	0	72	SRSF5, SRRM1, DDX39B, SRSF1, SRSF11, SRSF3, NUP85, SRSF6, NUP107, SRSF7, SYMPK, NXT1, DDX39A, POM121C, POLDIP3, SRSF2, NUP160, NUP155, CASC3, NUP54, NUP93, EIF4A3, NUP50, WDR33, SRSF9, RAE1, NCBP1, U2AF1L4, SRSF4, AAAS, NUP205, U2AF2, CPSF1, POM121, RNPS1, NUP35, THOC2, DHX38, CPSF4, SARNP, MAGOH, NXF1, NUP133
REACTOME_GPCR_LIGAND_BINDING	0.00101112234580384	0.0425686395783473	0.446789609938383	1.665248234209	0	73	PTGFR, LTB4R, PTGIR, AVPR1A, ACKR1, LPAR1, SAA1, ADM, RAMP3, GNB4, C3, GABBR1, ANXA1, AGTR1, CXCR4, LPAR6, EDNRB, ECE1, PTGER4, GNB1, S1PR1, FZD6, CXCL12, CCL2, APP, EDNRA, CNR1, GPR4, WNT2B, CMKLR1, CALCRL, GNG12, FZD1, PTCH1, ADRA2B, ADGRE5, GNB2, FZD8, F2R, ADRA2C, RAMP2, CXCL2, OPN4, WNT11, SSTR2, F2RL3, RAMP1
REACTOME_CROSSLINKING_OF_COLLAGEN_FIBRILS	0.00837320574162679	0.140765853387428	0.605601885554123	1.66097296925769	6	13	LOX, PCOLCE, COL1A1, LOXL4, PXDN, BMP1, COL4A2, COL4A1, COL1A2
REACTOME_NGF_STIMULATED_TRANSCRIPTION	0.00754310344827586	0.134165536613716	0.511385400003243	1.6516795984794	6	27	EGR1, ID4, JUND, NAB1, F3, NAB2, ID3, ID2, FOSB, JUNB, FOS, EGR3, CDK5R1, ATF2, CREB1
REACTOME_INITIAL_TRIGGERING_OF_COMPLEMENT	0.0037037037037037	0.0993722536095417	0.651299490694186	1.64888682791556	2	10	CFB, C1R, C1S, C3, CFD, C1QB, C1QC, C1QA
REACTOME_CELL_CELL_JUNCTION_ORGANIZATION	0.0121278941565601	0.157364397129792	0.540968204106966	1.64636811567441	10	20	CLDN15, CDH11, ACTG1, ACTB, CTNND1, F11R, CLDN5, AFDN, NECTIN2, CTNNA1, SDK1, CDH5, CDH6, CTNNB1
REACTOME_RRNA_PROCESSING	0.001001001001001	0.0425686395783473	0.416048408321933	1.64552319691915	0	175	RPL3, ERI1, RPL12, WDR75, CSNK1E, RPS8, RPS6, RPL36A, RPL31, RBM28, RPS19, RPL35, RPS27A, RPL34, RPS9, RPL24, RPS17, RPL35A, RPL36, RPL10A, RPL11, NOP56, RPL15, RPL13, RPL17, TRMT112, NOP58, RPL28, RPS18, RPS4X, RPL26, EXOSC10, RPL19, RPL13A, RPS11, RPL7A, NOL12, RPL7, EXOSC9, NAT10, EXOSC5, RRP7A, RPL37, RPL32, EXOSC8, RPS7, RPS2, RPL18A, RPL23, RPS24, RPL9, RPS16, RPS27, RPS3, FAU, RPS3A, RPS5, RPL29, RPL5, RPS12, RPS21, TBL3, PDCD11, RPL6, RPL14, RPS15, RPS20, RPL41, EXOSC4, RPL4, RPL23A, EXOSC1, RPLP2, RPS10, RPL27A, EXOSC6, NOP2, NOB1, EMG1, RPLP0, RPS25, TEX10, RPS13, RPL27, RRP1, RPL22, HEATR1, RPS14, UBA52, RCL1, NIP7, RPSA, NHP2, RPL37A, RPS23, NOL9, RPL21, RIOK1, WDR36, RPP40, EXOSC3, GNL3, DIMT1, DIS3, RPS15A
REACTOME_ACTIVATION_OF_SMO	0.00837320574162679	0.140765853387428	0.599846762436566	1.64518850068018	6	13	EFCAB7, BOC, ARRB1, GAS1, EVC, ARRB2, PTCH1
REACTOME_ACTIVATION_OF_MATRIX_METALLOPROTEINASES	0.0075	0.134165536613716	0.689099209246721	1.6449783955874	5	8	MMP2, CTSK, MMP14, TIMP2, COL18A1
REACTOME_SIGNAL_REGULATORY_PROTEIN_FAMILY_INTERACTIONS	0.0075	0.134165536613716	0.688716079978501	1.64406381121336	5	8	PTK2B, SRC, CD47, SIRPA, SKAP2, PTK2
REACTOME_DISEASES_ASSOCIATED_WITH_GLYCOSAMINOGLYCAN_METABOLISM	0.00862068965517241	0.141033473335879	0.508403078391917	1.64204725512056	7	27	VCAN, B3GAT3, FMOD, BGN, GPC3, SDC2, PRELP, LUM, CHST14, HEXA, DCN, EXT2, HSPG2, SLC26A2, B4GALT7, PAPSS2, AGRN, SDC3, B3GALT6, EXT1, B4GALT1
REACTOME_CASPASE_ACTIVATION_VIA_DEATH_RECEPTORS_IN_THE_PRESENCE_OF_LIGAND	0.00493827160493827	0.110375122019244	0.648317500304076	1.64133735989743	3	10	TNFRSF10B, FAS, TRAF2, TLR4, CFLAR, RIPK1, TRADD, CD14
REACTOME_HDL_ASSEMBLY	0.0116883116883117	0.157364397129792	0.739763868338735	1.63072411887877	8	6	ABCA1, ZDHHC8, BMP1, A2M
REACTOME_FCGAMMA_RECEPTOR_FCGR_DEPENDENT_PHAGOCYTOSIS	0.00102459016393443	0.0425686395783473	0.443373400786799	1.62948196138915	0	64	SRC, ACTG1, PLPP5, ACTB, FYN, MYH9, MYO10, ITPR1, ITPR3, ARPC1B, PLCG2, CYFIP1, FGR, VAV2, ARPC5, DOCK1, WIPF1, MYO1C, PLD2, ELMO1, MYO9B, CFL1, NCKIPSD, PLD3, PLD1, PRKCD, ARPC3, ABL1, PTK2, PLA2G6
REACTOME_A_TETRASACCHARIDE_LINKER_SEQUENCE_IS_REQUIRED_FOR_GAG_SYNTHESIS	0.0125427594070696	0.161119592875318	0.561859670241217	1.62572066705217	10	16	VCAN, B3GAT3, BGN, GPC3, SDC2, DCN, HSPG2, B4GALT7, XYLT2, AGRN, SDC3, B3GALT6
REACTOME_COLLAGEN_DEGRADATION	0.00635593220338983	0.127360008581849	0.4841199196157	1.62501228403441	5	34	MMP2, COL12A1, CTSK, MMP14, COL1A1, COL6A3, COL7A1, COL6A2, COL4A2, COL6A1, PHYKPL, COL18A1, COL16A1, COL4A1, COL8A1, COL5A1, ADAM10, COL1A2
REACTOME_RESOLUTION_OF_D_LOOP_STRUCTURES	0.0121012101210121	0.157364397129792	0.529934008961443	1.6237334475458	10	21	XRCC3, SPIDR, EME2, WRN, MRE11, RTEL1, RAD51D, ATM
REACTOME_G_ALPHA_S_SIGNALLING_EVENTS	0.00726895119418484	0.133799415585984	0.465726453371616	1.62344715123085	6	43	PTGIR, SRC, ADM, PDE8A, GRK3, RAMP3, GNB4, PDE1A, ADCY3, ADCY4, PTGER4, GNB1, ARRB1, PDE2A, GNAI2, GNAI3, GPR176, GRK5, CALCRL, GNG12, ADCY5, ARRB2
REACTOME_DAP12_INTERACTIONS	0.0117924528301887	0.157364397129792	0.581431043444533	1.6189671594269	9	14	FYN, B2M, PLCG2, VAV2, LCP2, NRAS, KRAS, SHC1
REACTOME_DAP12_SIGNALING	0.0117924528301887	0.157364397129792	0.581431043444533	1.6189671594269	9	14	FYN, B2M, PLCG2, VAV2, LCP2, NRAS, KRAS, SHC1
REACTOME_REGULATION_BY_C_FLIP	0.0127226463104326	0.161119592875318	0.6975609748903	1.61695052386737	9	7	TNFRSF10B, FAS, TRAF2, CFLAR, RIPK1, TRADD
REACTOME_RHOBTB2_GTPASE_CYCLE	0.0121012101210121	0.157364397129792	0.526994145071724	1.6147256178005	10	21	ACTG1, SRRM1, DDX39B, ACTN1, TWF1, PHIP, MYO6, RBMX, TMOD3, HNRNPC, RHOBTB2
REACTOME_COLLAGEN_CHAIN_TRIMERIZATION	0.00981461286804798	0.153881672478948	0.51337868854084	1.61425688362749	8	24	COL12A1, COL1A1, COL6A3, COL7A1, COL6A2, COL4A2, COL6A1, COL18A1, COL16A1, COL4A1, COL8A1, COL5A1, COL27A1, COL1A2
REACTOME_POLYMERASE_SWITCHING	0.00864197530864197	0.141033473335879	0.636879859506622	1.6123808268081	6	10	POLD1, RFC4, RFC2, POLA2, POLD2, POLD3, PCNA
REACTOME_DNA_STRAND_ELONGATION	0.0143329658213892	0.174531422271224	0.52295285480294	1.61206807939287	12	22	MCM3, POLD1, MCM5, RFC4, LIG1, RFC2, POLA2, MCM6, POLD2, POLD3, PCNA, MCM7, DNA2, MCM2
REACTOME_INTERFERON_ALPHA_BETA_SIGNALING	0.0127118644067797	0.161119592875318	0.483979258239329	1.60971856663715	11	32	PSMB8, EGR1, IFITM2, IRF3, STAT2, IFITM3, GBP2, MX1, IFIT5, ADAR, IRF1, IRF7, BST2, IFI6, SOCS3, IFNAR2, IP6K2, IFI27, OAS3, RNASEL, OAS2, ABCE1
REACTOME_NEF_AND_SIGNAL_TRANSDUCTION	0.0170454545454545	0.18608934169279	0.832576691315834	1.60880667294052	11	4	FYN, ELMO1
REACTOME_GP1B_IX_V_ACTIVATION_SIGNALLING	0.01625	0.182966497696613	0.672344384486463	1.60498223192527	12	8	SRC, COL1A1, FLNA, YWHAZ, VWF, COL1A2
REACTOME_SIGNALING_BY_ROBO_RECEPTORS	0.001001001001001	0.0425686395783473	0.404129299550793	1.60265525763818	0	182	RPL3, SRC, PSMB8, SRGAP2, ROBO3, RPL12, RPS8, RPS6, RPL36A, RPL31, RPS19, CAP1, PSMB9, CXCR4, PSME1, RPL35, RHOA, RPS27A, RPL34, RPS9, RPL24, RPS17, RPL35A, RPL36, RPL10A, RPL11, PSME2, PABPC1, RPL15, RPL13, RPL17, ZSWIM8, RPL28, CXCL12, RPS18, MYO9B, RPS4X, RPL26, RPL19, RPL13A, RPS11, RPL7A, RPL7, RPL37, CASC3, RPL32, RPS7, RPS2, RPL18A, RPL23, RPS24, RPL9, RPS16, UPF3A, RPS27, RPS3, FAU, RPS3A, ABL2, RPS5, EIF4A3, RPL29, RPL5, RPS12, NRP1, RPS21, NCBP1, RPL6, RPL14, RPS15, RPS20, PFN1, SLIT3, RPL41, ABL1, RPL4, RPL23A, RPLP2, RPS10, RPL27A, RNPS1, RPLP0, RPS25, NTN1, RPS13, RPL27, RPL22, RPS14, UBA52
REACTOME_DISSOLUTION_OF_FIBRIN_CLOT	0.0100125156445557	0.153881672478948	0.653315136398196	1.60231053600117	7	9	SERPINB8, S100A10, SERPINE1, SERPINF2, SERPINE2, PLAT, PLAU
REACTOME_EPHA_MEDIATED_GROWTH_CONE_COLLAPSE	0.0164126611957796	0.182966497696613	0.566332115214703	1.60108893620546	13	15	SRC, FYN, MYH9, RHOA, MYL9, MYL12B, ROCK1, EFNA1, MYL6
REACTOME_PROSTANOID_LIGAND_RECEPTORS	0.0148148148148148	0.175447022314172	0.896457765667575	1.60048831000788	9	3	PTGFR, PTGIR, PTGER4
REACTOME_RUNX3_REGULATES_CDKN1A_TRANSCRIPTION	0.0145888594164456	0.174955791335102	0.769782738454487	1.59951502889399	10	5	TGFB1, TP53, CDKN1A
REACTOME_TP53_REGULATES_TRANSCRIPTION_OF_DEATH_RECEPTORS_AND_LIGANDS	0.0139949109414758	0.1717360001578	0.689987130683792	1.59939430756767	10	7	TNFRSF10B, FAS, TP53, IGFBP3, TP63
REACTOME_SENSORY_PROCESSING_OF_SOUND_BY_OUTER_HAIR_CELLS_OF_THE_COCHLEA	0.0108932461873638	0.156717156717157	0.50326630865909	1.59770376770222	9	25	ACTG1, KCNQ4, ACTB, MYH9, EZR, TWF1, EPB41L3, MSN, MYO1C, SPTAN1, GSN
REACTOME_PARASITE_INFECTION	0.00726895119418484	0.133799415585984	0.457905937449505	1.59618609658602	6	43	SRC, ACTG1, ACTB, FYN, MYH9, MYO10, ARPC1B, CYFIP1, FGR, VAV2, ARPC5, DOCK1, WIPF1, MYO1C, ELMO1, MYO9B
REACTOME_SIGNALING_BY_NTRK3_TRKC	0.0131578947368421	0.16530910609858	0.581603892439643	1.59515412220587	10	13	SRC, BAX, NRAS, KRAS, NTRK3, SHC1, NELFB, PTPRS
REACTOME_INTERFERON_GAMMA_SIGNALING	0.00726895119418484	0.133799415585984	0.457603941126405	1.59513338620879	6	43	PML, VCAM1, CD44, IRF3, B2M, CIITA, GBP1, GBP2, TRIM22, SP100, TRIM38, IFI30, TRIM21, IRF1, TRIM35, IRF7, ICAM1, TRIM2, IFNGR1, TRIM62, PRKCD, SOCS3
REACTOME_RESPONSE_TO_ELEVATED_PLATELET_CYTOSOLIC_CA2	0.00100908173562059	0.0425686395783473	0.422907926127049	1.59466133255905	0	83	TGFB1, SERPING1, GAS6, ECM1, ACTN1, ACTN4, PROS1, HABP4, CAP1, FLNA, FERMT3, SERPINE1, TAGLN2, THBS1, CD109, PPIA, LGALS3BP, CLU, SYTL4, ANXA5, MAGED2, TMSB4X, SERPINF2, A2M, LHFPL2, SRGN, APP, GTPBP2, CFD, MMRN1, VEGFC, PECAM1, CFL1, FAM3C
REACTOME_PERK_REGULATES_GENE_EXPRESSION	0.0118534482758621	0.157364397129792	0.492575716113946	1.59092782274705	10	27	NFYA, EIF2AK3, CCL2, DDIT3, EXOSC9, EXOSC5, ASNS, EXOSC8, CEBPB, EXOSC4, EXOSC1, EXOSC6, EIF2S3, EXOSC3, DIS3, HSPA5, ATF6, KHSRP, PARN, HERPUD1, CEBPG
REACTOME_CELL_SURFACE_INTERACTIONS_AT_THE_VASCULAR_WALL	0.00204498977505112	0.0632795011192837	0.432020458445412	1.59031835159945	1	66	TNFRSF10B, TGFB1, SRC, ANGPT2, GAS6, ITGAM, CD74, CD44, FYN, PROS1, F11R, JAM3, COL1A1, ITGA5, PPIA, PROCR, SDC2, ESAM, MERTK, PECAM1, NRAS, CD47, ITGA3, SLC7A6, ITGB2, FN1, SIRPA, KRAS, INPP5D, COL1A2, ATP1B3, CD99, CD58, SDC3, SHC1, TEK, GLG1
REACTOME_NUCLEOTIDE_SALVAGE	0.0212765957446809	0.205371043072133	0.54061279154742	1.59027173769327	18	17	UPP1, AMPD2, TYMP, GMPR2, APRT, HPRT1, DGUOK, UCKL1, TK2
REACTOME_HS_GAG_DEGRADATION	0.0164126611957796	0.182966497696613	0.562110758135497	1.58915465253389	13	15	IDUA, GUSB, SGSH, GPC3, SDC2, HGSNAT, HSPG2, NAGLU, AGRN, GLB1, SDC3
