pathway	pval	padj	ES	NES	nMoreExtreme	size	leadingEdge
REACTOME_ROLE_OF_SECOND_MESSENGERS_IN_NETRIN_1_SIGNALING	0.729372937293729	0.928870844203118	0.532645713729688	0.845964269549143	441	2	NTN1, PITPNA
REACTOME_CELLULAR_RESPONSE_TO_HEAT_STRESS	0.792129162462159	0.954408478290882	0.223824533264995	0.843976445994858	784	83	EEF1A1, NUP85, NUP107, ATM, POM121C, HDAC6, SERPINH1, NUP160, NUP155, NUP54, NUP93, NUP50, RAE1, HSPA4L, AAAS, NUP205, POM121, CCAR2, TNFRSF21, NUP35, HSPA13, NUP133, TPR, RPA3, NUP43, HSPA5, NUP214, NUP153, DEDD2, HSF1, HSPB1, NUP62, NUP88, SEH1L, CAMK2D, COL4A6, NUP188, HSP90AB1, NUP98, HSPA12A, NUP58, SIRT1, BAG4, HSPB2, PTGES3
REACTOME_POU5F1_OCT4_SOX2_NANOG_ACTIVATE_GENES_RELATED_TO_PROLIFERATION	0.711111111111111	0.921179556339	0.472654729466719	0.843852770485049	479	3	FGF2, NR6A1, STAT3
REACTOME_RUNX3_REGULATES_IMMUNE_RESPONSE_AND_CELL_MIGRATION	0.729372937293729	0.928870844203118	0.531293961333008	0.843817374907184	441	2	CBFB, RORC
REACTOME_SYNTHESIS_OF_PIPS_AT_THE_LATE_ENDOSOME_MEMBRANE	0.69375	0.912889650872818	0.352749622297331	0.842063813082931	554	8	PIK3C2A, PIK3R4, PIKFYVE, MTMR2
REACTOME_DECTIN_1_MEDIATED_NONCANONICAL_NF_KB_SIGNALING	0.762886597938144	0.938925366406282	0.233525477303836	0.83939526889487	739	52	NFKB2, PSMB8, PSMB9, PSME1, RPS27A, PSME2
REACTOME_E2F_ENABLED_INHIBITION_OF_PRE_REPLICATION_COMPLEX_FORMATION	0.720159151193634	0.928870844203118	0.403490028474592	0.838403269277948	542	5	ORC2, ORC3, ORC5, MCM8, ORC4
REACTOME_METABOLISM_OF_LIPIDS	0.939060939060939	0.994336766912018	0.202936440934481	0.838272657348082	939	458	SPHK1, CERS5, PLA2G4B, ABCA1, SEC24D, FABP4, ACAD11, SREBF1, ARSG, OSBPL8, PIK3C2A, LPCAT2, ARSA, FDXR, PI4K2B, SMPD3, SIN3B, CHKB, SLC27A3, PPARG, UGCG, ACSL5, NFYA, PTEN, OSBPL5, PLPP3, ETNK1, KDSR, ABHD3, ACP6, HSD3B7, AHR, PGS1, FASN, SBF2, PLEKHA2, ELOVL5, OSBPL10, HILPDA, HELZ2, MED17, CPNE1, CYP1B1, VDR, STS, MED28, LPIN3, SLC25A17, MBTPS1, PLEKHA5, ORMDL1, ACACA, HSD17B11, SLC44A1, ACER3, MBOAT7, PLD2, SPTLC1, CCNC, AGK, GBA2, PLA2R1, ACOT7, PLA2G2A, CEPT1, RGL1, PIP4K2A, ACBD4, MTMR1, NR1H3, CERS2, SCAP, HEXA, STARD3, TNFAIP8L3, ORMDL2, LPIN2, ACOT9, CYP2R1, CPT1A, MED23, MED19, HACD3, GPX1, INPP5E, PON2, SUMF1, OSBPL2, GBA, PLD3, MVK, PLEKHA8, ALOX5, ANGPTL4, MED30, HACD2, PLD1, INPP5D, MED29, CTSA, MTMR12, PPT1, BDH2, SPTLC2, FAM120B, PTGR1, OCRL, SACM1L, PLB1, PLA2G6, PTGDS, CSNK2A2, CHKA, SRD5A3, GLB1, LPCAT4, EBP, SMPD4, GPX4, CHPT1, TNFRSF21, MSMO1, PTPN13, PIK3R4, SGPP1, DDHD1, PLBD1, PLA1A, GLA, SCD, MVD, SIN3A, MED8, GPAT2, SBF1, RAB14, LBR, INPP4B, PIKFYVE, ELOVL1, UBE2I, PLEKHA3, CDS2, INSIG1, MBOAT2, MED27, ESYT1, PLEKHA6, SUMO2, SELENOI, SGPL1, TBL1XR1, FAR1, FDPS, TIAM2, SMPD2, ACLY, DEGS1, SPHK2, ACAD10
REACTOME_FORMATION_OF_TUBULIN_FOLDING_INTERMEDIATES_BY_CCT_TRIC	0.704545454545455	0.917281407417057	0.305261924304838	0.8372361726549	588	13	TUBA1A, CCT3, CCT6B, CCT4, CCT8, CCT7, CCT6A, CCT2, CCT5, TCP1
REACTOME_RND1_GTPASE_CYCLE	0.710752688172043	0.921179556339	0.257915225177953	0.8370384748361	660	28	FLOT2, PKP4, RBMX, KIDINS220, PTPN13, LEMD3, WDR6, RASAL2, CPD, FRS3, CAV1, FRS2, DLG5, CCDC88A, DSP
REACTOME_THE_CANONICAL_RETINOID_CYCLE_IN_RODS_TWILIGHT_VISION	0.711688311688312	0.921179556339	0.379425474509784	0.836399693309716	547	6	RDH11, CYP4V2, RBP1, RDH10, NAPEPLD
REACTOME_CLEC7A_DECTIN_1_INDUCES_NFAT_ACTIVATION	0.697530864197531	0.915581557234404	0.33034620088987	0.83633337209996	564	10	ITPR1, ITPR3
REACTOME_FOXO_MEDIATED_TRANSCRIPTION_OF_OXIDATIVE_STRESS_METABOLIC_AND_NEURONAL_GENES	0.708930540242558	0.919866430495057	0.274785556824924	0.836274989860479	642	20	ATXN3, SREBF1, ABCA6, FOXO1, SIN3A, FOXO3, HDAC1
REACTOME_DISORDERS_OF_TRANSMEMBRANE_TRANSPORTERS	0.811811811811812	0.957753162590715	0.216668317681194	0.836137916938713	810	117	AVPR1A, ABCA1, PSMB8, CP, ABCD4, SLC33A1, NUP85, PSMB9, PSME1, NUP107, RPS27A, PSME2, POM121C, SLCO2A1, NUP160, NUP155, NUP54, SLC9A9, NUP93, NUP50, RAE1, OS9, SLC26A2, AAAS, NUP205, ERLIN1, POM121, SLC2A1, DERL2, ABCC8
REACTOME_UPTAKE_AND_FUNCTION_OF_ANTHRAX_TOXINS	0.701234567901235	0.917281407417057	0.329622765364466	0.83450185936929	567	10	ANTXR2, ANTXR1
REACTOME_APOPTOTIC_CLEAVAGE_OF_CELL_ADHESION_PROTEINS	0.722811671087533	0.928870844203118	0.401267006925007	0.83378410051709	544	5	TJP2, TJP1, CTNNB1, DSP
REACTOME_TAK1_ACTIVATES_NFKB_BY_PHOSPHORYLATION_AND_ACTIVATION_OF_IKKS_COMPLEX	0.70824295010846	0.919728129632233	0.259900248193079	0.830392467317657	652	26	NFKB2, SAA1, NOD1, RPS27A, APP, HMGB1, RELA, UBA52, NFKBIA, TRAF6, MAP3K7, NFKB1, TAB1
REACTOME_OPSINS	0.754980079681275	0.938925366406282	0.621521696828177	0.830329289428077	378	1	OPN4
REACTOME_METABOLISM_OF_AMINE_DERIVED_HORMONES	0.733333333333333	0.929944355885108	0.465060323374771	0.830294119272335	494	3	TPO, PNMT
REACTOME_MEMBRANE_TRAFFICKING	0.957042957042957	0.998916279133572	0.200921523464916	0.829957533493785	957	460	AMPH, RIN1, SRC, ACTG1, RAB27A, SEC24D, STX16, SH3GL1, PIK3C2A, DAB2, GDI1, ARFGAP1, TBC1D2, STX6, ACTB, HPS4, GRK3, TMED3, MAN1A1, MYH9, RAB31, RAB3IL1, CHMP4A, TRAPPC6A, CAPZA1, NECAP2, C2CD5, NECAP1, AP2A2, COL7A1, AGTR1, SBF2, RHOBTB3, RPS27A, RIN2, GJA1, DENND6A, GAK, FCHO2, NAPB, ARPC5, DNM1, ARFIP2, STON1, HIP1R, MYO1C, MYO6, TBC1D10A, FTL, SPTAN1, ALS2CL, SEC22A, ARF4, APP, ARRB1, YWHAZ, CBL, VPS54, DENND3, VPS28, PICALM, SGIP1, ASPSCR1, CTTN, MAN1C1, GJA4, RIN3, YWHAH, RAB13, PAFAH1B2, TSC2, KIF13B, RAB5C, AP3S1, YWHAQ, TUBA1A, AKT3, TBC1D16, SEC22B, TRAPPC2, EGFR, HIP1, HPS1, ARF5, VAMP4, TJP1, VAMP8, VPS53, ITSN2, AP4M1, DVL2, DYNLL1, ARRB2, ARPC3, GGA3, GPS1, BET1, CHMP2A, SYT11, OCRL, PLA2G6, HGS, TXNDC5, SEC16A, KDELR1, CTSC, DCTN6, KIFC2, COG3, RAB8B, NAPA, GORASP1, AP2M1, DENND2A, LDLR, BLOC1S3, CHMP5, VAMP2, AREG, UBA52, BLOC1S4, SBF1, BICD1, RAB14, AP2B1, KIF3B, KDELR2, COPE, LMAN2, CYTH2, RAB1A, DENND4A, ACTR3, RAB11A, COG8, VPS52, SEC31A, MON1B, USP6NL, ARPC1A, CPD, REPS1, COG1, SNAP23, GGA2, ARPC4, FNBP1L, SEC16B, RAB6B, EXOC3
REACTOME_PHOSPHOLIPASE_C_MEDIATED_CASCADE_FGFR4	0.737777777777778	0.930940576143602	0.463117944725574	0.826826299101986	497	3	FGF2, FGFR4, FGF1
REACTOME_METABOLISM_OF_STEROID_HORMONES	0.71863580998782	0.927895992830929	0.314799661510104	0.826368539352579	589	11	FDXR, HSD17B11, STARD3, SRD5A3
REACTOME_BETA_CATENIN_INDEPENDENT_WNT_SIGNALING	0.822289156626506	0.967075583164754	0.215160004512973	0.826139563074456	818	109	MOV10, PSMB8, GNB4, ITPR1, ITPR3, AP2A2, PSMB9, PSME1, RHOA, RPS27A, MYC, PSME2, GNB1, FZD6, TCF7L2, KRAS, GNG12, PFN1, FZD1, DVL2, ARRB2, PLCB2, GNB2, FZD8, AP2M1, AGO3, UBA52, SMURF2, AP2B1, TCF7L1, ITPR2, SMURF1, TNRC6A, PLCB3, CTNNB1, PSMB1, WNT11
REACTOME_IRE1ALPHA_ACTIVATES_CHAPERONES	0.762886597938144	0.938925366406282	0.235382165509721	0.825379387862998	739	44	PLA2G4B, PDIA5, ARFGAP1, SERP1, DDX11, MYDGF, EDEM1, SSR1, TPP1, DNAJC3, TATDN2, SHC1, SEC31A, CUL7, TLN1, DNAJB11, LMNA, SYVN1, HSPA5, WFS1
REACTOME_CHREBP_ACTIVATES_METABOLIC_GENE_EXPRESSION	0.72264631043257	0.928870844203118	0.355776887915006	0.82469296018823	567	7	FASN, ACACA
REACTOME_TRANSLOCATION_OF_SLC2A4_GLUT4_TO_THE_PLASMA_MEMBRANE	0.767250257466529	0.941752298539751	0.230643255517767	0.824508679246861	744	50	ACTG1, ACTB, MYH9, C2CD5, MYO1C, YWHAZ, ASPSCR1, YWHAH, RAB13, YWHAQ, TUBA1A
REACTOME_ERYTHROCYTES_TAKE_UP_OXYGEN_AND_RELEASE_CARBON_DIOXIDE	0.728693181818182	0.928870844203118	0.425985401459854	0.823141175572355	512	4	AQP1, HBA2, HBB, CA4
REACTOME_CDC6_ASSOCIATION_WITH_THE_ORC_ORIGIN_COMPLEX	0.728571428571429	0.928870844203118	0.373278016862901	0.8228483320124	560	6	ORC2, ORC3, ORC5, MCM8, ORC4
REACTOME_STAT5_ACTIVATION	0.736074270557029	0.930940576143602	0.395888925087916	0.822609099708005	554	5	STAT5A, GAB2, STAT5B, GRB2
REACTOME_TRANSPORT_TO_THE_GOLGI_AND_SUBSEQUENT_MODIFICATION	0.848697394789579	0.973130524694339	0.211398943923905	0.822194227674198	846	133	SEC24D, ARFGAP1, TMED3, MAN1A1, TRAPPC6A, CAPZA1, COL7A1, NAPB, MGAT5, SPTAN1, SEC22A, ARF4, FUCA1, MAN1C1, TUBA1A, SEC22B, TRAPPC2, ARF5, DYNLL1, BET1, MGAT4A, SEC16A, KDELR1, CTSC, DCTN6, COG3, NAPA, GORASP1, ST3GAL4, AREG, KDELR2, COPE, LMAN2, RAB1A, COG8, SEC31A, COG1, SEC16B, B4GALT1, COPB1, SCFD1, FUT8, TRAPPC6B, B4GALT4, TFG, CTSZ, MAN2A1, ARFGAP2, COPB2, TRAPPC1, SPTBN1, GOSR2, MGAT1, TRAPPC2L, SEC23IP, TRAPPC3, TMED7, CSNK1D, NAPG, ARF1, F8, COPG2, GOLGB1, B4GALT3, DYNC1I2, DYNC1LI2, TMED9, DCTN2, TMEM115, COPZ2, CD55, MIA3
REACTOME_NUCLEOTIDE_CATABOLISM	0.729759299781182	0.928870844203118	0.263516284578971	0.821887543483456	666	23	UPP1, NUDT5, NT5E, TYMP, DPYD, NT5C
REACTOME_CD28_DEPENDENT_PI3K_AKT_SIGNALING	0.725674091441969	0.928870844203118	0.290612595419985	0.821596725222783	618	15	MAP3K8, FYN, AKT3, RICTOR, PIK3R3, AKT1, PDPK1, AKT2, THEM4, MAP3K14, PIK3CA
REACTOME_ASSEMBLY_OF_THE_HIV_VIRION	0.729952830188679	0.928870844203118	0.294875244465613	0.821066130369677	618	14	RPS27A, PPIA, VPS28, UBA52, NMT2, VPS37B, MVB12A
REACTOME_STAT3_NUCLEAR_EVENTS_DOWNSTREAM_OF_ALK_SIGNALING	0.72987012987013	0.928870844203118	0.371979829549708	0.819986627821304	561	6	HIF1A, SIN3A, HDAC1, HDAC2, STAT3
REACTOME_HEDGEHOG_ON_STATE	0.806122448979592	0.957753162590715	0.221966548014035	0.819619352224513	789	68	EFCAB7, PSMB8, DZIP1, PSMB9, PSME1, RPS27A, BOC, PSME2, ARRB1, ULK3, GAS1, NUMB, EVC, ARRB2, PTCH1, CDC73, UBA52, SMURF2, SMURF1, SPOPL, PSMB1
REACTOME_DNA_REPLICATION_PRE_INITIATION	0.793456032719836	0.954408478290882	0.222243478700773	0.818104503599106	775	66	PSMB8, POLE, MCM3, CDK2, PSMB9, PSME1, RPS27A, PSME2, MCM5
REACTOME_EARLY_PHASE_OF_HIV_LIFE_CYCLE	0.725943970767357	0.928870844203118	0.311000801544956	0.816396297497091	595	11	CXCR4, PPIA, LIG1
REACTOME_REGULATION_OF_TP53_ACTIVITY	0.848848848848849	0.973130524694339	0.211145574625691	0.816071678643278	847	124	PML, WRN, TP53, MAPK11, PPP2R1B, BANP, MRE11, CDK2, TAF1, L3MBTL1, TP53INP1, RPS27A, BRD1, ATM, MDM4, RFC4, MDM2, PRKAA1, PIP4K2A, RFC2, AKT3, CHD3, TP63, SUPT16H, KAT5, TAF12, EHMT2, RAD9A, CSNK2A2, CDK5R1, TAF4B, GATAD2A, DNA2, TBP, TAF9, UBA52, MTA2, ATRIP, TAF10, RBBP4, TAF9B, GATAD2B, HDAC1, KAT6A, BRPF1, RICTOR, RPA3, TAF4, BARD1
REACTOME_SMOOTH_MUSCLE_CONTRACTION	0.76271186440678	0.938925366406282	0.24533421971993	0.815983416213515	719	32	SORBS3, ANXA1, MYL9, MYL12B, MYL5, CALD1, MYL6, MYLK, PXN, ITGA1, ANXA2, TLN1, ITGB5, ACTA2, GUCY1A2
REACTOME_HIGHLY_SODIUM_PERMEABLE_POSTSYNAPTIC_ACETYLCHOLINE_NICOTINIC_RECEPTORS	0.762376237623762	0.938925366406282	0.513768609516396	0.815983073295483	461	2	CHRNG, CHRND
REACTOME_METABOLISM_OF_NITRIC_OXIDE_NOS3_ACTIVATION_AND_REGULATION	0.73938679245283	0.931145021839961	0.292921846865312	0.815626987413953	626	14	NOSTRIN, CYGB, DDAH2, ZDHHC21, CAV1, NOSIP, AKT1, WASL
REACTOME_INTERLEUKIN_20_FAMILY_SIGNALING	0.724691358024691	0.928870844203118	0.321881853927781	0.814904290069174	586	10	STAT2, STAT5A, SOCS3, IL10RB, STAT3, STAT5B, JAK2
REACTOME_AUF1_HNRNP_D0_BINDS_AND_DESTABILIZES_MRNA	0.785345717234262	0.951760297504436	0.228566203803235	0.814731079984607	760	49	PSMB8, PSMB9, PSME1, RPS27A, PSME2, PABPC1
REACTOME_CELLULAR_HEXOSE_TRANSPORT	0.72875	0.928870844203118	0.341220260055531	0.814541576011444	582	8	SLC2A3, SLC50A1, SLC2A1
REACTOME_EGFR_INTERACTS_WITH_PHOSPHOLIPASE_C_GAMMA	0.76	0.938925366406282	0.455821752147535	0.813800062534085	512	3	EGFR, AREG
REACTOME_SUMO_IS_CONJUGATED_TO_E1_UBA2_SAE1	0.738636363636364	0.930940576143602	0.420968955279189	0.813447783751421	519	4	SAE1, SUMO2, UBA2
REACTOME_CLEC7A_DECTIN_1_SIGNALING	0.833164812942366	0.971074503125565	0.2160909014961	0.813076041885467	823	81	SRC, NFKB2, PSMB8, ITPR1, ITPR3, PLCG2, PSMB9, PSME1, RPS27A, PSME2
REACTOME_SIGNALING_BY_NOTCH4	0.80952380952381	0.957753162590715	0.218751984665252	0.812976071001472	798	72	PSMB8, NOTCH2, MAML2, RBPJ, PSMB9, JAG1, PSME1, RPS27A, PSME2, FLT4, KAT2A, YWHAZ, MAML3, DLL4, NOTCH1, ADAM10
REACTOME_G2_M_CHECKPOINTS	0.844758064516129	0.973130524694339	0.212178181856306	0.810471425669361	837	97	PSMB8, WRN, TP53, MDC1, MRE11, MCM3, CDK2, PSMB9, PSME1, RPS27A, PSME2, ATM, MCM5, RFC4, YWHAZ, YWHAH, RFC2, YWHAQ, UIMC1, ORC2, MCM6, KAT5, RAD9A, MCM7, DNA2, MCM2, UBA52
REACTOME_N_GLYCAN_ANTENNAE_ELONGATION_IN_THE_MEDIAL_TRANS_GOLGI	0.746462264150943	0.936331033400114	0.291027350850489	0.81035185312891	632	14	MGAT5, FUCA1, MGAT4A, ST3GAL4, B4GALT1, FUT8, B4GALT4, MAN2A1, B4GALT3
REACTOME_DOPAMINE_NEUROTRANSMITTER_RELEASE_CYCLE	0.72962962962963	0.928870844203118	0.319931477829849	0.809966547136295	590	10	CPLX1, LIN7C, VAMP2, CASK, SYN2, TSPOAP1, PPFIA4, APBA1, PPFIA1
REACTOME_CONSTITUTIVE_SIGNALING_BY_ABERRANT_PI3K_IN_CANCER	0.771276595744681	0.945724903999868	0.243220997943193	0.809501294345829	724	33	SRC, FYN, PDGFRA, PDGFRB, FGF2, EGFR, FGFR1, GAB2, AREG, ERBB3, PIK3R3, FRS2, ERBB2, FGFR4, PDGFB, RHOG, FGF1
REACTOME_TYROSINE_CATABOLISM	0.776892430278884	0.947007429255127	0.60585717065577	0.809402079722704	389	1	FAH
REACTOME_TRANSFERRIN_ENDOCYTOSIS_AND_RECYCLING	0.757442116868798	0.938925366406282	0.262513223432582	0.809230094123228	686	22	STEAP2, TCIRG1, ATP6V0A1, ATP6V1C1, ATP6AP1, ATP6V1A, ATP6V1B2, ATP6V0A2, ATP6V0D1, ATP6V1F, ATP6V0B, MCOLN1, ATP6V1G1
REACTOME_MICRORNA_MIRNA_BIOGENESIS	0.751929437706725	0.938925366406282	0.265728181902229	0.808710018072438	681	20	DICER1, POLR2H, DGCR8, XPO5, AGO3, POLR2A, POLR2K, POLR2G, DROSHA
REACTOME_PRC2_METHYLATES_HISTONES_AND_DNA	0.733333333333333	0.929944355885108	0.319097828935844	0.807856008589788	593	10	EZH2, SUZ12, RBBP4, AEBP2, PHF1, EED, PHF19
REACTOME_SIGNALING_BY_ERBB2_IN_CANCER	0.753058954393771	0.938925366406282	0.267917196349258	0.806027556438289	676	19	PTPN12, NRAS, EGFR, KRAS, SHC1, ERBB3, CDC37, ERBIN, ERBB2
REACTOME_SYNTHESIS_OF_DNA	0.844064386317907	0.973130524694339	0.211239524831327	0.805821762957708	838	94	PSMB8, POLE, MCM3, CDK2, POLD1, PSMB9, PSME1, RPS27A, PSME2, MCM5, ANAPC2, RFC4, ANAPC7, LIG1, RFC2, POLA2, ORC2, MCM6, POLD2, POLD3, PCNA, MCM7, DNA2, MCM2, UBA52
REACTOME_MITOCHONDRIAL_IRON_SULFUR_CLUSTER_BIOGENESIS	0.727272727272727	0.928870844203118	0.29907965877395	0.805139593392398	607	12	FDXR, SLC25A37, LYRM4, SLC25A28
REACTOME_M_PHASE	0.943	0.996508010680908	0.200045008589361	0.80502054338965	942	258	PSMB8, PHF8, HAUS5, CSNK1E, EML4, OFD1, PPP2R1B, CEP131, CHMP4A, IST1, NUP85, TMPO, TUBGCP2, PSMB9, PSME1, NUP107, RPS27A, PSME2, HAUS4, RCC2, LPIN3, MAU2, TUBGCP6, POM121C, ANAPC2, CNTRL, ITGB3BP, ODF2, CEP164, NUP160, ANAPC7, CEP192, NUP155, KNTC1, SFI1, LPIN2, NUP54, NUMA1, RPS27, NUP93, TUBA1A, CEP290, NUP50, RAE1, NDEL1, LEMD2, BUB3, CENPC, AAAS, ALMS1, NUP205, RANGAP1, DYNLL1, POM121, CHMP2A, HAUS6, TUBG2, CSNK2A2, TUBGCP3, MAD1L1, NIPBL, NUP35, GORASP1, LEMD3, NUDC, CC2D1B, MZT2B, SDCCAG8, HAUS3, UBA52, LBR, UBE2I, RAB1A, NUP133, MAPRE1, ANAPC10, ANKLE2, NINL, TUBB, NEK6, PDS5B, LMNA, PSMB1, NDE1, CENPP, TPR, PPP2R2D, CDK5RAP2, SMC1A, CEP78, CEP57, EMD, NUP43
REACTOME_SYNTHESIS_OF_PA	0.753812636165577	0.938925366406282	0.253560092534656	0.804969274142222	691	25	PLA2G4B, ACP6, PLD2, PLA2R1, PLA2G2A, PLD1, LPCAT4, DDHD1, GPAT2
REACTOME_COPI_DEPENDENT_GOLGI_TO_ER_RETROGRADE_TRAFFIC	0.804503582395087	0.957753162590715	0.221825549031486	0.804412262635565	785	55	ARFGAP1, TMED3, NAPB, ARF4, KIF13B, TUBA1A, SEC22B, ARF5, KDELR1, KIFC2, NAPA, KIF3B, KDELR2, COPE, RAB1A, COPB1, KLC1, KIF26A, RINT1, KIF2A, ARFGAP2, COPB2, TMED7, NAPG, ARF1, USE1, COPG2, SURF4, KIF3C, TMED9, COPZ2, STX18
REACTOME_TCR_SIGNALING	0.83030303030303	0.970242543428384	0.21452601943067	0.804092373848398	821	78	PSMB8, PAG1, PTEN, PLCG2, PSMB9, PSME1, PTPRC, RPS27A, PSME2, LCP2
REACTOME_PURINE_CATABOLISM	0.736842105263158	0.930940576143602	0.292752863481332	0.802927805401991	615	13	NUDT5, NT5E, NT5C, ITPA, NUDT1, ADPRM
REACTOME_NOREPINEPHRINE_NEUROTRANSMITTER_RELEASE_CYCLE	0.748091603053435	0.9368900376848	0.346256936738467	0.80262565625897	587	7	CPLX1, VAMP2, TSPOAP1, PPFIA4, PPFIA1, MAOA
REACTOME_NEURONAL_SYSTEM	0.901901901901902	0.986180312113229	0.204080527667167	0.802440650713682	900	154	SRC, CPLX1, KCNQ4, FLOT2, PTPRF, GNB4, DBNL, GABBR1, CAMKK2, ADCY3, AP2A2, CAMK1, ADCY4, EPB41L3, GNB1, PRKX, MYO6, ARHGEF7, PPM1F, GLS, MDM2, PRKAA1, PPFIBP2, ABAT, NRAS, GNAI2, GNAI3, LRFN4, TUBA1A, LIN7C, CHRNA1, DNAJC5, KRAS, GNG12, ADCY5, CAMKK1, EPB41L2, PLCB2, ABCC8, KCNJ8, NTRK3, CREB1, GNB2, AP2M1, SHARPIN, VAMP2, SIPA1L1, AP2B1, PRKAR1A, ARHGEF9, PTPRS, ADCY6, ALDH2, PLCB3, EPB41L1, GNAI1, NAAA
REACTOME_MITOTIC_G2_G2_M_PHASES	0.881881881881882	0.981941817632074	0.204889119757469	0.800609172506367	880	140	PSMB8, HAUS5, TP53, LIN37, CSNK1E, OFD1, PPP2R1B, CDKN1A, CEP131, CDK2, CDC25B, TUBGCP2, PSMB9, PSME1, RPS27A, PSME2, HAUS4, TUBGCP6, CNTRL, ODF2, CEP164, CEP192, PHLDA1, SFI1, TUBA1A, CEP290, ALMS1, DYNLL1, HAUS6, FBXL7, TUBG2, TUBGCP3, MZT2B, SDCCAG8, HAUS3, UBA52, CDK11A, MAPRE1, NINL, RBBP4, TUBB, PSMB1, NDE1, CDK5RAP2, CEP78, CEP57, CCNH, PPP1R12A, CENPJ, LCMT1
REACTOME_MRNA_CAPPING	0.762527233115468	0.938925366406282	0.251722504721081	0.799135541737097	699	25	POLR2H, NCBP1, SUPT5H, GTF2F1, NCBP2, GTF2H4, RNMT, CCNH, POLR2A, GTF2H1, POLR2K, POLR2G, GTF2H3, RNGTT, ERCC3
REACTOME_MITOTIC_G1_PHASE_AND_G1_S_TRANSITION	0.866197183098592	0.97942152917505	0.208089812666024	0.798140503826514	860	108	SRC, PSMB8, LIN37, PPP2R1B, POLE, CDKN1A, MCM3, CDK2, PSMB9, PSME1, RPS27A, MYC, CCND2, PSME2, MCM5, CCND3
REACTOME_TRANSLATION_OF_SARS_COV_1_STRUCTURAL_PROTEINS	0.75704989154013	0.938925366406282	0.249224441595525	0.796282806235059	697	26	MOGS, PRKCSH, RPS27A, ST6GALNAC4, PARP16, GANAB, PARP10, PARP4, ST3GAL4, UBA52, UBE2I
REACTOME_ACTIVATION_OF_KAINATE_RECEPTORS_UPON_GLUTAMATE_BINDING	0.733253588516746	0.929944355885108	0.295328652486548	0.795041669349582	612	12	GNB4, GNB1, GNG12, PLCB2, GNB2, PLCB3
REACTOME_INTERLEUKIN_27_SIGNALING	0.757142857142857	0.938925366406282	0.360519766139597	0.794724239907287	582	6	CRLF1, IL6ST, STAT3, JAK2, CANX
REACTOME_ACETYLCHOLINE_NEUROTRANSMITTER_RELEASE_CYCLE	0.757142857142857	0.938925366406282	0.360507674335638	0.794697584920201	582	6	CPLX1, VAMP2, TSPOAP1, PPFIA4, PPFIA1
REACTOME_SENESCENCE_ASSOCIATED_SECRETORY_PHENOTYPE_SASP	0.803534303534304	0.957753162590715	0.228876725830685	0.794374439606009	772	42	CDKN1A, CDK2, RPS27A, JUN, ANAPC2, ANAPC7, IGFBP7, CEBPB, FOS, EHMT2, RELA, CDK6, UBA52, ANAPC10, MAPK7, NFKB1, EHMT1, CDKN2B, ANAPC4, FZR1, CDK4, CDKN1B, STAT3, ANAPC1
REACTOME_NEGATIVE_REGULATION_OF_THE_PI3K_AKT_NETWORK	0.830246913580247	0.970242543428384	0.217165906212237	0.794000985081449	806	62	SRC, FYN, PPP2R1B, PTEN, PDGFRA, MYD88, IRAK4, PDGFRB, PIP4K2A, FGF2, AKT3, EGFR, FGFR1, GAB2, AREG, IL1RL1, TRAF6, PHLPP2, ERBB3, PIK3R3, IER3, FRS2, ERBB2, AKT1, FGFR4, PIP5K1B, PDGFB, PPP2R1A
REACTOME_ACTIVATION_OF_NIMA_KINASES_NEK9_NEK6_NEK7	0.788148148148148	0.952395815662991	0.444612732101098	0.793788070627688	531	3	NEK6, NEK9, NEK7
REACTOME_DEFECTIVE_FACTOR_IX_CAUSES_HEMOPHILIA_B	0.793729372937294	0.954408478290882	0.499075605721514	0.792647193737222	480	2	GGCX, F8
REACTOME_MATURATION_OF_SARS_COV_2_NUCLEOPROTEIN	0.745215311004785	0.935508197716554	0.288688568855562	0.791780740517399	622	13	PARP16, PARP10, PARP4, UBE2I, PARP9, SRPK2
REACTOME_RNA_POLYMERASE_III_TRANSCRIPTION	0.799366420274551	0.956460350184894	0.233173542839224	0.790886892996642	756	37	POU2F1, SNAPC4, POLR2H, POLR1C, SNAPC2, BRF1, TBP, GTF3C2, POLR3C, BDP1, SSB, GTF3C3, CRCP, GTF3C5, SNAPC1, POLR2K, NFIB, POLR3H
REACTOME_NEF_MEDIATED_DOWNREGULATION_OF_MHC_CLASS_I_COMPLEX_CELL_SURFACE_EXPRESSION	0.775862068965517	0.947007429255127	0.380335309713579	0.790290576179098	584	5	B2M, PACS1, AP1S1
REACTOME_ORC1_REMOVAL_FROM_CHROMATIN	0.834871794871795	0.971074503125565	0.217305512053035	0.789680335026801	813	59	PSMB8, MCM3, CDK2, PSMB9, PSME1, RPS27A, PSME2, MCM5
REACTOME_SHC1_EVENTS_IN_ERBB2_SIGNALING	0.752565564424173	0.938925366406282	0.272338329173938	0.788001121309257	659	16	PTPN12, NRAS, EGFR, KRAS, PRKCD, SHC1, ERBB3
REACTOME_REGULATION_OF_MRNA_STABILITY_BY_PROTEINS_THAT_BIND_AU_RICH_ELEMENTS	0.858442871587462	0.975029353280238	0.209862633740382	0.787690242470554	848	79	PSMB8, MAPK11, ZFP36L1, ZFP36, PSMB9, PSME1, RPS27A, PSME2, PABPC1, YWHAZ, EXOSC9, EXOSC5, TNFSF13, EXOSC8, HNRNPD, ANP32A, PRKCD, EXOSC4, EXOSC1, EXOSC6
REACTOME_NEUROFASCIN_INTERACTIONS	0.774147727272727	0.947007429255127	0.407488216311774	0.787398648538821	544	4	CNTNAP1, SDCBP, NFASC
REACTOME_DEPOLYMERISATION_OF_THE_NUCLEAR_LAMINA	0.761266747868453	0.938925366406282	0.299510125692587	0.786232564236562	624	11	TMPO, LPIN3, LPIN2, LEMD2, LEMD3, LMNA, EMD
REACTOME_SODIUM_PROTON_EXCHANGERS	0.762086513994911	0.938925366406282	0.339161406212763	0.786178173940369	598	7	SLC9A9, SLC9A1, SLC9A5, SLC9A8
REACTOME_BASIGIN_INTERACTIONS	0.759671746776084	0.938925366406282	0.278056393648444	0.786098834149528	647	15	PPIA, ITGA3, SLC7A6, ATP1B3, CAV1, ATP1B2, PPIL2, SLC3A2, ITGA6, SLC7A8
REACTOME_RAP1_SIGNALLING	0.748803827751196	0.937040679312366	0.291631393358297	0.785088435741555	625	12	RAPGEF3, YWHAZ, RAP1B, SIPA1, RAP1GAP2, RASGRP2, PRKACB, YWHAB
REACTOME_WNT_MEDIATED_ACTIVATION_OF_DVL	0.763358778625954	0.938925366406282	0.338418480268083	0.784456067144422	599	7	CSNK1E, DVL2, CSNK2A2, DVL3, PIP5K1B
REACTOME_PHOSPHATE_BOND_HYDROLYSIS_BY_NUDT_PROTEINS	0.779220779220779	0.947090667524901	0.355347076774555	0.783321642851573	599	6	NUDT5, NUDT1, ADPRM
REACTOME_RETROGRADE_TRANSPORT_AT_THE_TRANS_GOLGI_NETWORK	0.811728395061728	0.957753162590715	0.221795358541754	0.782688426064042	788	45	STX16, STX6, RHOBTB3, NAPB, ARFIP2, VPS54, VAMP4, VPS53, COG3, NAPA, COG8, VPS52, USP6NL, COG1, RAB6B
REACTOME_CA_DEPENDENT_EVENTS	0.779569892473118	0.947090667524901	0.240949251553064	0.781977077521194	724	28	PDE1A, CAMKK2, ADCY3, ADCY4, PRKX, ADCY5, PRKCD, CAMKK1, CREB1, PRKAR1A, ADCY6
REACTOME_ACTIVATED_TAK1_MEDIATES_P38_MAPK_ACTIVATION	0.776185226019846	0.947007429255127	0.256881414337424	0.781786003065826	703	20	MAPK11, NOD1, RPS27A
REACTOME_TRANSCRIPTIONAL_REGULATION_BY_MECP2	0.813152400835073	0.957753162590715	0.226899217720856	0.780393768803138	778	40	MOV10, PPARG, PTEN, SLC2A3, NOTCH1, DGCR8, DLL1, CREB1, AGO3, SIN3A, LBR, TBL1XR1, RBFOX1, TNRC6A, HDAC1, MECP2, TBL1X, TNRC6C
REACTOME_RESOLUTION_OF_SISTER_CHROMATID_COHESION	0.853061224489796	0.973130524694339	0.211039841466283	0.779272100700604	835	68	PPP2R1B, NUP85, NUP107, RCC2, ITGB3BP, NUP160, KNTC1, RPS27, TUBA1A, NDEL1, BUB3, CENPC, RANGAP1, DYNLL1, MAD1L1, NUDC, NUP133, MAPRE1, PDS5B, NDE1, CENPP, SMC1A, NUP43, KIF2A, HDAC8, AHCTF1, PPP2R1A, SEH1L, STAG2, XPO1, DYNC1I2, MIS12, DYNC1LI2, NUP98, STAG1, DSN1, SMC3, SKA2, ZW10
REACTOME_INSULIN_RECEPTOR_RECYCLING	0.781979977753059	0.949290111029979	0.258915057492673	0.77894466633581	702	19	TCIRG1, ATP6V0A1, ATP6V1C1, ATP6AP1, ATP6V1A, ATP6V1B2, ATP6V0A2, ATP6V0D1, ATP6V1F, ATP6V0B, ATP6V1G1, INSR
REACTOME_HEDGEHOG_OFF_STATE	0.86491935483871	0.978919579348457	0.206278800834856	0.778859729750526	857	84	PSMB8, IFT122, IFT140, OFD1, ADCY3, PSMB9, PSME1, ADCY4, TULP3, RPS27A, PSME2, DYNC2H1, IFT88, TUBA1A, WDR19, NUMB, ADCY5, IFT172, PTCH1
REACTOME_PI3K_AKT_SIGNALING_IN_CANCER	0.849948612538541	0.973130524694339	0.214029797560479	0.776537166462292	826	58	SRC, FYN, CDKN1A, PTEN, PDGFRA, MDM2, PDGFRB, FGF2, TSC2, AKT3, EGFR, FGFR1, CREB1, FOXO1, GAB2, AREG, FOXO3, ERBB3, RICTOR, PIK3R3, NR4A1, FRS2, ERBB2, AKT1, FGFR4
REACTOME_MISCELLANEOUS_TRANSPORT_AND_BINDING_EVENTS	0.774912075029308	0.947007429255127	0.274659162271217	0.77649445285862	660	15	LRRC8B, TUSC3, CTNS, NIPAL2, ADD3, LRRC8C, LRRC8A
REACTOME_SIGNALING_BY_THE_B_CELL_RECEPTOR_BCR	0.868686868686869	0.980010455646049	0.205954666115571	0.771964989708595	859	78	PSMB8, FYN, ITPR1, ITPR3, PLCG2, PSMB9, PSME1, RPS27A, PPIA, PSME2
REACTOME_NEUROTRANSMITTER_RELEASE_CYCLE	0.793179317931793	0.954408478290882	0.251394504654176	0.770280183633002	720	21	CPLX1, GLS, ABAT, LIN7C, DNAJC5, VAMP2, NAAA, CASK, SYN2, TSPOAP1, PPFIA4, APBA1, SLC1A7, PPFIA1
REACTOME_FRUCTOSE_METABOLISM	0.794034090909091	0.954408478290882	0.398550005400773	0.770127142492882	558	4	TKFC, GLYCTK
REACTOME_RAS_PROCESSING	0.787210584343991	0.951989576024857	0.252977342713352	0.769904456249608	713	20	BCL2L1, RPS27A, RCE1, NRAS, KRAS, ZDHHC9, UBA52
REACTOME_THYROXINE_BIOSYNTHESIS	0.828382838283828	0.970242543428384	0.48469897482806	0.769813787330557	501	2	TPO, DIO2
REACTOME_SYNTHESIS_OF_SUBSTRATES_IN_N_GLYCAN_BIOSYTHESIS	0.834890965732087	0.971074503125565	0.220715053440766	0.76937700692785	803	43	AMDHD2, GFPT2, NAGK, ST6GALNAC4, DPM2, CTSA, PMM1, SRD5A3, GLB1, ST3GAL4, MVD, GMPPA, GMPPB, DHDDS, ALG5, ST6GALNAC6, NEU1, MPI, SLC35A1, ST8SIA5, DPM3, NUS1
REACTOME_GLUTAMATE_NEUROTRANSMITTER_RELEASE_CYCLE	0.78641975308642	0.951760297504436	0.303621872743474	0.768675722592944	636	10	CPLX1, GLS, VAMP2, TSPOAP1, PPFIA4, SLC1A7, PPFIA1
REACTOME_REGULATION_OF_SIGNALING_BY_CBL	0.798349056603774	0.955977213110974	0.275826360853847	0.76802541756478	676	14	FYN, RPS27A, CBL, UBA52, PIK3R3, YES1
REACTOME_SYNTHESIS_OF_PI	0.848605577689243	0.973130524694339	0.574041642342868	0.766897746967071	425	1	PITPNM2
REACTOME_CELL_CYCLE_CHECKPOINTS	0.938938938938939	0.994336766912018	0.193797000559667	0.766491238845282	937	175	PSMB8, WRN, TP53, MDC1, PPP2R1B, CDKN1A, MRE11, MCM3, CDK2, NUP85, PSMB9, PSME1, NUP107, RPS27A, PSME2, RCC2, ATM, MCM5, ANAPC2, MDM4, RFC4, ITGB3BP, MDM2, NUP160, ANAPC7, YWHAZ, KNTC1, YWHAH, RFC2, RPS27, YWHAQ, UIMC1, NDEL1, ORC2, BUB3, MCM6, CENPC, RANGAP1, KAT5, DYNLL1
REACTOME_ALPHA_PROTEIN_KINASE_1_SIGNALING_PATHWAY	0.790123456790123	0.954054486726747	0.302603302749297	0.766097021594854	639	10	ALPK1, RPS27A, UBA52, TRAF6, MAP3K7, TAB1
REACTOME_HUR_ELAVL1_BINDS_AND_STABILIZES_MRNA	0.78625	0.951760297504436	0.320881101664412	0.765989095194648	628	8	TNFSF13, ANP32A, PRKCD, NUP214, XPO1, ELAVL1, SET
REACTOME_NEGATIVE_REGULATION_OF_MET_ACTIVITY	0.776510832383124	0.947007429255127	0.264647068122242	0.765746735188131	680	16	SH3GL1, RPS27A, CBL, HGS, UBA52, SH3KBP1, STAM2, USP8, STAM
