pathway	pval	padj	ES	NES	nMoreExtreme	size	leadingEdge
REACTOME_ACTIVATION_OF_ANTERIOR_HOX_GENES_IN_HINDBRAIN_DEVELOPMENT_DURING_EARLY_EMBRYOGENESIS	0.415463917525773	0.76843578956255	0.299752459572946	1.05109705765932	402	44	ZNF335, EZH2, MEIS1, JUN, POLR2H, PCGF2, CNOT9, KDM6A, HOXB3, SUZ12, RBBP4, PAGR1, PKNOX1, POLR2A, POLR2K, PAXIP1, POLR2G, PIAS2, EED, HOXA3, RARG, CNOT6
REACTOME_RHOU_GTPASE_CYCLE	0.416313559322034	0.76843578956255	0.31591473773739	1.05073473739387	392	32	PTK2B, SRC, SRGAP2, IQGAP1, MYO6, ARHGEF7, SPTAN1, ARHGAP31, ITSN2, PEAK1, HGS
REACTOME_SIGNALING_BY_FGFR2_IN_DISEASE	0.428884026258206	0.775912472647702	0.336855478494883	1.05062699321011	391	23	NRAS, FGF2, POLR2H, NCBP1, KRAS, GTF2F1, NCBP2, POLR2A, FRS2, POLR2K, POLR2G
REACTOME_NUCLEAR_ENVELOPE_NE_REASSEMBLY	0.403292181069959	0.760375304214167	0.29109666767998	1.05040734322421	391	53	CHMP4A, IST1, NUP85, TMPO, NUP107, NUP160, NUP155, NUP54, NUP93, TUBA1A, LEMD2, NUP205, RANGAP1, POM121, CHMP2A, NUP35, LEMD3, CC2D1B, LBR, UBE2I, NUP133, ANKLE2, LMNA, EMD, NUP43
REACTOME_DUAL_INCISION_IN_GG_NER	0.416313559322034	0.76843578956255	0.315494005310716	1.04933537825343	392	32	DDB2, POLE, POLD1, RPS27A, RFC4, RFC2, POLD2, POLD3, PCNA, CUL4B, UBA52, XPA, GTF2H4, POLK, RPA3, PARP2, PARP1, GTF2H1
REACTOME_HIV_LIFE_CYCLE	0.405405405405405	0.760375304214167	0.270213914298707	1.04924316033105	404	129	NELFE, CHMP4A, TAF1, NUP85, NELFA, CXCR4, NUP107, RPS27A, CCNT2, PPIA, POM121C, NUP160, NUP155, VPS28, LIG1, POLR2H, NUP54, CDK9, NUP93, NUP50, RAE1, NCBP1, RANBP1, AAAS, NUP205, SUPT16H, RANGAP1, TAF12, POM121, CCNT1, CHMP2A, SUPT5H, TAF4B, NUP35, GTF2F1, NELFCD, TBP, CHMP5, TAF9, UBA52, PDCD6IP, NELFB, TAF10, NUP133, GTF2B, TAF9B, XRCC5, NCBP2, GTF2H4, NMT2, RNMT, TPR, VPS4B, NUP43, TAF4, CCNH, POLR2A, NUP214, VPS37B, NUP153, MVB12A, GTF2H1, POLR2K, POLR2G, CTDP1, NUP62, NUP88, PSIP1, SEH1L, XPO1, ELL, TCEA1, GTF2H3, XRCC6, NUP188, SSRP1, RNGTT, NUP98, NUP58
REACTOME_NUCLEOTIDE_EXCISION_REPAIR	0.416498993963783	0.76843578956255	0.275187265077534	1.04906948516541	413	92	DDB2, ACTB, POLE, POLD1, INO80D, XAB2, ACTR5, RPS27A, AQR, INO80B, HMGN1, UVSSA, RFC4, LIG1, ACTL6A, XPC, POLR2H, RFC2, PIAS3, INO80E, ZNF830, POLD2, GPS1, POLD3, PCNA, CUL4B, UBA52, XRCC1, UBE2I, SUMO2, XPA, GTF2H4, NFRKB, RUVBL1, POLK, RPA3, CCNH, POLR2A, PARP2, PPIE, PARP1, GTF2H1, POLR2K, POLR2G, CETN2, ERCC6, COPS6, RBX1, COPS7B, PRPF19, ELL, TCEA1, GTF2H3
REACTOME_FRUCTOSE_CATABOLISM	0.404444444444444	0.760375304214167	0.586942669465997	1.0478964175469	272	3	TKFC, GLYCTK, ALDH1A1
REACTOME_CARGO_TRAFFICKING_TO_THE_PERICILIARY_MEMBRANE	0.404435058078142	0.760375304214167	0.308615133228429	1.04668760055073	382	36	ASAP1, PKD2, ARF4, NPHP3, BBS1, BBIP1, INPP5E, BBS7, ARL3, CCT3, CCT4, RAB11A, EXOC3, BBS10, RAB11FIP3, CCT8, EXOC7, LZTFL1, PKD1, PDE6D, SMO
REACTOME_GLUCAGON_TYPE_LIGAND_RECEPTORS	0.43125	0.778413625997719	0.438413766351423	1.04655638012492	344	8	GNB4, GNB1, GNG12, GNB2
REACTOME_BUTYROPHILIN_BTN_FAMILY_INTERACTIONS	0.40053050397878	0.757514680762734	0.503601323729803	1.04642238080577	301	5	PPL, BTN3A1, BTN3A3, BTN3A2, BTNL9
REACTOME_REGULATION_OF_TP53_ACTIVITY_THROUGH_PHOSPHORYLATION	0.418533604887984	0.768751287071501	0.2827058477157	1.04611268656548	410	69	WRN, TP53, MAPK11, MRE11, CDK2, TAF1, TP53INP1, RPS27A, ATM, MDM4, RFC4, MDM2, PRKAA1, RFC2, SUPT16H, KAT5, TAF12, RAD9A, CSNK2A2, CDK5R1, TAF4B, DNA2, TBP, TAF9, UBA52, ATRIP, TAF10, TAF9B, RPA3, TAF4, BARD1, STK11, PIN1, TOPBP1, RAD50
REACTOME_GLUTAMATE_AND_GLUTAMINE_METABOLISM	0.43375	0.779371452894438	0.437466569636858	1.04429528606049	346	8	ALDH18A1, RIMKLB, GLS
REACTOME_HIV_TRANSCRIPTION_ELONGATION	0.414994720168955	0.76843578956255	0.30719125469671	1.04194298385877	392	37	NELFE, NELFA, POLR2H, CDK9, NCBP1, SUPT16H, CCNT1, SUPT5H, GTF2F1, NELFCD, NELFB, NCBP2, GTF2H4, CCNH, POLR2A, GTF2H1, POLR2K, POLR2G, CTDP1, ELL, TCEA1, GTF2H3, SSRP1
REACTOME_SIGNALING_BY_NUCLEAR_RECEPTORS	0.397397397397397	0.756624872171091	0.263868487474023	1.04181836227874	396	168	CYP26B1, MOV10, SPHK1, MMP2, SRC, ABCA1, PLTP, SREBF1, GNB4, APOD, TLE3, POU2F1, FASN, MYC, GNB1, JUND, RUNX1, JUN, ZNF217, CXCL12, ABCG1, NRAS, GNAI2, NR1H3, POLR2H, GNAI3, CAV2, CPT1A, CDK9, AKT3, FOSB, EGFR, ALDH1A3, RDH11, FOS, IGF1R, KRAS, GNG12, CHD1, KAT5, DDX5, PGR, CCNT1, PTK2, APOC1, ATF2, CREB1, KCTD6, GNB2, GTF2F1, MYLIP, AGO3, TBP, SCD, AREG, CBFB, ALDH1A2, SHC1, ZDHHC21, TBL1XR1, FOXO3, USF1, TNRC6A, HDAC1
REACTOME_RECEPTOR_TYPE_TYROSINE_PROTEIN_PHOSPHATASES	0.433041301627034	0.778982250540448	0.424583790498406	1.04132759678823	345	9	PTPRF, PPFIBP2, NTRK3, PTPRS, PTPRD, PPFIBP1, PPFIA4, PPFIA1
REACTOME_METABOLISM_OF_AMINO_ACIDS_AND_DERIVATIVES	0.382617382617383	0.75282464568882	0.258709631950433	1.04119828236633	382	254	RPL3, PSMB8, CSAD, RPL12, SLC25A13, NNMT, RPS8, MRI1, RPS6, RPL36A, RPL31, RPS19, PSMB9, CDO1, PSME1, RPL35, RPS27A, RPL34, RPS9, RPL24, RPS17, RPL35A, ASL, RPL36, RPL10A, RPL11, PSME2, AFMID, RPL15, RPL13, RPL17, SLC44A1, HNMT, ALDH18A1, BCAT1, RPL28, RPS18, RPS4X, RPL26, RIMKLB, GLS, RPL19, PHYKPL, RPL13A, RPS11, RPL7A, ASRGL1, SEPSECS, RPL7, ASNS, RPL37, NMRAL1, RPL32, RPS7, RPS2, RPL18A, RPL23, RPS24, RPL9, RPS16, RPS27, RPS3, FAU, RPS3A, HYKK, RPS5, RPL29, RPL5, RPS12, TSTD1, RPS21, RPL6, RPL14, RPS15, RPS20, TPO, RPL41, PAPSS2, AMT, RPL4, RPL23A, RPLP2, RPS10, RPL27A, PRODH, SERINC5, RPLP0, RPS25, RPS13, RPL27, MTR, RPL22, PAPSS1, RPS14, UBA52
REACTOME_DUAL_INCISION_IN_TC_NER	0.420781893004115	0.770946454427679	0.288484629578782	1.04098193817184	408	53	POLE, POLD1, XAB2, RPS27A, AQR, HMGN1, UVSSA, RFC4, POLR2H, RFC2, ZNF830, POLD2, POLD3, PCNA, CUL4B, UBA52, XPA, GTF2H4, POLK, RPA3, CCNH, POLR2A, PPIE, GTF2H1, POLR2K, POLR2G, ERCC6, RBX1, PRPF19, TCEA1, GTF2H3
REACTOME_REGULATION_OF_GENE_EXPRESSION_IN_LATE_STAGE_BRANCHING_MORPHOGENESIS_PANCREATIC_BUD_PRECURSOR_CELLS	0.434292866082603	0.779457383426067	0.424150383317721	1.04026462908199	346	9	MAML2, RBPJ, KAT2A, MAML3, NOTCH1, MAMLD1
REACTOME_INTERLEUKIN_37_SIGNALING	0.438679245283019	0.783780186549683	0.373388622660522	1.03968290755479	371	14	PTPN18, IL18BP, PTPN12, PTPN9, PTPN13, PTPN23, SIGIRR
REACTOME_COOPERATION_OF_PDCL_PHLP1_AND_TRIC_CCT_IN_G_PROTEIN_BETA_FOLDING	0.441144114411441	0.78451072265273	0.339096118400703	1.03900051717615	400	21	GNB4, GNB1, GNG12, CSNK2A2, GNB2, CCT3, GNAQ, CCT6B, CCT4, PDCL, CCT8, RGS11, CCT7, CCT6A, GNG10
REACTOME_RESPONSE_OF_MTB_TO_PHAGOCYTOSIS	0.441601779755284	0.78451072265273	0.345175984693055	1.03846023799321	396	19	SFPQ, RPS27A, ENO1, TRIM27, VPS33B, HGS, RNF213, UBA52
REACTOME_ER_QUALITY_CONTROL_COMPARTMENT_ERQC	0.441601779755284	0.78451072265273	0.345076498261569	1.0381609335575	396	19	MAN1B1, UGGT2, RPS27A, EDEM1, OS9, EDEM2, DERL2, UBA52, RNF185, SYVN1
REACTOME_RAB_GERANYLGERANYLATION	0.430062630480167	0.777156557134822	0.301630635735525	1.03742388789424	411	40	RAB27A, RAB31, RAB34, RAB40C, RAB2B, RAB24, RAB20, RAB13, RAB5C, RAB8B, RABGGTA, RAB14, RAB1A, RAB4B, RAB11A, RAB22A, RAB6B
REACTOME_VXPX_CARGO_TARGETING_TO_CILIUM	0.442216981132075	0.78451072265273	0.372536265203161	1.03730955864761	374	14	ASAP1, PKD2, ARF4, RAB11A, EXOC3, RAB11FIP3, EXOC7, PKD1
REACTOME_POLO_LIKE_KINASE_MEDIATED_EVENTS	0.417771883289125	0.768751287071501	0.498443083118244	1.03570418336034	314	5	LIN37, RBBP4, WEE1, LIN52
REACTOME_BH3_ONLY_PROTEINS_ASSOCIATE_WITH_AND_INACTIVATE_ANTI_APOPTOTIC_BCL_2_MEMBERS	0.445	0.786199776785714	0.43382410078497	1.03560019181636	355	8	BBC3, BCL2L1, BCL2L11
REACTOME_REGULATED_PROTEOLYSIS_OF_P75NTR	0.44320987654321	0.78451072265273	0.409045738545433	1.03557601370711	358	10	NGFR, RELA, PSEN1, TRAF6, NFKB1, APH1B, NCSTN, ADAM17
REACTOME_ERCC6_CSB_AND_EHMT2_G9A_POSITIVELY_REGULATE_RRNA_EXPRESSION	0.44811320754717	0.789936756734042	0.371606551698351	1.03472081549581	379	14	CHD3, EHMT2, GATAD2A, MTA2, RBBP4, GATAD2B, HDAC1, ERCC6, CHD4, HDAC2, CBX3
REACTOME_REGULATION_OF_RUNX3_EXPRESSION_AND_ACTIVITY	0.440904419321686	0.78451072265273	0.290352217744447	1.03426474860763	428	48	TGFB1, SRC, PSMB8, PSMB9, PSME1, RPS27A, PSME2
REACTOME_METABOLISM_OF_INGESTED_SEMET_SEC_MESEC_INTO_H2SE	0.419098143236074	0.768751287071501	0.497562965248396	1.03387540533026	315	5	NNMT, HNMT, SCLY, CTH, AHCY
REACTOME_INTERACTION_BETWEEN_L1_AND_ANKYRINS	0.452679589509692	0.791814132810876	0.357146112246246	1.03338937921418	396	16	ACTG1, SCN5A, ACTB, SPTAN1
REACTOME_INACTIVATION_OF_CDC42_AND_RAC1	0.425974025974026	0.774770035815407	0.468786721901417	1.03338625571358	327	6	SRGAP2, CDC42, SRGAP3, ROBO1
REACTOME_SIGNALING_BY_NODAL	0.443053817271589	0.78451072265273	0.421197972505407	1.03302359227202	353	9	ACVR1B, ACVR2A, FOXO3, SMAD3, ACVR2B, SMAD2
REACTOME_REGULATION_OF_RAS_BY_GAPS	0.4375	0.782556497175141	0.284750521489919	1.03291285397147	426	56	PSMB8, SPRED1, SPRED2, RASA2, PSMB9, SYNGAP1, PSME1, RPS27A, PSME2
REACTOME_HYDROLYSIS_OF_LPC	0.432467532467532	0.778835158016045	0.467857808295016	1.03133857281482	332	6	PLA2G4B, PLBD1, GPCPD1, PLA2G4C, PLA2G4F, PLA2G15
REACTOME_VLDLR_INTERNALISATION_AND_DEGRADATION	0.449382716049383	0.790031955545293	0.406792850233232	1.02987240436021	363	10	AP2A2, NR1H3, MYLIP, AP2M1, AP2B1
REACTOME_DOWNSTREAM_SIGNALING_OF_ACTIVATED_FGFR2	0.4688995215311	0.805936962631631	0.375339127183656	1.02943560683665	391	13	NRAS, FGF2, KRAS, SHC1, FRS3, FRS2, FGF1, GRB2, PIK3CA
REACTOME_DOWNSTREAM_SIGNALING_OF_ACTIVATED_FGFR3	0.4688995215311	0.805936962631631	0.375339127183656	1.02943560683665	391	13	NRAS, FGF2, KRAS, SHC1, FRS3, FRS2, FGF1, GRB2, PIK3CA
REACTOME_APOPTOSIS	0.448897795591182	0.790031955545293	0.264441442280306	1.02849249558678	447	133	TNFRSF10B, PSMB8, FAS, BBC3, VIM, BCL2L1, TP53, HMGB2, GSDMD, TRAF2, DBNL, PSMB9, PSME1, BAX, RPS27A, PSME2, DAPK1, TLR4, SPTAN1, GSN, CFLAR, YWHAZ, RIPK1, ROCK1, BCL2L11, CASP7, YWHAH, DAPK3, YWHAQ, AKT3, TJP2, TRADD, TJP1, TP63, DYNLL1, PRKCD, PTK2, CD14
REACTOME_ARMS_MEDIATED_ACTIVATION	0.426136363636364	0.774770035815407	0.531506489248813	1.0270419476472	299	4	BRAF, KIDINS220, YWHAB
REACTOME_PTK6_EXPRESSION	0.427556818181818	0.775912472647702	0.530689441960011	1.02546314878814	300	4	HIF1A, EPAS1, PELP1
REACTOME_HIGHLY_CALCIUM_PERMEABLE_POSTSYNAPTIC_NICOTINIC_ACETYLCHOLINE_RECEPTORS	0.48207171314741	0.817665289256198	0.766588830511773	1.02413344887348	241	1	CHRNA1
REACTOME_HIGHLY_CALCIUM_PERMEABLE_NICOTINIC_ACETYLCHOLINE_RECEPTORS	0.48207171314741	0.817665289256198	0.766588830511773	1.02413344887348	241	1	CHRNA1
REACTOME_SYNTHESIS_OF_PIPS_AT_THE_ER_MEMBRANE	0.43236074270557	0.778835158016045	0.492116021023944	1.0225573168446	325	5	PI4K2B, SACM1L, SBF1, MTMR2, PI4KA
REACTOME_TIE2_SIGNALING	0.4688995215311	0.805936962631631	0.379766133625634	1.02235221099623	391	12	ANGPT2, NRAS, KRAS, SHC1, TEK
REACTOME_PTK6_REGULATES_RTKS_AND_THEIR_EFFECTORS_AKT1_AND_DOK1	0.455470737913486	0.795816973639126	0.440747463424351	1.0216552638847	357	7	RPS27A, CBL, ARAP1, UBA52, AKT1
REACTOME_FLT3_SIGNALING_BY_CBL_MUTANTS	0.436339522546419	0.781363647274866	0.491558652184209	1.0213991720964	328	5	RPS27A, CBL, UBA52
REACTOME_FOLDING_OF_ACTIN_BY_CCT_TRIC	0.462962962962963	0.802893980269367	0.403057746616029	1.0204162889428	374	10	ACTB, CCT3, CCT6B, CCT4, CCT8, CCT7, CCT6A, CCT2, CCT5, TCP1
REACTOME_SEALING_OF_THE_NUCLEAR_ENVELOPE_NE_BY_ESCRT_III	0.463071512309496	0.802893980269367	0.36057231960751	1.01938127137052	394	15	CHMP4A, IST1, TUBA1A, LEMD2, CHMP2A, CC2D1B
REACTOME_SLBP_DEPENDENT_PROCESSING_OF_REPLICATION_DEPENDENT_HISTONE_PRE_MRNAS	0.462962962962963	0.802893980269367	0.402532775619641	1.01908722639424	374	10	LSM11, NCBP1, SNRPB, ZNF473, NCBP2, SLBP
REACTOME_TRANSPORT_OF_NUCLEOSIDES_AND_FREE_PURINE_AND_PYRIMIDINE_BASES_ACROSS_THE_PLASMA_MEMBRANE	0.460559796437659	0.802368088660718	0.439055571854377	1.01773344907729	361	7	SLC25A6, SLC25A5
REACTOME_PROCESSING_OF_DNA_DOUBLE_STRAND_BREAK_ENDS	0.465020576131687	0.804511007668263	0.288392532818993	1.01770162858582	451	45	WRN, MDC1, MRE11, CDK2, RPS27A, SIRT6, ATM, RFC4, RFC2, UIMC1, TIMELESS, KAT5, RAD9A, DNA2, UBA52, UBE2I, ATRIP, SUMO2
REACTOME_INTERLEUKIN_RECEPTOR_SHC_SIGNALING	0.471291866028708	0.808293633719875	0.377806010144179	1.01707544617268	393	12	IL3RA, INPP5D, GAB2, SHC1, PIK3R3
REACTOME_SCAVENGING_BY_CLASS_F_RECEPTORS	0.446949602122016	0.788763902072632	0.488956728266724	1.0159926902384	336	5	SCARF1, CALR, HYOU1
REACTOME_SLC_MEDIATED_TRANSMEMBRANE_TRANSPORT	0.468812877263582	0.805936962631631	0.264588741542796	1.01484541110489	465	108	SLC12A7, SLC7A1, SLC30A7, SLC20A1, SLC39A10, CP, SLC12A4, APOD, SLC25A6, SLC33A1, SLC25A5, SLC1A5, RUNX1, SLC44A1, CTNS, SLCO2A1, SLC2A3, SLC26A11, SLC25A29, SLC7A6, SLC9A9, SLC30A2, SRI, SLC50A1, SLC16A2, SLC26A2, SLC15A3, SLC11A1, SLC35B3, SLCO3A1, SLC8B1, SLC2A1, SLC30A1, SLC35D1, SLC9A1, SLC4A2, SLC35A3, SLC30A5, SLC35A2, SLC16A7, SLC36A1, SLC9A5, SLC4A7, SLC9A8, ARL2, SLC35B4, SLC43A1, SLC39A14, SLC39A7
REACTOME_TNFR1_MEDIATED_CERAMIDE_PRODUCTION	0.452254641909814	0.791814132810876	0.488303713536862	1.01463580494815	340	5	SMPD3, RACK1, SMPD2, TNFRSF1A
REACTOME_ROLE_OF_ABL_IN_ROBO_SLIT_SIGNALING	0.46875	0.805936962631631	0.424384929297271	1.01306753909937	374	8	CAP1, ABL2, ABL1
REACTOME_RUNX3_REGULATES_BCL2L11_BIM_TRANSCRIPTION	0.460740740740741	0.802368088660718	0.567244063838069	1.0127275682844	310	3	BCL2L11, FOXO3, SMAD3
REACTOME_SIGNALING_BY_ERBB2_ECD_MUTANTS	0.476415094339623	0.812839909743115	0.363497382144233	1.01214121754286	403	14	NRAS, EGFR, KRAS, SHC1, CDC37, ERBIN, ERBB2
REACTOME_SYNTHESIS_OF_DOLICHYL_PHOSPHATE	0.466233766233766	0.805729314353768	0.45883632187378	1.01145174659244	358	6	SRD5A3, MVD, DHDDS, NUS1
REACTOME_CLEC7A_INFLAMMASOME_PATHWAY	0.462222222222222	0.802893980269367	0.566368236667964	1.01116391274922	311	3	MALT1, RELA, NFKB1
REACTOME_INWARDLY_RECTIFYING_K_CHANNELS	0.498803827751196	0.817665289256198	0.368390185911026	1.01037687552468	416	13	GNB4, GABBR1, GNB1, GNG12, ABCC8, KCNJ8, GNB2
REACTOME_NR1H2_NR1H3_REGULATE_GENE_EXPRESSION_LINKED_TO_LIPOGENESIS	0.47125	0.808293633719875	0.423161150346515	1.01014620366906	376	8	SREBF1, FASN, NR1H3, SCD
REACTOME_NEGATIVE_REGULATION_OF_FLT3	0.472594397076736	0.808775060078349	0.3847447941239	1.00997882913375	387	11	SOCS2, RPS27A, CBL, ABL2, UBA52
REACTOME_SIGNALING_BY_ERYTHROPOIETIN	0.48936170212766	0.817665289256198	0.343144161181801	1.00939613345057	436	17	PLCG2, NRAS, EPOR, KRAS, STAT5A, SHC1
REACTOME_RA_BIOSYNTHESIS_PATHWAY	0.483950617283951	0.817665289256198	0.398413256064386	1.00865788992299	391	10	CYP26B1, ALDH1A3, RDH11, ALDH1A2
REACTOME_HATS_ACETYLATE_HISTONES	0.493374108053007	0.817665289256198	0.273006353756252	1.00735728227939	483	67	ACTB, BRD1, OGT, RUVBL2, KAT2A, JADE2, ACTL6A, YEATS2, MBIP, KAT8, JADE1, ING3, EP400, SUPT7L, KAT5, TAF12, ATXN7, JADE3, ATF2, TADA2A, TAF9, MRGBP, MSL1, TAF10, KAT6A, RUVBL1, SUPT20H, BRPF1, TRRAP, BRD8
REACTOME_HDACS_DEACETYLATE_HISTONES	0.486984815618221	0.817665289256198	0.315159658055336	1.00694865769093	448	26	CHD3, HMG20B, GATAD2A, ARID4B, MTA2, TBL1XR1, RBBP4, GATAD2B, HDAC1, ARID4A, SUDS3, TBL1X, HDAC8, CHD4, HDAC2, NCOR2, GPS2, BRMS1, SAP18
REACTOME_SIGNALING_BY_FLT3_FUSION_PROTEINS	0.494960806270997	0.817665289256198	0.341197284811291	1.00366918337241	441	17	CDKN1A, PIM1, NRAS, ETV6, KRAS, STAT5A, GAB2
REACTOME_REGULATION_OF_SIGNALING_BY_NODAL	0.48	0.817665289256198	0.561891786687427	1.00317189556942	323	3	ACVR1B, ACVR2A, ACVR2B
REACTOME_ACYL_CHAIN_REMODELLING_OF_PI	0.484732824427481	0.817665289256198	0.432156241926947	1.00174076092233	380	7	MBOAT7, PLA2R1, PLA2G2A, PLBD1
REACTOME_NITRIC_OXIDE_STIMULATES_GUANYLATE_CYCLASE	0.48125	0.817665289256198	0.419540216279402	1.00150251603698	384	8	PDE1A, ITPR1, PDE2A, PDE5A, GUCY1A2
REACTOME_INTRINSIC_PATHWAY_FOR_APOPTOSIS	0.493762993762994	0.817665289256198	0.28926159130976	1.00127662847651	474	41	BBC3, BCL2L1, TP53, GSDMD, BAX, YWHAZ, BCL2L11, CASP7, YWHAH, YWHAQ, AKT3, TP63, DYNLL1
REACTOME_SIGNALING_BY_SCF_KIT	0.494577006507592	0.817665289256198	0.313318111096115	1.0010648359794	455	26	SRC, FYN, FES, CBL, NRAS, FER, KRAS, STAT5A, GAB2, PTPRU, PIK3R3, YES1
REACTOME_RUNX3_REGULATES_YAP1_MEDIATED_TRANSCRIPTION	0.481432360742706	0.817665289256198	0.481165143416274	0.999802723323556	362	5	WWTR1, TEAD2, TEAD3
REACTOME_NOTCH3_INTRACELLULAR_DOMAIN_REGULATES_TRANSCRIPTION	0.505131128848347	0.820866115139089	0.345514127067526	0.999732650131329	442	16	MAML2, RBPJ, KAT2A, NOTCH3, MAML3, NOTCH1, PLXND1, MAMLD1, HEYL
REACTOME_ACTIVATED_NTRK2_SIGNALS_THROUGH_CDK5	0.474431818181818	0.811042730217946	0.517163091626039	0.999325877705719	333	4	NTRK2, CDK5R1
REACTOME_RAB_GEFS_EXCHANGE_GTP_FOR_GDP_ON_RABS	0.502532928064843	0.819268408987277	0.267658710185828	0.99884791436612	495	74	RIN1, RAB27A, GDI1, HPS4, RAB31, RAB3IL1, TRAPPC6A, SBF2, RIN2, DENND6A, ALS2CL, DENND3, RIN3, RAB13, RAB5C, AKT3, TRAPPC2, HPS1, RAB8B, DENND2A, SBF1, RAB14, RAB1A, DENND4A, MON1B
REACTOME_RNA_POLYMERASE_I_TRANSCRIPTION_TERMINATION	0.487320837927233	0.817665289256198	0.323959231077153	0.998645156341923	441	22	TAF1C, TAF1D, POLR2H, TAF1B, POLR1C, POLR1E, TBP, GTF2H4, CCNH, GTF2H1, POLR2K
REACTOME_FRS_MEDIATED_FGFR4_SIGNALING	0.502469135802469	0.819268408987277	0.394437023378771	0.998591311039212	406	10	NRAS, FGF2, KRAS, FRS3, FRS2, FGFR4, FGF1, GRB2
REACTOME_SARS_COV_INFECTIONS	0.512512512512513	0.820866115139089	0.257149873624261	0.998482792312611	511	128	MAN1B1, IMPDH1, STAT2, CHMP4A, AP2A2, MOGS, PRKCSH, IL1R1, RPS27A, TUSC3, ST6GALNAC4, S1PR1, MGAT5, SIGMAR1, PARP16, IMPDH2, GANAB, RIPK1, ROCK1, PARP10, VHL, IFNGR1, STT3A, CHD3, FKBP1A, HMG20B, PARP4, DDX5, EDEM2, CHMP2A, MGAT4A, IFNAR2, GATAD2A, PIK3R4, CTSL, AP2M1, ATP1B3, ST3GAL4, ARID4B, UBA52, MTA2, AP2B1, UBE2I, RBBP4, TUBB, GATAD2B, NFE2L2, HDAC1, IFNGR2, FUT8, ARID4A, PARP9, SRPK2, FXYD6, DDOST, SUDS3, ATP1B2
REACTOME_NOTCH3_ACTIVATION_AND_TRANSMISSION_OF_SIGNAL_TO_THE_NUCLEUS	0.487320837927233	0.817665289256198	0.323766608029793	0.998051371523362	441	22	JAG1, RPS27A, NOTCH3, MIB1, DLL4, EGFR, ADAM10, JAG2, DLL1, UBA52, PSEN1, NEURL1B, WWP2, APH1B
REACTOME_SCF_SKP2_MEDIATED_DEGRADATION_OF_P27_P21	0.51081359423275	0.820866115139089	0.279076625888719	0.99764937718915	495	50	PSMB8, CDKN1A, CDK2, PSMB9, PSME1, RPS27A, PSME2
REACTOME_MATURATION_OF_SARS_COV_2_SPIKE_PROTEIN	0.498915401301518	0.817665289256198	0.312109929132511	0.997204642660228	459	26	MAN1B1, MOGS, PRKCSH, TUSC3, ST6GALNAC4, MGAT5, GANAB, STT3A, EDEM2, MGAT4A, ST3GAL4
REACTOME_ETHANOL_OXIDATION	0.494910941475827	0.817665289256198	0.430114728751262	0.997008521135796	388	7	ADH1B, ADH5, ALDH2, ALDH1A1, ACSS1
REACTOME_SYNTHESIS_OF_16_20_HYDROXYEICOSATETRAENOIC_ACIDS_HETE	0.488448844884488	0.817665289256198	0.627642828164446	0.996841602174898	295	2	CYP1B1, CYP2U1
REACTOME_SIGNALING_BY_ERBB2	0.491596638655462	0.817665289256198	0.291875621881505	0.996677784736624	467	38	SRC, PTPN18, FYN, RHOA, RPS27A, PTPN12, NRAS, AKT3, EGFR, KRAS, PRKCD, UBA52, SHC1, ERBB3, YES1, CDC37, DIAPH1, ERBIN, ERBB2, AKT1
REACTOME_REGULATION_OF_BETA_CELL_DEVELOPMENT	0.498820754716981	0.817665289256198	0.35750304322315	0.995450265167467	422	14	MAML2, RBPJ, KAT2A, MAML3, AKT3, NOTCH1, FOXO1, MAMLD1
REACTOME_SHC_MEDIATED_CASCADE_FGFR4	0.495	0.817665289256198	0.416958192100018	0.995338854934225	395	8	NRAS, FGF2, KRAS, SHC1, FGFR4, FGF1, GRB2
REACTOME_REGULATION_OF_KIT_SIGNALING	0.509876543209877	0.820866115139089	0.392561318879521	0.993842613264891	412	10	SRC, FYN, CBL
REACTOME_RHOBTB3_ATPASE_CYCLE	0.495	0.817665289256198	0.416129874575543	0.993361542503499	395	8	RHOBTB3, VHL, HGS, LRRC41
REACTOME_SIGNALING_BY_NOTCH1_PEST_DOMAIN_MUTANTS_IN_CANCER	0.511867905056759	0.820866115139089	0.278423957897542	0.992450537905127	495	49	MAML2, HDAC7, RBPJ, JAG1, RPS27A, MYC, HDAC6, CCNC, KAT2A, MAML3, MIB1, DLL4, NOTCH1, ADAM10, JAG2, DLL1, UBA52, MAMLD1, TBL1XR1, HEYL, PSEN1, HDAC1, NEURL1B, TBL1X, HDAC8, APH1B, SNW1
REACTOME_CD28_CO_STIMULATION	0.496141124586549	0.817665289256198	0.321502284791075	0.991071309781584	449	22	SRC, MAP3K8, FYN
REACTOME_DISEASES_OF_CARBOHYDRATE_METABOLISM	0.506465517241379	0.820866115139089	0.306779188528591	0.990839642523091	469	27	IDUA, GUSB, SGSH, RPS27A, GAA, HGSNAT, DCXR, NAGLU, TALDO1, GLB1, UBA52
REACTOME_MITOTIC_PROMETAPHASE	0.524524524524524	0.823983910340348	0.255177421017797	0.990823990235638	523	128	HAUS5, CSNK1E, EML4, OFD1, PPP2R1B, CEP131, NUP85, TUBGCP2, NUP107, HAUS4, RCC2, TUBGCP6, CNTRL, ITGB3BP, ODF2, CEP164, NUP160, CEP192, KNTC1, SFI1, NUMA1, RPS27, TUBA1A, CEP290, NDEL1, BUB3, CENPC, ALMS1, RANGAP1, DYNLL1, HAUS6, TUBG2, CSNK2A2, TUBGCP3, MAD1L1, NUDC, MZT2B, SDCCAG8, HAUS3, NUP133, MAPRE1, NINL, TUBB, NEK6, PDS5B, NDE1, CENPP, CDK5RAP2, SMC1A, CEP78, CEP57, NUP43, CENPJ, KIF2A, HDAC8, CEP250, NEK9, AHCTF1, SMC4, CEP76, CETN2, CSNK1D, PPP2R1A, SEH1L, STAG2, XPO1, DYNC1I2, MIS12, DYNC1LI2, CCP110, DCTN2, SMC2, NUP98, STAG1, DSN1, SMC3, NCAPD2, SKA2, AKAP9, HAUS2, ZW10
REACTOME_G0_AND_EARLY_G1	0.508254716981132	0.820866115139089	0.355513024128373	0.989909151397569	430	14	LIN37, CDK2, MYC, PCNA, MAX, RBBP4, HDAC1
REACTOME_SUMO_IS_TRANSFERRED_FROM_E1_TO_E2_UBE2I_UBC9	0.5	0.817665289256198	0.476335528143557	0.989767369415783	376	5	SAE1, UBE2I, SUMO2
REACTOME_REGULATION_OF_TP53_EXPRESSION_AND_DEGRADATION	0.505820105820106	0.820866115139089	0.300090218040759	0.98916298904204	477	30	TP53, PPP2R1B, CDK2, RPS27A, ATM, MDM4, MDM2, AKT3
REACTOME_REGULATION_OF_HSF1_MEDIATED_HEAT_SHOCK_RESPONSE	0.525993883792049	0.824404275289914	0.267866116257845	0.988390486798549	515	67	NUP85, NUP107, ATM, POM121C, SERPINH1, NUP160, NUP155, NUP54, NUP93, NUP50, RAE1, HSPA4L, AAAS, NUP205, POM121, CCAR2, TNFRSF21, NUP35, HSPA13, NUP133, TPR, RPA3, NUP43, HSPA5, NUP214, NUP153, DEDD2, HSF1, HSPB1, NUP62, NUP88, SEH1L, COL4A6, NUP188, NUP98, HSPA12A, NUP58, SIRT1, BAG4, HSPB2, MAPKAPK2, BAG5
REACTOME_FOXO_MEDIATED_TRANSCRIPTION	0.519091847265222	0.823369132485818	0.27714725037939	0.987899675713864	502	49	ATXN3, SREBF1, BBC3, BTG1, NFYA, GADD45A, CDKN1A, ABCA6, DDIT3, YWHAZ, BCL2L11, YWHAQ, AKT3, TXN, TXNIP, CCNG2, BCL6, FOXO1, SIN3A
REACTOME_OXIDATIVE_STRESS_INDUCED_SENESCENCE	0.515463917525773	0.821731501956998	0.274786188208927	0.987704763536906	499	52	MOV10, TP53, MAPK11, CBX4, EZH2, RPS27A, MINK1, JUN, MDM4, MDM2, RING1, MAP3K5, FOS, PHC3, TXN, CDK6, AGO3, UBA52, SUZ12, RBBP4, TNRC6A, PHC1, KDM6B, CBX6, TNRC6C, PHC2, CDKN2B, MAPK14, CDK4, EED, MAPKAPK5, TNRC6B, MAP4K4, RNF2
REACTOME_ACTIVATED_NTRK2_SIGNALS_THROUGH_FRS2_AND_FRS3	0.505632040050063	0.820866115139089	0.40251598098407	0.987204430614207	403	9	NRAS, KRAS, NTRK2, FRS3, FRS2
REACTOME_IRON_UPTAKE_AND_TRANSPORT	0.520790020790021	0.823983910340348	0.284374086090549	0.98699203449705	500	42	STEAP2, CP, TCIRG1, CAND1, RPS27A, SLC22A17, FTL
REACTOME_THE_ROLE_OF_GTSE1_IN_G2_M_PROGRESSION_AFTER_G2_CHECKPOINT	0.518556701030928	0.823369132485818	0.274318490971214	0.986023649967868	502	52	PSMB8, TP53, CDKN1A, PSMB9, PSME1, RPS27A, PSME2
REACTOME_PKMTS_METHYLATE_HISTONE_LYSINES	0.496304118268215	0.817665289256198	0.290631462865228	0.985774851956673	469	37	NFKB2, EZH2, KMT2B, KMT5C, KMT2E, SMYD3, NSD3, SETD1B, EHMT2, RELA, DOT1L, SUZ12, RBBP4, SETDB1, AEBP2, KMT2A, NFKB1, EHMT1, SUV39H1, ATF7IP
REACTOME_TOLL_LIKE_RECEPTOR_9_TLR9_CASCADE	0.529292929292929	0.827118170849661	0.262913173120265	0.985458444860626	523	78	NFKB2, SAA1, MAP3K8, MAPK11, NOD1, PPP2R1B, RPS27A, MYD88, IRAK4, PELI2, DUSP6, JUN, TLR4, APP, PELI1, DUSP4, IRF7, FOS, CD14, HMGB1, RELA, ATF2, CREB1, PIK3R4, UBA52, NFKBIA
REACTOME_PI_METABOLISM	0.512846865364851	0.820866115139089	0.271572434005966	0.985311815438548	498	58	PIK3C2A, PI4K2B, PTEN, SBF2, PLEKHA2, PLEKHA5, PIP4K2A, MTMR1, TNFAIP8L3, INPP5E, PLEKHA8, INPP5D, MTMR12, OCRL, SACM1L, PTPN13, PIK3R4, SBF1, RAB14, INPP4B, PIKFYVE, PLEKHA3, PLEKHA6, PIK3R3, PNPLA7, TNFAIP8L1, PLEKHA4, RUFY1, MTMR2, INPP5F, PIP5K1B, ARF1, INPP4A
REACTOME_TRANSCRIPTIONAL_REGULATION_BY_RUNX1	0.540540540540541	0.836167529989095	0.253741526421788	0.985280723907176	539	129	MOV10, SRC, PML, PSMB8, CTSK, LGALS3, SIN3B, CBX4, PSMB9, PSME1, RPS27A, THBS1, CLDN5, CCND2, PSME2, RUNX1, MYL9, CCND3, RING1, KMT2B, ACTL6A, KMT2E, ELF1, TJP1, PHC3, ABL1, SETD1B, SOCS3, RYBP, CSNK2A2, ARID2, CDK6, SMARCA4, KCTD6, CTSL, AGO3, SIN3A, UBA52, CBFB, TCF12, TNRC6A, HDAC1, PHC1, PSMB1, LDB1, KMT2A, SMARCC2, CCNH, CBX6
REACTOME_PEXOPHAGY	0.51278928136419	0.820866115139089	0.375013948362281	0.984434758469506	420	11	RPS27A, ATM, EPAS1, UBA52
REACTOME_RHOG_GTPASE_CYCLE	0.523711340206186	0.823983910340348	0.273721537790035	0.983877932584831	507	52	MCAM, CDC42EP1, TMPO, ARHGDIA, CYFIP1, VAV2, MAP3K11, DOCK1, DOCK3, ARHGDIB, PLEKHG3, PLD1, DOCK5, ARHGAP32, ARHGAP1, MCF2L, LEMD3, LBR, ESYT1, ANKLE2, OPHN1, CDC42, CAV1, EMD, TRIO, DOCK4
REACTOME_DAG_AND_IP3_SIGNALING	0.509533898305085	0.820866115139089	0.295653040526438	0.983344183693904	480	32	PDE1A, ITPR1, ITPR3, CAMKK2, ADCY3, ADCY4, PRKX, ADCY5, PRKCD, CAMKK1, CREB1, PRKAR1A, ITPR2, ADCY6
REACTOME_ESTROGEN_DEPENDENT_GENE_EXPRESSION	0.539939332659252	0.836167529989095	0.262827883077713	0.983343393821904	533	76	MOV10, TLE3, POU2F1, MYC, JUND, RUNX1, JUN, ZNF217, CXCL12, POLR2H, CDK9, FOSB, FOS, CHD1, KAT5, DDX5, PGR, CCNT1, ATF2, KCTD6, GTF2F1, AGO3, TBP, CBFB, USF1, TNRC6A, HDAC1, SP1, SMC1A, POLR2A, TNRC6C, KDM4B, POLR2K, GREB1, POLR2G
REACTOME_METABOLISM_OF_ANGIOTENSINOGEN_TO_ANGIOTENSINS	0.51063829787234	0.820866115139089	0.400919712965578	0.983289448514738	407	9	ATP6AP2, CES1, ANPEP, CTSZ, CTSD, ENPEP, MME
REACTOME_NRIF_SIGNALS_CELL_DEATH_FROM_THE_NUCLEUS	0.518867924528302	0.823369132485818	0.352946888906791	0.982763869601505	439	14	NGFR, RPS27A, ITGB3BP, UBA52, PSEN1, TRAF6, APH1B, NCSTN
REACTOME_INSULIN_RECEPTOR_SIGNALLING_CASCADE	0.523861171366594	0.823983910340348	0.307480450875082	0.982413260584581	482	26	NRAS, FGF2, KRAS, FGFR1, PIK3R4, GAB2, SHC1, FRS2, FGFR4, PDPK1, FGF1, INSR, AKT2, THEM4, GRB2, PIK3CA
