pathway	pval	padj	ES	NES	nMoreExtreme	size	leadingEdge
REACTOME_RNA_POLYMERASE_II_TRANSCRIPTION	0.000999000999000999	0.0462865497076023	0.308954996884087	1.2850511943558	0	884	ZNF274, TNFRSF10B, WRN, ZNF773, MDC1, G6PD, ZNF529, ZNF700, TAF1, ZNF26, NABP1, ZNF79, TP53, ZNF791, ZNF432, PSMB8, ZNF324B, SERPINE1, PML, ZNF548, LGALS3, DDB2, NFYA, ZNF550, MOV10, ZNF595, ITGA5, NELFA, ZNF606, BNIP3L, COX6A1, PERP, VDR, ZNF226, SRSF5, NELFE, POU2F1, CDKN1A, RAD51D, RBPJ, DDX39B, ZNF333, ZKSCAN8, BANP, ZNF268, NDRG1, BAX, ZNF587, ZNF75A, BTG1, NR2C2, SNAPC4, CASP2, ZNF263, NPM1, ZNF324, YWHAQ, ATXN3, PPARG, CCNC, ACTL6A, TGFB1, MAPK11, SIN3B, PTEN, EIF4A3, KMT2B, SRSF3, HDAC7, SRSF1, NOTCH2, ZNF160, CDK2, ZNF12, MAML2, THBS1, SRRM1, ZNF662, ZNF627, ZNF564, PRKAA1, ZNF544, PIP4K2A, SRSF7, CTSL, ZNF549, ZNF562, ZNF761, WWTR1, BCL2L11, SRC, ZNF347, EAF1, PPP2R1B, YWHAZ, ARID2, ZNF655, TP53INP1, SRSF11, PRELID1, BRD1, MDM4, ZNF224, RELA, ZNF267, PIDD1, MYC, BBC3, NUDT21, ZNF446, NOTCH1, ZNF394, FAS, EZH2, CASP10, MRE11, SRSF9, RFC2, ZNF506, SETD1B, ZNF211, KRAS, RRAGB, ZNF350, ZNF234, SKI, ZNF558, MAGOH, SRSF6, PSMB9, TAF9, CTSK, CNOT3, SUPT16H, ZNF521, CBX4, PCF11, SMAD1, PHC3, AFF4, MAML3, POLDIP3, ABL1, MED17, CCNT2, ZNF720, COX7A2L, RPS27A, SNRPB, TGIF1, ZNF354B, ZNF441, ZNF721, MED27, ZNF500, JAG1, CCNT1, PRMT5, NR2C2AP, ZNF764, SYMPK, TAF9B, ZNF17, ZNF528, RAD9A, CLDN5, RING1, CASC3, ZNF266, ZNF33B, ZNF3, TCF7L2, SUPT5H, TAF12, GADD45A, TAF4B, ZSCAN25, PMS2, INTS4, ZNF471, ANAPC2, TBP, NR2C1, NCBP1, GLS, CBFB, RFC4, CDK9, AKT3, TRIM33, ZKSCAN1, SRRT, MDM2, DDX39A, BRD2, CCND3, MED23, KRBOX4, ZNF568, CSTF3, ELL2, KMT2E, L3MBTL1, WDR33, CSNK2A2, SNAPC2, SUZ12, KAT5, PPM1D, ZNF585B, ANAPC7, ZNF621, NR1H3, PHC2, ZNF320, ZNF37A, GATAD2A, LSM11, TCF12, CNOT6L, CPSF3, MED8, POLR2H, SREBF1, ZNF227, CREB1, CDK4, ZNF510, GTF2B, CCND2, MED30, SIN3A, NOP2, GTF2F1, CNOT9, JUN, SLC38A9, TJP1, SMARCE1, ZNF746, CEBPB, BRPF1, ANAPC10, INTS2, RBM8A, MTA2, SRSF2, CDC73, YWHAH, ZNF747, SLBP, SNW1, CBX5, RNMT, DHX38, CITED2, CDK13, ZNF431, ATRIP, RNPS1, ZNF317, KDM5B, RUNX1, ZNF205, ZNF426, CPSF7, CNOT10, SESN2, SESN3, ZNF264, PCGF2, KMT2A, ZNF555, ELF1, CTDP1, SMARCA4, FIP1L1, PSMB1, CPSF4, MED12, SRSF4, ZNF615, SP1, ZNF398, IGFBP3, PLK2, TXNIP, BCL6, RYBP, MED26, INTS14, PSME1, ZNF34, RAD50, PSME2, ZNF706, RICTOR, ZNF586, ATM, TSC2, ZNF493, LBR, ZNF140, GATAD2B, ZNF514, TP63, SUPT6H, EGFR, ABCA6, THOC2, TRIM28, ZNF10, U2AF2, HDAC6, DNA2, NFKB1, GTF2H1, RBBP4, FOXO1, SATB2, ZNF254, PPP2R1A, DDIT3, CNOT8, ZNF546, SSRP1, TOPBP1, ZNF23, ZNF212, UBE2I, GATA2, ZFP28, YWHAB, NCBP2, PABPN1, ZNF614, UXT, ARID3A, ITCH, UBA52, ZNF304, CBX6, HDAC1, ZNF202, CAV1, PLAGL1, LDB1, TOP3A, ZNF302, EHMT2, ZNF561, SMURF2, ZNF585A, RPRD1B, ZNF667, INTS6, SLC2A3, U2AF1L4, POLR2K, INTS5, ZNF691, CTNNB1, CPSF1, MED15, ATF2, PAPOLA, ELL, NELFB, SMARCC2, NRBF2, SCO1, PIP4K2C, POLR2G, JUNB, INTS3, RBM14, INTS9, MECP2, KAT2A, TP53I3, CSTF1, ALYREF, ZNF496, SARNP, CHD3, SMURF1, MYL9, CNOT2, ZNF75D, RBL2, AGO3, TAF10, ZNF473, SOCS3, PSMB4, NR1D1, AKT1, MAMLD1, UBE2D3, CCNH, ZNF18, ZNF419, WDR61, NOTCH4, KAT6A, ZFP90, FOXO3, PDPK1, ZNF354A, ERCC2, EHMT1, ICE1, CHD4, MED4, TAF4, NOTCH3, L3MBTL2, TBL1XR1, DDIT4
REACTOME_SIGNALING_BY_ERYTHROPOIETIN	0.138580931263858	0.507442026504251	0.442246452209552	1.28477718558989	124	17	PLCG2, NRAS, KRAS, STAT5A, SHC1, EPOR
REACTOME_DISEASES_OF_DNA_REPAIR	0.14498933901919	0.512317240328967	0.410507093801188	1.28467925042445	135	23	WRN, RAD51D, MRE11, NEIL1, PMS2, KAT5, PALB2, RAD50, ATM, DNA2, TOP3A, OGG1
REACTOME_CELL_JUNCTION_ORGANIZATION	0.110204081632653	0.462740215449575	0.369917228006302	1.28464765565372	107	42	CLDN15, ACTG1, ACTN1, F11R, FBLIM1, ACTB, CTNND1, PARVA, CDH11, NECTIN2, CTNNA1, CLDN5, FLNA
REACTOME_ACTIVATION_OF_C3_AND_C5	0.120860927152318	0.481757966344432	0.8138561837112	1.28447932651253	72	2	CFB, C3
REACTOME_EGFR_DOWNREGULATION	0.153200419727177	0.523763551977954	0.405850442425022	1.28416777654933	145	24	SH3GL1, SPRY1, CBL, PTPN12, HGS, RPS27A, PTPRK, SPRY2, ARHGEF7, EGFR, UBA52, AREG, CDC42, STAM2, STAM, GRB2
REACTOME_FERTILIZATION	0.153103448275862	0.523763551977954	0.649240699071235	1.28302578613404	110	4	OVGP1, HVCN1, B4GALT1
REACTOME_OLFACTORY_SIGNALING_PATHWAY	0.120860927152318	0.481757966344432	0.812785832441374	1.28279003041119	72	2	ADCY3, GNB1
REACTOME_SUPPRESSION_OF_APOPTOSIS	0.140730717185386	0.510362582104275	0.608401512621946	1.28051872904075	103	5	SFPQ, TRIM27, RNF213
REACTOME_RUNX1_INTERACTS_WITH_CO_FACTORS_WHOSE_PRECISE_EFFECT_ON_RUNX1_TARGETS_IS_NOT_KNOWN	0.125263157894737	0.489092621365569	0.398924930833701	1.27882974397043	118	27	ACTL6A, ARID2, CBX4, PHC3, RING1, CBFB, CSNK2A2, PHC2, SMARCE1, RUNX1, SMARCA4, RYBP, CBX6, SMARCC2
REACTOME_APOPTOSIS_INDUCED_DNA_FRAGMENTATION	0.154440154440154	0.524257794069611	0.568041437833199	1.27762310650428	119	6	HMGB2, HMGB1, DFFA
REACTOME_CELL_CELL_COMMUNICATION	0.0797979797979798	0.403578920192339	0.350586830410634	1.27747576221327	78	66	CLDN15, ACTG1, ACTN1, F11R, FBLIM1, ACTB, CTNND1, PARVA, ACTN4, FYN, CDH11, SRC, CD47, NECTIN2, CTNNA1, CLDN5, SPTAN1, FLNA, PTK2B, IQGAP1, AFDN, PTK2, ILK, PXN, CDH5, SIRPA, SKAP2, MAGI2
REACTOME_SIGNALING_BY_FGFR	0.0963488843813387	0.443248966875652	0.356807655085825	1.27648965236539	94	54	PTBP1, HNRNPA1, BRAF, NRAS, CBL, SRC, KRAS, RPS27A, SHC1, SPRED1, FGF2, HNRNPH1, SPRED2, NCBP1, HNRNPF, HNRNPM, POLR2H, SPRY2, GTF2F1, FGFR1, PPP2R1A, NCBP2, UBA52, POLR2K, POLR2G
REACTOME_REGULATION_OF_PTEN_GENE_TRANSCRIPTION	0.115423901940756	0.475823012427647	0.363568818162463	1.27613188548046	112	47	TP53, PPARG, PTEN, HDAC7, EZH2, RRAGB, CBX4, PHC3, RING1, SUZ12, PHC2, GATAD2A, JUN, SLC38A9, MTA2, EGR1, SNAI2, GATAD2B, RBBP4, CBX6, HDAC1, ATN1, ATF2, CHD3
REACTOME_FATTY_ACYL_COA_BIOSYNTHESIS	0.149253731343284	0.519271773003116	0.407688003317407	1.2758569252947	139	23	ACSL5, ACACA, ELOVL5, SLC27A3, ELOVL1, ACLY, HACD3, FASN
REACTOME_G_ALPHA_S_SIGNALLING_EVENTS	0.127551020408163	0.491273151596405	0.366872438254726	1.27435880532173	124	43	ADM, PTGIR, RAMP3, PDE8A, ADCY3, ADCY4, SRC, GNAI3, GNAI2, GNB4, PDE2A, GNB2, GRK5, GNB1, GRK3, PDE1A, GNG12
REACTOME_MEIOTIC_RECOMBINATION	0.170378619153675	0.546698099042013	0.446446620252184	1.27212331557807	152	15	MSH5, CDK2, MRE11, CDK4, RAD50, ATM, TOP3A
REACTOME_RHOA_GTPASE_CYCLE	0.0480961923847695	0.304464899024591	0.335198850808763	1.27164987288099	47	102	ARHGDIA, MCAM, PKN3, ARHGEF10, STOM, ARHGEF15, ARHGEF1, TMPO, STK10, ARHGAP31, MYO9B, RHOA, ACTC1, ROCK1, FAF2, ARHGAP4, STARD13, ARHGEF18, VAV2, ARHGEF17, FMNL3, FLOT2, DLC1, ARHGDIB, TJP2, IQGAP1, PREX2, ARHGAP1, SNAP23, ARHGAP45, CCDC115, DDRGK1, ARHGAP23, PLEKHG3, ARHGEF7, DIAPH1, LBR, TMEM87A, PLD1, ARHGAP29, HMOX2, SCFD1, ATP6AP1, CAV1, PKN2, ARHGEF25, ARAP1, ARHGAP10, FAM13A, ARHGAP32, STARD8, SLK, MCF2L, ARHGEF12, ARHGAP42, AAAS, ARHGEF3, DAAM1, BCR, BCAP31
REACTOME_NF_KB_IS_ACTIVATED_AND_SIGNALS_SURVIVAL	0.157596371882086	0.52743140949121	0.466245029129505	1.27021015763821	138	12	RELA, NGFR, TRAF6, RPS27A, NFKBIA, NFKB1, UBA52
REACTOME_GRB2_SOS_PROVIDES_LINKAGE_TO_MAPK_SIGNALING_FOR_INTEGRINS	0.155528554070474	0.524257794069611	0.505761190762012	1.26991327704184	127	9	VWF, RAP1B, SRC, PTK2, TLN1, FN1, GRB2
REACTOME_ONCOGENIC_MAPK_SIGNALING	0.0939393939393939	0.443248966875652	0.348218574890963	1.26724322404786	92	64	ACTG1, AGTRAP, VWF, BRAF, ACTB, SND1, NRAS, CLCN6, RAP1B, BCL2L11, SRC, KRAS, MAP3K11, AGK, DUSP6, SPRED1, SPRED2, IQGAP1, ZC3HAV1
REACTOME_PURINE_SALVAGE	0.158932714617169	0.530191387559809	0.476114103796047	1.26704450790372	136	11	HPRT1, DGUOK, APRT, AMPD2, GMPR2
REACTOME_G2_PHASE	0.137417218543046	0.505887109194517	0.802191578156	1.26606950793838	82	2	CDK2, E2F3
REACTOME_CLATHRIN_MEDIATED_ENDOCYTOSIS	0.047047047047047	0.30274583526616	0.33269037919273	1.26512198831468	46	109	ARFGAP1, SH3GL1, ACTG1, PIK3C2A, AMPH, HIP1R, RAB5C, NECAP1, ACTB, GAK, NECAP2, FCHO2, ARPC5, DAB2, CBL, AP2A2, CTTN, HGS, RPS27A, HIP1, VAMP4, SGIP1, AGFG1, ARPC3, OCRL, AGTR1, ITSN2, GRK3, STON1, GPS1, PICALM, SYT11, REPS1, DVL2, AP2M1, ACTR2, EGFR, CLTCL1, VAMP2, AAK1, UBA52, AREG, ARPC4, TOR1A, ACTR3, AP2A1, ARRB1, AP2B1, ARPC1A, SNX9, DNM1, CLTC, STAM2, ARRB2, RAB5A, STAM, FNBP1L, WASL, SCARB2
REACTOME_COLLAGEN_DEGRADATION	0.130792996910402	0.495390487525844	0.378747949540178	1.26391900432413	126	34	MMP14, MMP2, COL12A1, CTSL, COL6A3, PHYKPL, CTSK, COL4A2, COL4A1, COL18A1, ADAM10, CTSB
REACTOME_RESOLUTION_OF_AP_SITES_VIA_THE_MULTIPLE_NUCLEOTIDE_PATCH_REPLACEMENT_PATHWAY	0.164113785557987	0.538955601564297	0.422657322795891	1.26201588249965	149	19	POLD3, POLD1, RFC2, APEX1, RFC4, POLD2, LIG1, POLE
REACTOME_REGULATION_OF_TP53_ACTIVITY_THROUGH_ACETYLATION	0.155299055613851	0.524257794069611	0.394783435666459	1.26160114024669	147	26	TP53, PML, PIP4K2A, BRD1, AKT3, GATAD2A, BRPF1, MTA2, GATAD2B, RBBP4, HDAC1, PIP4K2C, CHD3, AKT1, KAT6A, CHD4, MEAF6
REACTOME_REGULATED_PROTEOLYSIS_OF_P75NTR	0.17654028436019	0.553392614142931	0.483793259295151	1.2615080596206	148	10	RELA, NGFR, TRAF6, PSEN1, NFKB1, NCSTN, ADAM17, APH1B
REACTOME_RESPONSE_OF_MTB_TO_PHAGOCYTOSIS	0.165207877461707	0.539224886643055	0.422292188896832	1.26092562626842	150	19	SFPQ, ENO1, TRIM27, VPS33B, HGS, RPS27A
REACTOME_HIV_ELONGATION_ARREST_AND_RECOVERY	0.145702306079665	0.51254833449802	0.38967576557336	1.25975870133699	138	28	NELFA, NELFE, SUPT16H, CCNT2, CCNT1, SUPT5H, CDK9, POLR2H, GTF2F1, CTDP1, SSRP1, POLR2K, ELL, NELFB, POLR2G, POLR2A, NELFCD, TCEA1, POLR2C
REACTOME_INTERFERON_SIGNALING	0.0540540540540541	0.320477781151938	0.328489286992321	1.25962708889282	53	120	PSMB8, PML, IFITM2, IFITM3, NUP85, VCAM1, NUP93, EIF4A3, IFNGR1, POM121C, NUP155, NUP107, RAE1, B2M, TRIM38, CD44, ADAR, TRIM35, IRF3, SP100, CIITA, IFIT5, NUP160, RPS27A, NUP54, FLNA, PRKCD, NUP214, NUP50, IFI30, STAT2, GBP2, POM121, NUP43, TRIM62, TRIM22, ABCE1, TPR, NUP133, GBP1, ICAM1, NUP205, EGR1, TRIM21, UBE2L6, IRF1
REACTOME_TP53_REGULATES_TRANSCRIPTION_OF_SEVERAL_ADDITIONAL_CELL_DEATH_GENES_WHOSE_SPECIFIC_ROLES_IN_P53_DEPENDENT_APOPTOSIS_REMAIN_UNCERTAIN	0.171324422843256	0.546698099042013	0.501422648603679	1.25901965295501	140	9	TP53, PERP, NDRG1, BCL6, TP63, TP53I3, RABGGTA
REACTOME_REGULATION_OF_HSF1_MEDIATED_HEAT_SHOCK_RESPONSE	0.094949494949495	0.443248966875652	0.344877479143453	1.25799086637714	93	67	NUP85, HSPA5, NUP93, POM121C, NUP155, NUP107, RAE1, HSPA13, NUP160, NUP54, NUP214, NUP50, CCAR2, POM121, NUP43, TPR, NUP133, NUP205, TNFRSF21, ATM, NUP153, NUP88, HSPA4L, SERPINH1, NUP58, NUP98, SEH1L, NUP188, NUP35, AAAS, RPA3, BAG5, NUP62, DEDD2
REACTOME_SEALING_OF_THE_NUCLEAR_ENVELOPE_NE_BY_ESCRT_III	0.181514476614699	0.558870255957635	0.441132377540004	1.25698069437291	162	15	CHMP4A, IST1, LEMD2, CHMP2A, CC2D1B, TUBA1A
REACTOME_SIGNALING_BY_FLT3_FUSION_PROTEINS	0.169623059866962	0.546698099042013	0.431967135371796	1.25491457913908	152	17	CDKN1A, NRAS, PIM1, KRAS, STAT5A, ETV6
REACTOME_TP53_REGULATES_TRANSCRIPTION_OF_ADDITIONAL_CELL_CYCLE_GENES_WHOSE_EXACT_ROLE_IN_THE_P53_PATHWAY_REMAIN_UNCERTAIN	0.169398907103825	0.546698099042013	0.424902818006697	1.25393198975981	154	18	TP53, NPM1, CNOT3, CNOT6L, CNOT9, CNOT10, PLK2, CNOT8, PLAGL1, CNOT2, CENPJ, TNKS1BP1, RGCC
REACTOME_NOTCH4_ACTIVATION_AND_TRANSMISSION_OF_SIGNAL_TO_THE_NUCLEUS	0.187203791469194	0.563390878128773	0.480868493349309	1.2538816288213	157	10	YWHAZ, PSEN1, JAG1, ADAM10, NCSTN, DLL4, NOTCH4, APH1B
REACTOME_BASE_EXCISION_REPAIR_AP_SITE_FORMATION	0.179888268156425	0.55761252446184	0.445354316993455	1.25361562510051	160	14	ACD, NEIL1, TERF2IP, TERF1, TERF2, TINF2, TDG, OGG1
REACTOME_DEFECTIVE_FACTOR_VIII_CAUSES_HEMOPHILIA_A	0.156204379562044	0.524257794069611	0.69917603676552	1.25329698911676	106	3	VWF, F8
REACTOME_RND3_GTPASE_CYCLE	0.144050104384134	0.510434554384912	0.383841094584077	1.25289079895636	137	30	KCTD13, NISCH, PKP4, RBMX, CPD, TMOD3, ROCK1, CKAP4, FLOT2, LEMD3, PICALM, RND3, TNFAIP1, CAV1, DLG5, PTPN13
REACTOME_DISSOLUTION_OF_FIBRIN_CLOT	0.176184690157959	0.553392614142931	0.498863207642358	1.25259316528067	144	9	SERPINB8, SERPINE1, PLAT, SERPINF2, ANXA2, SERPINE2, S100A10
REACTOME_CASPASE_MEDIATED_CLEAVAGE_OF_CYTOSKELETAL_PROTEINS	0.179829890643985	0.55761252446184	0.498727223012172	1.25225172214407	147	9	DBNL, VIM, SPTAN1, GSN, CASP7
REACTOME_POST_TRANSLATIONAL_MODIFICATION_SYNTHESIS_OF_GPI_ANCHORED_PROTEINS	0.140167364016736	0.510362582104275	0.38361797416622	1.2515473329528	133	31	PIGL, PIGA, PIGO, PIGG, DPM2, CD109, LY6E, NEGR1, PGAP1, CPM, PIGT, NRN1, RECK, GPAA1, PIGW, GPIHBP1, PIGV, PIGZ, PIGU, PIGH, DPM1, DPM3, PIGK, PIGS, PIGC
REACTOME_GABA_B_RECEPTOR_ACTIVATION	0.170678336980306	0.546698099042013	0.419021248826056	1.25115890013502	155	19	ADCY3, ADCY4, GNAI3, GNAI2, GNB4, GNB2, GABBR1, GNB1, GNG12
REACTOME_NUCLEAR_EVENTS_STIMULATED_BY_ALK_SIGNALING_IN_CANCER	0.174638487208009	0.552643761905846	0.434327796684451	1.25026858014259	156	16	EML4, RPS6, NPM1, STAT5A, CEBPB, JUNB, MECP2, STAT3, CLTC, FN1
REACTOME_ANCHORING_OF_THE_BASAL_BODY_TO_THE_PLASMA_MEMBRANE	0.098989898989899	0.449000028942722	0.341673900008612	1.24945305424431	97	68	TCTN3, CEP131, HAUS5, ODF2, CSNK1E, CNTRL, CEP164, HAUS4, OFD1, CEP83, CEP290, IQCB1, CEP192, NPHP4, ALMS1, MAPRE1, AHI1, SFI1, HAUS2, TTBK2, SDCCAG8, CEP76, CEP162, PPP2R1A, CEP78, TUBB, RAB11A, TUBA1A, DCTN2, CENPJ, CEP57, DYNLL1, CDK5RAP2, CETN2, FBF1, NDE1, HAUS6, CSNK1D
REACTOME_ALK_MUTANTS_BIND_TKIS	0.191943127962085	0.566876812619368	0.47910508851864	1.24928348826534	161	10	EML4, EIF2AK3, NPM1, HIP1
REACTOME_COPI_DEPENDENT_GOLGI_TO_ER_RETROGRADE_TRAFFIC	0.115736040609137	0.475870525413673	0.34907666851537	1.2490171830347	113	55	ARFGAP1, SEC22B, ARF4, KIF13B, KDELR1, NAPA, TMED3, RAB1A, SURF4, KIF3B, KDELR2, RINT1, COPB1, COPE, ARF1, ARF5, TMED7, ARFGAP2, NAPB, KIF26A, TMED9, COPG2, TUBA1A, KLC1, KIF2A, STX18, COPB2, ZW10, KIFC2, TMED2, TMED10, BNIP1, NAPG
REACTOME_THE_NLRP3_INFLAMMASOME	0.191943127962085	0.566876812619368	0.478949522361856	1.24887784400136	161	10	NFKB2, RELA, APP, TXNIP, NFKB1, HSP90AB1, TXN
REACTOME_SIGNALING_BY_NTRK3_TRKC	0.181514476614699	0.558870255957635	0.449958869548185	1.24884169826098	162	13	BAX, NRAS, SRC, KRAS, SHC1, NELFB, NTRK3, PTPRS, GRB2
REACTOME_ACTIVATED_NTRK3_SIGNALS_THROUGH_RAS	0.176319176319176	0.553392614142931	0.555144235711288	1.24861507585239	136	6	NRAS, KRAS, SHC1, NTRK3, GRB2
REACTOME_MISMATCH_REPAIR	0.181514476614699	0.558870255957635	0.449832462027223	1.24849085956475	162	13	POLD3, POLD1, PMS2, POLD2, LIG1, PCNA, MSH2, RPA3, MSH6
REACTOME_SIGNALING_BY_ACTIVIN	0.182260024301337	0.559142671451581	0.497183276450664	1.24837503434494	149	9	FST, INHBB, ACVR1B, FSTL3, ACVR2B, ACVR2A
REACTOME_G_BETA_GAMMA_SIGNALLING_THROUGH_PI3KGAMMA	0.18445475638051	0.559318985799157	0.4690737111078	1.24830847211313	158	11	RHOA, GNB4, GNB2, GNB1, AKT3, GNG12, AKT1, PDPK1
REACTOME_FOLDING_OF_ACTIN_BY_CCT_TRIC	0.191943127962085	0.566876812619368	0.478485215678392	1.24766714787843	161	10	ACTB, CCT3, CCT4, CCT6A, CCT2, CCT6B, TCP1, CCT5, CCT8
REACTOME_SIGNALING_BY_KIT_IN_DISEASE	0.184357541899441	0.559318985799157	0.443166427148639	1.24745699411659	164	14	NRAS, FYN, SRC, KRAS, STAT5A, STAT3, PIK3R3, YES1, STAT5B, GRB2
REACTOME_UREA_CYCLE	0.173793103448276	0.551331628774791	0.6308179705146	1.24661889447903	125	4	NMRAL1, ASL
REACTOME_GLYCOSPHINGOLIPID_METABOLISM	0.161425576519916	0.534917006732441	0.3855648580075	1.24646880231321	153	28	ARSG, ARSA, UGCG, STS, GBA2, HEXA, NEU1, CTSA, SMPD3, GLB1, SMPD2, ESYT2, GBA, SUMF1, ESYT1, SMPD4, GLA, NEU3
REACTOME_NGF_STIMULATED_TRANSCRIPTION	0.155789473684211	0.524257794069611	0.388800210455554	1.24637302700893	147	27	ID3, ID4, F3, ID2, TCF12, CREB1, EGR1, NAB2, JUND, NAB1, MEF2D, ATF2, JUNB, ID1, CHD4, CDK5R1, EGR3, FOS, DNM2, RRAD
REACTOME_HYALURONAN_METABOLISM	0.184690157958688	0.559318985799157	0.496238889710149	1.24600377834043	151	9	GUSB, CD44, HEXA, HYAL2, ABCC5, LYVE1
REACTOME_NEGATIVE_EPIGENETIC_REGULATION_OF_RRNA_EXPRESSION	0.161522633744856	0.534917006732441	0.364982144906048	1.24570496745781	156	38	TAF1D, TAF1C, SIN3B, POLR1E, RRP8, SAP30BP, TAF1B, POLR1C, BAZ2A, TBP, POLR2H, SIN3A, ARID4B, GTF2H1, HDAC1, SAP18, POLR2K, CCNH, ERCC2, ERCC3, SIRT1, GTF2H4, GTF2H3, SUV39H1, SUDS3, POLR1B, HDAC2, POLR1D, CDK7, MBD2, SMARCA5
REACTOME_LISTERIA_MONOCYTOGENES_ENTRY_INTO_HOST_CELLS	0.177383592017738	0.554937205857865	0.428716185930441	1.24547019433307	159	17	SH3GL1, CTNND1, CBL, SRC, HGS, RPS27A
REACTOME_ABORTIVE_ELONGATION_OF_HIV_1_TRANSCRIPT_IN_THE_ABSENCE_OF_TAT	0.184665226781857	0.559318985799157	0.409399782381249	1.24312201464922	170	20	NELFA, NELFE, SUPT5H, NCBP1, POLR2H, GTF2F1, CTDP1, NCBP2, POLR2K, NELFB, POLR2G, POLR2A, NELFCD, POLR2C
REACTOME_FORMATION_OF_RNA_POL_II_ELONGATION_COMPLEX	0.152594099694812	0.523763551977954	0.351989162540818	1.24131019971073	149	48	NELFA, NELFE, EAF1, SUPT16H, AFF4, CCNT2, CCNT1, SUPT5H, NCBP1, CDK9, POLR2H, GTF2F1, CDC73, CTDP1, SUPT6H, GTF2H1, SSRP1, NCBP2, POLR2K, ELL, NELFB, POLR2G, CCNH, WDR61, ERCC2, POLR2A, MLLT1, NELFCD, TCEA1, POLR2C, ERCC3, CCNK, GTF2H4, GTF2H3
REACTOME_RNA_POLYMERASE_I_TRANSCRIPTION_INITIATION	0.164086687306502	0.538955601564297	0.364819297897557	1.2386860532404	158	37	TAF1D, TAF1C, POLR1E, TAF1B, POLR1C, TBP, GATAD2A, POLR2H, MTA2, GATAD2B, GTF2H1, RBBP4, HDAC1, EHMT2, POLR2K, ERCC6, KAT2A, CHD3, CCNH, ERCC2, CHD4
REACTOME_ADRENALINE_NORADRENALINE_INHIBITS_INSULIN_SECRETION	0.197104677060134	0.575676575251276	0.445446989850385	1.23631916812438	176	13	GNAI2, GNB4, GNB2, ADRA2C, GNB1, GNG12, CACNA1C, ADCY6, ADCY5
REACTOME_FRUCTOSE_CATABOLISM	0.169343065693431	0.546698099042013	0.689684091028499	1.2362823513324	115	3	GLYCTK, TKFC
REACTOME_FLT3_SIGNALING	0.153522607781283	0.523763551977954	0.381671034231396	1.23627068082355	145	29	NRAS, FYN, ABL2, BCL2L11, CBL, KRAS, STAT5A, RPS27A, SOCS2, AKT3, UBA52, SH2B3, GAB2, AKT1, FOXO3, STAT5B, GRB2, CDKN1B, UBC, PIK3CA
REACTOME_DISEASES_OF_CARBOHYDRATE_METABOLISM	0.163157894736842	0.538081140350877	0.385503401345069	1.23580447833018	154	27	IDUA, GUSB, SGSH, GAA, RPS27A, NAGLU, HGSNAT, GNS, GLB1, TALDO1, DCXR, NHLRC1, UBA52
REACTOME_ACTIVATED_PKN1_STIMULATES_TRANSCRIPTION_OF_AR_ANDROGEN_RECEPTOR_REGULATED_GENES_KLK2_AND_KLK3	0.170802919708029	0.546698099042013	0.689400122034171	1.23577332718558	116	3	KDM4C, KDM1A, PKN1
REACTOME_REGULATION_OF_RUNX1_EXPRESSION_AND_ACTIVITY	0.185144124168514	0.559318985799157	0.425280891663738	1.23549026644988	166	17	PML, MOV10, SRC, CBFB, CCND3, CCND2, RUNX1
REACTOME_NR1H2_NR1H3_REGULATE_GENE_EXPRESSION_LINKED_TO_LIPOGENESIS	0.203955500618047	0.582909747292419	0.509095215781543	1.23541294285555	164	8	FASN, NR1H3, SREBF1
REACTOME_COPII_MEDIATED_VESICLE_TRANSPORT	0.129327902240326	0.495390487525844	0.344990682203806	1.23534718907631	126	57	SEC24D, SEC22A, SEC22B, GORASP1, SEC16A, NAPA, RAB1A, LMAN2, TRAPPC6A, TRAPPC2, SEC23IP, GOSR2, COL7A1, CTSC, SEC31A, SCFD1, NAPB, AREG, BET1, TRAPPC6B, SEC24A, TRAPPC4, TFG, SEC24B, SEC24C, TMED2, TMED10, CSNK1D, NAPG, TRAPPC2L, TRAPPC3, CTSZ, SEC22C, SEC13, STX17, F8, TRAPPC1
REACTOME_NF_KB_ACTIVATION_THROUGH_FADD_RIP_1_PATHWAY_MEDIATED_BY_CASPASE_8_AND_10	0.190765492102066	0.566876812619368	0.49192745864444	1.23517822736222	156	9	TRIM4, CASP10, RIPK1, RNF135, IKBKG
REACTOME_P75NTR_RECRUITS_SIGNALLING_COMPLEXES	0.198375870069606	0.578322287882478	0.463980236601215	1.23475361446816	170	11	MYD88, NGFR, TRAF6, RPS27A
REACTOME_EPIGENETIC_REGULATION_OF_GENE_EXPRESSION	0.119071644803229	0.481757966344432	0.336454032155349	1.23439291232691	117	70	TAF1D, TAF1C, ACTB, SIN3B, MYO1C, POLR1E, RRP8, SAP30BP, TAF1B, EZH2, POLR1C, BAZ2A, TBP, SUZ12, GATAD2A, POLR2H, SIN3A, MTA2, DDX21, ARID4B, GATAD2B, TDG, GTF2H1, RBBP4, HDAC1, EHMT2, SAP18, POLR2K, ERCC6, SF3B1, AEBP2, KAT2A, CHD3, CCNH, ERCC2, CHD4
REACTOME_TOLL_LIKE_RECEPTOR_CASCADES	0.0840840840840841	0.413735317631142	0.324610026092248	1.23401383821174	83	108	NOD1, IRAK4, PLCG2, HSP90B1, GSDMD, MYD88, MAPK11, NFKB2, SAA1, IRAK3, CTSL, PPP2R1B, RELA, MAP3K8, UNC93B1, IRF3, PELI1, CTSK, TRAF6, RIPK1, RPS27A, DUSP6, PELI2, TLR4, CNPY3, PIK3R4, CTSB, ITGAM, CREB1, JUN, BIRC3, ITGB2, APP, HMGB1, S100A8, NFKBIA, NFKB1, PPP2R1A, MAP3K7, IKBKG, DUSP4, UBA52, LGMN, ATF2, MAPK7, CD14, UBE2D3, VRK3, MAP3K1
REACTOME_RHOB_GTPASE_CYCLE	0.145621181262729	0.51254833449802	0.348275796573214	1.23395800902629	142	51	MCAM, PKN3, ARHGEF10, STOM, ARHGEF1, STK10, MYO9B, ACTC1, ROCK1, STARD13, VAV2, ARHGEF17, FLOT2, DLC1, TJP2, ARHGAP1, SNAP23, DIAPH1, RHOB, CAV1, PKN2, ARHGEF25, ARHGAP32, STARD8, SLK, MCF2L, ARHGEF12, ARHGEF3, DAAM1, BCR
REACTOME_SUMO_IS_CONJUGATED_TO_E1_UBA2_SAE1	0.184827586206897	0.559318985799157	0.624262833223713	1.23366466935438	133	4	SAE1, UBA2, SUMO2
REACTOME_SUMOYLATION_OF_DNA_METHYLATION_PROTEINS	0.200696055684455	0.578363587986037	0.463475345060385	1.23340998686126	172	11	CBX4, PHC3, RING1, PHC2, PCGF2, UBE2I
REACTOME_NUCLEOTIDE_EXCISION_REPAIR	0.0942828485456369	0.443248966875652	0.327910130862459	1.23309999808616	93	92	DDB2, ACTR5, XAB2, AQR, XPC, ACTB, UVSSA, ACTL6A, POLD3, INO80B, POLD1, RFC2, RPS27A, INO80D, RFC4, GPS1, POLD2, POLR2H, INO80E, POLK, LIG1, PIAS3, POLE, HMGN1, CUL4B, XRCC1, RUVBL1, GTF2H1, UBE2I, UBA52, POLR2K, ERCC6, ELL, ZNF830, POLR2G, SUMO2, CCNH, PPIE, ERCC2, NFRKB, POLR2A, PCNA, ERCC4, XPA, PRPF19, CETN2, RPA3
REACTOME_ER_QUALITY_CONTROL_COMPARTMENT_ERQC	0.188183807439825	0.564195013593263	0.412569293518193	1.23189395514876	171	19	UGGT2, EDEM1, MAN1B1, EDEM2, OS9, RPS27A, DERL2
REACTOME_ASSEMBLY_OF_THE_ORC_COMPLEX_AT_THE_ORIGIN_OF_REPLICATION	0.191831683168317	0.566876812619368	0.524071915014568	1.23169726462804	154	7	ORC3, ORC2, ORC5
REACTOME_IRAK4_DEFICIENCY_TLR2_4	0.207663782447466	0.587021013597033	0.507098427461243	1.23056736965319	167	8	IRAK4, MYD88, TLR4, HMGB1, S100A8, CD14
REACTOME_SIGNALING_BY_BRAF_AND_RAF1_FUSIONS	0.142566191446029	0.510362582104275	0.345945994754462	1.23017378207412	139	52	ACTG1, AGTRAP, VWF, BRAF, ACTB, SND1, NRAS, CLCN6, RAP1B, BCL2L11, SRC, KRAS, AGK
REACTOME_SIGNALING_BY_FGFR1	0.166492146596859	0.542298493956435	0.374727729156198	1.23015883207885	158	32	BRAF, NRAS, CBL, SRC, KRAS, RPS27A, SHC1, SPRED1, FGF2, SPRED2, SPRY2, FGFR1, PPP2R1A, UBA52
REACTOME_FLT3_SIGNALING_THROUGH_SRC_FAMILY_KINASES	0.143468950749465	0.510362582104275	0.925374586495427	1.22907341535982	66	1	FYN
REACTOME_NONHOMOLOGOUS_END_JOINING_NHEJ	0.159831756046267	0.531541323153867	0.379196887775014	1.22825667281729	151	29	MDC1, POLM, MRE11, UIMC1, XRCC5, POLL, KAT5, RIF1, RAD50, ATM, PRKDC
REACTOME_NEGATIVE_REGULATION_OF_FLT3	0.207656612529002	0.587021013597033	0.461471352449695	1.22807692108772	178	11	ABL2, CBL, RPS27A, SOCS2, UBA52, SH2B3
REACTOME_SIGNALING_BY_NTRK2_TRKB	0.189277899343545	0.566202872087945	0.411236964474239	1.22791574319431	172	19	NRAS, FYN, SRC, KRAS, DOCK3, SHC1
REACTOME_SIGNALING_BY_SCF_KIT	0.189926547743966	0.566202872087945	0.383384739569525	1.22517456634817	180	26	NRAS, FES, FYN, CBL, SRC, KRAS, STAT5A, FER, SH2B3, PTPRU, GAB2, STAT3, PIK3R3, YES1, STAT5B, GRB2
REACTOME_ESTROGEN_BIOSYNTHESIS	0.149892933618844	0.520352004207521	0.921871959525199	1.22442126070175	69	1	HSD17B11
REACTOME_PROCESSIVE_SYNTHESIS_ON_THE_LAGGING_STRAND	0.216553287981859	0.599307438593153	0.449405492452397	1.2243335279675	190	12	POLD3, POLD1, POLD2, LIG1, DNA2, POLA2, PCNA, RPA3
REACTOME_ERCC6_CSB_AND_EHMT2_G9A_POSITIVELY_REGULATE_RRNA_EXPRESSION	0.211173184357542	0.593031212370267	0.434891585064359	1.22416436859064	188	14	GATAD2A, MTA2, GATAD2B, RBBP4, HDAC1, EHMT2, ERCC6, CHD3, CHD4
REACTOME_TRANSCRIPTION_OF_THE_HIV_GENOME	0.132860040567951	0.496852356697037	0.338934320293012	1.22351761600116	130	60	TAF1, NELFA, NELFE, TAF9, SUPT16H, CCNT2, CCNT1, TAF9B, SUPT5H, TAF12, TAF4B, TBP, NCBP1, CDK9, POLR2H, GTF2B, GTF2F1, RNMT, CTDP1, GTF2H1, SSRP1, NCBP2, POLR2K, ELL, NELFB, POLR2G, TAF10, CCNH, ERCC2, TAF4, POLR2A, TAF11, NELFCD, RNGTT, TCEA1, POLR2C, ERCC3, CCNK, GTF2H4, GTF2H3
REACTOME_SEMA4D_MEDIATED_INHIBITION_OF_CELL_ATTACHMENT_AND_MIGRATION	0.195544554455446	0.573235240190686	0.520537059257023	1.22338948845708	157	7	PLXNB1, RHOA, RRAS
REACTOME_NOD1_2_SIGNALING_PATHWAY	0.18	0.55761252446184	0.381192436031913	1.2219848590445	170	27	CASP4, NOD1, CASP2, MAPK11, TRAF6, RPS27A, AAMP, BIRC3, MAP3K7, IKBKG, ITCH, UBA52
REACTOME_PLATELET_SENSITIZATION_BY_LDL	0.218820861678005	0.604502782502436	0.448325740935056	1.22139191731353	192	12	PECAM1, PPP2R1B, FGR
REACTOME_ACTIVATION_OF_MATRIX_METALLOPROTEINASES	0.213844252163164	0.594930494155166	0.503230600174617	1.22118137712664	172	8	MMP14, MMP2, CTSK, COL18A1, TIMP2
REACTOME_IKK_COMPLEX_RECRUITMENT_MEDIATED_BY_RIP1	0.207650273224044	0.587021013597033	0.41328302494741	1.21964078336164	189	18	TRAF6, RIPK1, RPS27A, TLR4, BIRC3, IKBKG, UBA52, CD14, UBE2D3
REACTOME_ACTIVATED_NTRK2_SIGNALS_THROUGH_RAS	0.199257425742574	0.578363587986037	0.518828887746386	1.21937486733947	160	7	NRAS, KRAS, SHC1, GRB2, NTRK2
REACTOME_PEPTIDE_HORMONE_BIOSYNTHESIS	0.156316916488223	0.524257794069611	0.917980151780502	1.21925219997055	72	1	INHBB
REACTOME_SIGNALING_BY_NTRKS	0.1001001001001	0.452738452738453	0.321623188437052	1.21828763184337	99	98	BRAF, BAX, NRAS, MAPK11, FYN, ID3, SRC, PPP2R1B, ID4, AP2A2, RHOA, KIDINS220, KRAS, F3, PCSK5, DOCK3, SHC2, DUSP6, SHC1, DNAL4, ID2, TCF12, CREB1, EGR1, NAB2, JUND, AP2M1, NAB1, PPP2R1A, YWHAB, DUSP4, MEF2D, ATF2, NELFB, JUNB, AP2A1, MAPK7, AP2B1, RALB, ID1, STAT3, VRK3, CHD4, DNM1, CLTC, IRS2, FRS2, NTRK3, PTPRS, GRB2, RIT1, CDK5R1, MAPK14, EGR3, FRS3, NTRK2
REACTOME_LOSS_OF_FUNCTION_OF_SMAD2_3_IN_CANCER	0.205683355886333	0.585605669726735	0.578300572561187	1.21716448565068	151	5	TGFBR2, TGFB1, TGFBR1, SMAD2, SMAD3
REACTOME_RESOLUTION_OF_ABASIC_SITES_AP_SITES	0.187891440501044	0.564195013593263	0.372849409264801	1.21701297973414	179	30	PNKP, POLD3, POLD1, RFC2, APEX1, NEIL1, RFC4, POLD2, LIG1, POLE, XRCC1, TDG
