pathway	pval	padj	ES	NES	nMoreExtreme	size	leadingEdge
REACTOME_VITAMIN_D_CALCIFEROL_METABOLISM	0.521447721179625	0.887497900972212	0.45721794996593	0.983078385150537	388	6	CYP2R1, SUMO2, UBE2I, PIAS4, LGMN, VDR
REACTOME_GABA_SYNTHESIS_RELEASE_REUPTAKE_AND_DEGRADATION	0.52258064516129	0.887497900972212	0.42146862616545	0.983075967291277	404	8	CPLX1, VAMP2, ABAT, DNAJC5, SLC6A1
REACTOME_TRNA_PROCESSING	0.554663991975928	0.909495778532746	0.269423412347665	0.982054965154329	552	91	QTRT1, TRMT44, NSUN6, TRMT112, TRMT11, ADAT2, TSEN54, NUP155, THADA, TRMT5, AAAS, OSGEP, NUP160, GTPBP3, TYW5, NUP107, NUP85, NUP35, POM121C, THG1L, CPSF1, NUP93, NUP50, TRMU, ELAC2, POM121, PUS1, QTRT2, CTU1, METTL1, DUS2, NUP54, NUP43, RAE1, NUP133, MTO1, RPP30, CDKAL1, LCMT2, TSEN34, C2orf49, POP5, TPR, TYW3, NUP205, CPSF4, RPP40, WDR4, NUP62, NUP153, POP1, CTU2, ADAT1, FAM98B, TRNT1, TYW1, TRIT1, NUP58, RAN
REACTOME_RUNX1_REGULATES_TRANSCRIPTION_OF_GENES_INVOLVED_IN_DIFFERENTIATION_OF_KERATINOCYTES	0.522788203753351	0.887497900972212	0.456524182588469	0.981586694561497	389	6	CTSK, RUNX1, SOCS3, CTSL
REACTOME_NTRK2_ACTIVATES_RAC1	0.512968299711816	0.886611146700833	0.521312178823026	0.981574355392075	355	4	FYN, NTRK2
REACTOME_TELOMERE_MAINTENANCE	0.524974515800204	0.889077412513256	0.286305386216252	0.981509083867945	514	50	CHTF18, LIG1, ACD, CDK2, WRN, POLD1, RTEL1, RUVBL2, RFC4, STN1, TERF2IP, POLD2, RFC2, TERF1, POLD3, POLR2H, POLA2, RUVBL1, PCNA, DNA2, NHP2, TERF2, POLA1, POLR2A, POLR2G, GAR1
REACTOME_ESTROGEN_DEPENDENT_NUCLEAR_EVENTS_DOWNSTREAM_OF_ESR_MEMBRANE_SIGNALING	0.516347237880496	0.886611146700833	0.338033025055529	0.981113584142927	457	18	AREG, XPO1, FOS, CREB1, CCND1, FOXO3, AKT3, CDKN1B, PTK2, AKT2, EGFR, AKT1, SRF
REACTOME_RHO_GTPASES_ACTIVATE_WASPS_AND_WAVES	0.525980911983033	0.889077412513256	0.310316834702614	0.980925025719596	495	29	ACTG1, ACTB, ARPC1B, WIPF1, ARPC5, CYFIP1, ARPC1A, ABL1
REACTOME_EGR2_AND_SOX10_MEDIATED_INITIATION_OF_SCHWANN_CELL_MYELINATION	0.52143684820394	0.887497900972212	0.359299530748816	0.980333736256266	449	14	WWTR1, NAB1, NAB2, LAMB1, HDAC2, LAMC1, LAMA2, PMP22
REACTOME_LRR_FLII_INTERACTING_PROTEIN_1_LRRFIP1_ACTIVATES_TYPE_I_IFN_PRODUCTION	0.52914798206278	0.891273655715211	0.564920103975156	0.98023153711892	353	3	IRF3, CTNNB1, LRRFIP1
REACTOME_MEIOSIS	0.528183716075157	0.890884980332775	0.300856312800377	0.979210100064728	505	34	MSH5, ACD, ATM, CDK2, MRE11, TERF2IP, TERF1, SYNE1, MLH3, DIDO1, SYNE2, SUN1, UBE2I, TERF2, MLH1, BRCA1, STAG3, SMC1A, RAD51C, LMNA
REACTOME_ANCHORING_OF_THE_BASAL_BODY_TO_THE_PLASMA_MEMBRANE	0.53125	0.893181818181818	0.273948607775883	0.977352432025624	526	68	HAUS5, CSNK1E, DYNLL1, CEP78, HAUS4, TTBK2, CEP83, OFD1, CNTRL, CEP192, SFI1, TUBA1A, CEP131, CEP290, CEP57, NINL, IQCB1, CENPJ, CC2D2A, ALMS1, CEP164, MAPRE1, ODF2, CEP250, TCTN3, NPHP4, AKAP9, SDCCAG8, HSP90AA1, HAUS3, CSNK1D, CEP162
REACTOME_SIGNALING_BY_KIT_IN_DISEASE	0.522595596755504	0.887497900972212	0.357839349521034	0.976349692871463	450	14	SRC, FYN, YES1, JAK2, PIK3R3, KRAS, NRAS, STAT5A, STAT3, PIK3CA, GRB2, SOS1
REACTOME_HYALURONAN_BIOSYNTHESIS_AND_EXPORT	0.543186180422265	0.902943926176528	0.733021988713758	0.975600280999815	282	1	ABCC5
REACTOME_AURKA_ACTIVATION_BY_TPX2	0.536659877800407	0.897478008406639	0.280225910125929	0.97270166747735	526	55	HAUS5, CSNK1E, DYNLL1, CEP78, HAUS4, OFD1, CNTRL, CEP192, SFI1, TUBA1A, CEP131, CEP290, CEP57, NINL, CENPJ, ALMS1, CEP164, MAPRE1, ODF2, CEP250
REACTOME_POU5F1_OCT4_SOX2_NANOG_REPRESS_GENES_RELATED_TO_DIFFERENTIATION	0.54510556621881	0.903909230059039	0.729811247324382	0.971327011916594	283	1	TSC22D1
REACTOME_DEFECTIVE_RIPK1_MEDIATED_REGULATED_NECROSIS	0.547085201793722	0.905282039178664	0.559458933437135	0.970755486340618	365	3	TRAF2, RIPK1, TRADD
REACTOME_ACTIVATED_NTRK2_SIGNALS_THROUGH_RAS	0.54259501965924	0.902943926176528	0.4320936106288	0.9705708169645	413	7	NTRK2, SHC1, KRAS, NRAS, GRB2, SOS1
REACTOME_INTERACTIONS_OF_VPR_WITH_HOST_CELLULAR_PROTEINS	0.54384133611691	0.902943926176528	0.29800898990747	0.969942794655952	520	34	SLC25A6, SLC25A5, NUP155, AAAS, NUP160, NUP107, NUP85, NUP35, PSIP1, POM121C, NUP93, NUP50, POM121, NUP54, NUP43, RAE1, NUP133, TPR, NUP205, NUP62, NUP153
REACTOME_SNRNP_ASSEMBLY	0.551373346897253	0.908552307465914	0.283420560907235	0.968746863273537	541	48	NUP155, AAAS, NUP160, GEMIN8, NUP107, NUP85, NCBP1, NUP35, POM121C, NUP93, NUP50, POM121, GEMIN6, NUP54, NUP43, RAE1, NUP133, GEMIN4, TPR, SNRPF, NUP205, NUP62, GEMIN2, NUP153, NUP58, SNRPB, TGS1, SEH1L, NCBP2, NUP98, SNRPD1, SNRPD3, GEMIN5
REACTOME_SIGNALING_BY_NUCLEAR_RECEPTORS	0.602397602397602	0.926450789668615	0.256515652731385	0.968738124495602	602	168	CYP26B1, SPHK1, SRC, MOV10, ABCA1, GNB4, TLE3, MMP2, CXCL12, PLTP, JUN, CAV2, POU2F1, JUND, SCD, AREG, PLIN1, GNAI2, GNB1, RUNX1, IGF1R, GNG12, MYC, ZNF217, ZDHHC21, ABCG1, KCTD6, GNG10, ATF2, XPO1, HSPB1, ALDH1A2, FOS, ALDH1A3, NR1H3, RDH11, CHD1, CREB1, AGO3, ERBB4, SREBF1, APOD, TBL1XR1, POLR2H, GNAI3, TNRC6A, CCND1, CAV1, CPT1A, PGR, GTF2F1, FOXO3, DDX5, APOC1, RXRB, AKT3, CCNT1, TNRC6C, GNAI1, RARB, CDKN1B, HSP90AA1, SHC1, RARG, HSP90AB1, ALDH1A1, PTK2, NCOA1, AKT2, TNRC6B, HDAC1, KAT5, MYLIP, POLR2A, ESR1, PIK3R3, POLR2G, EGFR
REACTOME_EGFR_INTERACTS_WITH_PHOSPHOLIPASE_C_GAMMA	0.553064275037369	0.909495778532746	0.557832060979078	0.967932588590943	369	3	AREG, EGFR, EGF
REACTOME_CREB1_PHOSPHORYLATION_THROUGH_THE_ACTIVATION_OF_ADENYLATE_CYCLASE	0.538853503184713	0.900188849103474	0.400639715181807	0.967341445315906	422	9	PRKX, PRKAR1B, CREB1, PRKACB, PRKAR1A
REACTOME_SLC_TRANSPORTER_DISORDERS	0.546938775510204	0.905282039178664	0.280495364458315	0.966006586356661	535	52	AVPR1A, CP, SLC33A1, NUP155, SLCO2A1, AAAS, NUP160, NUP107, NUP85, NUP35, SLC2A1, SLC9A9, POM121C, SLC35A3, SLC26A2, NUP93, NUP50, POM121, NUP54, NUP43, RAE1, NUP133, SLC35A1, TPR, NUP205, NUP62, SLC36A2, NUP153
REACTOME_TRANSCRIPTIONAL_REGULATION_BY_MECP2	0.539649845520082	0.900562162587654	0.289234512399722	0.965429621802334	523	40	MOV10, SLC2A3, DLL1, GAMT, RBFOX1, DGCR8, NOTCH1, PPARG, PTEN, CREB1, AGO3, TBL1XR1, CAMK2D, TNRC6A, LBR, HDAC2, TNRC6C, CAMK2B, TNRC6B, SIN3A, HDAC1
REACTOME_NEUROTOXICITY_OF_CLOSTRIDIUM_TOXINS	0.562380038387716	0.915177453773799	0.725141078030745	0.965111347795543	292	1	VAMP2
REACTOME_TOXICITY_OF_BOTULINUM_TOXIN_TYPE_D_BOTD	0.562380038387716	0.915177453773799	0.725141078030745	0.965111347795543	292	1	VAMP2
REACTOME_INTEGRIN_SIGNALING	0.535260115606936	0.897478008406639	0.346520162923484	0.964223362860148	462	15	SRC, FN1, RAP1B, RAPGEF3, VWF, SHC1, PTK2, RASGRP2, CSK, AKT1, TLN1
REACTOME_ASSOCIATION_OF_TRIC_CCT_WITH_TARGET_PROTEINS_DURING_BIOSYNTHESIS	0.556256572029443	0.909922300968037	0.298830758784325	0.96207387580752	528	32	SPHK1, USP11, KIFC3, CCT3, TP53, NOP56, CCT4, CCT8, FBXW5, FKBP9, SKIV2L, LONP2, CCT6B, GBA, CCT7, FBXW2, WRAP53, FBXL5
REACTOME_BASE_EXCISION_REPAIR_AP_SITE_FORMATION	0.52954808806489	0.891273655715211	0.352392026917234	0.961486901067514	456	14	ACD, NEIL1, TERF2IP, TERF1, OGG1, NTHL1, TERF2
REACTOME_REGULATION_OF_PTEN_MRNA_TRANSLATION	0.543949044585987	0.902943926176528	0.398078208505451	0.961156707566259	426	9	MOV10, PTEN, AGO3, TNRC6A, TNRC6C, TNRC6B
REACTOME_SENSING_OF_DNA_DOUBLE_STRAND_BREAKS	0.548257372654156	0.906267707478793	0.446535373352287	0.960109448416163	408	6	ATM, MRE11, KAT5, NBN, RAD50
REACTOME_SCAVENGING_BY_CLASS_F_RECEPTORS	0.558904109589041	0.912354372039432	0.475959303221755	0.959179292293906	407	5	SCARF1, HSP90AA1, HSPH1, CALR
REACTOME_TRANSPORT_OF_CONNEXONS_TO_THE_PLASMA_MEMBRANE	0.558904109589041	0.912354372039432	0.474931471981195	0.957107950405546	407	5	GJA1, TUBA1A
REACTOME_IRF3_MEDIATED_ACTIVATION_OF_TYPE_1_IFN	0.575485799701046	0.925013984795547	0.551179279013404	0.956388891267301	384	3	IRF3, DTX4
REACTOME_PERK_REGULATES_GENE_EXPRESSION	0.569444444444444	0.921901819430141	0.30583481300173	0.955998509505256	532	27	NFYA, EXOSC9, EXOSC5, EXOSC4, CEBPB, EIF2AK3, EXOSC6, EXOSC8, EIF2S3, DCP2, ATF6, KHSRP, HERPUD1, CCL2, EXOSC1, NFYC, EXOSC3, DIS3, DDIT3, HSPA5
REACTOME_REGULATION_OF_GENE_EXPRESSION_BY_HYPOXIA_INDUCIBLE_FACTOR	0.553619302949062	0.909495778532746	0.444472249886228	0.955673463158957	412	6	HIF1A, EPAS1, CITED2, HIF3A
REACTOME_SIGNALING_BY_MET	0.57258883248731	0.92413721218691	0.271976385077828	0.955097039683173	563	60	SRC, COL27A1, LAMA4, COL5A1, LAMA5, SH3GL1, ITGA3, COL1A1, FN1, CBL, COL1A2, RPS27A, RAP1B, COL3A1, LAMB1, DOCK7, SH3KBP1, LAMC1, LAMC2, MUC20, LAMA2, TNS3, RANBP10, SHC1, PTK2, LAMB2, UBA52, COL5A3, KRAS, NRAS
REACTOME_PI_METABOLISM	0.570121951219512	0.922049081601927	0.272527049665702	0.954690389950666	560	58	PLEKHA2, PLEKHA5, INPP5D, PIK3C2A, PI4K2B, INPP5E, PIP4K2A, INPP4B, PTEN, PTPN13, INPP4A, MTMR1, PIK3R4, PIP5K1B, MTMR12, PLEKHA8, RAB14, SBF2, TNFAIP8L3, PIKFYVE, SACM1L, PLEKHA3, MTMR2, PLEKHA6, PLEKHA4, PNPLA7
REACTOME_KILLING_MECHANISMS	0.549044585987261	0.906497263265364	0.395082041483026	0.953922485825249	430	9	NOXA1, JUN, CYBA
REACTOME_MITOTIC_PROMETAPHASE	0.612	0.926450789668615	0.256284597875761	0.953890628308011	611	128	HAUS5, CSNK1E, PPP2R1B, EML4, DYNLL1, CEP78, HAUS4, OFD1, CNTRL, CENPC, CEP192, TUBGCP2, SFI1, MZT2B, TUBA1A, KNTC1, CEP131, TUBGCP6, CEP290, CEP57, NUP160, RCC2, NUP107, NUP85, TUBG2, NINL, XPO1, ITGB3BP, CENPJ, MAD1L1, ALMS1, CEP164, NDEL1, CENPP, SKA2, MAPRE1, ODF2, NEK6, CEP250, NUMA1, PDS5B, CSNK2A2, AKAP9, BUB3, SDCCAG8, NUDC, SMC4, HSP90AA1, RANGAP1, HDAC8, HAUS3, SMC2, CSNK1D, NUP43, NUP133, RPS27, NEK9, CLASP2, CLASP1
REACTOME_DEFECTS_IN_COBALAMIN_B12_METABOLISM	0.554838709677419	0.909495778532746	0.408371827506394	0.952527672090018	429	8	ABCD4, MTR, MMAB, TCN2
REACTOME_TRAFFICKING_OF_MYRISTOYLATED_PROTEINS_TO_THE_CILIUM	0.576980568011958	0.925523931545712	0.548472449594181	0.951692086279032	385	3	NPHP3, ARL3, UNC119B
REACTOME_METABOLISM_OF_RNA	0.714285714285714	0.945639216423885	0.240248638397719	0.951516663093413	714	568	PSMB8, RBM5, SRRM1, PSMB9, CSNK1E, DDX39B, PPIH, RPL3, QTRT1, SRSF5, SRSF10, SNRPA, HNRNPH1, TRMT44, NSUN6, ERI1, PPIL4, SRSF7, PRPF3, RBM28, PAN2, ZFP36, MAPK11, SYMPK, TRMT112, PAN3, PSME2, SRSF6, HNRNPM, TRMT11, HNRNPA3, ANP32A, HNRNPU, SNRNP70, ADAT2, CNOT6L, WDR75, SRSF3, PTBP1, RBMX, HNRNPA1, ZFP36L1, TSEN54, NUP155, THADA, TRMT5, CPSF7, CSTF3, AAAS, RPL31, OSGEP, CNOT3, XAB2, SF3A2, CNOT9, HNRNPC, RPS8, RPL12, SRSF1, EIF4A3, RRP7A, ADAR, LSM11, RPL35A, NUP160, EXOSC9, U2AF1L4, GEMIN8, GTPBP3, RPL36A, SMG1, TYW5, NUP107, GTF2H4, AQR, PRPF6, NUP85, TNFSF13, PSME1, U2SURP, NXT1, RPL36, RPL24, RPS27A, RPL28, EXOSC5, NCBP1, NUP35, RPL10A, SRSF11, RPL15, XPO1, HSPB1, RPS9, ADARB1, HNRNPL, NOP56, RPL34, EXOSC4, WDR18, RNPC3, RPS6, PRPF38A, UPF3A, NOP58, LSM7, PABPN1, RPL11, DCP1B, SF1, HNRNPD, RPS11, POLDIP3, PSMD10, RPL35, RPL17, FUS, RPS19, SRRM2, PDCD7, UPF1, NOL12, SRSF2, RPS4X, RPL13, RPL23A, PCF11, RPL18A, U2AF2, DHX9, PABPC1, POM121C, RPL7A, THG1L, RPS17, POLR2H, NAT10, RPL37, CPSF1, SF3B1, SNRNP40, EXOSC10, HNRNPR, MAPK14, RPL13A, RPL19, FAU, RPL23, WDR33, SRSF9, DDX39A, PPWD1, EXOSC6, SRRT, RPS18, PPIE, RPS15, NUP93, METTL14, NUP50, RPS24, TRMU, SNRNP200, NT5C3B, GTF2F1, ELAC2, EXOSC8, POM121, PUS1, RPS3A, MAGOH, RPL26, DDX5, RPL7, RPL22, RPS3, RCL1, QTRT2, SF3B3, PQBP1, RPL29, CTU1, PAPOLA, RPS16, RPS20, RPS5, SKIV2L, HNRNPA0, RPL14, YWHAZ, RPL6, LSM8, RPS7, DCP2, PDCD11, ERCC2, PSMB10, METTL1, PELP1, RPS12, GTF2H3, NHP2, RPL9, DIMT1, SARNP, CNOT2, SMG9, NOB1, WDR36, THOC2, GEMIN6, LSM6, RPS2, RNPS1, CSTF1, MTERF4, TBL3, GPKOW, DUS2, NXF1, RPS21, CHERP, HNRNPH2, RPL4, NUP54, RPL5, TEX10, CASC3, CSNK1D, RPS23, RNMT, NUP43, RAE1, NUP133, PPIL3, RPS27, RPS25, MTO1, RPL37A, GEMIN4, NIP7, UBA52, RPP30, UTP20, CDKAL1, RPL32, SMG6, LCMT2, TSEN34, RPL41, C2orf49, POP5, SF3B6, SUGP1, PLRG1, POLR2A, ZNF473, RRP1, POLR2G, TPR, TYW3, SART1, KHSRP, XRN1, HNRNPF, GAR1, PRKCD, SNRPF, SRSF4, EMG1, HSPA1A, NUP205, CPSF4, NUDT21, MPHOSPH6, RPP40, WDR4, ZRSR2, NUP62, NOP2, GEMIN2, NSUN4
REACTOME_UREA_CYCLE	0.579250720461095	0.925833928208044	0.50454606843428	0.950005585918049	401	4	ASL, NMRAL1, ASS1
REACTOME_TRANSCRIPTIONAL_REGULATION_OF_WHITE_ADIPOCYTE_DIFFERENTIATION	0.591277890466531	0.926450789668615	0.268034151236737	0.948929455990883	582	64	TGFB1, CEBPA, MED17, HELZ2, NR2F2, PLIN1, ANGPTL4, EBF1, CEBPD, FABP4, SMARCD3, PPARG, ZNF638, CEBPB, SREBF1, MED28, MED23, TBL1XR1, MED29, MED30, MED12, MED22, FAM120B, CCND3, CCNC, MED9
REACTOME_SIGNALING_BY_ERBB2	0.574665293511843	0.924640574616804	0.286724422249668	0.948862784738206	557	38	SRC, FYN, ERBB3, PTPN18, PTPN12, ERBIN, RPS27A, CDC37, ERBB4, ERBB2, YES1, RHOA, AKT3, HSP90AA1, SHC1, AKT2, UBA52, EGFR, PRKCD, KRAS, NRAS
REACTOME_APOPTOTIC_CLEAVAGE_OF_CELLULAR_PROTEINS	0.580818965517241	0.925833928208044	0.305464112128113	0.945884917549145	538	25	TJP2, GSN, SPTAN1, VIM, DBNL, ROCK1, CTNNB1, ACIN1, TJP1, CASP7, PTK2, PRKCD, LMNA, DSP, BCAP31
REACTOME_TRANSPORT_OF_INORGANIC_CATIONS_ANIONS_AND_AMINO_ACIDS_OLIGOPEPTIDES	0.584097859327217	0.926450789668615	0.275882482259447	0.945777395236145	572	50	SLC12A7, SLC26A11, SLC12A4, SLC9A1, SLC20A1, SLC1A5, SLC25A29, SLC7A1, SRI, SLC4A7, SLC15A3, SLC1A7, SLC9A9, SLC36A1
REACTOME_PHENYLALANINE_AND_TYROSINE_METABOLISM	0.576712328767123	0.925523931545712	0.469222940432998	0.945603804539767	420	5	FAH, ASRGL1, KYAT1, PCBD1
REACTOME_MATURATION_OF_SARS_COV_1_SPIKE_PROTEIN	0.580821917808219	0.925833928208044	0.468734592661305	0.944619659326354	423	5	PRKCSH, MOGS, GANAB
REACTOME_BICARBONATE_TRANSPORTERS	0.587896253602305	0.926450789668615	0.501394568476922	0.944071652921997	407	4	SLC4A7, SLC4A2, AHCYL2
REACTOME_SENESCENCE_ASSOCIATED_SECRETORY_PHENOTYPE_SASP	0.585641025641026	0.926450789668615	0.280311304445879	0.942521779236992	570	42	IGFBP7, JUN, CDK2, ANAPC7, CDKN1A, ANAPC2, CDK6, FZR1, RPS27A, FOS, CEBPB
REACTOME_RND2_GTPASE_CYCLE	0.589171974522293	0.926450789668615	0.296705154051898	0.941587518273652	554	30	NISCH, KCTD13, WDR6, RBMX, FRS3, PTPN13, CKAP4, CAV1, PKP4, TNFAIP1, ALDH3A2, PLXND1, FRS2, NUDC, ARHGAP1, LEMD3, KIDINS220
REACTOME_NEGATIVE_REGULATION_OF_NMDA_RECEPTOR_MEDIATED_NEURONAL_TRANSMISSION	0.565605095541401	0.918949365824428	0.389932068673481	0.941487916929197	443	9	PPM1F, CAMK1, CAMK2D, CAMK2B, DLG4, CAMK2A
REACTOME_IRAK4_DEFICIENCY_TLR2_4	0.566451612903226	0.918949365824428	0.403583465126614	0.941358812331534	438	8	S100A8, MYD88, IRAK4, TLR4, HMGB1, CD14, CD36
REACTOME_NR1H3_NR1H2_REGULATE_GENE_EXPRESSION_LINKED_TO_CHOLESTEROL_TRANSPORT_AND_EFFLUX	0.581296493092455	0.925833928208044	0.299961299781696	0.941200261047165	546	28	MOV10, ABCA1, PLTP, ABCG1, NR1H3, AGO3, APOD, TBL1XR1, TNRC6A, APOC1, RXRB, TNRC6C, NCOA1, TNRC6B
REACTOME_EFFECTS_OF_PIP2_HYDROLYSIS	0.572390572390572	0.92413721218691	0.320482214200383	0.939109494353981	509	19	DGKH, ITPR1, ITPR3, DGKQ, DGKE, ITPR2, PRKCH, RASGRP2, DGKZ, ABHD12, PRKCD, DGKG
REACTOME_SIGNALING_BY_ROBO_RECEPTORS	0.674325674325674	0.943036844836533	0.246874361424346	0.938085714823046	674	182	SRC, ROBO3, CXCR4, PSMB8, PSMB9, RPL3, SRGAP2, CXCL12, PSME2, ABL2, SLIT3, SRGAP3, NRP1, RPL31, RPS8, RPL12, EIF4A3, RPL35A, EVL, RPL36A, CAP1, NTN1, PSME1, RPL36, RPL24, RPS27A, COL4A5, RPL28, NCBP1, RPL10A, RPL15, RPS9, RPL34, ZSWIM8, RPS6, UPF3A, ABL1, RPL11, RPS11, PRKACB, PSMD10, RPL35, RPL17, RPS19, RPS4X, RPL13, MYO9B, RPL23A, RPL18A, PABPC1, RPL7A, RPS17, RPL37, CDC42, RPL13A, RPL19, FAU, RPL23, RHOA, RPS18, RPS15, RPS24, RPS3A, MAGOH, RPL26, RPL7, RPL22, RPS3, RPL29, RPS16, RPS20, RPS5, RPL14, RPL6, RPS7, PAK6, PSMB10, RPS12, RPL9, LDB1, RPS2, RNPS1, RPS21, RBX1, RPL4, RPL5, CASC3, RPS23, RPS27, RPS25, RPL37A, UBA52, CLASP2, RPL32, RPL41, CLASP1
REACTOME_SUMOYLATION_OF_TRANSCRIPTION_COFACTORS	0.591858037578288	0.926450789668615	0.287871504974171	0.936947882421795	566	34	CBX4, NPM1, DDX17, PHC3, PCGF2, UHRF2, TRIM28, RING1, ZNF350, SUMO2, DDX5, SAFB, PIAS2, UBE2I, NCOA1, SIN3A, MBD1, RNF2, PHC1
REACTOME_TRNA_PROCESSING_IN_THE_NUCLEUS	0.596330275229358	0.926450789668615	0.273140301846431	0.9363766814719	584	50	TSEN54, NUP155, AAAS, NUP160, NUP107, NUP85, NUP35, POM121C, CPSF1, NUP93, NUP50, ELAC2, POM121, NUP54, NUP43, RAE1, NUP133, RPP30, TSEN34, C2orf49, POP5, TPR, NUP205, CPSF4, RPP40, NUP62, NUP153, POP1, FAM98B, TRNT1, NUP58, RAN
REACTOME_TNFR1_INDUCED_NFKAPPAB_SIGNALING_PATHWAY	0.599137931034483	0.926450789668615	0.302375759712333	0.936321679662343	555	25	BIRC3, TRAF1, TRAF2, RPS27A, TAB1, USP4, MAP3K7, RACK1, SHARPIN, RIPK1, UBA52, TRADD
REACTOME_BIOSYNTHESIS_OF_MARESINS	0.59967585089141	0.926450789668615	0.604943076773377	0.935773259552073	369	2	EPHX2, ALOX5
REACTOME_HCMV_EARLY_EVENTS	0.608961303462322	0.926450789668615	0.26696267311984	0.932690596899202	597	57	PML, DYNLL1, NUP155, TUBA1A, AAAS, NUP160, NUP107, NUP85, NUP35, CREB1, EZH2, TRIM28, POM121C, TBL1XR1, NUP93, NUP50, POM121, SUZ12, EED, NUP54, NUP43, RAE1, NUP133, RBBP4, EGFR, TPR, NUP205, DYNC1I2, NUP62, NUP153
REACTOME_UPTAKE_AND_FUNCTION_OF_DIPHTHERIA_TOXIN	0.595890410958904	0.926450789668615	0.462624612581342	0.932306492361533	434	5	CD9, HSP90AA1, HSP90AB1, EEF2
REACTOME_FRUCTOSE_CATABOLISM	0.621823617339312	0.926450789668615	0.53690703752217	0.931624148223742	415	3	TKFC, ALDH1A1, GLYCTK
REACTOME_METABOLISM_OF_WATER_SOLUBLE_VITAMINS_AND_COFACTORS	0.652261306532663	0.933768933768934	0.256405953483617	0.92989909588908	648	84	SLC23A2, SLC2A3, ABCD4, PARP10, NT5E, MTR, NADSYN1, NNMT, NAXD, PARP4, ALDH1L2, PDXK, QPRT, PARP16, SLC19A1, NMRK1, SLC2A1, MTHFD2L, ENPP2, NAPRT, NADK, PARP9, ACACA, CYB5A, CYB5R3, MTHFR, PPCDC, MMAB, PDZD11
REACTOME_INSERTION_OF_TAIL_ANCHORED_PROTEINS_INTO_THE_ENDOPLASMIC_RETICULUM_MEMBRANE	0.56878612716763	0.921785352481974	0.33418161806551	0.929890257636532	491	15	SERP1, APP, PRNP, VAMP2, CYB5A, SEC61B, ALDH3A2, EMD
REACTOME_CHOLINE_CATABOLISM	0.626307922272048	0.926450789668615	0.535735605563342	0.929591516455901	418	3	SLC44A1, ALDH7A1
REACTOME_RUNX2_REGULATES_GENES_INVOLVED_IN_CELL_MIGRATION	0.602739726027397	0.926450789668615	0.461064344500776	0.929162154551188	439	5	ITGA5, AKT3, AKT2, AKT1, CBFB
REACTOME_SIGNALING_BY_ALK_IN_CANCER	0.623217922606925	0.926450789668615	0.271869357441286	0.927057039530488	611	47	MYH9, EML4, MSN, NPM1, FN1, JUNB, RRBP1, FRS3, HIP1, RPS6, CEBPB, EIF2AK3, PRKAR1A, LMO7, RNF213, FRS2, SHC1, RBX1, TPR, TFG, STAT5A, PPFIBP1, MECP2, SEC31A
REACTOME_RND1_GTPASE_CYCLE	0.602550478214665	0.926450789668615	0.295423106721352	0.926960595809726	566	28	FLOT2, WDR6, RBMX, RASAL2, FRS3, PTPN13, CCDC88A, CAV1, PKP4, ALDH3A2, FRS2, LEMD3, KIDINS220, ANKRD26, CPD, DST, DSP, STIP1
REACTOME_GALACTOSE_CATABOLISM	0.610951008645533	0.926450789668615	0.491736774215401	0.925887072622791	423	4	GALT, GALE, GALK1
REACTOME_SYNTHESIS_OF_5_EICOSATETRAENOIC_ACIDS	0.612391930835735	0.926450789668615	0.491678832116788	0.925777973928368	424	4	GPX1, PON2, ALOX5, GPX4
REACTOME_FRUCTOSE_METABOLISM	0.612391930835735	0.926450789668615	0.491605374528092	0.925639661247019	424	4	TKFC, ALDH1A1, GLYCTK
REACTOME_SYNTHESIS_OF_LIPOXINS_LX	0.62780269058296	0.926450789668615	0.533345166584219	0.925443702174896	419	3	PTGR1, ALOX5, HPGD
REACTOME_ACTIVATED_NTRK3_SIGNALS_THROUGH_RAS	0.597855227882037	0.926450789668615	0.430257509233703	0.925109911821877	445	6	NTRK3, SHC1, KRAS, NRAS, GRB2, SOS1
REACTOME_STAT3_NUCLEAR_EVENTS_DOWNSTREAM_OF_ALK_SIGNALING	0.597855227882037	0.926450789668615	0.430153551557766	0.924886389223538	445	6	HIF1A, HDAC2, SIN3A, HDAC1, CD274, STAT3
REACTOME_INSULIN_PROCESSING	0.594501718213058	0.926450789668615	0.324132165593289	0.924239120423017	518	17	RAB27A, SLC30A7, MYRIP, VAMP2, CPE, EXOC7
REACTOME_ONCOGENIC_MAPK_SIGNALING	0.627789046653144	0.926450789668615	0.260727462419872	0.923061363391151	618	64	ACTG1, SRC, ZC3HAV1, ACTB, SPRED1, BCL2L11, MAP3K11, FN1, SPRED2, IQGAP1, BRAF, PAPSS1, AGK, RAP1B, DUSP6, KSR1, CAMK2D, FAM131B, JAK2, ATG7, CLCN6, ARRB2, AKAP9, VWF, CAMK2B, DUSP16, SND1, DUSP10, ARRB1, CSK, KRAS, DUSP8, NRAS, AGTRAP, LMNA, CAMK2A
REACTOME_INTERLEUKIN_12_SIGNALING	0.607781282860147	0.926450789668615	0.286625741029031	0.922780301130323	577	32	CNN2, MTAP, MSN, PDCD4, PSME2, PPIA, RAP1B, CFL1, CDC42, JAK2
REACTOME_SODIUM_COUPLED_PHOSPHATE_COTRANSPORTERS	0.620745542949757	0.926450789668615	0.5961414081235	0.922158150167031	382	2	SLC20A1
REACTOME_ETHANOL_OXIDATION	0.604193971166448	0.926450789668615	0.410391269227975	0.921822909785801	460	7	ADH1B, ALDH2, ALDH1A1, ADH5, ACSS2, ALDH1B1, ACSS1
REACTOME_ANTIGEN_PRESENTATION_FOLDING_ASSEMBLY_AND_PEPTIDE_LOADING_OF_CLASS_I_MHC	0.59371492704826	0.926450789668615	0.314516225157193	0.921627348058747	528	19	SEC24D, B2M, TAPBP, TAP2, TAP1
REACTOME_ESTROGEN_BIOSYNTHESIS	0.629558541266795	0.927522049551454	0.691768826619965	0.92069524793054	327	1	HSD17B11
REACTOME_SIGNALLING_TO_P38_VIA_RIT_AND_RIN	0.623987034035656	0.926450789668615	0.594628782718692	0.919818302898941	384	2	BRAF, RIT1
REACTOME_LYSINE_CATABOLISM	0.590967741935484	0.926450789668615	0.394341160814506	0.91980112882306	457	8	PHYKPL, HYKK, ALDH7A1
REACTOME_SIGNALING_BY_FGFR_IN_DISEASE	0.614830072090628	0.926450789668615	0.277793608782063	0.919307867614786	596	38	CNTRL, FGF2, FGFR1, NCBP1, POLR2H, FGFR1OP2, FGFR4, GTF2F1, FRS2, FGF1, POLR2A, POLR2G, BAG4, KRAS, NRAS, LRRFIP1, BCR, STAT5A, POLR2K, GAB1, POLR2L, ERLIN2, NCBP2, POLR2E, POLR2I, STAT3, PIK3CA, GRB2, ZMYM2, SOS1
REACTOME_XENOBIOTICS	0.621037463976945	0.926450789668615	0.48818066525204	0.919191304702509	430	4	AHR, CYP2J2
REACTOME_MATURATION_OF_SARS_COV_1_NUCLEOPROTEIN	0.588535031847134	0.926450789668615	0.380342191953281	0.918333234915933	461	9	PARP10, PARP4, PARP16, PARP9
REACTOME_PHASE_3_RAPID_REPOLARISATION	0.625607779578606	0.926450789668615	0.59365573610976	0.918313118309023	385	2	AKAP9, KCNE4
REACTOME_IKBA_VARIANT_LEADS_TO_EDA_ID	0.601876675603217	0.926450789668615	0.427026148919127	0.918162064564066	448	6	NFKB2, NFKBIA, RELA, NFKB1, IKBKB
REACTOME_METHIONINE_SALVAGE_PATHWAY	0.601876675603217	0.926450789668615	0.426897187333948	0.917884780290966	448	6	MTAP, MRI1, ENOPH1, ADI1
REACTOME_TFAP2A_ACTS_AS_A_TRANSCRIPTIONAL_REPRESSOR_DURING_RETINOIC_ACID_INDUCED_CELL_DIFFERENTIATION	0.639760837070254	0.928975069252078	0.528902296613468	0.917734574406202	427	3	NPM1, HSPD1, NOP2
REACTOME_FORMATION_OF_SENESCENCE_ASSOCIATED_HETEROCHROMATIN_FOCI_SAHF	0.588535031847134	0.926450789668615	0.379973403282168	0.917442797566333	461	9	CDKN1A, TP53, EP400, CABIN1
REACTOME_HIGHLY_SODIUM_PERMEABLE_POSTSYNAPTIC_ACETYLCHOLINE_NICOTINIC_RECEPTORS	0.627228525121556	0.926450789668615	0.5930719081444	0.917410007555072	386	2	CHRNG, CHRND
REACTOME_CYTOSOLIC_SENSORS_OF_PATHOGEN_ASSOCIATED_DNA	0.630722278738555	0.928035983462342	0.268138375341965	0.916511523385249	619	48	IRF3, IFI16, NFKB2, STAT6, TRIM21, TRIM56, IRF7, DDX41, MRE11, RPS27A, DTX4, TRIM32, MYD88, DHX9, POLR2H, CTNNB1, POLR1C, POLR3B, NFKBIA, RIPK1, UBA52, RELA, LRRFIP1, POLR3H, POLR3F, CRCP, NFKB1, POLR3C, POLR2K
REACTOME_P75NTR_NEGATIVELY_REGULATES_CELL_CYCLE_VIA_SC1	0.628242074927954	0.926450789668615	0.486412361495337	0.915861780301137	435	4	NGFR, HDAC2, HDAC1
REACTOME_RUNX1_REGULATES_ESTROGEN_RECEPTOR_MEDIATED_TRANSCRIPTION	0.60455764075067	0.926450789668615	0.42579441099065	0.915513666937187	450	6	RUNX1, KCTD6, ESR1, GPAM, CBFB
REACTOME_REGULATION_OF_TLR_BY_ENDOGENOUS_LIGAND	0.592258064516129	0.926450789668615	0.392392359451829	0.915255547810062	458	8	GSDMD, S100A8, TLR4, HMGB1, CD14, CD36
REACTOME_CONSTITUTIVE_SIGNALING_BY_EGFRVIII	0.605667060212515	0.926450789668615	0.341870593091627	0.915232367168364	512	13	CBL, CDC37, HSP90AA1, SHC1, EGFR, KRAS, NRAS, GAB1, PIK3CA, GRB2, SOS1
REACTOME_MAP2K_AND_MAPK_ACTIVATION	0.616365568544102	0.926450789668615	0.291350522645811	0.914181890030595	579	28	ACTG1, SRC, ACTB, FN1, IQGAP1, BRAF, RAP1B, KSR1, ARRB2, VWF, ARRB1, CSK, KRAS, NRAS
REACTOME_LDL_CLEARANCE	0.589803012746234	0.926450789668615	0.335028158437261	0.914110312438639	508	14	LDLR, AP2A2, CES3, LIPA, AP2B1, LSR, AP2M1
REACTOME_ABORTIVE_ELONGATION_OF_HIV_1_TRANSCRIPT_IN_THE_ABSENCE_OF_TAT	0.62122905027933	0.926450789668615	0.309001090144035	0.912742104082978	555	20	NCBP1, NELFE, NELFA, POLR2H, GTF2F1, NELFCD, POLR2A, POLR2G, NELFB, POLR2K, SUPT5H, POLR2L, NCBP2, POLR2E, POLR2I
REACTOME_SODIUM_PROTON_EXCHANGERS	0.619921363040629	0.926450789668615	0.405844978230486	0.911611008338869	472	7	SLC9A1, SLC9A9, SLC9A5
REACTOME_THE_CANONICAL_RETINOID_CYCLE_IN_RODS_TWILIGHT_VISION	0.611260053619303	0.926450789668615	0.423792649039868	0.911209616962383	455	6	CYP4V2, RDH11, RBP1, RDH10, NAPEPLD
REACTOME_SIGNALING_BY_SCF_KIT	0.624731182795699	0.926450789668615	0.292614527991628	0.910808976773056	580	26	FES, SRC, FYN, FER, CBL
REACTOME_P130CAS_LINKAGE_TO_MAPK_SIGNALING_FOR_INTEGRINS	0.622542595019659	0.926450789668615	0.405248089290448	0.910270273433469	474	7	SRC, FN1, RAP1B, VWF, PTK2
REACTOME_MEIOTIC_RECOMBINATION	0.591907514450867	0.926450789668615	0.32685025534943	0.909490084807319	511	15	MSH5, ATM, CDK2, MRE11, MLH3, MLH1, BRCA1, RAD51C, NBN, CDK4, RPA3
