pathway	pval	padj	ES	NES	nMoreExtreme	size	leadingEdge
REACTOME_MITOTIC_G2_G2_M_PHASES	0.925074925074925	1	0.2121217908644	0.777697726500947	925	140	PSMB8, HAUS5, PSMB9, CSNK1E, PPP2R1B, LIN37, CDKN1A, CDK2, HAUS4, CEP131, TP53, CEP192, TUBGCP6, TUBGCP2, OFD1, CNTRL, SFI1, RPS27A, DYNLL1, CEP78, PSME2, CEP290, CDC25B, TUBA1A, TUBG2, CEP164, ALMS1, PSME1, FBXL7, ODF2, PHLDA1, MZT2B, PPP2R3B, CEP57, PPP1R12A, CENPJ
REACTOME_NEF_MEDIATES_DOWN_MODULATION_OF_CELL_SURFACE_RECEPTORS_BY_RECRUITING_THEM_TO_CLATHRIN_ADAPTERS	0.770833333333333	0.968446195105598	0.302239987543861	0.777693660916214	665	12	B2M, AP2A2, AP2M1, AP1S1, AP2B1, PACS1, ARF1, AP2S1, AP2A1
REACTOME_LYSOSOME_VESICLE_BIOGENESIS	0.778256189451023	0.970045155314151	0.259375486804338	0.776789334981555	722	23	APP, ARRB1, AP4M1, TXNDC5, VAMP2, CHMP2A, VAMP8, AP1S1, AP4B1, CTSZ, HGS
REACTOME_GROWTH_HORMONE_RECEPTOR_SIGNALING	0.770833333333333	0.968446195105598	0.301862848760342	0.776723245176022	665	12	SOCS2, SOCS3, SH2B1, STAT5A, JAK2, IRS2, STAT3, ADAM17, STAT5B
REACTOME_MISCELLANEOUS_TRANSPORT_AND_BINDING_EVENTS	0.765571913929785	0.968446195105598	0.283959469252183	0.77525106026756	675	15	TUSC3, LRRC8B, NIPAL2, ADD3, CTNS, LRRC8C, LRRC8A
REACTOME_IRS_MEDIATED_SIGNALLING	0.76931330472103	0.968446195105598	0.260985913309102	0.775066222152892	716	22	FGF2, FGFR1, NRAS, PIK3R4, KRAS, FGFR4, FRS2, AKT2, GAB2, IRS2, PDPK1, FGF1, THEM4
REACTOME_ER_QUALITY_CONTROL_COMPARTMENT_ERQC	0.782135076252723	0.972330063242169	0.267772819257329	0.774866841692044	717	19	MAN1B1, UGGT2, RPS27A, OS9, EDEM1, EDEM2, UBA52, DERL2, SYVN1, RNF185
REACTOME_IRON_UPTAKE_AND_TRANSPORT	0.841237113402062	0.99135892120748	0.23392180883569	0.771177076657145	815	42	STEAP2, TCIRG1, CP, CAND1, SLC22A17, RPS27A
REACTOME_SULFUR_AMINO_ACID_METABOLISM	0.782561894510226	0.972330063242169	0.257272455573569	0.770491082778459	726	23	CSAD, TSTD1, MRI1, MTAP, MTR
REACTOME_CONSTITUTIVE_SIGNALING_BY_ABERRANT_PI3K_IN_CANCER	0.818756585879874	0.986738544474394	0.241413898127597	0.770418138742537	776	33	SRC, FYN, FGF2, PDGFRA, FGFR1, PDGFRB, AREG, ERBB3, EGFR, PDGFB, ERBB2, FGFR4, FRS2, PIK3R3, GAB2, IRS2
REACTOME_HIGHLY_SODIUM_PERMEABLE_POSTSYNAPTIC_ACETYLCHOLINE_NICOTINIC_RECEPTORS	0.834146341463415	0.987621114642276	0.49566994259025	0.770148332098438	512	2	CHRNG, CHRND
REACTOME_MYD88_INDEPENDENT_TLR4_CASCADE	0.877632898696088	0.998561891323511	0.219038712117477	0.769679519664079	874	77	NOD1, NFKB2, IRF3, PPP2R1B, MAP3K8, SAA1, BIRC3, MAPK11, RPS27A, APP, DUSP6, JUN, TLR4, CREB1, IRF7, NFKBIA, ATF2, RIPK1, FOS, RELA, UBA52, TAB1, TRAF6, DUSP4, MAP3K7, CD14, HMGB1, MAPK7
REACTOME_RHOV_GTPASE_CYCLE	0.798087141339001	0.980008644282786	0.246359062701079	0.768977490207505	750	29	MAP3K11, SPTAN1, PEAK1, IQGAP1, ARHGEF7, WDR6
REACTOME_SLBP_DEPENDENT_PROCESSING_OF_REPLICATION_DEPENDENT_HISTONE_PRE_MRNAS	0.789659224441833	0.975753307185392	0.311347953799845	0.76671062939021	671	10	LSM11, NCBP1, SNRPB, SNRPF, NCBP2, SLBP, ZNF473
REACTOME_INTRAFLAGELLAR_TRANSPORT	0.829268292682927	0.986738544474394	0.242652133025927	0.766241211080998	781	31	IFT88, IFT140, IFT122, DYNLL1, TUBA1A, IFT172, DYNC2H1, WDR19, IFT80, WDR35, DYNC2LI1, KIF3B, IFT57, IFT81, CLUAP1, IFT27, TTC21B, KIF3C, IFT46
REACTOME_HATS_ACETYLATE_HISTONES	0.861895161290323	0.996848451492968	0.221038977422225	0.765663512622495	854	67	ACTB, YEATS2, BRD1, KAT2A, RUVBL2, ACTL6A, OGT, MBIP, JADE1, EP400, KAT8, TAF9, SUPT7L, ATF2, ATXN7, TAF12, JADE3, ELP4, BRD8, KAT5, ING3, RUVBL1, TRRAP, KAT6A, ING4, JADE2, TADA2A, SUPT20H, TAF10, MORF4L2, MRGBP, BRPF1, HAT1, MSL1, NCOA1
REACTOME_CROSS_PRESENTATION_OF_PARTICULATE_EXOGENOUS_ANTIGENS_PHAGOSOMES	0.804318488529015	0.983055930424352	0.375795569194672	0.764900793542535	595	5	CYBA, ITGB5, ITGAV, CYBB, CD36
REACTOME_N_GLYCAN_ANTENNAE_ELONGATION_IN_THE_MEDIAL_TRANS_GOLGI	0.794084186575654	0.975855019908988	0.284438642625054	0.763530668839526	697	14	FUCA1, MGAT5, MGAT4A, ST3GAL4, B4GALT1, FUT8
REACTOME_VESICLE_MEDIATED_TRANSPORT	0.993006993006993	1	0.197364952865198	0.762359240333839	993	486	ACTG1, RIN1, SCARF1, RAB27A, SEC24D, MYH9, COL7A1, ARFGAP1, APOL1, GDI1, AMPH, STX6, ACTB, TMED3, SRC, TRAPPC6A, MYO1C, STX16, NECAP2, SAA1, CHMP4A, LRP1, TBC1D2, SH3GL1, C2CD5, PIK3C2A, NECAP1, RAB3IL1, GRK3, TBC1D10A, MAN1A1, RIN3, RAB31, ARPC5, SGIP1, SPTAN1, SEC22A, COL4A2, FCHO2, AP2A2, STON1, TRAPPC2, DAB2, HPS4, RIN2, COL4A1, RPS27A, KIF13B, APP, GJA1, YWHAH, VPS28, DYNLL1, ARF5, STAB1, ALS2CL, DENND6A, MAN1C1, GJA4, VPS54, SSC5D, PAFAH1B2, HIP1, YWHAQ, DENND3, HSP90B1, TUBA1A, ARF4, NAPA, CBL, GAK, RAB13, FTL, SBF2, SYT11, MYO6, HIP1R, PICALM, RHOBTB3, AGTR1, KIFC2, COLEC12, NAPB, DNM1, ASPSCR1, LDLR, ARFIP2, AP3S1, PLA2G6, YWHAZ, COG8, IGHA1, SEC16B, ARRB1, RAB6B, KDELR1, AP4M1, BET1, AREG, RAB5C, CAPZA1, ARPC1A, TXNDC5, DVL2, CTSC, SCARB1, ITSN2, COG1, TBC1D16, TSC2, VAMP4, VPS52, CTTN, HPS1, VAMP2, AKT3, TJP1, SCARA5, GPS1, COPE, GORASP1, GGA3, DCTN6, COG3, RAB14, SEC16A, TRAPPC2L, FNBP1L, CALR, EGFR, REPS1, CYTH2, CHMP2A, COL1A2, CHMP5, VAMP8, UBA52, EXOC7, ARRB2, DENND2A, COG5, DENND4A, KDELR2, AP2M1, VPS53, COL1A1, GOLIM4, SH3D19, VPS37B, BICD1, AP1S1, AP2B1, USP6NL, CPD, GGA2, SPARC, COPG2, TRAPPC6B, BLOC1S6, TPD52L1, COPB1, SBF1, ARPC3, SCFD1, SNAP23, SPTBN1, AAK1, TBC1D24, CSNK1D, LMAN2, GGA1, KIF3B, AGFG1, GABARAP, SEC22B, RAB1A, AKT2, KIF26A, DENND4C, BLOC1S4, AKT1, ULK1, ACTR10, AP4B1, CTSZ, TRAPPC1, SURF4, SEC23IP, ACTR3, SEC31A, CD163, MON1B, OCRL, HGS, EXOC3
REACTOME_BBSOME_MEDIATED_CARGO_TARGETING_TO_CILIUM	0.801752464403067	0.98144484552998	0.266086835877198	0.760113781481358	731	18	BBS1, CCT3, BBS7, BBIP1, CCT4, CCT8, SMO, BBS10, LZTFL1, BBS2, CCT2, TCP1, BBS9
REACTOME_SYNTHESIS_OF_DOLICHYL_PHOSPHATE	0.81331592689295	0.986738544474394	0.354690654524097	0.757902915117341	622	6	MVD, SRD5A3, DHDDS
REACTOME_CARBOXYTERMINAL_POST_TRANSLATIONAL_MODIFICATIONS_OF_TUBULIN	0.793141592920354	0.975855019908988	0.267786604382062	0.756410894924439	716	17	TTLL3, TPGS2, TUBA1A, NICN1, TTLL5, TTLL7, VASH1, AGBL5
REACTOME_SIGNALING_BY_HEDGEHOG	0.926073926073926	1	0.20913477034153	0.756154196801333	926	112	PSMB8, EFCAB7, PSMB9, ADCY4, IFT88, DZIP1, ADCY3, OFD1, IFT140, IFT122, BOC, TULP3, INTU, RPS27A, PSME2, PTCH1, TUBA1A, GAS1, EVC, IFT172, PSME1, DYNC2H1, NUMB, ADCY5, ARRB1, ULK3, CDC73, OS9, ADCY6, SPOPL, WDR19, PSMD10, UBA52, SMURF2, ARRB2, WDR35
REACTOME_SIGNALING_BY_WNT	0.966033966033966	1	0.202725009872873	0.755976900729954	966	186	SOX7, MOV10, PSMB8, PSMB9, CSNK1E, PPP2R1B, TLE3, GNB4, TCF4, FZD6, ITPR3, LRP5, AP2A2, ITPR1, TCF7L2, GNB1, SOX4, RPS27A, SFRP2, MYC, WNT11, PSME2, SOX17, FZD1, TLE4, SFRP1, PSME1, WNT2B, DACT1, RHOA, YWHAZ, GNG12, PLCB2, CDC73, CAV1, DVL2, DAAM1, ITPR2, GNAO1, FZD8, XPO1, PLCB3, PIP5K1B, AGO3, CSNK2A2, CTNNB1, CSNK1G2, PSMD10, TNRC6A, KAT5, GNB2, KRAS, FZD3, UBA52, SMURF2, RUVBL1, ARRB2, TRRAP, HDAC1, NLK, AP2M1
REACTOME_TRANSPORT_OF_BILE_SALTS_AND_ORGANIC_ACIDS_METAL_IONS_AND_AMINE_COMPOUNDS	0.808262711864407	0.986343867930731	0.242389945675753	0.755573489227689	762	28	SLC39A10, CP, SLC30A7, RUNX1, SLC44A1, SLC11A1, SLC39A14, SLC16A7, SLC30A1, SLC30A2, SLC30A5, SLC39A7, SLC39A1, SLC11A2, SLC22A5, SLC31A1
REACTOME_RORA_ACTIVATES_GENE_EXPRESSION	0.812286689419795	0.986738544474394	0.280601957819055	0.75323169367562	713	14	HELZ2, SREBF1, SMARCD3, CPT1A
REACTOME_INFECTION_WITH_MYCOBACTERIUM_TUBERCULOSIS	0.813577586206897	0.986738544474394	0.255182647791156	0.75244346440068	754	21	B2M, SFPQ, RPS27A, TRIM27, ENO1, VPS33B, UBA52, MRC1, RNF213, DUSP16, HGS
REACTOME_REGULATION_OF_MECP2_EXPRESSION_AND_ACTIVITY	0.819251336898396	0.986738544474394	0.244156688995819	0.751936465386758	765	27	MOV10, CREB1, AGO3, TNRC6A, HDAC1, SIN3A, TBL1XR1, LBR, TNRC6C, MECP2, CAMK2D, HDAC2, CAMK2B, TNRC6B, NCOR2
REACTOME_PURINE_CATABOLISM	0.807825086306099	0.986343867930731	0.286573741270828	0.750266459157447	701	13	NT5E, NUDT5, NT5C, ITPA, NUDT1, ADPRM
REACTOME_SUMO_IS_TRANSFERRED_FROM_E1_TO_E2_UBE2I_UBC9	0.817813765182186	0.986738544474394	0.368403586016464	0.749855023282442	605	5	SAE1, UBE2I, SUMO2, UBA2
REACTOME_TRANSPORT_OF_SMALL_MOLECULES	0.994005994005994	1	0.195724486511384	0.749338457097386	994	398	SLC12A7, TPCN2, PSMB8, STEAP2, TRPV2, SLC25A6, TCIRG1, TRPV1, PSMB9, LCAT, LMF2, SLC39A10, MLKL, CP, LMF1, SLCO2A1, STOM, SLC12A4, ABCA1, SLC30A7, CLIC2, TUSC3, SCNN1D, ADCY4, GNB4, SLC25A5, SLC20A1, ATP11C, TRPM7, LRRC8B, SLC25A29, CAND1, SLC9B2, SLC33A1, SLC26A11, ADCY3, ATP8B1, ATP10D, ASIC3, PLTP, ZDHHC8, A2M, SLC1A5, AQP1, ATP8B2, SLC2A3, SLC22A17, CYGB, AP2A2, TTYH3, SLC7A1, MBTPS1, GNB1, RPS27A, SLC50A1, SRI, BMP1, ABCA7, PSME2, PCSK5, ATP13A1, APOD, CLCN6, SLC15A3, NIPAL2, ABCC5, RUNX1, SLC26A2, LIPA, NR1H3, FTL, SLC2A1, SLCO3A1, ABCG1, PSME1, SLC44A1, ABCA6, LDLR, SLC35D1, ADCY5, ABCA5, ATP11B, ADD3, BEST3, SLC16A2, SLC9A9, MICU3, SLC9A1, ABCA9, GNG12, CTNS, SLC4A7, CLCN5, OS9, SLC35A3, SLC8B1, ATP2B4, LSR, ANGPTL4, ATP6AP1, SLC11A1, RIPK1, SCARB1, ADCY6, CES3, APOC1, AQP3, SLC9A5, SLC7A6, ABCA8, ATP6V0A1
REACTOME_BETA_CATENIN_INDEPENDENT_WNT_SIGNALING	0.93006993006993	1	0.207866264346296	0.749327510394988	930	109	MOV10, PSMB8, PSMB9, GNB4, FZD6, ITPR3, AP2A2, ITPR1, TCF7L2, GNB1, RPS27A, MYC, WNT11, PSME2, FZD1, PSME1, RHOA, GNG12, PLCB2, DVL2, DAAM1, ITPR2, GNAO1, FZD8, PLCB3, AGO3, CTNNB1, PSMD10, TNRC6A, GNB2, KRAS, FZD3, UBA52, SMURF2, ARRB2, NLK, AP2M1, MAP3K7, TNRC6C, AP2B1
REACTOME_SIGNALING_BY_INSULIN_RECEPTOR	0.866053169734151	0.996848451492968	0.225401148921129	0.748244882763081	846	44	TCIRG1, FGF2, FGFR1, NRAS, PIK3R4, ATP6AP1, ATP6V0A1, SHC1, KRAS, ATP6V1C1, FGFR4, ATP6V0D1, FRS2, AKT2, ATP6V1B2, ATP6V1A, GAB2, IRS2, ATP6V1F, ATP6V0A2, ATP6V0B, PDPK1, FGF1, THEM4, ATP6V1G1, INSR
REACTOME_NEUREXINS_AND_NEUROLIGINS	0.811546840958606	0.986738544474394	0.258413431019724	0.747783138335008	744	19	EPB41L3, DBNL, LIN7C, SIPA1L1, EPB41L2, APBA3, SHARPIN, EPB41L1, EPB41L5
REACTOME_OTHER_INTERLEUKIN_SIGNALING	0.81184668989547	0.986738544474394	0.295911103580338	0.7477603693018	698	11	CSF1, TXLNA, VAMP2, CSF3R, IL10RB, CSF3, IL16
REACTOME_IRE1ALPHA_ACTIVATES_CHAPERONES	0.866053169734151	0.996848451492968	0.22515514933393	0.747428259009545	846	44	PLA2G4B, ARFGAP1, PDIA5, SERP1, MYDGF, DDX11, TPP1, WFS1, SSR1, HSPA5, EDEM1, SHC1, CUL7, DNAJC3, ATP6V0D1, DNAJB11, TATDN2, SYVN1, XBP1, SEC31A, TLN1, LMNA, GOSR2, PDIA6, FKBP14
REACTOME_SYNTHESIS_OF_DNA	0.917835671342685	1	0.209589328950797	0.747279107627587	915	94	PSMB8, MCM3, PSMB9, POLE, MCM5, LIG1, POLD1, CDK2, ANAPC2, ANAPC7, RFC4, RPS27A, PSME2, RFC2, MCM2, POLD3, POLD2, PSME1, ORC2
REACTOME_CA_DEPENDENT_EVENTS	0.819915254237288	0.986738544474394	0.239713576402372	0.747230760057498	773	28	CAMKK2, ADCY4, ADCY3, PDE1A, PRKX, ADCY5, CREB1, ADCY6, PRKCD, CAMKK1, PRKAR1B, PRKAR1A, PRKACB, CAMK2D, NBEA, CAMK2B
REACTOME_DISEASES_OF_MISMATCH_REPAIR_MMR	0.821862348178138	0.986738544474394	0.366862847834867	0.746718978170812	608	5	PMS2, MSH2, MSH6, MLH1
REACTOME_PI5P_REGULATES_TP53_ACETYLATION	0.826370757180157	0.986738544474394	0.349034043119579	0.745815869071758	632	6	TP53, PIP4K2A, PIN1
REACTOME_BIOSYNTHESIS_OF_THE_N_GLYCAN_PRECURSOR_DOLICHOL_LIPID_LINKED_OLIGOSACCHARIDE_LLO_AND_TRANSFER_TO_A_NASCENT_PROTEIN	0.874111675126904	0.996848451492968	0.219071119614505	0.74355136039125	860	53	ALG13, NAGK, ST6GALNAC4, GFPT2, ALG8, AMDHD2, ALG9, ALG6, ALG10B, MVD, CTSA, DPM2, PMM1, ST3GAL4, GLB1, SRD5A3, DPAGT1, DPM3, MPI, ALG2, DHDDS, ST6GALNAC6, NEU3, ST8SIA5, NEU1, SLC35A1, ALG12, GMPPB, FPGT
REACTOME_RHOBTB3_ATPASE_CYCLE	0.820048309178744	0.986738544474394	0.319053892282921	0.743529886877681	678	8	RHOBTB3, VHL, LRRC41, HGS
REACTOME_ANTIVIRAL_MECHANISM_BY_IFN_STIMULATED_GENES	0.887096774193548	1	0.214770118570967	0.741990873447122	879	65	IRF3, UBE2L6, FLNA, NUP85, NUP155, EIF4A3, NUP107, RPS27A, NUP160, NUP93, POM121C, AAAS, UBA7, MX1, POM121, NUP35, EIF2AK2, NUP54, NUP50, RAE1, PIN1, UBA52, DDX58, NUP205, NUP43, NUP133, TPR, TRIM25, NUP153, NUP62, RNASEL, ABCE1, NUP214, OAS2, NUP58, NUP98
REACTOME_NEGATIVE_REGULATION_OF_ACTIVITY_OF_TFAP2_AP_2_FAMILY_TRANSCRIPTION_FACTORS	0.862068965517241	0.996848451492968	0.429390744980939	0.741547283648714	574	3	KCTD15, UBE2I
REACTOME_E2F_MEDIATED_REGULATION_OF_DNA_REPLICATION	0.825938566552901	0.986738544474394	0.276224924950754	0.741482239372846	725	14	PPP2R1B, ORC2, PPP2R3B, POLA2, ORC3, PPP2R1A, ORC5, MCM8, POLA1, RB1
REACTOME_HIV_INFECTION	0.974025974025974	1	0.198600119091229	0.741096843208549	974	192	PSMB8, SLC25A6, PSMB9, B2M, SLC25A5, TAF1, CCNT2, CHMP4A, LIG1, NPM1, FYN, NELFE, NUP85, CXCR4, NUP155, AP2A2, NELFA, NUP107, RPS27A, VPS28, PSME2, NUP160, ELMO1, NUP93, POM121C, AAAS, PSME1, PPIA, NCBP1, POLR2H, TAF9, POM121, NUP35, NUP54, NUP50, GTF2H4, CCNT1, TAF12, NMT2, RAE1, TAF4, XPO1, RANBP1, GTF2F1, TAF9B, CDK9, PSMD10, SUPT16H, RNMT, GTF2B, CHMP2A, RANGAP1, CHMP5, UBA52, NELFCD, AP2M1, NUP205, NUP43, VPS37B, AP1S1, POLR2A, NUP133, AP2B1, PSIP1, TPR, POLR2G, ERCC2, TAF4B, NELFB, GTF2H3, SUPT5H, TBP, RBX1, PDCD6IP, PACS1, PSMB1, TAF10, NUP153, NUP62, ELL
REACTOME_HOST_INTERACTIONS_OF_HIV_FACTORS	0.931	1	0.205479935660831	0.740380901320176	930	108	PSMB8, SLC25A6, PSMB9, B2M, SLC25A5, NPM1, FYN, NUP85, NUP155, AP2A2, NUP107, RPS27A, PSME2, NUP160, ELMO1, NUP93, POM121C, AAAS, PSME1, PPIA, POM121, NUP35, NUP54, NUP50, CCNT1, RAE1, XPO1, RANBP1, CDK9, PSMD10, RANGAP1, UBA52, AP2M1, NUP205, NUP43, AP1S1, NUP133, AP2B1, PSIP1, TPR
REACTOME_TRANSCRIPTION_OF_E2F_TARGETS_UNDER_NEGATIVE_CONTROL_BY_DREAM_COMPLEX	0.824074074074074	0.986738544474394	0.287586247836482	0.739988125749426	711	12	LIN37, MYC, HDAC1, PCNA, RBBP4, MAX, LIN52
REACTOME_ASPARAGINE_N_LINKED_GLYCOSYLATION	0.976023976023976	1	0.195966165066801	0.736965008692512	976	224	SEC24D, COL7A1, ARFGAP1, TUSC3, TMED3, ALG13, TRAPPC6A, NAGK, MAN1B1, UGGT2, ST6GALNAC4, FUCA1, GFPT2, MAN1A1, PRKCSH, SPTAN1, SEC22A, ENGASE, TRAPPC2, MOGS, RPS27A, DYNLL1, ARF5, MGAT5, ALG8, MAN1C1, AMDHD2, ALG9, TUBA1A, ALG6, ARF4, NAPA, PDIA3, ALG10B, NAPB, STT3A, MVD, COG8, SEC16B, KDELR1, CTSA, GANAB, BET1, AREG, CAPZA1, DPM2, OS9, CTSC, EDEM1, COG1, PMM1, MGAT4A, ST3GAL4, GLB1, COPE, GORASP1, SRD5A3, DCTN6, B4GALT1, EDEM2, COG3, SEC16A, TRAPPC2L, CALR, FUT8, UBA52, COG5, KDELR2, DPAGT1, DPM3, MPI, COPG2, TRAPPC6B, COPB1, SCFD1, SPTBN1, DDOST, CSNK1D, LMAN2, ALG2, SEC22B, RAB1A, DHDDS, ST6GALNAC6, DERL2, SYVN1, ACTR10, NEU3, RNF185, CTSZ, TRAPPC1, SEC23IP, SEC31A
REACTOME_AKT_PHOSPHORYLATES_TARGETS_IN_THE_CYTOSOL	0.823935558112773	0.986738544474394	0.281397943056287	0.736715923150498	715	13	CDKN1A, MDM2, TSC2, AKT3, AKT2, AKT1, CDKN1B, CASP9, MKRN1
REACTOME_INTERLEUKIN_RECEPTOR_SHC_SIGNALING	0.825231481481482	0.986738544474394	0.286108804835588	0.736186517413288	712	12	IL3RA, INPP5D, SHC1, PIK3R3, JAK2, GAB2
REACTOME_APOPTOSIS_INDUCED_DNA_FRAGMENTATION	0.838120104438642	0.989019448073507	0.344522521729772	0.736175651125964	641	6	HMGB2, DFFA, HMGB1
REACTOME_ELEVATION_OF_CYTOSOLIC_CA2_LEVELS	0.83	0.986738544474394	0.328097675914832	0.735755257318522	663	7	ITPR3, ITPR1, ITPR2
REACTOME_PKA_MEDIATED_PHOSPHORYLATION_OF_CREB	0.819089900110988	0.986738544474394	0.263104844213706	0.734646862359094	737	16	ADCY4, ADCY3, PRKX, ADCY5, CREB1, ADCY6, PRKAR1B, PRKAR1A, PRKACB, NBEA
REACTOME_CD28_CO_STIMULATION	0.824034334763948	0.986738544474394	0.247315154707308	0.734467313617521	767	22	SRC, MAP3K8, FYN, CDC42, AKT3, RICTOR, AKT2, YES1, PIK3R3, AKT1
REACTOME_PKA_ACTIVATION_IN_GLUCAGON_SIGNALLING	0.826237054085155	0.986738544474394	0.279819716193442	0.732584034880195	717	13	ADCY4, ADCY3, ADCY5, ADCY6, PRKAR1B, PRKAR1A, PRKACB
REACTOME_N_GLYCAN_TRIMMING_IN_THE_ER_AND_CALNEXIN_CALRETICULIN_CYCLE	0.852476290832455	0.995404970187579	0.229386189950915	0.732034414281404	808	33	MAN1B1, UGGT2, PRKCSH, ENGASE, MOGS, RPS27A, PDIA3, GANAB, OS9, EDEM1, EDEM2, CALR, UBA52
REACTOME_CELL_CYCLE_CHECKPOINTS	0.973026973026973	1	0.196530417941145	0.730799810730871	973	175	PSMB8, MCM3, PSMB9, PPP2R1B, MDC1, WRN, MCM5, CDKN1A, CDK2, TP53, ANAPC2, NUP85, MDM4, ATM, ANAPC7, MDM2, RFC4, NUP107, RPS27A, YWHAH, DYNLL1, MRE11, PSME2, RFC2, NUP160, YWHAQ, CENPC, MCM2, ITGB3BP, KNTC1, RCC2, RAD9A, PSME1, ORC2, NDEL1, MAD1L1, YWHAZ, MCM6, RPS27
REACTOME_REGULATED_PROTEOLYSIS_OF_P75NTR	0.824911868390129	0.986738544474394	0.296729070981782	0.730710865429582	701	10	NGFR, RELA, TRAF6, PSEN1, APH1B, NFKB1, NCSTN
REACTOME_NEUROTRANSMITTER_CLEARANCE	0.836707152496626	0.988835725677831	0.358974264817727	0.730662420019616	619	5	ALDH2, COMT, ACHE, MAOA
REACTOME_ORGANIC_CATION_TRANSPORT	0.865464632454924	0.996848451492968	0.383260340632603	0.729841210348798	623	4	RUNX1, SLC22A5, SLC22A4, SLC22A3
REACTOME_ORGANIC_CATION_ANION_ZWITTERION_TRANSPORT	0.865464632454924	0.996848451492968	0.383260340632603	0.729841210348798	623	4	RUNX1, SLC22A5, SLC22A4, SLC22A3
REACTOME_NUCLEOTIDE_CATABOLISM	0.827771797631862	0.986738544474394	0.24365641944491	0.729713167410364	768	23	TYMP, UPP1, NT5E, NUDT5, DPYD, NT5C
REACTOME_METABOLISM_OF_VITAMINS_AND_COFACTORS	0.95004995004995	1	0.199642321372334	0.727086672190787	950	121	ABCD4, LRP1, NADSYN1, SLC23A2, NNMT, PARP10, GPC3, VKORC1, SLC2A3, NT5E, ALDH1L2, NAPRT, MTHFD2L, NADK, ACACA, MTR, SDC2, SDC3, PARP16, SLC2A1, NAXD, HSPG2, LDLR, ENPP2, PARP4, AGRN, PDXK, TCN2, SLC19A1, PPCDC, RDH11
REACTOME_AMINO_ACID_TRANSPORT_ACROSS_THE_PLASMA_MEMBRANE	0.826944140197152	0.986738544474394	0.254415294682114	0.726772412735085	754	18	SLC25A29, SLC1A5, SLC7A1
REACTOME_APC_C_CDC20_MEDIATED_DEGRADATION_OF_CYCLIN_B	0.831877729257642	0.986835345491909	0.248844290787693	0.725036831863127	761	20	ANAPC2, ANAPC7, RPS27A
REACTOME_ENOS_ACTIVATION	0.830787309048179	0.986738544474394	0.294002448577459	0.723996415071987	706	10	DDAH2, CYGB, ZDHHC21, CAV1
REACTOME_FORMATION_OF_TC_NER_PRE_INCISION_COMPLEX	0.883673469387755	1	0.215213836971073	0.722392036762782	865	47	HMGN1, XAB2, AQR, RPS27A, UVSSA, POLR2H, GTF2H4, GPS1, CUL4B, ZNF830, UBA52, XPA, POLR2A, ERCC6, POLR2G, ERCC2, PPIE, GTF2H3, RBX1, POLR2K, GTF2H1, COPS6
REACTOME_INTRACELLULAR_SIGNALING_BY_SECOND_MESSENGERS	0.982017982017982	1	0.191749476540784	0.720711268079406	982	223	MOV10, PSMB8, PML, CAMKK2, PSMB9, PPP2R1B, SRC, ADCY4, CBX4, HDAC7, RRAGB, ADCY3, CDKN1A, PREX2, TP53, FYN, ITPR3, PDE1A, FGF2, MDM2, ITPR1, MYD88, PIP4K2A, EZH2, RPS27A, PHC3, PTEN, PDGFRA, PSME2, PRKX, JUN, IRAK4, PPARG, FGFR1, PDGFRB, PSME1, RING1, EGR1, CHD3, ADCY5, CREB1, TRIM27, IL1RL1, AREG, ERBB3, SNAI2, ATF2, ADCY6, ITPR2, TSC2, AKT3, PIP5K1B, PRKCD, AGO3, CSNK2A2, CAMKK1, PSMD10, ATN1, EGFR, TNRC6A, MTA2, UBA52, FOXO1, SUZ12, PDGFB, HDAC1, GATAD2A, TRAF6, ERBB2, IER3, FOXO3, TNRC6C, FGFR4, RBBP4, SLC38A9, PHC2, PRKAR1B, CBX6, PRKAR1A, PRKACB, RICTOR, FRS2, PHLPP2, AKT2, PIK3R3, LAMTOR4, PSMB1, AKT1, CAMK2D, HDAC2, NBEA, NR4A1, GAB2, EED, PPP2R1A, WWP2, GATAD2B, IRS2
REACTOME_REGULATION_OF_SIGNALING_BY_CBL	0.84641638225256	0.995404970187579	0.268336412807082	0.720306772855285	743	14	FYN, RPS27A, CBL, UBA52, YES1, PIK3R3
REACTOME_NR1H2_NR1H3_REGULATE_GENE_EXPRESSION_LINKED_TO_GLUCONEOGENESIS	0.868238557558946	0.996848451492968	0.377816564989644	0.719474649077244	625	4	NR1H3, RXRB, NRIP1, RXRA
REACTOME_REGULATION_OF_CHOLESTEROL_BIOSYNTHESIS_BY_SREBP_SREBF	0.89070480081716	1	0.214105868517673	0.71890695407285	871	48	SEC24D, NFYA, MVK, HELZ2, MBTPS1, SCAP, ACACA, SREBF1, SMARCD3, MVD
REACTOME_DNA_DOUBLE_STRAND_BREAK_RESPONSE	0.875130072840791	0.996848451492968	0.219186709745532	0.718511143527571	840	40	MDC1, TP53, ATM, RPS27A, MRE11, ABL1, EYA2, UIMC1, UBE2I, KAT5, UBA52
REACTOME_G2_M_CHECKPOINTS	0.942885771543086	1	0.20039476164401	0.71654609925732	940	97	PSMB8, MCM3, PSMB9, MDC1, WRN, MCM5, CDK2, TP53, ATM, RFC4, RPS27A, YWHAH, MRE11, PSME2, RFC2, YWHAQ, MCM2, RAD9A, PSME1, ORC2, YWHAZ, MCM6
REACTOME_REGULATION_OF_IFNG_SIGNALING	0.85375	0.995404970187579	0.319447679732308	0.716357740559735	682	7	IFNGR2, SOCS3, IFNGR1, JAK2
REACTOME_NEGATIVE_REGULATION_OF_MAPK_PATHWAY	0.883280757097792	1	0.222094515087678	0.71617022070635	839	36	PPP2R1B, DUSP5, RPS27A, BRAF, DUSP6, NRAS, PAQR3, DUSP1, KRAS, UBA52, DUSP4, KSR1
REACTOME_TRANSPORT_TO_THE_GOLGI_AND_SUBSEQUENT_MODIFICATION	0.962037962037962	1	0.195478525289312	0.715656982240337	962	133	SEC24D, COL7A1, ARFGAP1, TMED3, TRAPPC6A, FUCA1, MAN1A1, SPTAN1, SEC22A, TRAPPC2, DYNLL1, ARF5, MGAT5, MAN1C1, TUBA1A, ARF4, NAPA, NAPB, COG8, SEC16B, KDELR1, BET1, AREG, CAPZA1, CTSC, COG1, MGAT4A, ST3GAL4, COPE, GORASP1, DCTN6, B4GALT1, COG3, SEC16A, TRAPPC2L, FUT8, COG5, KDELR2, COPG2, TRAPPC6B, COPB1, SCFD1, SPTBN1, CSNK1D, LMAN2, SEC22B, RAB1A, ACTR10, CTSZ, TRAPPC1, SEC23IP, SEC31A, TFG, MAN2A1, B4GALT4, COPZ2, GOSR2, DYNC1I2, NAPG, ARFGAP2, TRAPPC3, TMED7
REACTOME_SULFIDE_OXIDATION_TO_SULFATE	0.863697705802969	0.996848451492968	0.351398428737895	0.71524243238743	639	5	TSTD1, SLC25A10, ETHE1
REACTOME_SIGNALING_BY_ERYTHROPOIETIN	0.837389380530973	0.988899020702118	0.253040804766003	0.714758761093107	756	17	PLCG2, NRAS, EPOR, STAT5A, SHC1, KRAS, JAK2, IRS2
REACTOME_SIGNALLING_TO_ERKS	0.857758620689655	0.996848451492968	0.235422523773489	0.714733826742866	795	25	SHC2, SRC, MAPK11, BRAF, NRAS, KIDINS220, SHC1, KRAS, FRS2, MAPK14
REACTOME_N_GLYCAN_ANTENNAE_ELONGATION	0.841363102232667	0.99135892120748	0.290209557116915	0.714656221364494	715	10	MGAT5, MGAT4A, ST3GAL4, B4GALT1
REACTOME_RUNX1_AND_FOXP3_CONTROL_THE_DEVELOPMENT_OF_REGULATORY_T_LYMPHOCYTES_TREGS	0.890554722638681	1	0.413487738419619	0.714083181417264	593	3	RUNX1, CBFB, NFATC2
REACTOME_CIRCADIAN_CLOCK	0.896656534954407	1	0.208207229205855	0.7132820993153	884	59	CSNK1E, SERPINE1, RAI1, HELZ2, HIF1A, RPS27A, SREBF1, PER1, SMARCD3, CREB1, CPT1A, CRY2, ATF2, NFIL3, RBM4, UBA52, TBL1XR1, NAMPT, CRY1, CSNK1D
REACTOME_CD28_DEPENDENT_PI3K_AKT_SIGNALING	0.849377123442809	0.995404970187579	0.261230985012414	0.713198959833794	749	15	MAP3K8, FYN, AKT3, RICTOR, AKT2, PIK3R3, AKT1, PDPK1, MAP3K14, THEM4
REACTOME_ARYL_HYDROCARBON_RECEPTOR_SIGNALLING	0.861618798955614	0.996848451492968	0.333763680392943	0.713186161246655	659	6	AHR, HSP90AB1, PTGES3, ARNT
REACTOME_RHOT1_GTPASE_CYCLE	0.866396761133603	0.996848451492968	0.350077493651079	0.712553778292097	641	5	MYO19, RAP1GDS1
REACTOME_RUNX1_REGULATES_TRANSCRIPTION_OF_GENES_INVOLVED_IN_WNT_SIGNALING	0.875173370319001	0.996848451492968	0.373603133222872	0.711451026974034	630	4	RUNX1, CBFB, ESR1
REACTOME_INSULIN_RECEPTOR_SIGNALLING_CASCADE	0.862808145766345	0.996848451492968	0.231872891264824	0.7105856155493	804	26	FGF2, FGFR1, NRAS, PIK3R4, SHC1, KRAS, FGFR4, FRS2, AKT2, GAB2, IRS2, PDPK1, FGF1, THEM4
REACTOME_VITAMIN_B5_PANTOTHENATE_METABOLISM	0.856655290102389	0.996685481753741	0.2646239082235	0.710341139910297	752	14	ENPP2, PPCDC, FASN, ENPP1, SLC25A16, PDZD11, SLC5A6, PANK3, AASDHPPT
REACTOME_PHASE_I_FUNCTIONALIZATION_OF_COMPOUNDS	0.890721649484536	1	0.215456258344	0.71030113987329	863	42	CYP26B1, FDXR, CYP1B1, AHR, ADH1B, CES1, AOC3, FMO3, CYP2R1, CES3, CYP4V2, ALDH2, CYB5R3, CYP2J2, HSP90AB1, CES2, PAOX, ALDH1A1, NCOA1, ADH5, ACSS1, SMOX, PTGIS, CYP2U1, CYP4B1, POR
REACTOME_EGFR_INTERACTS_WITH_PHOSPHOLIPASE_C_GAMMA	0.893553223388306	1	0.410953598243911	0.709706783496148	595	3	AREG, EGFR
REACTOME_ERYTHROPOIETIN_ACTIVATES_RAS	0.849588719153937	0.995404970187579	0.286960007178832	0.706654034589678	722	10	NRAS, EPOR, SHC1, KRAS, JAK2, IRS2
REACTOME_GALACTOSE_CATABOLISM	0.877947295423024	0.998561891323511	0.37087081269471	0.706247879374565	632	4	GALE, GALT, GALK1
REACTOME_CASPASE_ACTIVATION_VIA_DEPENDENCE_RECEPTORS_IN_THE_ABSENCE_OF_LIGAND	0.853864734299517	0.995404970187579	0.302597930259784	0.705180567601312	706	8	DAPK1, MAGED1, DAPK3, DAPK2, UNC5B, CASP9
REACTOME_THE_RETINOID_CYCLE_IN_CONES_DAYLIGHT_VISION	0.9453125	1	0.528507491729909	0.704796088540048	483	1	DHRS3
REACTOME_DEFECTS_IN_VITAMIN_AND_COFACTOR_METABOLISM	0.850166481687014	0.995404970187579	0.252146084795561	0.704047584546675	765	16	ABCD4, ACACA, MTR, TCN2, MMAB
REACTOME_TRYPTOPHAN_CATABOLISM	0.870445344129555	0.996848451492968	0.345511059892112	0.703259180132308	644	5	AFMID, SLC3A2, KYAT3, KYAT1
REACTOME_IRAK2_MEDIATED_ACTIVATION_OF_TAK1_COMPLEX	0.854289071680376	0.995404970187579	0.284265224353037	0.700017990860406	726	10	RPS27A, UBA52, TAB1, TRAF6, MAP3K7
REACTOME_REGULATION_OF_GENE_EXPRESSION_IN_BETA_CELLS	0.874493927125506	0.996848451492968	0.343784350496443	0.699744605998837	647	5	AKT3, FOXO1, AKT2, AKT1
REACTOME_AKT_PHOSPHORYLATES_TARGETS_IN_THE_NUCLEUS	0.856639247943596	0.996685481753741	0.283537729282238	0.698226496177999	728	10	CREB1, AKT3, FOXO1, FOXO3, AKT2, AKT1, NR4A1
REACTOME_FOXO_MEDIATED_TRANSCRIPTION_OF_OXIDATIVE_STRESS_METABOLIC_AND_NEURONAL_GENES	0.862445414847162	0.996848451492968	0.239244327470638	0.697066220331846	789	20	ATXN3, SREBF1, ABCA6, SMAD3, FOXO1, HDAC1, SIN3A, FOXO3
REACTOME_FRUCTOSE_METABOLISM	0.894590846047157	1	0.36561806789165	0.696245097405549	644	4	TKFC, GLYCTK, ALDH1A1
REACTOME_VLDL_ASSEMBLY	0.921951219512195	1	0.448087963413447	0.696217720713252	566	2	APOC1, P4HB
REACTOME_DNA_REPLICATION	0.955867602808425	1	0.194783434097465	0.696003075241523	952	98	PSMB8, MCM3, PSMB9, POLE, MCM5, LIG1, POLD1, CDK2, ANAPC2, ANAPC7, RFC4, RPS27A, PSME2, RFC2, MCM2, POLD3, POLD2, PSME1, ORC2
REACTOME_TRANSCRIPTIONAL_REGULATION_BY_RUNX2	0.943887775551102	1	0.195662223587927	0.695757212029258	941	89	PSMB8, PSMB9, ITGA5, WWTR1, SRC, CDKN1A, LGALS3, ZNF521, RPS27A, BAX, BMP2, PSME2, HDAC6, RUNX1, ABL1, PSME1, SATB2, SMAD1, RBM14, HIVEP3, HEY2, HEY1, AKT3, PSMD10, UBA52, SMAD6, PPM1D, COL1A1, CCND1
REACTOME_TICAM1_TRAF6_DEPENDENT_INDUCTION_OF_TAK1_COMPLEX	0.872315035799523	0.996848451492968	0.289944486708047	0.693834345477147	730	9	RPS27A, UBA52, TAB1, TRAF6, MAP3K7
REACTOME_PI_3K_CASCADE_FGFR2	0.868357487922705	0.996848451492968	0.296222468197379	0.690323057002916	718	8	FGF2, FRS2, FGF1, GRB2, PIK3CA
REACTOME_PI_3K_CASCADE_FGFR3	0.868357487922705	0.996848451492968	0.296222468197379	0.690323057002916	718	8	FGF2, FRS2, FGF1, GRB2, PIK3CA
REACTOME_INTERLEUKIN_27_SIGNALING	0.887728459530026	1	0.322430625935761	0.688969692893951	679	6	CRLF1, JAK2, IL6ST, STAT3
