pathway	pval	padj	ES	NES	nMoreExtreme	size	leadingEdge
REACTOME_ERYTHROPOIETIN_ACTIVATES_PHOSPHOLIPASE_C_GAMMA_PLCG	0.471567267683773	0.832286005434783	0.525742092457421	1.0011686689447	339	4	PLCG2, EPOR, JAK2, IRS2
REACTOME_TNFR1_MEDIATED_CERAMIDE_PRODUCTION	0.492577597840756	0.846389855225244	0.490858327637969	0.999101519828583	364	5	SMPD3, RACK1, TNFRSF1A, SMPD2
REACTOME_METABOLISM_OF_ANGIOTENSINOGEN_TO_ANGIOTENSINS	0.473747016706444	0.832286005434783	0.416918107654616	0.997680989303951	396	9	ATP6AP2, CES1, ENPEP, ANPEP, CTSZ, AGT
REACTOME_MEIOSIS	0.50104821802935	0.852052807524506	0.310651914626553	0.997580693544979	477	34	MSH5, ACD, CDK2, ATM, MRE11, DIDO1, TERF2IP, TERF1, SYNE1, TERF2, UBE2I, SUN1, STAG3, SYNE2, MLH3, CDK4, SMC1A, RPA3, LMNA, TINF2, TOP3A, RAD50
REACTOME_RUNX3_REGULATES_YAP1_MEDIATED_TRANSCRIPTION	0.493927125506073	0.846389855225244	0.489947753142979	0.997248120770979	365	5	WWTR1, TEAD3, TEAD2
REACTOME_DNA_REPAIR	0.509490509490509	0.856388047987443	0.265324183752413	0.997095186481899	509	214	DDB2, XRCC3, MDC1, ACTB, ACD, WRN, HMGN1, SPIDR, UBE2L6, POLE, PNKP, LIG1, INO80D, POLD1, CDK2, EME2, TP53, RTEL1, NEIL1, XAB2, POLM, RIF1, ATM, FAAP20, RAD51D, RFC4, AQR, FAAP100, RAD52, RPS27A, INO80E, ACTL6A, UVSSA, SIRT6, MRE11, RFC2, FANCC, ACTR5, ALKBH2, POLD3, POLD2, POLL, INO80B, ABL1, RAD9A, PMS2, UBA7, TERF2IP, EYA2, TERF1, POLR2H, WDR48, XPC, GTF2H4, UIMC1, MGMT, DNA2, MSH2, XRCC1, OGG1, GPS1, POLI, APEX1, SLX4, TERF2, CUL4B, PARP2, UBE2I, KAT5, ZNF830, UBA52, RUVBL1, XPA, POLH, PCNA, SUMO2, ATRIP, POLR2A, POLK, ERCC6, POLR2G, ERCC2, PPIE, PALB2, DCLRE1A, GTF2H3, TIMELESS, TOPBP1, BARD1, TDG, RBX1, NFRKB, TRIM25, TP53BP1, ELL, MSH6, REV3L, USP1, XRCC5
REACTOME_RNA_POLYMERASE_I_PROMOTER_ESCAPE	0.51237890204521	0.857886146496815	0.332642957544486	0.99621404073624	475	23	POLR1E, TAF1D, TAF1C, POLR2H, POLR1C, GTF2H4, TAF1B, ERCC2, GTF2H3, TBP, POLR2K, GTF2H1
REACTOME_NS1_MEDIATED_EFFECTS_ON_HOST_PATHWAYS	0.507820646506778	0.856164927068769	0.306527509141271	0.995920786867922	486	37	NUP85, NUP155, NUP107, NUP160, NUP93, POM121C, PABPN1, AAAS, POM121, NUP35, EIF2AK2, NUP54, NUP50, RAE1, CPSF4, NUP205, NUP43, NUP133, TPR, NUP153, NUP62, NUP214, NUP58, NUP98
REACTOME_NUCLEOTIDE_EXCISION_REPAIR	0.521042084168337	0.860742486357615	0.279401775702804	0.994005794770283	519	92	DDB2, ACTB, HMGN1, POLE, LIG1, INO80D, POLD1, XAB2, RFC4, AQR, RPS27A, INO80E, ACTL6A, UVSSA, RFC2, ACTR5, POLD3, POLD2, INO80B, POLR2H, XPC, GTF2H4, XRCC1, GPS1, CUL4B, PARP2, UBE2I, ZNF830, UBA52, RUVBL1, XPA, PCNA, SUMO2, POLR2A, POLK, ERCC6, POLR2G, ERCC2, PPIE, GTF2H3
REACTOME_TRANSCRIPTION_OF_THE_HIV_GENOME	0.50761421319797	0.856164927068769	0.289839311886756	0.993474026005929	499	60	TAF1, CCNT2, NELFE, NELFA, NCBP1, POLR2H, TAF9, GTF2H4, CCNT1, TAF12, TAF4, GTF2F1, TAF9B, CDK9, SUPT16H, RNMT, GTF2B, NELFCD, POLR2A, POLR2G, ERCC2, TAF4B, NELFB, GTF2H3, SUPT5H, TBP, TAF10, ELL, POLR2K, RNGTT, NCBP2, GTF2H1
REACTOME_ETHANOL_OXIDATION	0.50625	0.855350429645542	0.442988907399042	0.99339751994232	404	7	ADH1B, ALDH2, ALDH1A1, ADH5, ACSS1
REACTOME_PHENYLALANINE_METABOLISM	0.485436893203884	0.841461586882887	0.52150754141355	0.993104829482357	349	4	ASRGL1, KYAT1, PCBD1
REACTOME_MEIOTIC_SYNAPSIS	0.502183406113537	0.852251867593711	0.340833947368098	0.993059413213554	459	20	ACD, DIDO1, TERF2IP, TERF1, SYNE1, TERF2, UBE2I, SUN1, STAG3, SYNE2, SMC1A, LMNA, TINF2
REACTOME_RNA_POLYMERASE_I_TRANSCRIPTION_TERMINATION	0.518240343347639	0.859462201927955	0.334079910609746	0.992138046572651	482	22	POLR1E, TAF1D, TAF1C, POLR2H, POLR1C, GTF2H4, TAF1B, ERCC2, GTF2H3, TBP, POLR2K, GTF2H1
REACTOME_POTENTIAL_THERAPEUTICS_FOR_SARS	0.509586276488396	0.856388047987443	0.286513490099216	0.99148147898421	504	68	S1PR1, IMPDH1, STAT2, AP2A2, IL1R1, SIGMAR1, IFNAR2, ROCK1, IFNGR2, HMG20B, CHD3, FKBP1A, IFNGR1, RIPK1, IMPDH2, ARID4B, MTA2, HDAC1, AP2M1, GATAD2A, AP2B1, RBBP4, FXYD6, COMT, HSP90AB1, NFE2L2, ARID4A, ATP1B3, SAP18, TUBB, RBX1, ATP1B2, JAK2, HDAC2
REACTOME_FRS_MEDIATED_FGFR4_SIGNALING	0.487661574618096	0.841461586882887	0.402144191650802	0.99030111655854	414	10	FGF2, NRAS, FRS3, KRAS, FGFR4, FRS2
REACTOME_REGULATION_OF_SIGNALING_BY_NODAL	0.497751124437781	0.851046216022424	0.573374854028805	0.990204308051428	331	3	ACVR1B, ACVR2A, ACVR2B
REACTOME_SYNTHESIS_OF_VERY_LONG_CHAIN_FATTY_ACYL_COAS	0.502831257078143	0.852320654508533	0.362201126361145	0.98886227665191	443	15	ACSL5, SLC27A3, ELOVL5, HACD3, HACD2, ACSF3
REACTOME_OAS_ANTIVIRAL_RESPONSE	0.51375	0.857886146496815	0.440280633172612	0.987324246199067	410	7	FLNA, DDX58, RNASEL, ABCE1, OAS2, OAS3
REACTOME_RUNX1_REGULATES_TRANSCRIPTION_OF_GENES_INVOLVED_IN_BCR_SIGNALING	0.502248875562219	0.852251867593711	0.571473998725036	0.986921577569704	334	3	RUNX1, ELF1, CBFB
REACTOME_FOXO_MEDIATED_TRANSCRIPTION_OF_CELL_CYCLE_GENES	0.50517836593786	0.854457601742208	0.376791806547846	0.986462518458832	438	13	BTG1, CDKN1A, GADD45A, CCNG2, CAV1, SMAD3, FOXO1, FOXO3
REACTOME_HDMS_DEMETHYLATE_HISTONES	0.511853448275862	0.857886146496815	0.334361997214568	0.985915389333063	474	21	PHF8, KDM4C, KDM5A, KDM5B, KDM6A, PHF2, ARID5B, KDM6B, UTY
REACTOME_PLATELET_HOMEOSTASIS	0.522142121524202	0.860932449850702	0.297772766470336	0.984073114243833	506	43	PTGIR, PPP2R1B, GNB4, FGR, ITPR3, PDE1A, ITPR1, GNB1, PECAM1, SRI, PDE2A, GNG12, PDE5A, ATP2B4, ITPR2
REACTOME_HIV_LIFE_CYCLE	0.532467532467532	0.862287904886355	0.269225033721995	0.983858335670301	532	129	TAF1, CCNT2, CHMP4A, LIG1, NELFE, NUP85, CXCR4, NUP155, NELFA, NUP107, RPS27A, VPS28, NUP160, NUP93, POM121C, AAAS, PPIA, NCBP1, POLR2H, TAF9, POM121, NUP35, NUP54, NUP50, GTF2H4, CCNT1, TAF12, NMT2, RAE1, TAF4, XPO1, RANBP1, GTF2F1, TAF9B, CDK9, SUPT16H, RNMT, GTF2B, CHMP2A, RANGAP1, CHMP5, UBA52, NELFCD, NUP205, NUP43, VPS37B, POLR2A, NUP133, PSIP1, TPR, POLR2G, ERCC2, TAF4B, NELFB, GTF2H3, SUPT5H, TBP, PDCD6IP, TAF10, NUP153, NUP62, ELL, XRCC5, POLR2K, RNGTT, NCBP2
REACTOME_DOWNSTREAM_SIGNAL_TRANSDUCTION	0.518318965517241	0.859462201927955	0.333554969080628	0.983535748514119	480	21	STAT6, SRC, PDGFRA, PDGFRB, NRAS, RASA1, STAT5A, KRAS, PDGFB
REACTOME_FORMATION_OF_RNA_POL_II_ELONGATION_COMPLEX	0.525025536261491	0.861034292035398	0.292859016524482	0.983337752486721	513	48	CCNT2, NELFE, NELFA, AFF4, NCBP1, POLR2H, CDC73, GTF2H4, CCNT1, GTF2F1, CDK9, SUPT16H, NELFCD, POLR2A, POLR2G, ERCC2, NELFB, GTF2H3, SUPT5H, ELL, POLR2K, NCBP2, GTF2H1, EAF1, CCNH, MLLT1, WDR61, ELOB, POLR2I, SUPT6H, PAF1, ERCC3, CTDP1, TCEA1
REACTOME_CHROMATIN_MODIFYING_ENZYMES	0.53946053946054	0.864536668325867	0.264353844562944	0.982234130077839	539	171	NFKB2, PRMT7, ACTB, YEATS2, KMT5C, PHF8, KDM4C, BRD1, KAT2A, EZH2, RUVBL2, ACTL6A, OGT, MBIP, KDM5A, JADE1, EP400, SMYD3, SMARCD3, KAT8, HMG20B, CHD3, TAF9, KMT2E, KMT2B, NSD3, SUPT7L, KDM5B, KMT2A, RPS2, BRWD1, ARID2, ATF2, AEBP2, ATXN7, EHMT2, TAF12, RELA, ARID4B, JADE3, KDM6A, ELP4, BRD8, DOT1L, PHF2, KAT5, MTA2, ING3, RUVBL1, TRRAP, SETD1B, SUZ12, KAT6A, HDAC1, ATF7IP, ING4, CCND1, GATAD2A, SETDB1, JADE2, TBL1XR1, TADA2A, RBBP4, ARID5B, KDM6B, SUPT20H, ARID4A, SAP18, UTY, HDAC8, CDK4, TAF10, JAK2, HDAC2, SUV39H1, MORF4L2, SMARCA4, EED, MRGBP, EHMT1, BRPF1, GATAD2B, HAT1, NFKB1, SMARCC2
REACTOME_REGULATION_OF_TP53_ACTIVITY_THROUGH_ACETYLATION	0.528403001071811	0.861034292035398	0.320222626427982	0.981337623695129	492	26	PML, TP53, BRD1, PIP4K2A, CHD3, AKT3, PIN1, MTA2, KAT6A, HDAC1, GATAD2A, RBBP4, AKT2, AKT1, HDAC2, BRPF1, GATAD2B
REACTOME_FGFR2_MUTANT_RECEPTOR_ACTIVATION	0.520951302378256	0.860742486357615	0.359362456295017	0.981112290415103	459	15	FGF2, NCBP1, POLR2H, GTF2F1, POLR2A, POLR2G, POLR2K, NCBP2, FGF1, POLR2I
REACTOME_SIGNALING_BY_FGFR2_IIIA_TM	0.520951302378256	0.860742486357615	0.359362456295017	0.981112290415103	459	15	FGF2, NCBP1, POLR2H, GTF2F1, POLR2A, POLR2G, POLR2K, NCBP2, FGF1, POLR2I
REACTOME_METAL_SEQUESTRATION_BY_ANTIMICROBIAL_PROTEINS	0.5234375	0.861034292035398	0.735259778166959	0.980512525975174	267	1	S100A8
REACTOME_METABOLISM_OF_NITRIC_OXIDE_NOS3_ACTIVATION_AND_REGULATION	0.508532423208191	0.856388047987443	0.364921183685532	0.979573355018479	446	14	NOSTRIN, DDAH2, CYGB, ZDHHC21, CAV1, NOSIP
REACTOME_ACTIVATION_OF_KAINATE_RECEPTORS_UPON_GLUTAMATE_BINDING	0.518518518518518	0.859462201927955	0.380418275399821	0.978854200198066	447	12	GNB4, GNB1, GNG12, PLCB2, PLCB3, GNB2, GNG10
REACTOME_INTERLEUKIN_2_SIGNALING	0.516869095816464	0.859462201927955	0.479280873319121	0.975536569303311	382	5	PTK2B, STAT5A, SHC1
REACTOME_KILLING_MECHANISMS	0.513126491646778	0.857886146496815	0.407215596653395	0.97446297455068	429	9	NOXA1, JUN, CYBA, DVL2
REACTOME_NEGATIVE_REGULATORS_OF_DDX58_IFIH1_SIGNALING	0.538135593220339	0.863762538913871	0.312513849244383	0.974162434201886	507	28	IRF3, NLRC5, UBE2L6, TRIM4, RPS27A, UBA7, ATG12, PIN1, UBA52, DDX58, OTUD5, TRIM25, RNF125, RNF135
REACTOME_DEFECTIVE_FACTOR_IX_CAUSES_HEMOPHILIA_B	0.52520325203252	0.861034292035398	0.626778913775958	0.97385920259051	322	2	GGCX, F8
REACTOME_MITOTIC_PROMETAPHASE	0.563436563436563	0.886285714285714	0.266011139760096	0.971946596453028	563	128	HAUS5, EML4, CSNK1E, PPP2R1B, HAUS4, CEP131, CEP192, TUBGCP6, TUBGCP2, NUP85, OFD1, CNTRL, SFI1, NUP107, DYNLL1, CEP78, NUP160, CEP290, CENPC, TUBA1A, ITGB3BP, KNTC1, TUBG2, RCC2, CEP164, ALMS1, ODF2, NDEL1, MAD1L1, RPS27, MZT2B, CEP57, CENPJ, NUMA1, NEK6, XPO1, BUB3, CSNK2A2, MAPRE1, NUDC, RANGAP1, NINL, SDCCAG8, NUP43, NUP133, SMC4, CENPP, CSNK1D, PDS5B, CEP250, TUBB, HDAC8, NDE1, HAUS3, NEK9, TUBGCP3, SKA2, SMC1A, PPP2R1A, AHCTF1, CDK5RAP2, KIF2A, HAUS6, CEP76, DYNC1I2, CETN2, NUP98
REACTOME_METHYLATION	0.53125	0.862253572074516	0.377602646410601	0.97160930572132	458	12	NNMT, TRMT112, MTR, MAT2A, AS3MT, GSTO1, COMT
REACTOME_PURINE_RIBONUCLEOSIDE_MONOPHOSPHATE_BIOSYNTHESIS	0.521479713603819	0.860742486357615	0.405993022118149	0.971537365541554	436	9	PFAS, IMPDH1, IMPDH2, PAICS, GMPS, PPAT, GART
REACTOME_SIGNALING_BY_FGFR_IN_DISEASE	0.559709241952233	0.884074637706222	0.297557996650993	0.971427975886599	538	38	CNTRL, FGF2, FGFR1, NRAS, NCBP1, POLR2H, GTF2F1, STAT5A, KRAS, FGFR1OP2, POLR2A, FGFR4, POLR2G, FRS2, BCR, GAB2, POLR2K, NCBP2, LRRFIP1, STAT3, BAG4, FGF1, ERLIN2, POLR2I
REACTOME_FOLDING_OF_ACTIN_BY_CCT_TRIC	0.513513513513513	0.857886146496815	0.394377577599677	0.971175423022757	436	10	ACTB, CCT3, CCT4, CCT8, CCT6B, CCT7, CCT6A, CCT2, TCP1
REACTOME_REGULATION_OF_FZD_BY_UBIQUITINATION	0.517633674630262	0.859462201927955	0.361452859117608	0.970263184808623	454	14	FZD6, LRP5, RPS27A, FZD8, UBA52, ZNRF3, FZD5
REACTOME_GLUTAMATE_NEUROTRANSMITTER_RELEASE_CYCLE	0.514688601645123	0.858542068279723	0.393868297325717	0.969921293696972	437	10	CPLX1, GLS, TSPOAP1, VAMP2, PPFIA4, SLC1A7
REACTOME_NOREPINEPHRINE_NEUROTRANSMITTER_RELEASE_CYCLE	0.5275	0.861034292035398	0.432150850534694	0.969093302319239	421	7	CPLX1, TSPOAP1, VAMP2, PPFIA4
REACTOME_TRANSPORT_OF_INORGANIC_CATIONS_ANIONS_AND_AMINO_ACIDS_OLIGOPEPTIDES	0.551829268292683	0.875027660306845	0.287261569591873	0.968670969246732	542	50	SLC12A7, SLC12A4, SLC20A1, SLC25A29, SLC26A11, SLC1A5, SLC7A1, SRI, SLC15A3, SLC26A2, SLC9A9, SLC9A1, CTNS, SLC4A7, SLC8B1, SLC9A5, SLC7A6
REACTOME_ATF6_ATF6_ALPHA_ACTIVATES_CHAPERONE_GENES	0.515863689776733	0.859462201927955	0.393338259994236	0.968616049030801	438	10	NFYA, HSP90B1, HSPA5, CALR, ATF6, XBP1, DDIT3
REACTOME_ATF6_ATF6_ALPHA_ACTIVATES_CHAPERONES	0.534722222222222	0.862287904886355	0.376417798023015	0.968560572535281	461	12	NFYA, MBTPS1, HSP90B1, HSPA5, CALR, ATF6, XBP1, DDIT3
REACTOME_INSULIN_PROCESSING	0.529867256637168	0.861034292035398	0.342813525465381	0.968337778462977	478	17	RAB27A, SLC30A7, MYRIP, VAMP2, ERO1B, EXOC7, CPE, EXOC3, SLC30A5
REACTOME_NEUROTRANSMITTER_RECEPTORS_AND_POSTSYNAPTIC_SIGNAL_TRANSMISSION	0.578	0.898413043478261	0.272844510641289	0.967450822783053	577	85	CAMKK2, SRC, ADCY4, GNB4, CAMK1, GABBR1, ADCY3, PPM1F, GNAI2, MDM2, AP2A2, GNB1, PRKX, PRKAA1, ARHGEF9, TUBA1A, ARHGEF7, LIN7C, MYO6, GNAI3, NRAS, ADCY5, CREB1, GNG12, PLCB2, CHRNG, ADCY6, PLCB3, RASGRF2, CHRNA1, CAMKK1, GNB2, KRAS, AP2M1, EPB41L1, AP2B1, GNAI1, PRKAR1B, PRKAR1A, PRKACB, GNG10
REACTOME_APOPTOTIC_CLEAVAGE_OF_CELL_ADHESION_PROTEINS	0.531713900134953	0.862253572074516	0.475185392751844	0.967200557405774	393	5	TJP2, TJP1, CTNNB1
REACTOME_MECP2_REGULATES_TRANSCRIPTION_FACTORS	0.534412955465587	0.862287904886355	0.474847297822383	0.966512393145638	395	5	PPARG, CREB1, RBFOX1, MECP2
REACTOME_DOWNSTREAM_SIGNALING_OF_ACTIVATED_FGFR2	0.52819332566168	0.861034292035398	0.36914988538528	0.966455531404213	458	13	FGF2, NRAS, FRS3, SHC1, KRAS, FRS2
REACTOME_DOWNSTREAM_SIGNALING_OF_ACTIVATED_FGFR3	0.52819332566168	0.861034292035398	0.36914988538528	0.966455531404213	458	13	FGF2, NRAS, FRS3, SHC1, KRAS, FRS2
REACTOME_AURKA_ACTIVATION_BY_TPX2	0.562310030395137	0.885399076888439	0.283364914943106	0.965502940735736	554	55	HAUS5, CSNK1E, HAUS4, CEP131, CEP192, OFD1, CNTRL, SFI1, DYNLL1, CEP78, CEP290, TUBA1A, CEP164, ALMS1, ODF2, CEP57, CENPJ, MAPRE1, NINL, SDCCAG8, CSNK1D, CEP250, TUBB, NDE1, HAUS3, PPP2R1A, CDK5RAP2, HAUS6, CEP76, DYNC1I2, CETN2
REACTOME_ACTIVATION_OF_THE_AP_1_FAMILY_OF_TRANSCRIPTION_FACTORS	0.526570048309179	0.861034292035398	0.414086821523856	0.964996619731419	435	8	MAPK11, JUN, ATF2, FOS, MAPK14
REACTOME_FOXO_MEDIATED_TRANSCRIPTION	0.557026476578411	0.881491597241289	0.286673598743309	0.964390378162573	546	49	ATXN3, BTG1, NFYA, BBC3, CDKN1A, BCL2L11, YWHAQ, GADD45A, SREBF1, ABCA6, CCNG2, YWHAZ, TXNIP, CITED2, CAV1, SMAD3, AKT3, BCL6, FOXO1, HDAC1, SIN3A, TXN, FOXO3
REACTOME_SARS_COV_2_INFECTION	0.570415400202634	0.891026240832913	0.280713340942618	0.963663287336595	562	61	TUSC3, MAN1B1, CHMP4A, ST6GALNAC4, PARP10, PRKCSH, MOGS, RPS27A, MGAT5, PARP16, CTSL, PARP4, DDX5, STT3A, GANAB, PIK3R4, VHL, MGAT4A, ST3GAL4, EDEM2, PARP9, FUT8, UBE2I, CHMP2A, UBA52
REACTOME_ASSOCIATION_OF_TRIC_CCT_WITH_TARGET_PROTEINS_DURING_BIOSYNTHESIS	0.561181434599156	0.884507411447367	0.303251482037204	0.963398316396469	531	32	SPHK1, KIFC3, USP11, TP53, NOP56, CCT3, FBXW5, SKIV2L, CCT4, FKBP9, CCT8, WRAP53, CCT6B, GBA, FBXW2, STAT3, LONP2, XRN2, CCT7, DCAF7, FBXL5, CCT6A, FBXL3, CCT2, AP3M1, TCP1
REACTOME_REGULATION_OF_BETA_CELL_DEVELOPMENT	0.52901023890785	0.861034292035398	0.358889550461177	0.963382387056164	464	14	RBPJ, KAT2A, MAML2, MAML3, NOTCH1, MAMLD1, AKT3, FOXO1, AKT2, AKT1
REACTOME_MRNA_CAPPING	0.560344827586207	0.884074637706222	0.316912678626041	0.962134837003347	519	25	NCBP1, POLR2H, GTF2H4, GTF2F1, RNMT, POLR2A, POLR2G, ERCC2, GTF2H3, SUPT5H, POLR2K, RNGTT, NCBP2, GTF2H1
REACTOME_IRAK1_RECRUITS_IKK_COMPLEX	0.536248561565017	0.863376650298641	0.367403541617339	0.961883503452754	465	13	PELI1, PELI2, RPS27A, UBA52, TRAF6
REACTOME_INTERLEUKIN_10_SIGNALING	0.54006968641115	0.864536668325867	0.380322108030425	0.961064983751987	464	11	CSF1, IL1R1, ICAM1, CXCL2, CCL2, IL10RB, CSF3, STAT3, TNFRSF1A
REACTOME_IKK_COMPLEX_RECRUITMENT_MEDIATED_BY_RIP1	0.543263964950712	0.867567732860376	0.336403252458583	0.960982333026547	495	18	BIRC3, RPS27A, TLR4, RIPK1, UBA52, TRAF6, CD14
REACTOME_SIGNALING_BY_NOTCH	0.591408591408591	0.908482142857143	0.261327207339159	0.960942084819874	591	147	MOV10, PSMB8, MDK, PSMB9, POGLUT1, TLE3, NOTCH2, JAG1, HDAC7, RBPJ, TP53, HIF1A, KAT2A, FLT4, MAML2, MAML3, RPS27A, SIRT6, MYC, NOTCH1, PSME2, HDAC6, NOTCH3, JUN, TLE4, RUNX1, JAG2, PSME1, ACTA2, DLL4, NUMB, MIB1, DLL1, YWHAZ, CREB1, CCNC, ARRB1, HEYL, HEY2, MAMLD1, SMAD3, DTX4, HEY1, ADAM10, PLXND1, ST3GAL4, NOTCH4, B4GALT1, AGO3, MFNG, PSMD10, EGFR, TNRC6A, UBA52, ARRB2, HDAC1, CCND1, NEURL1B, PSEN1, TBL1XR1, TNRC6C, TLE1, DTX2
REACTOME_NEURONAL_SYSTEM	0.598401598401598	0.910125361620058	0.260507341173834	0.96043001592151	598	154	PTPRF, CAMKK2, EPB41L3, KCNQ4, FLOT2, CPLX1, SRC, ADCY4, GNB4, CAMK1, ABCC8, GABBR1, DBNL, ADCY3, GLS, PPM1F, GNAI2, MDM2, AP2A2, GNB1, PTPRS, PRKX, PRKAA1, ARHGEF9, TUBA1A, ARHGEF7, LIN7C, SIPA1L1, MYO6, DNAJC5, GNAI3, EPB41L2, NRAS, ADCY5, NTRK3, CREB1, KCNQ5, GNG12, ABAT, PLCB2, CHRNG, KCNJ8, PTPRD, LRFN4, TSPOAP1, ADCY6, APBA3, PPFIBP2, VAMP2, PLCB3, RASGRF2, CHRNA1, SHARPIN, CAMKK1, KCNAB1, ALDH2, GNB2, KRAS, AP2M1, PPFIA4, EPB41L1, AP2B1, GNAI1, NAAA, PRKAR1B, COMT, PRKAR1A, PRKACB, SLC1A7, GNG10
REACTOME_PTK6_REGULATES_CELL_CYCLE	0.525658807212205	0.861034292035398	0.504330900243309	0.960395416969902	378	4	CDK2, CCND1, CDK4, CDKN1B
REACTOME_SYNTHESIS_OF_EPOXY_EET_AND_DIHYDROXYEICOSATRIENOIC_ACIDS_DHET	0.545727136431784	0.86885504616113	0.555955624756715	0.960121726391345	363	3	CYP1B1, CYP2J2, EPHX2
REACTOME_TRANSMISSION_ACROSS_CHEMICAL_SYNAPSES	0.596403596403596	0.910125361620058	0.265298203464915	0.959220456867346	596	112	CAMKK2, CPLX1, SRC, ADCY4, GNB4, CAMK1, GABBR1, ADCY3, GLS, PPM1F, GNAI2, MDM2, AP2A2, GNB1, PRKX, PRKAA1, ARHGEF9, TUBA1A, ARHGEF7, LIN7C, MYO6, DNAJC5, GNAI3, NRAS, ADCY5, CREB1, GNG12, ABAT, PLCB2, CHRNG, TSPOAP1, ADCY6, VAMP2, PLCB3, RASGRF2, CHRNA1, CAMKK1, ALDH2, GNB2, KRAS, AP2M1, PPFIA4, EPB41L1, AP2B1, GNAI1, NAAA, PRKAR1B, COMT, PRKAR1A, PRKACB, SLC1A7, GNG10
REACTOME_INHIBITION_OF_DNA_RECOMBINATION_AT_TELOMERE	0.544247787610619	0.868122997339396	0.339399280947079	0.9586936375339	491	17	ACD, TERF2IP, TERF1, POLR2H, TERF2, POLR2A, POLR2G, POLR2K, TINF2
REACTOME_VASOPRESSIN_REGULATES_RENAL_WATER_HOMEOSTASIS_VIA_AQUAPORINS	0.56972972972973	0.890839825909408	0.317662470418725	0.957065590291803	526	24	ADCY4, GNB4, ADCY3, AQP1, GNB1, ADCY5, GNG12, ADCY6, AQP3, GNB2, PRKAR1B, PRKAR1A, PRKACB, GNG10
REACTOME_STAT3_NUCLEAR_EVENTS_DOWNSTREAM_OF_ALK_SIGNALING	0.537859007832898	0.863762538913871	0.44752733703841	0.956276318560482	411	6	HIF1A, HDAC1, SIN3A, HDAC2, STAT3
REACTOME_P75NTR_NEGATIVELY_REGULATES_CELL_CYCLE_VIA_SC1	0.533980582524272	0.862287904886355	0.501664062258642	0.955316967529187	384	4	NGFR, HDAC1, HDAC2
REACTOME_GABA_SYNTHESIS_RELEASE_REUPTAKE_AND_DEGRADATION	0.535024154589372	0.862287904886355	0.409860291269909	0.955147024921225	442	8	CPLX1, DNAJC5, ABAT, VAMP2
REACTOME_SIGNALING_BY_FGFR4_IN_DISEASE	0.550119331742243	0.873196477124671	0.398611176101156	0.953872679595068	460	9	NRAS, KRAS, FGFR4, FRS2, GRB2, PIK3CA
REACTOME_G_BETA_GAMMA_SIGNALLING_THROUGH_CDC42	0.550119331742243	0.873196477124671	0.398426769443568	0.953431396251411	460	9	GNB4, GNB1, GNG12, CDC42, GNB2, GNG10
REACTOME_ACETYLCHOLINE_NEUROTRANSMITTER_RELEASE_CYCLE	0.540469973890339	0.864536668325867	0.44567901361859	0.95232682147029	413	6	CPLX1, TSPOAP1, VAMP2, PPFIA4
REACTOME_REGULATION_OF_TP53_ACTIVITY_THROUGH_PHOSPHORYLATION	0.58953722334004	0.906492719759417	0.274219221302668	0.952160345033561	585	69	TAF1, WRN, MAPK11, CDK2, TP53, TP53INP1, MDM4, ATM, MDM2, RFC4, RPS27A, MRE11, RFC2, PRKAA1, RAD9A, TAF9, DNA2, TAF12, TAF4, CSNK2A2, TAF9B, SUPT16H, PIN1, KAT5, UBA52, ATRIP, TAF4B, TOPBP1, BARD1, TBP, MAPK14
REACTOME_SLC_MEDIATED_TRANSMEMBRANE_TRANSPORT	0.618	0.919841341795104	0.263927610030585	0.950978309241183	617	108	SLC12A7, SLC25A6, SLC39A10, CP, SLCO2A1, SLC12A4, SLC30A7, SLC25A5, SLC20A1, SLC25A29, SLC33A1, SLC26A11, SLC1A5, SLC2A3, SLC7A1, SLC50A1, SRI, APOD, SLC15A3, RUNX1, SLC26A2, SLC2A1, SLCO3A1, SLC44A1, SLC35D1, SLC16A2, SLC9A9, SLC9A1, CTNS, SLC4A7, SLC35A3, SLC8B1, SLC11A1, SLC9A5, SLC7A6, SLC35B3, SLC39A14, SLC16A7, SLC30A1, SLC43A1, SLC35A2, SLC30A2, SLC35B4, SLC1A7, SLC9A8, ARL2, SLC36A1, PDZD11, SLC30A5, SLC2A11, SLC7A8, SLC29A1, SLC39A7, SLC39A1, SLC4A2, SLC5A6, SLC35A1, SLC43A2, SLC11A2
REACTOME_DISEASES_OF_CARBOHYDRATE_METABOLISM	0.566844919786096	0.888094680103117	0.308462531521644	0.949981041316498	529	27	IDUA, GUSB, SGSH, GAA, RPS27A, HGSNAT
REACTOME_SIGNALING_BY_NUCLEAR_RECEPTORS	0.642357642357642	0.919841341795104	0.255279161685943	0.947227313398605	642	168	CYP26B1, MOV10, SPHK1, ABCA1, MMP2, POU2F1, SRC, TLE3, GNB4, PLTP, CAV2, GNAI2, CXCL12, GNB1, MYC, APOD, JUND, JUN, RUNX1, IGF1R, NR1H3, ZNF217, ABCG1, SREBF1, GNAI3, NRAS, DDX5, CHD1, ZDHHC21, POLR2H, CREB1, CPT1A, GNG12, KCTD6, AREG, RDH11, ALDH1A3, CAV1, ATF2, CCNT1, FOS, APOC1, AKT3, FASN, XPO1, AGO3, GTF2F1, CDK9, SHC1, EGFR, TNRC6A, KAT5, GNB2, KRAS, ALDH1A2, PTK2, PGR, HDAC1, HSPB1, CCND1, FOXO3, TBL1XR1, POLR2A, TNRC6C, GNAI1, SCD, POLR2G, HSP90AB1, GNG10, TBP, AKT2, RXRB, PIK3R3, MYLIP, AKT1, SP1, SMC1A, PPARD, POLR2K, DHRS3, CBFB, USF1, PDK4, ALDH1A1, NCOA1, CDKN1B, TNRC6B, NCOR2
REACTOME_PKMTS_METHYLATE_HISTONE_LYSINES	0.597497393117831	0.910125361620058	0.291233501101225	0.946229910625595	572	37	NFKB2, KMT5C, EZH2, SMYD3, KMT2E, KMT2B, NSD3, KMT2A, AEBP2, EHMT2, RELA, DOT1L, SETD1B, SUZ12, ATF7IP, SETDB1, RBBP4, SUV39H1, EED, EHMT1, NFKB1
REACTOME_TRANSPORT_OF_NUCLEOTIDE_SUGARS	0.55375	0.877189073514602	0.421204288200094	0.944545762429509	442	7	SLC35D1, SLC35A3, SLC35B3, SLC35A2, SLC35B4, SLC35A1
REACTOME_TRANSLATION_OF_SARS_COV_1_STRUCTURAL_PROTEINS	0.57556270096463	0.896396166947885	0.308135966009436	0.944297472142271	536	26	ST6GALNAC4, PARP10, PRKCSH, MOGS, RPS27A, PARP16, PARP4, GANAB, ST3GAL4, PARP9, UBE2I, UBA52
REACTOME_TLR3_MEDIATED_TICAM1_DEPENDENT_PROGRAMMED_CELL_DEATH	0.576171875	0.896457328758655	0.707433352792372	0.943404337219199	294	1	RIPK1
REACTOME_LRR_FLII_INTERACTING_PROTEIN_1_LRRFIP1_ACTIVATES_TYPE_I_IFN_PRODUCTION	0.580209895052474	0.900957714627385	0.546011757693856	0.942948911896348	386	3	IRF3, CTNNB1, LRRFIP1
REACTOME_TRANS_GOLGI_NETWORK_VESICLE_BUDDING	0.614837398373984	0.918159982590692	0.276087151671937	0.941116524976991	604	56	PIK3C2A, NECAP1, APP, NAPA, GAK, FTL, HIP1R, PICALM, AP3S1, ARRB1, AP4M1, RAB5C, TXNDC5, VAMP2, CHMP2A, VAMP8, SH3D19, AP1S1, CPD, BLOC1S6, TPD52L1, SNAP23, BLOC1S4, AP4B1, CTSZ, OCRL, HGS, ACBD3, BLOC1S3, SNX9, SNX5, PUM1
REACTOME_ANTIMICROBIAL_PEPTIDES	0.56563245823389	0.887484832324731	0.393185831611943	0.9408898828349	473	9	CLU, PLA2G2A, S100A8, SLC11A1, PDZD11, ATP7A
REACTOME_AQUAPORIN_MEDIATED_TRANSPORT	0.59375	0.910125361620058	0.309395279006031	0.939312297717623	550	25	ADCY4, GNB4, ADCY3, AQP1, GNB1, ADCY5, GNG12, ADCY6, AQP3, GNB2, PRKAR1B, PRKAR1A, PRKACB, GNG10
REACTOME_TRANSCRIPTIONAL_REGULATION_BY_TP53	0.711288711288711	0.949626943910536	0.247374009968717	0.937967093956139	711	283	MOV10, TNFRSF10B, DDB2, PML, COX6A1, G6PD, NDRG1, CASP2, FAS, PPP2R1B, MDC1, TAF1, WRN, BANP, CCNT2, MAPK11, RRAGB, BBC3, L3MBTL1, CDKN1A, CDK2, PIDD1, TP53, GLS, NPM1, BRD1, NELFE, TP53INP1, MDM4, PERP, ATM, CNOT9, MDM2, NELFA, RAD51D, RFC4, SESN3, PIP4K2A, PLAGL1, RPS27A, PTEN, YWHAH, CNOT3, BAX, MRE11, RFC2, FANCC, TP53I3, PRKAA1, YWHAQ, JUN, TP63, CASP10, GADD45A, RAD9A, CNOT6L, PLK2, PRELID1, PMS2, COX7A2L, CHD3, BNIP3L, YWHAZ, POLR2H, TAF9, IGFBP3, GTF2H4, CENPJ, ATF2, CCNT1, FOS, CDK13, TSC2, EHMT2, DNA2, AKT3, MSH2, TAF12, TAF4, AGO3, CSNK2A2, GTF2F1, TAF9B, CDK9, RRM2B, SUPT16H, PIN1, TNRC6A, KAT5, MTA2, BCL6, UBA52, KAT6A, CNOT2, HDAC1, NELFCD, GATAD2A, PCNA, ZNF420, TXN, ATRIP, POLR2A, TNRC6C, RBBP4, SLC38A9, POLR2G, ERCC2, TAF4B, NELFB, GTF2H3, SUPT5H, TOPBP1, RICTOR, BARD1, TBP, MAPK14, AKT2
REACTOME_INTRINSIC_PATHWAY_FOR_APOPTOSIS	0.609730848861284	0.915756038899927	0.284828081038366	0.937227765334332	588	41	GSDMD, BCL2L1, BBC3, TP53, BCL2L11, YWHAH, DYNLL1, BAX, YWHAQ, TP63
REACTOME_RHOH_GTPASE_CYCLE	0.583065380493033	0.902383908432853	0.305742547551595	0.936962726287099	543	26	STOM, SLC1A5, ARHGDIA, FAM91A1, MTR, DBN1, ROCK1, ARHGDIB, SLC4A7, CAV1
REACTOME_COSTIMULATION_BY_THE_CD28_FAMILY	0.607966457023061	0.915756038899927	0.291297336839343	0.935428322279393	579	34	PPP2R1B, SRC, MAP3K8, TNFRSF14, FYN
REACTOME_HCMV_INFECTION	0.635907723169508	0.919841341795104	0.266433269492625	0.93461849776147	633	76	PML, CHMP4A, NUP85, CEBPD, NUP155, NUP107, EZH2, VPS28, DYNLL1, NUP160, TUBA1A, NUP93, POM121C, AAAS, TRIM28, CREB1, POM121, NUP35, NUP54, NUP50, RAE1, EGFR, CHMP2A, SUZ12, NUP205, NUP43, VPS37B, TBL1XR1, NUP133, RBBP4, TPR, HNRNPK, NUP153, NUP62, EED, NFKB1, NUP214, DYNC1I2, NCOR2, NUP58, NUP98
REACTOME_SIGNALING_BY_ALK_IN_CANCER	0.613265306122449	0.918159982590692	0.278234656426479	0.933929263019148	600	47	MYH9, EML4, EIF2AK3, MSN, NPM1, RPS6, RRBP1, HIP1, JUNB, FN1, CEBPB, FRS3, STAT5A, SHC1, TPR, RNF213, PRKAR1A, FRS2, RBX1, MECP2, SEC31A, TFG, LMO7
REACTOME_IRF3_MEDIATED_ACTIVATION_OF_TYPE_1_IFN	0.589205397301349	0.906492719759417	0.540426364316067	0.933303074542324	392	3	IRF3, DTX4
REACTOME_NOTCH3_ACTIVATION_AND_TRANSMISSION_OF_SIGNAL_TO_THE_NUCLEUS	0.589055793991416	0.906492719759417	0.313917952033622	0.932261814684642	548	22	JAG1, RPS27A, NOTCH3, JAG2, DLL4, MIB1, DLL1, ADAM10, EGFR, UBA52, NEURL1B, PSEN1
REACTOME_PI_METABOLISM	0.632218844984802	0.919841341795104	0.272665034679084	0.931625732430621	623	58	PLEKHA2, PIK3C2A, PI4K2B, PIP4K2A, PLEKHA5, PTEN, INPP5D, INPP5E, SBF2, MTMR12, PTPN13, MTMR1, PIK3R4, PLEKHA8, INPP4B, PIP5K1B, RAB14, TNFAIP8L3, PLEKHA3, PLEKHA6, PIKFYVE, INPP4A, SACM1L, SBF1, PIK3R3, PNPLA7, MTMR2, OCRL, PLEKHA4
REACTOME_ACTIVATION_OF_BH3_ONLY_PROTEINS	0.597837837837838	0.910125361620058	0.309104960232584	0.931283197656843	552	24	BBC3, TP53, BCL2L11, YWHAH, DYNLL1, YWHAQ, TP63
REACTOME_POTASSIUM_CHANNELS	0.583423035522067	0.902383908432853	0.310907344006039	0.931119250962668	541	23	KCNQ4, GNB4, ABCC8, GABBR1, GNB1, KCNQ5, GNG12, KCNJ8, KCNAB1, GNB2
REACTOME_INOSITOL_PHOSPHATE_METABOLISM	0.610115911485774	0.915756038899927	0.291714261589135	0.930940431355653	578	33	PLCG2, INPP5B, PPIP5K2, PTEN, INPP5D, IPMK, ITPKC, PLCD1, IP6K2, PLCB2, PLCB4, IP6K1, INPP4B, PLCB3, INPP4A, PPIP5K1
REACTOME_TRAF3_DEPENDENT_IRF_ACTIVATION_PATHWAY	0.581145584725537	0.901520714766538	0.388685800302616	0.930121351542643	486	9	IRF3, TRIM4, IRF7, DDX58, TRIM25, RNF135, SIKE1
REACTOME_ABERRANT_REGULATION_OF_MITOTIC_G1_S_TRANSITION_IN_CANCER_DUE_TO_RB1_DEFECTS	0.584490740740741	0.903147284071891	0.361024875627956	0.928953046519634	504	12	CDKN1A, CDK2, CCND2, CDK6, CCND3, CCND1, CDK4, CDKN1B, RB1, CDKN1C
