pathway	pval	padj	ES	NES	nMoreExtreme	size	leadingEdge
REACTOME_HEMOSTASIS	0.048951048951049	0.385	0.312159693367021	1.18922704101314	48	325	CD74, PTGIR, TNFRSF10B, ACTN1, ANGPT2, LCP2, TGFB1, TAGLN2, F11R, ACTN4, ITGA5, ESAM, PPP2R1B, GAS6, SERPINE1, PROS1, ACTB, SRC, ECM1, GNB4, CD44, SERPING1, DGKH, PLCG2, MAGED2, CD47, PRCP, SRGN, VAV2, CDK2, FERMT3, TP53, FGR, TMSB4X, THBS1, FYN, A2M, FLNA, PLAT, GNAI2, JAM3, ITPR3, PDE1A, DOCK1, PROCR, VEGFC, CAP1, LGALS3BP, SERPINB8, CD109, MERTK, IRF1, ITPR1, TFPI, ANXA5, CFD, HABP4, GNB1, PECAM1, KIF13B, DOCK11, APP, INPP5D, F3, SRI, CBX5, DOCK6, CLU, TUBA1A, SDC2, SDC3, RAP1B, ITGAM, LHFPL2, SYTL4, ITIH4, FAM3C, AKAP10, DGKQ, ITGA3, ABL1, MMRN1, DOCK9, FN1, IGF2, GTPBP2, DGKE, PPIA, KIFC2, DOCK3, GNAI3, CFL1, MICAL1, NRAS, HMG20B, RAPGEF3, RHOA, SERPINE2, ITGA1, VWF, ISLR, TIMP3, PDE2A, YWHAZ, IGHA1, ARRB1, GNG12, PDE5A, F2R, PLAU, CAPZA1, PHACTR2, CAV1, TEK, HSPA5, ATP2B4, PDPN, ITPR2, CDC42, SERPINF2, EHD2, SLC7A6, RHOB, MAFF, ADRA2C, TGFB3, SH2B1, CD58, ABHD12, RASGRP2, DOCK5, S100A10, PRKCD, TMX3, PRKCH, SHC1, AAMP, GNB2, COL1A2, KRAS, ARRB2, PTK2, WEE1, PDGFB, HDAC1, NHLRC2, APLP2, SIN3A, COL1A1, ITGB2, SIRPA
REACTOME_BUTYRATE_RESPONSE_FACTOR_1_BRF1_BINDS_AND_DESTABILIZES_MRNA	0.257078142695357	0.725652679059595	0.435547903346923	1.18910975131856	226	15	ZFP36L1, EXOSC9, EXOSC5, EXOSC4, EXOSC8, DIS3, EXOSC6, EXOSC1, AKT1, XRN1, EXOSC3
REACTOME_GLUCURONIDATION	0.234817813765182	0.709303394279872	0.583462985482533	1.1875906401842	173	5	UGDH, SLC35D1
REACTOME_MAP2K_AND_MAPK_ACTIVATION	0.257415254237288	0.725652679059595	0.380959764125896	1.18752078364261	242	28	ACTG1, ACTB, SRC, BRAF, RAP1B, IQGAP1, FN1, NRAS, VWF, ARRB1
REACTOME_IRF3_MEDIATED_INDUCTION_OF_TYPE_I_IFN	0.260143198090692	0.730723661779748	0.49619833392548	1.18739780209272	217	9	IFI16, IRF3, MRE11, DDX41, DTX4
REACTOME_MRNA_SPLICING_MINOR_PATHWAY	0.211656441717791	0.679460373106298	0.357614571963048	1.18714245581105	206	44	SRSF7, SRSF6, SRSF1, RNPC3, SRSF2, SNRNP40, PRPF6, NCBP1, POLR2H, SF3B3, SNRNP200, SF3B1, GTF2F1, SF3B6, POLR2A, PDCD7, POLR2G, SNRPB, SNRPF, DDX42, SNRPD1, SF3B4, LSM2, POLR2K, NCBP2, PRPF8, SF3B2
REACTOME_GPVI_MEDIATED_ACTIVATION_CASCADE	0.255202628696605	0.725106635297718	0.415320945552103	1.1864216183837	232	18	LCP2, PLCG2, VAV2, FYN, RHOA, PDPN, CDC42, RHOB, COL1A2, COL1A1
REACTOME_SIGNALING_BY_NOTCH1	0.2016210739615	0.663493617869119	0.344115834403291	1.18518269092175	198	62	TLE3, JAG1, HDAC7, RBPJ, HIF1A, KAT2A, MAML2, MAML3, RPS27A, MYC, NOTCH1, HDAC6, TLE4, JAG2, DLL4, NUMB, MIB1, DLL1, CCNC, ARRB1, HEYL, HEY2, MAMLD1, DTX4, HEY1, ADAM10, UBA52, ARRB2, HDAC1, NEURL1B, PSEN1, TBL1XR1, TLE1, DTX2
REACTOME_ONCOGENE_INDUCED_SENESCENCE	0.259533898305085	0.730316318486401	0.380196893658377	1.1851427778249	244	28	MOV10, ETS2, TP53, ETS1, MDM4, ERF, MDM2, RPS27A, CDK6, AGO3, ID1, TNRC6A, UBA52, TNRC6C, CDK4, SP1, CDKN2B
REACTOME_ABORTIVE_ELONGATION_OF_HIV_1_TRANSCRIPT_IN_THE_ABSENCE_OF_TAT	0.255458515283843	0.725106635297718	0.40673632214197	1.18507365982157	233	20	NELFE, NELFA, NCBP1, POLR2H, GTF2F1, NELFCD, POLR2A, POLR2G, NELFB, SUPT5H, POLR2K, NCBP2
REACTOME_NUCLEAR_EVENTS_KINASE_AND_TRANSCRIPTION_FACTOR_ACTIVATION	0.213265306122449	0.680459080183798	0.353679420877219	1.1835363007427	208	46	PPP2R1B, MAPK11, ID4, NAB1, F3, ID2, ID3, JUND, NAB2, DUSP6, JUNB, EGR3, EGR1, CREB1, ATF2, FOS, TCF12
REACTOME_PEPTIDE_HORMONE_METABOLISM	0.229559748427673	0.703044484172889	0.368539774747281	1.18347303454822	218	34	RAB27A, SLC30A7, ATP6AP2, TCF7L2, GNB1, CES1, SEC11C, ENPEP, MYRIP, VAMP2, INHBB, CTNNB1, ERO1B, EXOC7, CPE, ANPEP, CTSZ, EXOC3, SLC30A5
REACTOME_RESOLUTION_OF_ABASIC_SITES_AP_SITES	0.237791932059448	0.711459721957722	0.377567672294218	1.18252566138731	223	30	POLE, PNKP, LIG1, POLD1, NEIL1, RFC4, RFC2, POLD3, POLD2, XRCC1, OGG1, APEX1, PARP2, PCNA
REACTOME_SYNTHESIS_OF_16_20_HYDROXYEICOSATETRAENOIC_ACIDS_HETE	0.214634146341463	0.680684500393391	0.76089861744031	1.1822480057099	131	2	CYP1B1, CYP2U1
REACTOME_DEFECTIVE_B4GALT1_CAUSES_B4GALT1_CDG_CDG_2D	0.234396671289875	0.709303394279872	0.620535279805353	1.18168297541492	168	4	LUM, PRELP, B4GALT1, FMOD
REACTOME_FGFR1_LIGAND_BINDING_AND_ACTIVATION	0.234396671289875	0.709303394279872	0.619448045071335	1.17961255844221	168	4	FGF2, FGFR1, FGF1
REACTOME_FGFR1C_LIGAND_BINDING_AND_ACTIVATION	0.234396671289875	0.709303394279872	0.619448045071335	1.17961255844221	168	4	FGF2, FGFR1, FGF1
REACTOME_MRNA_EDITING	0.232383808095952	0.708410329718862	0.682826996856634	1.17922547385953	154	3	ADARB1, ADAR
REACTOME_SIGNALING_BY_LRP5_MUTANTS	0.24609375	0.717279489904357	0.884121424401635	1.17902836092846	125	1	LRP5
REACTOME_ACTIVATED_NOTCH1_TRANSMITS_SIGNAL_TO_THE_NUCLEUS	0.262593783494105	0.733676769868965	0.384713484523835	1.17897295677512	244	26	JAG1, RPS27A, NOTCH1, JAG2, DLL4, NUMB, MIB1, DLL1, ARRB1, DTX4, ADAM10, UBA52, ARRB2, NEURL1B, PSEN1, DTX2
REACTOME_TRANSCRIPTIONAL_REGULATION_OF_PLURIPOTENT_STEM_CELLS	0.27326968973747	0.736050037597672	0.491851648234431	1.1769962253782	228	9	FOXP1, FGF2, EPAS1, NR6A1, TSC22D1, HIF3A, STAT3, PBX1
REACTOME_CA2_PATHWAY	0.229660144181256	0.703044484172889	0.356131162815898	1.17693470301433	222	43	MOV10, GNB4, FZD6, ITPR3, ITPR1, TCF7L2, GNB1, MYC, WNT11, GNG12, PLCB2, ITPR2, GNAO1, PLCB3, AGO3, CTNNB1, TNRC6A, GNB2, KRAS, FZD3, NLK, MAP3K7, TNRC6C
REACTOME_HIV_ELONGATION_ARREST_AND_RECOVERY	0.270127118644068	0.734727921796283	0.377530189775075	1.17683017743124	254	28	CCNT2, NELFE, NELFA, POLR2H, CCNT1, GTF2F1, CDK9, SUPT16H, NELFCD, POLR2A, POLR2G, NELFB, SUPT5H, ELL, POLR2K
REACTOME_ACTIVATED_NTRK3_SIGNALS_THROUGH_RAS	0.265013054830287	0.734727921796283	0.550651246577675	1.17663146652166	202	6	NRAS, NTRK3, SHC1, KRAS
REACTOME_ABC_TRANSPORTERS_IN_LIPID_HOMEOSTASIS	0.266745005875441	0.734727921796283	0.477733810101444	1.17644450767559	226	10	ABCA7, ABCG1, ABCA6, ABCA5, ABCA9
REACTOME_O_LINKED_GLYCOSYLATION	0.225510204081633	0.698530388427081	0.350421847431785	1.17623455654689	220	47	THBS2, ADAMTS1, POFUT2, ST6GALNAC4, ADAMTS4, ADAMTS13, THBS1, ADAMTS9, ADAMTS2, GALNT16, ADAMTS5, B3GNT2, SPON2, GALNT15, ADAMTS10, SEMA5A, MUC20, ST3GAL4, ADAMTSL4, GALNT18, ADAMTS17, ADAMTSL3
REACTOME_FGFR1B_LIGAND_BINDING_AND_ACTIVATION	0.235382308845577	0.709303394279872	0.681051508168027	1.17615924844696	156	3	FGF2, FGFR1, FGF1
REACTOME_RHO_GTPASE_EFFECTORS	0.11988011988012	0.532859078590786	0.316603685357556	1.17477531778438	119	168	ACTG1, MYH9, NOXA1, ARPC1B, PPP2R1B, ACTB, SRC, SRGAP2, FMNL3, LIMK2, FMNL1, MAPK11, FMNL2, KDM4C, FLNA, NUP85, ARPC5, PKN3, WIPF1, NUP107, YWHAH, DYNLL1, MYL9, CYFIP1, NUP160, YWHAQ, CENPC, MYLK, MYL12B, TUBA1A, ITGB3BP, IQGAP1, KNTC1, TAX1BP3, CYBA, RCC2, ABL1, SCAI, ROCK1, CFL1, RHOA, MYH10, MYL6, NDEL1, MAD1L1, YWHAZ, NCKIPSD, RPS27, PIK3R4, S100A8, ARPC1A, PPP1R12A, EVL, CTNNA1, DVL2, DAAM1, CTTN, CDC42, MYH11, RHOB, XPO1, GOPC, BUB3, PPP1R14A, PRKCD, CTNNB1, MAPRE1, PKN2, PIN1, NUDC, RANGAP1, PTK2, RTKN
REACTOME_ADENYLATE_CYCLASE_INHIBITORY_PATHWAY	0.26909518213866	0.734727921796283	0.477049522346813	1.17475941327033	228	10	ADCY4, ADCY3, GNAI2, GNAI3, ADCY5, ADCY6
REACTOME_SENSORY_PERCEPTION	0.184184184184184	0.64360913676979	0.332399922184949	1.17400978615628	183	80	ACTG1, MYH9, EPB41L3, KCNQ4, SCNN1D, ACTB, MYO1C, LRP1, GSN, ADCY3, MSN, GPC3, ITPR3, SPTAN1, TRIOBP, GNB1, TWF1, EZR, SDC2, SDC3, DNAJC5, HSPG2, LDLR, AGRN, RDH11, PLCB2, CAPZA1, CAMKMT, VAMP2, NMT2
REACTOME_UNWINDING_OF_DNA	0.2725	0.735235849056604	0.523200744293275	1.17327163983529	217	7	MCM3, MCM5, MCM2, MCM6, MCM7, MCM4
REACTOME_NICOTINATE_METABOLISM	0.276824034334764	0.738041027133193	0.395014752181071	1.17310006423617	257	22	NADSYN1, NNMT, PARP10, NT5E, NAPRT, NADK, PARP16, NAXD, PARP4, PARP9, NAXE, NAMPT, NMRK1
REACTOME_GLUCAGON_LIKE_PEPTIDE_1_GLP1_REGULATES_INSULIN_SECRETION	0.276824034334764	0.738041027133193	0.394988258520521	1.17302138435214	257	22	GNB4, ITPR3, ITPR1, GNB1, IQGAP1, RAPGEF3, ADCY5, GNG12, ADCY6, ITPR2, GNB2, PRKAR1B, PRKAR1A, PRKACB, GNG10
REACTOME_INNATE_IMMUNE_SYSTEM	0.022977022977023	0.274728633430266	0.302647837750153	1.17183142781912	22	606	EEF1A1, ACTG1, PSMB8, RAB27A, IFI16, GSDMD, S100A11, NOD1, CFB, MYH9, CASP4, GUSB, COTL1, NFKB2, TCIRG1, PLPP5, PSMB9, PLEKHO2, LCP2, IRF3, CASP2, ALPK1, B2M, ARPC1B, ICAM2, CFI, PPP2R1B, STOM, PROS1, STAT6, ACTB, NLRC5, CD81, UNC13D, TMEM63A, SRC, MGST1, CD44, C1R, TRAF2, SERPING1, BCL2L1, TMC6, MYO1C, MAP3K8, ATAD3B, IMPDH1, UBE2L6, PLCG2, SAA1, ARSA, CD47, BIRC3, CAND1, MAPK11, DBNL, GSN, OSTF1, PRCP, C3, PFKL, CRISPLD2, ATP6AP2, PELI1, FUCA1, VAV2, IRAK3, C1S, TRIM56, FGR, CD93, FYN, GAA, CNN2, LAMP1, TIMP2, PRKCSH, LGALS3, RAB31, NBEAL2, ARPC5, ITPR3, CTSK, TRIM4, SPTAN1, PELI2, IST1, DOCK1, SLC2A3, DPP7, CAP1, AP2A2, TKFC, DHX58, SDCBP, CMTM6, C8G, ITPR1, VAT1, MYD88, WIPF1, C7, CFD, PLD2, PTPRC, ARHGAP45, MALT1, MANBA, RPS27A, PECAM1, APP, TRIM21, NAPRT, DYNLL1, HVCN1, RAP2B, MRE11, HGSNAT, PYGL, CYFIP1, PSME2, CNPY3, CLU, APRT, RAB24, PAFAH1B2, CEP290, CHI3L1, MYO10, DUSP6, JUN, HSP90B1, IRAK4, DDX41, TMEM30A, CASP10, RAP1B, PLD1, ELMO1, PLD3, ITGAM, IQGAP1, FUCA2, MYO9B, CYBA, CFH, ABL1, MVP, ROCK1, FTL, BST2, CPNE1, MOSPD2, TLR4, PSME1, DNAJC5, C1orf35, PPIA, CTSL, CFL1, PGAM1, UBA7, NRAS, DNM1, FGL2, RHOA, UNC93B1, PLA2G6, STK10, PDXK, DHX9, ATP11B, POLR2H, NCKIPSD, CKAP4, CREB1, POLR1C, ALOX5, TXNIP, PLA2G2A, NLRP1, CTSA, IRF7, PIK3R4, S100A8, PLAU, RAB5C, CAPZA1, ATG7, FAF2, ARPC1A, NFASC, TXNDC5, CTSC, CD68, NFKBIA, ATF2, SLC11A1, RIPK1, DTX4, FOS, CDK13, ADAM10, ITPR2, TMEM179B, IMPDH2, MUC20
REACTOME_REGULATION_OF_GENE_EXPRESSION_BY_HYPOXIA_INDUCIBLE_FACTOR	0.27154046997389	0.734727921796283	0.54834905420413	1.17171214234773	207	6	HIF1A, EPAS1, CITED2, HIF3A
REACTOME_FLT3_SIGNALING	0.250797024442083	0.717279489904357	0.375263944045819	1.17133716411262	235	29	SOCS2, FYN, BCL2L11, ABL2, RPS27A, CBL, NRAS, AKT3, STAT5A, KRAS, UBA52, FOXO3, AKT2, AKT1, GAB2, CSK, SH2B3, CDKN1B
REACTOME_MRNA_DECAY_BY_3_TO_5_EXORIBONUCLEASE	0.278481012658228	0.739950393431406	0.447345822047794	1.171176969803	241	13	EXOSC9, EXOSC5, EXOSC4, EXOSC8, SKIV2L, NT5C3B, DIS3, EXOSC6, EXOSC1
REACTOME_ZINC_TRANSPORTERS	0.27144535840188	0.734727921796283	0.475238760383791	1.17030031717736	230	10	SLC39A10, SLC30A7, SLC39A14, SLC30A1, SLC30A2, SLC30A5, SLC39A7, SLC39A1
REACTOME_TRANSCRIPTIONAL_REGULATION_BY_THE_AP_2_TFAP2_FAMILY_OF_TRANSCRIPTION_FACTORS	0.269063180827887	0.734727921796283	0.404102281960451	1.16936984049277	246	19	CDKN1A, NPM1, MYC, CITED2, KDM5B, KCTD15, EGFR, UBE2I, NOP2, ERBB2
REACTOME_GP1B_IX_V_ACTIVATION_SIGNALLING	0.282608695652174	0.746106760284454	0.501190960619537	1.16798593362125	233	8	SRC, FLNA, VWF, YWHAZ, COL1A2, COL1A1
REACTOME_MET_PROMOTES_CELL_MOTILITY	0.25583864118896	0.725106635297718	0.372911051402088	1.1679413256394	240	30	SRC, LAMA5, LAMA4, COL27A1, RAP1B, LAMB1, ITGA3, FN1, COL5A1, LAMC1, LAMA2, COL1A2, PTK2, COL1A1, LAMC2, TNS3
REACTOME_METABOLISM_OF_NUCLEOTIDES	0.213855421686747	0.680684500393391	0.334860518902358	1.16787449734672	212	71	PFAS, TYMP, UPP1, CAD, IMPDH1, AK4, HPRT1, UMPS, GMPR2, NT5E, NUDT5, UCKL1, AMPD2, APRT, NME1, TK2, DUT, DGUOK, NME3, DPYD, CTPS2
REACTOME_PROCESSING_OF_INTRONLESS_PRE_MRNAS	0.276013143483023	0.738041027133193	0.408538809889284	1.16704751155053	251	18	CPSF7, SYMPK, CSTF3, PABPN1, NCBP1, PCF11, WDR33, CPSF1, NUDT21, CPSF4, PAPOLA, CSTF1, FIP1L1, NCBP2, CPSF3, CSTF2T
REACTOME_PEXOPHAGY	0.274099883855981	0.737024132146084	0.461730874197177	1.16678301297331	235	11	ATM, RPS27A, EPAS1
REACTOME_CONSTITUTIVE_SIGNALING_BY_EGFRVIII	0.283084004602992	0.746106760284454	0.445258075253938	1.16571112918655	245	13	CBL, NRAS, CDC37, SHC1, EGFR, KRAS
REACTOME_P75_NTR_RECEPTOR_MEDIATED_SIGNALLING	0.226034308779011	0.698530388427081	0.336051299158097	1.16290733461959	223	68	NGFR, PLEKHG2, ARHGEF10, CASP2, ARHGEF15, ARHGEF17, VAV2, BCL2L11, ARHGDIA, MYD88, MAGED1, ARHGEF1, RPS27A, BEX3, ARHGEF9, ITGB3BP, ARHGEF7, RHOA, NFKBIA, ABR, MCF2L, RELA, TIAM2, ARHGEF3, RASGRF2, ARHGEF12, ARHGEF18, PREX1, UBA52, HDAC1, TRAF6, PSEN1
REACTOME_DCC_MEDIATED_ATTRACTIVE_SIGNALING	0.287686996547756	0.750467073913135	0.443919529711511	1.16220674033333	249	13	SRC, FYN, DOCK1, NTN1, CDC42, ABLIM2, PTK2, ABLIM1, TRIO
REACTOME_CELLULAR_HEXOSE_TRANSPORT	0.28743961352657	0.750467073913135	0.498130608937548	1.1608540258309	237	8	SLC2A3, SLC50A1, SLC2A1
REACTOME_LGI_ADAM_INTERACTIONS	0.250374812593703	0.717279489904357	0.671709406436016	1.16002566791706	166	3	LGI4, DLG4
REACTOME_DUAL_INCISION_IN_GG_NER	0.268987341772152	0.734727921796283	0.36510875700639	1.15991242462719	254	32	DDB2, POLE, POLD1, RFC4, RPS27A, RFC2, POLD3, POLD2, GTF2H4, CUL4B, PARP2, UBA52, XPA, PCNA, POLK, ERCC2, GTF2H3, RBX1, RPA3, GTF2H1
REACTOME_PHENYLALANINE_AND_TYROSINE_METABOLISM	0.264507422402159	0.734727921796283	0.569735833106663	1.15965015709686	195	5	ASRGL1, FAH
REACTOME_SCAVENGING_BY_CLASS_F_RECEPTORS	0.264507422402159	0.734727921796283	0.569693998859543	1.15956500694757	195	5	SCARF1, CALR, HYOU1, HSPH1, HSP90AA1
REACTOME_SIGNALING_BY_ERBB2_ECD_MUTANTS	0.291240045506257	0.751387654887125	0.431865203773705	1.15927401721053	255	14	NRAS, CDC37, ERBIN, SHC1, EGFR, KRAS, ERBB2
REACTOME_HYDROLYSIS_OF_LPC	0.287206266318538	0.750467073913135	0.54243675327216	1.15907873897429	219	6	PLA2G4B, GPCPD1, PLBD1, PLA2G4C
REACTOME_NRCAM_INTERACTIONS	0.251874062968516	0.717749820741803	0.67110502120953	1.15898190945646	167	3	NRP2, DLG4
REACTOME_ADVANCED_GLYCOSYLATION_ENDPRODUCT_RECEPTOR_SIGNALING	0.287589498806683	0.750467073913135	0.483561091900012	1.1571570044527	240	9	SAA1, PRKCSH, LGALS3, APP, CAPZA1, HMGB1, DDOST
REACTOME_ACTIVATION_OF_THE_PHOTOTRANSDUCTION_CASCADE	0.267578125	0.734727921796283	0.866997470324966	1.15619255246325	136	1	GNB1
REACTOME_DEPOSITION_OF_NEW_CENPA_CONTAINING_NUCLEOSOMES_AT_THE_CENTROMERE	0.292596944770858	0.751387654887125	0.469276769798603	1.15561860336424	248	10	NPM1, CENPC, ITGB3BP, RUVBL1, RBBP4, CENPP, RSF1
REACTOME_DEFECTIVE_INTRINSIC_PATHWAY_FOR_APOPTOSIS	0.293028322440087	0.751387654887125	0.399245597257817	1.15531582281069	268	19	TP53, BCL2L11, CAPN2, APP, CDC25B, JUN, CAPNS1
REACTOME_RECOGNITION_OF_DNA_DAMAGE_BY_PCNA_CONTAINING_REPLICATION_COMPLEX	0.297093649085038	0.753755338727039	0.385753890166868	1.15527304257288	275	23	POLE, POLD1, RFC4, RPS27A, RFC2, POLD3, POLD2, WDR48, CUL4B, UBA52, PCNA, RBX1, USP1, RPA3
REACTOME_THROMBOXANE_SIGNALLING_THROUGH_TP_RECEPTOR	0.293772032902468	0.751387654887125	0.468673663123622	1.15413342161591	249	10	GNB4, GNB1, GNG12, AAMP, GNB2, GNAQ, GNG10
REACTOME_TP53_REGULATES_TRANSCRIPTION_OF_ADDITIONAL_CELL_CYCLE_GENES_WHOSE_EXACT_ROLE_IN_THE_P53_PATHWAY_REMAIN_UNCERTAIN	0.293537787513691	0.751387654887125	0.403961427713879	1.15397158743289	267	18	TP53, NPM1, CNOT9, PLAGL1, CNOT3, CNOT6L, PLK2
REACTOME_PTK6_REGULATES_RHO_GTPASES_RAS_GTPASE_AND_MAP_KINASES	0.296122209165687	0.753755338727039	0.468064596783967	1.15263356388144	251	10	DOCK1, PXN, ELMO1, NRAS, RHOA, RASA1, KRAS
REACTOME_ZBP1_DAI_MEDIATED_INDUCTION_OF_TYPE_I_IFNS	0.301245753114383	0.756964168768249	0.422017770063223	1.15217050008889	265	15	NFKB2, IRF3, MYD88, DHX9, NFKBIA, RIPK1, DTX4, RELA
REACTOME_DNA_DAMAGE_BYPASS	0.264859228362878	0.734727921796283	0.354490979979765	1.15175612364474	253	37	UBE2L6, POLE, POLD1, RFC4, RPS27A, RFC2, POLD3, POLD2, UBA7, WDR48, POLI, CUL4B, UBA52, POLH, PCNA, POLK, RBX1, TRIM25, REV3L, USP1, RPA3
REACTOME_MODULATION_BY_MTB_OF_HOST_IMMUNE_SYSTEM	0.296344647519582	0.753755338727039	0.538696474001027	1.15108651102358	226	6	B2M, RPS27A, UBA52, MRC1
REACTOME_RUNX3_REGULATES_P14_ARF	0.305	0.759121835443038	0.512413944721176	1.1490823660994	243	7	TGFB1, RUNX1, BRD2, KRAS, CCND1, CBFB
REACTOME_RETROGRADE_NEUROTROPHIN_SIGNALLING	0.299522673031026	0.755046738265712	0.479556362963074	1.14757372693526	250	9	AP2A2, DNM1, DNAL4, AP2M1, AP2B1
REACTOME_RNA_POLYMERASE_II_TRANSCRIPTION	0.018981018981019	0.246753246753247	0.294515641922989	1.14747323416158	18	884	MOV10, TNFRSF10B, PSMB8, ZNF26, ZNF529, ZNF550, DDB2, ZNF226, PML, SIN3B, ZNF662, SRRM1, DDX39B, ZNF606, ATXN3, ZNF544, COX6A1, G6PD, SRSF5, PSMB9, NDRG1, ZNF274, CASP2, TGFB1, ZNF700, ZNF548, ITGA5, FAS, WWTR1, PPP2R1B, SERPINE1, MDC1, ZNF773, POU2F1, BTG1, SRC, ZNF528, NFYA, SRSF7, TAF1, NABP1, NOTCH2, SRSF6, WRN, BANP, ZNF211, ZNF493, JAG1, CCNT2, CBX4, ZNF79, MAPK11, NR2C1, HDAC7, ZNF333, RRAGB, ZNF549, MED17, BBC3, L3MBTL1, ZNF471, ZNF562, CPSF7, CDKN1A, CDK2, ZNF160, SRSF1, PIDD1, RBPJ, ZNF354B, ZNF587, TP53, SRSF3, GLS, ZNF234, ZNF595, ZNF268, THBS1, NPM1, ZNF263, BCL2L11, ANAPC2, ZNF568, BRD1, NELFE, LGALS3, CCND2, KAT2A, ZNF500, ZNF254, SYMPK, MAML2, TP53INP1, CTSK, MDM4, PERP, CLDN5, ZNF791, ZNF564, SLC2A3, INTS4, ZNF441, ZNF75A, ATM, ZNF432, ZNF224, ZNF721, ZNF585B, ANAPC7, U2AF1L4, CNOT9, MDM2, PCGF2, NELFA, ZNF521, ZNF37A, RAD51D, ZNF667, EIF4A3, ZNF506, CSTF3, RFC4, SESN3, ZNF33B, ZKSCAN8, PIP4K2A, TCF7L2, ZNF205, MAML3, EZH2, PLAGL1, RPS27A, SRSF11, PHC3, ELL2, ZNF577, PTEN, SNAPC4, ACTL6A, YWHAH, NR2C2, ZNF12, ZNF431, MYL9, CBX5, CNOT3, BAX, ZNF347, ZNF514, MYC, NOTCH1, BMP2, MRE11, PSME2, HDAC6, RFC2, FANCC, TP53I3, PRKAA1, YWHAQ, ZNF17, SRSF2, ZNF615, ZNF324, ZNF320, NOTCH3, JUN, TP63, CASP10, POLDIP3, RUNX1, PPARG, ZNF264, ZNF585A, ZNF10, JUNB, NR6A1, ZNF394, KRBOX4, ZNF720, GADD45A, ABL1, NR1H3, ZNF266, RAD9A, PABPN1, ZNF627, ZNF621, CNOT6L, INTS2, PLK2, ZNF706, SKI, LSM11, PSME1, AFF4, PRELID1, RING1, PMS2, ZNF761, SREBF1, SRSF9, CTSL, MED23, ZNF426, CDK6, COX7A2L, ABCA6, SMARCD3, NCBP1, CHD3, ZNF692, PCF11, ZNF350, DGCR8, SATB2, ZNF140, ZNF324B, SMAD1, ZNF691, SOCS3, BNIP3L, ELF1, ZNF555, MED30, ZNF546, ZNF510, DLL1, CCNG2, YWHAZ, TRIM28, POLR2H, TAF9, KMT2E, SRRT, CREB1, ZNF678, ZNF3, CEBPB, INTS3, TXNIP, CCNC, SNAPC2, KMT2B, ZNF774, RBM14, ZFP28, MAGOH, WDR33, ZNF227, CITED2, HIVEP3, KDM5B, KCTD6, KMT2A, CCND3, HEY2, RBFOX1, IGFBP3, U2AF2, ZNF138, CDC73, ZNF558, ZNF655, CAV1, MAMLD1, SMAD3, ARID2, GTF2H4, INTS6, CENPJ, ATF2, DDX39A, CCNT1, MED12, KCTD15, TGIF1, FOS, HEY1, TCF12, ZNF419, ZNF764, CDK13, TSC2, ZNF605, EHMT2, CASC3, ZNF614, ZNF212, DNA2, AKT3, MSH2, TAF12, BRD2, ZNF250, GAMT, TJP1, TRIM33, VDR, RELA, RNPS1, SARNP, ZNF446, TAF4, L3MBTL2, ZNF202, ZNF383, ZKSCAN1, ZNF561, ZNF34, ANAPC10, CPSF1, RYBP, NOTCH4, FZR1, AGO3, CSNK2A2, GTF2F1, CTNNB1, TAF9B, CDK9, RRM2B, PSMD10, SUPT16H, ZFP90, RNMT, EGFR, PIN1, TEAD3, NUDT21, GTF2B, TNRC6A, UBE2I, KAT5, KRAS, MTA2, LDB1, BCL6, NOP2, MED27, UBA52, ZNF750, SMURF2, FOXO1, SETD1B, NR2C2AP, SMAD6, SUZ12, KAT6A, PGR, ZSCAN25, PPM1D, THOC2, CNOT2, HDAC1, SIN3A, NELFCD, COL1A1, CPSF4, CCND1, GATAD2A, PCNA, ZNF420, ERBB2, ZNF445, SRSF4, ZFP30, TEAD2, TXN, PAPOLA, ZNF23, ATRIP, ZNF566, FOXO3, ZNF746, TBL1XR1, LBR, POLR2A, TNRC6C
REACTOME_EGR2_AND_SOX10_MEDIATED_INITIATION_OF_SCHWANN_CELL_MYELINATION	0.296928327645051	0.753755338727039	0.427452163792731	1.14742790749353	260	14	WWTR1, NAB1, NAB2, LAMB1, PMP22, LAMC1, LAMA2
REACTOME_NEUTROPHIL_DEGRANULATION	0.101898101898102	0.507233273056058	0.301805899534745	1.14639523354086	101	299	EEF1A1, RAB27A, GSDMD, S100A11, GUSB, COTL1, TCIRG1, PLEKHO2, B2M, STOM, UNC13D, TMEM63A, MGST1, CD44, TMC6, ATAD3B, IMPDH1, ARSA, CD47, CAND1, DBNL, GSN, OSTF1, PRCP, C3, PFKL, CRISPLD2, ATP6AP2, FUCA1, FGR, CD93, GAA, CNN2, LAMP1, TIMP2, LGALS3, RAB31, NBEAL2, ARPC5, SPTAN1, IST1, SLC2A3, DPP7, CAP1, AP2A2, SDCBP, CMTM6, VAT1, CFD, PTPRC, ARHGAP45, MANBA, PECAM1, NAPRT, DYNLL1, HVCN1, RAP2B, HGSNAT, PYGL, CYFIP1, APRT, RAB24, PAFAH1B2, CEP290, CHI3L1, TMEM30A, RAP1B, PLD1, ITGAM, IQGAP1, FUCA2, CYBA, MVP, ROCK1, FTL, BST2, CPNE1, MOSPD2, DNAJC5, C1orf35, PPIA, PGAM1, NRAS, FGL2, RHOA, STK10, PDXK, ATP11B, CKAP4, ALOX5, CTSA, S100A8, PLAU, RAB5C, ATG7, FAF2, NFASC, TXNDC5, CTSC, CD68, SLC11A1, CDK13, ADAM10, TMEM179B, IMPDH2
REACTOME_POU5F1_OCT4_SOX2_NANOG_ACTIVATE_GENES_RELATED_TO_PROLIFERATION	0.268365817091454	0.734727921796283	0.663275859034042	1.14546113842834	178	3	FGF2, NR6A1, STAT3
REACTOME_P75NTR_REGULATES_AXONOGENESIS	0.271844660194175	0.734727921796283	0.60128961101817	1.14503352147344	195	4	NGFR, ARHGDIA, RHOA
REACTOME_SIGNALING_BY_FLT3_ITD_AND_TKD_MUTANTS	0.307249712313003	0.762308828814439	0.437178099458286	1.1445572900267	266	13	BCL2L1, CDKN1A, PIM1, NRAS, STAT5A, KRAS
REACTOME_SYNTHESIS_OF_PIPS_AT_THE_GOLGI_MEMBRANE	0.307249712313003	0.762308828814439	0.437075035356691	1.14428746230896	266	13	PIK3C2A, PI4K2B, INPP5E, PIK3R4, PIKFYVE, SACM1L, OCRL
REACTOME_REGULATION_OF_INSULIN_SECRETION	0.271134020618557	0.734727921796283	0.346633228299086	1.14275620987389	262	42	GNB4, ABCC8, CACNA1C, GNAI2, ITPR3, ITPR1, GNB1, IQGAP1, SLC2A1, RAPGEF3, ADCY5, GNG12, PLCB2, ADCY6, MARCKS, ITPR2, VAMP2, ADRA2C, PLCB3, GNB2, GNAI1, GNAQ, PRKAR1B, PRKAR1A, PRKACB, GNG10
REACTOME_SIRT1_NEGATIVELY_REGULATES_RRNA_EXPRESSION	0.31	0.765155854039338	0.509514602335692	1.14258062421129	247	7	TAF1D, RRP8, TAF1C, TAF1B, TBP, SUV39H1
REACTOME_RHOU_GTPASE_CYCLE	0.298523206751055	0.755046738265712	0.359191256197622	1.14111314200492	282	32	SRC, SRGAP2, PTK2B, SPTAN1, ARHGAP31, PEAK1, IQGAP1, ARHGEF7, MYO6, WDR6
REACTOME_GLUCAGON_TYPE_LIGAND_RECEPTORS	0.303140096618358	0.75809121141602	0.489603562758584	1.14098241844984	250	8	GNB4, GNB1, GNG12, GNB2, GNG10
REACTOME_RHOQ_GTPASE_CYCLE	0.278004073319756	0.739933007329908	0.338625915456595	1.13916166711691	272	49	CPNE8, STOM, CDC42EP1, SRGAP2, ARHGAP33, SYDE1, DLC1, SLC1A5, GJA1, ARHGEF9, IQGAP1, ARHGEF7, ARHGAP32, PLEKHG3, SLC4A7, CDC42EP3, CAV1, OPHN1, ARHGAP17, CDC42, GOPC, PREX1, ARHGAP1
REACTOME_DEFECTS_OF_CONTACT_ACTIVATION_SYSTEM_CAS_AND_KALLIKREIN_KININ_SYSTEM_KKS	0.292847503373819	0.751387654887125	0.559453292500291	1.13872089631206	216	5	SERPING1, GGCX, VWF
REACTOME_DUAL_INCISION_IN_TC_NER	0.276142131979695	0.738041027133193	0.335430260423991	1.1384870214455	271	53	HMGN1, POLE, POLD1, XAB2, RFC4, AQR, RPS27A, UVSSA, RFC2, POLD3, POLD2, POLR2H, GTF2H4, CUL4B, ZNF830, UBA52, XPA, PCNA, POLR2A, POLK, ERCC6, POLR2G, ERCC2, PPIE, GTF2H3, RBX1, RPA3, POLR2K, GTF2H1
REACTOME_SUMOYLATION	0.203796203796204	0.665081126790339	0.310603914368299	1.13771248918025	203	137	PML, NFKB2, MDC1, WRN, CBX4, NR2C1, HDAC7, SP100, TP53, DDX17, NPM1, NUP85, NUP155, SMC5, MDM2, PCGF2, NUP107, RAD52, UHRF2, PHC3, CBX5, NOP58, HNRNPC, NUP160, PPARG, NUP93, POM121C, NR1H3, AAAS, SAE1, RING1, CHD3, ZNF350, SENP1, SATB2, DDX5, NSMCE1, TRIM28, TRIM27, POM121, SMC6, NUP35, XPC, NUP54, NUP50, NFKBIA, VHL, VDR, RAE1, RELA, L3MBTL2, UBE2I, RANGAP1, SUZ12, PGR, HDAC1, SIN3A, NUP205, PCNA, SUMO2, SAFB, NUP43, NUP133, TPR, PHC2, HNRNPK, TDG, MBD1, PIAS2, NUP153, TP53BP1, NUP62, HDAC2, SMC1A, PIAS3, NUP214, NCOA1, PHC1, HIC1, SENP5, NCOR2, NUP58, CETN2, NUP98, PIAS4, NSMCE3
REACTOME_DDX58_IFIH1_MEDIATED_INDUCTION_OF_INTERFERON_ALPHA_BETA	0.280203045685279	0.743270473630597	0.33495455330484	1.13687241941026	275	53	NFKB2, IRF3, NLRC5, TRAF2, UBE2L6, SAA1, TRIM4, TKFC, DHX58, RPS27A, APP, CASP10, UBA7, IRF7, NFKBIA, RIPK1, RELA, MAP3K1, ATG12, PIN1, UBA52, DDX58, TRAF6, HMGB1, OTUD5, HSP90AB1, TRIM25, RNF125, RNF135, NFKB1
REACTOME_SPERM_MOTILITY_AND_TAXES	0.29296875	0.751387654887125	0.852403191282351	1.13673021570312	149	1	HVCN1
REACTOME_NOD1_2_SIGNALING_PATHWAY	0.314438502673797	0.765155854039338	0.368697307562465	1.13548783523552	293	27	NOD1, CASP4, CASP2, BIRC3, MAPK11
REACTOME_ACTIVATION_OF_IRF3_IRF7_MEDIATED_BY_TBK1_IKK_EPSILON	0.30787037037037	0.762645815106445	0.441231170962968	1.13533185150341	265	12	IRF3, RPS27A, TLR4, IRF7, UBA52, CD14
REACTOME_TICAM1_DEPENDENT_ACTIVATION_OF_IRF3_IRF7	0.310386473429952	0.765155854039338	0.487032700896603	1.13499122800944	256	8	IRF3, RPS27A, IRF7, UBA52
REACTOME_LISTERIA_MONOCYTOGENES_ENTRY_INTO_HOST_CELLS	0.315265486725664	0.765297238610292	0.401709631111267	1.13470030463179	284	17	SRC, CTNND1, SH3GL1, RPS27A, CBL, CTNNB1, UBA52, HGS, SH3KBP1, STAM2
REACTOME_SYNTHESIS_OF_PC	0.318729463307777	0.767781693389177	0.39707577935518	1.13430178229342	290	18	ABHD3, CHKB, LPIN3, LPIN2, CEPT1, CHKA, SLC44A1, CHPT1, CSNK2A2
REACTOME_ONCOGENIC_MAPK_SIGNALING	0.26969696969697	0.734727921796283	0.328943469263487	1.13408602883885	266	64	ACTG1, ACTB, SRC, ZC3HAV1, SPRED1, MAP3K11, BCL2L11, SPRED2, AGK, BRAF, CLCN6, DUSP6, RAP1B, IQGAP1, FN1, NRAS, PAPSS1, VWF, ARRB1, SND1, ATG7, AGTRAP
REACTOME_ATF4_ACTIVATES_GENES_IN_RESPONSE_TO_ENDOPLASMIC_RETICULUM_STRESS	0.317596566523605	0.767781693389177	0.381872718282067	1.13407134258466	295	22	NFYA, EXOSC9, EXOSC5, EXOSC4, EXOSC8, CEBPB, CCL2, DIS3, EXOSC6, HERPUD1, ATF6, EXOSC1, EXOSC3, KHSRP, DDIT3
REACTOME_NOTCH1_INTRACELLULAR_DOMAIN_REGULATES_TRANSCRIPTION	0.283643892339545	0.746106760284454	0.344462010842913	1.13345341332896	273	41	TLE3, HDAC7, RBPJ, HIF1A, KAT2A, MAML2, MAML3, RPS27A, MYC, NOTCH1, HDAC6, TLE4, CCNC, HEYL, HEY2, MAMLD1, HEY1, UBA52, HDAC1, TBL1XR1, TLE1, RBX1, HDAC8, HDAC2, NBEA
REACTOME_TRISTETRAPROLIN_TTP_ZFP36_BINDS_AND_DESTABILIZES_MRNA	0.322763306908267	0.770419850935818	0.415135623215289	1.1333812283142	284	15	ZFP36, EXOSC9, EXOSC5, EXOSC4, EXOSC8, DIS3, EXOSC6, EXOSC1, XRN1, EXOSC3
REACTOME_NEGATIVE_EPIGENETIC_REGULATION_OF_RRNA_EXPRESSION	0.283489096573209	0.746106760284454	0.347089982984249	1.13313345101047	272	38	SIN3B, POLR1E, TAF1D, RRP8, TAF1C, SAP30BP, POLR2H, BAZ2A, POLR1C, GTF2H4, TAF1B, ARID4B, HDAC1, SIN3A, ERCC2, GTF2H3, TBP, SAP18, HDAC2, SUV39H1, POLR2K, GTF2H1
REACTOME_RRNA_MODIFICATION_IN_THE_NUCLEUS_AND_CYTOSOL	0.2829417773238	0.746106760284454	0.337392384698412	1.13286820809814	276	48	WDR75, RPS6, RPS9, TRMT112, NOP58, NOP56, RRP7A, NAT10, RCL1, RPS7, PDCD11, RPS2, TBL3, RPS14, NHP2, EMG1, NOP2, DIMT1, WDR36, HEATR1, NOC4L, GAR1, DCAF13, UTP20
