pathway	pval	padj	ES	NES	nMoreExtreme	size	leadingEdge
REACTOME_MRNA_SPLICING	0.001	0.0162014264633546	0.470468813051943	3.04260585752558	0	164	PCBP2, HNRNPA0, SF3B1, HNRNPA2B1, GPKOW, SNRPD3, YBX1, CDC5L, SNRNP27, WDR33, POLR2C, PRPF6, SNRNP35, HNRNPK, U2SURP, RBM22, FUS, WBP11, SNRNP200, CWC15, PLRG1, HNRNPD, HNRNPUL1, PPWD1, FIP1L1, PPIE, CSTF1, CHERP, HNRNPM, SRRM2, PQBP1, CASC3, POLR2B, LSM8, SNU13, POLR2K, ELAVL1, SNRPC, PDCD7, SF1, PRPF40A, LSM6, PCBP1, POLR2L, PRPF8, PRPF38A, SLU7, SF3B6, SRRM1, SUGP1, RNPS1, HNRNPL, WBP4, PABPN1, PUF60, ZCRB1, SRSF2, LSM5, CCAR1, RBM17, CPSF7, POLR2I, POLR2D, HNRNPH2, SNRNP40, SNW1, SRSF9, MAGOH, SNRPB2, ISY1, PPIL4, DNAJC8, USP39, AQR, SRSF5, XAB2, NUDT21, HNRNPU, SYMPK, CWC22, U2AF2, RBM5, CPSF1, CPSF4, SMNDC1, HNRNPC, POLR2G, PRPF4, SNRPF, SRSF11, SF3A2, HNRNPA3, PPIH, U2AF1L4, SNRNP70, HNRNPR, NCBP1, ZRSR2, DDX42, ALYREF, DHX38, SRSF4, SRSF3, GCFC2, PPIL3, POLR2E, CWC27, POLR2A, SART1, GTF2F1, DHX9, PRPF3, SYF2, SNRPD1, NCBP2, CTNNBL1, SF3A1, SF3B5, BUD31, CRNKL1, SF3B4, SRSF10, DDX46, CPSF2, DDX5, SNRPB, SNRPD2, DDX23, POLR2H, PAPOLA, SF3B3, SNRNP48, SRRT, RBMX, PTBP1, PHF5A, LSM2, EIF4A3, SRSF6, SRSF1
REACTOME_PROCESSING_OF_CAPPED_INTRON_CONTAINING_PRE_MRNA	0.000999000999000999	0.0162014264633546	0.455769576629609	3.04049827517419	0	208	PCBP2, HNRNPA0, SF3B1, HNRNPA2B1, GPKOW, SNRPD3, YBX1, CDC5L, SNRNP27, WDR33, POLR2C, PRPF6, SNRNP35, HNRNPK, U2SURP, RBM22, FUS, WBP11, SNRNP200, CWC15, PLRG1, HNRNPD, HNRNPUL1, POM121, PPWD1, FIP1L1, PPIE, NUP54, SARNP, CSTF1, NUP62, NUP133, POM121C, CHERP, NUP43, HNRNPM, SRRM2, PQBP1, THOC7, CASC3, POLR2B, LSM8, THOC2, SNU13, POLR2K, ELAVL1, SNRPC, PDCD7, SF1, PRPF40A, LSM6, PCBP1, POLR2L, PRPF8, NUP155, PRPF38A, SLU7, SF3B6, SRRM1, SUGP1, RNPS1, DDX39B, HNRNPL, WBP4, PABPN1, PUF60, NUP58, EIF4E, ZCRB1, SRSF2, LSM5, CCAR1, RBM17, NUP160, CPSF7, POLR2I, POLR2D, HNRNPH2, SNRNP40, SNW1, SRSF9, MAGOH, SNRPB2, ISY1, RAE1, PPIL4, DNAJC8, POLDIP3, USP39, TPR, NUP153, AQR, METTL14, SRSF5, XAB2, NUDT21, HNRNPU, NUP205, SYMPK, CWC22, U2AF2, RBM5, CPSF1, CPSF4, SMNDC1, HNRNPC, POLR2G, SEC13, FYTTD1, GLE1, NUP107, NUP98, PRPF4, SNRPF, SRSF11, SF3A2, HNRNPA3, CHTOP, PPIH, U2AF1L4, SNRNP70, HNRNPR, NCBP1, RANBP2, ZRSR2, NUP37, DDX42, ALYREF, DHX38, SRSF4, SRSF3, NUP93, GCFC2, PPIL3, POLR2E, THOC5, CWC27, POLR2A, SART1, GTF2F1, AAAS, SLBP, DHX9, PRPF3, SYF2, SNRPD1, NCBP2, CTNNBL1, SF3A1, SF3B5, BUD31, CRNKL1, SF3B4, SRSF10, DDX46, CPSF2, DDX5, SNRPB, SNRPD2, DDX23, POLR2H, PAPOLA, SF3B3, SNRNP48, SRRT, RBMX, NXF1, PTBP1, PHF5A, LSM2, EIF4A3, SRSF6, SRSF1, NUP35
REACTOME_MITOCHONDRIAL_TRANSLATION	0.00100502512562814	0.0162014264633546	0.51417503575894	2.99924818729721	0	81	MRPL38, MRPL37, MRPL10, MRPL43, TUFM, MRPS27, MRPL32, MRPL9, MRPL44, MRPL51, OXA1L, MRPS14, MTIF3, MRPS35, MRPS10, MTFMT, MRPL39, MRPL30, MRPL55, MRPS9, MRPL57, GFM1, TSFM, MRPS2, ERAL1, MRPL42, MRPL21, MRPS24, MRPL22, MRPS15, MRPS22, MRPS36, MRPL3, MRPL50, AURKAIP1, MRPS18C, MRPL36, MRPL18, MRPS31, MRRF, MRPS11, MRPL28, MRPS18B, MRPL2, PTCD3, GADD45GIP1, MRPL49, MRPS33, MRPS30, MRPS28, MRPS17, CHCHD1, MRPL11, MRPL4, MRPS26, MRPL14, MRPS25, MTRF1L, MRPL46, MTIF2, MRPL13, MRPL45, MRPL47, MRPL1, MRPL15, MRPL16, MRPS5, MRPL24, MRPS34
REACTOME_RESPIRATORY_ELECTRON_TRANSPORT	0.00100704934541793	0.0162014264633546	0.51746879184152	2.99900964577737	0	79	NDUFV2, NDUFA2, TRAP1, NDUFC2, NDUFB4, SCO1, COX16, COA1, NDUFB6, NDUFAF6, LRPPRC, COX11, NDUFV3, COX7C, NDUFA12, NDUFA6, NDUFA5, NDUFB11, COX4I1, UQCR11, NDUFA13, SDHC, TIMMDC1, COX7A2L, NDUFA7, NDUFS5, NDUFV1, UQCRB, COX19, COX5A, COX6C, NDUFS2, ETFA, NDUFAF3, UQCRC1, NDUFA4, NDUFA3, NDUFA1, UQCRC2, SDHA, COX6B1, UQCRH, NDUFAF2, NDUFB9, NDUFB10, NDUFA10, ECSIT, CYC1, NDUFB7, COX5B, TMEM186, NDUFB2, UQCRQ, SDHD, COX8A, TMEM126B, SDHB, TACO1, NDUFB5, NDUFS8, NDUFS4, NDUFAF7, NDUFA8, NDUFAB1, NDUFAF1, UQCRFS1, NUBPL, NDUFS3
REACTOME_RESPIRATORY_ELECTRON_TRANSPORT_ATP_SYNTHESIS_BY_CHEMIOSMOTIC_COUPLING_AND_HEAT_PRODUCTION_BY_UNCOUPLING_PROTEINS	0.00100502512562814	0.0162014264633546	0.488308825395949	2.86524673870089	0	83	NDUFV2, NDUFA2, TRAP1, NDUFC2, NDUFB4, SCO1, COX16, COA1, NDUFB6, NDUFAF6, LRPPRC, COX11, NDUFV3, COX7C, NDUFA12, NDUFA6, NDUFA5, NDUFB11, COX4I1, UQCR11, NDUFA13, SDHC, TIMMDC1, COX7A2L, NDUFA7, NDUFS5, NDUFV1, UQCRB, COX19, COX5A, COX6C, NDUFS2, ETFA, NDUFAF3, UQCRC1, NDUFA4, NDUFA3, NDUFA1, UQCRC2, SDHA, COX6B1, UQCRH, NDUFAF2, NDUFB9, NDUFB10, NDUFA10, ECSIT, CYC1, NDUFB7, COX5B, TMEM186, NDUFB2, UQCRQ, SDHD, COX8A, TMEM126B, SDHB, TACO1, NDUFB5, NDUFS8, NDUFS4, NDUFAF7, NDUFA8, NDUFAB1, NDUFAF1, UQCRFS1, NUBPL, NDUFS3
REACTOME_COMPLEX_I_BIOGENESIS	0.00104275286757039	0.0162014264633546	0.549100741860876	2.81757627580352	0	43	NDUFV2, NDUFA2, NDUFC2, NDUFB4, COA1, NDUFB6, NDUFAF6, NDUFV3, NDUFA12, NDUFA6, NDUFA5, NDUFB11, NDUFA13, TIMMDC1, NDUFA7, NDUFS5, NDUFV1, NDUFS2, NDUFAF3, NDUFA3, NDUFA1, NDUFAF2, NDUFB9, NDUFB10, NDUFA10, ECSIT, NDUFB7, TMEM186, NDUFB2, TMEM126B, NDUFB5, NDUFS8, NDUFS4, NDUFAF7, NDUFA8, NDUFAB1, NDUFAF1, NUBPL, NDUFS3
REACTOME_TRANSLATION	0.000999000999000999	0.0162014264633546	0.399727560121834	2.71860982743375	0	246	MRPL38, EIF3F, MRPL37, IARS2, MRPL10, MRPL43, TUFM, SRP14, MRPS27, MRPL32, SRP9, MRPL9, NARS2, RPL22, AIMP1, MRPL44, MRPL51, EIF3K, OXA1L, MRPS14, MTIF3, MRPS35, SRP54, MRPS10, MTFMT, MRPL39, MRPL30, RPL30, EIF2B3, EEF1A2, SRPRA, MRPL55, MRPS9, MRPL57, HARS2, GFM1, TSFM, CARS2, MRPS2, LARS2, EEF1G, ERAL1, MRPL42, EIF2B1, MRPL21, EIF3I, MRPS24, EIF2B5, EEF2, MRPL22, RPS25, EEF1B2, MRPS15, SPCS2, RPS20, MRPS22, MRPS36, MRPL3, MRPL50, EIF4E, AURKAIP1, EIF4B, EIF3L, MRPS18C, RPL14, SSR3, MRPL36, RPL29, EIF2B2, RARS2, RPL37A, MRPL18, UBA52, RPS11, MRPS31, SSR1, MRRF, PPA2, RPS15A, MRPS11, SEC61A2, MRPL28, MRPS18B, RPL35A, MRPL2, FAU, PTCD3, RPLP1, RPL4, GADD45GIP1, RPS14, EIF3E, RPL6, EIF3H, RPS23, RPL23A, MRPL49, MRPS33, SRP19, MRPS30, EIF3G, RPS4X, SRP68, MRPS28, RPL27, RPL19, RPL13A, YARS2, MRPS17, RPS29, WARS2, RPL21, RPS15, RPS13, SARS2, RPL7A, RPL18A, CHCHD1, MRPL11, MRPL4, EARS2, RPS7, RPL39, MRPS26, RPS24, RPL24, EIF3M, MRPL14, RPS9, MRPS25, MTRF1L, SPCS3, RPL7, RPS3A, RPL10A, RPS3, EIF3J, MRPL46, SSR4, MTIF2, MRPL13, RPL5, MRPL45, RPL32, MRPL47, RPL23, DDOST, RPL28, TRAM1, SRP72, EIF4H, MRPL1, MRPL15, RPS16, MRPL16, TARS2, TRMT112, RPS5, MRPS5, VARS2, MRPL24, FARS2, MRPS34, RPL37, RPS27A, RPL15, RPL13, RPL9, RPL34, RPL27A, RPL31, PPA1, MRPL33, RPS6, FARSB, MRPL48, EIF4A2, RPL36AL, EEF1E1, EIF2S3, RPLP2, RPS12, GSPT1, EIF2S2, RPS21, MRPL52, RPL17, EIF5B, MRPL35, MRPL27, RPS10, MRPL19, RPL11, RPL26, EIF3C, GSPT2, EIF2S1, RPSA, EIF5, RPS18, EIF3D, RPS19, SEC61G, RPL35, RPS2, RPS26, FARSA, MRPS23
REACTOME_THE_CITRIC_ACID_TCA_CYCLE_AND_RESPIRATORY_ELECTRON_TRANSPORT	0.001001001001001	0.0162014264633546	0.43255125141448	2.68664851863352	0	123	GLO1, NDUFV2, NDUFA2, TRAP1, NDUFC2, NDUFB4, VDAC1, SCO1, COX16, HAGH, MDH2, DLST, COA1, NDUFB6, NDUFAF6, LRPPRC, IDH3G, CS, SUCLG2, COX11, NDUFV3, D2HGDH, COX7C, NDUFA12, NDUFA6, NDUFA5, NDUFB11, COX4I1, UQCR11, NDUFA13, SDHC, TIMMDC1, COX7A2L, NDUFA7, FH, NDUFS5, NDUFV1, UQCRB, IDH3B, COX19, COX5A, COX6C, NDUFS2, OGDH, SUCLG1, ETFA, NDUFAF3, UQCRC1, NDUFA4, NDUFA3, NDUFA1, UQCRC2, SDHA, COX6B1, UQCRH, NDUFAF2, NDUFB9, NDUFB10, PDHX, NDUFA10, ECSIT, CYC1, NDUFB7, COX5B, TMEM186, NDUFB2, PDHA1, UQCRQ, SDHD, COX8A, TMEM126B, SDHB, TACO1, PDHB, NDUFB5, NDUFS8, NDUFS4, ME1, ME2, DLAT, NDUFAF7, ME3, NDUFA8, NDUFAB1, DLD, NDUFAF1, UQCRFS1, NUBPL, SUCLA2, NDUFS3, PDPR, ACO2
REACTOME_FORMATION_OF_TC_NER_PRE_INCISION_COMPLEX	0.00103092783505155	0.0162014264633546	0.509543986391913	2.67338267851026	0	47	POLR2C, COPS7B, ERCC3, GTF2H3, RBX1, CUL4A, COPS6, MNAT1, PPIE, XPA, COPS4, POLR2B, CUL4B, POLR2K, COPS7A, TCEA1, POLR2L, GTF2H5, POLR2I, POLR2D, UBA52, ISY1, AQR, XAB2, USP7, ERCC6, POLR2G, COPS2, GTF2H4, GPS1, POLR2E, POLR2A, ERCC2, COPS3, ZNF830, UBB, GTF2H1, RPS27A, POLR2H
REACTOME_TRANSPORT_OF_MATURE_TRANSCRIPT_TO_CYTOPLASM	0.00100908173562059	0.0162014264633546	0.463839295837077	2.65668644802682	0	72	WDR33, POM121, FIP1L1, NUP54, SARNP, NUP62, NUP133, POM121C, NUP43, THOC7, CASC3, THOC2, NUP155, SLU7, SRRM1, RNPS1, DDX39B, NUP58, EIF4E, SRSF2, NUP160, SRSF9, MAGOH, RAE1, POLDIP3, TPR, NUP153, SRSF5, NUP205, SYMPK, U2AF2, CPSF1, CPSF4, SEC13, FYTTD1, GLE1, NUP107, NUP98, SRSF11, CHTOP, U2AF1L4, NCBP1, RANBP2, NUP37, ALYREF, DHX38, SRSF4, SRSF3, NUP93, THOC5, AAAS, SLBP
REACTOME_MRNA_SPLICING_MINOR_PATHWAY	0.00104384133611691	0.0162014264633546	0.503047787690781	2.59443834071631	0	44	SF3B1, SNRPD3, YBX1, POLR2C, PRPF6, SNRNP35, SNRNP200, POLR2B, SNU13, POLR2K, PDCD7, POLR2L, PRPF8, SF3B6, ZCRB1, SRSF2, POLR2I, POLR2D, SNRNP40, POLR2G, SNRPF, NCBP1, ZRSR2, DDX42, POLR2E, POLR2A, GTF2F1, SNRPD1, NCBP2, SF3B5, SF3B4, SNRPB, SNRPD2, DDX23, POLR2H, SF3B3, SNRNP48, LSM2, SRSF6, SRSF1
REACTOME_VIRAL_MESSENGER_RNA_SYNTHESIS	0.00105374077976818	0.0162014264633546	0.517262943955751	2.56914754931339	0	38	POLR2C, POM121, NUP54, NUP62, NUP133, POM121C, NUP43, POLR2B, POLR2K, POLR2L, NUP155, NUP58, NUP160, POLR2I, POLR2D, RAE1, TPR, NUP153, NUP205, POLR2G, SEC13, NUP107, NUP98, RANBP2, NUP37, NUP93, POLR2E, POLR2A, GTF2F1, AAAS
REACTOME_GENE_SILENCING_BY_RNA	0.00101729399796541	0.0162014264633546	0.463019600614961	2.54370371525684	0	58	AGO1, DROSHA, TNRC6A, ELAC2, POLR2C, POM121, NUP54, NUP62, NUP133, POM121C, TNRC6B, NUP43, POLR2B, POLR2K, TNRC6C, POLR2L, NUP155, NUP58, TSN, DGCR8, NUP160, POLR2I, POLR2D, AGO3, RAE1, TPR, DICER1, NUP153, NUP205, POLR2G, SEC13, NUP107, NUP98, IPO8, RANBP2, NUP37, NUP93, POLR2E, AGO4, POLR2A, AAAS
REACTOME_TRANSCRIPTIONAL_REGULATION_BY_SMALL_RNAS	0.00104166666666667	0.0162014264633546	0.496305654183323	2.53294825966007	0	42	AGO1, TNRC6A, POLR2C, POM121, NUP54, NUP62, NUP133, POM121C, NUP43, POLR2B, POLR2K, POLR2L, NUP155, NUP58, NUP160, POLR2I, POLR2D, RAE1, TPR, NUP153, NUP205, POLR2G, SEC13, NUP107, NUP98, IPO8, RANBP2, NUP37, NUP93, POLR2E, POLR2A, AAAS
REACTOME_SUMOYLATION_OF_RNA_BINDING_PROTEINS	0.00104712041884817	0.0162014264633546	0.496970655055241	2.51663071843936	0	41	SUMO2, SCMH1, HNRNPK, POM121, NUP54, NUP62, NUP133, POM121C, NUP43, SUMO1, RNF2, NUP155, UBE2I, PHC3, NUP58, NUP160, RAE1, TPR, NUP153, RING1, NUP205, HNRNPC, SEC13, NUP107, NUP98, RANBP2, NUP37, NUP93, PHC1, AAAS, PCGF2
REACTOME_FORMATION_OF_RNA_POL_II_ELONGATION_COMPLEX	0.00103199174406605	0.0162014264633546	0.473189686016843	2.49462384188011	0	48	SUPT4H1, POLR2C, PAF1, ERCC3, GTF2H3, MNAT1, POLR2B, POLR2K, TCEA1, CCNT2, POLR2L, GTF2H5, CDC73, ELOB, WDR61, POLR2I, POLR2D, NELFCD, NELFA, CCNT1, CCNK, POLR2G, GTF2H4, NCBP1, IWS1, SUPT16H, POLR2E, SUPT5H, POLR2A, GTF2F1, ERCC2, NELFB, NCBP2, GTF2H1, SUPT6H, CDK9, MLLT3, POLR2H
REACTOME_SUMOYLATION_OF_CHROMATIN_ORGANIZATION_PROTEINS	0.00102564102564103	0.0162014264633546	0.467845128582746	2.48127042755032	0	49	SUMO2, SCMH1, HDAC2, POM121, NUP54, NUP62, SUZ12, NUP133, POM121C, PIAS2, NUP43, SUMO1, RNF2, NUP155, UBE2I, PHC3, NUP58, NUP160, RAE1, CBX5, TPR, NUP153, RING1, NUP205, HDAC1, SEC13, L3MBTL2, NUP107, NUP98, RANBP2, NUP37, NUP93, PHC1, AAAS, PCGF2
REACTOME_INFLUENZA_INFECTION	0.001001001001001	0.0162014264633546	0.391754214281797	2.47520220020562	0	138	POLR2C, POM121, RPL22, NUP54, NUP62, NUP133, POM121C, NUP43, RPL30, POLR2B, POLR2K, GRSF1, POLR2L, NUP155, RPS25, RPS20, PABPN1, NUP58, RPL14, NUP160, POLR2I, POLR2D, RPL29, RPL37A, PARP1, UBA52, RPS11, RAE1, RPS15A, TPR, RPL35A, NUP153, FAU, RPLP1, RPL4, RPS14, RPL6, RPS23, RPL23A, NUP205, CPSF4, KPNA4, RPS4X, POLR2G, SEC13, RPL27, RPL19, RPL13A, RPS29, NUP107, NUP98, KPNA3, CLTC, RPL21, RPS15, RPS13, EIF2AK2, RPL7A, RPL18A, RANBP2, NUP37, RPS7, RPL39, RPS24, RPL24, NUP93, RPS9, RPL7, POLR2E, RPS3A, RPL10A, RPS3, POLR2A, GTF2F1, AAAS, RPL5, RPL32, RPL23, RPL28, RPS16, RAN, RPS5, DNAJC3, RPL37, RPS27A, POLR2H, RPL15, RPL13, RPL9, RPL34, RPL27A, RPL31, RPS6, KPNB1, RPL36AL, RPLP2, RPS12, RPS21, NUP35, RPL17, KPNA5, NUP214, RPS10, RPL11, KPNA1, RPL26, NUP188, RPSA, RPS18, NUP50, RPS19, RPL35, RPS2, RPS26, NUP85
REACTOME_HIV_TRANSCRIPTION_ELONGATION	0.00105485232067511	0.0162014264633546	0.496695841181539	2.45223894746331	0	37	SUPT4H1, POLR2C, ERCC3, GTF2H3, MNAT1, POLR2B, POLR2K, TCEA1, POLR2L, GTF2H5, ELOB, POLR2I, POLR2D, NELFCD, NELFA, CCNT1, POLR2G, GTF2H4, NCBP1, SUPT16H, POLR2E, SUPT5H, POLR2A, GTF2F1, ERCC2, NELFB, NCBP2, GTF2H1, CDK9, POLR2H
REACTOME_FORMATION_OF_THE_EARLY_ELONGATION_COMPLEX	0.00109409190371991	0.0162014264633546	0.532220048042787	2.44527113940746	0	29	SUPT4H1, POLR2C, ERCC3, GTF2H3, MNAT1, POLR2B, POLR2K, POLR2L, GTF2H5, POLR2I, POLR2D, NELFCD, NELFA, POLR2G, GTF2H4, NCBP1, POLR2E, SUPT5H, POLR2A, GTF2F1, ERCC2, NELFB, NCBP2, GTF2H1, POLR2H
REACTOME_MRNA_CAPPING	0.00110497237569061	0.0162014264633546	0.547202526817224	2.41410465646453	0	25	POLR2C, ERCC3, GTF2H3, MNAT1, POLR2B, POLR2K, POLR2L, GTF2H5, POLR2I, POLR2D, POLR2G, RNMT, GTF2H4, NCBP1, POLR2E, SUPT5H, POLR2A, GTF2F1, ERCC2, NCBP2, GTF2H1, POLR2H
REACTOME_METABOLISM_OF_RNA	0.000999000999000999	0.0162014264633546	0.330995558160482	2.40591847042548	0	568	PCBP2, HNRNPA0, SF3B1, HNRNPA2B1, MTERF4, GPKOW, SNRPD3, YBX1, MTO1, CDC5L, CNOT2, SNRNP27, WDR33, C2orf49, C1D, CNOT4, ELAC2, HBS1L, CNOT7, POLR2C, DDX1, CNOT9, PPP2CA, PRPF6, SNRNP35, TTC37, HNRNPK, U2SURP, RBM22, FUS, WBP11, SNRNP200, CWC15, AKT1, PLRG1, CDKAL1, ERCC3, GTF2H3, HNRNPD, HNRNPUL1, POM121, PSMF1, PPWD1, RPL22, FIP1L1, MRM2, RPP30, THUMPD1, MNAT1, PPIE, PELP1, NSUN2, NUP54, MAPK14, SARNP, CSTF1, NUP62, NUP133, UTP14C, POM121C, DCP1A, CHERP, NUP43, HNRNPM, SRRM2, PQBP1, CLNS1A, EXOSC10, THOC7, CASC3, RPL30, RTCB, KRR1, POLR2B, LSM8, SNUPN, THOC2, SNU13, POLR2K, TYW3, ELAVL1, SNRPC, UPF3A, PDCD7, TRMU, SF1, PRPF40A, LSM6, PCBP1, POLR2L, PRPF8, NUP155, SMG6, GTF2H5, PRPF38A, SLU7, CNOT11, PHAX, SF3B6, SRRM1, SUGP1, RPS25, RNPS1, EDC3, GEMIN5, DDX39B, HNRNPL, WBP4, RPS20, EXOSC8, PSMD10, PABPN1, PUF60, NUP58, EIF4E, WDR61, ZCRB1, SRSF2, LSM5, EIF4B, CCAR1, RBM17, RPL14, MRM3, NUP160, CPSF7, POLR2I, POLR2D, HNRNPH2, SNRNP40, SNW1, SRSF9, RPL29, RPL37A, PSMB1, MAGOH, SNRPB2, UBA52, RPS11, ISY1, URM1, RAE1, PPIL4, DNAJC8, POLDIP3, USP39, RPS15A, CNOT6L, PPP2R1A, DDX52, TPR, PAIP1, RPL35A, RBM28, NUP153, CNOT6, AQR, FAU, METTL14, SRSF5, RPLP1, XAB2, RPL4, YWHAB, GEMIN2, RRP36, UPF1, RPS14, KHSRP, DDX49, TSEN15, NOL11, NUDT21, HNRNPU, NT5C3B, RPL6, RPS23, RPL23A, NUP205, SYMPK, TYW5, RIOK2, CWC22, U2AF2, FAM98B, RBM5, CPSF1, PAN3, GTPBP3, YWHAZ, CPSF4, UPF2, SMNDC1, PSMC6, RPS4X, HNRNPC, POLR2G, TEX10, PSMC2, SEC13, RNMT, RPL27, FYTTD1, PSMB10, RPL19, TRMT44, RPL13A, GLE1, RPS29, PSMD9, NUP107, NUP98, PRPF4, SNRPF, SRSF11, ANP32A, SF3A2, WDR77, RPL21, PATL1, HNRNPA3, CHTOP, RPS15, PPIH, RPS13, U2AF1L4, SNRNP70, PARN, HNRNPR, GTF2H4, NCBP1, RPL7A, RPL18A, RANBP2, ZRSR2, NUP37, DDX42, FCF1, SEM1, RPS7, NOC4L, RPL39, ALYREF, RPS24, DHX38, SRSF4, RPP14, RPL24, SET, SRSF3, NUP93, RPS9, CSNK1E, GCFC2, TPRKB, RPL7, OSGEP, PPIL3, POLR2E, PPP2R2A, IMP3, RPS3A, ADAR, SUPT5H, THOC5, RPL10A, RPS3, CWC27, POLR2A, SART1, GTF2F1, AAAS, SLBP, PSMB7, DHX9, PRPF3, RPL5, ERCC2, GEMIN6, SYF2, RPL32, NOL9, SNRPD1, RPL23, SMG8, PSMD13, NCBP2, EXOSC9, CTNNBL1, CNOT10, SF3A1, RPL28, NSUN4, SF3B5, NOP10, BUD31, CRNKL1, RPS16, UBB, RAN, GTF2H1, PSMD1, SF3B4, SRSF10, DIS3, DDX46, PSMB4, TRMT112, RPS5, CPSF2, TRMT10C, WDR36, DDX5, FTSJ1, SNRPB, SKIV2L, SNRPD2, DDX23, RPL37, RPS27A, POLR2H, RPL15, ZBTB8OS, CNOT3, RPL13, LSM1, RPL9, XRN1, TBL3, TSR3, LSM11, RPL34, PAPOLA, RPL27A, RPL31, SF3B3, NOL6, SNRNP48, ALKBH8, RPS6, PSMC3, NSUN6, PSMB6, PSMB5, DUS2, EIF4A2, SRRT, QTRT1, PSMB3, CTU2, TRIT1, RPL36AL, RBMX, DCP1B, IMP4, NXF1, PTBP1, PHF5A, LSM2, EIF4A3, RPLP2, RPS12, UTP20, NHP2, PSMA1, SENP3, GSPT1, RPS21, SRSF6, SRSF1, ISG20L2, NUP35, RPL17, TSR1, PSMD4, NUP214, RPS10, TRMT61B, RPL11, CD2BP2, RPL26, GEMIN7, PSMA3, HSD17B10, RNPC3, PSME3, NUP188, LTV1, PCF11, NAT10, GSPT2, CSTF3, DDX20, EMG1, TYW1, RPSA, LSM10, PRPF19, RPS18, GEMIN8, NUP50, HNRNPA1, DIMT1, EXOSC1, THG1L, RPS19, SRSF7, NCL, WDR18, UTP15, RPL35, ADAT1, RPP21, RPS2, RPS26, NUP85, DKC1, NOP58, CPSF3, DHX16, PSMA6, PSMA2, SNRPG, TRMT12, EXOSC3, CSTF2T, RPP38, RIOK3, SNRPA, WDR75
REACTOME_TRANSCRIPTIONAL_REGULATION_BY_VENTX	0.00106837606837607	0.0162014264633546	0.504872298002236	2.40404633941526	0	33	AGO1, FZR1, TNRC6A, CDC27, ANAPC5, ANAPC16, CTNNB1, TNRC6B, ANAPC2, CDC23, ANAPC1, ANAPC11, TNRC6C, CDC16, ANAPC10, AGO3, ANAPC7, ANAPC15, UBE2E1, RELA, NFKB1, AGO4, TCF7L2, EHMT2
REACTOME_MITOTIC_PROPHASE	0.00101522842639594	0.0162014264633546	0.422433598993	2.39500208862409	0	69	CTDNEP1, PPP2CA, ENSA, POM121, NEK9, RAB1B, NUP54, NUP62, NUP133, POM121C, NUP43, CNEP1R1, ARPP19, MAPK1, GORASP2, NUP155, LEMD3, BANF1, NUP58, NUP160, KMT5A, RAE1, SMC4, MCPH1, PPP2R1A, GOLGA2, TPR, NUP153, RB1, EMD, NUP205, GORASP1, SEC13, RAB2A, NUP107, NUP98, NCAPG2, RANBP2, NUP37, SET, NUP93, AAAS, VRK2, PPP2R2D, NCAPD3, LEMD2, LMNA, BLZF1, SMC2, USO1, NEK7, PHF8, NUP35, NUMA1, NUP214, NUP188, TMPO, NUP50
REACTOME_NUCLEOTIDE_EXCISION_REPAIR	0.00100401606425703	0.0162014264633546	0.401484693973805	2.3913713142186	0	92	SUMO2, POLR2C, UBE2N, COPS7B, ERCC3, GTF2H3, RBX1, CUL4A, COPS6, MNAT1, PPIE, XPA, COPS4, SUMO1, NFRKB, POLR2B, XRCC1, CUL4B, UBE2V2, INO80D, POLR2K, COPS7A, TCEA1, RNF111, POLR2L, GTF2H5, PARP2, UBE2I, POLE3, RFC1, POLR2I, POLR2D, PARP1, UBA52, ISY1, INO80C, AQR, POLK, XAB2, USP7, ERCC6, RPA1, ACTR8, POLR2G, INO80E, RAD23A, COPS2, GTF2H4, GPS1, POLR2E, POLR2A, PCNA, ERCC2, POLD2, COPS3, RAD23B, CETN2, TFPT, ZNF830, UBB, GTF2H1, ACTL6A, ERCC4, RPS27A, POLR2H, ACTR5
REACTOME_INHIBITION_OF_THE_PROTEOLYTIC_ACTIVITY_OF_APC_C_REQUIRED_FOR_THE_ONSET_OF_ANAPHASE_BY_MITOTIC_SPINDLE_CHECKPOINT_COMPONENTS	0.00116279069767442	0.0162014264633546	0.60502760577493	2.38038003433901	0	17	CDC27, ANAPC5, ANAPC16, ANAPC2, CDC23, ANAPC1, ANAPC11, BUB3, CDC16, ANAPC10, ANAPC7, ANAPC15, UBE2E1
REACTOME_FORMATION_OF_INCISION_COMPLEX_IN_GG_NER	0.00106382978723404	0.0162014264633546	0.492114700769981	2.36912774567097	0	34	SUMO2, UBE2N, ERCC3, GTF2H3, RBX1, CUL4A, MNAT1, XPA, SUMO1, CUL4B, UBE2V2, RNF111, GTF2H5, PARP2, UBE2I, PARP1, UBA52, RPA1, RAD23A, GTF2H4, ERCC2, RAD23B, CETN2, UBB, GTF2H1, ERCC4, RPS27A
REACTOME_TRANSPORT_OF_MATURE_MRNAS_DERIVED_FROM_INTRONLESS_TRANSCRIPTS	0.0010482180293501	0.0162014264633546	0.470995557738588	2.3687082055115	0	40	WDR33, POM121, FIP1L1, NUP54, NUP62, NUP133, POM121C, NUP43, NUP155, NUP58, EIF4E, NUP160, RAE1, TPR, NUP153, NUP205, SYMPK, CPSF1, CPSF4, SEC13, NUP107, NUP98, NCBP1, RANBP2, NUP37, ALYREF, NUP93, AAAS, SLBP, NCBP2, CPSF2, NXF1, NUP35, NUP214, NUP188, NUP50, NUP85, CPSF3
REACTOME_RNA_POLYMERASE_II_TRANSCRIPTION_TERMINATION	0.00102145045965271	0.0162014264633546	0.431462966032609	2.35905242579253	0	57	SNRPD3, WDR33, FIP1L1, SARNP, CSTF1, THOC7, CASC3, THOC2, SLU7, SRRM1, RNPS1, DDX39B, PABPN1, SRSF2, CPSF7, SRSF9, MAGOH, POLDIP3, SRSF5, NUDT21, SYMPK, U2AF2, CPSF1, CPSF4, FYTTD1, SNRPF, SRSF11, CHTOP, U2AF1L4, NCBP1, ALYREF, DHX38, SRSF4, SRSF3, THOC5, SLBP, NCBP2, CPSF2, SNRPB, LSM11, PAPOLA, EIF4A3, SRSF6, SRSF1, PCF11, CSTF3, LSM10, SRSF7, CPSF3, SNRPG, CSTF2T, UPF3B
REACTOME_ABERRANT_REGULATION_OF_MITOTIC_EXIT_IN_CANCER_DUE_TO_RB1_DEFECTS	0.00115340253748558	0.0162014264633546	0.577465829690286	2.35354344362797	0	19	FZR1, CDC27, ANAPC5, ANAPC16, ANAPC2, CDC23, ANAPC1, ANAPC11, CDC16, ANAPC10, RB1, ANAPC7, ANAPC15, UBE2E1
REACTOME_EUKARYOTIC_TRANSLATION_INITIATION	0.00100300902708124	0.0162014264633546	0.383257322054213	2.33982234761023	0	109	EIF3F, RPL22, EIF3K, RPL30, EIF2B3, EIF2B1, EIF3I, EIF2B5, RPS25, RPS20, EIF4E, EIF4B, EIF3L, RPL14, RPL29, EIF2B2, RPL37A, UBA52, RPS11, RPS15A, RPL35A, FAU, RPLP1, RPL4, RPS14, EIF3E, RPL6, EIF3H, RPS23, RPL23A, EIF3G, RPS4X, RPL27, RPL19, RPL13A, RPS29, RPL21, RPS15, RPS13, RPL7A, RPL18A, RPS7, RPL39, RPS24, RPL24, EIF3M, RPS9, RPL7, RPS3A, RPL10A, RPS3, EIF3J, RPL5, RPL32, RPL23, RPL28, EIF4H, RPS16, RPS5, RPL37, RPS27A, RPL15, RPL13, RPL9, RPL34, RPL27A, RPL31, RPS6, EIF4A2, RPL36AL, EIF2S3, RPLP2, RPS12, EIF2S2, RPS21, RPL17, EIF5B, RPS10, RPL11, RPL26, EIF3C, EIF2S1, RPSA, EIF5, RPS18, EIF3D, RPS19, RPL35, RPS2, RPS26, EIF1AX, EIF4G1, RPL36, RPL41, RPS27, RPS8, EIF3B, RPS17, EIF3A
REACTOME_DNA_REPAIR	0.000999000999000999	0.0162014264633546	0.345806733263861	2.31677580551142	0	214	SUMO2, MBD4, ALKBH5, FTO, POLR2C, MAPK8, UBE2N, MLH1, NEIL2, TERF2, REV1, COPS7B, ERCC3, GTF2H3, RBX1, TERF1, PARG, CUL4A, COPS6, FAAP100, MNAT1, PPIE, XPA, NSD2, RAD17, APBB1, XRCC6, COPS4, RCHY1, ABL1, NBN, SUMO1, NFRKB, HUS1, POLR2B, XRCC1, CUL4B, UBE2V2, INO80D, POLR2K, COPS7A, TCEA1, PPP5C, RNF111, BRCC3, POLM, POLR2L, GTF2H5, UBE2B, PARP2, UBE2I, TERF2IP, TOP3A, BAP1, APEX1, WDR48, POLE3, TOPBP1, RNF168, SMARCA5, RNF8, RFC1, POLR2I, POLR2D, PAXIP1, EYA3, MPG, PARP1, UBA52, KDM4A, ISY1, RAD1, KAT5, VCP, INO80C, HERC2, AQR, POLK, XAB2, USP7, USP1, ERCC6, POLH, RAD51C, RPA1, SLX4, MRE11, MSH3, POLL, ACTR8, SMUG1, ATM, POLR2G, INO80E, PIAS4, RIF1, LIG4, TDG, RAD23A, BAZ1B, COPS2, GTF2H4, GPS1, MSH6, NEIL1, ACD, FAN1, POLR2E, UIMC1, POLR2A, PRKDC, PCNA, ERCC2, FAAP20, XRCC5, PNKP, POLD2, COPS3, RAD23B, CETN2, TFPT, ZNF830, ASCC2, UBB, GTF2H1, MGMT, RTEL1, ALKBH3, RAD9A, ACTL6A, PPP4C, ERCC4, FANCM, RPS27A, POLR2H, ACTR5, RAD50
REACTOME_TRANSCRIPTION_COUPLED_NUCLEOTIDE_EXCISION_REPAIR_TC_NER	0.00101419878296146	0.0162014264633546	0.412445236265038	2.31669259947476	0	65	POLR2C, COPS7B, ERCC3, GTF2H3, RBX1, CUL4A, COPS6, MNAT1, PPIE, XPA, COPS4, POLR2B, XRCC1, CUL4B, POLR2K, COPS7A, TCEA1, POLR2L, GTF2H5, POLE3, RFC1, POLR2I, POLR2D, UBA52, ISY1, AQR, POLK, XAB2, USP7, ERCC6, RPA1, POLR2G, COPS2, GTF2H4, GPS1, POLR2E, POLR2A, PCNA, ERCC2, POLD2, COPS3, ZNF830, UBB, GTF2H1, ERCC4, RPS27A, POLR2H
REACTOME_CONVERSION_FROM_APC_C_CDC20_TO_APC_C_CDH1_IN_LATE_ANAPHASE	0.00116822429906542	0.0162014264633546	0.578332199019427	2.30920228198681	0	18	FZR1, CDC27, ANAPC5, ANAPC16, ANAPC2, CDC23, ANAPC1, ANAPC11, CDC16, ANAPC10, ANAPC7, ANAPC15, UBE2E1
REACTOME_EUKARYOTIC_TRANSLATION_ELONGATION	0.00100502512562814	0.0162014264633546	0.39346035321127	2.308704932647	0	83	RPL22, RPL30, EEF1A2, EEF1G, EEF2, RPS25, EEF1B2, RPS20, RPL14, RPL29, RPL37A, UBA52, RPS11, RPS15A, RPL35A, FAU, RPLP1, RPL4, RPS14, RPL6, RPS23, RPL23A, RPS4X, RPL27, RPL19, RPL13A, RPS29, RPL21, RPS15, RPS13, RPL7A, RPL18A, RPS7, RPL39, RPS24, RPL24, RPS9, RPL7, RPS3A, RPL10A, RPS3, RPL5, RPL32, RPL23, RPL28, RPS16, RPS5, RPL37, RPS27A, RPL15, RPL13, RPL9, RPL34, RPL27A, RPL31, RPS6, RPL36AL, RPLP2, RPS12, RPS21, RPL17, RPS10, RPL11, RPL26, RPSA, RPS18, RPS19, RPL35, RPS2, RPS26
REACTOME_HIV_LIFE_CYCLE	0.001001001001001	0.0162014264633546	0.367236759147142	2.29710276246458	0	129	SUPT4H1, POLR2C, ERCC3, GTF2H3, POM121, MNAT1, TAF7, NUP54, XRCC6, NUP62, NUP133, POM121C, NUP43, POLR2B, POLR2K, TCEA1, VPS4A, CCNT2, TAF15, POLR2L, TSG101, NUP155, NMT2, GTF2H5, BANF1, TAF4, TBP, NUP58, ELOB, PSIP1, CHMP4B, TAF6, VPS28, VPS37B, NUP160, POLR2I, POLR2D, NELFCD, UBA52, RAE1, GTF2A2, NELFA, TAF11, CHMP5, TPR, NUP153, VTA1, GTF2B, NUP205, CCNT1, CCNK, POLR2G, SEC13, RNMT, CHMP3, LIG4, NUP107, CHMP7, NUP98, RANBP1, GTF2H4, NCBP1, CHMP6, RANBP2, NUP37, NUP93, SUPT16H, POLR2E, SUPT5H, POLR2A, GTF2F1, AAAS, CHMP2A, TAF1, ERCC2, NELFB, XRCC5, NCBP2, UBB, RAN, GTF2H1, TAF13, CDK9, RPS27A, POLR2H, PDCD6IP, VPS37C, TAF9B, GTF2A1, TAF12, VPS4B, NUP35, VPS37A, NUP214, KPNA1, NUP188, NUP50, TAF10, NMT1, TAF9, NUP85, CHMP4A, LIG1, CTDP1, TAF3
REACTOME_PHOSPHORYLATION_OF_THE_APC_C	0.00116822429906542	0.0162014264633546	0.593433148469683	2.29607252587962	0	16	CDC27, ANAPC5, ANAPC16, ANAPC2, CDC23, ANAPC1, ANAPC11, CDC16, ANAPC10, ANAPC7, ANAPC15, UBE2E1
REACTOME_SUMOYLATION_OF_DNA_REPLICATION_PROTEINS	0.00105485232067511	0.0162014264633546	0.464845226926341	2.29498915734743	0	37	SUMO2, TOP2B, POM121, NUP54, NUP62, NUP133, POM121C, NUP43, SUMO1, NUP155, UBE2I, NUP58, NUP160, RAE1, TPR, NUP153, NUP205, SEC13, PIAS4, NUP107, NUP98, RANBP2, NUP37, NUP93, AAAS, PCNA
REACTOME_SUMOYLATION_OF_SUMOYLATION_PROTEINS	0.00107642626480086	0.0162014264633546	0.484848242268038	2.29182556413689	0	32	SUMO2, POM121, NUP54, NUP62, NUP133, POM121C, NUP43, SUMO1, NUP155, UBE2I, NUP58, NUP160, RAE1, TPR, NUP153, NUP205, SEC13, PIAS4, NUP107, NUP98, RANBP2, NUP37, NUP93, AAAS
REACTOME_TRANSCRIPTION_OF_THE_HIV_GENOME	0.00101317122593718	0.0162014264633546	0.412458511445434	2.28678702579141	0	60	SUPT4H1, POLR2C, ERCC3, GTF2H3, MNAT1, TAF7, POLR2B, POLR2K, TCEA1, CCNT2, TAF15, POLR2L, GTF2H5, TAF4, TBP, ELOB, TAF6, POLR2I, POLR2D, NELFCD, GTF2A2, NELFA, TAF11, GTF2B, CCNT1, CCNK, POLR2G, RNMT, GTF2H4, NCBP1, SUPT16H, POLR2E, SUPT5H, POLR2A, GTF2F1, TAF1, ERCC2, NELFB, NCBP2, GTF2H1, TAF13, CDK9, POLR2H, TAF9B, GTF2A1
REACTOME_ABORTIVE_ELONGATION_OF_HIV_1_TRANSCRIPT_IN_THE_ABSENCE_OF_TAT	0.00114810562571757	0.0162014264633546	0.552929692063347	2.28653150387318	0	20	SUPT4H1, POLR2C, POLR2B, POLR2K, POLR2L, POLR2I, POLR2D, NELFCD, NELFA, POLR2G, NCBP1, POLR2E, SUPT5H, POLR2A, GTF2F1, NELFB, NCBP2, POLR2H
REACTOME_HIV_ELONGATION_ARREST_AND_RECOVERY	0.00108932461873638	0.0162014264633546	0.501047868346888	2.28428917507797	0	28	SUPT4H1, POLR2C, POLR2B, POLR2K, TCEA1, CCNT2, POLR2L, ELOB, POLR2I, POLR2D, NELFCD, NELFA, CCNT1, CCNK, POLR2G, SUPT16H, POLR2E, SUPT5H, POLR2A, GTF2F1, NELFB, CDK9, POLR2H
REACTOME_DUAL_INCISION_IN_TC_NER	0.00102669404517454	0.0162014264633546	0.423131398653334	2.27810617829578	0	53	POLR2C, ERCC3, GTF2H3, RBX1, CUL4A, MNAT1, PPIE, XPA, POLR2B, CUL4B, POLR2K, TCEA1, POLR2L, GTF2H5, POLE3, RFC1, POLR2I, POLR2D, UBA52, ISY1, AQR, POLK, XAB2, USP7, ERCC6, RPA1, POLR2G, GTF2H4, POLR2E, POLR2A, PCNA, ERCC2, POLD2, ZNF830, UBB, GTF2H1, ERCC4, RPS27A, POLR2H
REACTOME_NONHOMOLOGOUS_END_JOINING_NHEJ	0.00109409190371991	0.0162014264633546	0.495573727841366	2.27690057636016	0	29	UBE2N, NSD2, XRCC6, NBN, SUMO1, UBE2V2, BRCC3, POLM, RNF168, RNF8, PAXIP1, KAT5, HERC2, MRE11, POLL, ATM, PIAS4, RIF1, LIG4, UIMC1, PRKDC, XRCC5
