pathway	pval	padj	ES	NES	nMoreExtreme	size	leadingEdge
REACTOME_DOWNREGULATION_OF_TGF_BETA_RECEPTOR_SIGNALING	0.858490566037736	1	-0.250820720552361	-0.702588736535263	727	21	PPP1R15A, TGFB1, TGFBR2, SMAD3, RPS27A, SMAD7, USP15
REACTOME_SUMOYLATION_OF_DNA_DAMAGE_RESPONSE_AND_REPAIR_PROTEINS	0.922199170124481	1	-0.211607764405944	-0.70277947902755	888	65	PML, NSMCE1, AAAS, MDC1, RAD52, PCGF2, HDAC7, NUP155, CBX4, NUP85, NUP35, SMC6, SP100, CETN2, WRN, NUP107
REACTOME_INTERLEUKIN_10_SIGNALING	0.856410256410256	1	-0.291181209578492	-0.703415338543489	667	11	CSF1, CXCL2, IL1R1, ICAM1, CCL2
REACTOME_GP1B_IX_V_ACTIVATION_SIGNALLING	0.847708894878706	1	-0.31760746001948	-0.703477080078082	628	8	COL1A2, SRC, COL1A1, VWF, YWHAZ, FLNA
REACTOME_DEFECTIVE_C1GALT1C1_CAUSES_TNPS	0.880916030534351	1	-0.389117734515439	-0.703940175932134	576	4	MUC3A, MUC20
REACTOME_DSCAM_INTERACTIONS	0.852413793103448	1	-0.330456404264803	-0.705404178166271	617	7	MAPK11, PAK1
REACTOME_RAF_INDEPENDENT_MAPK1_3_ACTIVATION	0.863131935881628	1	-0.270841290902961	-0.706536986767133	699	16	DUSP5, PEA15, DUSP8, DUSP16
REACTOME_COOPERATION_OF_PREFOLDIN_AND_TRIC_CCT_IN_ACTIN_AND_TUBULIN_FOLDING	0.879041916167665	1	-0.256588376564564	-0.706719890852373	733	20	ACTB, TUBA1A, PFDN5, CCT6B, PFDN1, CCT3, CCT8, TUBB2A
REACTOME_BASIGIN_INTERACTIONS	0.865689865689866	1	-0.274146756940018	-0.710264001696644	708	15	ATP1B2, CAV1, ITGA6, PPIA, ITGA3, BSG, SLC7A8, SLC16A1
REACTOME_MAP2K_AND_MAPK_ACTIVATION	0.860202931228861	1	-0.239313900991619	-0.710766457860019	762	28	ACTG1, ACTB, SRC, NRAS, FN1, RAP1B, KSR1, ARRB1, VWF, PEBP1, LAMTOR2
REACTOME_TRANSCRIPTIONAL_REGULATION_OF_TESTIS_DIFFERENTIATION	0.85924713584288	1	-0.427899167082951	-0.711764042211201	524	3	PTGDS, SOX9
REACTOME_SERINE_BIOSYNTHESIS	0.848703170028818	1	-0.366635685757221	-0.712693950435264	588	5	PSPH, SERINC5
REACTOME_DEACTIVATION_OF_THE_BETA_CATENIN_TRANSACTIVATING_COMPLEX	0.881564245810056	1	-0.23478018477848	-0.713030928466287	788	34	SOX7, TLE3, SOX4, TCF7L2, SOX17, SOX9, TLE1, SOX6, RPS27A, HDAC1, CBY1, TLE4, YWHAZ
REACTOME_SIGNALING_BY_EGFR	0.877682403433476	1	-0.227078802834267	-0.713279183970525	817	40	SPRY1, SPRY2, PAG1, SH3KBP1, SRC, CBL, NRAS, PTPN12, SH3GL1, EGFR, CDC42, AREG, RPS27A
REACTOME_THE_RETINOID_CYCLE_IN_CONES_DAYLIGHT_VISION	0.930555555555556	1	-0.542517999610819	-0.713991543789237	468	1	DHRS3
REACTOME_RECOGNITION_OF_DNA_DAMAGE_BY_PCNA_CONTAINING_REPLICATION_COMPLEX	0.857642940490082	1	-0.250371377881837	-0.714739925237172	734	23	POLE, UBE2B, RFC2, RPA3, RPS27A, RBX1, POLD1, POLD4, WDR48, CUL4B, RFC4, POLD2, PCNA
REACTOME_GAP_JUNCTION_ASSEMBLY	0.849655172413793	1	-0.334879454497615	-0.714845780974381	615	7	GJA1, TUBA1A, GJA4
REACTOME_SIGNALING_BY_NUCLEAR_RECEPTORS	0.958917835671343	1	-0.198819655654164	-0.715847117061019	956	168	MOV10, JUND, JUN, NR1H3, CAV2, CXCL12, MMP2, TLE3, APOD, GNAI2, SPHK1, GNB4, POU2F1, CYP26B1, ZNF217, KCTD6, ALDH1A2, PLTP, TNRC6C, GREB1, MYC, CAV1, SRC, ABCA1, ESR1, HSPB1, RARB, NRAS, ABCG1, GNB1, ALDH1A1, AKT3, CCND1, EGFR, ZDHHC21, IGF1R, FASN, AREG, POLR2I, POLR2G, SREBF1, RXRG, RDH11, PLIN1, RARG, HDAC1, PDHA1
REACTOME_BBSOME_MEDIATED_CARGO_TARGETING_TO_CILIUM	0.84688995215311	1	-0.263971038438847	-0.715933104621974	707	18	SMO, BBS9, BBS7, BBIP1, BBS1, CCT3, CCT8
REACTOME_BETA_OXIDATION_OF_HEXANOYL_COA_TO_BUTANOYL_COA	0.847262247838617	1	-0.368493753479313	-0.716305801862925	587	5	ECHS1
REACTOME_TELOMERE_C_STRAND_SYNTHESIS_INITIATION	0.817941952506596	1	-0.313808241623835	-0.719771130301521	619	9	ACD, STN1, TERF2IP, TERF1
REACTOME_INTERLEUKIN_23_SIGNALING	0.846153846153846	1	-0.436453873102374	-0.725993871583906	516	3	JAK2, STAT3, P4HB
REACTOME_SYNTHESIS_SECRETION_AND_INACTIVATION_OF_GLUCOSE_DEPENDENT_INSULINOTROPIC_POLYPEPTIDE_GIP	0.846153846153846	1	-0.436479669364752	-0.726036780879825	516	3	SEC11C
REACTOME_PEROXISOMAL_PROTEIN_IMPORT	0.87592788971368	1	-0.226698976394681	-0.726991528408623	825	48	MPV17, DECR2, PEX7, GSTK1, DDO, EPHX2, ACAA1, ECI2, PEX6, ACOT8, ECH1, RPS27A, PEX10, PEX12
REACTOME_ACTIVATION_OF_PUMA_AND_TRANSLOCATION_TO_MITOCHONDRIA	0.835734870317003	1	-0.374224962751262	-0.727446556392481	579	5	TP63, BBC3
REACTOME_DUAL_INCISION_IN_GG_NER	0.853006681514477	1	-0.240194114501587	-0.72758242873373	765	32	DDB2, POLE, RFC2, PARP2, XPA, RPA3, RPS27A, RBX1, POLD1, POLD4, ERCC2, CUL4B, RFC4
REACTOME_KSRP_KHSRP_BINDS_AND_DESTABILIZES_MRNA	0.842490842490842	1	-0.280957661120291	-0.727909806127269	689	15	MAPK11, EXOSC9, EXOSC5, YWHAZ, EXOSC1, MAPK14, EXOSC8, EXOSC3, DIS3
REACTOME_SIGNALING_BY_ROBO_RECEPTORS	0.958958958958959	1	-0.202234275764872	-0.729188788132411	957	182	SRGAP2, CXCL12, ROBO3, SRGAP3, NRP1, UPF3A, RPS6, RPL35A, RPL3, RPS4Y1, RPL11, SRC, RPS8, RPL31, PSMB9, RPL24, PSMB8, RPL13, RPL36A, RPL34, EIF4A3, PSMB10, RPL10A, RPL28, RPL36, RPS18, RPS20, ROBO1, RPL35, RPS19, RPS9, PSME2, PSME1, CAP1, PAK1, RPS26, RPL12, CDC42, RPS27, RPL23, PSMD10, RPL9, RPS15A, EVL, RPS17, RPS12, RPS27A, PABPC1, RPS16, RPL37, RBX1, RPL15, RPS3A, COL4A5, RPS11, ABL1, RPS2, RPL27A, RPL7, RPL26, RPL22, CXCR4, RPL17, RPS24, CLASP2, LDB1, SLIT3, RPL6, RHOA, RPL32, RPL4, RPL7A, RPL13A, RPL29
REACTOME_PTK6_REGULATES_RTKS_AND_THEIR_EFFECTORS_AKT1_AND_DOK1	0.833103448275862	1	-0.342783514382965	-0.731718072737062	603	7	ARAP1, CBL, RPS27A
REACTOME_TRANSLOCATION_OF_SLC2A4_GLUT4_TO_THE_PLASMA_MEMBRANE	0.869198312236287	1	-0.227178500441494	-0.732207239539983	823	50	ACTG1, C2CD5, ACTB, MYH9
REACTOME_ACTIVATION_OF_PPARGC1A_PGC_1ALPHA_BY_PHOSPHORYLATION	0.807387862796834	1	-0.319424819487925	-0.732653681048891	611	9	MAPK11, PPARGC1A
REACTOME_ACETYLCHOLINE_INHIBITS_CONTRACTION_OF_OUTER_HAIR_CELLS	0.85472972972973	1	-0.487651598325607	-0.734276806637593	505	2	CHRNA10
REACTOME_CD209_DC_SIGN_SIGNALING	0.827020202020202	1	-0.293712957178549	-0.734369404808804	654	13	FYN, ICAM2, NRAS, PAK1
REACTOME_REGULATION_OF_EXPRESSION_OF_SLITS_AND_ROBOS	0.937625754527163	1	-0.205965172176628	-0.735227597819715	931	145	ROBO3, UPF3A, RPS6, RPL35A, RPL3, RPS4Y1, RPL11, RPS8, RPL31, PSMB9, RPL24, PSMB8, RPL13, RPL36A, RPL34, EIF4A3, PSMB10, RPL10A, RPL28, RPL36, RPS18, RPS20, ROBO1, RPL35, RPS19, RPS9, PSME2, PSME1, RPS26, RPL12, RPS27, RPL23, PSMD10, RPL9, RPS15A, RPS17, RPS12, RPS27A, PABPC1, RPS16, RPL37, RBX1, RPL15, RPS3A, COL4A5, RPS11, RPS2, RPL27A, RPL7, RPL26, RPL22, RPL17, RPS24, LDB1, RPL6, RPL32, RPL4, RPL7A, RPL13A, RPL29, RPS5
REACTOME_NR1H2_NR1H3_REGULATE_GENE_EXPRESSION_LINKED_TO_TRIGLYCERIDE_LIPOLYSIS_IN_ADIPOSE	0.832853025936599	1	-0.378379188784757	-0.735521852600208	577	5	NR1H3
REACTOME_REGULATION_OF_PLK1_ACTIVITY_AT_G2_M_TRANSITION	0.884536082474227	1	-0.221106825868626	-0.737629242307051	857	66	DYNLL1, HAUS5, NINL, SFI1, OFD1, CSNK1E, CNTRL, HAUS4
REACTOME_KETONE_BODY_METABOLISM	0.811797752808989	1	-0.358873500913437	-0.737651220699391	577	6	BDH2, ACAT1, BDH1
REACTOME_ACTIVATED_NOTCH1_TRANSMITS_SIGNAL_TO_THE_NUCLEUS	0.829099307159353	1	-0.252530034482241	-0.737748912620437	717	26	DLL1, DTX4, JAG1, NOTCH1, DLL4, RPS27A, ARRB1, DLK1, DTX2, JAG2, NUMB
REACTOME_TICAM1_DEPENDENT_ACTIVATION_OF_IRF3_IRF7	0.807277628032345	1	-0.333112265199243	-0.737819079080152	598	8	IRF3
REACTOME_ERKS_ARE_INACTIVATED	0.824358974358974	1	-0.30556725707739	-0.738168152732251	642	11	PPP2R1B
REACTOME_SEMA4D_INDUCED_CELL_MIGRATION_AND_GROWTH_CONE_COLLAPSE	0.825358851674641	1	-0.272558598792012	-0.739223988277738	689	18	MYH9, MYL6, LIMK2, ERBB2, MYH10, MYL12B, SEMA4D, RHOA, PLXNB1, ROCK1, MYL9
REACTOME_TRANSCRIPTIONAL_REGULATION_BY_MECP2	0.853004291845494	1	-0.235420896177413	-0.739482605241635	794	40	MOV10, DLL1, GAMT, SLC2A3, PPARG, TNRC6C
REACTOME_NR1H2_AND_NR1H3_MEDIATED_SIGNALING	0.837988826815642	1	-0.24411075247879	-0.741368001958016	749	34	MOV10, NR1H3, APOD, PLTP, TNRC6C, ABCA1, ABCG1, FASN, SREBF1, PLIN1
REACTOME_THE_CANONICAL_RETINOID_CYCLE_IN_RODS_TWILIGHT_VISION	0.803370786516854	1	-0.360766366417591	-0.741541935801524	571	6	CYP4V2, RDH11, RDH5
REACTOME_METABOLISM_OF_PORPHYRINS	0.828606658446362	1	-0.284456027679539	-0.742053414360877	671	16	PPOX, COX15, UROS, UROD, HMOX2
REACTOME_GAP_FILLING_DNA_REPAIR_SYNTHESIS_AND_LIGATION_IN_GG_NER	0.822754491017964	1	-0.269552974597834	-0.742428208702506	686	20	POLE, LIG1, RFC2, RPA3, RPS27A, POLD1, POLD4
REACTOME_NUCLEAR_EVENTS_STIMULATED_BY_ALK_SIGNALING_IN_CANCER	0.827373612823674	1	-0.285012149277239	-0.743504155038581	670	16	EML4, RPS6, JUNB, CEBPB, FN1, RBX1, NPM1
REACTOME_MRNA_SPLICING_MINOR_PATHWAY	0.862808145766345	1	-0.23493546634205	-0.745105681352745	804	44	SRSF1, SRSF7, SRSF2, SRSF6, RNPC3
REACTOME_INLA_MEDIATED_ENTRY_OF_LISTERIA_MONOCYTOGENES_INTO_HOST_CELLS	0.797843665768194	1	-0.336889502117519	-0.74618538004131	591	8	CTNND1, SRC, RPS27A
REACTOME_PHASE_4_RESTING_MEMBRANE_POTENTIAL	0.847972972972973	1	-0.49596185657293	-0.746789899815448	501	2	KCNJ2, KCNJ12
REACTOME_TRANSCRIPTIONAL_REGULATION_BY_TP53	0.979020979020979	1	-0.203211693420669	-0.747372124627665	979	283	MOV10, FAS, DDB2, CNOT9, TNFRSF10B, JUN, PLAGL1, NDRG1, CASP2, PPP2R1B, FANCC, COX6A1, PML, ATM, GLS, CDK2, CCNT2, CDKN1A, MDC1, MDM2, MAPK11, L3MBTL1, DNA2, CASP10, PIDD1, RRAGB, GPI, G6PD, PLK2, YWHAH, TNRC6C, CHD3, YWHAQ, PERP, BTG2, RFC2, PIN1, TTC5, COX7B, TP63, MDM4, BBC3, BANP, RAD51D, SESN2, AKT3, COX5B, COX4I1, PRDX2, SESN3, RPA3, NELFE, USP2, TP53I3, MSH2, TMEM219, CNOT3, POLR2I, POLR2G, LAMTOR4, MRE11, COX7A2L, RPS27A, TP53INP1, PRDX5, HDAC1, COX6B1
REACTOME_RHO_GTPASE_EFFECTORS	0.93687374749499	1	-0.207888430800577	-0.748499102713416	934	168	ACTG1, DYNLL1, NOXA1, SRGAP2, PPP2R1B, ACTB, FMNL3, MYH9, SCAI, CENPC, FMNL2, KNTC1, DAAM1, MYL6, MAPK11, ARPC5, YWHAH, ARPC1B, PKN3, SRC, YWHAQ, ITGB3BP, PIN1, TAX1BP3, CYBA, RTKN, KLC4, WIPF1, LIMK2, SKA2, PAK1, NDEL1, NUP85, CDC42, RPS27, MYH10, TUBA1A, EVL, RCC2, MYL12B, FMNL1, CFL1, PMF1, S100A8, ABL1, KDM4C, NUP107, NSL1, NCKIPSD, CLASP2, PPP1R14A, ARPC1A, YWHAZ, CTNNA1, RHOA, FLNA
REACTOME_SYNTHESIS_OF_LIPOXINS_LX	0.824877250409165	1	-0.450059163500304	-0.748624802499483	503	3	PTGR1
REACTOME_INTERLEUKIN_15_SIGNALING	0.814102564102564	1	-0.310253462784312	-0.749488762941234	634	11	IL15
REACTOME_DISPLACEMENT_OF_DNA_GLYCOSYLASE_BY_APEX1	0.792452830188679	1	-0.338434898731837	-0.749608319470177	587	8	NTHL1, OGG1
REACTOME_ORGANELLE_BIOGENESIS_AND_MAINTENANCE	0.954954954954955	1	-0.20794913045667	-0.750036436062138	953	191	DYNLL1, HAUS5, IFT172, IFT27, NINL, SFI1, OFD1, CSNK1E, IFT88, CNTRL, SMO, MAPK11, IFT80, HAUS4, CC2D2A, SMARCD3, ASAP1, TTBK2, POLG2, ACSS2, INPP5E, SIRT5, IFT122, SIRT3, CEP290, PKD2, IFT140, ATAT1, IFT81, BBS9, CEP131, BBS7, TCTN3, PPARGC1A, APOO, NPHP3, ARF4, DYNC2H1, HELZ2, CEP78, CEP83, CEP57
REACTOME_ACETYLCHOLINE_REGULATES_INSULIN_SECRETION	0.808275862068966	1	-0.352606664901517	-0.752686924691859	585	7	MARCKS
REACTOME_SYNTHESIS_OF_DOLICHYL_PHOSPHATE	0.794943820224719	1	-0.366515468878338	-0.753359003479414	565	6	MVD
REACTOME_COOPERATION_OF_PDCL_PHLP1_AND_TRIC_CCT_IN_G_PROTEIN_BETA_FOLDING	0.811320754716981	1	-0.269296478880506	-0.754342274567191	687	21	GNB4, GNB1, RGS11, GNG10, CCT6B, GNG12, CCT3, CCT8, CCT4, GNB2, GNG7, PDCL
REACTOME_RELEASE_OF_HH_NP_FROM_THE_SECRETING_CELL	0.818330605564648	1	-0.453969474788663	-0.755129182930696	499	3	NOTUM
REACTOME_SIGNALING_BY_NOTCH1_HD_DOMAIN_MUTANTS_IN_CANCER	0.814814814814815	1	-0.295381046282986	-0.756419203340493	659	14	DLL1, JAG1, NOTCH1, DLL4, RPS27A
REACTOME_SIGNALLING_TO_P38_VIA_RIT_AND_RIN	0.83277027027027	1	-0.503357010800817	-0.757925083724801	492	2	RIT1, BRAF
REACTOME_MATURATION_OF_SARS_COV_1_NUCLEOPROTEIN	0.778364116094987	1	-0.330813985727121	-0.758776618466847	589	9	PARP10, PARP16
REACTOME_RHO_GTPASES_ACTIVATE_WASPS_AND_WAVES	0.808437856328392	1	-0.255227961518836	-0.759435248885388	708	29	ACTG1, ACTB, ARPC5, ARPC1B, WIPF1, CDC42, ABL1, NCKIPSD, ARPC1A
REACTOME_TNFR1_MEDIATED_CERAMIDE_PRODUCTION	0.802593659942363	1	-0.391061145326252	-0.760173991106963	556	5	SMPD3
REACTOME_REGULATION_OF_CYTOSKELETAL_REMODELING_AND_CELL_SPREADING_BY_IPP_COMPLEX_COMPONENTS	0.783018867924528	1	-0.343229966254823	-0.76022904009066	580	8	PARVA, ACTN1, RSU1, ARHGEF6, PXN, PARVB
REACTOME_PROCESSIVE_SYNTHESIS_ON_THE_LAGGING_STRAND	0.79539641943734	1	-0.310208529865603	-0.760442455958151	621	12	DNA2, LIG1, RPA3, POLD1, POLD4
REACTOME_FORMATION_OF_THE_BETA_CATENIN_TCF_TRANSACTIVATING_COMPLEX	0.802585193889542	1	-0.269665599332154	-0.76129739903341	682	22	TCF4, TLE3, TCF7L2, MYC, TLE1, HDAC1, TLE4, RUVBL1
REACTOME_DISEASES_OF_CARBOHYDRATE_METABOLISM	0.791146424517594	1	-0.257230779407787	-0.761695954429207	696	27	IDUA, HGSNAT, HYAL1, GUSB
REACTOME_RHOG_GTPASE_CYCLE	0.843096234309623	1	-0.234455488056483	-0.762145192214731	805	52	PLD1, MCF2L, VAV2, OPHN1, DOCK1, CDC42EP1, ARHGDIB, CAV1, HSPE1, MAP3K11, NDUFS3, MCAM, CDC42, TMPO, ARHGDIA, EMD, PLEKHG3
REACTOME_SENSING_OF_DNA_DOUBLE_STRAND_BREAKS	0.786516853932584	1	-0.370884839344208	-0.762340083023135	559	6	ATM
REACTOME_PHASE_2_PLATEAU_PHASE	0.785112359550562	1	-0.37166502290576	-0.763943721506009	558	6	KCNE4, CACNG6, CACNA1C, AKAP9, CACNB1
REACTOME_PROTEIN_FOLDING	0.868475991649269	1	-0.232680413386025	-0.765881749868527	831	60	ACTB, KIFC3, USP11, SPHK1, GNB4, FKBP9, TBCB, FBXW5, GNB1, TBCD, RGS11, TUBA1A, PFDN5, GNG10, ARL2, CCT6B, GNG12, PFDN1, NOP56, CCT3, TBCA, CCT8, TP53
REACTOME_LATE_ENDOSOMAL_MICROAUTOPHAGY	0.795402298850575	1	-0.263727545504721	-0.766305853585033	691	25	HBB, VIM, VPS28, IFT88
REACTOME_HDR_THROUGH_SINGLE_STRAND_ANNEALING_SSA	0.795402298850575	1	-0.264070179594782	-0.767301436008361	691	25	ATM, RAD52, DNA2, RFC2, RPA3, MRE11, WRN, ABL1
REACTOME_MATURATION_OF_SARS_COV_2_SPIKE_PROTEIN	0.790993071593533	1	-0.263560534973702	-0.769973751776376	684	26	TUSC3, MAN1B1, ST6GALNAC4, ST3GAL4, MGAT5, PRKCSH, DAD1, STT3A, FUT8
REACTOME_AGGREPHAGY	0.789838337182448	1	-0.267364235031906	-0.770395393124709	683	24	DYNLL1, VIM, IFT88
REACTOME_SIGNALING_BY_FGFR1	0.815144766146993	1	-0.254401929331212	-0.770619937967411	731	32	SPRED1, SPRY2, SPRED2, FLRT2, FGFR1, SRC, CBL, NRAS
REACTOME_DEPOSITION_OF_NEW_CENPA_CONTAINING_NUCLEOSOMES_AT_THE_CENTROMERE	0.775032509752926	1	-0.328089720867244	-0.771904928629916	595	10	CENPC, ITGB3BP, NPM1, RUVBL1
REACTOME_PLASMA_LIPOPROTEIN_CLEARANCE	0.798349056603774	1	-0.275594399388132	-0.771983751724693	676	21	NR1H3, CES3, LDLR, SCARB1, LIPA, AP2A2, AP2B1
REACTOME_TP53_REGULATES_TRANSCRIPTION_OF_CELL_CYCLE_GENES	0.799338478500551	1	-0.2520633770107	-0.772978336386319	724	35	CNOT9, PLAGL1, CDK2, CDKN1A, PLK2, BTG2, CNOT3, NPM1, GADD45A, BAX, RBL1, TP53, CDKN1B, AURKA
REACTOME_PROGRAMMED_CELL_DEATH	0.915492957746479	1	-0.215864237306539	-0.773715863354356	909	153	FAS, DYNLL1, GSDMD, MLKL, TNFRSF10B, CASP4, PELI1, VIM, HMGB2, FLOT2, CASP9, DAPK1, SPTAN1, MAGED1, TRAF2, CASP7, TICAM2, OGT, YWHAH, BCL2L1, CHMP4A, YWHAQ, SDCBP, CDC37, IRF1, PSMB9, BCL2L11, TP63, PSMB8, BBC3, TLR4, PSMB10, AKT3, PSME2, PSME1, OMA1
REACTOME_METABOLISM_OF_FAT_SOLUBLE_VITAMINS	0.785219399538106	1	-0.268704696905527	-0.774257860563457	679	24	SDC2, VKORC1, GPC3, LRP1, BCO2
REACTOME_ROS_AND_RNS_PRODUCTION_IN_PHAGOCYTES	0.790094339622642	1	-0.276757715545748	-0.775242385331877	669	21	TCIRG1, CYBA, ATP6V1F, ATP6V1E2, SLC11A1, HVCN1
REACTOME_CELLULAR_SENESCENCE	0.879154078549849	1	-0.221543585758789	-0.776636654534128	872	104	MOV10, JUN, ETS1, ATM, CDK2, CDKN1A, MDM2, MAPK11, CDK6, KDM6B, ETS2, ACD, TNRC6C, CEBPB, ERF, MAP2K3, MDM4, IGFBP7, CBX4, MAP3K5
REACTOME_DISEASES_OF_IMMUNE_SYSTEM	0.782661782661783	1	-0.299768932012182	-0.776646361284102	640	15	TLR4, MYD88, NFKB2, S100A8, IRAK4, UNC93B1, CD36, S100A1
REACTOME_GLYCOLYSIS	0.829166666666667	1	-0.236247954602261	-0.776651443352871	795	58	PFKFB4, PPP2R1B, AAAS, ENO2, GPI, PFKFB2, NUP155, PFKL, TPI1, PGAM1, NUP85, NUP35, ENO1, ADPGK, NUP107, PKM
REACTOME_NOTCH4_ACTIVATION_AND_TRANSMISSION_OF_SIGNAL_TO_THE_NUCLEUS	0.76592977893368	1	-0.330590937531276	-0.777789603911525	588	10	JAG1, DLL4, NOTCH4, YWHAZ
REACTOME_AMYLOID_FIBER_FORMATION	0.776775648252537	1	-0.261903063233638	-0.777856663511497	688	28	SIAH2, APP, ITM2B, UBE2L6, TGFBI, GSN, RPS27A, B2M
REACTOME_SIGNALING_BY_INTERLEUKINS	0.956	1	-0.212474274221033	-0.778279557940792	955	265	IL15, GSDMD, NOD1, PTPN18, JUN, PPP2R1B, STAT2, STAT6, IL3RA, PIM1, ANXA1, IL18BP, IL4R, IRAK3, LAMA5, PELI1, IL11RA, CEBPD, MMP2, VIM, FYN, CDKN1A, CSF1, VCAM1, MSN, MAPK11, ITGAM, PELI2, POU2F1, NDN, FSCN1, TGFB1, APP, CNN2, PDCD4, SIGIRR, CXCL2, COL1A2, S1PR1, MYC, PTPN13, JUNB, BCL2L1, MAP3K8, TXLNA, CBL, MAP2K3, HIF1A, PSMB9, PTPN20, PSMB8, IL15RA, IL17RA, SOCS3, PTPN12, PSMB10, CRLF1, SMAD3, CCND1, IL1RL1, FN1, INPP5D, PSME2, PSME1, CDC42, FGF2, IL1R1, GSTO1, MYD88
REACTOME_B_WICH_COMPLEX_POSITIVELY_REGULATES_RRNA_EXPRESSION	0.780600461893764	1	-0.270346314115086	-0.778988090601022	675	24	KAT2A, ACTB
REACTOME_CYTOSOLIC_IRON_SULFUR_CLUSTER_ASSEMBLY	0.755936675461741	1	-0.339773450490364	-0.77932663348929	572	9	NDOR1, RTEL1, POLD1, MMS19, ERCC2
REACTOME_METABOLISM_OF_AMINE_DERIVED_HORMONES	0.777414075286416	1	-0.470222615214696	-0.782164526343779	474	3	PNMT, TPO
REACTOME_NR1H2_NR1H3_REGULATE_GENE_EXPRESSION_LINKED_TO_GLUCONEOGENESIS	0.801526717557252	1	-0.433767016828596	-0.784713733287229	524	4	NR1H3
REACTOME_SHC1_EVENTS_IN_EGFR_SIGNALING	0.745283018867924	1	-0.354587434913169	-0.785384994829131	552	8	NRAS, EGFR, AREG
REACTOME_ENDOGENOUS_STEROLS	0.760869565217391	1	-0.320672858737974	-0.786094619524083	594	12	CYP4V2, CYP1B1, FDXR, AHR
REACTOME_SYNTHESIS_OF_IP3_AND_IP4_IN_THE_CYTOSOL	0.764139590854392	1	-0.295507545712127	-0.788261562624848	634	17	INPP5B, PLCD1, PLCG2, PLCB4
REACTOME_VITAMIN_B5_PANTOTHENATE_METABOLISM	0.779012345679012	1	-0.307981935567757	-0.788687877157285	630	14	ENPP2, ENPP1
REACTOME_ATTACHMENT_OF_GPI_ANCHOR_TO_UPAR	0.759831460674157	1	-0.383763723469183	-0.788812153465375	540	6	PGAP1, PIGU
REACTOME_WNT_LIGAND_BIOGENESIS_AND_TRAFFICKING	0.733509234828496	1	-0.343918182612013	-0.788833262469328	555	9	WNT2B, WNT11, WNT5A
REACTOME_CA_DEPENDENT_EVENTS	0.76662908680947	1	-0.265641516865199	-0.788959935969003	679	28	PDE1A, PRKAR1B, ADCY4, CAMKK2, PRKX, CAMK2A, ADCY3, CAMK2B, ADCY1, NBEA, ADCY5, CREB1, ADCY6
REACTOME_DOWNREGULATION_OF_ERBB2_SIGNALING	0.773584905660377	1	-0.281894145408731	-0.789630342434416	655	21	PTPN18, CDC37, PTPN12, AKT3, EGFR, ERBB2, RPS27A
REACTOME_DEFECTS_OF_CONTACT_ACTIVATION_SYSTEM_CAS_AND_KALLIKREIN_KININ_SYSTEM_KKS	0.772334293948127	1	-0.406555671645666	-0.790293413742812	535	5	SERPING1, GGCX
REACTOME_EPHRIN_SIGNALING	0.777777777777778	1	-0.308630407063747	-0.790348499253922	629	14	FYN, SRC, SDCBP, PAK1, MYL12A, ARHGEF7, EFNB2, EFNB1
REACTOME_IRON_UPTAKE_AND_TRANSPORT	0.801282051282051	1	-0.250739245483618	-0.791916479661154	749	42	CP, STEAP2, TCIRG1, CAND1
REACTOME_RESOLUTION_OF_AP_SITES_VIA_THE_MULTIPLE_NUCLEOTIDE_PATCH_REPLACEMENT_PATHWAY	0.751190476190476	1	-0.290081003504336	-0.793087182967442	630	19	POLE, LIG1, RFC2, PARP2, RPA3, POLD1, POLD4
REACTOME_MITOCHONDRIAL_UNCOUPLING	0.787786259541985	1	-0.439294827440829	-0.794713914799748	515	4	SLC25A27
REACTOME_THE_FATTY_ACID_CYCLING_MODEL	0.787786259541985	1	-0.439294827440829	-0.794713914799748	515	4	SLC25A27
REACTOME_CYTOKINE_SIGNALING_IN_IMMUNE_SYSTEM	0.964035964035964	1	-0.214417337426147	-0.794839393915326	964	408	TNFRSF6B, IRF3, IFITM2, IL15, GSDMD, NOD1, PTPN18, TNFRSF14, EDA2R, JUN, PPP2R1B, STAT2, STAT6, IL3RA, PIM1, ANXA1, IL18BP, IFITM3, IL4R, IRAK3, LAMA5, PELI1, PML, IL11RA, CEBPD, MMP2, VIM, FYN, UBA7, AAAS, CDKN1A, CSF1, VCAM1, GBP1, MSN, TRAF2, MAPK11, ITGAM, PELI2, XAF1, POU2F1, NDN, FSCN1, BST2, TGFB1, APP, CNN2, TRIM22, PDCD4, SIGIRR, NUP155, TNFSF12, CXCL2, UBE2L6, COL1A2, ADAR, S1PR1, RNASEL, MYC, CD44, TRIM2, PTPN13, IFNGR2, JUNB, BCL2L1, MAP3K8, IFIT1, IRF1, TXLNA, CBL, PIN1, MAP2K3, HIF1A, PSMB9, BCL2L11, PTPN20, NRAS, PSMB8, IL15RA, IL17RA, SOCS3, PTPN12, CAMK2A, EIF4A3, PSMB10, CRLF1, SMAD3, IP6K2, AKT3, CCND1, IL1RL1, FN1, INPP5D, PSME2, PSME1, NUP85, CDC42, FGF2, IL1R1, NUP35, GSTO1, MYD88, SH2B1, PSMD10, PPIA, TRIM21, IFIT5, ICAM1, CAMK2B, TRIM25, RAP1B, IFI27, RPS27A, SP100, NCAM1, VAMP2, CSF3R, JAK2, RBX1, LTBR, B2M
REACTOME_BIOSYNTHESIS_OF_THE_N_GLYCAN_PRECURSOR_DOLICHOL_LIPID_LINKED_OLIGOSACCHARIDE_LLO_AND_TRANSFER_TO_A_NASCENT_PROTEIN	0.799580272822665	1	-0.244192911676742	-0.79550582172941	761	53	ALG2, NAGK, MVD, GFPT2, ST3GAL5, ST6GALNAC4, ALG13, ALG9, CTSA, ST3GAL4, MPI, ALG6, NEU3
REACTOME_LAGGING_STRAND_SYNTHESIS	0.764346764346764	1	-0.307883166719846	-0.797668856237168	625	15	DNA2, LIG1, RFC2, RPA3, POLD1, POLD4, RFC4, POLD2, PCNA
REACTOME_GPVI_MEDIATED_ACTIVATION_CASCADE	0.740430622009569	1	-0.294338071641431	-0.798293519944283	618	18	VAV2, FYN, LCP2, PLCG2, COL1A2, COL1A1, CDC42
REACTOME_SIGNALING_BY_MODERATE_KINASE_ACTIVITY_BRAF_MUTANTS	0.777653631284916	1	-0.26306488534883	-0.798931986633086	695	34	ACTG1, ACTB, SRC, MAP3K11, NRAS, CAMK2A, FN1, CAMK2B, RAP1B, JAK2, KSR1, ARRB1, VWF
REACTOME_CYCLIN_D_ASSOCIATED_EVENTS_IN_G1	0.775244299674267	1	-0.257490825445744	-0.800202591683716	713	37	PPP2R1B, CCND2, PPP2R3B, CDK2, CDKN1A, CDK6
REACTOME_SIGNALING_BY_TGFB_FAMILY_MEMBERS	0.832139201637666	1	-0.233422510719711	-0.800392486027101	812	80	FST, F11R, CCNT2, INHBB, PPP1R15A, TGFB1, FSTL1, TGFBR2, FSTL3, MYC, TGIF1, JUNB, BMP2, CBL, SERPINE1, CHRDL1, WWTR1, SMAD3, ACVRL1, FKBP1A, RPS27A, HDAC1, SMAD7, ACVR2A, USP15, ACVR1B, BMPR1A, RHOA, NEDD8, ACVR2B
REACTOME_INTERLEUKIN_12_SIGNALING	0.773942093541203	1	-0.264247965693897	-0.800444994526471	694	32	MSN, CNN2, PDCD4, PSME2, CDC42, GSTO1, PPIA, RAP1B, JAK2, CFL1, IL12RB2, MTAP, HNRNPA2B1, TALDO1, SNRPA1, CAPZA1, RALA
REACTOME_RAB_GEFS_EXCHANGE_GTP_FOR_GDP_ON_RABS	0.826310380267215	1	-0.236757078734296	-0.803219543211228	803	74	GDI1, DENND2A, HPS4, ALS2CL, RAB27A, TRAPPC6A, RAB3IL1, RAB31, TRAPPC1, RAB6B, TRAPPC2L, DENND2C, RIN1, RAB13, AKT3, SBF2, TRAPPC9
REACTOME_TRAF3_DEPENDENT_IRF_ACTIVATION_PATHWAY	0.721635883905013	1	-0.350267225828563	-0.803395843708949	546	9	IRF3, SIKE1, TRIM25, TRIM4, IRF7
REACTOME_BETA_OXIDATION_OF_LAUROYL_COA_TO_DECANOYL_COA_COA	0.755043227665706	1	-0.41343757966913	-0.803670982829261	523	5	ECHS1, ACADL
REACTOME_SHC_MEDIATED_CASCADE_FGFR4	0.721024258760108	1	-0.363147369028466	-0.804344617051862	534	8	NRAS, FGF2, FGFR4, FGF1
REACTOME_RHO_GTPASES_ACTIVATE_PKNS	0.748013620885357	1	-0.27170071997817	-0.804543451990217	658	27	MYH9, MYL6, YWHAH, PKN3, YWHAQ, PAK1, MYH10, MYL12B, KDM4C, PPP1R14A, YWHAZ, RHOA
REACTOME_PCNA_DEPENDENT_LONG_PATCH_BASE_EXCISION_REPAIR	0.765721331689272	1	-0.308458003650539	-0.804666776313441	620	16	POLE, LIG1, RFC2, RPA3, POLD1, POLD4, RFC4, POLD2, PCNA
REACTOME_NUCLEAR_RECEPTOR_TRANSCRIPTION_PATHWAY	0.761596548004315	1	-0.258570834440974	-0.806021509298433	705	38	NR1H3, NR4A1, NR2C1, PPARG, NR6A1, ESR1, RARB, NR4A3, NR4A2, NR1D1, RXRG, RARG, PGR, NRBF2
REACTOME_RAC3_GTPASE_CYCLE	0.819415448851775	1	-0.244952253253923	-0.806275258094504	784	60	NOXA1, SRGAP2, BAIAP2L1, VAV2, OPHN1, CDC42EP1, ARHGDIB, CAV1, ABR, CYBA, JAG1, SYDE1, PAK1, SLC1A5, MCAM, CDC42
REACTOME_PHOSPHATE_BOND_HYDROLYSIS_BY_NUDT_PROTEINS	0.740168539325843	1	-0.392414438521646	-0.806593378610531	526	6	NUDT5
REACTOME_ACTIVATION_OF_TRKA_RECEPTORS	0.793650793650794	1	-0.614224557306869	-0.80836237732092	399	1	NTRK2
REACTOME_NGF_INDEPENDANT_TRKA_ACTIVATION	0.793650793650794	1	-0.614224557306869	-0.80836237732092	399	1	NTRK2
REACTOME_CGMP_EFFECTS	0.742068965517241	1	-0.378690014711262	-0.808365385447677	537	7	PDE1A, PDE11A, ITPR1, PDE2A, PDE5A
REACTOME_EXTENSION_OF_TELOMERES	0.760517799352751	1	-0.259403315733303	-0.808616534484303	704	38	CHTF18, CDK2, DNA2, LIG1, ACD, RFC2, STN1, RTEL1, RPA3, POLD1, WRN, TERF2IP, RUVBL1, POLD4
REACTOME_SIGNALING_BY_RETINOIC_ACID	0.74460839954597	1	-0.273256433583446	-0.80915013538214	655	27	CYP26B1, ALDH1A2, RARB, ALDH1A1, RXRG, RDH11, RARG, PDHA1, PDHB, ALDH1A3, RDH5
REACTOME_INTEGRATION_OF_ENERGY_METABOLISM	0.810699588477366	1	-0.241912818600442	-0.809301339694705	787	67	ITPR3, PPP2R1B, MARCKS, PRKAR1B, ADCY4, GNAI2, GNB4, ABCC8, TKT, GNB1, RAPGEF3, ADCY3, ACSL4, FASN, VAMP2, ITPR1, GNAS, ADCY1, GNG10, CACNA1C, ADCY5, ADCY6, SLC2A1, GNG12, GNAI1, PFKFB1, PLCB1, ACACA
REACTOME_OXIDATIVE_STRESS_INDUCED_SENESCENCE	0.784518828451883	1	-0.249336540287023	-0.810519075490474	749	52	MOV10, JUN, MDM2, MAPK11, CDK6, KDM6B, TNRC6C, MAP2K3, MDM4, CBX4, MAP3K5, MINK1
REACTOME_ACTIVATION_OF_ANTERIOR_HOX_GENES_IN_HINDBRAIN_DEVELOPMENT_DURING_EARLY_EMBRYOGENESIS	0.767416934619507	1	-0.255603869913507	-0.810656213868607	715	44	MEIS1, CNOT9, JUN, HOXB3, PAGR1, PCGF2, HOXA3, RARB
REACTOME_SIGNALING_BY_FGFR	0.782198952879581	1	-0.248066625103928	-0.810937693277548	746	54	SPRED1, SPRY2, SPRED2, FLRT2, HNRNPM, HNRNPH1, PTBP1, FGFR1, SRC, RBFOX2, CBL, NRAS, HNRNPA1, FGF2, POLR2I, POLR2G, RPS27A
REACTOME_RRNA_PROCESSING	0.893893893893894	1	-0.225322785010925	-0.811116341057867	892	175	CSNK1E, ERI1, RBM28, RPS6, RPL35A, RPL3, RPS4Y1, RPL11, RPS8, WDR18, NOP58, RPL31, RPL24, WDR75, RPL13, RPL36A, RPL34, RPL10A, MPHOSPH6, RPL28, RPL36, RPS18, RPS20, RPL35, RPS19, RPS9, RPS26, RPL12, RPS27, RPL23, RPL9, RPS15A, RPS17, RPS12, EXOSC9, RPS27A, EXOSC5, RPS16, RPL37, RPL15, RPS3A, RPS11, RRP7A, RPS2, RPL27A, RPL7, RPL26, TSR3, RPL22, RPL17, RPS24, RPP14, RCL1, NOL12, RPL6, RPL32, RPL4, RPL7A, RPL13A, RPL29, NOP56, RPS5, EXOSC1, SNU13, RPL18A, RPP30, RPL39, RPL19, TRMT112, HSD17B10, RPS7, RPS25, ELAC2, RPS4X, RPP40, RPS14, RPS15, RPS13, RPSA, RPL41, NHP2, EXOSC10, RPL37A, RPL21, PDCD11, RPL3L, EXOSC8
REACTOME_CARGO_TRAFFICKING_TO_THE_PERICILIARY_MEMBRANE	0.757377049180328	1	-0.262729222648951	-0.811469064328498	692	36	SMO, ASAP1, INPP5E, PKD2, BBS9, BBS7, NPHP3, ARF4, BBIP1, ARL3, BBS1, EXOC4, CCT3, CCT8
REACTOME_P75_NTR_RECEPTOR_MEDIATED_SIGNALLING	0.803699897225077	1	-0.242727026577164	-0.813377120190281	781	68	ARHGEF15, CASP2, MCF2L, VAV2, ARHGEF10, PLEKHG2, MAGED1, ARHGEF9, BEX3, ITGB3BP, ABR, BCL2L11, TIAM2, ARHGEF1, ARHGEF17, RASGRF2, MYD88, NGFR, RPS27A, ARHGDIA, HDAC1
REACTOME_PURINE_SALVAGE	0.730769230769231	1	-0.337023314666868	-0.814157511491271	569	11	HPRT1, ADK, DGUOK, ADAL, GMPR2, AMPD2, AMPD1
