pathway	pval	padj	ES	NES	nMoreExtreme	size	leadingEdge
REACTOME_G_ALPHA_12_13_SIGNALLING_EVENTS	0.894791666666667	0.96432557941377	0.124417075756937	0.634975670444652	858	42	ARHGEF7, ITSN1, ARHGEF11, ROCK1, GNB1, GNG10, ARHGEF12, ARHGEF18, GNB2, GNA12, ARHGEF40, TRIO, SOS2, RASGRF2, ARHGEF1, GNG12, OBSCN, MCF2L, SOS1, RHOA, ABR, ARHGEF9, ARHGEF17, NET1, AKAP13, ARHGEF3, ARHGEF10, PREX1, ROCK2, KALRN, VAV2, ARHGEF15, ARHGEF6, GNA13, GNB4
REACTOME_PLASMA_LIPOPROTEIN_CLEARANCE	0.905638665132336	0.967626003619994	0.151244638464407	0.633859442576382	786	21	HDLBP, AP2M1, AP2B1, LDLRAP1, CLTC, AP2S1, AP2A2, AP2A1, NR1H2, SCARB1, LSR, NCEH1, VLDLR, MYLIP, LIPA, NR1H3
REACTOME_ROLE_OF_LAT2_NTAL_LAB_ON_CALCIUM_MOBILIZATION	0.904040404040404	0.967626003619994	0.201235770814627	0.633355273497708	715	9	GRB2, PDPK1, PIK3CA
REACTOME_NR1H2_NR1H3_REGULATE_GENE_EXPRESSION_LINKED_TO_GLUCONEOGENESIS	0.926253687315634	0.976922668209485	0.276204379562044	0.631611831845021	627	4	RXRB, RXRA, NRIP1, NR1H3
REACTOME_SYNTHESIS_OF_PG	0.910836762688615	0.9679375	0.234400446050964	0.630474243026514	663	6	PLD3, CDS2, PGS1, PLD2, PLD1
REACTOME_MYOCLONIC_EPILEPSY_OF_LAFORA	0.909090909090909	0.967626003619994	0.200281096612133	0.630350599238382	719	9	UBA52, EPM2A, UBB, RPS27A
REACTOME_ANTIGEN_PRESENTATION_FOLDING_ASSEMBLY_AND_PEPTIDE_LOADING_OF_CLASS_I_MHC	0.919261822376009	0.972872706294792	0.154358609647258	0.629110286746628	796	19	SEC23A, SAR1B, SEC13, SEC31A, BCAP31, SEC24C, TAPBP, SEC24B, PDIA3, B2M, CALR, ERAP1, CANX, SEC24D, TAP2
REACTOME_VITAMIN_B2_RIBOFLAVIN_METABOLISM	0.925190839694657	0.976922668209485	0.302841572596341	0.624626853583341	605	3	FLAD1, ENPP1, SLC52A2
REACTOME_CELL_CELL_COMMUNICATION	0.926113360323887	0.976922668209485	0.110262436054895	0.62246349918828	914	66	GRB2, NCK1, CTNNB1, CD2AP, PTK2, AFDN, CTNNA1, WASL, PARVB, FERMT2, PXN, CASK, CTNND1, PIK3CA, PLEC, SPTBN1, ILK, NECTIN2, PRKCI
REACTOME_FORMATION_OF_TUBULIN_FOLDING_INTERMEDIATES_BY_CCT_TRIC	0.916467780429594	0.971136434892218	0.170011006292546	0.619221184982551	767	13	CCT8, CCT7, TCP1, CCT4, CCT3, CCT6A, CCT2
REACTOME_ATTACHMENT_AND_ENTRY	0.932824427480916	0.979930511526464	0.298471745743272	0.615613853239512	610	3	VCP, FURIN, CTSL
REACTOME_EPHRIN_SIGNALING	0.921708185053381	0.974729525464478	0.165333407679402	0.613703563569099	776	14	ARHGEF7, RAC1, PAK2, SDCBP
REACTOME_SIGNALING_BY_NOTCH2	0.919337016574586	0.972872706294792	0.138954219450805	0.613027191527626	831	25	RBPJ, CREB1, NCSTN, UBA52, PSEN1, PSEN2, MIB1, UBB, RPS27A, ADAM10, JAG2, PSENEN, APH1B, DLL4, NEURL1B, NOTCH2, MAMLD1, NEURL1, JAG1
REACTOME_SENSORY_PROCESSING_OF_SOUND	0.92948717948718	0.978374987196559	0.126521103969816	0.60245451782753	869	33	VAMP2, CAPZB, CAPZA2, TRIOBP, RDX, CASK, ATP2B1, DNAJC5, SPTBN1, MYO1C
REACTOME_SHC_RELATED_EVENTS_TRIGGERED_BY_IGF1R	0.92772667542707	0.977823915900132	0.208029059269408	0.602015272035148	705	7	GRB2, KRAS, SOS1, NRAS, SHC1
REACTOME_NEUROTRANSMITTER_RECEPTORS_AND_POSTSYNAPTIC_SIGNAL_TRANSMISSION	0.950803212851406	0.987660893244463	0.101804618992859	0.59949473385847	946	85	PRKACA, ARHGEF7, ADCY6, MAPK1, RAC1, PDPK1, LIN7C, CREB1, AP2M1, PRKAR2A, AP2B1, GNB1, GNG10, CAMK2B, PRKAG1, CASK, PRKAA1, GNAI3, GNB2, CAMK2G, GNAI2, PRKACB, AP2S1, AP2A2, KRAS
REACTOME_METABOLISM_OF_VITAMINS_AND_COFACTORS	0.968968968968969	0.992110085477868	0.0966419868561513	0.598491395168996	967	121	NAXD, PANK4, AKT1, HLCS, AASDHPPT, LMBRD1, PCCA, MOCS2, MMADHC, NADK2, MTHFD1, SLC25A16, MMAB, MCCC1, GPHN, MCCC2, MTRR, FLAD1, PNPO, VKORC1L1, SHMT1, NAXE, NFS1, ABCD4, MTR, RDH11, NMRK1, PPCS, NUDT12, COQ6, PANK3, MTHFS, PDSS2, PARP6, PTS, PDZD11, MTHFD2L, NMNAT3, VKORC1, SLC25A32, PCCB, UBIAD1, COQ9, CYB5R3, PARP16, COQ5, COASY, PANK2, CYB5A, MTHFR, THTPA, NADSYN1, MOCS3, SLC19A1, LRP12, FPGS, SLC23A2, PARP10, PARP4, PDXK, BTD, NADK, GPC1, LRP10, HSPG2, AGRN, COQ2, PPCDC, GPC4, ENPP1, PDSS1, SLC25A19, ALDH1L1, MOCS1, SLC52A2, SDC3, TCN2, IDH1, COQ3, MMACHC, SPR, GSTO1, ABCC1, NAPRT, HSP90AA1, NMNAT1, SLC5A6
REACTOME_PRESYNAPTIC_FUNCTION_OF_KAINATE_RECEPTORS	0.931818181818182	0.979524298839458	0.189605891359238	0.596752211063055	737	9	GNB1, GNG10, GNB2, GNG12, PLCB3
REACTOME_ACETYLCHOLINE_REGULATES_INSULIN_SECRETION	0.92904073587385	0.978374987196559	0.206060298946169	0.596317876749464	706	7	GNA11, GNAQ, PLCB3, PRKCA, PLCB1, PLCB2, MARCKS
REACTOME_BLOOD_GROUP_SYSTEMS_BIOSYNTHESIS	0.943134535367545	0.984496634026928	0.236876459783478	0.594150523142376	679	5	ST3GAL3, ST6GALNAC6, ST3GAL6, ST3GAL4, B3GALT1
REACTOME_REGULATION_OF_GENE_EXPRESSION_BY_HYPOXIA_INDUCIBLE_FACTOR	0.935528120713306	0.980947604338045	0.219673370067213	0.590862364127485	681	6	ARNT, HIGD1A, EPAS1, HIF1A, HIF3A
REACTOME_SHC_MEDIATED_CASCADE_FGFR3	0.931668856767411	0.979524298839458	0.203856512785027	0.58994034021699	708	7	GRB2, KRAS, SOS1, NRAS, SHC1
REACTOME_HSF1_DEPENDENT_TRANSACTIVATION	0.924507658643326	0.976922668209485	0.127794233178659	0.587147273620474	844	29	DNAJB6, MLST8, MRPL18, AKT1S1, HSP90AB1, CAMK2B, CAMK2G, HSF1, UBB, MTOR, PTGES3, DEDD2
REACTOME_FCGR3A_MEDIATED_IL10_SYNTHESIS	0.93854748603352	0.982027515168097	0.134111299959383	0.585047748636937	839	24	PRKACA, ADCY6, CREB1, YES1, PRKAR2A, PRKACB, ITPR2, ADCY2, ADCY4, ITPR3, PRKX, AHCYL1, FYN, PLCG2, PRKAR1B, ITPR1, CALM1, ADCY3, ADCY5, FGR, ADCY1, ADCY9, SRC, PRKAR1A
REACTOME_SIGNALING_BY_NOTCH3	0.935654008438819	0.980947604338045	0.118205805033099	0.583594334570792	886	37	YBX1, RBPJ, NCSTN, SNW1, UBA52, PSEN1, PSEN2, MIB1, KAT2B, UBB, NOTCH1, RPS27A, WWP2, ADAM10, JAG2, PSENEN, APH1B, PLXND1, DLL4, NEURL1B, PBX1, KAT2A, MAMLD1, NEURL1, JAG1, HEY1, EGFR, EGF, NOTCH3, MAML2, HEY2, HEYL, MAML3
REACTOME_FREE_FATTY_ACIDS_REGULATE_INSULIN_SECRETION	0.953246753246753	0.98825122418565	0.192709970421984	0.582272958980242	733	8	GNA11, GNAQ, ACSL3, PLCB3
REACTOME_REGULATION_OF_TP53_ACTIVITY_THROUGH_ASSOCIATION_WITH_CO_FACTORS	0.938131313131313	0.982027515168097	0.185005061507155	0.582271883646679	742	9	AKT1, AKT2, TP53BP2, BANP, PHF20, AKT3, TP53
REACTOME_ION_CHANNEL_TRANSPORT	0.961923847695391	0.990328610783156	0.0965242658632496	0.582124176966392	959	99	ATP6V1G1, ATP6AP1, TRPC4AP, ATP6V1H, ATP6V0C, FXYD1, ATP6V1C1, ATP6V1D, UBA52, ATP7A, ATP11B, ATP6V1A, ATP6V1F, ATP6V1B2, CAMK2B, ATP2B1, ASPH, TTYH2, ATP6V0D1, CAMK2G, SGK3, ATP7B, ANO8, RYR1, ANO10, SRI, ATP2C1, UBB, WWP1, PDZD11, ATP11A, CLCN3, TRPM7, RPS27A, RAF1, ATP1A2, MCOLN1, RIPK1, ATP6V0A2, WNK2, ANO1, FXYD6, ATP6V0E1, CAMK2D, WNK1, ATP6V1E1, TPCN2, ATP13A1, CUTC, OSTM1, TPCN1, TRDN, TRPV1, ATP6V0A1, ATP9B, ANO6, ATP2B4, CLCN6, ATP13A2, TCIRG1, ATP6V0B, ANO5, ATP11C, ATP6V1E2, ATP6V0E2, ATP1B1, ATP8A1, ATP1B3, TTYH3, ATP2A2, ATP10D, CLCN5, MLKL, CAMK2A, STOM, ATP1B2, CLIC2
REACTOME_SIGNALING_BY_PDGFR_IN_DISEASE	0.941588785046729	0.983907382127481	0.150082718572568	0.580690188292373	805	16	GRB2, FIP1L1, WDR48, PIK3CA, KRAS, SOS1, GOLGA4, NRAS, STRN, PIK3CB, KDR, ETV6, STAT3, PDGFRA, PIK3R1, KANK1
REACTOME_FATTY_ACID_METABOLISM	0.962925851703407	0.990328610783156	0.0949301822299432	0.576812362953526	960	105	ACBD6, THEM4, PCCA, ACAA1, CBR4, HSD17B4, ECI1, ACOX1, ACSF3, SCP2, ACADVL, ACBD5, SLC25A17, NUDT19, TECR, MCEE, ACOT9, DECR2, PTGES2, ACADS, HACD3, MECR, MCAT, CROT, ACSL3, ACAD10, NDUFAB1, ECHS1, PRKAB2, PHYH, PTGES3, CYP2U1, ACOT8, HACD2, GPX1, ACAA2, PCCB, PPT1, HSD17B12, CRAT, FAAH, ACOX3, DECR1, RXRA, MORC2, HACL1, ACOT13, ACBD4, ACOT2, PON2, ECI2, HADHB, CPT1B, MLYCD, MAPKAPK2, ELOVL1, ACLY
REACTOME_TNFR1_INDUCED_PROAPOPTOTIC_SIGNALING	0.940656565656566	0.98358335337502	0.183252190847128	0.576755022147385	744	9	USP4, USP21, OTUD7B, RIPK1, USP2, TRAF2, TNFRSF1A, TRADD, CYLD
REACTOME_G_ALPHA_I_SIGNALLING_EVENTS	0.957831325301205	0.990328610783156	0.0971525250858679	0.576309257198917	953	89	PRKACA, GNAS, GNA11, PPP2CA, ADCY6, GRK2, PPP2R5D, HEBP1, MAPK1, CREB1, PPP3R1, PRKAR2A, PPP2R1A, GNB1, GNG10, CAMK2B, GNAI3, GNB2, CAMK2G, GNAI2, PRKACB, PPP3CA, PPP3CB, ITPR2, GNAQ
REACTOME_GLYCEROPHOSPHOLIPID_CATABOLISM	0.977346278317152	0.994891102625909	0.33015471441082	0.576060536012186	603	2	GDE1, PNPLA7
REACTOME_HEME_DEGRADATION	0.946502057613169	0.984496634026928	0.213923116982804	0.575395727772127	689	6	BLVRA, HMOX2, BLVRB, ABCC1
REACTOME_ACTIVATION_OF_IRF3_IRF7_MEDIATED_BY_TBK1_IKK_EPSILON	0.944711538461538	0.984496634026928	0.162403186619923	0.572994925693977	785	12	UBA52, TANK, UBB, RPS27A, IRF3
REACTOME_SHC1_EVENTS_IN_ERBB4_SIGNALING	0.95974025974026	0.990328610783156	0.188707196781904	0.570178582926767	738	8	GRB2, KRAS, SOS1, NRAS, SHC1
REACTOME_ADENYLATE_CYCLASE_INHIBITORY_PATHWAY	0.953980099502488	0.988363392734884	0.173770325932676	0.565847064672292	766	10	ADCY6, GNAI3, GNAI2, GNAI1, ADCY2, ADCY4, ADCY3, ADCY5, ADCY1, ADCY9
REACTOME_DAG_AND_IP3_SIGNALING	0.946178686759957	0.984496634026928	0.119683622208627	0.565731627082182	878	32	PRKACA, ADCY6, GRK2, CREB1, PRKAR2A, CAMK2B, CAMK2G, PRKACB, ITPR2, NBEA, CAMKK2, CAMK2D, ADCY2, ADCY4, ITPR3, PRKX, AHCYL1, PRKCA, KPNA2, CAMK2A, PRKAR1B, ITPR1, PRKCD, PRKCE, CALM1, ADCY3, ADCY5, ADCY1, PDE1A, ADCY9
REACTOME_GABA_SYNTHESIS_RELEASE_REUPTAKE_AND_DEGRADATION	0.95974025974026	0.990328610783156	0.187188043562497	0.565588463182204	738	8	VAMP2, DNAJC5, HSPA8, ABAT, SLC6A1, ALDH5A1, CPLX1
REACTOME_TRIGLYCERIDE_CATABOLISM	0.946511627906977	0.984496634026928	0.143706736615595	0.565390146457265	813	17	PRKACA, PPP1CB, PRKACB, PPP1CC, PNPLA4, MGLL, PPP1CA
REACTOME_RORA_ACTIVATES_GENE_EXPRESSION	0.962040332147094	0.990328610783156	0.151875304432538	0.563748227636648	810	14	TBL1XR1, SMARCD3, CARM1, MED1, NCOA1, RXRA, TGS1, PPARA, CHD9, CPT1A, TBL1X, RORA, HELZ2, SREBF1
REACTOME_CELL_CELL_JUNCTION_ORGANIZATION	0.951779563719862	0.988025929245635	0.134558672522309	0.556440806594202	828	20	CTNNB1, AFDN, CTNNA1, CTNND1, NECTIN2, PRKCI, JUP, CDH5, ACTB, F11R, PATJ, PARD6A, ACTG1, CDH6, CDH13, SDK1, CLDN5, CLDN15
REACTOME_REGULATION_OF_FZD_BY_UBIQUITINATION	0.9644128113879	0.990328610783156	0.149614011372858	0.555354499905041	812	14	USP8, UBA52, LRP6, UBB, RPS27A, LRP5, ZNRF3, FZD8, FZD5
REACTOME_GLYCOGEN_METABOLISM	0.950506186726659	0.987660893244463	0.128672952220064	0.554662166341246	844	23	PHKA2, UBA52, EPM2A, PHKB, GAA, UBB, RPS27A, PGM1, UGP2
REACTOME_ACTIVATION_OF_NOXA_AND_TRANSLOCATION_TO_MITOCHONDRIA	0.991909385113269	1	0.316838953698292	0.55282693092144	612	2	TFDP1, TP53
REACTOME_MISCELLANEOUS_TRANSPORT_AND_BINDING_EVENTS	0.969519343493552	0.992110085477868	0.145654715510522	0.550721306121323	826	15	ADD1, MAGT1, MMGT1, NIPA1, MRS2, DMTN, ANKH, LRRC8A, LRRC8C, NIPAL3, TUSC3, ADD3, NIPAL2, LRRC8B, CTNS
REACTOME_SHC_MEDIATED_CASCADE_FGFR4	0.968831168831169	0.992110085477868	0.182147033421609	0.550357056708751	745	8	GRB2, KRAS, SOS1, NRAS, SHC1, FGF2, FGF1, FGFR4
REACTOME_MET_PROMOTES_CELL_MOTILITY	0.960954446854664	0.990328610783156	0.116674064814134	0.543560257018798	885	30	GRB2, CRKL, PTK2, RAC1, LAMB2, DOCK7, LAMC1, ITGB1, RAPGEF1, RAP1B, COL5A3, TNS3, RAP1A, COL27A1
REACTOME_CAMK_IV_MEDIATED_PHOSPHORYLATION_OF_CREB	0.964646464646465	0.990328610783156	0.17262162276044	0.543297121841073	763	9	CREB1, CAMK2B, CAMK2G, CAMKK2, CAMK2D, KPNA2, CAMK2A, CALM1
REACTOME_SPHINGOLIPID_METABOLISM	0.963377416073245	0.990328610783156	0.0996815120945759	0.541338577617428	946	55	SMPD4, VAPA, CSNK1G2, VAPB, DEGS1, GALC, GLB1, GLTP, ORMDL3, SGPP1, OSBP, SUMF2, CERS2, NEU3, HEXA, SPTLC1, GBA2, NEU1, SPTLC2, SGMS1, ORMDL1, ARSB, CTSA, SGPL1, ACER3, ASAH1, ARSA, ESYT2, SPHK2, PRKD3, ESYT1, PLPP1, CERS5, SUMF1
REACTOME_METABOLISM_OF_CARBOHYDRATES	0.994005994005994	1	0.0818373372035742	0.540036347779129	994	191	IDS, PRKACA, CHST12, PPP2CA, POM121, MDH2, NUP54, NUP62, NUP133, POM121C, NUP43, ST3GAL3, PPP2R5D, RPIA, PHKA2, NUP155, NUP58, XYLT2, NUP160, GLB1, HGSNAT, UBA52, RAE1, EPM2A, PRPS1, PPP2R1A, TPR, NUP153, B4GALT7, NUP205, SEC13, PHKB, NUP107, SLC35B3, NUP98, GAA, SGSH, RANBP2, NUP37, PRKACB, NUP93, GNPDA1, GNPDA2, DERA, RPE, GNS, AAAS, NDST2, PFKM, PFKL, UBB, HEXA, B4GALT4, RPS27A, PGM1, CRYL1, UGP2, PGK1, GPI, GLCE, B4GALT2, NUP35, MAN2C1, B4GAT1, NUP214, ADPGK, G6PC3, SHPK, HS2ST1, NUP188, ARSB, CHST14, B3GNT2, NUP50, AKR1B1, GUSB, CHP1, PGP, NUP85, EXT2, MANBA, BPGM, ST6GALNAC6, GALK1, GYG1, EXT1, SLC25A13, SEH1L, MAN2B1, SLC25A12, SLC37A4, PGD, HS6ST1, ST3GAL2, ALDOA, SLC37A1, HYAL2, TALDO1, GALNS, SLC25A11, PGLS, GPC1, SLC25A10, GALT, PPP2CB, NUP88, PAPSS1, B4GALT3, GYS1, HSPG2, GALE, AGRN, PGAM1, PGM2L1, NAGLU, GOT2, G6PD, B3GALT6
REACTOME_GAP_JUNCTION_TRAFFICKING_AND_REGULATION	0.972318339100346	0.993687972926727	0.131312606047426	0.535183048310193	842	19	DNM2, TJP1, AP2M1, CLTB, CLTC
REACTOME_SIGNALING_BY_MET	0.965552178318136	0.990615180999982	0.0958720197476955	0.531541681918841	952	60	GRB2, RAB4A, CRKL, PTK2, RAC1, USP8, UBA52, LAMB2, PIK3CA, KRAS, STAM2, ARF6, UBB, EPS15, DOCK7, RANBP9, RPS27A, LAMC1, ITGB1, RAPGEF1, RAP1B, COL5A3, GGA3, LRIG1, TNS3, RANBP10, SOS1, CBL, RAP1A, COL27A1, NRAS
REACTOME_GLYCEROPHOSPHOLIPID_BIOSYNTHESIS	0.983854692230071	0.997098890010091	0.090712019441288	0.523338085324938	974	77	DDHD2, AGPAT1, CEPT1, PCYT1A, PLA2G12A, ETNK1, PLD3, LPGAT1, CSNK2A1, DDHD1, CPNE3, AGK, PTDSS2, CDS2, CSNK2A2, MIGA1, CHKA, GNPAT, CPNE1, PTDSS1, PLBD1, PLA2G6, AGPAT5, MGLL, PGS1, PITPNM2, AGPAT3, STARD10, PISD, LCLAT1, GPD1L, MBOAT7, PLD2, HADHB, SLC44A1, PEMT, LPIN2, LPCAT3, ACP6, HADHA, GPAT4, PLA2G4B, CHKB, PLA2G4C, STARD7, LPCAT4, PLD1, SELENOI, CHPT1
REACTOME_CYTOKINE_SIGNALING_IN_IMMUNE_SYSTEM	1	1	0.0734506395765841	0.52115317788252	1000	408	HNRNPA2B1, UBE2V1, MAPK9, HMGB1, ATF2, PRKACA, GRB2, SOCS5, BIRC2, MAPK8, UBE2N, VAMP2, PPP2CA, TAB1, MAP3K7, UBA3, AKT1, RBX1, POM121, PSMF1, SH2B1, ARIH1, CDC42, MAP2K1, NUP54, MAPK14, PIN1, NUP62, CRKL, UBE2D2, NUP133, POM121C, RNF7, NUP43, SUMO1, RALA, PPP2R5D, MAPK1, BRWD1, BTRC, TAB3, TRIM3, NUP155, SOCS6, IFNAR1, PSMD10, CREB1, NUP58, EIF4G2, ELOB, EIF4E, AKT2, YES1, NUP160, MTAP, NKIRAS2, PSMB1, MAP2K4, UBA52, RAE1, ARF1, PAK2, PPP2R1A, TPR, CUL1, NUP153, EIF4E3, SKP1, MAP2K7, NUP205, PTPN23, YWHAZ, TCP1, CAMK2B, NKIRAS1, KPNA4, PSMC6, CDKN1B, UBE2E1, PSMC2, SEC13, PSMB10, RELA, PSMD9, NUP107, NUP98, KPNA3, NFKB1, UBE2D3, ABL2, CAMK2G, PIK3CA, EIF2AK2, ATF1, RANBP2, NUP37, VRK3, SEM1, MAP3K3
REACTOME_P130CAS_LINKAGE_TO_MAPK_SIGNALING_FOR_INTEGRINS	0.971090670170828	0.993075258434721	0.179909755079859	0.520640820693773	738	7	PTK2, TLN1, RAP1B, RAP1A
REACTOME_INTERLEUKIN_12_FAMILY_SIGNALING	0.975583864118896	0.994453958202434	0.106099261169816	0.519276676769859	918	36	HNRNPA2B1, CDC42, RALA, MTAP, ARF1, PAK2, TCP1, SOD1, HSPA9, AIP, PITPNA, RAP1B, VAMP7, P4HB, PDCD4, SNRPA1, PSME2, CFL1, TALDO1, RPLP0, CAPZA1, CANX, MSN, JAK1, JAK2
REACTOME_SIGNALING_BY_KIT_IN_DISEASE	0.98932384341637	0.999700479233227	0.135996103263517	0.504805981899141	833	14	GRB2, YES1, PIK3CA, KRAS, STAT5B, SOS1, NRAS, FYN, JAK2, STAT5A, STAT3, PIK3R3, PIK3R1, SRC
REACTOME_SIALIC_ACID_METABOLISM	0.976985040276179	0.994891102625909	0.119221346196887	0.499651272341459	848	21	ST3GAL3, GNE, GLB1, CMAS, SLC35A1, NEU3, NEU1, CTSA, ST6GALNAC6, SLC17A5, ST3GAL2, ST6GALNAC4, ST3GAL1, ST3GAL6, ST6GALNAC2, ST8SIA5, ST6GAL1, ST3GAL4
REACTOME_GAMMA_CARBOXYLATION_HYPUSINE_FORMATION_AND_ARYLSULFATASE_ACTIVATION	0.977900552486188	0.994891102625909	0.11289344384597	0.498054331104916	884	25	DHPS, EEF2, DPH7, DPH1, DNAJC24, SUMF2, FN3KRP, GGCX, DPH5, F8, ARSB, DPH6, ARSA, DOHH, GAS6, SUMF1, DPH2, DPH3, FURIN, TPST2, PROS1, ICMT, ARSG
REACTOME_TRANSMISSION_ACROSS_CHEMICAL_SYNAPSES	0.989	0.999700479233227	0.0807231860811488	0.495162989640853	988	112	PRKACA, VAMP2, ARHGEF7, ADCY6, PPFIA1, MAPK1, RAC1, PDPK1, LIN7C, CREB1, AP2M1, PRKAR2A, AP2B1, GNB1, GNG10, CAMK2B, PRKAG1, CASK, PRKAA1, GNAI3, GNB2, DNAJC5, CAMK2G, GNAI2, PRKACB, ARL6IP5, AP2S1, GLS, AP2A2, KRAS, PRKAB2, AP2A1, NBEA, RASGRF2, LRTOMT, COMT, MYO6, CACNB1, MAPT, NAAA, EPB41L1, GNG12, CACNA2D2, RPS6KA3, GNAI1, PLCB3, CAMKK2, CAMK2D, ADCY2, HSPA8, ADCY4, ARHGEF9, PPM1F, CACNA2D3, TSPAN7, NRAS, DLG4, PICK1
REACTOME_SIGNALING_BY_PDGFRA_TRANSMEMBRANE_JUXTAMEMBRANE_AND_KINASE_DOMAIN_MUTANTS	0.974747474747475	0.994242424242424	0.157301632968513	0.49508006636744	771	9	GRB2, PIK3CA, KRAS, SOS1, NRAS, PIK3CB, STAT3, PDGFRA, PIK3R1
REACTOME_SIGNALING_BY_INTERLEUKINS	1	1	0.0723059900310648	0.494910563430386	1000	265	HNRNPA2B1, UBE2V1, MAPK9, HMGB1, ATF2, PRKACA, GRB2, SOCS5, MAPK8, UBE2N, VAMP2, PPP2CA, TAB1, MAP3K7, AKT1, RBX1, PSMF1, CDC42, MAP2K1, MAPK14, CRKL
REACTOME_ASSEMBLY_AND_CELL_SURFACE_PRESENTATION_OF_NMDA_RECEPTORS	0.98932384341637	0.999700479233227	0.132564423344696	0.492067877575467	833	14	LIN7C, CAMK2B, CASK, CAMK2G
REACTOME_SYNTHESIS_OF_PA	0.98232044198895	0.996821963276335	0.110759667216543	0.488640704806593	888	25	DDHD2, AGPAT1, PLA2G12A, DDHD1, MIGA1, GNPAT, AGPAT5, AGPAT3, LCLAT1, GPD1L, PLD2, ACP6, GPAT4, PLA2G4B, LPCAT4, PLD1
REACTOME_SYNTHESIS_OF_BILE_ACIDS_AND_BILE_SALTS_VIA_7ALPHA_HYDROXYCHOLESTEROL	0.983173076923077	0.997047231953422	0.138477740689919	0.488580577686497	817	12	HSD17B4, SCP2, NCOA1, ACOT8, RXRA
REACTOME_GRB2_EVENTS_IN_ERBB2_SIGNALING	0.991293532338308	1	0.149696470919015	0.487455543440385	796	10	GRB2, KRAS, ERBB2, SOS1, NRAS, EGFR, EGF, ERBB4, NRG4, NRG2
REACTOME_NICOTINATE_METABOLISM	0.979591836734694	0.995970864229936	0.114082958109818	0.485170899175227	863	22	NAXD, NADK2, NAXE, NMRK1, NUDT12, PARP6, NMNAT3, PARP16, NADSYN1, PARP10, PARP4, NADK
REACTOME_DISEASES_OF_METABOLISM	0.995	1	0.0749090859183008	0.477409453093411	994	149	IDS, HLCS, LMBRD1, PCCA, POMT1, ST3GAL3, RPIA, FDX1, ALG12, GNE, MMADHC, ALG13, MMAB, GLB1, DPM3, HGSNAT, UBA52, MCCC1, EPM2A, MCCC2, GFPT1, B4GALT7, MTRR, DPM1, ABCD4, MTR, GAA, SGSH, MPI, GCLC, GNS, MOGS, UBB, HEXA, NOTCH1, C1GALT1C1, RPS27A, PGM1, CYP2U1, ALG6, GSS, MAN1B1, NEU1, TPMT, NOTCH4, ALG9, B4GAT1, ACY1, DAG1, G6PC3, ALG8, PCCB, POMGNT1, ARSB, CHST14, CYP2R1, GUSB, CTSA, OPLAH, THSD1, EXT2, GALK1, GYG1, DHDDS, AHCY, EXT1, C1GALT1, NUS1, SLC37A4, DPM2, BTD, TALDO1, ALG1, DPAGT1, GALNS, GPC1, GALT, FDX2, SLC35D1, GYS1, ADAMTS13, HSPG2, GALE, AGRN, ALG3, NAGLU, B3GALT6, NOTCH2, GPC4, SRD5A3
REACTOME_TRANSPORT_OF_SMALL_MOLECULES	1	1	0.0671946894146764	0.475612799702513	1000	398	PMPCA, PHB2, YME1L1, PMPCB, PRKACA, GNAS, ATP6V1G1, HDLBP, ATP6AP1, ADCY6, PEX19, PSMF1, VDAC1, FBXL5, ABCB7, TRPC4AP, NEDD8, SLC35A3, PARL, ATP6V1H, ERLEC1, ZDHHC8, SMDT1, VDAC2, ABCA2, ATP6V0C, FXYD1, ADD1, ABCB10, MBTPS1, ATP6V1C1, RNF185, PSMD10, ATP6V1D, SAR1B, STOML2, RNF5, SLC2A8, PEX3, PSMB1, SLC25A26, UBA52, SLC30A5, MBTPS2, SLC9A6, AP2M1, VCP, PRKAR2A, AHCYL2, AP2B1, ATP7A, CUL1, GNB1, SKP1, ATP11B, IREB2, ATP6V1A, MAGT1, ATP6V1F, LDLRAP1, ACO1, ERLIN2, ATP6V1B2, MAIP1, GNG10, SLC35A1, CAMK2B, MMGT1, PSMC6, PSMC2, SLC39A6, ATP2B1, ARL2, LMF2, PSMB10, RAB11FIP2, PSMD9, SLC35B3, GNB2, MICU1, ASPH, TTYH2, CLTC, ATP6V0D1, CAMK2G, NIPA1, PRKACB, SEM1, SGK3, AP2S1, ATP7B, ANO8, SLC8B1, MICU3, AP2A2, RYR1, MRS2, CAND1, DERL1, ANO10, PSMB7, SLC33A1, SRI, ATP2C1, PSMD13, UBB, WWP1, PDZD11, PSMD1, ATP11A, CLCN3, PSMB4, SLC12A6, OS9, TRPM7, RPS27A, AP2A1, RAF1, ABCF1, PSMC3, ATP1A2, PSMB6, GLRX3, DERL2, MCOLN1, PSMB5, RIPK1, PSMB3, SLC31A1, RAB11A, CYB5R1, EIF2S3, DMTN, PSMA1, EIF2S2, ATP6V0A2, WNK2, ABCC9, ABCC10, SLC9A8, PSMD4, NR1H2, SLC35B4, ANO1, PSMA3, GNG12, PSME3, SLC35A2, SLC2A11, EIF2S1, HMOX2, BSG, SLC4A2, CYB5R4, SLC15A3, FXYD6, PSMA6, PSMA2, ERLIN1, ATP6V0E1, ABCD3, CAMK2D, WNK1, SCARB1, ATP6V1E1, P4HB, CYB5RL, MCU, PSMB2, PSMD6, CYGB, ADCY2, SLC30A6, AKAP1, PSME1, PSMD3, ADCY4, TPCN2, ANKH, ATP13A1, PSMC1, CUTC, SLC25A29, PSME2, SLC12A4, SLC4A7, SLC35C1, SLC26A11, OSTM1, LRRC8A, PSMC5, SLCO3A1, SLC15A4, TPCN1, SLC44A1, SLC17A5, TRDN, PSMA5, SEL1L, ABCB8, TRPV1, SLC2A4, SLC39A7, SLC39A1, SLC27A1, ATP6V0A1, ATP9B, ANO6
REACTOME_L1CAM_INTERACTIONS	0.993927125506073	1	0.0787672306669639	0.441741345421101	981	64	NUMB, MAP2K1, DNM2, MAPK1, CSNK2A1, RAC1, RDX, MAP2K2, AP2M1, AP2B1, CSNK2A2, SDCBP, CLTC, SPTBN1, AP2S1, AP2A2, LYPLA2, RANBP9, AP2A1, ITGAV, LAMC1, SPTAN1, ITGB1, FGFR1, RPS6KA3, RPS6KA4, ITGA1, HSPA8, RPS6KA5, SCN4A, ANK2, DLG4, DPYSL2
REACTOME_HEPARAN_SULFATE_HEPARIN_HS_GAG_METABOLISM	0.993506493506494	1	0.0904927479001242	0.424920458842224	917	31	IDS, XYLT2, GLB1, HGSNAT, B4GALT7, SGSH, NDST2, GLCE, HS2ST1, GUSB, EXT2, EXT1, HS6ST1, GPC1, HSPG2, AGRN, NAGLU, B3GALT6, GPC4, SDC3
REACTOME_ACYL_CHAIN_REMODELLING_OF_PI	0.996057818659658	1	0.145221368635023	0.420256102926995	757	7	PLA2G12A, PLBD1, MBOAT7, PLA2G4C
REACTOME_FATTY_ACYL_COA_BIOSYNTHESIS	0.997750281214848	1	0.0968248976254403	0.417376818873686	886	23	CBR4, ACSF3, TECR, HACD3, ACSL3, HACD2, PPT1, HSD17B12, MORC2, ELOVL1, ACLY, ELOVL5, ACSL5, HSD17B8
REACTOME_GLYCOSPHINGOLIPID_METABOLISM	0.996732026143791	1	0.0835102532865779	0.380725235335161	914	28	SMPD4, GALC, GLB1, GLTP, SUMF2, NEU3, HEXA, GBA2, NEU1, ARSB, CTSA, ASAH1, ARSA, ESYT2, ESYT1, SUMF1, GM2A, PSAP, GLA, CPTP, SMPD2, B4GALNT1, ARSG, GBA, UGCG
REACTOME_SIGNALING_BY_ERBB4	0.99789029535865	1	0.0735883768854828	0.363313458493876	945	37	GRB2, NCOR1, NCSTN, UBA52, PSEN1, PSEN2, PIK3CA, ITCH, KRAS, UBB, WWP1, RPS27A, MXD4, TAB2, SOS1, PSENEN, APH1B, NRAS, DLG4, SHC1, ADAM17, STMN1, SPARC, STAT5A, EGFR, EGF
REACTOME_TRANSCRIPTIONAL_REGULATION_BY_THE_AP_2_TFAP2_FAMILY_OF_TRANSCRIPTION_FACTORS	1	1	0.080489124371894	0.328044779810483	866	19	SUMO1, UBE2I, DEK, KDM5B, YEATS4, YY1, ERBB2
REACTOME_AFLATOXIN_ACTIVATION_AND_DETOXIFICATION	0.974358974358974	0.994242424242424	-0.169834980385431	-0.511929145680017	265	6	GGT7, MGST1, MGST3, MGST2, ACY1
REACTOME_PHASE_3_RAPID_REPOLARISATION	0.989583333333333	0.999700479233227	-0.322954169504719	-0.558304624103806	379	2	KCNE4, AKAP9
REACTOME_SYNTHESIS_OF_UDP_N_ACETYL_GLUCOSAMINE	0.95970695970696	0.990328610783156	-0.186020578365033	-0.560716970939651	261	6	GFPT2, UAP1, AMDHD2, GNPNAT1
REACTOME_GAB1_SIGNALOSOME	0.994117647058824	1	-0.131178647716161	-0.567401943597824	168	12	AREG, SRC, PIK3R1, GAB1, EGF, EGFR, PTPN11
REACTOME_ZINC_EFFLUX_AND_COMPARTMENTALIZATION_BY_THE_SLC30_FAMILY	0.9644128113879	0.990328610783156	-0.210411972183942	-0.577783218713694	270	5	SLC30A2, SLC30A1, SLC30A7, SLC30A6
REACTOME_SIGNALING_BY_FLT3_ITD_AND_TKD_MUTANTS	0.981707317073171	0.996821963276335	-0.128983639621272	-0.584513164749722	160	13	PIM1, CDKN1A, GAB2, PIK3R1, BCL2L1, STAT5A, PTPN11, NRAS, SOS1, STAT5B, KRAS, PIK3CA
REACTOME_ATTENUATION_PHASE	0.962962962962963	0.990328610783156	-0.111354948309815	-0.595140665327896	129	19	HSPA1A, DNAJB1, HSPA2, SERPINH1, HSPH1, COL4A6, HSPB1, FKBP4, HSP90AA1, TNFRSF21
REACTOME_SYNTHESIS_OF_BILE_ACIDS_AND_BILE_SALTS	0.945205479452055	0.984496634026928	-0.113072727709436	-0.599147918606735	137	18	AKR1C3, AKR1C1, AKR1C2, OSBPL3, OSBPL6, PTGIS, HSD3B7, ACOX2, OSBPL9, CYP27A1
REACTOME_BILE_ACID_AND_BILE_SALT_METABOLISM	0.945205479452055	0.984496634026928	-0.113072727709436	-0.599147918606735	137	18	AKR1C3, AKR1C1, AKR1C2, OSBPL3, OSBPL6, PTGIS, HSD3B7, ACOX2, OSBPL9, CYP27A1
REACTOME_FOXO_MEDIATED_TRANSCRIPTION_OF_CELL_CYCLE_GENES	0.981707317073171	0.996821963276335	-0.133141126747769	-0.603353584859202	160	13	GADD45A, CDKN1A, CCNG2, FOXO1, BTG1, FOXO3, CAV1, SMAD3, PCBP4
REACTOME_RHO_GTPASES_ACTIVATE_ROCKS	0.938356164383562	0.982027515168097	-0.116644404211092	-0.618073459586011	136	18	MYH11, MYL9, LIMK1, MYH10, RHOB, LIMK2, PAK1, MYH14, ROCK2, MYH9, CFL1, RHOA, MYL6
REACTOME_ACTIVATION_OF_RAS_IN_B_CELLS	0.913544668587896	0.969887793624161	-0.296808096535617	-0.62171550928305	316	3	RASGRP3, NRAS, KRAS
REACTOME_SYNTHESIS_OF_VERY_LONG_CHAIN_FATTY_ACYL_COAS	0.959731543624161	0.990328610783156	-0.129676539360873	-0.631118161760698	142	15	ACSL4, ACSL6, TECRL, ACSL1, HACD1, SLC27A3, ACSL5, ELOVL5, ELOVL1, HSD17B12, HACD2, ACSL3, HACD3, TECR, ACSF3
REACTOME_DISEASES_OF_IMMUNE_SYSTEM	0.953020134228188	0.98825122418565	-0.130585280670424	-0.635540882690996	141	15	S100A8, CD14, NFKB2, TLR4, CD36, S100A1, MYD88, NFKBIA, UNC93B1, IRAK4, IKBKB, IKBKG
REACTOME_TRANSPORT_AND_SYNTHESIS_OF_PAPS	0.907407407407407	0.967626003619994	-0.26059482886499	-0.640311361930399	293	4	SLC26A2, PAPSS2, PAPSS1
REACTOME_FORMATION_OF_XYLULOSE_5_PHOSPHATE	0.9140625	0.969887793624161	-0.375887905030651	-0.649813426608317	350	2	DCXR, CRYL1
REACTOME_CYTOSOLIC_SULFONATION_OF_SMALL_MOLECULES	0.90948275862069	0.967626003619994	-0.184889494693798	-0.662536296531075	210	8	SLC26A2, TPST2, PAPSS2, PODXL2, PAPSS1, ABHD14B, SLC35B3, BPNT1
REACTOME_GLUTATHIONE_CONJUGATION	0.916030534351145	0.971136434892218	-0.1221317475361	-0.663018809893215	119	20	GSTM1, CHAC1, GGT7, MGST1, GSTM5, GCLM, GSTM2, MGST3, GSTO1, MGST2, GSTM3, OPLAH, GSTA4, GSS, GSTK1, CNDP2, GCLC, GSTP1
REACTOME_CASPASE_ACTIVATION_VIA_DEPENDENCE_RECEPTORS_IN_THE_ABSENCE_OF_LIGAND	0.90948275862069	0.967626003619994	-0.186252555739461	-0.667420713672431	210	8	UNC5B, DAPK1, CASP3, DAPK2, MAGED1, DAPK3, CASP9, APPL1
REACTOME_MISCELLANEOUS_SUBSTRATES	0.8984375	0.966278698979592	-0.388829424929454	-0.672185983102986	344	2	CYP4B1, CYP2U1
REACTOME_SYNTHESIS_OF_16_20_HYDROXYEICOSATETRAENOIC_ACIDS_HETE	0.8984375	0.966278698979592	-0.388829424929454	-0.672185983102986	344	2	CYP1B1, CYP2U1
REACTOME_HISTIDINE_CATABOLISM	0.855907780979827	0.945254206047979	-0.322596340988712	-0.675733414187971	296	3	CARNS1, HNMT, CARNMT1
REACTOME_METABOLISM_OF_INGESTED_SEMET_SEC_MESEC_INTO_H2SE	0.879003558718861	0.956495258513055	-0.247031341249757	-0.678338603972924	246	5	NNMT, CTH, HNMT, AHCY, SCLY
REACTOME_LDL_REMODELING	0.974358974358974	0.994242424242424	-0.514594279042615	-0.684830313323416	493	1	P4HB
REACTOME_TNF_RECEPTOR_SUPERFAMILY_TNFSF_MEMBERS_MEDIATING_NON_CANONICAL_NF_KB_PATHWAY	0.883620689655172	0.958822450476889	-0.191932381918744	-0.687773903603502	204	8	TNFRSF12A, BIRC3, MAP3K14, TRAF2, LTBR, CD40, TNFSF12
REACTOME_ACYL_CHAIN_REMODELING_OF_DAG_AND_TAG	0.861979166666667	0.947038959346769	-0.39885180500146	-0.689512098283068	330	2	DGAT2, MGLL
REACTOME_MRNA_EDITING	0.824207492795389	0.934101825168108	-0.32948943945834	-0.690172192225379	285	3	APOBEC2, ADARB1
