pathway	pval	padj	ES	NES	nMoreExtreme	size	leadingEdge
REACTOME_ACETYLCHOLINE_REGULATES_INSULIN_SECRETION	0.920052424639581	0.995404274971384	0.286953136349401	0.644555561865094	701	7	MARCKS, PLCB2, PLCB3, GNAQ
REACTOME_PROCESSING_AND_ACTIVATION_OF_SUMO	0.910967741935484	0.992405606599155	0.275971543570467	0.643703885171047	705	8	SAE1, SENP1, SUMO2, UBE2I
REACTOME_METABOLISM_OF_AMINO_ACIDS_AND_DERIVATIVES	0.998001998001998	1	0.166993600066602	0.643640610753348	998	254	RIMKLB, PSMB8, PSMB9, GLS, CSAD, RPL3, ALDH18A1, AFMID, TSTD1, MTAP, AZIN2, AMT, PSME2, PHYKPL, MTR, PNMT, MRI1, ASL, NNMT, GAMT, RPL31, SERINC5, RPS8, RPL12, RPL35A, HYKK, RPL36A, SLC44A1, HNMT, SMS, SLC25A13, PSME1, FAH, RPL36, RPL24, INMT, RPS27A, RPL28, RPL10A, RPL15, RPS9, PAPSS1, RPL34, RPS6, RPL11, ASRGL1, RPS11, PSMD10, RPL35, RPL17, RPS19, RPS4X, RPL13, RPL23A, RPL18A, RPL7A, RPS17, SEPSECS, RPL37, SCLY, CDO1, ALDH7A1, ASPA, RPL13A, RPL19, FAU, NQO1, RPL23, ENOPH1, RPS18, RPS15, RPS24, NMRAL1, RPS3A, RPL26, RPL7, RPL22, RPS3, RPL29, RPS16, SRM, RPS20, DDO, RPS5, RPL14, RPL6, ADI1, RPS7, PSMB10, RPS12, RPL9, BCKDHA, RPS2, TPO, RPS21, RPL4, RPL5, RPS23, RPS27, RPS25, AZIN1, RPL37A, UBA52, PAPSS2, PAOX, RPL32, RPL41
REACTOME_ROS_AND_RNS_PRODUCTION_IN_PHAGOCYTES	0.903440621531632	0.990827164467332	0.215526635395117	0.642942509716724	813	21	TCIRG1, HVCN1, CYBA, SLC11A1, ATP6V1C1, ATP6V1A, ATP6V0A1, ATP6V0D1, ATP6V1F
REACTOME_HCMV_LATE_EVENTS	0.939672801635992	1	0.188977949416033	0.641073766726037	918	46	CHMP4A, NUP155, VPS28, AAAS, NUP160, CEBPD, NUP107, NUP85, NUP35, POM121C, NUP93, NUP50, VPS37B, POM121, NUP54, NUP43, RAE1, NUP133, TPR, NUP205, NUP62, NUP153, HNRNPK
REACTOME_MYD88_INDEPENDENT_TLR4_CASCADE	0.966867469879518	1	0.177603377093838	0.640374225935178	962	77	IRF3, MAP3K8, NOD1, BIRC3, NFKB2, PPP2R1B, JUN, MAPK11, SAA1
REACTOME_DEFECTS_IN_VITAMIN_AND_COFACTOR_METABOLISM	0.908881199538639	0.992405606599155	0.22577773194022	0.637898005643201	787	16	ABCD4, MTR, ACACA, MMAB, TCN2
REACTOME_VESICLE_MEDIATED_TRANSPORT	1	1	0.16163690648243	0.63661742777353	1000	486	ACTG1, MYH9, SRC, RIN1, SEC24D, APOL1, SCARF1, COL7A1, AMPH, RAB27A, LRP1, ACTB, SSC5D, TRAPPC6A, TMED3, C2CD5, SEC16B, STX6, MAN1C1, STX16, GDI1, MYO1C, TRAPPC2, NECAP2, RIN3, DYNLL1, GRK3, STON1, NECAP1, SH3GL1, RAB3IL1, SAA1, SPTAN1, COL1A1, RAB13, FCHO2, TBC1D2, SGIP1, LDLR, CHMP4A, ARF5, GJA1, PIK3C2A, RAB31, STAB1, AREG, YWHAH, VPS28, COL4A2, TUBA1A, KIFC2, MAN1A1, ARPC5, ARFGAP1, COLEC12, PICALM, COL4A1, GJA4, APP, AP2A2, CBL, GOLIM4, SEC22A, AP3S1, NAPB, DAB2, RIN2, PAFAH1B2, DENND6A, COL1A2, TBC1D10A, FTL, KIF13B, ARPC1A, RHOBTB3, TBC1D16, MYO6, SCARB1, BET1, PLA2G6, ARF4, RPS27A, DNM1, VPS54, HSP90B1, COG5
REACTOME_ERBB2_REGULATES_CELL_MOTILITY	0.893827160493827	0.98534102124565	0.253969914052762	0.635397823787558	723	10	ERBB3, ERBB4, ERBB2, RHOA
REACTOME_PHYSIOLOGICAL_FACTORS	0.915549597855228	0.994350704295456	0.295185734572583	0.634687932275436	682	6	WWTR1, NPR1, NPR2
REACTOME_ROLE_OF_LAT2_NTAL_LAB_ON_CALCIUM_MOBILIZATION	0.907006369426752	0.992215736074359	0.261890010540688	0.632331373326943	711	9	FYN, SHC1, PIK3CA, PDPK1, GRB2, SOS1, GAB2
REACTOME_DOWNREGULATION_OF_ERBB2_ERBB3_SIGNALING	0.910179640718563	0.992405606599155	0.241089211508473	0.631356378816702	759	12	ERBB3, RPS27A, ERBB2, AKT3, AKT2, UBA52, AKT1
REACTOME_MAP3K8_TPL2_DEPENDENT_MAPK1_3_ACTIVATION	0.915411355735805	0.994350704295456	0.2312026501686	0.630826757273412	789	14	MAP3K8, RPS27A
REACTOME_ATF6_ATF6_ALPHA_ACTIVATES_CHAPERONE_GENES	0.902469135802469	0.990827164467332	0.249803003686944	0.62497278667939	730	10	NFYA, HSP90B1, ATF6, NFYC, CALR, DDIT3, HSPA5
REACTOME_HDL_CLEARANCE	0.970826580226904	1	0.403016232673025	0.623417025800783	598	2	SCARB1
REACTOME_PI5P_REGULATES_TP53_ACETYLATION	0.92627345844504	0.996847051690162	0.289052768924949	0.621501254093818	690	6	TP53, PIP4K2A, PIN1
REACTOME_INTERLEUKIN_15_SIGNALING	0.919512195121951	0.995404274971384	0.243032286831764	0.620860801187833	753	11	IL15, IL15RA
REACTOME_HIV_LIFE_CYCLE	0.992	1	0.16638904819804	0.619212594239121	991	129	CXCR4, LIG1, CCNT2, TAF1, CHMP4A, NUP155, VPS28, AAAS, NUP160, NUP107, GTF2H4, NUP85, RPS27A, NCBP1, NELFE, NUP35, XPO1, PPIA, NELFA, NMT2, PSIP1, POM121C, POLR2H, TAF4, CHMP5, NUP93, NUP50, GTF2F1, VPS37B, POM121, TAF9, GTF2B, CCNT1, TAF9B, ERCC2, GTF2H3, RANGAP1, NELFCD, RANBP1, NUP54, RNMT, NUP43, RAE1, NUP133, UBA52, TAF4B, TAF12, POLR2A, POLR2G, SUPT16H, TPR, CDK9, NUP205, ELL, NUP62, NELFB, NUP153
REACTOME_GLYCOLYSIS	0.959349593495935	1	0.17574591446498	0.615656081914147	943	58	ENO2, PPP2R1B, PFKL, NUP155, AAAS, NUP160, NUP107, NUP85, NUP35, PFKP, ADPGK, PRKACB, PGAM1, POM121C, NUP93, NUP50, PFKFB2, POM121, ENO1, NUP54, NUP43, RAE1, NUP133, TPR, NUP205, PFKFB4, NUP62, NUP153
REACTOME_HCMV_INFECTION	0.979919678714859	1	0.170807232899418	0.614561028531735	975	76	PML, DYNLL1, CHMP4A, NUP155, VPS28, TUBA1A, AAAS, NUP160, CEBPD, NUP107, NUP85, NUP35, CREB1, EZH2, TRIM28, POM121C, TBL1XR1, NUP93, NUP50, VPS37B, POM121, SUZ12, EED, NUP54, NUP43, RAE1, NUP133, RBBP4, EGFR, TPR, NUP205, DYNC1I2, NUP62, NUP153
REACTOME_DNA_DAMAGE_REVERSAL	0.928954423592493	0.996847051690162	0.285184246835395	0.613183425694908	692	6	MGMT, ALKBH2
REACTOME_POLB_DEPENDENT_LONG_PATCH_BASE_EXCISION_REPAIR	0.928954423592493	0.996847051690162	0.285176236225706	0.613166201836489	692	6	LIG1, PARP2, APEX1
REACTOME_PROTEIN_METHYLATION	0.929161747343565	0.996847051690162	0.228628336376564	0.612068009744278	786	13	EEF1A1, EEF1AKMT1, CAMKMT, VCPKMT, RPS2
REACTOME_TRANSPORT_TO_THE_GOLGI_AND_SUBSEQUENT_MODIFICATION	0.988011988011988	1	0.163882596674719	0.610628393915481	988	133	SEC24D, COL7A1, TRAPPC6A, TMED3, SEC16B, FUCA1, MAN1C1, TRAPPC2, DYNLL1, SPTAN1, ARF5, AREG, TUBA1A, MAN1A1, MGAT5, ARFGAP1, SEC22A, NAPB, ST3GAL4, BET1, ARF4, COG5, COG8
REACTOME_MITOTIC_SPINDLE_CHECKPOINT	0.96579476861167	1	0.170152833882627	0.609171073037931	959	71	PPP2R1B, DYNLL1, CENPC, ANAPC7, KNTC1, ANAPC2, NUP160, RCC2, NUP107, NUP85, XPO1, ITGB3BP, MAD1L1, NDEL1, CENPP, SKA2, MAPRE1, ANAPC10, BUB3, NUDC, RANGAP1, ANAPC1, NUP43, NUP133, RPS27, CLASP2, CLASP1, ANAPC16, DYNC1I2, CDC23, AHCTF1, NDE1, NSL1
REACTOME_RAB_REGULATION_OF_TRAFFICKING	0.97997997997998	1	0.165497719896565	0.608081775003235	978	100	RIN1, RAB27A, TRAPPC6A, GDI1, TRAPPC2, RIN3, RAB3IL1, RAB13, TBC1D2, RAB31, RIN2, DENND6A, TBC1D10A, TBC1D16, HPS4, TBC1D24, RAB6B, DENND2A, ALS2CL, TRAPPC2L, DENND3, RAB14, SBF2
REACTOME_TNFR1_INDUCED_PROAPOPTOTIC_SIGNALING	0.923566878980892	0.996847051690162	0.25171572895338	0.607765650352495	724	9	TRAF2, USP4, RIPK1, TRADD, TNFRSF1A, CYLD
REACTOME_RESOLUTION_OF_SISTER_CHROMATID_COHESION	0.969758064516129	1	0.169774587886231	0.6056961110841	961	68	PPP2R1B, DYNLL1, CENPC, TUBA1A, KNTC1, NUP160, RCC2, NUP107, NUP85, XPO1, ITGB3BP, MAD1L1, NDEL1, CENPP, SKA2, MAPRE1, PDS5B, BUB3, NUDC, RANGAP1, HDAC8, NUP43, NUP133, RPS27, CLASP2, CLASP1
REACTOME_HDR_THROUGH_MMEJ_ALT_NHEJ	0.939711664482307	1	0.268109853783943	0.602229686860291	716	7	MRE11, XRCC1, PARP2
REACTOME_DNA_DOUBLE_STRAND_BREAK_RESPONSE	0.956745623069001	1	0.18031735002434	0.601877381762153	928	40	ATM, MDC1, TP53, MRE11, RPS27A, ABL1, BARD1, TP53BP1, EYA2, UBE2I, UBA52, KAT5, UIMC1, BRCA1, EYA3, EYA1, PIAS4, NBN, APBB1
REACTOME_RAS_PROCESSING	0.935195530726257	1	0.203317930061424	0.600570163670156	836	20	BCL2L1, RPS27A, ABHD17A, RCE1, UBA52, ABHD17B, ARL2, ZDHHC9, KRAS, NRAS
REACTOME_IKK_COMPLEX_RECRUITMENT_MEDIATED_BY_RIP1	0.931228861330327	0.997881233818183	0.206838747603333	0.600332778039673	825	18	BIRC3, RPS27A, TLR4, RIPK1, UBA52, TRAF6, CD14
REACTOME_RESPONSE_TO_METAL_IONS	0.941022280471822	1	0.267079610757779	0.599915549851597	717	7	CSRP1, MT1X, MT1M, MT1A, MT2A, MT1E
REACTOME_TICAM1_RIP1_MEDIATED_IKK_COMPLEX_RECRUITMENT	0.942196531791908	1	0.215291787767472	0.599068665574774	814	15	BIRC3, RPS27A, RIPK1, UBA52, TRAF6
REACTOME_N_GLYCAN_ANTENNAE_ELONGATION	0.92962962962963	0.996847051690162	0.238994106854186	0.59793041218911	752	10	MGAT5, ST3GAL4, MGAT4A, B4GALT1, B4GALT4
REACTOME_ASPARAGINE_N_LINKED_GLYCOSYLATION	0.998001998001998	1	0.15511435621176	0.595085364102427	998	224	SEC24D, COL7A1, ENGASE, TRAPPC6A, TMED3, ST6GALNAC4, SEC16B, FUCA1, MAN1C1, ALG13, TRAPPC2, TUSC3, NAGK, DYNLL1, GFPT2, MAN1B1, SPTAN1, UGGT2, ARF5, AREG, TUBA1A, MAN1A1, MGAT5, ARFGAP1, SRD5A3, PRKCSH, SEC22A, NAPB, ST3GAL4, ALG10B, ALG8, ALG6, BET1, MOGS, ARF4, RPS27A, COG5, AMDHD2, ALG9, MVD, COG8
REACTOME_COPII_MEDIATED_VESICLE_TRANSPORT	0.976578411405295	1	0.169210132055338	0.591171406937629	958	57	SEC24D, COL7A1, TRAPPC6A, SEC16B, TRAPPC2
REACTOME_DSCAM_INTERACTIONS	0.947575360419397	1	0.262796064051974	0.590293825939253	722	7	MAPK11, NTN1, MAPK14
REACTOME_TRAFFICKING_OF_AMPA_RECEPTORS	0.943630214205186	1	0.20176785019412	0.585614907408078	836	18	MDM2, AP2A2, MYO6, EPB41L1, CAMK2D, CAMK2B, AP2B1, DLG4, AP2M1, CAMK2A, TSPAN7, AP2S1
REACTOME_INSULIN_RECEPTOR_SIGNALLING_CASCADE	0.950537634408602	1	0.187946607452865	0.585013527513609	883	26	FGF2, FGFR1, PIK3R4, FGFR4, FRS2, SHC1, AKT2, FGF1, KRAS, NRAS, THEM4, GAB1, IRS2, PIK3CA, PDPK1, GRB2, SOS1
REACTOME_NEGATIVE_REGULATION_OF_ACTIVITY_OF_TFAP2_AP_2_FAMILY_TRANSCRIPTION_FACTORS	0.959641255605381	1	0.335677890597313	0.582457682708902	641	3	KCTD15, UBE2I
REACTOME_PHASE_0_RAPID_DEPOLARISATION	0.945885005636979	1	0.199831144368267	0.579993774993808	838	18	SCN5A, CACNA1C, CACNA2D2, CAMK2D, CAMK2B, SCN3B, FGF11, SCN7A, CAMK2A
REACTOME_METABOLISM_OF_STEROIDS	0.987963891675025	1	0.157804345249427	0.574034612472215	984	87	SEC24D, MVK, FDXR, NFYA, HELZ2, TSPOAP1, SCD, MBTPS1, SRD5A3, SMARCD3, MSMO1, MVD, HSD3B7, SCAP, SREBF1, OSBPL6, CYP2R1, ACACA, TBL1XR1, LBR, HSD17B11, EBP, SUMO2, ACOX2, STARD3
REACTOME_APC_CDC20_MEDIATED_DEGRADATION_OF_NEK2A	0.957824639289678	1	0.192416759564059	0.574002902605875	862	21	ANAPC7, ANAPC2, RPS27A, ANAPC10, BUB3, ANAPC1, UBA52, ANAPC16, CDC23
REACTOME_TRAF6_MEDIATED_INDUCTION_OF_TAK1_COMPLEX_WITHIN_TLR4_COMPLEX	0.950413223140496	1	0.213748734445597	0.572233365955092	804	13	RPS27A, TAB1, MAP3K7, TLR4, UBA52, TRAF6, CD14
REACTOME_FREE_FATTY_ACIDS_REGULATE_INSULIN_SECRETION	0.961290322580645	1	0.243636904049049	0.568283308048292	744	8	PLCB2, PLCB3, ACSL3, GNAQ, CD36, PLCB1
REACTOME_FORMATION_OF_TC_NER_PRE_INCISION_COMPLEX	0.977596741344195	1	0.165943816573589	0.565857751564833	959	47	HMGN1, XAB2, GTF2H4, AQR, RPS27A, UVSSA, POLR2H, ZNF830, PPIE, ERCC6, ERCC2, GTF2H3, CUL4B, RBX1, GPS1, XPA, UBA52, COPS7B, POLR2A, POLR2G, COPS6
REACTOME_ERKS_ARE_INACTIVATED	0.948780487804878	1	0.219536875388766	0.560838405962479	777	11	PPP2R1B, DUSP6, DUSP4, MAPK7
REACTOME_CONVERSION_FROM_APC_C_CDC20_TO_APC_C_CDH1_IN_LATE_ANAPHASE	0.956031567080045	1	0.192656288889359	0.559169335803399	847	18	ANAPC7, ANAPC2, FZR1, ANAPC10, CDC14A, ANAPC1, ANAPC16, CDC23
REACTOME_TRANSLESION_SYNTHESIS_BY_POLH	0.954913294797688	1	0.200749771739972	0.558604204636903	825	15	RFC4, RPS27A, RFC2, POLH, PCNA, UBA52
REACTOME_MICRORNA_MIRNA_BIOGENESIS	0.963128491620112	1	0.188457141402391	0.556673659930782	861	20	DGCR8, DICER1, AGO3, POLR2H, DROSHA, XPO5, POLR2A, POLR2G, POLR2K, RAN, POLR2L, POLR2E, POLR2I
REACTOME_RHOBTB3_ATPASE_CYCLE	0.963870967741935	1	0.238351780993117	0.555955753545044	746	8	RHOBTB3, VHL, LRRC41, RAB9B, RAB9A
REACTOME_ABACAVIR_TRANSPORT_AND_METABOLISM	0.978386167146974	1	0.293954324695651	0.553484147309358	678	4	GUK1, NT5C2, ADAL
REACTOME_SERINE_BIOSYNTHESIS	0.96986301369863	1	0.274331035168897	0.552846948019336	707	5	SERINC5, PSPH, SERINC2, SERINC1, SERINC3
REACTOME_PI_3K_CASCADE_FGFR1	0.961783439490446	1	0.227433356560617	0.549136052946121	754	9	FGF2, FGFR1, FRS2, FGF1, GAB1, PIK3CA, GRB2
REACTOME_ABERRANT_REGULATION_OF_MITOTIC_EXIT_IN_CANCER_DUE_TO_RB1_DEFECTS	0.958473625140292	1	0.186790367293472	0.547352082601025	853	19	ANAPC7, ANAPC2, FZR1, ANAPC10, SKP2, ANAPC1, ANAPC16, CDC23, RB1
REACTOME_REGULATION_OF_TP53_ACTIVITY	0.992	1	0.146587529922427	0.545135361387646	991	124	PML, PPP2R1B, ATM, TP53INP1, CDK2, MAPK11, WRN, BANP, MDM2, TAF1, L3MBTL1, BRD1, TP63, MDM4, TP53, RFC4, PIP4K2A, MRE11, CHD3, RPS27A, RFC2, RAD9A, PRKAA1, TAF4, BARD1, MAPK14, EHMT2, HDAC2, PIN1, TTC5, KAT6A, TAF9, AKT3, CSNK2A2, DNA2, TAF9B, JMY, RICTOR, AKT2, MTA2, HDAC1, UBA52, KAT5, TAF4B, TAF12, RBBP4, SUPT16H, BRCA1, GATAD2A, ATRIP
REACTOME_INTERLEUKIN_7_SIGNALING	0.958536585365854	1	0.213204649790506	0.544661828317226	785	11	SOCS2, BRWD1, PIK3R3, STAT5A, SMARCA4, IRS2, STAT3
REACTOME_MITOCHONDRIAL_TRNA_AMINOACYLATION	0.965050732807215	1	0.186425935712601	0.541086238346514	855	18	VARS2, AARS2, WARS2, LARS2, RARS2, TARS2, SARS2
REACTOME_REGULATION_OF_GLYCOLYSIS_BY_FRUCTOSE_2_6_BISPHOSPHATE_METABOLISM	0.963414634146341	1	0.209371683656463	0.534869967096107	789	11	PPP2R1B, PRKACB, PFKFB2, PFKFB4, PFKFB3
REACTOME_TRIGLYCERIDE_METABOLISM	0.961748633879781	1	0.173753659797501	0.532060025720111	879	23	LPIN3, PLIN1, LPIN2, FABP4, PRKACB, CAV1
REACTOME_TRANS_GOLGI_NETWORK_VESICLE_BUDDING	0.99388379204893	1	0.15074311830014	0.524471262174177	974	56	NECAP1, PIK3C2A, PICALM, APP, AP3S1, FTL, TPD52L1, AP4M1, NAPA, HIP1R, VAMP2, TXNDC5, AP1S1, GAK, BLOC1S6, VAMP8, RAB5C, ARRB1, SH3D19, SNX5, AP4S1, AP4B1, CTSZ, CPD, BLOC1S4, SNAP23, CHMP2A, BLOC1S3, OCRL, SNX9, PUM1
REACTOME_WNT5A_DEPENDENT_INTERNALIZATION_OF_FZD4	0.977245508982036	1	0.200110908859002	0.524043767817034	815	12	AP2A2, DVL2, ARRB2, AP2B1, AP2M1, WNT5A, AP2S1
REACTOME_COPI_MEDIATED_ANTEROGRADE_TRANSPORT	0.991959798994975	1	0.146116140255789	0.523949327485876	986	72	TMED3, DYNLL1, SPTAN1, ARF5, TUBA1A, ARFGAP1, NAPB, BET1, ARF4, COG5, COG8, NAPA, ACTR10, COG1, KDELR1, COPZ2, CAPZA1, DCTN6, COPE, COG3, COPB1, GORASP1, COPG2, SPTBN1, KDELR2, DYNC1I2
REACTOME_IRS_MEDIATED_SIGNALLING	0.973480662983425	1	0.173184657767244	0.522840592637752	880	22	FGF2, FGFR1, PIK3R4, FGFR4, FRS2, AKT2, FGF1, KRAS, NRAS, THEM4, GAB1, IRS2, PIK3CA, PDPK1, GRB2, SOS1
REACTOME_ER_TO_GOLGI_ANTEROGRADE_TRANSPORT	0.997993981945838	1	0.141015728646658	0.522057951879974	994	115	SEC24D, COL7A1, TRAPPC6A, TMED3, SEC16B, TRAPPC2, DYNLL1, SPTAN1, ARF5, AREG, TUBA1A, ARFGAP1, SEC22A, NAPB, BET1, ARF4, COG5, COG8
REACTOME_HEME_SIGNALING	0.982346832814122	1	0.159435048306504	0.521626529833663	945	35	RAI1, HELZ2, SMARCD3, ATF2, XPO1, CREB1, TBL1XR1, TLR4, NCOA1, NFE2L2, HBA2, RORA, CRTC1, CRTC3, HBB, NR1D1, TGS1, CLOCK
REACTOME_ADAPTIVE_IMMUNE_SYSTEM	1	1	0.132246027941112	0.51982346092063	1000	461	CD74, SRC, PSMB8, SEC24D, UBE2L6, NPDC1, MAP3K8, LCP2, PSMB9, ICAM2, B2M, HACE1, WSB1, KLHL3, PPP2R1B, CD81, VCAM1, MALT1, FBXO17, C3, TAPBP, NECTIN2, FBXW8, RNF217, DYNLL1, PTPRC, PAG1, CBLB, FYN, ITPR1, MRC2, INPP5D, PSME2, COL1A1, TNFRSF14, FBXO44, TRIM21, UBA6, ANAPC7, ASB3, TAP2, PJA1, PLCG2, TUBA1A, CTSO, BTN3A3, COLEC12, CTSK, GAN, TRIM4, ANAPC2, CYBA, KLHL11, AP2A2, PILRB, COL1A2, S100A8, UBA7, EVL, FBXL19, KLHL42, KLHL2, ITPR3, TAP1, PSME1, UBE2Z, KCTD6, BTN3A2, RNF19A, FZR1, RPS27A, RNF138, DNM1, FKBP1A, FBXL20, MICA, PTEN, RLIM, PPIA, KLHL13, TRIM32, MYD88, BTN3A1, FBXO22, RAP1B, FBXL8, LILRB5, FBXL15, KCTD7, ACTR10, PRKACB, PSMD10, CUL7
REACTOME_NUCLEAR_ENVELOPE_NE_REASSEMBLY	0.990835030549898	1	0.150236119809512	0.519729586901621	972	53	TMPO, CHMP4A, NUP155, TUBA1A, NUP160, IST1, NUP107, NUP85, NUP35, LBR, NUP93, POM121, LEMD2, RANGAP1, UBE2I, LEMD3, EMD, NUP54, NUP43, NUP133
REACTOME_SIGNALING_BY_LEPTIN	0.974522292993631	1	0.215147607625617	0.519472208646065	764	9	SH2B1, JAK2, SOCS3, STAT5A, IRS2, STAT3
REACTOME_ELEVATION_OF_CYTOSOLIC_CA2_LEVELS	0.979030144167759	1	0.231031733746306	0.518944629244957	746	7	ITPR1, ITPR3, ITPR2, P2RX5, P2RX6
REACTOME_ARYL_HYDROCARBON_RECEPTOR_SIGNALLING	0.983914209115281	1	0.24031263641148	0.516703595194086	733	6	AHR, HSP90AB1, PTGES3, AIP, ARNT
REACTOME_RIP_MEDIATED_NFKB_ACTIVATION_VIA_ZBP1	0.978443113772455	1	0.197055589686759	0.516042599964492	816	12	NFKB2, MYD88, DHX9, NFKBIA, RIPK1, RELA
REACTOME_PHOSPHATE_BOND_HYDROLYSIS_BY_NUDT_PROTEINS	0.983914209115281	1	0.238334954886415	0.512451321283694	733	6	NUDT5, ADPRM, NUDT9, NUDT1
REACTOME_TRANSCRIPTION_OF_THE_HIV_GENOME	0.990862944162437	1	0.145877392528691	0.512276335024396	975	60	CCNT2, TAF1, GTF2H4, NCBP1, NELFE, NELFA, POLR2H, TAF4, GTF2F1, TAF9, GTF2B, CCNT1, TAF9B, ERCC2, GTF2H3, NELFCD, RNMT, TAF4B, TAF12, POLR2A, POLR2G, SUPT16H, CDK9, ELL, NELFB, RNGTT, POLR2K, SUPT5H, TBP, POLR2L, NCBP2, MNAT1, POLR2E, POLR2I
REACTOME_MEMBRANE_TRAFFICKING	1	1	0.130112962879537	0.511368954599804	1000	460	ACTG1, MYH9, SRC, RIN1, SEC24D, COL7A1, AMPH, RAB27A, ACTB, TRAPPC6A, TMED3, C2CD5, SEC16B, STX6, MAN1C1, STX16, GDI1, MYO1C, TRAPPC2, NECAP2, RIN3, DYNLL1, GRK3, STON1, NECAP1, SH3GL1, RAB3IL1, SPTAN1, RAB13, FCHO2, TBC1D2, SGIP1, LDLR, CHMP4A, ARF5, GJA1, PIK3C2A, RAB31, AREG, YWHAH, VPS28, TUBA1A, KIFC2, MAN1A1, ARPC5, ARFGAP1, PICALM, GJA4, APP, AP2A2, CBL, GOLIM4, SEC22A, AP3S1, NAPB, DAB2, RIN2, PAFAH1B2, DENND6A, TBC1D10A, FTL, KIF13B, ARPC1A, RHOBTB3, TBC1D16, MYO6, BET1, PLA2G6, ARF4, RPS27A, DNM1, VPS54, COG5, HIP1, TPD52L1
REACTOME_RHOT1_GTPASE_CYCLE	0.986301369863014	1	0.25257717411538	0.509007374113055	719	5	MYO19, RAP1GDS1, TRAK2
REACTOME_PI_3K_CASCADE_FGFR4	0.980891719745223	1	0.210298650762045	0.50776444038711	769	9	FGF2, FGFR4, FRS2, FGF1, GAB1, PIK3CA, GRB2
REACTOME_NEGATIVE_REGULATION_OF_MAPK_PATHWAY	0.989583333333333	1	0.153582895546698	0.503581281247403	949	36	PPP2R1B, DUSP5, RPS27A, BRAF, DUSP6, KSR1, DUSP1, PAQR3, DUSP4, DUSP16, UBA52, DUSP10, KRAS, DUSP8, NRAS
REACTOME_APC_C_CDC20_MEDIATED_DEGRADATION_OF_CYCLIN_B	0.979888268156425	1	0.168653713471966	0.498177353432814	876	20	ANAPC7, ANAPC2, RPS27A, ANAPC10, ANAPC1, UBA52, ANAPC16, CDC23
REACTOME_RETROGRADE_TRANSPORT_AT_THE_TRANS_GOLGI_NETWORK	0.995914198161389	1	0.145784690531462	0.49433551138588	974	45	STX6, STX16, NAPB, RHOBTB3, VPS54, COG5, COG8, RAB6B, NAPA, VPS52, VAMP4, COG1, ARFIP2
REACTOME_SIGNALING_BY_CYTOSOLIC_FGFR1_FUSION_MUTANTS	0.981460023174971	1	0.18042238958805	0.492274940967814	846	14	CNTRL, FGFR1OP2, LRRFIP1, BCR, STAT5A, STAT3, PIK3CA, GRB2, ZMYM2, GAB2
REACTOME_DISASSEMBLY_OF_THE_DESTRUCTION_COMPLEX_AND_RECRUITMENT_OF_AXIN_TO_THE_MEMBRANE	0.984665936473165	1	0.160380725757608	0.491059401384176	898	24	PPP2R1B, FZD1, LRP5, CAV1, DVL2, CTNNB1
REACTOME_INSULIN_RECEPTOR_RECYCLING	0.980920314253648	1	0.167425088233893	0.490605977451195	873	19	TCIRG1, ATP6AP1, ATP6V1C1, ATP6V1A, ATP6V0A1, ATP6V0D1, ATP6V1F
REACTOME_CLEC7A_DECTIN_1_INDUCES_NFAT_ACTIVATION	0.985185185185185	1	0.195620021319235	0.489414410754557	797	10	ITPR1, ITPR3, ITPR2, PPP3CA, NFATC2
REACTOME_GOLGI_ASSOCIATED_VESICLE_BIOGENESIS	0.995914198161389	1	0.144295073657106	0.489284428747027	974	45	NECAP1, PIK3C2A, PICALM, AP3S1, FTL, TPD52L1, NAPA, HIP1R, VAMP2, TXNDC5, AP1S1, GAK, BLOC1S6, VAMP8, RAB5C, ARRB1, SH3D19, SNX5
REACTOME_M_PHASE	1	1	0.126614533290505	0.48841841026609	1000	258	PSMB8, HAUS5, PSMB9, CSNK1E, PPP2R1B, EML4, DYNLL1, CEP78, MAU2, HAUS4, LPIN3, PSME2, TMPO, OFD1, CNTRL, CENPC, CEP192, TUBGCP2, CHMP4A, ANAPC7, SFI1, NUP155, MZT2B, TUBA1A, AAAS, KNTC1, LPIN2, PHF8, ANAPC2, CEP131, TUBGCP6, CEP290, CEP57, NUP160, IST1, RCC2, NUP107, NUP85, PSME1, TUBG2, RPS27A, NINL, NUP35, XPO1, ITGB3BP, CENPJ, MAD1L1
REACTOME_MITOPHAGY	0.989224137931034	1	0.153506143090353	0.47533945800942	917	25	SRC, RPS27A, CSNK2A2, ATG12, TOMM20, UBA52, MAP1LC3A, TOMM6, FUNDC1, TOMM40
REACTOME_SIGNALING_BY_INSULIN_RECEPTOR	0.993858751279427	1	0.140422493024702	0.47450157138932	970	44	TCIRG1, FGF2, FGFR1, PIK3R4, FGFR4, ATP6AP1, FRS2, ATP6V1C1, SHC1, ATP6V1A, AKT2, ATP6V0A1, FGF1, KRAS, NRAS, THEM4, ATP6V0D1
REACTOME_OTHER_INTERLEUKIN_SIGNALING	0.991463414634146	1	0.185412424218811	0.473662605702905	812	11	CSF1, VAMP2, TXLNA, IL10RB, CSF3R, IL32, IL16
REACTOME_SYNTHESIS_OF_SUBSTRATES_IN_N_GLYCAN_BIOSYTHESIS	0.995905834186285	1	0.139216093991795	0.469966207620322	972	43	ST6GALNAC4, NAGK, GFPT2, SRD5A3, ST3GAL4, AMDHD2, MVD, GLB1, MPI, ST8SIA5, DPM2, DPM3, CTSA, PMM1, SLC35A1, FPGT, NEU3, ST6GALNAC6
REACTOME_PHOSPHORYLATION_OF_THE_APC_C	0.988465974625144	1	0.166089742156598	0.469259365700154	856	16	ANAPC7, ANAPC2, ANAPC10, ANAPC1, ANAPC16, CDC23, ANAPC4, ANAPC5
REACTOME_INHIBITION_OF_THE_PROTEOLYTIC_ACTIVITY_OF_APC_C_REQUIRED_FOR_THE_ONSET_OF_ANAPHASE_BY_MITOTIC_SPINDLE_CHECKPOINT_COMPONENTS	0.994272623138603	1	0.15443980316583	0.440373782635925	867	17	ANAPC7, ANAPC2, ANAPC10, BUB3, ANAPC1, ANAPC16, CDC23
REACTOME_SLBP_DEPENDENT_PROCESSING_OF_REPLICATION_DEPENDENT_HISTONE_PRE_MRNAS	0.996296296296296	1	0.172333655132691	0.431155122625741	806	10	LSM11, NCBP1, ZNF473, SNRPF, SLBP, SNRPB, NCBP2, SNRPD3
REACTOME_FBXW7_MUTANTS_AND_NOTCH1_IN_CANCER	1	1	0.208162029874379	0.419499539447689	729	5	NOTCH1, RBX1, FBXW7
REACTOME_TRANSLATION	1	1	0.104853892422328	0.40374634482535	1000	246	EEF1A1, RPL3, TRMT112, VARS2, AARS2, RPL31, RPS8, RPL12, RPL35A, EIF3G, RPL36A, RPL36, RPL24, RPS27A, RPL28, RPL10A, RPL15, RPS9, RPL34, RPS6, SSR4, WARS2, RPL11, RPS11, EIF3E, RPL35, RPL17, RPS19, RPS4X, MRPL55, RPL13, RPL23A, RPL18A, LARS2, PABPC1, RPL7A, RPS17, MRPS25, RPL37, SEC11C, EIF3D, SSR1, RPL13A, RPL19, FAU, N6AMT1, RPL23, MRPS14, RPS18, RPS15, SEC61B, RPS24, RPS3A, RPL26, RPL7, RPL22, EIF2S3, RPS3, FARSA, MRPS26, RPL29, RPS16, RPS20, RPS5, RPL14, RPL6, RPS7, MRPL32, RPS12, RPL9, SRP14, RPS2, RPS21, RPL4, RPL5, RPS23, RPS27, RPS25, MRPL57, RPL37A, UBA52, RPL32, RARS2, RPL41, EIF4H, TARS2, EEF1E1, MRPL10
REACTOME_TRANSCRIPTION_OF_E2F_TARGETS_UNDER_NEGATIVE_CONTROL_BY_P107_RBL1_AND_P130_RBL2_IN_COMPLEX_WITH_HDAC1	0.997452229299363	1	0.155696202531646	0.375927258032355	782	9	LIN37, HDAC1, RBBP4, RBL1, LIN52, RBL2, E2F4, TFDP1, LIN54
REACTOME_TRNA_AMINOACYLATION	1	1	0.114578057789962	0.350819166108128	912	24	VARS2, AARS2, WARS2, LARS2, FARSA, RARS2, TARS2, EEF1E1, SARS2
REACTOME_PI_3K_CASCADE_FGFR2	1	1	-0.157463807592597	-0.474474156789539	226	8	PTPN11
REACTOME_PI_3K_CASCADE_FGFR3	1	1	-0.157463807592597	-0.474474156789539	226	8	PTPN11
REACTOME_GLUTATHIONE_SYNTHESIS_AND_RECYCLING	0.973568281938326	1	-0.190556604886063	-0.574190258741355	220	8	GCLM, OPLAH
REACTOME_PRESYNAPTIC_DEPOLARIZATION_AND_CALCIUM_CHANNEL_OPENING	0.981981981981982	1	-0.309474346934401	-0.589226551352932	326	3	CACNA2D3
REACTOME_NEGATIVE_REGULATION_OF_TCF_DEPENDENT_SIGNALING_BY_DVL_INTERACTING_PROTEINS	0.963963963963964	1	-0.315881666017906	-0.601425825911194	320	3	DVL1, DVL3, DVL2
REACTOME_NEUROTRANSMITTER_CLEARANCE	0.974264705882353	1	-0.24430601518396	-0.602040940214235	264	5	MAOA, LRTOMT, ACHE, COMT, ALDH2
REACTOME_TRNA_MODIFICATION_IN_THE_MITOCHONDRION	0.951541850220264	1	-0.2052486412883	-0.618460695802729	215	8	TRMT10C, TRMT61B
REACTOME_TFAP2_AP_2_FAMILY_REGULATES_TRANSCRIPTION_OF_GROWTH_FACTORS_AND_THEIR_RECEPTORS	0.955882352941177	1	-0.251216663422231	-0.619070783543004	259	5	YY1, ATAD2, EGFR, ESR1, ERBB2
REACTOME_VLDLR_INTERNALISATION_AND_DEGRADATION	0.927083333333333	0.996847051690162	-0.187126216408461	-0.620103889111704	177	10	VLDLR, NR1H2
REACTOME_CALCINEURIN_ACTIVATES_NFAT	0.929515418502203	0.996847051690162	-0.209619316522247	-0.631630531321971	210	8	CALM1, PPP3R1, PPP3CB, NFATC1, NFATC2, PPP3CA, PPIA, FKBP1A
REACTOME_ACTIVATION_OF_THE_TFAP2_AP_2_FAMILY_OF_TRANSCRIPTION_FACTORS	0.915915915915916	0.994350704295456	-0.334274036590113	-0.636444150340404	304	3	CITED4, YEATS4, CITED2
REACTOME_BLOOD_GROUP_SYSTEMS_BIOSYNTHESIS	0.908088235294118	0.992405606599155	-0.267047284784312	-0.658082029998915	246	5	ST3GAL3
REACTOME_TICAM1_TRAF6_DEPENDENT_INDUCTION_OF_TAK1_COMPLEX	0.889400921658986	0.984968817946281	-0.20856864654333	-0.661333626866475	192	9	TAB2, TAB3, UBC, UBB, TRAF6, UBA52, MAP3K7, TAB1, RPS27A
REACTOME_THYROXINE_BIOSYNTHESIS	0.922077922077922	0.996847051690162	-0.414214990544327	-0.66368853650421	354	2	DIO2
REACTOME_ARMS_MEDIATED_ACTIVATION	0.886363636363636	0.984013867488444	-0.309485515326376	-0.67411630653712	272	4	RAP1A
REACTOME_VLDL_CLEARANCE	0.873873873873874	0.98143032117583	-0.355044520140662	-0.675990305017377	290	3	VLDLR
REACTOME_ERYTHROCYTES_TAKE_UP_CARBON_DIOXIDE_AND_RELEASE_OXYGEN	0.878661087866109	0.98143032117583	-0.241173157358489	-0.682104557184477	209	7	CYB5R4
REACTOME_NR1H2_NR1H3_REGULATE_GENE_EXPRESSION_TO_CONTROL_BILE_ACID_HOMEOSTASIS	0.870292887029289	0.98143032117583	-0.243239338569548	-0.68794829052308	207	7	NR1H2, RXRA
REACTOME_RECYCLING_OF_BILE_ACIDS_AND_SALTS	0.893506493506493	0.98534102124565	-0.430447593410633	-0.689697716968285	343	2	RXRA
REACTOME_IRAK2_MEDIATED_ACTIVATION_OF_TAK1_COMPLEX	0.885416666666667	0.984013867488444	-0.208588957055215	-0.691227696355239	169	10	TAB2, TAB3, IRAK2, UBC, UBB, TRAF6, UBA52, MAP3K7, TAB1, RPS27A
REACTOME_NA_CL_DEPENDENT_NEUROTRANSMITTER_TRANSPORTERS	0.888311688311688	0.984785595222831	-0.435341052836431	-0.697538410808174	341	2	SLC6A6, SLC6A1
REACTOME_SUMOYLATION_OF_INTRACELLULAR_RECEPTORS	0.954022988505747	1	-0.147017285901309	-0.702891431537854	82	23	PPARA, NR1H2, RXRA, SUMO1, THRA, THRB, RARA
REACTOME_ALPHA_OXIDATION_OF_PHYTANATE	0.834415584415584	0.975164229808029	-0.325255474452555	-0.708466174540376	256	4	PHYH, HACL1, ALDH3A2, SLC25A17
REACTOME_RELEASE_OF_HH_NP_FROM_THE_SECRETING_CELL	0.837837837837838	0.975164229808029	-0.372323861424679	-0.708889467016706	278	3	ADAM17, SCUBE2, NOTUM
REACTOME_EICOSANOIDS	0.877922077922078	0.98143032117583	-0.442541597742532	-0.709075702359315	337	2	CYP4B1, PTGIS
REACTOME_MET_INTERACTS_WITH_TNS_PROTEINS	0.825825825825826	0.974623271920569	-0.377092253795251	-0.717968291868724	274	3	MET, ITGB1, TNS3
REACTOME_NR1H2_NR1H3_REGULATE_GENE_EXPRESSION_TO_LIMIT_CHOLESTEROL_UPTAKE	0.823529411764706	0.973374613003096	-0.294489939633431	-0.725708697786434	223	5	NR1H2, RXRA
REACTOME_INITIATION_OF_NUCLEAR_ENVELOPE_NE_REFORMATION	0.820143884892086	0.973374613003096	-0.192269283175655	-0.7275061777273	113	14	KPNB1, PPP2R2A, SIRT2, VRK2
REACTOME_VITAMIN_B2_RIBOFLAVIN_METABOLISM	0.813813813813814	0.973374613003096	-0.382347216815882	-0.727973527419927	270	3	FLAD1, SLC52A2, ENPP1
