pathway	pval	padj	ES	NES	nMoreExtreme	size	leadingEdge
REACTOME_INNATE_IMMUNE_SYSTEM	0.0837053571428571	0.315382743737305	0.21815137211153	1.16589113749165	74	662	IRF3, ALPK1, TCIRG1, STAT6, C7, ACTG1, LPCAT1, IFI16, CD81, EEF1A1, MYH9, VAV2, CASP4, NOS3, MGST1, GSDMD, TMEM63A, CTSK, HLA-A, ACTB, CFD, PLCG2, PLCG1, CAND1, HLA-B, S100A11, PSMB8, CLU, ITPR3, CFB, TIMP2, DYNLL1, ATAD3B, SERPING1, MAP3K8, PLEKHO2, RAB27A, CFI, UNC13D, UBE2L6, IMPDH1, GUSB, NOD1, STOM, CASP2, SRC, ARPC1B, MANBA, SDCBP, CD44, PRCP, CNN2, RAB31, PELI2, C1R, C1S, BST2, PLD1, IST1, SPTAN1, VAT1, DHX58, JUN, ARPC5, B2M, UBA7, PLPP5, DOCK1, HBB, PRKCSH, PPP2R1B, CD47, CEP290, NFASC, NBEAL2, ATP6AP2, PIK3R2, FUCA1, LGALS3, HGSNAT, PLA2G6, OSTF1, NFKB2, PROS1, WASF2, ITPR1, PSMB9, FYN, MAPK11, LAMP1, CNPY3, TRAF2, HLA-E, CAP1, COTL1, MALT1, WIPF1, C3, RAB24, NLRP1, HSPA1B, DNM1, GSN, TNFAIP3, NLRC5, NPC2, TRIM21, MYO1C, HSPA1A, HLA-C, PYGL, TRIM4, TRIM56, SLC2A3, CFH, BCL2L1, PFKL, IRAK3, PELI1, ARPC1A, PLA2G2A, AP2A2, PLD2, MYD88, SAA1, TKFC, DPP7, CPNE1
REACTOME_PTK6_REGULATES_PROTEINS_INVOLVED_IN_RNA_PROCESSING	0.306878306878307	0.660904021311068	0.671712874976589	1.16499294220635	173	3	KHDRBS1, SFPQ
REACTOME_ABERRANT_REGULATION_OF_MITOTIC_G1_S_TRANSITION_IN_CANCER_DUE_TO_RB1_DEFECTS	0.27209705372617	0.623392385338055	0.415699064241806	1.16375398323502	156	13	CCND2, CDK2, CDK6, CDKN1A, CCND3, CCND1, CDKN1B
REACTOME_PLATELET_ADHESION_TO_EXPOSED_COLLAGEN	0.294220665499124	0.647041297570688	0.499754432051527	1.16213776668243	167	7	COL1A1, FYN, COL1A2, ITGA10, VWF, ITGA1
REACTOME_SIGNAL_REGULATORY_PROTEIN_FAMILY_INTERACTIONS	0.289982425307557	0.640416666666667	0.479489948185146	1.15967845683525	164	8	SRC, CD47, PTK2B, SKAP2
REACTOME_ATTENUATION_PHASE	0.243021346469622	0.579316253203447	0.350689847691437	1.15892883969809	147	24	COL4A6, SERPINH1, HSPA1B, HSPA1A, DNAJB1, PTGES3, TNFRSF21, HSPB2, HSPB1, HSPA1L, HSP90AB1, HSP90AA1, DEDD2
REACTOME_SIGNALING_BY_FGFR	0.222049689440994	0.555998434978236	0.28585631144232	1.15674469070157	142	62	FGF7, PLCG1, HNRNPH1, HNRNPM, PTBP1, SRC, SPRED1, CBL, FGF2, SPRY2, FGFR1, RPS27A, TIA1, FLRT2, HNRNPA1, SPRED2, NCBP1, HRAS, RBFOX2, FGFR4, BRAF, FRS3, MAPK3, FGF6, NRAS, POLR2H
REACTOME_PHOSPHOLIPID_METABOLISM	0.196261682242991	0.522706992908468	0.246442399059961	1.15643316585089	146	156	PLA2G4B, ABHD3, OSBPL10, LPCAT1, LPIN3, ACP6, ETNK1, PLA2R1, LPCAT4, PLEKHA2, CEPT1, PIK3C2A, CHKB, PLD1, PTPN13, PIK3R2, PLA2G6, SLC44A5, MBOAT7, PLEKHA8, LPCAT2, AGK, PIP4K2A, ARF3, PLEKHA5, PI4K2B, PLA2G2A, PGS1, PLD2, CPNE1, MIGA2, INPP5E, PIP5K1B
REACTOME_EGFR_DOWNREGULATION	0.254457050243112	0.593235644994938	0.343164533208635	1.1549075726663	156	25	SPRY1, CBL, SH3GL1, PTPN12, ARHGEF7, SPRY2, AREG, RPS27A
REACTOME_SIGNALING_BY_VEGF	0.205663189269747	0.532060798868858	0.26577758659562	1.15290260545637	137	90	ACTG1, SPHK1, VAV2, NOS3, ACTB, PLCG1, ITPR3, SRC, CTNND1, NRP2, DOCK1, PIK3R2, WASF2, ITPR1, FYN, MAPK11, AXL, VEGFC, SHC2, ROCK1, PTK2B, FLT4, MAPK14, RASA1, SHB, CYBA, ELMO1, CYFIP1, AKT3, ABI2, HRAS, CAV1
REACTOME_PHASE_2_PLATEAU_PHASE	0.322695035460993	0.68048422597212	0.523709712233696	1.15262349638223	181	6	CACNA1C, AKAP9, KCNE4, CACNA2D2
REACTOME_GAP_JUNCTION_ASSEMBLY	0.299651567944251	0.654614866382214	0.447107446638745	1.15218026407592	171	10	TUBB6, GJA4, GJA1, TUBA1A
REACTOME_NOTCH3_INTRACELLULAR_DOMAIN_REGULATES_TRANSCRIPTION	0.275747508305648	0.629036640180746	0.363133162086478	1.15088505659196	165	20	KAT2A, RBPJ, NOTCH3, MAML2, NOTCH1, PLXND1, MAML1, HEYL, MAMLD1
REACTOME_VITAMINS	0.29520295202952	0.648304825589692	0.746572934973638	1.1507221528204	159	2	CYP26B1, CYP2R1
REACTOME_SRP_DEPENDENT_COTRANSLATIONAL_PROTEIN_TARGETING_TO_MEMBRANE	0.204836415362731	0.531304894660265	0.256092145016873	1.14986106182856	143	110	RPL3, RPL35A, RPS27A, RPL10A, RPS8, RPL24, RPL28, RPL31, RPL12, RPL18, RPS19, RPL11, RPS4X, RPL36A, RPL36, RPL22L1, RPL13, RPL34, RPS9, RPS6, SRP14, RPL15, RPL35, RPS11, SEC61B, RPL17, RPS28, RPS17, SSR2, RPL26, RPS27, FAU, RPL7A, RPL8, RPL41, SSR4, RPL13A, RPS15, RPL19, RPS16, RPL10, RPS18, RPL23, RPL22, RPL18A, RPL7, RPS3A, RPL32, RPL37, RPS24, RPS12, RPS27L, RPL23A, RPS25, SEC11C, RPS2, RPL9, RPS21, RPL29, RPS14, RPS20, SSR1
REACTOME_AMINE_LIGAND_BINDING_RECEPTORS	0.328042328042328	0.681068646040204	0.661481676773003	1.14724834605296	185	3	ADRA2B, ADRB2, ADRA2C
REACTOME_ADRENOCEPTORS	0.328042328042328	0.681068646040204	0.661481676773003	1.14724834605296	185	3	ADRA2B, ADRB2, ADRA2C
REACTOME_NEUROTRANSMITTER_RECEPTORS_AND_POSTSYNAPTIC_SIGNAL_TRANSMISSION	0.223646723646724	0.55649184757166	0.258231533144603	1.14639703615793	156	99	GABBR1, ADCY4, CAMK1, NCALD, GNB1, SRC, GNB4, CAMKK2, ADCY5, GNAI2, TUBB6, MDM2, ADCY3, PPM1F, ARHGEF7, MYO6, AP2A2, PRKX, ADCY6, ARHGEF9, TUBA1A, GNG11, PLCB2, CREB1, GNG12, PRKAR1B, DLG4, HRAS, RASGRF2, APBA1, AP2B1, EPB41L1, LIN7C, MAPK3, GRIP2, GNAI3, PLCB3, TSPAN7, NRAS, ERBB4, NPTN, CHRNG
REACTOME_RUNX3_REGULATES_CDKN1A_TRANSCRIPTION	0.329787234042553	0.681068646040204	0.520839923831757	1.14630742955275	185	6	TGFB1, TP53, CDKN1A, SMAD3
REACTOME_METABOLISM_OF_CARBOHYDRATES	0.184655396618986	0.501883898502884	0.236536415514394	1.14585773705776	141	206	ENO2, GPC3, MAN2C1, G6PD, VCAN, IDUA, GUSB, BGN, CSGALNACT1, PHKA2, MANBA, CD44, AAAS, RPE, PGLS, AKR1A1, PPP2R1B, NDST2, HGSNAT, NUP85, LUM, NUP210, SGSH, ABCC5, PYGL, PFKL, TKFC, XYLT2, CHST14, GALT, RPS27A, XYLT1, PAPSS1, SHPK, NUP155, ADPGK, FMOD, MAN2B2, TKT, PRELP, NUP107, SDC2, B3GNT2, B3GAT3, AGRN, SLC2A1, SLC25A13, HS6ST3, CRYL1, GALK1, SLC35B3, CHST7, CHSY1, B4GALT7, CHPF, ST3GAL4, NUP35, DSE, PFKFB2, ALDH1A1, NUP160, GALE, GLB1, GAA, DCN, PGAM1
REACTOME_AURKA_ACTIVATION_BY_TPX2	0.236559139784946	0.573411155671959	0.286763048427577	1.14541578939319	153	57	HAUS5, SFI1, DYNLL1, OFD1, CNTRL, CSNK1E, HAUS4, CEP290, CEP78, CEP192, CEP131, CEP164, NINL, TUBA1A, CEP57, CENPJ
REACTOME_STIMULI_SENSING_CHANNELS	0.234662576687117	0.571960080989136	0.291737236327209	1.14502427732593	152	51	TPCN2, MLKL, CLIC2, STOM, SCNN1D, TRPM7, TRPM4, TRPV1, ASIC3, SLC9B2, TTYH3, RPS27A, SRI, CLCN6
REACTOME_NEUTROPHIL_DEGRANULATION	0.151105651105651	0.466918374685365	0.226774635415539	1.14494520509195	122	326	TCIRG1, LPCAT1, EEF1A1, MGST1, GSDMD, TMEM63A, HLA-A, CFD, CAND1, HLA-B, S100A11, TIMP2, DYNLL1, ATAD3B, PLEKHO2, RAB27A, UNC13D, IMPDH1, GUSB, STOM, MANBA, SDCBP, CD44, PRCP, CNN2, RAB31, BST2, PLD1, IST1, SPTAN1, VAT1, ARPC5, B2M, HBB, CD47, CEP290, NFASC, NBEAL2, ATP6AP2, FUCA1, LGALS3, HGSNAT, OSTF1, LAMP1, CAP1, COTL1, C3, RAB24, HSPA1B, GSN, NPC2, HSPA1A, HLA-C, PYGL, SLC2A3, PFKL, AP2A2, DPP7, CPNE1, TMC6, ROCK1, CD58, IQGAP1, PECAM1, SLC11A1, PAFAH1B2, CD93, RAP1B, NAPRT, FTL, FGR, CHI3L1, CMTM6, PLAU, C1orf35, TLR2, MAPK14, RAP2B, CRISPLD2, CYBA, LTA4H, PTPRC, RNASET2, PGRMC1, ITGAM, ACTR10, PKP1, MVP, CYFIP1, PDXK, SRP14, ARSA, TICAM2, DBNL, MOSPD2, PPIE, TNFRSF1B, PPIA, CSTB, GLB1, GAA, CSNK2B, TMEM30A, GHDC, ATG7, PGAM1
REACTOME_TRANSMISSION_ACROSS_CHEMICAL_SYNAPSES	0.224350205198358	0.556500508994368	0.249723676937108	1.14445096827485	163	129	GABBR1, STXBP1, ADCY4, CAMK1, NCALD, GLS, GNB1, CPLX1, SRC, GNB4, CAMKK2, ADCY5, GNAI2, TUBB6, MDM2, ADCY3, PPM1F, ARHGEF7, MYO6, AP2A2, PRKX, ADCY6, ARHGEF9, TUBA1A, GNG11, TSPOAP1, PLCB2, VAMP2, CREB1, GNG12, ALDH2, NAAA, PRKAR1B, DLG4, HRAS, RASGRF2, APBA1, ABAT, SLC1A7, AP2B1, EPB41L1, LIN7C, MAPK3, GRIP2, GNAI3, PLCB3, TSPAN7, NRAS, ERBB4, NPTN, CHRNG
REACTOME_INTERLEUKIN_10_SIGNALING	0.289608177172061	0.640416666666667	0.391335827446913	1.14438043033386	169	15	CSF1, TIMP1, IL1R1, TYK2, CCL2, TNFRSF1B, ICAM1, IL10RA, CXCL2, TNFRSF1A
REACTOME_RESOLUTION_OF_D_LOOP_STRUCTURES_THROUGH_SYNTHESIS_DEPENDENT_STRAND_ANNEALING_SDSA	0.289830508474576	0.640416666666667	0.377193412569158	1.1442571459251	170	17	XRCC3, ATM, RTEL1, MRE11, RAD51D, WRN
REACTOME_INLA_MEDIATED_ENTRY_OF_LISTERIA_MONOCYTOGENES_INTO_HOST_CELLS	0.300527240773286	0.654614866382214	0.472700641977047	1.14325806642626	170	8	SRC, CTNND1, RPS27A, CTNNB1
REACTOME_HYDROLYSIS_OF_LPC	0.338652482269504	0.688951829384287	0.518320026758186	1.14076143239513	190	6	PLA2G4B, PLA2G4C, PLA2G4F, PLBD1
REACTOME_PLATELET_AGGREGATION_PLUG_FORMATION	0.285950413223141	0.639467168811242	0.351674902667537	1.13940245000851	172	22	COL1A1, SRC, RAPGEF3, ADRA2B, COL1A2, RAP1B, RASGRP2, FN1
REACTOME_FLT3_SIGNALING_BY_CBL_MUTANTS	0.338738738738739	0.688951829384287	0.557130858237932	1.13734721469497	187	5	CBL, RPS27A, UBA52
REACTOME_RUNX3_REGULATES_NOTCH_SIGNALING	0.31369150779896	0.668540211654934	0.404936521522298	1.13362412960542	180	13	KAT2A, JAG1, RBPJ, MAML2, NOTCH1, MAML1
REACTOME_LGI_ADAM_INTERACTIONS	0.352517985611511	0.698011951584436	0.597445804990822	1.13314253960714	195	4	LGI4, DLG4, LGI1, ADAM23
REACTOME_MEIOTIC_RECOMBINATION	0.304940374787053	0.659666933212808	0.380069897908913	1.12978359455605	178	16	MSH5, ATM, CDK2, MRE11
REACTOME_RHOQ_GTPASE_CYCLE	0.247692307692308	0.58431864871034	0.285850851972525	1.12953995490086	160	53	CPNE8, SRGAP2, ARHGAP33, CDC42EP1, STOM, DLC1, SYDE1, OPHN1, ARHGEF7, SLC1A5, GJA1, IQGAP1, ARHGEF9, SLC4A7, PLEKHG3, ARHGAP17
REACTOME_ETHANOL_OXIDATION	0.312829525483304	0.667649591299938	0.46635243252955	1.12790449798628	177	8	ADH1B, ALDH2, ALDH1A1, ACSS2
REACTOME_FGFR2C_LIGAND_BINDING_AND_ACTIVATION	0.35626102292769	0.702440601260708	0.649529835662185	1.12651953310448	201	3	FGF2, FGF6, FGF1
REACTOME_NUCLEOTIDE_SALVAGE	0.289256198347107	0.640416666666667	0.359290778864002	1.12640581718089	174	19	UPP1, TYMP, TK2, HPRT1, UCKL1, GMPR2, AMPD2, ADA, APRT, DGUOK
REACTOME_GLUCAGON_TYPE_LIGAND_RECEPTORS	0.317073170731707	0.671419588696553	0.437005257053811	1.12614727457593	181	10	GNB1, GNB4, GNG11, GNG12, GNAS, GNB2, GNG10
REACTOME_BIOLOGICAL_OXIDATIONS	0.246438746438746	0.584266324743558	0.253274386770953	1.12439020437658	172	99	CYP26B1, MGST1, FDXR, AOC3, GSTM5, TRMT112, ABHD14B, AKR1A1, CYP1B1, AHR, CES3, CES1, NNMT, UGDH, MTR, ADH1B, SLC35D1, GGT5, PAPSS1, GSTM2, AKR7A2, CYP4V2, ALDH2, SLC35B3, ALDH1A1, CYP2R1, PTGES3, N6AMT1, GSS, CYP2J2, CES2, AS3MT, ACSS2, CYB5R3, MAT2A, ABHD10, MGST2, PAPSS2, HSP90AB1
REACTOME_NGF_STIMULATED_TRANSCRIPTION	0.281967213114754	0.635926055109871	0.326518503618364	1.12438166994062	171	29	ID4, NAB1, JUND, FOSB, NAB2, JUNB, F3, FOS, EGR1, EGR3, CREB1
REACTOME_ACTIVATED_NTRK2_SIGNALS_THROUGH_FYN	0.345945945945946	0.691608084358524	0.550744841466099	1.12431056759305	191	5	SRC, FYN, NTRK2
REACTOME_LTC4_CYSLTR_MEDIATED_IL4_PRODUCTION	0.328820116054159	0.681068646040204	0.841050874264124	1.12208596608765	169	1	GGT5
REACTOME_SIGNALING_BY_NOTCH1_HD_DOMAIN_MUTANTS_IN_CANCER	0.310051107325383	0.665369781829286	0.383602447493083	1.12176576523346	181	15	JAG1, DLL1, RPS27A, NOTCH1, JAG2, DLL4, ADAM10, UBA52, MIB1
REACTOME_FORMATION_OF_XYLULOSE_5_PHOSPHATE	0.365079365079365	0.709638087424222	0.646052971836431	1.12048939438166	206	3	AKR1A1, CRYL1, DCXR
REACTOME_TP53_REGULATES_TRANSCRIPTION_OF_GENES_INVOLVED_IN_G1_CELL_CYCLE_ARREST	0.32688927943761	0.681068646040204	0.462678623920383	1.11901914655251	185	8	CDK2, TP53, CDKN1A, CDKN1B
REACTOME_ENOS_ACTIVATION	0.347978910369069	0.691608084358524	0.421391301663743	1.11863837099951	197	11	NOS3, DDAH2, CYGB, ZDHHC21, DDAH1, CAV1
REACTOME_NECTIN_NECL_TRANS_HETERODIMERIZATION	0.37037037037037	0.710360541482375	0.644773137345568	1.11826969872806	209	3	NECTIN2, PVR
REACTOME_OPIOID_SIGNALLING	0.273282442748092	0.624309028691761	0.272939195260087	1.11788395734512	178	65	ADCY4, ITPR3, PDE1A, GNB1, GNB4, CAMKK2, ADCY5, GNAI2, PPP2R1B, ADCY3, ITPR1, PLCB4, PRKX, ADCY6, GNG11, PLCB2, CREB1, GNG12, PDE4C, PRKAR1B
REACTOME_MEIOTIC_SYNAPSIS	0.315702479338843	0.670182833309426	0.344760670533027	1.11700081436652	190	22	ACD, SYNE2, POT1, STAG3, TERF2IP, DIDO1, UBE2I, SUN1, TERF1, SYNE1
REACTOME_EXTRINSIC_PATHWAY_OF_FIBRIN_CLOT_FORMATION	0.345018450184502	0.691608084358524	0.722847100175747	1.11415259287908	186	2	F3, TFPI
REACTOME_MULTIFUNCTIONAL_ANION_EXCHANGERS	0.377425044091711	0.716116730436539	0.642196649057978	1.11380113666451	213	3	SLC26A11, SLC26A6
REACTOME_RAC3_GTPASE_CYCLE	0.278860569715142	0.63337731122966	0.268187428190984	1.11259211496321	185	70	MCAM, VAV2, JAG1, SRGAP2, CDC42EP1, SYDE1, NOXA1, PIK3R2, TMPO, WASF2, OPHN1, SLC1A5, ABR, ARAP3, SWAP70, ARHGDIB, BAIAP2L1, EPHA2, ABL2
REACTOME_ACTIVATED_NTRK3_SIGNALS_THROUGH_PI3K	0.36036036036036	0.707194467988688	0.54455712706249	1.11167874216422	199	5	NTRK3, SRC, IRS1
REACTOME_ACTIVATION_OF_RAS_IN_B_CELLS	0.37589928057554	0.716116730436539	0.586048133966864	1.11152520497728	208	4	HRAS, NRAS, RASGRP3, KRAS
REACTOME_RA_BIOSYNTHESIS_PATHWAY	0.336221837088388	0.688021519910601	0.3960705897826	1.10880385872995	193	13	CYP26B1, ALDH1A3, ALDH1A1, RDH11, ALDH1A2
REACTOME_INTERLEUKIN_37_SIGNALING	0.328790459965928	0.681068646040204	0.378498716459159	1.10684096278178	192	15	IL18BP, PTPN18, PTPN13, PTPN12
REACTOME_REMOVAL_OF_AMINOTERMINAL_PROPEPTIDES_FROM_GAMMA_CARBOXYLATED_PROTEINS	0.380952380952381	0.71814812947464	0.637766874880661	1.10611830692521	215	3	GAS6, PROS1
REACTOME_SPHINGOLIPID_DE_NOVO_BIOSYNTHESIS	0.299173553719008	0.654614866382214	0.318462421229784	1.10513806244785	180	30	CERS5, SPHK1, PRKD2, CERS2, PLPP3, KDSR, SPNS2, ACER3
REACTOME_OTHER_SEMAPHORIN_INTERACTIONS	0.335652173913043	0.688021519910601	0.38649295104346	1.10421707943851	192	14	SEMA6A, SEMA4A, PTPRC, PLXND1, SEMA5A, PLXNC1, ITGA1, PLXNA4, SEMA7A, SEMA6D, SEMA4D
REACTOME_BASE_EXCISION_REPAIR	0.335925349922239	0.688021519910601	0.295443931764413	1.10048806952569	215	40	ACD, LIG1, POLE, NEIL1, POLD1, PNKP, MUTYH, POT1, RFC2, PARP2, TERF2IP, NTHL1, XRCC1, POLD2, RFC4, POLD3, PCNA, TERF1
REACTOME_PLASMA_LIPOPROTEIN_CLEARANCE	0.323481116584565	0.681068646040204	0.332769310461511	1.09970663079937	196	24	NR1H3, CES3, SCARB1, NPC2, APOE, CLTA, AP2A2, LIPA, APOC1, AP2B1, LDLR, LSR
REACTOME_NOTCH1_INTRACELLULAR_DOMAIN_REGULATES_TRANSCRIPTION	0.315301391035549	0.670182833309426	0.285478938366331	1.09967108394929	203	46	KAT2A, HDAC7, RBPJ, TLE3, HDAC6, MAML2, HIF1A, RPS27A, TLE4, HDAC5, MYC, NOTCH1, TLE1, MAML1, HDAC1, HEYL
REACTOME_SYNTHESIS_OF_5_EICOSATETRAENOIC_ACIDS	0.39568345323741	0.732405926248524	0.579480153396767	1.09906807811972	219	4	GPX1, PON2, ALOX5, GPX4
REACTOME_BH3_ONLY_PROTEINS_ASSOCIATE_WITH_AND_INACTIVATE_ANTI_APOPTOTIC_BCL_2_MEMBERS	0.347978910369069	0.691608084358524	0.453824619611235	1.09760514591932	197	8	BBC3, BCL2L1, BCL2L11
REACTOME_NEF_MEDIATED_DOWNREGULATION_OF_MHC_CLASS_I_COMPLEX_CELL_SURFACE_EXPRESSION	0.347978910369069	0.691608084358524	0.45381732593606	1.09758750567888	197	8	HLA-A, B2M
REACTOME_ANTIGEN_ACTIVATES_B_CELL_RECEPTOR_BCR_LEADING_TO_GENERATION_OF_SECOND_MESSENGERS	0.340869565217391	0.690933984165724	0.383742036767971	1.096357669535	195	14	PLCG2, ITPR3, ITPR1, FYN
REACTOME_RHO_GTPASES_ACTIVATE_FORMINS	0.285289747399703	0.639467168811242	0.252751989959688	1.09528261891891	191	89	CENPT, ACTG1, ACTB, SRGAP2, FMNL3, DYNLL1, SRC, RHOC, FMNL2, TUBB6, PPP2R1B, KNTC1, NUP85, CENPC, DAAM1, FMNL1, ITGB3BP, SCAI, XPO1, TUBA1A, RCC2
REACTOME_LDL_CLEARANCE	0.34412265758092	0.691608084358524	0.368361989774503	1.09498104215818	201	16	CES3, NPC2, CLTA, AP2A2, LIPA, AP2B1, LDLR, LSR
REACTOME_THE_ACTIVATION_OF_ARYLSULFATASES	0.381205673758865	0.71814812947464	0.497187403605888	1.09425101370986	214	6	ARSG, SUMF1, STS, ARSA
REACTOME_GPVI_MEDIATED_ACTIVATION_CASCADE	0.332231404958678	0.684258981715411	0.348861469305028	1.09370908337227	200	19	VAV2, PLCG2, COL1A1, PIK3R2, FYN, COL1A2, LCP2
REACTOME_G_BETA_GAMMA_SIGNALLING_THROUGH_CDC42	0.363796133567663	0.709638087424222	0.411472961287842	1.09230883814653	206	11	GNB1, GNB4, GNG11, GNG12, CDC42, GNB2, GNG10
REACTOME_KSRP_KHSRP_BINDS_AND_DESTABILIZES_MRNA	0.342372881355932	0.691608084358524	0.359930226315169	1.09188739721179	201	17	EXOSC2, MAPK11, YWHAZ, MAPK14, EXOSC9, EXOSC8, EXOSC5
REACTOME_BIOSYNTHESIS_OF_SPECIALIZED_PRORESOLVING_MEDIATORS_SPMS	0.359019264448336	0.705612645825531	0.469090221034165	1.09083066978985	204	7	EPHX2, LTA4H, PTGR1, ALOX5, GSTM4
REACTOME_OPSINS	0.377176015473888	0.716116730436539	0.814691151919866	1.08691820701679	194	1	OPN4
REACTOME_NEUREXINS_AND_NEUROLIGINS	0.347107438016529	0.691608084358524	0.335470000647818	1.08689968417744	209	22	STXBP1, EPB41L3, NLGN2, EPB41L2, SIPA1L1, DLG4, DBNL, APBA1, EPB41L1, LIN7C, APBA3, EPB41L5, SHARPIN
REACTOME_FGFR3_LIGAND_BINDING_AND_ACTIVATION	0.391143911439114	0.72909591932965	0.705058792533426	1.08673477647253	211	2	FGF2, FGF1
REACTOME_SIGNALING_BY_HIPPO	0.338842975206612	0.688951829384287	0.346631687904768	1.0867185373075	204	19	WWTR1, TJP2, STK3, STK4, LATS2, AMOT
REACTOME_MISMATCH_REPAIR	0.356521739130435	0.702440601260708	0.38032167253326	1.08658562946113	204	14	LIG1, POLD1, MSH2, POLD2, POLD3, PCNA, RPA2, MSH6, RPA3
REACTOME_METABOLISM_OF_NITRIC_OXIDE_NOS3_ACTIVATION_AND_REGULATION	0.354344122657581	0.700755167942231	0.371546627586955	1.08651102134198	207	15	NOS3, DDAH2, NOSTRIN, CYGB, ZDHHC21, DDAH1, CAV1, NOSIP
REACTOME_SYNTHESIS_SECRETION_AND_INACTIVATION_OF_GLUCAGON_LIKE_PEPTIDE_1_GLP_1	0.370175438596491	0.710360541482375	0.434100787314446	1.08579838637906	210	9	TCF7L2, GNB1, DPP4, CTNNB1
REACTOME_INCRETIN_SYNTHESIS_SECRETION_AND_INACTIVATION	0.370175438596491	0.710360541482375	0.434100787314446	1.08579838637906	210	9	TCF7L2, GNB1, DPP4, CTNNB1
REACTOME_REGULATION_OF_SIGNALING_BY_NODAL	0.410071942446043	0.743835922299129	0.570559849479646	1.08214942918072	227	4	ACVR2B, ACVR2A, ACVR1B
REACTOME_PKA_MEDIATED_PHOSPHORYLATION_OF_CREB	0.361158432708688	0.707194467988688	0.363410874182086	1.08026351466696	211	16	ADCY4, ADCY5, ADCY3, PRKX, ADCY6, CREB1, PRKAR1B
REACTOME_DEFECTIVE_ST3GAL3_CAUSES_MCT12_AND_EIEE15	0.415467625899281	0.746941766728677	0.569292206558596	1.07974516069834	230	4	LUM, FMOD, PRELP
REACTOME_RHOU_GTPASE_CYCLE	0.347619047619048	0.691608084358524	0.297060931963601	1.07974399542887	218	36	WDR6, SRGAP2, SRC, SPTAN1, PIK3R2, ARHGEF7, MYO6, IQGAP1, EPHA2, ARHGAP31, PTK2B
REACTOME_ACTIVATION_OF_KAINATE_RECEPTORS_UPON_GLUTAMATE_BINDING	0.361158432708688	0.707194467988688	0.36273316900318	1.07824898997745	211	16	NCALD, GNB1, GNB4, GNG11, PLCB2, GNG12, DLG4
REACTOME_CONDENSATION_OF_PROPHASE_CHROMOSOMES	0.367595818815331	0.709638087424222	0.418356019358628	1.07808884080573	210	10	NCAPH2, PHF8, SMC4
REACTOME_CONSTITUTIVE_SIGNALING_BY_ABERRANT_PI3K_IN_CANCER	0.367762128325509	0.709638087424222	0.290875935923182	1.07694658029686	234	39	FGF7, SRC, FGF2, PIK3R2, PDGFRB, FYN, AREG, ERBB3, FGFR1, ERBB2, PDGFRA
REACTOME_HISTIDINE_CATABOLISM	0.405643738977072	0.741348902268443	0.620847432615894	1.07677387784127	229	3	HNMT, CARNS1
REACTOME_KERATAN_SULFATE_DEGRADATION	0.384885764499121	0.721660808435852	0.444517690307228	1.07509571594274	218	8	LUM, FMOD, PRELP, GLB1
REACTOME_INFLAMMASOMES	0.379549393414211	0.717578520248034	0.383580607494373	1.07383801952372	218	13	NFKB2, NLRP1, BCL2L1, APP, TXN, TXNIP, HSP90AB1
REACTOME_RHO_GTPASES_ACTIVATE_WASPS_AND_WAVES	0.347967479674797	0.691608084358524	0.304025340695925	1.07362066057622	213	32	ACTG1, ACTB, ARPC1B, ARPC5, WASF2, WIPF1, ARPC1A
REACTOME_DEX_H_BOX_HELICASES_ACTIVATE_TYPE_I_IFN_AND_INFLAMMATORY_CYTOKINES_PRODUCTION	0.371278458844133	0.710388386958089	0.4615421182181	1.07327817843256	211	7	NFKB2, MYD88, IRF7, DHX9
REACTOME_GRB7_EVENTS_IN_ERBB2_SIGNALING	0.410934744268078	0.743835922299129	0.618030162761262	1.07188771350051	232	3	ERBB3, ERBB2
REACTOME_SIGNALING_BY_FGFR1	0.366043613707165	0.709638087424222	0.29147598585286	1.07088346234587	234	37	PLCG1, SRC, SPRED1, CBL, FGF2, SPRY2, FGFR1, RPS27A, FLRT2, SPRED2, HRAS, BRAF, FRS3, MAPK3, FGF6, NRAS
REACTOME_GLUCURONIDATION	0.401801801801802	0.737719243492916	0.523993019747106	1.06969842491557	222	5	UGDH, SLC35D1, ABHD10
REACTOME_BETA_DEFENSINS	0.398452611218569	0.734113153925289	0.800544767595115	1.06804484298209	205	1	TLR2
REACTOME_VEGF_LIGAND_RECEPTOR_INTERACTIONS	0.393673110720562	0.731340974958481	0.441411926954733	1.06758421989251	223	8	VEGFC, FLT4, PGF, VEGFA
REACTOME_SHC_MEDIATED_CASCADE_FGFR1	0.374564459930314	0.715814292414902	0.413904606579954	1.06661770564705	214	10	FGF2, FGFR1, HRAS, FGF6, NRAS, FGF1
REACTOME_TRNA_MODIFICATION_IN_THE_NUCLEUS_AND_CYTOSOL	0.375586854460094	0.716116730436539	0.288048508607614	1.06647824035367	239	39	NSUN6, QTRT1, TRMT11, ADAT2, TRMT44, TRMT112, THADA
REACTOME_PROCESSING_OF_CAPPED_INTRON_CONTAINING_PRE_MRNA	0.326996197718631	0.681068646040204	0.217890307056691	1.06488248964612	257	229	PRPF3, SRRM1, RBM5, DDX39B, SRSF1, HNRNPH1, SNRNP70, HNRNPU, HNRNPM, THOC1, HNRNPA3, PTBP1, SRSF10, CPSF7, SRSF5, PPIH, AAAS, SNRPA, SRSF7, SYMPK, HNRNPC, METTL3, NUP85, SRSF3, SF3A2, SRSF11, NUP210, SRSF6, RNPC3, PPIL4, SRRM2, SRSF2, NXT1, U2AF1L4, PRPF31, AQR, POLDIP3, NUP155, HNRNPL, PRPF38A, WDR33, CSTF3, HNRNPA1, SRSF9, NUP107, SARNP, RBMX, XAB2, SF1, PABPN1, SNRNP40, PDCD7, U2AF2, HNRNPD, EIF4A3, NUP35, PRPF6, CASC3, NCBP1, PPIE, NUP160, SF3B1, DHX15, U2SURP
REACTOME_PHASE_I_FUNCTIONALIZATION_OF_COMPOUNDS	0.370942812982998	0.710388386958089	0.276047470377264	1.06334086398238	239	46	CYP26B1, FDXR, AOC3, CYP1B1, AHR, CES3, CES1, ADH1B, CYP4V2, ALDH2, ALDH1A1, CYP2R1, PTGES3, CYP2J2, CES2
REACTOME_SIGNALING_BY_NOTCH2	0.365573770491803	0.709638087424222	0.308751200017322	1.06319913274318	222	29	MDK, JAG1, RBPJ, NOTCH2, DLL1, MAML2, RPS27A, CREB1, JAG2, MAML1
REACTOME_ADVANCED_GLYCOSYLATION_ENDPRODUCT_RECEPTOR_SIGNALING	0.393728222996516	0.731340974958481	0.410772121947787	1.05854540222684	225	10	PRKCSH, LGALS3, SAA1, APP, MAPK3, CAPZA1
REACTOME_DEATH_RECEPTOR_SIGNALLING	0.351694915254237	0.697250517773363	0.235206898312254	1.05740873036781	248	112	FAS, SMPD3, TRAF1, VAV2, TNFRSF10B, NGFR, ARHGEF10, CASP2, ARHGEF17, ARHGEF2, ARHGEF15, PLEKHG2, BEX3, TRAF2, CLIP3, SPPL2B, TNFAIP3, ARHGEF7, BCL2L11, ABR, MYD88, ITGB3BP, MAGED1, BIRC3, RPS27A, ARHGEF9, PLEKHG5, ARHGEF1, CASP10
REACTOME_ROLE_OF_ABL_IN_ROBO_SLIT_SIGNALING	0.413005272407733	0.745546193500059	0.434545563495586	1.05097746137648	234	8	CAP1, ABL2, ABL1, CLASP2
REACTOME_LRR_FLII_INTERACTING_PROTEIN_1_LRRFIP1_ACTIVATES_TYPE_I_IFN_PRODUCTION	0.41981981981982	0.747142288008336	0.513424500793572	1.0481234656084	232	5	IRF3, CTNNB1
REACTOME_EXTENSION_OF_TELOMERES	0.396899224806202	0.732707115414499	0.278248531526532	1.04765753623674	255	42	CHTF18, CTC1, ACD, LIG1, POLD1, RTEL1, CDK2, POT1, RFC2, POLA2, TERF2IP, WRN, STN1, POLD2, RFC4, POLD3, PCNA, TERF1
REACTOME_HS_GAG_BIOSYNTHESIS	0.4	0.735260115606936	0.344467926551173	1.04498083307834	235	17	GPC3, NDST2, SDC2, AGRN, HS6ST3
REACTOME_NEGATIVE_REGULATION_OF_FGFR1_SIGNALING	0.386776859504132	0.722650066523584	0.322360035185985	1.04442429951555	233	22	SRC, CBL, FGF2, SPRY2, FGFR1, RPS27A
REACTOME_MYOGENESIS	0.390082644628099	0.727971132580608	0.322189268202859	1.04387102625812	235	22	TCF4, MAPK11, BOC, MYOG, MAPK14, CDH15, TCF12, CTNNB1, CTNNA1, CDC42, ABL1
REACTOME_CONSTITUTIVE_SIGNALING_BY_OVEREXPRESSED_ERBB2	0.416520210896309	0.746941766728677	0.392525577129617	1.04201052665843	236	11	PTPN12, ERBB2, CDC37, HRAS, NRAS, HSP90AA1, ERBIN, SHC1, KRAS
REACTOME_RHOBTB1_GTPASE_CYCLE	0.39344262295082	0.731340974958481	0.317267325060132	1.0399661345974	239	23	SRRM1, VIM, CPSF7, HNRNPC, MYO6, ROCK1, PDE5A, RBMX, DBN1, TRA2B
REACTOME_TRANSCRIPTIONAL_REGULATION_OF_GRANULOPOIESIS	0.395081967213115	0.732405926248524	0.317001779067283	1.03909570509543	240	23	CEBPA, PML, CDK2, FLI1, CDKN1A, MYC, CREB1, CEBPB, KMT2A, CSF3R, RUNX1
REACTOME_THE_CANONICAL_RETINOID_CYCLE_IN_RODS_TWILIGHT_VISION	0.418563922942207	0.746941766728677	0.446512531523007	1.03832811256862	238	7	CYP4V2, RDH11, MYO7A, RDH5
REACTOME_RESPONSE_TO_METAL_IONS	0.418563922942207	0.746941766728677	0.44619259275707	1.03758412132197	238	7	CSRP1, MT1E, MT1X
REACTOME_SIGNALING_BY_NOTCH1	0.367069486404834	0.709638087424222	0.250257475345165	1.03331244374325	242	69	KAT2A, HDAC7, JAG1, RBPJ, NUMB, TLE3, DLL1, HDAC6, MAML2, HIF1A, RPS27A, TLE4, HDAC5, MYC, NOTCH1, ARRB2, DTX4, JAG2, TLE1, MAML1, HDAC1, DTX2, HEYL
REACTOME_SODIUM_CALCIUM_EXCHANGERS	0.441441441441441	0.762097602488482	0.505546647145392	1.03204132840123	244	5	SLC8B1, SRI, SLC24A3, SLC8A3
REACTOME_ASSEMBLY_OF_ACTIVE_LPL_AND_LIPC_LIPASE_COMPLEXES	0.423344947735192	0.750254803518176	0.400151712805662	1.03117697903917	242	10	LMF2, PCSK5, LMF1, MBTPS1
REACTOME_LAGGING_STRAND_SYNTHESIS	0.410562180579216	0.743835922299129	0.346814902927948	1.03093086253689	240	16	LIG1, POLD1, RFC2, POLA2, POLD2, RFC4, POLD3, PCNA
REACTOME_SIGNALING_BY_FGFR2	0.418569254185693	0.746941766728677	0.258306492024813	1.02608668737026	274	54	FGF7, PLCG1, HNRNPH1, HNRNPM, PTBP1, SRC, CBL, FGF2, SPRY2, RPS27A, TIA1, HNRNPA1, NCBP1, HRAS, RBFOX2, BRAF, FRS3, MAPK3, FGF6, NRAS, POLR2H
REACTOME_CYTOSOLIC_IRON_SULFUR_CLUSTER_ASSEMBLY	0.428571428571429	0.754218539073046	0.397684046001952	1.02481788792824	245	10	NDOR1, POLD1, RTEL1, MMS19
REACTOME_EPHRIN_SIGNALING	0.439522998296422	0.760436961143974	0.350282216036404	1.02432766184797	257	15	SRC, SDCBP, FYN, ARHGEF7, EFNB1, EPHB4, EPHB6, EPHB1
REACTOME_CA_DEPENDENT_EVENTS	0.40432612312812	0.740643474393676	0.300377533108171	1.02202539390034	242	28	ADCY4, PDE1A, CAMKK2, ADCY5, ADCY3, PRKX, ADCY6
REACTOME_DEFECTIVE_EXT2_CAUSES_EXOSTOSES_2	0.430313588850174	0.756020559416328	0.396535962869919	1.02185931782123	246	10	GPC3, SDC2, AGRN, SDC3, EXT1, EXT2
REACTOME_PKA_ACTIVATION_IN_GLUCAGON_SIGNALLING	0.441941074523397	0.762132655631454	0.364782703426149	1.02121308572511	254	13	ADCY4, ADCY5, ADCY3, ADCY6
REACTOME_AMYLOID_FIBER_FORMATION	0.427642276422764	0.754165999954283	0.289023950883075	1.02064546448379	262	32	UBE2L6, TGFBI, B2M, GSN, APOE, SAA1, RPS27A, SIAH2, ITM2B, APP
REACTOME_RHOD_GTPASE_CYCLE	0.437403400309119	0.759248260361899	0.264245360193679	1.01787887868587	282	46	CPNE8, ACTN1, MCAM, ANKFY1, EFHD2, PIK3R2, PLXNB1, TMPO, ADD3, AKAP12
REACTOME_POST_TRANSLATIONAL_MODIFICATION_SYNTHESIS_OF_GPI_ANCHORED_PROTEINS	0.4170692431562	0.746941766728677	0.285839572531596	1.01765379032628	258	33	LY6E, CD109, NEGR1, PIGG, PGAP1, THY1, PIGL, NRN1, RECK, PIGV
