pathway	pval	padj	ES	NES	nMoreExtreme	size	leadingEdge
REACTOME_IKK_COMPLEX_RECRUITMENT_MEDIATED_BY_RIP1	0.165	0.480494505494506	-0.364378188447902	-1.22905056412106	65	20	CHUK, UBE2D2, UBE2D1, BIRC2, UBE2V1, UBE2D3, IKBKG, TICAM1, UBC
REACTOME_BIOSYNTHESIS_OF_THE_N_GLYCAN_PRECURSOR_DOLICHOL_LIPID_LINKED_OLIGOSACCHARIDE_LLO_AND_TRANSFER_TO_A_NASCENT_PROTEIN	0.138418079096045	0.443719245489338	-0.279620448191279	-1.23264050385344	48	58	CMAS, GNPNAT1, SLC35C1, ST3GAL1, SLC17A5, DOLK, ALG3, MPDU1, ALG5, ALG1, ST3GAL3, NUS1, GNE, NEU4, ST6GALNAC2, DPM1, GFPT1, ST3GAL2, NANS, DHDDS
REACTOME_TGF_BETA_RECEPTOR_SIGNALING_ACTIVATES_SMADS	0.165	0.480494505494506	-0.323274728172711	-1.23338884409564	65	31	ZFYVE9, PPP1CC, UBE2M, STRAP, FURIN, UCHL5, PPP1CB, SMAD4, PPP1CA, TGFBR1
REACTOME_MRNA_CAPPING	0.151898734177215	0.468060052987931	-0.337974379305373	-1.23749001531737	59	27	POLR2B, POLR2J, POLR2D, CDK7, CCNH, GTF2H1, ERCC3, SUPT5H, POLR2C, GTF2F1, POLR2A, POLR2K, GTF2H3, RNMT, POLR2E, GTF2H5, RNGTT
REACTOME_SERINE_BIOSYNTHESIS	0.23489932885906	0.571960080989136	-0.585897532263108	-1.24137008698261	104	5	SERINC1, SERINC3
REACTOME_INTERLEUKIN_35_SIGNALLING	0.212471131639723	0.542261796640705	-0.493389667168425	-1.24164699027445	91	8	JAK1, CANX
REACTOME_INTRA_GOLGI_TRAFFIC	0.137741046831956	0.442440938308707	-0.312525144818571	-1.24377464826906	49	39	RGP1, YKT6, COG2, VTI1A, GOLGA5, MAN2A2, GOSR1, SNAP29, MAN1A2, TRIP11, GOSR2
REACTOME_RNA_POLYMERASE_III_TRANSCRIPTION_TERMINATION	0.165841584158416	0.480585910253429	-0.363574612523723	-1.24579960957559	66	21	POLR3E, NFIC, POLR1D, POLR3F, POLR3D, POLR3H, CRCP, POLR3GL, NFIX, POLR2K, POLR3C
REACTOME_CHROMATIN_MODIFYING_ENZYMES	0.0472103004291846	0.218210400239545	-0.228300621290978	-1.24630838050047	10	193	KANSL3, SETD3, MSL3, BRPF3, NSD1, KANSL2, SAP30L, TADA2B, TADA3, KDM2A, ELP3, HDAC3, PHF20, KMT2D, ENY2, TAF6L, KDM3B, EP300, KAT2B, KAT14, SAP130, SETD6, REST, ELP5, ELP6, BRMS1, SETD7, WDR77, SETD2, ARID1B, TAF5L, RBBP5, SETD1A, KDM1A, ASH1L, NCOR1, GPS2, SMARCE1, MORF4L1, WDR5, SGF29, CREBBP, PRMT3, KMT2C, ASH2L, CARM1, CHD4, NSD2, BRPF1, EPC1, KAT7, CLOCK, ZZZ3, HCFC1, SUDS3, ATXN7L3, SMARCB1, KDM1B, KDM3A, KDM7A, PBRM1, KMT5A, SMARCC1
REACTOME_FORMATION_OF_ATP_BY_CHEMIOSMOTIC_COUPLING	0.169565217391304	0.480585910253429	-0.810896309314587	-1.24650959825837	77	2	MT-ATP8, MT-ATP6
REACTOME_RNA_POLYMERASE_III_TRANSCRIPTION_INITIATION_FROM_TYPE_3_PROMOTER	0.126903553299492	0.425689134485639	-0.345020994397655	-1.24668875535694	49	26	BRF2, POLR3E, SNAPC5, POLR1D, POLR3F, POLR3D, POLR3H, CRCP, POLR3GL, TBP, ZNF143
REACTOME_CARNITINE_METABOLISM	0.177985948477752	0.493023255813954	-0.404735382278195	-1.25103969265681	75	14	RXRA, ACACB, SLC25A20, PRKAB2, PRKAG2
REACTOME_BETA_OXIDATION_OF_VERY_LONG_CHAIN_FATTY_ACIDS	0.198614318706697	0.524547298453117	-0.498550055107867	-1.25463344009297	85	8	ABCD1, HSD17B4, ACOX1
REACTOME_GASTRIN_CREB_SIGNALLING_PATHWAY_VIA_PKC_AND_MAPK	0.168674698795181	0.480585910253429	-0.400712538205473	-1.2552368272241	69	15	PRKCA, RPS6KA3, MAPK1, SOS1, RPS6KA2
REACTOME_YAP1_AND_WWTR1_TAZ_STIMULATED_GENE_EXPRESSION	0.199074074074074	0.524547298453117	-0.477275976889866	-1.25642325536547	85	9	HIPK2, KAT2B, HIPK1, TEAD1
REACTOME_METABOLISM_OF_AMINO_ACIDS_AND_DERIVATIVES	0.0147783251231527	0.0999895189183524	-0.224610960503419	-1.25950596596972	2	278	PSMB5, PSMD14, PSMD7, PSMD6, SLC25A15, PSMC1, PSMD12, GSR, PSMC2, PSMA1, PSMA6, PSMA4, PSMD3, PSMD2, PSMD11, PSMA2, GLUD1, PSME4, PSME3, PSMB6, PSMD1, ADO, PSMA3, SEM1, PSMA7, PSMD8, GCSH, SLC25A44, AIMP2, PSMC4, PSMB2, PSMC6, PSMA5, DBT, SERINC1, RIMKLA, PSMB7, DLAT, MTRR, MPST, BCAT2, PSMD13, RPL26L1, PSMC3, EEFSEC, KYAT3, SLC3A2, SERINC3, RIDA, ACADSB, DHTKD1, PSMF1, TXNRD1, PXMP2, CKMT2
REACTOME_VITAMIN_B1_THIAMIN_METABOLISM	0.179310344827586	0.493258561030903	-0.727136169956462	-1.26608923302142	77	3	THTPA, SLC25A19
REACTOME_CHOLESTEROL_BIOSYNTHESIS	0.1425	0.447776679841897	-0.37549849312225	-1.266559441344	56	20	GGPS1, HMGCR, HMGCS1, DHCR24, SC5D, LSS, ARV1
REACTOME_LYSOSOME_VESICLE_BIOGENESIS	0.139650872817955	0.44587326863564	-0.341556178567007	-1.26868616056789	55	28	AP4E1, AP1G1, VAMP7, DNM2, M6PR, CLTB, DNASE2, GNS, HSPA8, CLTC, AP1S2
REACTOME_INFECTIOUS_DISEASE	0.00763358778625954	0.0638810767376456	-0.20659646247048	-1.26933867965257	0	618	GALNT1, PSMB5, PSMD14, PSMD7, PSMD6, KPNA1, GTF2A2, TAF13, ELOA, CUL3, KPNA4, NCKAP1, PSMC1, PRKAR2A, PSMD12, RAC1, VTA1, PSMC2, VPS37C, IPO5, PSMA1, HMGA1, BECN1, ZCRB1, KEAP1, PSMA6, PSMA4, PSMD3, PSMD2, PSMD11, PSMA2, MAP2K4, CHMP3, MAPK8, SEC13, JAK1, PSME4, PSME3, ADCY9, PSMB6, POLR2B, CUL5, PSMD1, PSMA3, KPNB1, MAP2K7, KPNA3, SAP30L, SEM1, EPS15, DYNC1LI1, CHMP2B, VCP, TBK1, PSMA7, ST3GAL1, TAF3, GNG5, PSMD8, ELOC, GTF2A1, GSK3B, PSMC4, VPS37A, PARP6, POLR2J, GSK3A, PSMB2, AP1G1, RPN2, ACTR2, HDAC3, TCEA1, RAB5A, PSMC6, SNF8, CANX, ROCK2, GRSF1, PSMA5, POLR2D, GTF2E1, PIK3C3, ELK1, UBAP1, VPS4A, RAB7A, MET, FURIN, NUP37, PSMB7, BTRC, ARPC2, DYNC1H1, CCNK, PSMD13, STAM, FEN1, CHMP7, NDC1, MAP2K2, ITGB1, RPL26L1, TUBA4A, SUMO1, DAXX, CTDP1, PSMC3, PAK2, REST, ST3GAL3, BRMS1, CDK7, TAF11, MGAT4B, PARP1
REACTOME_INHIBITION_OF_THE_PROTEOLYTIC_ACTIVITY_OF_APC_C_REQUIRED_FOR_THE_ONSET_OF_ANAPHASE_BY_MITOTIC_SPINDLE_CHECKPOINT_COMPONENTS	0.160194174757282	0.475202869149399	-0.389920418229269	-1.27020468258221	65	17	UBE2D1, CDC27, CDC26, UBE2S, CDC16, ANAPC11, CDC23, UBE2E1, ANAPC10, ANAPC15
REACTOME_PI3K_EVENTS_IN_ERBB4_SIGNALING	0.210045662100457	0.539823284264491	-0.564861821594209	-1.27247067579688	91	6	PIK3R1, PIK3CA, NRG4, NRG2
REACTOME_RESPONSE_OF_MTB_TO_PHAGOCYTOSIS	0.1425	0.447776679841897	-0.377595681511379	-1.27363327467004	56	20	KPNA1, KPNB1, GSK3A, RAB5A, RAB7A, MAPK1
REACTOME_MITOPHAGY	0.134663341645885	0.436078845655718	-0.342951270826032	-1.27386813165436	53	28	MFN1, ATG5, CSNK2A1, TOMM5, VDAC1, PINK1, TOMM22, MTERF3, TOMM70, PGAM5, UBC, MFN2, TOMM40, MAP1LC3B, CSNK2A2
REACTOME_LOSS_OF_FUNCTION_OF_MECP2_IN_RETT_SYNDROME	0.168591224018476	0.480585910253429	-0.454229127677392	-1.27459147912857	72	11	HDAC3, NCOR1, GPS2, PRKACA, CALM1, NCOR2, TBL1X
REACTOME_TYSND1_CLEAVES_PEROXISOMAL_PROTEINS	0.201856148491879	0.526760724281716	-0.53393953473337	-1.2756172637749	86	7	AGPS, HSD17B4, ACOX1, SCP2, PHYH
REACTOME_GOLGI_ASSOCIATED_VESICLE_BIOGENESIS	0.0914285714285714	0.336507936507936	-0.302930005987508	-1.27750304743523	31	51	CLINT1, AP4E1, YIPF6, AP3B1, AP1G1, SORT1, VAMP7, DNM2, TGOLN2, TFRC, FTH1, SNX2, IGF2R, SNAPIN, HSPA8, SNX9, CLTC, AP1S2, ACBD3
REACTOME_SMAC_XIAP_REGULATED_APOPTOTIC_RESPONSE	0.197215777262181	0.524280575539568	-0.535174587592586	-1.27856788766844	84	7	XIAP, CASP3, CYCS, APAF1, DIABLO
REACTOME_TRANS_GOLGI_NETWORK_VESICLE_BUDDING	0.0962099125364431	0.347667638483965	-0.287246398742095	-1.27901108395865	32	64	CLINT1, AP4E1, YIPF6, AP3B1, AP1G1, SORT1, VAMP7, DNM2, M6PR, TGOLN2, TFRC, FTH1, CLTB, DNASE2, GNS, SNX2, IGF2R, SNAPIN, HSPA8, SNX9, CLTC, AP1S2, ACBD3
REACTOME_NUCLEAR_ENVELOPE_NE_REASSEMBLY	0.0932203389830508	0.341521518394126	-0.290943709161497	-1.28255641736362	32	58	CHMP3, SEC13, KPNB1, CHMP2B, SPAST, VRK2, VPS4A, NUP37, CHMP7, NDC1, TUBA4A, SUMO1, CHMP4B, CC2D1B, NUP58, PPP2R2A, TUBB4B
REACTOME_NONCANONICAL_ACTIVATION_OF_NOTCH3	0.182448036951501	0.497585555322276	-0.509764270486748	-1.28285473798392	78	8	PSEN2, APH1A, PSENEN, YBX1, PSEN1, NCSTN
REACTOME_O_LINKED_GLYCOSYLATION_OF_MUCINS	0.136020151133501	0.439577317687535	-0.368931450446566	-1.28825657307304	53	22	GALNT1, ST3GAL1, GALNT2, ST3GAL3, B4GALT5, C1GALT1C1, ST6GALNAC2, C1GALT1
REACTOME_INTEGRATION_OF_PROVIRUS	0.18013856812933	0.494681042013187	-0.513238669317487	-1.29159828722758	77	8	KPNA1, HMGA1
REACTOME_OVARIAN_TUMOR_DOMAIN_PROTEASES	0.123359580052493	0.414675966772652	-0.3334889035031	-1.29192565761718	46	33	APC, MAVS, ZRANB1, VCP, OTUD7B, TRAF3, UBE2D1, VCPIP1, TNIP1, RNF128
REACTOME_PHOSPHORYLATION_OF_THE_APC_C	0.137349397590361	0.442075996292864	-0.403226637124068	-1.29599863308408	56	16	UBE2D1, CDC27, CDC26, UBE2S, CDC16, ANAPC11, CDC23, UBE2E1, ANAPC10, ANAPC15
REACTOME_PEROXISOMAL_LIPID_METABOLISM	0.133663366336634	0.436078845655718	-0.378465676160863	-1.29682429784121	53	21	ACBD5, ABCD1, NUDT19, HSD17B4, ACOX3, ACOX1
REACTOME_HCMV_LATE_EVENTS	0.0714285714285714	0.286796536796537	-0.309193763927927	-1.30391829088792	24	51	VPS37C, CHMP3, SEC13, CHMP2B, VPS37A, SNF8, UBAP1, VPS4A, NUP37, CHMP7, NDC1, CHMP4B, NUP58, TSG101, VPS25, NUP214, RANBP2, NUP188
REACTOME_GLYCOGEN_METABOLISM	0.114503816793893	0.391529180004925	-0.365451095443558	-1.3059289886496	44	24	PHKA1, GBE1, EPM2A, GYG1, PHKB, PGM1, PGM2L1, CALM1, AGL, UGP2, UBC, PYGM, PHKG1
REACTOME_APOPTOTIC_FACTOR_MEDIATED_RESPONSE	0.133495145631068	0.436078845655718	-0.401168313572857	-1.3068458243811	54	17	UACA, AVEN, XIAP, MAPK1, CASP3, CYCS, C1QBP, APAF1, DIABLO, BAK1, APIP
REACTOME_MAPK3_ERK1_ACTIVATION	0.168591224018476	0.480585910253429	-0.523333221198804	-1.31700187955155	72	8	PTPN11, JAK1
REACTOME_HCMV_INFECTION	0.0527859237536657	0.231849775603117	-0.275576318023855	-1.3177084124559	17	85	VPS37C, CHMP3, SEC13, DYNC1LI1, CHMP2B, VPS37A, HDAC3, SNF8, ELK1, UBAP1, VPS4A, NUP37, DYNC1H1, CHMP7, NDC1, ITGB1, TUBA4A, DAXX, CHMP4B, NCOR1, GPS2, NUP58, TSG101, TUBB4B, VPS25, NUP214, RANBP2, NUP188
REACTOME_SIGNALLING_TO_ERKS	0.0994897959183673	0.356281025923883	-0.352391352844915	-1.32066736912134	38	29	MAPKAPK3, RAPGEF1, RAP1A, MAP2K2, MAPKAPK2, CRKL, RALB, MAPK1, MAPK12, SOS1, YWHAB
REACTOME_SEALING_OF_THE_NUCLEAR_ENVELOPE_NE_BY_ESCRT_III	0.103274559193955	0.361873057390832	-0.397244446675152	-1.32361778537373	40	19	CHMP3, CHMP2B, SPAST, VPS4A, CHMP7, TUBA4A, CHMP4B, CC2D1B, TUBB4B
REACTOME_TICAM1_TRAF6_DEPENDENT_INDUCTION_OF_TAK1_COMPLEX	0.147196261682243	0.458905992303463	-0.489170457206465	-1.32362381618632	62	10	TAB2, TAB3
REACTOME_UBIQUINOL_BIOSYNTHESIS	0.15473441108545	0.470110740780561	-0.528469842671056	-1.32992851951911	66	8	PDSS1, PDSS2, COQ9, COQ6, COQ7, COQ2
REACTOME_MET_INTERACTS_WITH_TNS_PROTEINS	0.131034482758621	0.434051724137931	-0.764819956389998	-1.33170422816853	56	3	MET, ITGB1
REACTOME_LOSS_OF_MECP2_BINDING_ABILITY_TO_THE_NCOR_SMRT_COMPLEX	0.160092807424594	0.475202869149399	-0.558146244029386	-1.33344871147356	68	7	HDAC3, NCOR1, GPS2, NCOR2, TBL1X
REACTOME_NEGATIVE_FEEDBACK_REGULATION_OF_MAPK_PATHWAY	0.148401826484018	0.459958877406606	-0.592481295929457	-1.33468938102524	64	6	RAF1, MAP2K2, MAPK1
REACTOME_UPTAKE_AND_FUNCTION_OF_ANTHRAX_TOXINS	0.120092378752887	0.405407393242229	-0.475782779213098	-1.33507219011245	51	11	MAP2K4, MAP2K7, FURIN, MAP2K2
REACTOME_DNA_DAMAGE_RECOGNITION_IN_GG_NER	0.0771349862258953	0.300277253184393	-0.340135519676418	-1.34695373529543	27	38	COPS3, RAD23B, COPS5, RAD23A, CUL4A, COPS8, YY1, COPS2, ACTR8, PARP1, INO80
REACTOME_BMAL1_CLOCK_NPAS2_ACTIVATES_CIRCADIAN_GENE_EXPRESSION	0.094147582697201	0.343336368093004	-0.378205268862326	-1.35150566088154	36	24	PPARA, MED1, RXRA, NPAS2, CHD9, CREBBP, CARM1, TGS1, CLOCK
REACTOME_ZBP1_DAI_MEDIATED_INDUCTION_OF_TYPE_I_IFNS	0.101941747572816	0.361564236842633	-0.415724026485419	-1.35426251208322	41	17	NKIRAS2, CHUK, NFKBIB, TBK1, NKIRAS1
REACTOME_BETA_OXIDATION_OF_PRISTANOYL_COA	0.133949191685912	0.436078845655718	-0.539008185202225	-1.35644893970018	57	8	HSD17B4, ACOX3, SCP2
REACTOME_SIGNALING_BY_INTERLEUKINS	0.00485436893203883	0.0479406621238618	-0.238740089049593	-1.3575849313075	0	293	NKIRAS2, TAB2, PSMB5, PSMD14, PSMD7, PSMD6, CHUK, PSMC1, PSMD12, CNTF, PSMC2, PIK3CB, PSMA1, PTPN11, MAPKAPK3, PSMA6, PSMA4, PSMD3, RAPGEF1, PSMD2, PSMD11, PSMA2, MAP2K4, CUL1, MAPK8, NFKBIB, PELI3, JAK1, PSME4, PSME3, IFNLR1, PSMB6, TAB3, PSMD1, PSMA3, MAP2K7, SEM1, TBK1, IRAK1, PSMA7, PSMD8, PSMC4, PSMB2, DUSP3, PSMC6, CANX, VAMP7, PSMA5, NKIRAS1, RPS6KA3, ELK1, ZEB1, PSMB7, BTRC, PSMD13, ATF1, HSPA9, ITGB1, MAPKAPK2, CRKL, MAPK9, PSMC3, PAK2, SOS2, FBXW11, PIK3R1, PIK3CA, MAPK1, PSMF1, CASP3, PPP2CB, SOS1, UBE2V1, RPS6KA2, PSMB3, SOD2
REACTOME_TRAF6_MEDIATED_NF_KB_ACTIVATION	0.0891089108910891	0.33026379561033	-0.396254936985031	-1.35777974804592	35	21	NKIRAS2, CHUK, MAVS, NFKBIB, NKIRAS1
REACTOME_KINESINS	0.0753246753246753	0.297186684283458	-0.381184117020223	-1.35842514454478	28	25	KIF5B, KIF1B, KIF1C, KIF16B, RACGAP1, TUBA4A, KIF21A, TUBB4B, KIF2A, KLC2
REACTOME_MAP3K8_TPL2_DEPENDENT_MAPK1_3_ACTIVATION	0.106024096385542	0.368880335345759	-0.423195471936639	-1.3601798657674	43	16	CHUK, MAP2K4, CUL1, BTRC, FBXW11, TNIP2, IKBKG, UBC
REACTOME_CELLULAR_RESPONSES_TO_STIMULI	0.00826446280991736	0.0673774493185979	-0.22099263426211	-1.36148397795341	0	626	PSMB5, PSMD14, DNAJC7, PSMD7, PSMD6, EIF2AK1, CUL3, PSMC1, PSMD12, PPARA, GSR, AGO4, PSMC2, HSPA14, PSMA1, HMGA1, MAPKAPK3, KEAP1, PSMA6, MTOR, E2F3, UBE2D2, PSMA4, CUL2, MED1, PSMD3, PSMD2, PSMD11, PSMA2, MAP2K4, EIF2AK4, EXTL3, CUL1, MAPK8, ABCC1, SEC13, PSME4, PSME3, WIPI1, NFYB, EIF2S2, PSMB6, PSMD1, PSMA3, MAP2K7, SEM1, RRAGD, DYNC1LI1, TFDP2, VCP, PSMA7, PSMD8, ELOC, RXRA, DCTN4, HDGF, GSK3B, PSMC4, ADD1, GSK3A, PSMB2, HDAC3, NPAS2, PSMC6, BAG1, PSMA5, UBE2D1, CAPZB, COX5A, RPS6KA3, MTF1, DNAJC2, RRAGC, EP300, CDC27, NUP37, PSMB7, CDC26, DYNC1H1, ATP6V1E2, MAP4K4, SRPRA, FBXL17, RPTOR, ATF4, TACO1, PSMD13, BAG3, CSNK2A1, HSPA9, NDC1, EIF2S1, HSPA4, COX16, RPL26L1, MAPKAPK2, TUBA4A, MAPK9, PSMC3, MT-CO2, PRDX3, MLST8, UBE2S, MIOS, MAPKAPK5, CHD9, YIF1A, MAPK1, GOSR2, PSMF1, ATP6V0C, TXNRD1, DCTN5, NCOR1, CYCS, RPS6KA2, AKT1S1, PSMB3, EGLN1, ATP6V0E1, SOD2, COX6C, HIF1AN, SCO1, FNIP2, NUP58, FKBP5, BMI1, DEPDC5, TFDP1, ZBTB17, SIRT1, RPS29, DNAJB9, CREBBP, PSMB4, ACTR1A, DCTN2, ATP6V0B, COX7C, CAPZA2, COX19, HIRA, ASNS, HMOX1, NDUFA4, TUBB4B, CDC16, SURF1, ATOX1, COX8A, YWHAE, CARM1, PSMD4, PARN, TGS1, BAG5, LIMD1, LRPPRC, SRPRB, NUP214, COX11, ATP6V1E1, RANBP2, NUP188, TINF2, ERN1, GFPT1, HYOU1, NRIP1, HSPA8, COX4I1, CLOCK, PPP2R5B, UBE2D3, PSMC5, COX5B, ANAPC11
REACTOME_INACTIVATION_OF_CSF3_G_CSF_SIGNALING	0.0816831683168317	0.310708702449192	-0.398335530469523	-1.36490896571234	32	21	UBE2D2, JAK1, CUL5, ELOC, UBE2D1
REACTOME_PIWI_INTERACTING_RNA_PIRNA_BIOGENESIS	0.120481927710843	0.405860731059833	-0.436111537605701	-1.3661246169924	49	15	POLR2B, POLR2J, POLR2D
REACTOME_ERYTHROPOIETIN_ACTIVATES_PHOSPHOINOSITIDE_3_KINASE_PI3K	0.132250580046404	0.435864695825308	-0.572642396697685	-1.36808098984799	56	7	PIK3CB, PIK3R1, PIK3CA
REACTOME_ESTABLISHMENT_OF_SISTER_CHROMATID_COHESION	0.131944444444444	0.435864695825308	-0.522433790476067	-1.37530065523144	56	9	WAPL, ESCO1, PDS5A, SMC3, STAG1, STAG2, RAD21
REACTOME_VITAMIN_B2_RIBOFLAVIN_METABOLISM	0.118834080717489	0.403731171668391	-0.702199479760041	-1.3755686756755	52	4	RFK, FLAD1
REACTOME_HIV_TRANSCRIPTION_ELONGATION	0.0584958217270195	0.245404634685913	-0.344019693440518	-1.37564899896887	20	40	ELOA, POLR2B, ELOC, POLR2J, TCEA1, POLR2D, CTDP1, CDK7, CCNH
REACTOME_HEME_BIOSYNTHESIS	0.107476635514019	0.371495327102804	-0.509886212982015	-1.37967762587754	45	10	COX10, ALAS1, ALAD, HMBS, FECH
REACTOME_MOLYBDENUM_COFACTOR_BIOSYNTHESIS	0.129753914988814	0.431843206342215	-0.651401951305265	-1.38015754022553	57	5	MOCS3, MOCS2, MOCS1, GPHN, NFS1
REACTOME_HATS_ACETYLATE_HISTONES	0.0359281437125748	0.183095347766006	-0.297073499253318	-1.38677562755576	11	77	KANSL3, MSL3, BRPF3, KANSL2, TADA2B, TADA3, ELP3, PHF20, ENY2, TAF6L, EP300, KAT2B, KAT14, SAP130, ELP5, ELP6, TAF5L, MORF4L1, WDR5, SGF29, CREBBP, BRPF1, EPC1, KAT7, CLOCK, ZZZ3, HCFC1, ATXN7L3
REACTOME_RNA_POLYMERASE_III_TRANSCRIPTION	0.0633608815426997	0.261672212085435	-0.350299531923063	-1.39410759207665	22	39	BRF2, GTF3C4, GTF3C6, POLR3E, NFIC, SNAPC5, POLR1D, GTF3C1, POLR3F, GTF3A, POLR3D, POLR3H, CRCP, POLR3GL, TBP, ZNF143, GTF3C2, GTF3C5, NFIX, POLR2K, POLR3C
REACTOME_MRNA_DECAY_BY_5_TO_3_EXORIBONUCLEASE	0.0939759036144578	0.343336368093004	-0.448587918553141	-1.40520702980094	38	15	LSM1, PATL1, EDC3, LSM5, XRN1, LSM3, DDX6
REACTOME_GDP_FUCOSE_BIOSYNTHESIS	0.0478260869565217	0.219778838904247	-0.914762943615388	-1.40617336180932	21	2	SLC35C1
REACTOME_RAF_ACTIVATION	0.0652741514360313	0.267489435008479	-0.362570346935343	-1.41079071825191	24	34	RAF1, SHOC2, PPP1CC, ARAF, BRAP, PPP2R5E, MARK3, MAP2K2, PPP1CB, PPP2CB, PPP2R5C, YWHAB, PPP2R5B, CALM1, CAMK2G
REACTOME_IRAK2_MEDIATED_ACTIVATION_OF_TAK1_COMPLEX	0.0911214953271028	0.336155864431771	-0.523261128121084	-1.41586819290123	38	10	TAB2, TAB3
REACTOME_RNA_POLYMERASE_III_CHAIN_ELONGATION	0.072289156626506	0.289520803617493	-0.440535515486452	-1.41591197934615	29	16	POLR3E, POLR1D, POLR3F, POLR3D, POLR3H, CRCP, POLR3GL
REACTOME_SYNTHESIS_OF_SUBSTRATES_IN_N_GLYCAN_BIOSYTHESIS	0.0394366197183099	0.193531559728743	-0.342493795767386	-1.41835103569599	13	46	CMAS, GNPNAT1, SLC35C1, ST3GAL1, SLC17A5, DOLK, ALG5, ST3GAL3, NUS1, GNE, NEU4, ST6GALNAC2, DPM1, GFPT1, ST3GAL2, NANS, DHDDS
REACTOME_CYTOSOLIC_TRNA_AMINOACYLATION	0.089041095890411	0.33026379561033	-0.631070531520152	-1.42161979270007	38	6	AIMP2, FARSB, PPA1, AIMP1, EEF1E1
REACTOME_SIALIC_ACID_METABOLISM	0.0629722921914358	0.261513157894737	-0.411366136735591	-1.43643251055942	24	22	CMAS, ST3GAL1, SLC17A5, ST3GAL3, GNE, NEU4, ST6GALNAC2, ST3GAL2, NANS
REACTOME_RORA_ACTIVATES_GENE_EXPRESSION	0.0738916256157636	0.29371921182266	-0.433701691653227	-1.44198869907021	29	18	PPARA, MED1, RXRA, EP300, CHD9, CREBBP, CARM1, TGS1
REACTOME_SARS_COV_2_INFECTION	0.0230547550432277	0.134611151560304	-0.321334319092358	-1.44327217872808	7	65	GALNT1, BECN1, ZCRB1, CHMP3, CHMP2B, VCP, ST3GAL1, GSK3B, PARP6, GSK3A, RPN2, CANX, PIK3C3, FURIN, CHMP7, SUMO1, ST3GAL3, MGAT4B, RPN1
REACTOME_SYNTHESIS_OF_BILE_ACIDS_AND_BILE_SALTS_VIA_7ALPHA_HYDROXYCHOLESTEROL	0.0679156908665105	0.274076011364852	-0.467084037026163	-1.44375978901807	28	14	RXRA, AKR1C2, CYP27A1, HSD17B4, AKR1C1, SCP2, AKR1C3, NCOA1, NCOA2
REACTOME_GLYOXYLATE_METABOLISM_AND_GLYCINE_DEGRADATION	0.0544554455445545	0.235283039173483	-0.421780944815103	-1.4452454001936	21	21	GCSH, DBT, DLAT, DHTKD1, PXMP2, DLD, PDHX, OGDH, GOT2, PDHA1, NDUFAB1, PDHB
REACTOME_MAPK1_ERK2_ACTIVATION	0.0946882217090069	0.344517786080826	-0.577021790418326	-1.4521126344365	40	8	PTPN11, JAK1, MAP2K2, MAPK1
REACTOME_REGULATION_OF_LIPID_METABOLISM_BY_PPARALPHA	0.0171821305841924	0.11015962753575	-0.299778300087225	-1.45282440781207	4	104	PPARA, MED10, MED1, NR1H2, HMGCR, NFYB, ESRRA, MED11, MED18, RXRA, HDAC3, NPAS2, MED13, MTF1, NCOA3, EP300, HMGCS1, ALAS1, ME1, ARNT2, MED15, MED21, CHD9, TXNRD1, NCOR1, GPS2, MED7, MED13L, ACOX1, CREBBP, SREBF2, ACSL1, PEX11A, CARM1, TGS1, CLOCK, MED8, ARNT, MED24, MED4, MED20, PLIN2
REACTOME_METALLOPROTEASE_DUBS	0.0674698795180723	0.273666092943201	-0.464708467741864	-1.45570484328934	27	15	PSMD14, STAMBP, EP300, KAT2B, STAM
REACTOME_CREB_PHOSPHORYLATION	0.0867579908675799	0.325042589437819	-0.646785358091852	-1.45702076196948	37	6	RPS6KA3, ATF1, MAPKAPK2, RPS6KA2
REACTOME_RETROGRADE_TRANSPORT_AT_THE_TRANS_GOLGI_NETWORK	0.0371428571428571	0.18513210927004	-0.35064154895129	-1.45821076614607	12	48	GOLGA4, RGP1, NAA35, NAA30, COG2, VTI1A, GCC1, VPS51, SYS1, M6PR, TGOLN2, GOLGA1, RABEPK, TMF1, IGF2R, NSF, GCC2
REACTOME_MATURATION_OF_PROTEIN_3A	0.0763888888888889	0.299897119341564	-0.554267733611775	-1.45910312676232	32	9	GALNT1, ST3GAL1, ST3GAL3, ST6GALNAC2, ST3GAL2
REACTOME_TP53_REGULATES_METABOLIC_GENES	0.0180722891566265	0.113129684090693	-0.308725495184383	-1.46219135017613	5	82	TIGAR, GSR, AGO4, MTOR, YWHAG, RRAGD, PRKAG1, COX5A, RRAGC, RPTOR, TACO1, COX16, MT-CO2, MLST8, TXNRD1, CYCS, COX6C, SCO1, YWHAB, AGO2, COX7C, COX19, PRKAG3, NDUFA4, SURF1, COX8A, YWHAE, LRPPRC, COX11, COX4I1, COX5B, TSC1, PRKAB2, PRKAG2, COX7B
REACTOME_CARGO_CONCENTRATION_IN_THE_ER	0.0483460559796438	0.2211589284224	-0.409371893063004	-1.46287869691695	18	24	CNIH1, SEC23A, TMED2, MIA3, MCFD2, LMAN1, SEC24C, SAR1B, GOSR2, F8
REACTOME_ATTACHMENT_AND_ENTRY	0.0574712643678161	0.24367816091954	-0.84029995476325	-1.46312997371296	24	3	VCP, FURIN
REACTOME_PEROXISOMAL_PROTEIN_IMPORT	0.0257142857142857	0.144984802431611	-0.348674384039838	-1.47041421902545	8	51	PEX2, PEX5, USP9X, UBE2D2, IDE, GNPAT, NUDT19, UBE2D1, AGPS, PEX13, HSD17B4, ACOX3, ACOX1, DHRS4, UBE2D3, ACOT2, UBC, SCP2, LONP2, IDH1, PEX26, PHYH
REACTOME_ARACHIDONATE_PRODUCTION_FROM_DAG	0.0514541387024608	0.227255779269202	-0.695439766360293	-1.47346263761043	22	5	DAGLA, ABHD6
REACTOME_CELL_CYCLE	0.0065359477124183	0.0576034779458382	-0.249287765917458	-1.47377446666978	0	463	PSMB5, PSMD14, HERC2, PSMD7, PSMD6, E2F6, PSMC1, PSMD12, LIN54, FBXL18, PSMC2, PSMA1, SSNA1, PSMA6, RAD1, E2F3, PSMA4, PSMD3, PSMD2, PSMD11, PSMA2, CUL1, CHMP3, PAFAH1B1, SEC13, PSME4, PSME3, YWHAG, PSMB6, POLR2B, PPP6C, PSMD1, PSMA3, CLIP1, KPNB1, PPP1CC, SEM1, DYNC1LI1, TFDP2, CHMP2B, PSMA7, MCPH1, SPAST, ANKRD28, PSMD8, ENSA, PRKCA, GSK3B, PSMC4, POLR2J, PSMB2, RMI1, PHF20, PSMC6, MIS12, E2F4, CEP70, PSMA5, UBE2D1, HUS1, VRK2, POLR2D, PPP2R5E, VPS4A, HAUS2, EP300, DHFR, CDC27, NUP37, PSMB7, BTRC, CDC26, DYNC1H1, TEN1, NOP10, UBE2V2, PSMD13, WAPL, FEN1, PCBP4, CSNK2A1, CHMP7, LPIN1, SMARCA5, NDC1, USO1, GORASP2, TUBA4A, PPP1CB, TAOK1, TUBG1, SUMO1, DAXX, RNF8, PSMC3, INCENP, CDK7, UBE2S, OPTN, NCAPD2, CCNH, MZT1, CNEP1R1, FBXW11, RAB1B, ESCO1, PPP6R3, MAPK1, RFC1, PSMF1, ARPP19, PPP2CB, CHMP4B, GOLGA2, PCM1, PPP1R12B, PSMB3, BLM, CC2D1B, CTDNEP1, NUP58, PPP2R2A, PPP2R5C, BRCC3, TFDP1, PSMB4, YWHAB, ACTR1A, CDK11B, DCTN2, TUBB4B, CCP110, CDC16, YWHAE, POLD4, PSMD4, CEP76, NUP214, RANBP2, NSD2, SUN2, NUP188, TINF2, CKAP5, DYRK1A, PPP2R5B, KIF2A, NEDD1, PSMC5, ANAPC11, SET, TOP3A, ATRX, PRKACA
REACTOME_RECYCLING_OF_EIF2_GDP	0.0831408775981524	0.313999989028652	-0.587012461853532	-1.47725480490297	35	8	EIF2S2, EIF2S1
REACTOME_ADAPTIVE_IMMUNE_SYSTEM	0.00709219858156028	0.0606268588423702	-0.24695481186533	-1.47773840736879	0	524	TAB2, PSMB5, PSMD14, HERC2, PSMD7, PSMD6, RNF14, RNF6, AREL1, CUL3, MAPKAP1, TRIM37, TRIM41, CHUK, PSMC1, PSMD12, KIF5B, RAC1, FBXL18, PSMC2, PIK3CB, PSMA1, WWP1, PTPN11, RNF130, KEAP1, PSMA6, SEC23A, MTOR, RAF1, UBE2D2, PSMA4, CUL2, PSMD3, PSMD2, PSMD11, PSMA2, CUL1, UBE3C, NFKBIB, FBXO6, UBE2L3, SEC13, PSME4, PSME3, NPEPPS, UBE2F, NEDD4, PSMB6, CUL5, PSMD1, PSMA3, SEM1, RNF41, RAP1A, DYNC1LI1, PSMA7, PSMD8, ELOC, BTBD1, UBE2M, DCTN4, PSMC4, ERAP1, PSMB2, AP1G1, UBE2Q1, PSMC6, CANX, ORAI1, RNF220, PSMA5, UBE2D1, TRIP12, CAPZB, NFATC3, SEC61A1, DNM2, UBR4, TRIM39, UBE2A, STIM1, PPP2R5E, RAB7A, UBE3A, FBXO32, LGMN, CDC27, SEC24C, PSMB7, BTRC, CDC26, DYNC1H1, ASB13, UBE4A, BLMH, ASB12, RNF19B, FBXO9, RNF126, UBE2V2, UBE2J2, PSMD13, RACGAP1, UBE3B, ITGB1, ARIH2, TUBA4A, FBXW4, PSMC3, PAK2, SAR1B, MLST8, UBE2S, DCAF1, FBXL14, UBE2K, UBE2D4, UBE2R2, SEC61A2, FBXW11, PIK3R1, PIK3CA, ASB2, PSMF1, RNF123, DCTN5, PPP2CB, RNF111, SOS1
REACTOME_RSK_ACTIVATION	0.0514541387024608	0.227255779269202	-0.697491858708916	-1.47781050719006	22	5	RPS6KA3, MAPK1, RPS6KA2, PDPK1
REACTOME_SYNTHESIS_OF_BILE_ACIDS_AND_BILE_SALTS	0.0495049504950495	0.223351204551308	-0.432765893940202	-1.48288566675749	19	21	OSBPL3, RXRA, OSBP, AKR1C2, CYP27A1, HSD17B4
REACTOME_BILE_ACID_AND_BILE_SALT_METABOLISM	0.0495049504950495	0.223351204551308	-0.432765893940202	-1.48288566675749	19	21	OSBPL3, RXRA, OSBP, AKR1C2, CYP27A1, HSD17B4
REACTOME_TRANSPORT_TO_THE_GOLGI_AND_SUBSEQUENT_MODIFICATION	0.015625	0.104385504201681	-0.287954143889131	-1.48357240761859	3	147	YKT6, CNIH1, COG2, SEC23A, TMED2, SEC13, PPP6C, TRAPPC10, DYNC1LI1, MIA3, ANKRD28, DCTN4, MCFD2, SEC22C, CAPZB, PPP6R1, LMAN1, MAN2A2, GOSR1, SEC24C, DYNC1H1, CHST10, USO1, MAN1A2, TUBA4A, B4GALT2, SAR1B, MGAT4B, COPB2, RAB1B, PPP6R3, COPG1, GOSR2, F8, DCTN5, SEC23IP, GOLGA2, ANK3, B4GALT5, TMEM115, ACTR1A, DCTN2, CAPZA2, TUBB4B, TBC1D20, STX17, MGAT1, NSF, TFG, SPTB, TMED10, TMED7, LMAN2
REACTOME_METABOLISM_OF_PORPHYRINS	0.0485436893203883	0.2211589284224	-0.455671758886794	-1.48439623779371	19	17	ABCC1, COX10, ALAS1, ALAD, HMBS, FECH, HMOX1
REACTOME_MAPK_FAMILY_SIGNALING_CASCADES	0.00469483568075117	0.0471698113207547	-0.269052551066059	-1.48692801035382	0	233	PSMB5, PSMD14, PSMD7, PSMD6, CUL3, PSMC1, PSMD12, RAC1, AGO4, PSMC2, PIK3CB, PSMA1, PTPN11, MAPK6, PSMA6, RAF1, PSMA4, PSMD3, PSMD2, PSMD11, PSMA2, SHOC2, JAK1, PSME4, PSME3, PSMB6, PSMD1, PSMA3, PPP1CC, SEM1, RAP1A, LYPLA1, PSMA7, PSMD8, ARAF, PSMC4, PSMB2, BRAP, PSMC6, RANBP9, PSMA5, VCL, PPP2R5E, ICMT, MET, NCOA3, PSMB7, GOLGA7, PSMD13, MARK3, MAP2K2, PPP1CB, PSMC3, PAK2, MAPKAPK5, PIK3R1, PIK3CA, MAPK1, MAPK12, PSMF1, PPP2CB, SOS1, DLG1, PSMB3
REACTOME_VESICLE_MEDIATED_TRANSPORT	0.00719424460431655	0.0611703150848305	-0.249484239288503	-1.49142296163977	0	528	GALNT1, GOLGA4, RGP1, RABEP1, COPS3, KIF5B, NAA35, CLINT1, RAC1, NAA30, YKT6, VTA1, KIF1B, VPS37C, CNIH1, AP4E1, COG2, KIF1C, COPS5, VTI1A, SEC23A, TBC1D1, GOLGA5, TMED2, CHMP3, GCC1, PAFAH1B1, SEC13, YWHAG, CHM, ALS2, KIF16B, PPP6C, MON1A, UBQLN1, RAB4A, TRAPPC10, TRAPPC8, EPS15, RAB3GAP2, DYNC1LI1, CHMP2B, MIA3, DENND1A, EXOC5, TOR1B, PRKAG1, YIPF6, ANKRD28, VPS51, BIN1, DCTN4, EPN1, MCFD2, AP3B1, COPS8, VPS37A, SYS1, RALGAPB, AP1G1, ACTR2, RAB5A, SNF8, SORT1, VAMP7, SEC22C, CAPZB, PPP6R1, DNM2, RHOQ, COPS2, EPS15L1, GALNT2, TRAPPC13, UBAP1, FNBP1, AGPAT3, LMAN1, VPS4A, RAB7A, CCZ1, MAN2A2, GOSR1, SEC24C, SNAP29, ARPC2, DYNC1H1, SYNJ1, M6PR, STAM, TGOLN2, RACGAP1, CHMP7, RAB3GAP1, TFRC, USO1, TBC1D4, MAN1A2, TUBA4A, GOLGA1, FTH1, TBC1D25, TRIP11, SAR1B, RAB10, BNIP1, OPTN, TOR1A, COPB2, RAB1B, PPP6R3, COPG1, CLTB, VPS4B, GOSR2, DNASE2, F8, RABEPK, STAM2, GNS, DCTN5, CHMP4B, RABGAP1, SEC23IP, GOLGA2, MYO5A, ANK3, UBQLN2, BICD2, KIF21A, TRIP10, RAB12, GRK2, TMEM115, CCZ1B, TMF1, STX18, TSG101, YWHAB, ACTR1A, DCTN2, SNX2, IGF2R, CAPZA2, PRKAG3, SNAPIN, MADD, TUBB4B, TBC1D20, STX17, YWHAE, SYNJ2, VPS25, DENND5A, TBC1D14, SCARB2, ARPC4
REACTOME_TRANSLATION_OF_REPLICASE_AND_ASSEMBLY_OF_THE_REPLICATION_TRANSCRIPTION_COMPLEX	0.0555555555555556	0.237455197132616	-0.512419384941556	-1.49404827044336	23	12	BECN1, CHMP3, CHMP2B, PIK3C3, CHMP7, CHMP4B, UVRAG
