pathway	pval	padj	ES	NES	nMoreExtreme	size	leadingEdge
REACTOME_METABOLISM_OF_AMINO_ACIDS_AND_DERIVATIVES	0.103448275862069	0.402158334035916	-0.209861419491399	-1.17160114264578	20	278	SLC25A15, PSMB5, PSMD7, PSMD14, PSMD6, PSMC1, GCSH, PSMC2, GSR, PSMD12, ADO, PSMA1, PSMB6, PSME4, GLUD1, PSMA4, PSMD1, PSMD2, RIMKLA, PSMA6, PSMD3, AIMP2, PSMA2, SLC25A44, ACADSB, SEM1, PSMD11, DLAT, DBT, SERINC1, PSME3, PSMA3, DHTKD1, RIDA, PSMC6, BCAT2, DLD, PSMA7, CKMT2, PSMC4, PSMB2, PDHX, PSMD8, MPST, MTRR, PSMF1, EEFSEC, PXMP2, CKM, KYAT3, TMLHE, MCCC1, PSMB7, GOT2, PSMA5, RPL26L1, TXNRD1, PSMC3, MCCC2, TXN2, RPS29, TST, GCAT, BHMT2, AIMP1, OAZ2, PSMD13, PDHB, GSTZ1, GCDH, APIP
REACTOME_PRE_NOTCH_PROCESSING_IN_GOLGI	0.237089201877934	0.606741573033708	-0.372052083544988	-1.17213302591913	100	16	SEL1L, ST3GAL3, TMED2, ATP2A2, FURIN, RAB6A, ATP2A1
REACTOME_REDUCTION_OF_CYTOSOLIC_CA_LEVELS	0.271762208067941	0.648801667909948	-0.46683771452523	-1.17605501515309	127	8	ATP2B1, ATP2A2, ATP2A1, CALM1
REACTOME_SIGNALING_BY_MEMBRANE_TETHERED_FUSIONS_OF_PDGFRA_OR_PDGFRB	0.293139293139293	0.667752831076613	-0.604712444441752	-1.17833326601151	140	4	GOLGA4
REACTOME_TERMINATION_OF_O_GLYCAN_BIOSYNTHESIS	0.266233766233766	0.643330833300438	-0.435802441262057	-1.17880378037374	122	10	ST3GAL1, ST3GAL3, ST6GALNAC2, ST3GAL2
REACTOME_LOSS_OF_FUNCTION_OF_MECP2_IN_RETT_SYNDROME	0.275	0.649856061413797	-0.424509350221648	-1.18371702543338	120	11	HDAC3, NCOR1, PRKACA, CALM1, GPS2
REACTOME_SIGNALING_BY_INTERLEUKINS	0.0670103092783505	0.308827116439161	-0.209912998879327	-1.18387644865435	12	293	NKIRAS2, TAB2, PSMB5, PSMD7, PSMD14, PSMD6, PSMC1, CNTF, MAP2K4, CHUK, MAPK8, TAB3, PSMC2, IFNLR1, PSMD12, PIK3CB, PTPN11, CUL1, PSMA1, PSMB6, RPS6KA3, DUSP3, RAPGEF1, PSME4, MAPKAPK3, PSMA4, PSMD1, PSMD2, PSMA6, NKIRAS1, JAK1, PELI3, PSMD3, PSMA2, MAPK9, ZEB1, SEM1, PSMD11, NFKBIB, MAP2K7, BTRC, PSME3, TBK1, SOS2, PSMA3, ATF1, PSMC6, FBXW11, IRAK1, PSMA7, ELK1, PSMC4, VAMP7, MAPK1, PSMB2, CRKL, PSMD8, MEF2A, PSMF1, CANX, ITGB1, RPS6KA2, PAK2, PTPN20, PSMB7, SOS1, PSMA5, PIK3CA, BCL2, UBE2V1
REACTOME_PHASE_4_RESTING_MEMBRANE_POTENTIAL	0.265560165975104	0.643330833300438	-0.768120046342671	-1.18524655011168	127	2	KCNJ12
REACTOME_ERYTHROPOIETIN_ACTIVATES_PHOSPHOINOSITIDE_3_KINASE_PI3K	0.260330578512397	0.640751733490264	-0.496246138886348	-1.18541153490488	125	7	PIK3CB, PIK3CA, PIK3R1
REACTOME_AMINO_ACID_CONJUGATION	0.227083333333333	0.598396748334651	-0.888586240224936	-1.1859637379794	108	1	ACSM5
REACTOME_LYSOSOME_VESICLE_BIOGENESIS	0.213917525773196	0.583411433926898	-0.329215554025256	-1.18621661182513	82	28	AP4E1, AP1G1, DNASE2, VAMP7, DNM2, M6PR, HSPA8, AP1S2, CLTB, GNS
REACTOME_SUMO_IS_PROTEOLYTICALLY_PROCESSED	0.247881355932203	0.618730543064684	-0.529233820794762	-1.18664582113898	116	6	SENP2, SUMO1
REACTOME_BIOTIN_TRANSPORT_AND_METABOLISM	0.268181818181818	0.644122493820379	-0.425945239244519	-1.18772090964022	117	11	PC, MCCC1, MCCC2, ACACB, HLCS, PCCB
REACTOME_REGULATION_OF_BACH1_ACTIVITY	0.268181818181818	0.644122493820379	-0.426084563091073	-1.18810940522725	117	11	FBXL17, CUL1
REACTOME_TRAF6_MEDIATED_INDUCTION_OF_TAK1_COMPLEX_WITHIN_TLR4_COMPLEX	0.25	0.623040752351097	-0.395858323508119	-1.19141706260602	108	14	TAB2, TAB3
REACTOME_TRANSCRIPTIONAL_ACTIVITY_OF_SMAD2_SMAD3_SMAD4_HETEROTRIMER	0.20911528150134	0.576244883166605	-0.28797812575502	-1.19234496333924	77	44	USP9X, TFDP2, PPM1A, UBE2D1, TFDP1, PARP1, MAPK1, E2F4, CCNK, NCOR1, SMAD4, RNF111
REACTOME_RNA_POLYMERASE_III_CHAIN_ELONGATION	0.225352112676056	0.598180065367161	-0.378468029993456	-1.19234617095281	95	16	POLR3F, POLR1D, POLR3E, POLR3H, CRCP, POLR3D, POLR3GL, POLR3K, POLR2K, POLR2L, POLR2E, POLR3C, POLR3A
REACTOME_PEROXISOMAL_LIPID_METABOLISM	0.218362282878412	0.591185182407859	-0.356867530833776	-1.19295922521287	87	21	ACBD5, NUDT19, ABCD1, HSD17B4, SCP2, ACOX1, ACOX3, PHYH
REACTOME_BETA_OXIDATION_OF_VERY_LONG_CHAIN_FATTY_ACIDS	0.252653927813163	0.628669397844961	-0.47449543114864	-1.19534629295557	118	8	ABCD1, HSD17B4, ACOX1
REACTOME_ACTIVATION_OF_PPARGC1A_PGC_1ALPHA_BY_PHOSPHORYLATION	0.255411255411255	0.631479933110368	-0.442639540219933	-1.19729747690971	117	10	PRKAG1, MAPK12, PRKAB2, PRKAG3
REACTOME_CREB1_PHOSPHORYLATION_THROUGH_NMDA_RECEPTOR_MEDIATED_ACTIVATION_OF_RAS_SIGNALING	0.197149643705463	0.561497326203209	-0.36982359819343	-1.19774142276391	82	18	RPS6KA3, MAPK1, CAMK2G, RPS6KA2, CALM1, DLG1, PDPK1
REACTOME_PKA_MEDIATED_PHOSPHORYLATION_OF_KEY_METABOLIC_FACTORS	0.282744282744283	0.655763350636422	-0.617099952773953	-1.20247137212293	135	4	PRKACA, PFKFB1, MLXIPL
REACTOME_LOSS_OF_MECP2_BINDING_ABILITY_TO_THE_NCOR_SMRT_COMPLEX	0.239669421487603	0.609719008264463	-0.50371456372748	-1.2032517884817	115	7	HDAC3, NCOR1, GPS2, NCOR2, TBL1X
REACTOME_BMAL1_CLOCK_NPAS2_ACTIVATES_CIRCADIAN_GENE_EXPRESSION	0.192214111922141	0.556956704497688	-0.344577340402749	-1.20711205641986	78	24	PPARA, MED1, RXRA, NPAS2, CARM1, CREBBP, CHD9, TGS1, CLOCK
REACTOME_TBC_RABGAPS	0.204081632653061	0.568283355373673	-0.30431313457292	-1.21196565274448	79	37	RABEP1, RAB4A, RAB5A, RAB7A, RABGAP1, OPTN, TBC1D25, RAB6A, TBC1D14, TSC1, TBC1D20, TBC1D7, RAB33B, TBC1D13, GABARAPL2, TBC1D15
REACTOME_DISASSEMBLY_OF_THE_DESTRUCTION_COMPLEX_AND_RECRUITMENT_OF_AXIN_TO_THE_MEMBRANE	0.201995012468828	0.566441040256502	-0.342534361024908	-1.21225416759817	80	25	APC, GSK3B, PPP2R5C, AMER1, PPP2R5E, PPP2CB, PPP2R5B, AXIN1, LRP6, DVL1
REACTOME_SMAC_XIAP_REGULATED_APOPTOTIC_RESPONSE	0.229338842975207	0.598396748334651	-0.508484943559709	-1.21464706763025	110	7	XIAP, CYCS, CASP3, APAF1, DIABLO
REACTOME_TRANSPORT_TO_THE_GOLGI_AND_SUBSEQUENT_MODIFICATION	0.0657439446366782	0.305651672433679	-0.231497177856251	-1.21811311196562	18	147	SEC23A, CNIH1, COG2, YKT6, PPP6C, DYNC1LI1, MIA3, TRAPPC10, DCTN4, ANKRD28, LMAN1, SEC13, MAN2A2, CHST10, TMED2, CAPZB, CAPZA2, USO1, MCFD2, B4GALT2, GOSR1, SEC22C, RAB1B, PPP6R1, DYNC1H1, GOLGA2, MAN1A2, ANK3, SAR1B, TUBA4A, F8, SEC24C, ANK2, DYNLL2
REACTOME_AMINO_ACIDS_REGULATE_MTORC1	0.153846153846154	0.502290317485389	-0.289819057944091	-1.22008131321901	55	47	RRAGD, MTOR, ATP6V1E2, SEC13, MLST8, RRAGC, RPTOR, ATP6V0C, MIOS, BMT2, FNIP2, DEPDC5, ATP6V0E1, ATP6V0E2, ATP6V1E1, LAMTOR3, ATP6V0B, FNIP1, LAMTOR1, ATP6V1D, ATP6V1F
REACTOME_ERK_MAPK_TARGETS	0.196029776674938	0.560943552850028	-0.367039327786685	-1.22696214776403	78	21	RPS6KA3, DUSP3, ELK1, MAPK1, MEF2A, RPS6KA2, PPP2CB, MEF2C
REACTOME_TICAM1_RIP1_MEDIATED_IKK_COMPLEX_RECRUITMENT	0.180952380952381	0.543883337834188	-0.383945759646711	-1.22804344429776	75	17	CHUK, UBE2D2, UBE2D1, BIRC2, UBE2V1, TICAM1, UBE2N, IKBKG, UBB, UBE2D3
REACTOME_PI3K_AKT_SIGNALING_IN_CANCER	0.133333333333333	0.461873638344227	-0.275471331334269	-1.2323218669447	43	65	FOXO4, MAPKAP1, CHUK, RAC1, PIK3CB, PTPN11, MTOR, GSK3B, MET, STRN, RPS6KB2, NRG4, GSK3A, BAD
REACTOME_ARACHIDONATE_PRODUCTION_FROM_DAG	0.233404710920771	0.60280360544798	-0.589773754729843	-1.23348330838803	108	5	DAGLA, ABHD6, MGLL
REACTOME_ION_HOMEOSTASIS	0.155612244897959	0.504945855893378	-0.305568841917149	-1.23809585766828	60	40	ATP2B1, ORAI1, RYR1, TRDN, KCNJ11, STIM1, ATP2A2, CAMK2G, ASPH, PRKACA, ATP2A1, CALM1, TNNI3, NOS1, PLN
REACTOME_RESPONSE_OF_MTB_TO_PHAGOCYTOSIS	0.182266009852217	0.544396890558127	-0.373603899073869	-1.2401578588646	73	20	KPNA1, KPNB1, GSK3A, RAB5A, RAB7A, MAPK1, PGK1
REACTOME_FORMATION_OF_RNA_POL_II_ELONGATION_COMPLEX	0.124277456647399	0.448075183830758	-0.287506183529686	-1.24196014487615	42	54	ELOA, POLR2B, CTR9, POLR2J, RTF1, TCEA1, POLR2D, ELOC, CCNK, LEO1, SUPT4H1, CDK7, CTDP1, ERCC3, CCNH, GTF2H1, IWS1, WDR61, MLLT1, SUPT6H, POLR2C
REACTOME_INACTIVATION_OF_CSF3_G_CSF_SIGNALING	0.178660049627792	0.539435947405587	-0.372617319592088	-1.24560860956701	71	21	CUL5, UBE2D2, JAK1, UBE2D1, ELOC, RNF7
REACTOME_SYNTHESIS_OF_DIPHTHAMIDE_EEF2	0.212314225053079	0.581156085014214	-0.494484828567014	-1.24570347351815	99	8	DNAJC24, DPH3
REACTOME_ALPHA_LINOLENIC_OMEGA3_AND_LINOLEIC_OMEGA6_ACID_METABOLISM	0.238636363636364	0.608063811188811	-0.447487307171329	-1.24778958081246	104	11	ABCD1, HSD17B4, SCP2, ACOX1, ACSL1
REACTOME_TRNA_PROCESSING_IN_THE_MITOCHONDRION	0.220338983050847	0.591185182407859	-0.557333230075971	-1.2496501970686	103	6	TRMT10C
REACTOME_INTEGRATION_OF_PROVIRUS	0.210191082802548	0.577363188633992	-0.496617477751199	-1.2510760316697	98	8	KPNA1, HMGA1
REACTOME_DARPP_32_EVENTS	0.168734491315136	0.522978247935803	-0.376023122189282	-1.25699374067738	67	21	PRKAR2A, PPP3CC, PPP3CB, PRKACA, PPP2CB, PPP3R1, CALM1, PPP1CA, CDK5
REACTOME_MAPK3_ERK1_ACTIVATION	0.201698513800425	0.566441040256502	-0.49946880446259	-1.25825907831404	94	8	PTPN11, JAK1
REACTOME_HIV_LIFE_CYCLE	0.0596026490066225	0.288354817883077	-0.241145889246598	-1.26092655967899	17	138	GTF2A2, ELOA, TAF13, VTA1, KPNA1, CHMP3, POLR2B, HMGA1, VPS37C, CHMP2B, GTF2A1, TAF3, POLR2J, SEC13, TCEA1, GTF2E1, POLR2D, NUP37, VPS37A, ELOC, FEN1, VPS4A, UBAP1, CCNK, CHMP7, SUPT4H1, NDC1, TAF11, FURIN, MVB12B, TSG101, CDK7, CHMP4B, LIG4, CTDP1, NUP58, VPS4B
REACTOME_ATTACHMENT_AND_ENTRY	0.198757763975155	0.562321787758891	-0.718192880660041	-1.26198273723251	95	3	VCP, FURIN
REACTOME_NONCANONICAL_ACTIVATION_OF_NOTCH3	0.197452229299363	0.561497326203209	-0.50252800921996	-1.26596581019397	92	8	PSEN2, APH1A, YBX1, PSENEN
REACTOME_ER_TO_GOLGI_ANTEROGRADE_TRANSPORT	0.0594059405940594	0.288354817883077	-0.246183505642683	-1.27043604019445	17	128	SEC23A, CNIH1, COG2, YKT6, PPP6C, DYNC1LI1, MIA3, TRAPPC10, DCTN4, ANKRD28, LMAN1, SEC13, TMED2, CAPZB, CAPZA2, USO1, MCFD2, GOSR1, SEC22C, RAB1B, PPP6R1, DYNC1H1, GOLGA2, ANK3, SAR1B, TUBA4A, F8, SEC24C, ANK2, DYNLL2, PPP6R3
REACTOME_CONVERSION_FROM_APC_C_CDC20_TO_APC_C_CDH1_IN_LATE_ANAPHASE	0.144893111638955	0.482977038796516	-0.392466310584949	-1.2710739918253	60	18	UBE2D1, CDC27, CDC26, CDC16, ANAPC11, UBE2S, CDC23, ANAPC15
REACTOME_TRANSCRIPTION_OF_THE_HIV_GENOME	0.0878787878787879	0.365778200856735	-0.284536608111083	-1.27287541111158	28	65	GTF2A2, ELOA, TAF13, POLR2B, GTF2A1, TAF3, POLR2J, TCEA1, GTF2E1, POLR2D, ELOC, CCNK, SUPT4H1, TAF11
REACTOME_SARS_COV_2_INFECTION	0.0848484848484849	0.35784904750422	-0.285288355657336	-1.27623835612361	27	65	GALNT1, ZCRB1, BECN1, CHMP3, GSK3B, CHMP2B, ST3GAL1, PARP6, ST3GAL3, SUMO1, VCP, PIK3C3, GSK3A, ST6GALNAC2, RPN2, CHMP7, CANX
REACTOME_TRNA_AMINOACYLATION	0.153284671532847	0.501486888348202	-0.364354592033744	-1.27639507676798	62	24	IARS2, AIMP2, YARS2, HARS2, PARS2, NARS2, AIMP1, PPA1, MARS2, PPA2, FARSB
REACTOME_HIV_ELONGATION_ARREST_AND_RECOVERY	0.121761658031088	0.445466978175395	-0.344332777468897	-1.28189087009168	46	31	ELOA, POLR2B, POLR2J, TCEA1, POLR2D, ELOC, CCNK, SUPT4H1
REACTOME_SIGNALING_BY_ROBO_RECEPTORS	0.0497925311203319	0.260428041056999	-0.238954628709249	-1.28647632739138	11	195	PSMB5, PSMD7, PRKAR2A, CUL2, PSMD14, PSMD6, PSMC1, EIF4G1, PSMC2, RAC1, PSMD12, NCK2, PSMA1, PSMB6, PSME4, PSMA4, PRKCA, PSMD1, PSMD2, PSMA6, GSPT1, PSMD3, PSMA2, SEM1, PSMD11, PSME3, SOS2, PSMA3, GPC1, PSMC6, DAG1, UPF2, USP33, PSMA7, PSMC4, ELOC, PSMB2, PSMD8, PSMF1, PAK2, PSMB7, SOS1, PSMA5, PPP3CB, PFN2, RPL26L1, PRKACA, PSMC3, ETF1, FLRT3, RPS29
REACTOME_PI3K_EVENTS_IN_ERBB4_SIGNALING	0.203389830508475	0.567350579839429	-0.574601584510505	-1.28836922790627	95	6	NRG4, PIK3CA, PIK3R1
REACTOME_APOPTOTIC_FACTOR_MEDIATED_RESPONSE	0.135714285714286	0.466059858068497	-0.403133539587401	-1.28941520521648	56	17	UACA, MAPK1, XIAP, AVEN, CYCS, CASP3, C1QBP, APIP, APAF1, BAK1, DIABLO
REACTOME_GDP_FUCOSE_BIOSYNTHESIS	0.147302904564315	0.486211081943151	-0.835724467998426	-1.28956345724267	70	2	SLC35C1
REACTOME_RORA_ACTIVATES_GENE_EXPRESSION	0.128266033254157	0.457672812030497	-0.398305111866806	-1.28998401862924	53	18	PPARA, MED1, RXRA, EP300, CARM1, CREBBP, CHD9
REACTOME_FORMATION_OF_ATP_BY_CHEMIOSMOTIC_COUPLING	0.147302904564315	0.486211081943151	-0.83725834797891	-1.2919303085751	70	2	MT-ATP8, MT-ATP6
REACTOME_MRNA_DECAY_BY_5_TO_3_EXORIBONUCLEASE	0.145584725536993	0.483256187064339	-0.422196167699296	-1.29315326968049	60	15	PATL1, LSM1, LSM5, LSM3, DDX6, EDC3, XRN1
REACTOME_ABERRANT_REGULATION_OF_MITOTIC_EXIT_IN_CANCER_DUE_TO_RB1_DEFECTS	0.134939759036145	0.465075465075465	-0.394279240207923	-1.29657765155644	55	19	UBE2D1, CDC27, CDC26, CDC16, ANAPC11, UBE2S, CDC23, ANAPC15
REACTOME_NEGATIVE_FEEDBACK_REGULATION_OF_MAPK_PATHWAY	0.197033898305085	0.561497326203209	-0.578312222441249	-1.29668920448612	92	6	RAF1, MAP2K2, MAPK1
REACTOME_INTRINSIC_PATHWAY_FOR_APOPTOSIS	0.10655737704918	0.409242100261345	-0.309054175277463	-1.29703724255746	38	46	YWHAG, MAPK8, TFDP2, PPP3CC, UACA, TFDP1, BAD, MAPK1, XIAP, AVEN, CYCS, BCL2, DYNLL2, PPP3R1, CASP3, C1QBP, APIP, TP53BP2, APAF1, YWHAE, AKT2, YWHAB, BAK1, BMF, DIABLO, PPP1R13B
REACTOME_GLYCEROPHOSPHOLIPID_CATABOLISM	0.178794178794179	0.539435947405587	-0.669753074007387	-1.30507042540679	85	4	GDE1, PNPLA6, GDPD5
REACTOME_ZBP1_DAI_MEDIATED_INDUCTION_OF_TYPE_I_IFNS	0.128571428571429	0.457672812030497	-0.4083558943742	-1.30611881086543	53	17	NKIRAS2, CHUK, NKIRAS1, NFKBIB, TBK1
REACTOME_RETROGRADE_TRANSPORT_AT_THE_TRANS_GOLGI_NETWORK	0.0815217391304348	0.351272534464475	-0.308460597624363	-1.31022964586604	29	48	GOLGA4, RGP1, NAA30, NAA35, COG2, VTI1A, VPS51, GCC1, SYS1, TGOLN2, M6PR, GOLGA1, RAB6A, IGF2R, RABEPK, GCC2, TMF1, NAA38, VAMP3, NSF
REACTOME_PIWI_INTERACTING_RNA_PIRNA_BIOGENESIS	0.138424821002387	0.47129649977258	-0.427954151267573	-1.31078951521692	57	15	POLR2B, POLR2J, POLR2D
REACTOME_BETA_OXIDATION_OF_OCTANOYL_COA_TO_HEXANOYL_COA	0.177730192719486	0.539295813786227	-0.628285136679265	-1.31402800275024	82	5	ACADM, HADHA, HADH, HADHB, ECHS1
REACTOME_BETA_OXIDATION_OF_HEXANOYL_COA_TO_BUTANOYL_COA	0.177730192719486	0.539295813786227	-0.628285136679265	-1.31402800275024	82	5	ACADS, HADHA, HADH, HADHB, ECHS1
REACTOME_UPTAKE_AND_FUNCTION_OF_ANTHRAX_TOXINS	0.170454545454545	0.526257722859665	-0.472112301013775	-1.31645479265591	74	11	MAP2K4, MAP2K7, MAP2K2, FURIN, CALM1
REACTOME_INHIBITION_OF_THE_PROTEOLYTIC_ACTIVITY_OF_APC_C_REQUIRED_FOR_THE_ONSET_OF_ANAPHASE_BY_MITOTIC_SPINDLE_CHECKPOINT_COMPONENTS	0.114285714285714	0.431625381744147	-0.413838904241509	-1.32365611699108	47	17	UBE2D1, CDC27, CDC26, CDC16, ANAPC11, UBE2S, CDC23, ANAPC15
REACTOME_ER_QUALITY_CONTROL_COMPARTMENT_ERQC	0.123152709359606	0.446042842555293	-0.399096905115265	-1.32478050832487	49	20	AMFR, RNF139, SEL1L, UGGT1, TRIM13
REACTOME_TRIGLYCERIDE_CATABOLISM	0.111904761904762	0.425061215634008	-0.414499344716396	-1.32576852369217	46	17	PPP1CC, PPP1CB, FABP3, PRKACA, ABHD5, PPP1CA, PNPLA4, MGLL
REACTOME_VITAMIN_B2_RIBOFLAVIN_METABOLISM	0.164241164241164	0.517115744838517	-0.680729483591719	-1.32645888644057	78	4	RFK, FLAD1
REACTOME_REGULATION_OF_IFNG_SIGNALING	0.168181818181818	0.522978247935803	-0.476094608064327	-1.32755919978801	73	11	PTPN11, JAK1, SUMO1
REACTOME_VESICLE_MEDIATED_TRANSPORT	0.0148148148148148	0.109053497942387	-0.22134339169663	-1.32803055276262	1	528	GALNT1, RABEP1, GOLGA4, KIF1B, KIF5B, RGP1, NAA30, VTA1, SEC23A, CLINT1, RAB4A, NAA35, CHMP3, COPS3, YWHAG, KIF1C, AP4E1, CNIH1, TBC1D1, ALS2, PRKAG1, CHM, COG2, RAC1, EPS15, COPS5, PAFAH1B1, VTI1A, YKT6, PPP6C, VPS37C, BIN1, CHMP2B, TRAPPC8, DYNC1LI1, GOLGA5, RAB3GAP2, VPS51, RHOQ, KIF16B, MIA3, FNBP1, TRAPPC10, DCTN4, GCC1, DENND1A, MON1A, RAB10, EPN1, TRAPPC13, ARPC2, EXOC5, ANKRD28, AP1G1, LMAN1, YIPF6, UBQLN1, SEC13, MAN2A2, AGPAT3, TMED2, SNF8, TOR1B, CAPZB, RALGAPB, RAB3GAP1, CCZ1, CAPZA2, AP3B1, TBC1D4, RAB5A, ACTR2, USO1, MCFD2, DNASE2, COPS8, RAB7A, SORT1, GOSR1, SEC22C, VPS37A, RAB1B, PPP6R1, DYNC1H1, TFRC, VAMP7, GOLGA2, COPS2, DNM2, MAN1A2, SYS1, RABGAP1, VPS4A, UBAP1, PRKAB2, ANK3, SAR1B, TRIP11, TUBA4A, STAM, CHMP7, MYO5A, SNAPIN, UBQLN2, PRKAG3, GALNT2, RACGAP1, TGOLN2, OPTN, EPS15L1, SYNJ1, F8, SEC24C, ANK2, SNAP29, DYNLL2, CCZ1B, KIF21A, TRIP10, TBC1D25, RAB12, PPP6R3, M6PR, GOLGA1, MVB12B, HSPA8, RAB6A, DENND5B, FTH1, COPB2, TOR1A, AP1S2, ITSN1, TSG101, TBC1D14, BICD2, CALM1, GRK2
REACTOME_CYTOSOLIC_TRNA_AMINOACYLATION	0.161016949152542	0.514390896921017	-0.593025586787851	-1.32967944741989	75	6	AIMP2, AIMP1, PPA1, FARSB, EEF1E1
REACTOME_YAP1_AND_WWTR1_TAZ_STIMULATED_GENE_EXPRESSION	0.159139784946237	0.511176278918214	-0.507208416911003	-1.33031362245735	73	9	KAT2B, HIPK2, TEAD1, HIPK1
REACTOME_TRAF6_MEDIATED_NF_KB_ACTIVATION	0.119106699751861	0.441853520145335	-0.398867243842961	-1.33335850719165	47	21	NKIRAS2, CHUK, MAVS, NKIRAS1, NFKBIB
REACTOME_CHOLESTEROL_BIOSYNTHESIS	0.11576354679803	0.436170709499685	-0.402707190421448	-1.33676465438519	46	20	GGPS1, HMGCR, HMGCS1, SC5D, DHCR24, LSS
REACTOME_GLYCOGEN_BREAKDOWN_GLYCOGENOLYSIS	0.147392290249433	0.486211081943151	-0.452362541711189	-1.33746138667572	64	13	PHKA1, PHKB, GYG1, AGL, PGM2L1, CALM1, PYGM, PHKG1
REACTOME_SYNTHESIS_OF_SUBSTRATES_IN_N_GLYCAN_BIOSYTHESIS	0.0737704918032787	0.329480567323632	-0.319139533682441	-1.33936343162788	26	46	CMAS, GNPNAT1, ST3GAL1, ST3GAL3, SLC17A5, DOLK, SLC35C1, ST6GALNAC2, GNE, GFPT1, NUS1, ST3GAL2, ALG5, NEU4
REACTOME_REGULATION_OF_EXPRESSION_OF_SLITS_AND_ROBOS	0.0283687943262411	0.179706705094516	-0.25355280251667	-1.34379807267642	7	157	PSMB5, PSMD7, CUL2, PSMD14, PSMD6, PSMC1, EIF4G1, PSMC2, PSMD12, PSMA1, PSMB6, PSME4, PSMA4, PSMD1, PSMD2, PSMA6, GSPT1, PSMD3, PSMA2, SEM1, PSMD11, PSME3, PSMA3, PSMC6, DAG1, UPF2, USP33, PSMA7, PSMC4, ELOC, PSMB2, PSMD8, PSMF1
REACTOME_MAPK_TARGETS_NUCLEAR_EVENTS_MEDIATED_BY_MAP_KINASES	0.0952380952380952	0.383363471971067	-0.366840748887132	-1.34390536653564	37	29	MAPK8, RPS6KA3, DUSP3, MAPK9, ATF1, ELK1, MAPK1, MEF2A, RPS6KA2, PPP2CB, MAPKAPK2, MEF2C
REACTOME_SIGNALING_BY_CSF3_G_CSF	0.0982367758186398	0.390491183879093	-0.376629401300291	-1.3468867911543	38	26	CUL5, UBE2D2, PTPN11, JAK1, UBE2D1, ELOC, RNF7
REACTOME_AMPK_INHIBITS_CHREBP_TRANSCRIPTIONAL_ACTIVATION_ACTIVITY	0.136363636363636	0.467280564263323	-0.564411705463098	-1.34824252253683	65	7	ADIPOR1, PRKAB2, ADIPOR2, MLXIPL
REACTOME_CARGO_CONCENTRATION_IN_THE_ER	0.102189781021898	0.400201359174427	-0.385731896881356	-1.35128335115408	41	24	SEC23A, CNIH1, MIA3, LMAN1, TMED2, MCFD2, SAR1B, F8, SEC24C
REACTOME_GLUCONEOGENESIS	0.0961538461538462	0.385461382907014	-0.393112527719954	-1.35907041283712	39	23	G6PC3, GAPDH, PC, ENO3, ALDOA, SLC37A4, MDH2, GOT2, PGK1
REACTOME_CELL_CYCLE	0.0133333333333333	0.102415458937198	-0.230240205057492	-1.35931141298484	1	463	HERC2, PSMB5, PSMD7, E2F6, PSMD14, RAD1, PSMD6, PSMC1, CHMP3, YWHAG, FBXL18, TFDP2, PSMC2, ENSA, LIN54, PSMD12, SSNA1, CUL1, PAFAH1B1, POLR2B, E2F3, PPP1CC, PSMA1, PSMB6, CLIP1, PPP6C, GSK3B, PSME4, CHMP2B, DYNC1LI1, CEP70, PSMA4, PRKCA, PSMD1, PSMD2, DHFR, PSMA6, HUS1, SPAST, PSMD3, PSMA2, SEM1, PSMD11, KPNB1, POLR2J, UBE2D1, RMI1, ANKRD28, SEC13, MCPH1, BTRC, PSME3, CDC27, PSMA3, PCBP4, SUMO1, TFDP1, VRK2, PHF20, RNF8, EP300, POLR2D, PSMC6, PPP1R12B, PPP2R5C, MZT1, USO1, NUP37, MIS12, PPP2R5E, BRCC3, ARPP19, FBXW11, PSMA7, RAB1B, TEN1, DYNC1H1, PSMC4, UBE2V2, PPP1CB, MAPK1, GOLGA2, CTDNEP1, PCM1, NEDD1, FEN1, PSMB2, CSNK2A1, TAOK1, VPS4A, CNEP1R1, CDC26, E2F4, PSMD8, HAUS2, SMARCA5, PSMF1, RFC1, TUBA4A, CHMP7, GORASP2, NOP10, NSD2, OPTN, PSMB7, INCENP, WAPL, PSMA5, LPIN1, RAD17, NCAPD2, PPP2R2A, CDC16
REACTOME_REGULATION_OF_LIPID_METABOLISM_BY_PPARALPHA	0.0224358974358974	0.154428904428904	-0.275972094385898	-1.36054931903837	6	104	PPARA, NFYB, MED1, HMGCR, MED11, NR1H2, HMGCS1, MED10, ESRRA, HDAC3, ME1, MED18, MED13, ALAS1, RXRA, EP300, ARNT2, MTF1, NCOA3, NPAS2, NCOR1, MED13L, MED21, MED7, CARM1, TXNRD1, ACOX1, CREBBP, CHD9, ARNT, MED15, GPS2, ACADM, PEX11A, MED24, FDFT1, TGS1, CLOCK, MED4, SREBF2
REACTOME_BETA_OXIDATION_OF_DECANOYL_COA_TO_OCTANOYL_COA_COA	0.139830508474576	0.47506518904824	-0.608409039961321	-1.3641721606701	65	6	ACADM, HADHA, HADH, HADHB, ECHS1
REACTOME_MOLYBDENUM_COFACTOR_BIOSYNTHESIS	0.154175588865096	0.502334398146523	-0.652280917640854	-1.36421401908359	71	5	MOCS3, MOCS2, GPHN, NFS1, MOCS1
REACTOME_TRANSLATION_OF_REPLICASE_AND_ASSEMBLY_OF_THE_REPLICATION_TRANSCRIPTION_COMPLEX	0.129032258064516	0.457672812030497	-0.474373808131483	-1.36667796233406	55	12	BECN1, CHMP3, CHMP2B, PIK3C3, CHMP7, CHMP4B, UVRAG
REACTOME_SIGNALING_BY_TGF_BETA_RECEPTOR_COMPLEX	0.0319767441860465	0.193624057837256	-0.30020444995406	-1.36718908866366	10	70	ZFYVE9, USP9X, TFDP2, PPM1A, PPP1CC, UCHL5, UBE2D1, UBE2M, TFDP1, PARP1, PARD3, PPP1CB, MAPK1, PARD6A, STRAP, E2F4, CCNK, NCOR1, TGFBR1, SMAD4, FURIN, RNF111
REACTOME_TICAM1_TRAF6_DEPENDENT_INDUCTION_OF_TAK1_COMPLEX	0.12987012987013	0.457672812030497	-0.505741893859145	-1.36798328767517	59	10	TAB2, TAB3
REACTOME_MET_INTERACTS_WITH_TNS_PROTEINS	0.122153209109731	0.445466978175395	-0.778963945679844	-1.36876747019692	58	3	MET, ITGB1
REACTOME_O_LINKED_GLYCOSYLATION_OF_MUCINS	0.103274559193955	0.402158334035916	-0.404986935161249	-1.37008456262156	40	22	GALNT1, ST3GAL1, ST3GAL3, ST6GALNAC2, GALNT2, C1GALT1C1, ST3GAL2, B4GALT5, GALNT11, C1GALT1
REACTOME_OVARIAN_TUMOR_DOMAIN_PROTEASES	0.0803108808290155	0.348305933405658	-0.357552902496154	-1.37019393782124	30	33	APC, MAVS, ZRANB1, OTUD7B, TRAF3, UBE2D1, RNF128, VCP, TNIP1, VCPIP1
REACTOME_TRANSCRIPTION_OF_E2F_TARGETS_UNDER_NEGATIVE_CONTROL_BY_P107_RBL1_AND_P130_RBL2_IN_COMPLEX_WITH_HDAC1	0.12987012987013	0.457672812030497	-0.506622681742846	-1.37036573437283	59	10	TFDP2, LIN54, TFDP1, E2F4
REACTOME_FORMATION_OF_TC_NER_PRE_INCISION_COMPLEX	0.0542857142857143	0.273146473779385	-0.323525768185295	-1.37385951898149	18	50	COPS3, CUL4A, COPS5, POLR2B, ISY1, POLR2J, TCEA1, EP300, POLR2D, COPS8, COPS2, USP7
REACTOME_PHOSPHORYLATION_OF_THE_APC_C	0.0962441314553991	0.385461382907014	-0.436590778048935	-1.37545922303915	40	16	UBE2D1, CDC27, CDC26, CDC16, ANAPC11, UBE2S, CDC23, ANAPC15, UBE2E1, ANAPC5
REACTOME_SYNTHESIS_OF_BILE_ACIDS_AND_BILE_SALTS_VIA_7ALPHA_HYDROXYCHOLESTEROL	0.0986238532110092	0.390805766737013	-0.457340835089613	-1.37646132970872	42	14	RXRA, CYP27A1, HSD17B4, AKR1C2, SCP2, NCOA2, AKR1C1, ACOX2, AMACR, NCOA1
REACTOME_GLYCOGEN_SYNTHESIS	0.120181405895692	0.442678503245514	-0.465766314455278	-1.37709116772077	52	13	EPM2A, GBE1, PGM1, GYG1, PGM2L1, GYS1, UGP2, UBB
REACTOME_MAPK_FAMILY_SIGNALING_CASCADES	0.00862068965517241	0.0725232621784346	-0.250560120786456	-1.37864682847235	1	233	PSMB5, PSMD7, CUL3, AGO4, PSMD14, PSMD6, PSMC1, MAPK6, PSMC2, RAF1, RAC1, PSMD12, PIK3CB, SHOC2, PTPN11, ARAF, LYPLA1, PPP1CC, PSMA1, PSMB6, PSME4, PSMA4, PSMD1, PSMD2, PSMA6, JAK1, PSMD3, PSMA2, RAP1A, SEM1, PSMD11, RANBP9, MET, PSME3, PSMA3, NRG4, MAP2K2, PSMC6, PPP2R5C, PPP2R5E, VCL, BRAP, PSMA7, ICMT, PSMC4, PPP1CB, MAPK1, MAPK12, PSMB2, MARK3, NCOA3, PSMD8, CAMK2G, PSMF1, GOLGA7, PAK2, PSMB7, SOS1, PSMA5, PIK3CA
REACTOME_KINESINS	0.0798004987531172	0.348305933405658	-0.391186833766667	-1.38443882863095	31	25	KIF1B, KIF5B, KIF1C, KIF16B, TUBA4A, RACGAP1, KIF21A
REACTOME_GOLGI_TO_ER_RETROGRADE_TRANSPORT	0.0287539936102236	0.181424007302602	-0.28811267899214	-1.3889581447933	8	94	GALNT1, KIF1B, KIF5B, KIF1C, PAFAH1B1, DYNC1LI1, RAB3GAP2, KIF16B, DCTN4, AGPAT3, TMED2, CAPZB, RAB3GAP1, CAPZA2, RAB1B, DYNC1H1, TUBA4A, GALNT2, RACGAP1, DYNLL2, KIF21A, RAB6A, COPB2, BICD2, DCTN5, KIF2A, BNIP1, COPG1, DCTN2, ACTR1A, RAB18, GBF1, NSF, STX18, DYNC1LI2, USE1, TMED7, KLC2, NAPG, TUBB4B, TMED10, DYNC1I1
REACTOME_GLYCOGEN_METABOLISM	0.0754257907542579	0.334058516153956	-0.396640870787246	-1.38949931134919	30	24	PHKA1, EPM2A, GBE1, PHKB, PGM1, GYG1, AGL, PGM2L1, CALM1, PYGM, PHKG1
REACTOME_METABOLISM_OF_COFACTORS	0.0915492957746479	0.372445443028898	-0.442380278816232	-1.39369877968475	38	16	PTS, DHFR, PDSS1, CALM1, SPR, IDH1, PDSS2, COQ6, COQ7, COQ2, COQ9, AKT1
REACTOME_RSK_ACTIVATION	0.130620985010707	0.457672812030497	-0.666818709837406	-1.39461910895314	60	5	RPS6KA3, MAPK1, RPS6KA2, PDPK1
REACTOME_ESTABLISHMENT_OF_SISTER_CHROMATID_COHESION	0.12258064516129	0.446002805049088	-0.531987765349436	-1.39530525840855	56	9	WAPL, ESCO1, SMC3, PDS5A, STAG1
REACTOME_MAP3K8_TPL2_DEPENDENT_MAPK1_3_ACTIVATION	0.0915492957746479	0.372445443028898	-0.44379931085746	-1.39816937505009	38	16	MAP2K4, CHUK, CUL1, BTRC, FBXW11
