pathway	pval	padj	ES	NES	nMoreExtreme	size	leadingEdge
REACTOME_TRAF6_MEDIATED_IRF7_ACTIVATION_IN_TLR7_8_OR_9_SIGNALING	0.72887323943662	0.922980210930498	0.288231204207555	0.789417637020435	413	12	MYD88, RPS27A, IRAK4, IRF7
REACTOME_TRANSPORT_OF_INORGANIC_CATIONS_ANIONS_AND_AMINO_ACIDS_OLIGOPEPTIDES	0.841463414634146	0.955662020905923	0.199711725488839	0.787939050034681	551	54	SLC25A29, SLC9A9, SLC20A1, SLC12A7, SLC12A4, SLC26A11, SLC1A5, SLC8B1, SRI, SLC7A5, SLC9A5, SLC4A7, SLC36A4
REACTOME_MITOCHONDRIAL_UNCOUPLING	0.712092130518234	0.916336379965732	0.414228494502352	0.787932435521862	370	4	SLC25A27, UCP2
REACTOME_THE_FATTY_ACID_CYCLING_MODEL	0.712092130518234	0.916336379965732	0.414228494502352	0.787932435521862	370	4	SLC25A27, UCP2
REACTOME_CASPASE_ACTIVATION_VIA_DEPENDENCE_RECEPTORS_IN_THE_ABSENCE_OF_LIGAND	0.757062146892655	0.929281122150789	0.329687081148108	0.785895268500803	401	8	DAPK1, MAGED1, UNC5B, DAPK2
REACTOME_SIGNALING_BY_NUCLEAR_RECEPTORS	0.927821522309711	0.98022340230727	0.162689543619348	0.78528378607045	706	189	MOV10, SPHK1, CYP26B1, NOS3, MMP2, GNB1, NR1H3, SRC, APOD, GNB4, JUN, GNAI2, TLE3, PLTP, ABCA1, PIK3R2, JUND, ZNF217, FOSB, ZDHHC21, AREG, MYC, FOS, POU2F1, CAV2, FASN, XPO1, PLIN1, APOE, CXCL12, KCTD6, CPT1A, ALDH1A3, SCD, GNG11, CREB1, IGF1R, AKT3, HDAC1, GNG12, PTGES3, RARG, CDKN1B, RXRB, HSPB1, RDH11, TNRC6C, GNAI3, RUNX1, POLR2H, CCND1, HRAS, APOC1, GNB2, NRAS, S1PR3, CAV1, MAPK3, ALDH1A2, HSP90AB1, ABCG1, TNRC6A, ALDH1A1, TBL1XR1
REACTOME_CHK1_CHK2_CDS1_MEDIATED_INACTIVATION_OF_CYCLIN_B_CDK1_COMPLEX	0.752895752895753	0.929281122150789	0.341950996485698	0.783928743838862	389	7	YWHAQ, YWHAZ, YWHAH
REACTOME_REGULATION_OF_PTEN_MRNA_TRANSLATION	0.737430167597765	0.92614425870563	0.313355190710302	0.782176144285841	395	9	MOV10, PTEN, TNRC6C, TNRC6A
REACTOME_GLUTAMATE_AND_GLUTAMINE_METABOLISM	0.758007117437722	0.929281122150789	0.292065148487911	0.780696952549024	425	11	GLS, RIMKLB, ALDH18A1
REACTOME_RUNX1_REGULATES_TRANSCRIPTION_OF_GENES_INVOLVED_IN_DIFFERENTIATION_OF_MYELOID_CELLS	0.727447216890595	0.922980210930498	0.409505552544563	0.778948603629516	378	4	LGALS3, RUNX1
REACTOME_CTLA4_INHIBITORY_SIGNALING	0.774305555555556	0.93601844945689	0.26402179360494	0.778393218896368	445	16	SRC, PPP2R1B, FYN
REACTOME_RUNX1_REGULATES_ESTROGEN_RECEPTOR_MEDIATED_TRANSCRIPTION	0.720754716981132	0.918694400837258	0.35622680251403	0.778065471715213	381	6	KCTD6, RUNX1, ESR1, GPAM
REACTOME_NR1H3_NR1H2_REGULATE_GENE_EXPRESSION_LINKED_TO_CHOLESTEROL_TRANSPORT_AND_EFFLUX	0.803571428571429	0.946428571428572	0.222813915706496	0.776295879917782	494	31	MOV10, NR1H3, APOD, PLTP, ABCA1
REACTOME_FORMATION_OF_SENESCENCE_ASSOCIATED_HETEROCHROMATIN_FOCI_SAHF	0.748603351955307	0.927731355891612	0.310467113048932	0.774967119139495	401	9	TP53, CDKN1A, CABIN1, EP400
REACTOME_BASIGIN_INTERACTIONS	0.78125	0.940338758516276	0.262827634253204	0.77487257944846	449	16	ITGA3, PPIA, SLC7A5, ATP1B2, CAV1, SLC7A6
REACTOME_SUMOYLATION_OF_SUMOYLATION_PROTEINS	0.803225806451613	0.946428571428572	0.215025804236637	0.773839594871059	497	34	AAAS, NUP85, NUP210, NUP155, NUP107, UBE2I, NUP35, NUP160, NUP50, SUMO2
REACTOME_CHOLINE_CATABOLISM	0.761078998073218	0.929281122150789	0.445936344644366	0.771161375832466	394	3	SLC44A1, ALDH7A1
REACTOME_SHC_RELATED_EVENTS_TRIGGERED_BY_IGF1R	0.775894538606403	0.93601844945689	0.323172168912768	0.770365273565541	411	8	IGF1R, HRAS, NRAS, IGF2, SHC1, KRAS
REACTOME_TRYPTOPHAN_CATABOLISM	0.762548262548263	0.929281122150789	0.336000153921576	0.770286331376202	394	7	AFMID, SLC7A5, SLC36A4, KYAT1
REACTOME_E2F_ENABLED_INHIBITION_OF_PRE_REPLICATION_COMPLEX_FORMATION	0.751401869158879	0.929281122150789	0.372593829656324	0.769813024746068	401	5	ORC3, ORC2, ORC5, ORC4
REACTOME_SYNTHESIS_SECRETION_AND_DEACYLATION_OF_GHRELIN	0.762548262548263	0.929281122150789	0.335384615384615	0.768875198327833	394	7	KLF4, SEC11C, SEC11A, ACHE, SPCS2, SPCS3, SPCS1
REACTOME_ABACAVIR_METABOLISM	0.764932562620424	0.930560653838159	0.443895201346014	0.767631609996753	396	3	GUK1, NT5C2
REACTOME_SLC_TRANSPORTER_DISORDERS	0.855203619909502	0.960592010236184	0.193122128466653	0.766977493345125	566	55	CP, SLC9A9, AAAS, NUP85, SLCO2A1, NUP210, SLC33A1, NUP155, NUP107, AVPR1A, NUP35, NUP160, SLC2A1
REACTOME_COOPERATION_OF_PREFOLDIN_AND_TRIC_CCT_IN_ACTIN_AND_TUBULIN_FOLDING	0.810580204778157	0.947382256297919	0.236419097048299	0.766521411998708	474	23	ACTB, TUBB6, CCT3, TUBA1A, PFDN5, CCT8, CCT4
REACTOME_CYTOSOLIC_SENSORS_OF_PATHOGEN_ASSOCIATED_DNA	0.875	0.96728650137741	0.193960833197145	0.765249583013765	573	54	IRF3, STAT6, IFI16, NFKB2, TRIM56, TRIM21, MYD88, RPS27A, DDX41, MRE11, TRIM32, IRF7
REACTOME_ACTIVATION_OF_THE_AP_1_FAMILY_OF_TRANSCRIPTION_FACTORS	0.761638733705773	0.929281122150789	0.306455951965626	0.764954728717182	408	9	JUN, MAPK11, FOS, MAPK14
REACTOME_RUNX1_REGULATES_GENES_INVOLVED_IN_MEGAKARYOCYTE_DIFFERENTIATION_AND_PLATELET_FUNCTION	0.823051948051948	0.94937530395413	0.219009707422086	0.763041809999515	506	31	MOV10, SIN3B, MYL9, KMT2E, THBS1, NR4A3, HDAC1, KMT2A, TNRC6C, RUNX1
REACTOME_RELEASE_OF_APOPTOTIC_FACTORS_FROM_THE_MITOCHONDRIA	0.760747663551402	0.929281122150789	0.368972790945923	0.76233162666455	406	5	GSDMD, BAX
REACTOME_ERCC6_CSB_AND_EHMT2_G9A_POSITIVELY_REGULATE_RRNA_EXPRESSION	0.791666666666667	0.945007507507508	0.257703655017178	0.759765982994319	455	16	CHD3, MTA1, HDAC1, EHMT2, MTA2, GATAD2A, MTA3, HDAC2
REACTOME_P38MAPK_EVENTS	0.767605633802817	0.933046733249424	0.277143007326651	0.759048898130396	435	12	SRC, MAPK11, MAPK14, RALGDS, HRAS, NRAS
REACTOME_RND1_GTPASE_CYCLE	0.829545454545455	0.951487816730859	0.212199798449051	0.757201004746793	510	33	FLOT2, WDR6, PTPN13, PIK3R2, UBXN11, PKP4, RBMX
REACTOME_SIGNALING_BY_LEPTIN	0.8	0.946428571428572	0.293673908281994	0.756589500438661	431	10	SOCS3, LEPR, STAT5A, SH2B1, IRS1, IRS2, STAT3
REACTOME_RAP1_SIGNALLING	0.77112676056338	0.935233828600896	0.276182660148793	0.756418665911271	437	12	RAPGEF3, YWHAZ, RAP1B, SIPA1, RASGRP2
REACTOME_ESR_MEDIATED_SIGNALING	0.93943661971831	0.984396185413188	0.16353985346195	0.754120981153992	666	135	MOV10, SPHK1, NOS3, MMP2, GNB1, SRC, GNB4, JUN, GNAI2, TLE3, PIK3R2, JUND, ZNF217, FOSB, ZDHHC21, AREG, MYC, FOS, POU2F1, CAV2, XPO1, CXCL12, KCTD6, GNG11, CREB1, IGF1R, AKT3, HDAC1, GNG12, PTGES3, CDKN1B, HSPB1, TNRC6C, GNAI3, RUNX1, POLR2H, CCND1, HRAS, GNB2, NRAS, S1PR3, CAV1, MAPK3, HSP90AB1, TNRC6A
REACTOME_CLEC7A_DECTIN_1_INDUCES_NFAT_ACTIVATION	0.788256227758007	0.943060498220641	0.282001000535418	0.753795250387052	442	11	ITPR3, ITPR1
REACTOME_SIGNALING_BY_FGFR1_IN_DISEASE	0.841322314049587	0.955662020905923	0.219790695120177	0.75323017208453	508	30	PLCG1, CNTRL, CPSF6, FGF2, FGFR1
REACTOME_TRISTETRAPROLIN_TTP_ZFP36_BINDS_AND_DESTABILIZES_MRNA	0.809278350515464	0.947382256297919	0.249915953272451	0.752418606211495	470	17	EXOSC2, ZFP36, EXOSC9, EXOSC8, EXOSC5
REACTOME_SIGNALLING_TO_RAS	0.800347222222222	0.946428571428572	0.255112170106537	0.752125726280006	460	16	SRC, MAPK11, SHC2, MAPK14, RALGDS, HRAS, NRAS
REACTOME_PURINE_CATABOLISM	0.796791443850267	0.946428571428572	0.269538036060034	0.752114033358357	446	13	NUDT5, NT5E, NUDT1, GDA, NT5C
REACTOME_SIGNAL_TRANSDUCTION_BY_L1	0.819277108433735	0.947382256297919	0.246007853930489	0.749307941809636	475	18	VAV2, ITGA5, FGFR1, ITGA9
REACTOME_PEXOPHAGY	0.788256227758007	0.943060498220641	0.280315628567478	0.749290211815712	442	11	ATM, RPS27A, EPAS1
REACTOME_ETHANOL_OXIDATION	0.80225988700565	0.946428571428572	0.314241155836153	0.749075871216537	425	8	ADH1B, ALDH1A1, ALDH2, ACSS2, ADH1C, ACSS1
REACTOME_SIGNALING_BY_NTRK2_TRKB	0.836393989983305	0.953993144959437	0.23363578451753	0.746550489913231	500	21	PLCG1, SRC, FYN, NTRK2
REACTOME_FGFR3B_LIGAND_BINDING_AND_ACTIVATION	0.875478927203065	0.96728650137741	0.5612863544504	0.745452505162276	456	1	FGF1
REACTOME_CHYLOMICRON_REMODELING	0.778420038535645	0.9383531927761	0.430630151520512	0.744692250608859	403	3	APOE, LPL
REACTOME_WNT5A_DEPENDENT_INTERNALIZATION_OF_FZD4	0.802139037433155	0.946428571428572	0.266834280249833	0.744569522322544	449	13	CLTA, AP2A2, ARRB2, AP2B1
REACTOME_PURINE_SALVAGE	0.801056338028169	0.946428571428572	0.270044026459234	0.739605962668161	454	12	HPRT1, AMPD2, GMPR2, APRT, DGUOK, ADA
REACTOME_DEACTIVATION_OF_THE_BETA_CATENIN_TRANSACTIVATING_COMPLEX	0.881967213114754	0.968406593406593	0.202592162743526	0.737082363458402	537	37	TCF7L2, TLE3, SOX7, RPS27A, YWHAZ, SOX17, TLE4, XPO1, SOX4, TLE1, HDAC1
REACTOME_HOMOLOGOUS_DNA_PAIRING_AND_STRAND_EXCHANGE	0.860696517412935	0.961592080008082	0.215830284823719	0.736692930919221	518	29	XRCC3, ATM, RFC2, RAD51D, MRE11, WRN, RFC4, RAD9A
REACTOME_DNA_REPAIR	0.981723237597911	0.997285831584709	0.148940827707327	0.734324152884388	751	236	XRCC3, HMGN1, DDB2, ACD, RAD52, ACTB, POLE, LIG1, POLM, ATM, POLD1, NEIL1, INO80E, PNKP, UBE2L6, FANCC, MDC1, SPIDR, INO80D, RTEL1, CDK2, TP53, UBA7, POT1, AQR, ACTL6A, MUTYH, RPS27A, FAAP100, RFC2, EME2, EYA2, UVSSA, WDR48, XAB2, FAAP20, RAD51D, MRE11, DDB1, WRN, GTF2H4, MGMT, TERF2IP, UBE2I, POLL, POLI, MSH2, ACTR5, POLD2, PPIE, USP45, POLD3, PARP2, RFC4, UIMC1, TRIM25, RAD9A, RIF1, ASCC3, ALKBH2
REACTOME_SYNTHESIS_SECRETION_AND_INACTIVATION_OF_GLUCOSE_DEPENDENT_INSULINOTROPIC_POLYPEPTIDE_GIP	0.779245283018868	0.938636363636364	0.335355133614627	0.732477871924605	412	6	DPP4, SEC11C, SEC11A, SPCS2, SPCS3, SPCS1
REACTOME_REGULATION_OF_PTEN_GENE_TRANSCRIPTION	0.895865237366003	0.969566558259504	0.182998915003737	0.729556179605426	584	56	HDAC7, JUN, TP53, PPARG, CHD3, RRAGB, CBX4, EGR1, HDAC5, MECOM, SNAI2, PTEN, MTA1, RING1, HDAC1, PHC3, EZH2, MAPK3, EED, CBX6, MTA2, GATAD2A, MTA3
REACTOME_CYTOSOLIC_SULFONATION_OF_SMALL_MOLECULES	0.827777777777778	0.950987475915222	0.282923715376173	0.728893873245169	446	10	ABHD14B, PAPSS1, SLC35B3, PAPSS2
REACTOME_DEFENSINS	0.844230769230769	0.956646963025514	0.47413319650735	0.728563858527141	438	2	TLR2, ART1
REACTOME_REGULATION_OF_PTEN_LOCALIZATION	0.808193668528864	0.947382256297919	0.291562060190361	0.727777598139641	433	9	PML, RPS27A, PTEN
REACTOME_TRANSPORT_OF_NUCLEOSIDES_AND_FREE_PURINE_AND_PYRIMIDINE_BASES_ACROSS_THE_PLASMA_MEMBRANE	0.816602316602317	0.947382256297919	0.31711845767022	0.726999706754562	422	7	SLC25A6, SLC25A5, SLC29A1, ARL2
REACTOME_APOPTOTIC_CLEAVAGE_OF_CELLULAR_PROTEINS	0.854785478547855	0.960592010236184	0.216442501510142	0.726280325473211	517	27	VIM, SPTAN1, TJP2, GSN, ROCK1, CASP7, DBNL, PKP1
REACTOME_G2_M_DNA_REPLICATION_CHECKPOINT	0.902298850574713	0.969566558259504	0.54670064141991	0.726081009254802	470	1	WEE1
REACTOME_PTK6_EXPRESSION	0.802303262955854	0.946428571428572	0.381602881998607	0.725873019857203	417	4	HIF1A, EPAS1, PELP1, NR3C1
REACTOME_SHC_MEDIATED_CASCADE_FGFR3	0.826741996233522	0.950987475915222	0.304461394819272	0.725763256468426	438	8	FGF2, HRAS, NRAS, SHC1, KRAS, FGF1
REACTOME_PHENYLALANINE_METABOLISM	0.802303262955854	0.946428571428572	0.380910529091229	0.724556047896577	417	4	ASRGL1, KYAT1, QDPR, PCBD1
REACTOME_APOPTOTIC_CLEAVAGE_OF_CELL_ADHESION_PROTEINS	0.79622641509434	0.946428571428572	0.331339331948779	0.723706615535693	421	6	TJP2, PKP1, CTNNB1, DSP
REACTOME_CARBOXYTERMINAL_POST_TRANSLATIONAL_MODIFICATIONS_OF_TUBULIN	0.861157024793388	0.961592080008082	0.223615559253263	0.723543013483248	520	22	TTLL3, TPGS2, TUBB6, NICN1, TUBA1A
REACTOME_GRB2_SOS_PROVIDES_LINKAGE_TO_MAPK_SIGNALING_FOR_INTEGRINS	0.813780260707635	0.947382256297919	0.289717666772034	0.723173747380944	436	9	SRC, RAP1B, FN1, VWF
REACTOME_GLYCOSPHINGOLIPID_METABOLISM	0.863636363636364	0.96161191749427	0.207209535093719	0.721929363625664	531	31	SMPD3, UGCG, ARSG, GBA2, SUMF1, STS, ARSA, GLB1
REACTOME_CYCLIN_D_ASSOCIATED_EVENTS_IN_G1	0.892384105960265	0.969566558259504	0.197755928283592	0.721351919233894	538	38	CCND2, SRC, PPP2R1B, CDK2, RPS27A, CDKN1A, CCND3, CDK6, CDKN1B, CCND1, PPP2R3B, ABL1
REACTOME_SYNTHESIS_OF_IP2_IP_AND_INS_IN_THE_CYTOSOL	0.818661971830986	0.947382256297919	0.262737424110797	0.719594386279654	464	12	INPP5B, ISYNA1
REACTOME_FLT3_SIGNALING	0.88595041322314	0.968406593406593	0.209125422261135	0.716679920006969	535	30	CBL, FYN, SOCS2, BCL2L11, RPS27A, ABL2, AKT3, CDKN1B, HRAS, NRAS
REACTOME_RUNX3_REGULATES_P14_ARF	0.836158192090395	0.953993144959437	0.299912487647575	0.714919748100925	443	8	TGFB1, RUNX1, CCND1, BRD2
REACTOME_SIGNALING_BY_FGFR2_IN_DISEASE	0.877280265339967	0.967320126137689	0.209241513867529	0.714203496728668	528	29	FGF7, PLCG1, FGF2
REACTOME_VLDL_ASSEMBLY	0.855769230769231	0.960592010236184	0.464608001037675	0.713927226425165	444	2	APOC1, P4HB
REACTOME_INTEGRIN_SIGNALING	0.843373493975904	0.956464946805768	0.234053257055071	0.712895793836449	489	18	SRC, RAPGEF3, RAP1B, RASGRP2, FN1, VWF
REACTOME_MECP2_REGULATES_NEURONAL_RECEPTORS_AND_CHANNELS	0.845195729537367	0.956646963025514	0.266336558359565	0.711923831173284	474	11	SLC2A3, NOTCH1, CREB1, HDAC1, SIN3A, HDAC2
REACTOME_THROMBOXANE_SIGNALLING_THROUGH_TP_RECEPTOR	0.825704225352113	0.95066597994921	0.259658662642237	0.711162167394325	468	12	GNB1, GNB4, GNG11, GNG12, GNB2
REACTOME_MAP2K_AND_MAPK_ACTIVATION	0.87987012987013	0.967502772482026	0.203887474529239	0.710355122758052	541	31	ACTG1, ACTB, SRC, RAP1B, IQGAP1, ARRB2, BRAF, ARRB1, FN1, HRAS, VWF, NRAS, MAPK3
REACTOME_RUNX1_REGULATES_TRANSCRIPTION_OF_GENES_INVOLVED_IN_INTERLEUKIN_SIGNALING	0.817658349328215	0.947382256297919	0.37317630515029	0.709844249969743	425	4	RUNX1, ELF1, CBFB, LIFR
REACTOME_ACTIVATED_NTRK2_SIGNALS_THROUGH_RAS	0.839924670433145	0.955279131608513	0.297592401197911	0.709389216067476	445	8	NTRK2, HRAS, NRAS, SHC1, KRAS, NTF4
REACTOME_TRNA_PROCESSING	0.968115942028986	0.995012390928591	0.160325972753655	0.708687577701328	667	101	NSUN6, QTRT1, TRMT11, TSEN54, TRMT44, ADAT2, TRMT112, AAAS, NUP85, THADA
REACTOME_DISEASES_OF_IMMUNE_SYSTEM	0.85738255033557	0.961380997908009	0.225953779520857	0.708320236067288	510	20	NFKB2, MYD88, TLR2, TLR4, IRAK4, UNC93B1, S100A8, NFKBIA, RELA, S100A9, HMGB1
REACTOME_MATURATION_OF_SARS_COV_1_SPIKE_PROTEIN	0.820560747663551	0.948177026733319	0.341925028045344	0.706448467809463	438	5	PRKCSH, MOGS, GANAB
REACTOME_CHYLOMICRON_CLEARANCE	0.822736030828516	0.94937530395413	0.407949016182663	0.705469577367174	426	3	APOE, LDLR
REACTOME_SENESCENCE_ASSOCIATED_SECRETORY_PHENOTYPE_SASP	0.922829581993569	0.978199356913183	0.186345600055357	0.7043305245295	573	43	JUN, CDK2, IGFBP7, ANAPC2, RPS27A, FOS, CDKN1A, ANAPC7, CEBPB, CDK6, EHMT2, CDKN1B
REACTOME_SMAD2_SMAD3_SMAD4_HETEROTRIMER_REGULATES_TRANSCRIPTION	0.892561983471074	0.969566558259504	0.205092815620175	0.702860040177847	539	30	CCNT2, WWTR1, SERPINE1, RPS27A, MYC, JUNB
REACTOME_P130CAS_LINKAGE_TO_MAPK_SIGNALING_FOR_INTEGRINS	0.832402234636871	0.951487816730859	0.280782301913566	0.700869890799085	446	9	SRC, RAP1B, FN1, VWF
REACTOME_SIGNALING_BY_ERBB2_IN_CANCER	0.88595041322314	0.968406593406593	0.216378504565858	0.70012639446642	535	22	PLCG1, PTPN12, ERBB2, ERBB3, HRAS, CDC37, NRAS
REACTOME_ATF6_ATF6_ALPHA_ACTIVATES_CHAPERONES	0.84330985915493	0.956464946805768	0.254488573163971	0.697002146690329	478	12	NFYA, MBTPS1, HSP90B1, DDIT3
REACTOME_ALK_MUTANTS_BIND_TKIS	0.855555555555556	0.960592010236184	0.269717392824387	0.694870540901685	461	10	HIP1, EML4, NPM1, EIF2AK3, FN1
REACTOME_TICAM1_DEPENDENT_ACTIVATION_OF_IRF3_IRF7	0.855555555555556	0.960592010236184	0.269591867367307	0.69454715077343	461	10	IRF3, RPS27A, IRF7
REACTOME_NR1H2_AND_NR1H3_MEDIATED_SIGNALING	0.921311475409836	0.978199356913183	0.190003163775833	0.691280349268795	561	37	MOV10, NR1H3, APOD, PLTP, ABCA1, FASN, PLIN1, APOE, SCD, RXRB, TNRC6C, APOC1, ABCG1, TNRC6A, TBL1XR1
REACTOME_DNA_DOUBLE_STRAND_BREAK_REPAIR	0.976811594202899	0.997285831584709	0.155782176296641	0.69091779838717	673	105	XRCC3, RAD52, POLE, POLM, ATM, POLD1, MDC1, SPIDR, RTEL1, CDK2, TP53, RPS27A, RFC2, EME2, EYA2, RAD51D, MRE11, WRN, UBE2I, POLL, POLD2, POLD3, PARP2, RFC4, UIMC1, RAD9A, RIF1, XRCC1, SUMO2, ABL1, PCNA
REACTOME_INTERLEUKIN_2_FAMILY_SIGNALING	0.901023890784983	0.969566558259504	0.212751062593167	0.689784568755982	527	23	IL3RA, IL15, PIK3R2, LGALS9, IL15RA, PTK2B, INPP5D
REACTOME_METABOLIC_DISORDERS_OF_BIOLOGICAL_OXIDATION_ENZYMES	0.867469879518072	0.963182338291714	0.225914188243218	0.688105248322483	503	18	CYP26B1, FDXR, CYP1B1, SLC35D1
REACTOME_SIGNALING_BY_FGFR_IN_DISEASE	0.940438871473354	0.984396185413188	0.177559257049388	0.683558887788318	599	47	FGF7, PLCG1, CNTRL, CPSF6, FGF2, FGFR1
REACTOME_HUR_ELAVL1_BINDS_AND_STABILIZES_MRNA	0.858757062146893	0.961592080008082	0.28669217822254	0.683405687589153	455	8	ANP32A, XPO1, TNFSF13, PRKCD
REACTOME_BETA_OXIDATION_OF_LAUROYL_COA_TO_DECANOYL_COA_COA	0.852336448598131	0.960592010236184	0.328821306143975	0.679374976545186	455	5	ACADL, ECHS1, HADHB, HADH, HADHA
REACTOME_SUMOYLATION_OF_TRANSCRIPTION_FACTORS	0.886792452830189	0.968406593406593	0.233422050048806	0.679207509050137	516	15	MDM2, TP53, MTA1, UBE2I, SUMO2, TP53BP1
REACTOME_HDMS_DEMETHYLATE_HISTONES	0.910743801652893	0.973173820314583	0.209566307452025	0.678084468382904	550	22	PHF8, KDM4C, KDM5B, KDM6B, KDM6A
REACTOME_RUNX3_REGULATES_IMMUNE_RESPONSE_AND_CELL_MIGRATION	0.888461538461538	0.968898385565052	0.44103690685413	0.677707346748792	461	2	RORC, CBFB
REACTOME_FGFR1_MUTANT_RECEPTOR_ACTIVATION	0.914675767918089	0.975221887332856	0.20890722455607	0.677322021540144	535	23	CNTRL, CPSF6, FGF2, FGFR1
REACTOME_REGULATION_OF_CYTOSKELETAL_REMODELING_AND_CELL_SPREADING_BY_IPP_COMPLEX_COMPONENTS	0.870056497175141	0.964034725093014	0.28331139282338	0.675346702566858	461	8	ACTN1, PARVA, RSU1, PXN
REACTOME_ZINC_EFFLUX_AND_COMPARTMENTALIZATION_BY_THE_SLC30_FAMILY	0.85607476635514	0.960592010236184	0.326741370836474	0.675077639437323	457	5	SLC30A7, SLC30A1, SLC30A2
REACTOME_NRCAM_INTERACTIONS	0.861804222648752	0.961592080008082	0.353578215945824	0.672565380062444	448	4	NRP2, DLG4
REACTOME_VXPX_CARGO_TARGETING_TO_CILIUM	0.90625	0.972292510121457	0.227560647363485	0.670897892090109	521	16	ASAP1, PKD2, ARF4, RAB11FIP3, PKD1, RAB11A
REACTOME_SUMOYLATION_OF_DNA_REPLICATION_PROTEINS	0.952845528455285	0.990859640447287	0.179640988978537	0.669327514440543	585	41	AAAS, NUP85, NUP210, NUP155, TOP1, NUP107, UBE2I, NUP35, NUP160, NUP50, SUMO2, PCNA, RANGAP1
REACTOME_NEGATIVE_REGULATION_OF_MET_ACTIVITY	0.881239242685026	0.968327847870899	0.21973410658213	0.669281522999495	511	18	SH3GL1, CBL, RPS27A
REACTOME_GROWTH_HORMONE_RECEPTOR_SIGNALING	0.909722222222222	0.972791764212144	0.225634153544367	0.665218172607213	523	16	SOCS3, SOCS2, CISH, MAPK3, STAT5A, SH2B1, IRS1, IRS2
REACTOME_FOXO_MEDIATED_TRANSCRIPTION	0.94969512195122	0.989525061535019	0.16792444844011	0.662526098843867	622	54	ATXN3, NFYA, BTG1, BBC3, YWHAQ, ABCA6, BCL2L11, YWHAZ, CDKN1A, CCNG2, TXN, AKT3, HDAC1, CDKN1B, DDIT3, CITED2, TXNIP, KLF4, CAV1, GADD45A, SMAD3, BCL6, SREBF1, SIN3A
REACTOME_SIGNALING_BY_ERBB2_ECD_MUTANTS	0.911458333333333	0.973283243787777	0.224474303643705	0.66179868482446	524	16	PLCG1, ERBB2, HRAS, CDC37, NRAS, SHC1, HSP90AA1, KRAS
REACTOME_HCMV_EARLY_EVENTS	0.974320241691843	0.996250279286193	0.162505613354076	0.660378355256143	644	63	PML, DYNLL1, AAAS, NUP85, TUBB6, NUP210, NUP155, NUP107, TUBA1A, TRIM28, CREB1, NUP35, NUP160
REACTOME_POTENTIAL_THERAPEUTICS_FOR_SARS	0.980332829046899	0.997285831584709	0.157961300870606	0.658416598535294	647	74	STAT2, IMPDH1, SIGMAR1, AP2A2, CHD3, S1PR1, IL1R1, ROCK1, PHF21A, TYK2, HMG20B, MTA1, HDAC1, PTGES3, ATP1B2, FKBP1A, IFNGR2, TUBB, IMPDH2, AP2B1, HSP90AB1, MTA2, GATAD2A, MTA3, NFE2L2, RBX1
REACTOME_SIGNALING_BY_FGFR4_IN_DISEASE	0.886120996441281	0.968406593406593	0.245507093683482	0.656246186373707	497	11	PLCG1, HRAS, NRAS, FGFR4, KRAS
REACTOME_NR1H2_NR1H3_REGULATE_GENE_EXPRESSION_LINKED_TO_GLUCONEOGENESIS	0.875239923224568	0.96728650137741	0.34304044022788	0.652520753976549	455	4	NR1H3, RXRB
REACTOME_TRAFFICKING_OF_AMPA_RECEPTORS	0.914821124361158	0.975221887332856	0.211112762659883	0.651485705083988	536	19	MDM2, AP2A2, MYO6, DLG4, AP2B1, GRIP2, EPB41L1, TSPAN7
REACTOME_NR1H2_NR1H3_REGULATE_GENE_EXPRESSION_LINKED_TO_LIPOGENESIS	0.898305084745763	0.969566558259504	0.270886347675811	0.645728362174574	476	8	NR1H3, FASN, SCD, RXRB, SREBF1
REACTOME_SHC1_EVENTS_IN_EGFR_SIGNALING	0.901851851851852	0.969566558259504	0.250439023858767	0.645203848922484	486	10	AREG, HRAS, NRAS, SHC1, KRAS
REACTOME_SIGNALING_BY_ERBB2	0.966237942122186	0.995012390928591	0.170577430900329	0.644731570497147	600	43	PTPN18, PLCG1, SRC, FYN, PTPN12, RPS27A, ERBB2, AKT3, ERBB3, HRAS, CDC37, RHOA, NRAS
REACTOME_REGULATION_OF_TP53_ACTIVITY_THROUGH_ACETYLATION	0.932006633499171	0.982034822573679	0.186847728068365	0.637766847867099	561	29	PML, TP53, PIP4K2A, CHD3
REACTOME_THYROXINE_BIOSYNTHESIS	0.917307692307692	0.976251158480074	0.413358134345836	0.635175515089489	476	2	TPO, DIO2
REACTOME_FORMATION_OF_THE_BETA_CATENIN_TCF_TRANSACTIVATING_COMPLEX	0.947194719471947	0.988214963228606	0.188601288424742	0.632858168733417	573	27	TCF7L2, TLE3, TCF4, MYC, TLE4, TLE1, HDAC1
REACTOME_P2Y_RECEPTORS	0.893457943925234	0.969566558259504	0.305977740103658	0.632178073993946	477	5	LPAR6, P2RY11
REACTOME_NUCLEOTIDE_LIKE_PURINERGIC_RECEPTORS	0.893457943925234	0.969566558259504	0.305977740103658	0.632178073993946	477	5	LPAR6, P2RY11
REACTOME_KETONE_BODY_METABOLISM	0.924670433145009	0.979497660693248	0.262817505867648	0.626494170233435	490	8	BDH2, ACSS3
REACTOME_RUNX3_REGULATES_YAP1_MEDIATED_TRANSCRIPTION	0.907547169811321	0.972568578553616	0.284869123177116	0.622207052186009	480	6	WWTR1, TEAD3, TEAD2
REACTOME_ESTROGEN_DEPENDENT_NUCLEAR_EVENTS_DOWNSTREAM_OF_ESR_MEMBRANE_SIGNALING	0.922818791946309	0.978199356913183	0.198236708471461	0.621432721503763	549	20	AREG, FOS, XPO1, CREB1, AKT3, CDKN1B, CCND1, MAPK3
REACTOME_PP2A_MEDIATED_DEPHOSPHORYLATION_OF_KEY_METABOLIC_FACTORS	0.901544401544402	0.969566558259504	0.270993655031795	0.621257775999088	466	7	PPP2R1B, PPP2R1A, PPP2CA, PPP2R5D, MLXIPL, PFKFB1, PPP2CB
REACTOME_MATURATION_OF_SARS_COV_2_SPIKE_PROTEIN	0.958745874587459	0.9937682008828	0.183086417814098	0.614352829005333	580	27	PRKCSH, MAN1B1, TUSC3, MGAT5, FUT8, STT3A, ST3GAL4, MOGS, ST6GALNAC4
REACTOME_CROSS_PRESENTATION_OF_PARTICULATE_EXOGENOUS_ANTIGENS_PHAGOSOMES	0.91588785046729	0.975392955286665	0.296914828162081	0.613453266712012	489	5	CYBA, CD36, ITGB5, CYBB, ITGAV
REACTOME_SIGNALING_BY_MAPK_MUTANTS	0.918867924528302	0.976837264517274	0.28039246398612	0.612429197402009	486	6	DUSP16, DUSP8, DUSP10, DUSP6
REACTOME_DEFECTIVE_FACTOR_IX_CAUSES_HEMOPHILIA_B	0.938461538461538	0.984396185413188	0.393209457268135	0.604214599414141	487	2	GGCX
REACTOME_ION_TRANSPORT_BY_P_TYPE_ATPASES	0.969255663430421	0.995012390928591	0.165492376504128	0.602524379260106	598	36	ATP11C, ATP8B2, ATP10D, ATP8B1, SRI, ATP13A1, ATP7B, ATP1B2
REACTOME_POSITIVE_EPIGENETIC_REGULATION_OF_RRNA_EXPRESSION	0.986991869918699	0.997285831584709	0.159993474748582	0.596122496258184	606	41	ACTB, KAT2A, MYO1C, CHD3, TAF1D, MTA1, HDAC1, SF3B1, EHMT2, POLR2H, POLR1C, TAF1C, MTA2, GATAD2A, MTA3, POLR1E, HDAC2
REACTOME_DOWNREGULATION_OF_ERBB2_SIGNALING	0.971235194585448	0.995103695817103	0.181604967361397	0.595278332925611	573	24	PTPN18, PTPN12, RPS27A, ERBB2, AKT3, ERBB3, CDC37
REACTOME_HSF1_DEPENDENT_TRANSACTIVATION	0.969354838709677	0.995012390928591	0.16514713611189	0.594335146689178	600	34	SERPINH1, COL4A6, HSPA1B, HSPA1A, DNAJB1, PTGES3, HSPB1, TNFRSF21, HSP90AB1, DEDD2, HSPA1L
REACTOME_LONG_TERM_POTENTIATION	0.946296296296296	0.987925877288976	0.230480083158415	0.593783805984027	510	10	SRC, DLG4, ERBB4
REACTOME_CREB1_PHOSPHORYLATION_THROUGH_THE_ACTIVATION_OF_CAMKII_CAMKK_CAMKIV_CASCASDE	0.926640926640927	0.979627043456831	0.257521976548079	0.590373713371178	479	7	CAMKK2, CREB1
REACTOME_CAMK_IV_MEDIATED_PHOSPHORYLATION_OF_CREB	0.955307262569832	0.992770292474532	0.236468494918541	0.590256747243279	512	9	CAMKK2, CREB1
REACTOME_IRS_MEDIATED_SIGNALLING	0.971947194719472	0.995103695817103	0.17281899441616	0.579900133461727	588	27	FGF7, PIK3R2, FGF2, FGFR1
REACTOME_FATTY_ACID_METABOLISM	0.997113997113997	0.998998900700224	0.128528476742956	0.575587955300834	690	115	SLC27A3, ACAD11, ACSL5, ACBD4, CYP1B1, ELOVL5, HACD3, GGT5, GPX1, FASN, CPT1A, ACACA, DECR2, ACADL, EPHX2, SCD, HACD2, PTGDS, ACOT9, ACOT7, SLC25A17, PTGR1, PTGES3, LTA4H, SLC25A1, ACSL6, PPT2
REACTOME_FRUCTOSE_CATABOLISM	0.938342967244701	0.984396185413188	0.331786768870529	0.57376157883981	486	3	TKFC, ALDH1A1
REACTOME_BIOSYNTHESIS_OF_EPA_DERIVED_SPMS	0.946257197696737	0.987925877288976	0.301126830421551	0.572794001484812	492	4	LTA4H, ALOX5, GPX4
REACTOME_DOWNSTREAM_SIGNALING_OF_ACTIVATED_FGFR1	0.960817717206133	0.9937682008828	0.185568221386397	0.572656252648584	563	19	PLCG1, FGF2, FGFR1, FLRT2, HRAS, NRAS, FRS3, SHC1, FGF6
REACTOME_POST_CHAPERONIN_TUBULIN_FOLDING_PATHWAY	0.96078431372549	0.9937682008828	0.204432945571034	0.570445973014784	538	13	TUBB6, TUBA1A, TBCD, TBCB, ARL2, TBCA
REACTOME_FRS_MEDIATED_FGFR1_SIGNALING	0.961267605633803	0.9937682008828	0.207933556479132	0.569495649384338	545	12	FGF2, FGFR1, HRAS, NRAS, FRS3, FGF6
REACTOME_RUNX3_REGULATES_BCL2L11_BIM_TRANSCRIPTION	0.959692898272553	0.9937682008828	0.29506319457121	0.561259943767665	499	4	BCL2L11, SMAD3, FOXO3
REACTOME_EPIGENETIC_REGULATION_OF_GENE_EXPRESSION	0.995535714285714	0.998676205497972	0.131303090766728	0.553572076773531	668	78	SIN3B, ACTB, KAT2A, MYO1C, CHD3, MTF2, TAF1D, RRP8, MTA1, GTF2H4, BAZ2A, DNMT1, HDAC1, SAP30BP, SF3B1, EHMT2, POLR2H, POLR1C, TAF1C, EZH2, EED, MTA2, AEBP2, GATAD2A, MTA3, SIN3A, POLR1E, ERCC2, HDAC2
REACTOME_NOTCH3_ACTIVATION_AND_TRANSMISSION_OF_SIGNAL_TO_THE_NUCLEUS	0.986463620981388	0.997285831584709	0.168765232039228	0.55319128900364	582	24	JAG1, DLL1, RPS27A, NOTCH3
REACTOME_SYNTHESIS_OF_LEUKOTRIENES_LT_AND_EOXINS_EX	0.951737451737452	0.990355070852453	0.239556187061551	0.549186821304799	492	7	GGT5, PTGR1, LTA4H, ALOX5, CYP4B1
REACTOME_ARYL_HYDROCARBON_RECEPTOR_SIGNALLING	0.966037735849057	0.995012390928591	0.250977083264424	0.548180544814987	511	6	AHR, PTGES3, HSP90AB1
