pathway	pval	padj	ES	NES	nMoreExtreme	size	leadingEdge
REACTOME_RAP1_SIGNALLING	0.821052631578947	0.961830109908835	0.269337347578875	0.729603041477343	467	12	RAPGEF3, RAP1B, YWHAZ, SIPA1, RASGRP2
REACTOME_TRANSCRIPTIONAL_REGULATION_OF_TESTIS_DIFFERENTIATION	0.818342151675485	0.961830109908835	0.419659463870862	0.727841212745392	463	3	PTGDS, SOX9
REACTOME_INACTIVATION_OF_CDC42_AND_RAC1	0.820921985815603	0.961830109908835	0.330545001387485	0.727490681022355	462	6	SRGAP2, SRGAP3, CDC42
REACTOME_FRUCTOSE_METABOLISM	0.811151079136691	0.961748458376156	0.382726676031445	0.725896598538062	450	4	TKFC, ALDH1A1
REACTOME_TELOMERE_MAINTENANCE	0.91705069124424	0.986604234236169	0.182113980617024	0.724033770100456	596	55	CHTF18, CTC1, ACD, LIG1, POLD1, RTEL1, CDK2, POT1, RFC2, POLA2, TERF2IP, WRN, STN1, POLD2, RFC4, POLD3, PCNA, TERF1
REACTOME_SIGNALING_BY_FGFR2_IN_DISEASE	0.898360655737705	0.983742040373933	0.210056612858726	0.723339726633737	547	29	FGF7, PLCG1, FGF2
REACTOME_RUNX1_REGULATES_EXPRESSION_OF_COMPONENTS_OF_TIGHT_JUNCTIONS	0.81294964028777	0.961748458376156	0.380176249093155	0.721059344290406	451	4	CLDN5, RUNX1, TJP1, CBFB
REACTOME_VISUAL_PHOTOTRANSDUCTION	0.89922480620155	0.983910891089109	0.191393723473224	0.720633009939226	579	42	GPC3, GNB1, LRP1, APOE, CAMKMT, SDC2, CYP4V2, AGRN, BCO2, RDH11, NMT2, LDLR, MYO7A, SDC3
REACTOME_SULFIDE_OXIDATION_TO_SULFATE	0.812612612612613	0.961748458376156	0.350190801813164	0.714892250473595	450	5	TSTD1, SUOX, ETHE1
REACTOME_TRANSPORT_OF_INORGANIC_CATIONS_ANIONS_AND_AMINO_ACIDS_OLIGOPEPTIDES	0.933028919330289	0.989010654490107	0.179694035601651	0.713809615412143	612	54	SLC25A29, SLC26A11, SLC9A9, SLC12A4, SLC20A1, SLC8B1, SLC1A5, SLC12A7, SRI, SLC4A7, SLC7A5, SLC9A5, SLC1A7, SLC36A4, SLC26A6, SLC43A1, SLC15A3, SLC9A1, SLC7A6
REACTOME_INTERLEUKIN_2_FAMILY_SIGNALING	0.883606557377049	0.98304792304706	0.217652890236764	0.713441369673283	538	23	IL3RA, IL15, PIK3R2, LGALS9, PTK2B, IL15RA, INPP5D
REACTOME_SIGNALING_BY_TYPE_1_INSULIN_LIKE_GROWTH_FACTOR_1_RECEPTOR_IGF1R	0.90531561461794	0.985251079563672	0.204958547873263	0.713155391302492	544	31	FGF7, FGF2, PIK3R2, FGFR1, IGF1R, PIK3R4, CILP, HRAS, FGFR4, IGF2, IRS1, FGF6, NRAS
REACTOME_SIGNALING_BY_ERBB2_ECD_MUTANTS	0.8603066439523	0.980115331079737	0.239183721901096	0.710989864168291	504	16	PLCG1, ERBB2, CDC37, HRAS, NRAS, HSP90AA1
REACTOME_FRS_MEDIATED_FGFR1_SIGNALING	0.842105263157895	0.972661731139067	0.262277328137491	0.710478283237811	479	12	FGF2, FGFR1, HRAS, FRS3, FGF6, NRAS, FGF1
REACTOME_CARDIAC_CONDUCTION	0.922137404580153	0.987225938312895	0.173369717857008	0.710074733301377	603	65	CLIC2, CACNA1C, ITPR3, KCNIP2, WWTR1, NPR1, ITPR1
REACTOME_CREB1_PHOSPHORYLATION_THROUGH_THE_ACTIVATION_OF_CAMKII_CAMKK_CAMKIV_CASCASDE	0.840630472854641	0.972074510428276	0.305110535173384	0.709509417419473	479	7	CAMKK2, CREB1
REACTOME_METABOLISM_OF_WATER_SOLUBLE_VITAMINS_AND_COFACTORS	0.968934911242604	0.992507859550774	0.162944271489411	0.707980837911581	654	91	ABCD4, NADSYN1, PARP10, NT5E, SLC23A2, PARP16, NADK, PARP14, NNMT, SLC2A3, ENPP2, MTR, ALDH1L2, PARP4, QPRT, NAPRT, PARP9, FASN
REACTOME_SLC_TRANSPORTER_DISORDERS	0.935483870967742	0.989162049861496	0.1779355101055	0.707421351067814	608	55	CP, SLC9A9, AAAS, NUP85, NUP210, SLCO2A1, AVPR1A, NUP155, SLC33A1, NUP107, SLC2A1, NUP35, NUP160
REACTOME_SIGNALING_BY_MAPK_MUTANTS	0.828014184397163	0.96448046981025	0.320820986403691	0.706089267438311	466	6	DUSP16, DUSP8, DUSP10, DUSP6
REACTOME_TRANSPORT_OF_NUCLEOSIDES_AND_FREE_PURINE_AND_PYRIMIDINE_BASES_ACROSS_THE_PLASMA_MEMBRANE	0.851138353765324	0.975824527697727	0.302153115095821	0.702632180633454	485	7	SLC25A6, SLC25A5, SLC29A1, ARL2
REACTOME_FRUCTOSE_CATABOLISM	0.844797178130511	0.97335327045472	0.405026411882261	0.702462210905874	478	3	TKFC, ALDH1A1
REACTOME_ACTIVATION_OF_PUMA_AND_TRANSLOCATION_TO_MITOCHONDRIA	0.851138353765324	0.975824527697727	0.301911042150638	0.702069259939116	485	7	BBC3, TP53, TP63
REACTOME_MRNA_DECAY_BY_3_TO_5_EXORIBONUCLEASE	0.867120954003407	0.980115331079737	0.236034104413998	0.701627412193988	508	16	EXOSC2, DCPS, EXOSC9, EXOSC8, EXOSC5, NT5C3B, SKIV2L
REACTOME_SIGNALING_BY_FGFR_IN_DISEASE	0.922720247295209	0.987225938312895	0.181610769051803	0.701469969578723	596	47	FGF7, PLCG1, CNTRL, FGF2, CPSF6
REACTOME_FGFR1_MUTANT_RECEPTOR_ACTIVATION	0.89672131147541	0.983214221651577	0.213268374395437	0.699069426420945	546	23	CNTRL, FGF2, CPSF6, FGFR1
REACTOME_ERYTHROPOIETIN_ACTIVATES_STAT5	0.823423423423423	0.962678855325914	0.34221401224917	0.698608141886413	456	5	EPOR, STAT5A, JAK2, IRS2
REACTOME_ACTIVATED_NTRK2_SIGNALS_THROUGH_RAS	0.843585237258348	0.972661731139067	0.288665858436129	0.698157653813783	479	8	NTRK2, HRAS, NRAS, NTF4, SHC1, KRAS
REACTOME_E2F_ENABLED_INHIBITION_OF_PRE_REPLICATION_COMPLEX_FORMATION	0.823423423423423	0.962678855325914	0.340951041575108	0.696029867577699	456	5	ORC2, ORC3, ORC4
REACTOME_EGR2_AND_SOX10_MEDIATED_INITIATION_OF_SCHWANN_CELL_MYELINATION	0.877966101694915	0.982764205846542	0.228196572183619	0.692259063110876	517	17	NAB1, WWTR1, NAB2, UTRN, HDAC2, PMP22, LAMA2
REACTOME_PROTEIN_FOLDING	0.944869831546707	0.989162049861496	0.168361575653209	0.691904165787377	616	68	SPHK1, ACTB, KIFC3, GNB1, USP11, GNB4, TUBB6, RGS11, TP53, TUBA1A, GNG11, CCT3, NOP56, GNG12, PFDN5, FKBP9, CSNK2B, CCT8, TBCD, TBCB, FBXW5, CCT4
REACTOME_MECP2_REGULATES_NEURONAL_RECEPTORS_AND_CHANNELS	0.86115992970123	0.980115331079737	0.260575944919363	0.691732955557907	489	11	SLC2A3, NOTCH1, CREB1, HDAC1, HDAC2, SIN3A
REACTOME_RUNX1_REGULATES_TRANSCRIPTION_OF_GENES_INVOLVED_IN_DIFFERENTIATION_OF_MYELOID_CELLS	0.848920863309353	0.975277581403086	0.36422335656758	0.690802372026976	471	4	LGALS3, RUNX1
REACTOME_SIGNALING_BY_BRAF_AND_RAF1_FUSIONS	0.951219512195122	0.991241302875439	0.172902434199149	0.690424112536659	623	56	ACTG1, ZC3HAV1, ACTB, SRC, AGK, BCL2L11, IQGAP1, CLCN6, PAPSS1, RAP1B, FN1, ARRB2, HRAS, FAM131B, ATG7, BRAF, ARRB1, MAPK3, KSR1, VWF, NRAS, AKAP9
REACTOME_BASIGIN_INTERACTIONS	0.873935264054514	0.98138173273082	0.232178373259773	0.690165989368795	512	16	ITGA3, ATP1B2, SLC7A5, PPIA, CAV1, SLC7A6, ITGA6
REACTOME_PURINE_SALVAGE	0.868421052631579	0.980115331079737	0.254133005903767	0.688416276888111	494	12	HPRT1, GMPR2, AMPD2, ADA, APRT, DGUOK
REACTOME_DETOXIFICATION_OF_REACTIVE_OXYGEN_SPECIES	0.922570016474465	0.987225938312895	0.202303733102478	0.687280255150511	559	27	SOD3, CCS, TXNRD2, GPX1, CYBA, GPX3
REACTOME_ASSOCIATION_OF_TRIC_CCT_WITH_TARGET_PROTEINS_DURING_BIOSYNTHESIS	0.938808373590982	0.989162049861496	0.191718036206959	0.682559746685726	582	33	SPHK1, KIFC3, USP11, TP53, CCT3, NOP56, FKBP9, CCT8, FBXW5, CCT4
REACTOME_REVERSIBLE_HYDRATION_OF_CARBON_DIOXIDE	0.859712230215827	0.980115331079737	0.35867463526103	0.680278418054325	477	4	CA3, CA14, CA2
REACTOME_SIGNALING_BY_MODERATE_KINASE_ACTIVITY_BRAF_MUTANTS	0.937402190923318	0.989162049861496	0.184553101502896	0.678933725530968	598	38	ACTG1, ACTB, SRC, MAP3K11, IQGAP1, RAP1B, FN1, ARRB2, HRAS, BRAF, ARRB1, MAPK3, KSR1, VWF, NRAS
REACTOME_TRANSLESION_SYNTHESIS_BY_POLK	0.882453151618399	0.98304792304706	0.232083892438662	0.678681189083159	517	15	RPS27A, RFC2, RFC4, PCNA, RPA2, REV1, RPA3, MAD2L2, UBA52
REACTOME_MIRO_GTPASE_CYCLE	0.87170474516696	0.98138173273082	0.279894228465607	0.676942881018969	495	8	RHOT2, MYO19
REACTOME_TRANSPORT_OF_BILE_SALTS_AND_ORGANIC_ACIDS_METAL_IONS_AND_AMINE_COMPOUNDS	0.941463414634146	0.989162049861496	0.190799524959095	0.673780388027232	578	32	CP, SLC30A7, SLC39A10, SLC44A5, SLC11A1, SLC39A14, SLC44A1, SLC5A3, SLC30A1, SLC16A7, RUNX1
REACTOME_STAT5_ACTIVATION_DOWNSTREAM_OF_FLT3_ITD_MUTANTS	0.875219683655536	0.98138173273082	0.278153610890795	0.672733081187422	497	8	BCL2L1, CDKN1A, PIM1
REACTOME_GRB2_SOS_PROVIDES_LINKAGE_TO_MAPK_SIGNALING_FOR_INTEGRINS	0.873684210526316	0.98138173273082	0.268935594796862	0.672677505785782	497	9	SRC, RAP1B, FN1, VWF
REACTOME_INSERTION_OF_TAIL_ANCHORED_PROTEINS_INTO_THE_ENDOPLASMIC_RETICULUM_MEMBRANE	0.893220338983051	0.983214221651577	0.221408331490952	0.671666198384163	526	17	SERP1, VAMP2, APP, STX5, CYB5A, SEC61B, PRNP
REACTOME_MITOCHONDRIAL_UNCOUPLING	0.866906474820144	0.980115331079737	0.354021877374211	0.671453788533111	481	4	SLC25A27, UCP2
REACTOME_THE_FATTY_ACID_CYCLING_MODEL	0.866906474820144	0.980115331079737	0.354021877374211	0.671453788533111	481	4	SLC25A27, UCP2
REACTOME_INTERACTIONS_OF_REV_WITH_HOST_CELLULAR_PROTEINS	0.93968253968254	0.989162049861496	0.184656584545212	0.6711816227774	591	36	AAAS, NUP85, NUP210, XPO1, NPM1, NUP155, NUP107, NUP35, NUP160, RANBP1
REACTOME_P2Y_RECEPTORS	0.863063063063063	0.980115331079737	0.326927686487546	0.667402080023514	478	5	LPAR6, P2RY11
REACTOME_NUCLEOTIDE_LIKE_PURINERGIC_RECEPTORS	0.863063063063063	0.980115331079737	0.326927686487546	0.667402080023514	478	5	LPAR6, P2RY11
REACTOME_SIGNALING_BY_RETINOIC_ACID	0.943521594684385	0.989162049861496	0.191751093503938	0.667199916956089	567	31	CYP26B1, ALDH1A3, CPT1A, RARG, ALDH1A1, RXRB, RDH11, ALDH1A2
REACTOME_MITOCHONDRIAL_FATTY_ACID_BETA_OXIDATION_OF_UNSATURATED_FATTY_ACIDS	0.863475177304965	0.980115331079737	0.303006329113924	0.666881301474488	486	6	ACADL, ECI1, HADHB, ACADM, DECR1, HADHA
REACTOME_CAMK_IV_MEDIATED_PHOSPHORYLATION_OF_CREB	0.880701754385965	0.98304792304706	0.266234473765663	0.66592130321072	501	9	CAMKK2, CREB1, CAMK2A, CAMK2B
REACTOME_VLDL_CLEARANCE	0.878306878306878	0.982764205846542	0.383438516467531	0.665020996464174	497	3	APOC1, LSR
REACTOME_KETONE_BODY_METABOLISM	0.889279437609842	0.983214221651577	0.274804163313834	0.664632218568711	505	8	BDH2, ACSS3, HMGCS2
REACTOME_TRANSPORT_OF_MATURE_MRNAS_DERIVED_FROM_INTRONLESS_TRANSCRIPTS	0.941085271317829	0.989162049861496	0.17558444243356	0.661108122843429	606	42	AAAS, SYMPK, NUP85, NUP210, NUP155, WDR33, NUP107, NUP35, NCBP1, NUP160
REACTOME_INTERLEUKIN_12_SIGNALING	0.941841680129241	0.989162049861496	0.185049768519764	0.660933677783006	582	34	CNN2, PDCD4, MTAP, RAP1B, TYK2, MSN, PSME2, PPIA, HNRNPDL, CFL1, CAPZA1, CDC42
REACTOME_NEF_MEDIATED_CD4_DOWN_REGULATION	0.896672504378284	0.983214221651577	0.284131868131868	0.66072525523902	511	7	AP2A2, AP2B1, AP2S1, AP2M1, ATP6V1H, ARF1, AP2A1
REACTOME_REGULATION_OF_PTEN_GENE_TRANSCRIPTION	0.966463414634146	0.992507859550774	0.164902064279538	0.658477492887856	633	56	HDAC7, JUN, CHD3, PPARG, RRAGB, TP53, CBX4, MECOM, HDAC5, SNAI2, PTEN, EGR1, MTA1, HDAC1, PHC3, RING1, MAPK3, EED, EZH2, HDAC2, MTA3, ATF2, LAMTOR4, CBX6
REACTOME_PHOSPHATE_BOND_HYDROLYSIS_BY_NUDT_PROTEINS	0.868794326241135	0.980115331079737	0.299076310968535	0.658231793646453	489	6	NUDT5, NUDT1
REACTOME_SHC1_EVENTS_IN_EGFR_SIGNALING	0.90418118466899	0.985229624519562	0.25446544701671	0.65574856367535	518	10	AREG, HRAS, NRAS, SHC1, KRAS
REACTOME_ABC_TRANSPORTERS_IN_LIPID_HOMEOSTASIS	0.892982456140351	0.983214221651577	0.242064872670101	0.655725130296722	508	12	ABCA6, ABCA7, ABCA10, ABCA9, ABCA5, ABCG1, ABCA2
REACTOME_FRS_MEDIATED_FGFR4_SIGNALING	0.894736842105263	0.983214221651577	0.240457619838547	0.651371272338047	509	12	FGF2, HRAS, FGFR4, FRS3, FGF6, NRAS, FGF1
REACTOME_CYTOSOLIC_SULFONATION_OF_SMALL_MOLECULES	0.911149825783972	0.986414263574874	0.25134234379596	0.647700435824488	522	10	ABHD14B, PAPSS1, SLC35B3, PAPSS2, PODXL2, SULT1A1
REACTOME_BICARBONATE_TRANSPORTERS	0.89568345323741	0.983214221651577	0.339866408859202	0.644605891354098	497	4	SLC4A7, AHCYL2, SLC4A4, SLC4A2
REACTOME_PEXOPHAGY	0.903339191564148	0.985229624519562	0.242763382176051	0.644447176065463	513	11	ATM, RPS27A, EPAS1
REACTOME_SIGNALING_BY_LEPTIN	0.916376306620209	0.986604234236169	0.249972080907629	0.644169316250437	525	10	LEPR, SOCS3, SH2B1, IRS1, STAT5A, JAK2, IRS2
REACTOME_VXPX_CARGO_TARGETING_TO_CILIUM	0.923339011925043	0.987225938312895	0.215781329910253	0.641424663950935	541	16	ASAP1, PKD2, ARF4, RAB11FIP3, EXOC4, PKD1
REACTOME_TRAF6_MEDIATED_IRF7_ACTIVATION_IN_TLR7_8_OR_9_SIGNALING	0.910526315789474	0.986414263574874	0.236151425761592	0.639706301534776	518	12	MYD88, RPS27A, IRF7, IRAK4
REACTOME_INTERLEUKIN_12_FAMILY_SIGNALING	0.964006259780908	0.992507859550774	0.17233155798831	0.638044812692083	615	39	CNN2, PDCD4, MTAP, RAP1B, TYK2, MSN, PSME2, CRLF1, PPIA, HNRNPDL, CFL1, CAPZA1
REACTOME_CROSS_PRESENTATION_OF_PARTICULATE_EXOGENOUS_ANTIGENS_PHAGOSOMES	0.895495495495495	0.983214221651577	0.310450909730157	0.633765788163041	496	5	CYBA, CD36, ITGB5, ITGAV, CYBB
REACTOME_REGULATION_OF_GLUCOKINASE_BY_GLUCOKINASE_REGULATORY_PROTEIN	0.962295081967213	0.992507859550774	0.183757866183394	0.63277876798523	586	29	AAAS, NUP85, NUP210, NUP155, NUP107, NUP35, NUP160
REACTOME_ALPHA_OXIDATION_OF_PHYTANATE	0.904676258992806	0.985229624519562	0.331780629284584	0.629270038754001	502	4	SLC25A17, ALDH3A2
REACTOME_HOMOLOGOUS_DNA_PAIRING_AND_STRAND_EXCHANGE	0.963934426229508	0.992507859550774	0.182129887564472	0.627172747812143	587	29	XRCC3, ATM, RFC2, MRE11, RAD51D, WRN, RAD9A, RFC4
REACTOME_RUNX1_AND_FOXP3_CONTROL_THE_DEVELOPMENT_OF_REGULATORY_T_LYMPHOCYTES_TREGS	0.908289241622575	0.986414263574874	0.361103787679058	0.626284502980153	514	3	RUNX1, NFATC2
REACTOME_TRANSPORT_OF_THE_SLBP_DEPENDANT_MATURE_MRNA	0.968954248366013	0.992507859550774	0.173725290408117	0.620551208060267	592	35	AAAS, NUP85, NUP210, NUP155, NUP107, NUP35, NCBP1, NUP160
REACTOME_BETA_OXIDATION_OF_LAUROYL_COA_TO_DECANOYL_COA_COA	0.908108108108108	0.986414263574874	0.302979695877648	0.618513780237259	503	5	ACADL, ECHS1, HADH, HADHB, HADHA
REACTOME_NEGATIVE_REGULATION_OF_ACTIVITY_OF_TFAP2_AP_2_FAMILY_TRANSCRIPTION_FACTORS	0.91710758377425	0.986604234236169	0.356486438599175	0.618276350553488	519	3	KCTD15, UBE2I
REACTOME_GLYCOSPHINGOLIPID_METABOLISM	0.973421926910299	0.994325981513682	0.177153415768927	0.616407146001951	585	31	SMPD3, UGCG, ARSG, GBA2, SUMF1, STS, ARSA, GLB1
REACTOME_HSF1_DEPENDENT_TRANSACTIVATION	0.972536348949919	0.994325981513682	0.172513483793196	0.616158410911053	601	34	COL4A6, SERPINH1, HSPA1B, HSPA1A, DNAJB1, PTGES3, TNFRSF21, HSPB2, HSPB1, CRYAB, HSPA1L, HSP90AB1, HSP90AA1, DEDD2
REACTOME_ZINC_INFLUX_INTO_CELLS_BY_THE_SLC39_GENE_FAMILY	0.911347517730496	0.986414263574874	0.279885086533303	0.615994165258681	513	6	SLC39A10, SLC39A14
REACTOME_IONOTROPIC_ACTIVITY_OF_KAINATE_RECEPTORS	0.913513513513514	0.986604234236169	0.301556378308097	0.615608167939145	506	5	NCALD, DLG4
REACTOME_SYNTHESIS_OF_PI	0.920634920634921	0.987225938312895	0.353018718692328	0.612262070691476	521	3	CDIPT, PITPNM2
REACTOME_IRS_ACTIVATION	0.926258992805755	0.987225938312895	0.319476182105818	0.605932871753852	514	4	IRS1, IRS2, INSR
REACTOME_PP2A_MEDIATED_DEPHOSPHORYLATION_OF_KEY_METABOLIC_FACTORS	0.928196147110333	0.987225938312895	0.260490063116143	0.605748185063717	529	7	PPP2R1B, PPP2R1A, PPP2CA, PPP2R5D, MLXIPL, PFKFB1, PPP2CB
REACTOME_RUNX1_REGULATES_TRANSCRIPTION_OF_GENES_INVOLVED_IN_INTERLEUKIN_SIGNALING	0.928057553956835	0.987225938312895	0.318421515204781	0.60393254315384	515	4	RUNX1, ELF1, CBFB, LIFR
REACTOME_NR1H2_NR1H3_REGULATE_GENE_EXPRESSION_LINKED_TO_GLUCONEOGENESIS	0.928057553956835	0.987225938312895	0.318107610646744	0.603337177674465	515	4	NR1H3, RXRB
REACTOME_NEGATIVE_REGULATION_OF_TCF_DEPENDENT_SIGNALING_BY_DVL_INTERACTING_PROTEINS	0.928057553956835	0.987225938312895	0.318069959571102	0.603265766953835	515	4	CCDC88C, DVL2
REACTOME_PHASE_0_RAPID_DEPOLARISATION	0.951342281879195	0.991241302875439	0.195353748680042	0.600958569251256	566	18	CACNA1C, SCN5A, SCN2B, FGF11, CAMK2A, CACNA2D2, CAMK2B, SCN4B, CACNB1, SCN3B, CAMK2D, CACNG6, SCN1B, CAMK2G, CALM1, SCN7A, FGF13, SCN4A
REACTOME_P130CAS_LINKAGE_TO_MAPK_SIGNALING_FOR_INTEGRINS	0.945614035087719	0.989162049861496	0.239964124473511	0.600212362557794	538	9	SRC, RAP1B, FN1, VWF
REACTOME_VITAMIN_D_CALCIFEROL_METABOLISM	0.929078014184397	0.987455910797588	0.270949443030352	0.596327864603557	523	6	CYP2R1, UBE2I, SUMO2
REACTOME_NOTCH3_ACTIVATION_AND_TRANSMISSION_OF_SIGNAL_TO_THE_NUCLEUS	0.973727422003284	0.994325981513682	0.180178168270516	0.595436899206751	592	24	JAG1, DLL1, NOTCH3, RPS27A
REACTOME_NUCLEAR_PORE_COMPLEX_NPC_DISASSEMBLY	0.975609756097561	0.994325981513682	0.168196923512284	0.593962633887005	599	32	AAAS, NUP85, NUP210, NUP155, NUP107, NUP35, NUP160
REACTOME_VLDL_ASSEMBLY	0.939114391143911	0.989162049861496	0.383886501750275	0.591699325061078	508	2	APOC1, P4HB
REACTOME_SIGNALING_BY_FGFR4_IN_DISEASE	0.945518453427065	0.989162049861496	0.222688904240884	0.591156846608258	537	11	PLCG1, HRAS, FGFR4, NRAS
REACTOME_BBSOME_MEDIATED_CARGO_TARGETING_TO_CILIUM	0.953020134228188	0.99233923603328	0.191965762647457	0.590536249472174	567	18	BBS1, SMO, CCT3, BBIP1, BBS7, CCT8, CCT4
REACTOME_ASPARTATE_AND_ASPARAGINE_METABOLISM	0.956063268892794	0.992507859550774	0.243600097304938	0.589163101326216	543	8	ASPA, SLC25A13, GADL1, NAT8L
REACTOME_REGULATION_OF_TP53_ACTIVITY_THROUGH_ACETYLATION	0.978688524590164	0.994958282671586	0.170992126861174	0.588819350255199	596	29	PML, CHD3, PIP4K2A, TP53
REACTOME_HUR_ELAVL1_BINDS_AND_STABILIZES_MRNA	0.956063268892794	0.992507859550774	0.243204204551257	0.588205608266356	543	8	ANP32A, XPO1, TNFSF13
REACTOME_RUNX3_REGULATES_BCL2L11_BIM_TRANSCRIPTION	0.93705035971223	0.989162049861496	0.306492179845355	0.581306830073114	520	4	BCL2L11, SMAD3, FOXO3
REACTOME_LONG_TERM_POTENTIATION	0.958188153310105	0.992507859550774	0.224797102145566	0.579294275818343	549	10	SRC, DLG4, ERBB4, CAMK2A, CAMK2B
REACTOME_RUNX3_REGULATES_P14_ARF	0.959578207381371	0.992507859550774	0.23935694052235	0.57890074331774	545	8	TGFB1, CCND1, RUNX1, BRD2
REACTOME_HDMS_DEMETHYLATE_HISTONES	0.970247933884298	0.992724719997447	0.178542453296572	0.578465244956538	586	22	PHF8, KDM5B, KDM4C, KDM6B, KDM6A
REACTOME_CHYLOMICRON_ASSEMBLY	0.938271604938272	0.989162049861496	0.327139123370549	0.567377497207486	531	3	APOE
REACTOME_DEFECTIVE_FACTOR_IX_CAUSES_HEMOPHILIA_B	0.944649446494465	0.989162049861496	0.368032405110556	0.567262783952172	511	2	GGCX
REACTOME_WNT5A_DEPENDENT_INTERNALIZATION_OF_FZD4	0.960138648180243	0.992507859550774	0.200823584278079	0.562207775370893	553	13	CLTA, AP2A2, ARRB2, AP2B1
REACTOME_GROWTH_HORMONE_RECEPTOR_SIGNALING	0.981260647359455	0.995574403451764	0.187269497570957	0.556671305147997	575	16	SOCS3, SOCS2, CISH, SH2B1, MAPK3, IRS1, STAT5A, JAK2, IRS2
REACTOME_FOXO_MEDIATED_TRANSCRIPTION_OF_CELL_CYCLE_GENES	0.984667802385009	0.995942624549722	0.182830316679252	0.543475538336925	577	16	BTG1, CDKN1A, CCNG2, CDKN1B, CAV1, KLF4, SMAD3, GADD45A
REACTOME_SIRT1_NEGATIVELY_REGULATES_RRNA_EXPRESSION	0.968476357267951	0.992507859550774	0.23161839325002	0.538609494965716	552	7	TAF1D, RRP8, TAF1C, SUV39H1, TAF1B
REACTOME_LYSINE_CATABOLISM	0.982425307557118	0.995574403451764	0.221308972833097	0.535250528338045	558	8	PHYKPL, HYKK, ALDH7A1
REACTOME_XENOBIOTICS	0.965827338129496	0.992507859550774	0.281021920957744	0.532998793429017	536	4	AHR, CYP2J2
REACTOME_RHOT1_GTPASE_CYCLE	0.985585585585586	0.99623717805536	0.259811771985482	0.530389209004209	546	5	MYO19, RAP1GDS1, TRAK1, RHOT1, TRAK2
REACTOME_BIOSYNTHESIS_OF_EPA_DERIVED_SPMS	0.967625899280576	0.992507859550774	0.278683516378353	0.528563670307245	537	4	LTA4H, ALOX5, GPX4
REACTOME_INTERLEUKIN_7_SIGNALING	0.980935875216638	0.995574403451764	0.185144371370039	0.518313650882058	565	13	PIK3R2, SOCS2, CISH, IRS1, STAT5A, BRWD1, PIK3R3, IRS2
REACTOME_VOLTAGE_GATED_POTASSIUM_CHANNELS	0.984210526315789	0.995942624549722	0.206017922960373	0.515304129484344	560	9	KCNAB1, KCNQ4, KCNQ5, KCND3, KCNC4, KCNAB2
REACTOME_ARYL_HYDROCARBON_RECEPTOR_SIGNALLING	0.968085106382979	0.992507859550774	0.230569730051993	0.507456864374219	545	6	AHR, PTGES3, HSP90AB1
REACTOME_RRNA_PROCESSING	1	1	0.103722493906275	0.498574082741062	766	195	LAS1L, CSNK1E, RBM28, RPL3, ERI1, TRMT112, EXOSC2, WDR75, EXOSC10, RPL35A, RPS27A, NOP58, RPL10A, RPS8, RPL24, RPL28, RPL31, RPL12, RPL18, RPS19, RPL11, NOP56, RPS4X, RPL36A, FBL, WDR18, RPL36, RPL22L1, RPL13, RPL34, RPS9, RPS6, RPL15, RPL35, RPS11, EXOSC9, RPL17, RPS28, RPS17, RPL26, RPS27, FAU, RPL7A, MTERF4, RPL8, RPL41, RPL13A, RPS15, RPL19, RPS16, RPL10, EXOSC8, RPS18, RPL23, RPL22, RPL18A, RPL7, RPS3A, RPL32, EXOSC5, NOL12, MT-RNR2, RPL37, TEX10, RPS24, TFB1M, RPS12, RPS27L, RPL23A, RPS25
REACTOME_SHC1_EVENTS_IN_ERBB2_SIGNALING	0.98993288590604	0.999360818152764	0.161987558224686	0.498315552606323	589	18	PTPN12, ERBB3, ERBB2, HRAS, NRAS, ERBB4
REACTOME_FORMATION_OF_TUBULIN_FOLDING_INTERMEDIATES_BY_CCT_TRIC	0.993185689948893	1	0.166595471816163	0.495216358940199	582	16	TUBB6, TUBA1A, CCT3, CCT8, CCT4
REACTOME_SYNTHESIS_SECRETION_AND_INACTIVATION_OF_GLUCOSE_DEPENDENT_INSULINOTROPIC_POLYPEPTIDE_GIP	0.975177304964539	0.994325981513682	0.224068213783404	0.493147791545829	549	6	DPP4, SEC11C, SEC11A, SPCS2, SPCS3, SPCS1
REACTOME_ERCC6_CSB_AND_EHMT2_G9A_POSITIVELY_REGULATE_RRNA_EXPRESSION	0.99488926746167	1	0.164817018723085	0.489929786287901	583	16	CHD3, MTA1, HDAC1, EHMT2, HDAC2, MTA3, MTA2, GATAD2A
REACTOME_RUNX1_REGULATES_ESTROGEN_RECEPTOR_MEDIATED_TRANSCRIPTION	0.976950354609929	0.994385796545106	0.22079315143355	0.485939764410992	550	6	KCTD6, RUNX1, ESR1, GPAM
REACTOME_REGULATION_OF_GLYCOLYSIS_BY_FRUCTOSE_2_6_BISPHOSPHATE_METABOLISM	0.996485061511424	1	0.168130196372095	0.446323614756498	566	11	PPP2R1B, PFKFB2, PFKFB4, PRKACB
REACTOME_ASSEMBLY_AND_CELL_SURFACE_PRESENTATION_OF_NMDA_RECEPTORS	0.998347107438017	1	0.131563978277522	0.412463773581442	603	19	TUBB6, TUBA1A, DLG4, APBA1, LIN7C, NBEA, CAMK2A
REACTOME_ABACAVIR_TRANSPORT_AND_METABOLISM	0.996402877697842	1	0.216470381437863	0.41056744515261	553	4	GUK1, NT5C2
REACTOME_TRISTETRAPROLIN_TTP_ZFP36_BINDS_AND_DESTABILIZES_MRNA	1	1	-0.122594646059403	-0.399364296415483	411	17	MAPKAPK2, YWHAB, XRN1, TNPO1
REACTOME_THYROXINE_BIOSYNTHESIS	0.997826086956522	1	-0.261335676625659	-0.401725134939358	458	2	DIO2, TPO
REACTOME_SYNTHESIS_OF_LIPOXINS_LX	0.993103448275862	1	-0.252570524650672	-0.439775705089646	431	3	HPGD, ALOX5, PTGR1
REACTOME_DISEASES_OF_MISMATCH_REPAIR_MMR	0.986577181208054	0.996605920025925	-0.216313615188538	-0.458314357913241	440	5	MSH3, MLH1, PMS2, MSH6, MSH2
REACTOME_ERBB2_REGULATES_CELL_MOTILITY	1	1	-0.164142287161552	-0.460592128141504	432	11	MEMO1, NRG4, NRG2, DIAPH1
REACTOME_AMINO_ACID_TRANSPORT_ACROSS_THE_PLASMA_MEMBRANE	1	1	-0.138652088539874	-0.467674611266864	399	20	SLC38A2, SLC3A2, SLC6A6, SLC38A1, SLC16A10, SLC1A4, SLC38A3
REACTOME_NEUROTRANSMITTER_CLEARANCE	0.982102908277405	0.995574403451764	-0.225015381910873	-0.476751221559487	438	5	LRTOMT, COMT, MAOA, ACHE, ALDH2
REACTOME_SYNTHESIS_OF_PROSTAGLANDINS_PG_AND_THROMBOXANES_TX	0.995381062355658	1	-0.195194354304034	-0.491219210023374	430	8	PTGES2
REACTOME_GRB2_EVENTS_IN_ERBB2_SIGNALING	0.993055555555556	1	-0.169305189094107	-0.49363886764742	428	12	SOS1, NRG4, NRG2, GRB2, HBEGF, EGFR, EGF, KRAS, ERBB4, NRAS, HRAS, ERBB2
REACTOME_METABOLISM_OF_FOLATE_AND_PTERINES	0.997647058823529	1	-0.169468305246894	-0.507743394231732	423	13	DHFR, SHMT2, ALDH1L1, MTHFS, SHMT1, FPGS, SLC25A32, MTHFD1
REACTOME_TYROSINE_CATABOLISM	0.958695652173913	0.992507859550774	-0.344661735762637	-0.529813931627903	440	2	GSTZ1
REACTOME_BLOOD_GROUP_SYSTEMS_BIOSYNTHESIS	0.974885844748858	0.994325981513682	-0.235232067510549	-0.529909964651987	426	6	ST3GAL3, FUT11, B3GALT1, ST3GAL6, ST6GALNAC6, ST3GAL4
REACTOME_COOPERATION_OF_PREFOLDIN_AND_TRIC_CCT_IN_ACTIN_AND_TUBULIN_FOLDING	0.994897959183674	1	-0.152076455438779	-0.533190796573437	389	23	PFDN4, TUBA4A, VBP1, TUBB4B, PFDN2, CCT2, CCT7, TCP1, PFDN1, TUBA1C
REACTOME_TRAFFICKING_OF_GLUR2_CONTAINING_AMPA_RECEPTORS	0.983644859813084	0.995942624549722	-0.198626471468533	-0.537454223344147	420	10	PRKCA, NSF, AP2A1, PICK1
REACTOME_FREE_FATTY_ACIDS_REGULATE_INSULIN_SECRETION	0.960739030023095	0.992507859550774	-0.222986253999278	-0.561159322082569	415	8	GNA11
REACTOME_ANDROGEN_BIOSYNTHESIS	0.947826086956522	0.989522966684747	-0.366916266895733	-0.564023591165744	435	2	HSD17B12
REACTOME_DOWNREGULATION_OF_ERBB2_ERBB3_SIGNALING	0.965277777777778	0.992507859550774	-0.199891402305736	-0.582818317705614	416	12	RNF41, USP8, NRG2, AKT2, UBC, AKT1
REACTOME_MITOCHONDRIAL_FATTY_ACID_BETA_OXIDATION	0.9775	0.994385796545106	-0.153822048817261	-0.586876679348054	390	31	ACOT13, MCAT, MMAA, ACADS, ACOT2, PCTP, HADHA, ACOT1, NDUFAB1, DBI, DECR1, ACADM, ACADVL, HADHB
REACTOME_POST_CHAPERONIN_TUBULIN_FOLDING_PATHWAY	0.969411764705882	0.992507859550774	-0.197109675891969	-0.590559607753786	411	13	TUBA4A, TBCC, TUBB4B, TBCE
REACTOME_CREATINE_METABOLISM	0.931506849315068	0.989010654490107	-0.264339629772334	-0.595480902545293	407	6	CKMT2, CKM
REACTOME_RELEASE_OF_HH_NP_FROM_THE_SECRETING_CELL	0.91264367816092	0.986604234236169	-0.342275929493208	-0.595970723172384	396	3	ADAM17
REACTOME_SUMOYLATION_OF_SUMOYLATION_PROTEINS	0.968668407310705	0.992507859550774	-0.154568937824854	-0.601440312636069	370	34	SEC13, NUP37, NDC1, SUMO1, NUP58, NUP214, RANBP2, NUP188
REACTOME_SOS_MEDIATED_SIGNALLING	0.932714617169374	0.989010654490107	-0.252307692307692	-0.60277995382308	401	7	SOS1, GRB2, KRAS, IRS2, NRAS, IRS1, HRAS
REACTOME_E2F_MEDIATED_REGULATION_OF_DNA_REPLICATION	0.956626506024096	0.992507859550774	-0.194628572379684	-0.609676334998429	396	15	TFDP2, PPP2CB, TFDP1
REACTOME_FORMATION_OF_SENESCENCE_ASSOCIATED_HETEROCHROMATIN_FOCI_SAHF	0.944444444444444	0.989162049861496	-0.231816350098952	-0.610253746975148	407	9	HMGA1
REACTOME_FRS_MEDIATED_FGFR3_SIGNALING	0.934579439252336	0.989162049861496	-0.225606680329439	-0.610458728190817	399	10	PTPN11
REACTOME_GLUTATHIONE_SYNTHESIS_AND_RECYCLING	0.939814814814815	0.989162049861496	-0.232413102247063	-0.61182468981091	405	9	GCLM, GCLC, OPLAH
REACTOME_FOXO_MEDIATED_TRANSCRIPTION_OF_OXIDATIVE_STRESS_METABOLIC_AND_NEURONAL_GENES	0.957920792079208	0.992507859550774	-0.179354035169341	-0.61456212643338	386	21	FOXO4, FBXO32, SMAD4, SOD2, TRIM63, SMAD2
REACTOME_HDR_THROUGH_MMEJ_ALT_NHEJ	0.916859122401848	0.986604234236169	-0.24453297029217	-0.615383026419356	396	8	FEN1, PARP1
REACTOME_FATTY_ACIDS_BOUND_TO_GPR40_FFAR1_REGULATE_INSULIN_SECRETION	0.923937360178971	0.987225938312895	-0.291915911092583	-0.61849668242309	412	5	GNA11
