pathway	pval	padj	ES	NES	nMoreExtreme	size	leadingEdge
REACTOME_SIGNALING_BY_VEGF	0.177514792899408	0.539295813786227	0.272978408689849	1.18073782401148	119	90	ACTG1, SPHK1, NOS3, PLCG1, ACTB, ITPR3, VAV2, SRC, CTNND1, WASF2, FYN, DOCK1, MAPK11, NRP2, PIK3R2, AXL, ITPR1, SHC2, VEGFC, ROCK1, SHB, ELMO1, MAPK14, PTK2B, FLT4, CYBA, CYFIP1, AKT3, RASA1, CTNNA1, PGF, HSPB1, HRAS, PXN, RHOA, NRAS, ABI2
REACTOME_RHO_GTPASES_ACTIVATE_CIT	0.265625	0.643330833300438	0.399074931263631	1.17655901085179	152	16	MYH9, MYL9, RHOC, MYH11, MYL6, MYH10, MYL12B, CDKN1B, RHOA, DLG4
REACTOME_TRANSCRIPTIONAL_REGULATION_OF_GRANULOPOIESIS	0.24061433447099	0.611145034838456	0.362831965001227	1.17637903876347	140	23	CEBPA, PML, CDK2, FLI1, MYC, CDKN1A, CEBPB, CREB1, CSF3R, KMT2A, RUNX1
REACTOME_HYALURONAN_UPTAKE_AND_DEGRADATION	0.284916201117318	0.65749892565535	0.471173834487743	1.17611242472991	152	9	GUSB, CD44, HYAL2, SLC9A1, HEXA, LYVE1
REACTOME_PLATELET_ADHESION_TO_EXPOSED_COLLAGEN	0.283783783783784	0.656792163342382	0.512529000309518	1.17498185272998	146	7	FYN, COL1A1, COL1A2, ITGA10, VWF, ITGA1
REACTOME_ASSEMBLY_OF_ACTIVE_LPL_AND_LIPC_LIPASE_COMPLEXES	0.264814814814815	0.643330833300438	0.455711830437681	1.17404637051978	142	10	LMF2, PCSK5, LMF1, MBTPS1
REACTOME_RHO_GTPASES_ACTIVATE_PKNS	0.244628099173554	0.613963899105986	0.342420852380243	1.17348788320031	147	30	MYH9, MYL9, RHOC, PKN3, MYH11, KDM4C, MYL6, YWHAQ, PPP1R14A, YWHAZ, YWHAH, MYH10
REACTOME_PASSIVE_TRANSPORT_BY_AQUAPORINS	0.310940499040307	0.673684654063316	0.616835134020421	1.17332442339117	161	4	AQP1, AQP7, AQP3
REACTOME_POTASSIUM_CHANNELS	0.261157024793388	0.641393673308567	0.351831298234911	1.17272945798674	157	26	GABBR1, GNB1, GNB4, ABCC8, KCNAB1, KCNJ8, KCNQ4, GNG11, GNG12, GNB2, KCNQ5
REACTOME_AMINE_LIGAND_BINDING_RECEPTORS	0.308285163776493	0.673315124182176	0.676509359346164	1.16989318000752	159	3	ADRA2B, ADRB2, ADRA2C
REACTOME_ADRENOCEPTORS	0.308285163776493	0.673315124182176	0.676509359346164	1.16989318000752	159	3	ADRA2B, ADRB2, ADRA2C
REACTOME_ACTIVATED_NTRK3_SIGNALS_THROUGH_PI3K	0.297196261682243	0.671509774755631	0.565906038370326	1.16921377769931	158	5	NTRK3, SRC
REACTOME_SIGNALING_BY_RNF43_MUTANTS	0.29622641509434	0.671509774755631	0.53494121110786	1.168410919176	156	6	FZD6, LRP5, FZD8, FZD4, FZD5
REACTOME_INTERACTION_BETWEEN_L1_AND_ANKYRINS	0.276632302405498	0.649856061413797	0.387551275661998	1.16679542402478	160	17	ACTG1, ACTB, SPTAN1, NFASC, SCN5A
REACTOME_RHO_GTPASE_EFFECTORS	0.172642762284197	0.530951628688341	0.243197334278442	1.16663553425599	129	183	CENPT, ACTG1, MYH9, ACTB, SRGAP2, FLNA, MYL9, ARPC1B, DYNLL1, FMNL3, FMNL2, RHOC, LIMK2, SRC, ARPC5, PKN3, PPP2R1B, WASF2, NUP85, TUBB6, NOXA1, MYH11, MAPK11, KNTC1, KDM4C, MYLK, MYL6, ARPC1A, YWHAQ, WIPF1, PPP1R14A, TAX1BP3, ITGB3BP, CENPC, FMNL1, YWHAZ, ROCK1, IQGAP1, RCC2, DAAM1, XPO1, SCAI, YWHAH, NUP107, MAPK14, TUBA1A, MYH10, PIK3R4, NCKIPSD, CFL1, CYBA, CYFIP1, NUP160
REACTOME_TP53_REGULATES_TRANSCRIPTION_OF_SEVERAL_ADDITIONAL_CELL_DEATH_GENES_WHOSE_SPECIFIC_ROLES_IN_P53_DEPENDENT_APOPTOSIS_REMAIN_UNCERTAIN	0.268683274021352	0.644353553082881	0.43604370092427	1.16555498063428	150	11	NDRG1, TP53I3, TP53, PERP, TP63
REACTOME_CLEC7A_INFLAMMASOME_PATHWAY	0.315992292870906	0.677842565597668	0.673730623714596	1.16508788970443	163	3	MALT1, RELA, NFKB1
REACTOME_VASOPRESSIN_REGULATES_RENAL_WATER_HOMEOSTASIS_VIA_AQUAPORINS	0.266115702479339	0.643330833300438	0.348604130913811	1.1619726145726	160	26	ADCY4, GNB1, GNB4, ADCY3, ADCY5, AQP1, ADCY6, GNG11, GNG12
REACTOME_METABOLISM_OF_CARBOHYDRATES	0.168449197860963	0.522978247935803	0.239452634145959	1.16191679679706	125	206	ENO2, G6PD, GPC3, MAN2C1, IDUA, VCAN, GUSB, PGLS, NDST2, CD44, CSGALNACT1, RPE, AKR1A1, PPP2R1B, MANBA, AAAS, NUP85, PHKA2, BGN, HGSNAT, SGSH, ABCC5, PYGL, NUP210, RPS27A, ADPGK, XYLT1, LUM, CHST14, TKFC, NUP155, PFKL, SHPK, MAN2B2, XYLT2, TKT, SLC25A13, B3GAT3, NUP107, HS6ST3, PRELP, ENO1, PAPSS1, GALT, SLC35B3, CHST7, CHSY1, B4GALT7, CHPF, CRYL1, GALK1, B3GNT2, FMOD, NUP35, NUP160, PGAM1, GALE, PFKFB2, GAA, SLC2A1, DSE, SDC2, DCN, HYAL2, SLC25A1, ST3GAL4, GLB1
REACTOME_LTC4_CYSLTR_MEDIATED_IL4_PRODUCTION	0.264367816091954	0.643330833300438	0.87461558738248	1.16158957989751	137	1	GGT5
REACTOME_NEPHRIN_FAMILY_INTERACTIONS	0.27710843373494	0.649856061413797	0.381079997248118	1.16072013084384	160	18	ACTN1, ACTN4, SPTAN1, FYN, PIK3R2, IQGAP1
REACTOME_PYRIMIDINE_CATABOLISM	0.293785310734463	0.668267015833758	0.486305312429048	1.15923572969212	155	8	UPP1, TYMP, NT5E, DPYD
REACTOME_THE_NLRP3_INFLAMMASOME	0.281481481481481	0.655763350636422	0.449141571653446	1.15711947074718	151	10	NFKB2, TXN, APP, TXNIP, HSP90AB1, RELA
REACTOME_DISEASES_OF_METABOLISM	0.188888888888889	0.552083333333333	0.246557560044495	1.15611508888788	135	157	ABCD4, CYP26B1, GPC3, ALG13, ADAMTS9, THBS2, FDXR, IDUA, VCAN, ADAMTS1, ADAMTS4, GUSB, MAN1B1, NOTCH2, ADAMTS13, BGN, CYP1B1, HGSNAT, ADAMTS2, SGSH, ADAMTS17, ADAMTS10, ALG6, ADAMTSL4, MTR, RPS27A, THBS1, LUM, ALG2, CHST14, SLC35D1, ALG9, NOTCH3, B3GAT3, SPON2, NOTCH1, PRELP, ACACA, GALT, CHSY1, B4GALT7, GALK1, MUC20, FMOD, CYP2R1, GALE, GAA, SDC2, DCN, GLB1, MOGS, SRD5A3, AGRN, GSS, PAPSS2, DPAGT1, ADAMTS5, TCN2, ALG8
REACTOME_LDL_CLEARANCE	0.276041666666667	0.649856061413797	0.392066488461388	1.15589660916971	158	16	CLTA, AP2A2, NPC2, CES3, LIPA, LSR, AP2B1, LDLR
REACTOME_METABOLISM_OF_NITRIC_OXIDE_NOS3_ACTIVATION_AND_REGULATION	0.276157804459691	0.649856061413797	0.3968511443407	1.15475070652059	160	15	NOS3, DDAH2, NOSTRIN, CYGB, ZDHHC21
REACTOME_CELLULAR_RESPONSE_TO_STARVATION	0.191933240611961	0.556956704497688	0.248005235431898	1.15424488138914	137	145	TCIRG1, RPL3, ATF3, RRAGB, RPS27A, RPL35A, ITFG2, RPL10A, RPS8, RPL24, RPL28, RPS19, RPL12, RPL31, RPL18, RPL11, WDR59, RPL36, RPL36A, RPL22L1, RPL15, RPL34, RPS6, CEBPB, RPS9, KPTN, RPL13, RPS4X, RPL35, SZT2, RPL17, RPS17, RPL26, DDIT3, NPRL2, RPS11, RPS27, RPL7A, RPS28, RPL19, RPS15, RPS16, RPL8, FAU, RPS18, RPL13A, RPL41, RPL7, RPL23, RPL32, RPL10, RPS27L, RPL37, RPL18A, SESN2, RPL22, RPL9, RPS24, RPS12, RPS2, RPS25, RPS3A, RPS21, RPL29, LAMTOR4, RPL23A, RPS5, RPS20, UBA52, RPS14, RPL38, ATP6V1B2, ATF2, ATP6V1C1, FLCN
REACTOME_SENSORY_PERCEPTION	0.2023988005997	0.566574107312541	0.268236164878745	1.15249269092821	134	88	ACTG1, GPC3, MYH9, ACTB, ITPR3, GNB1, EPS8, EPB41L3, ADCY3, LRP1, SPTAN1, SCNN1D, TRPM4, MYO1C, GSN, CAMKMT, MSN, TWF1, TRIOBP, APOE, PLCB2, VAMP2, KCNQ4, CDH23, SDC2, CYP4V2, CAPZA1, RDH11, MYO7A
REACTOME_AQUAPORIN_MEDIATED_TRANSPORT	0.278877887788779	0.65157258477615	0.343397527053029	1.15228231966762	168	27	ADCY4, GNB1, GNB4, ADCY3, ADCY5, AQP1, ADCY6, GNG11, GNG12
REACTOME_SIGNAL_REGULATORY_PROTEIN_FAMILY_INTERACTIONS	0.303201506591337	0.671509774755631	0.481991726701967	1.1489531714512	160	8	SRC, CD47, SKAP2, PTK2B
REACTOME_GLUCAGON_SIGNALING_IN_METABOLIC_REGULATION	0.267111853088481	0.643650242886884	0.3595444249374	1.14887394983985	159	21	ADCY4, GNB1, GNB4, ADCY3, ADCY5, ADCY6, GNG11, GNG12
REACTOME_GLUCAGON_TYPE_LIGAND_RECEPTORS	0.294444444444444	0.668809523809524	0.445659671377279	1.14814908176733	158	10	GNB1, GNB4, GNG11, GNG12, GNB2
REACTOME_CHROMOSOME_MAINTENANCE	0.229166666666667	0.598396748334651	0.280455782908696	1.14748753494614	153	65	CENPT, CHTF18, ACD, CTC1, LIG1, POLD1, RTEL1, CDK2, POT1, ITGB3BP, NPM1, CENPC, RFC2, WRN, POLA2, TERF2IP, POLD2, POLD3, STN1, RFC4
REACTOME_PTK6_REGULATES_RTKS_AND_THEIR_EFFECTORS_AKT1_AND_DOK1	0.303088803088803	0.671509774755631	0.500162147789399	1.14663062328198	156	7	CBL, RPS27A, ARAP1, UBA52
REACTOME_EXTRINSIC_PATHWAY_OF_FIBRIN_CLOT_FORMATION	0.305769230769231	0.671509774755631	0.746045694200351	1.14639078977829	158	2	F3, TFPI
REACTOME_SODIUM_CALCIUM_EXCHANGERS	0.323364485981308	0.687365685441551	0.55445750717665	1.14556006224398	172	5	SLC8B1, SRI, SLC24A3, SLC8A3
REACTOME_TP53_REGULATES_TRANSCRIPTION_OF_GENES_INVOLVED_IN_CYTOCHROME_C_RELEASE	0.289930555555556	0.662341355363985	0.388333051532242	1.1448896314913	166	16	ATM, TP53INP1, BBC3, TP53, BAX, TP63, BNIP3L, PRELID1
REACTOME_VLDLR_INTERNALISATION_AND_DEGRADATION	0.300711743772242	0.671509774755631	0.428302186171515	1.14486173117648	168	11	NR1H3, CLTA, AP2A2
REACTOME_ACTIVATION_OF_TRKA_RECEPTORS	0.300766283524904	0.671509774755631	0.861962920657236	1.14478539067657	156	1	NTRK2
REACTOME_NGF_INDEPENDANT_TRKA_ACTIVATION	0.300766283524904	0.671509774755631	0.861962920657236	1.14478539067657	156	1	NTRK2
REACTOME_OTHER_SEMAPHORIN_INTERACTIONS	0.286219081272085	0.658593833896693	0.400232061658394	1.14464141427568	161	14	SEMA4A, SEMA6A, PTPRC, PLXND1, SEMA5A, ITGA1
REACTOME_RHOJ_GTPASE_CYCLE	0.243710691823899	0.613963899105986	0.298775861839156	1.14399571768887	154	46	CPNE8, FMNL3, STOM, CDC42EP1, SYDE1, TMPO, PIK3R2, RHOJ, SLC1A5, OPHN1, ARHGEF7, GJA1
REACTOME_SYNTHESIS_OF_EPOXY_EET_AND_DIHYDROXYEICOSATRIENOIC_ACIDS_DHET	0.33140655105973	0.698854663375293	0.661393795588365	1.14375371170909	171	3	CYP1B1, EPHX2, CYP2J2
REACTOME_LAGGING_STRAND_SYNTHESIS	0.289930555555556	0.662341355363985	0.387745413014431	1.14315714633853	166	16	LIG1, POLD1, RFC2, POLA2, POLD2, POLD3, RFC4, PCNA
REACTOME_ENOS_ACTIVATION	0.304270462633452	0.671509774755631	0.425837263362762	1.13827293502937	170	11	NOS3, DDAH2, CYGB, ZDHHC21
REACTOME_SIGNALING_BY_FGFR	0.243491577335375	0.613963899105986	0.281741020650724	1.13814861454055	158	62	FGF7, PLCG1, HNRNPH1, PTBP1, HNRNPM, SRC, CBL, SPRED1, FGF2, RPS27A, HNRNPA1, FGFR1, SPRY2, TIA1, NCBP1, SPRED2, BRAF
REACTOME_ACTIVATION_OF_KAINATE_RECEPTORS_UPON_GLUTAMATE_BINDING	0.291666666666667	0.665351506456241	0.38594509522706	1.13784942102384	167	16	GNB1, NCALD, GNB4, PLCB2, GNG11, GNG12, DLG4, GNB2, PLCB3
REACTOME_G_PROTEIN_MEDIATED_EVENTS	0.27479674796748	0.649856061413797	0.304199842599636	1.13733404726227	168	42	ADCY4, ITPR3, CAMKK2, PDE1A, GNAI2, ADCY3, ADCY5, ITPR1, PLCB4, ADCY6, PRKX, PLCB2
REACTOME_STIMULI_SENSING_CHANNELS	0.267175572519084	0.643650242886884	0.29019349757383	1.13513461323988	174	51	TPCN2, MLKL, CLIC2, STOM, TRPM7, TRPV1, SCNN1D, TRPM4, SLC9B2, RPS27A, TTYH3, ASIC3, CLCN6, SRI
REACTOME_SPHINGOLIPID_DE_NOVO_BIOSYNTHESIS	0.285950413223141	0.658593833896693	0.330785808685071	1.13361419355238	172	30	CERS5, SPHK1, PRKD2, CERS2, PLPP3, KDSR, SPNS2, ACER3, SPTLC2, SGMS1, SGPP1, SPTLC1, PRKD3, ORMDL1, ORMDL2
REACTOME_FORMATION_OF_XYLULOSE_5_PHOSPHATE	0.339113680154143	0.703803504962779	0.654978469109764	1.13265963504755	175	3	AKR1A1, CRYL1, DCXR
REACTOME_CONDENSATION_OF_PROPHASE_CHROMOSOMES	0.3	0.671509774755631	0.439450385883643	1.13215215430042	161	10	PHF8, NCAPH2, SMC4
REACTOME_NEURONAL_SYSTEM	0.219839142091153	0.591185182407859	0.238046268275352	1.13201931961229	163	173	GABBR1, STXBP1, PTPRF, ADCY4, FLOT2, CAMK1, NTRK3, CPLX1, GNB1, GLS, SRC, NCALD, CAMKK2, EPB41L3, GNB4, GNAI2, ADCY3, PTPRS, NLGN2, TUBB6, ADCY5, MDM2, ABCC8, AP2A2, PPM1F, ARHGEF7, PTPRD, MYO6, KCNAB1, ADCY6, PRKX, KCNJ8, PLCB2, VAMP2, TUBA1A, DBNL, PPFIBP2, KCNQ4, ARHGEF9, GNG11, SIPA1L1, CREB1, TSPOAP1, EPB41L2
REACTOME_DCC_MEDIATED_ATTRACTIVE_SIGNALING	0.297682709447415	0.671509774755631	0.405133405216864	1.1304768851918	166	13	SRC, FYN, DOCK1, NTN1
REACTOME_RND3_GTPASE_CYCLE	0.282926829268293	0.655763350636422	0.313000635888028	1.13030137968705	173	35	NISCH, FLOT2, WDR6, KCTD13, PTPN13, PIK3R2, UBXN11, ROCK1, PKP4, RBMX, PICALM, TMOD3, EPHA2, PLEKHG5
REACTOME_PLASMA_LIPOPROTEIN_CLEARANCE	0.287648054145516	0.66092544232857	0.344759237978419	1.13007759328571	169	24	NR1H3, CLTA, AP2A2, NPC2, CES3, SCARB1, APOE, LIPA, APOC1, LSR, AP2B1, LDLR
REACTOME_ANTIGEN_ACTIVATES_B_CELL_RECEPTOR_BCR_LEADING_TO_GENERATION_OF_SECOND_MESSENGERS	0.302120141342756	0.671509774755631	0.394767735131892	1.12901374462462	170	14	PLCG2, ITPR3, FYN, ITPR1
REACTOME_OPSINS	0.32183908045977	0.685957289451789	0.849837448378877	1.1286813760065	167	1	OPN4
REACTOME_LISTERIA_MONOCYTOGENES_ENTRY_INTO_HOST_CELLS	0.310996563573883	0.673684654063316	0.374758059346451	1.12827905937073	180	17	SRC, SH3GL1, CBL, CTNND1, RPS27A
REACTOME_NEF_MEDIATES_DOWN_MODULATION_OF_CELL_SURFACE_RECEPTORS_BY_RECRUITING_THEM_TO_CLATHRIN_ADAPTERS	0.289879931389365	0.662341355363985	0.387377666785026	1.12718494274084	168	15	HLA-A, B2M, AP2A2
REACTOME_ACTIVATED_NTRK2_SIGNALS_THROUGH_FYN	0.349532710280374	0.711596682901145	0.545513369785404	1.12708065407651	186	5	SRC, FYN, NTRK2
REACTOME_NOSTRIN_MEDIATED_ENOS_TRAFFICKING	0.355140186915888	0.714775819235774	0.544674720765375	1.12534792828391	189	5	NOS3, NOSTRIN, CAV1
REACTOME_DNA_REPLICATION_INITIATION	0.357009345794393	0.71661272464015	0.544087551806011	1.1241347833613	190	5	POLE, POLA2
REACTOME_RECRUITMENT_OF_NUMA_TO_MITOTIC_CENTROSOMES	0.261398176291793	0.641393673308567	0.272131083283172	1.1227624627067	171	70	HAUS5, OFD1, DYNLL1, SFI1, CNTRL, CSNK1E, CEP290, HAUS4, TUBB6, CEP164, CEP192, TUBGCP2, CEP131, CEP78, TUBG2, MZT2A, ALMS1, TUBA1A, CENPJ
REACTOME_TP53_REGULATES_TRANSCRIPTION_OF_GENES_INVOLVED_IN_G1_CELL_CYCLE_ARREST	0.333333333333333	0.700132100396301	0.470607447737954	1.12181576909393	176	8	CDK2, TP53, CDKN1A, CDKN1B
REACTOME_KERATAN_SULFATE_DEGRADATION	0.335216572504708	0.70069869555463	0.469892737697582	1.12011207103842	177	8	LUM, PRELP, FMOD, GLB1
REACTOME_SIGNAL_AMPLIFICATION	0.309810671256454	0.673684654063316	0.367621406077894	1.11972701176941	179	18	GNB1, SRC, GNB4, GNAI2, MAPK14, GNG11, GNG12, GNAI3, GNB2
REACTOME_NGF_STIMULATED_TRANSCRIPTION	0.313432835820896	0.676198383928391	0.327971387803567	1.11946385622386	188	29	ID4, NAB1, JUND, FOSB, FOS, JUNB, EGR1, F3, NAB2, CREB1, EGR3, RRAD, TCF12, ID3, TRIB1
REACTOME_SYNTHESIS_OF_VERY_LONG_CHAIN_FATTY_ACYL_COAS	0.300171526586621	0.671509774755631	0.38427499109969	1.11815682983039	174	15	SLC27A3, ACSL5, ELOVL5, HACD3, HACD2, ACSL6
REACTOME_PHOSPHOLIPID_METABOLISM	0.244813278008299	0.613963899105986	0.238439482919111	1.1177122199641	176	156	PLA2G4B, ABHD3, LPCAT1, LPIN3, OSBPL10, ETNK1, ACP6, PLA2R1, PIK3C2A, PLEKHA2, CEPT1, CHKB, LPCAT4, PLD1, PTPN13, SLC44A5, PLA2G6, PIK3R2, PIP4K2A, MBOAT7, PLEKHA8, PGS1, ARF3, PI4K2B, CPNE1, PITPNB, PLA2G2A, AGK, INPP5E, LPCAT2, MIGA2, PLEKHA5, PLD2, PTEN, CHKA, PIP5K1B, PIK3R4, CSNK2B, LPIN2, PLD3, INPP5D, CDIPT, SLC44A1, SBF2, DDHD1, PLA2G4C, OSBPL8, GPAT2, RAB14, PHOSPHO1, OCRL, PLA1A
REACTOME_GP1B_IX_V_ACTIVATION_SIGNALLING	0.337099811676083	0.700755531570426	0.468297891432333	1.11631033840916	178	8	FLNA, SRC, COL1A1, YWHAZ, COL1A2, VWF
REACTOME_THE_ACTIVATION_OF_ARYLSULFATASES	0.358490566037736	0.71661272464015	0.510249164588683	1.11447890539441	189	6	ARSG, SUMF1, STS, ARSA
REACTOME_HDR_THROUGH_HOMOLOGOUS_RECOMBINATION_HRR	0.289877300613497	0.662341355363985	0.284764431504317	1.11315543123993	188	50	XRCC3, POLE, ATM, POLD1, SPIDR, RTEL1, RPS27A, RFC2, EME2, RAD51D, MRE11, WRN, POLD2, POLD3, RFC4, RAD9A
REACTOME_METAL_ION_SLC_TRANSPORTERS	0.323024054982818	0.687365685441551	0.36933961427956	1.11196581953278	187	17	CP, SLC30A7, SLC39A10, SLC11A1, SLC39A14
REACTOME_BETA_DEFENSINS	0.350574712643678	0.711895010349232	0.836833318689043	1.11141040375165	182	1	TLR2
REACTOME_ONCOGENE_INDUCED_SENESCENCE	0.312396694214876	0.675796930342385	0.323905809810599	1.11003620389578	188	30	MOV10, ETS2, MDM2, TP53, RPS27A, ETS1, MDM4, ERF
REACTOME_BASE_EXCISION_REPAIR	0.30655737704918	0.671700604924597	0.299280652554781	1.10797702043038	186	40	ACD, POLE, LIG1, POLD1, NEIL1, PNKP, POT1, MUTYH, RFC2, TERF2IP, POLD2, POLD3, PARP2, RFC4, XRCC1
REACTOME_CA2_PATHWAY	0.310789049919485	0.673684654063316	0.292487073306288	1.10785679735664	192	45	MOV10, ITPR3, GNB1, TCF7L2, GNB4, FZD6, ITPR1, MYC, PLCB2, WNT11, FZD3, GNG11, GNG12, TNRC6C, GNB2, PLCB3, GNAO1, TNRC6A
REACTOME_ACTIVATION_OF_RAC1_DOWNSTREAM_OF_NMDARS	0.349420849420849	0.711596682901145	0.483065875136027	1.10743711402708	180	7	CAMK1, CAMKK2, ARHGEF7
REACTOME_SIGNALING_BY_NOTCH1	0.276853252647504	0.649856061413797	0.268747390691446	1.10640895755108	182	69	HDAC7, KAT2A, JAG1, RBPJ, NUMB, TLE3, DLL1, HDAC6, MAML2, RPS27A, MYC, HIF1A, HDAC5, TLE4, NOTCH1, MAML1, ARRB2, TLE1, DTX2, HDAC1, JAG2, ARRB1
REACTOME_MET_PROMOTES_CELL_MOTILITY	0.310064935064935	0.673684654063316	0.30964242818062	1.10490942707891	190	33	LAMA3, LAMA5, ITGA3, SRC, COL27A1, COL1A1, COL5A1, RAP1B, LAMA4, COL1A2, COL5A2, COL3A1, FN1
REACTOME_CYTOSOLIC_IRON_SULFUR_CLUSTER_ASSEMBLY	0.335185185185185	0.70069869555463	0.428670814782728	1.10438084032195	180	10	NDOR1, POLD1, RTEL1
REACTOME_RHO_GTPASES_ACTIVATE_RHOTEKIN_AND_RHOPHILINS	0.369811320754717	0.727188552188552	0.505247367819655	1.10355405264596	195	6	RHOC, TAX1BP3, RHOA, RTKN
REACTOME_INTRAFLAGELLAR_TRANSPORT	0.313114754098361	0.676198383928391	0.301978291961124	1.09867464830621	190	37	DYNLL1, IFT122, TUBB6, IFT172, DYNC2H1, IFT43, IFT140, IFT20, TUBA1A, IFT88, WDR19, IFT80
REACTOME_MISMATCH_REPAIR	0.332155477031802	0.6995062363981	0.384129797669826	1.09858983572762	187	14	LIG1, POLD1, MSH2, POLD2, POLD3, PCNA, RPA2, RPA3, MSH6
REACTOME_PROTEIN_PROTEIN_INTERACTIONS_AT_SYNAPSES	0.314754098360656	0.677211118259056	0.301939993072932	1.09853530710641	191	37	STXBP1, PTPRF, FLOT2, NTRK3, EPB41L3, PTPRS, NLGN2, PTPRD, DBNL, PPFIBP2, SIPA1L1, EPB41L2
REACTOME_WNT5A_DEPENDENT_INTERNALIZATION_OF_FZD2_FZD5_AND_ROR2	0.344444444444444	0.705756013745704	0.426268586889596	1.0981920017825	185	10	CLTA, AP2A2, AP2B1
REACTOME_SIGNALING_BY_HIPPO	0.327086882453152	0.691579977527275	0.355820660702275	1.09804860255908	191	19	WWTR1, TJP2, STK3, STK4, LATS2
REACTOME_REGULATION_OF_SIGNALING_BY_NODAL	0.383877159309021	0.737155414615149	0.576993815291743	1.09753951791767	199	4	ACVR2B, ACVR2A, ACVR1B
REACTOME_RHO_GTPASES_ACTIVATE_FORMINS	0.278761061946903	0.65157258477615	0.253945728632986	1.09740635301365	188	89	CENPT, ACTG1, ACTB, SRGAP2, DYNLL1, FMNL3, FMNL2, RHOC, SRC, PPP2R1B, NUP85, TUBB6, KNTC1, ITGB3BP, CENPC, FMNL1, RCC2, DAAM1, XPO1, SCAI, NUP107, TUBA1A
REACTOME_NERVOUS_SYSTEM_DEVELOPMENT	0.224611708482676	0.597211733256614	0.208933198888549	1.09638140227959	187	422	ACTG1, ROBO3, FES, MYH9, PLCG1, ACTB, SRGAP2, VAV2, PSMB8, MYL9, ARPC1B, MMP2, RRAS, SDCBP, PTPRA, RPL3, DPYSL2, ITGA5, RHOC, LIMK2, NAB1, SRC, CACNA1H, ARPC5, CACNA1C, SEMA4A, NUMB, CNTNAP1, WWTR1, CAP1, TUBB6, SPTAN1, FYN, PLXNB1, MYH11, DOCK1, PLXNA3, MAPK11, NRP2, CLTA, SEMA6A, PIK3R2, MYL6, COL6A1, PSMB9, ARPC1A, AP2A2, COL6A2, VASP, NFASC, DNM1, SLIT3, RPS27A, COL6A3, COL5A1, CXCR4, ARHGEF7, FGFR1, RPL35A, ITGA9, ROCK1, RPL10A, RPS8, RPL24, RPL28, RPS19, NTN1, RPL12, RPL31, MSN, UPF3A, ABL2, SCN5A, NAB2, SIAH2, RPL18, EIF4A3, CXCL12, RPL11, COL4A5, PSME2, SRGAP3, RPL36, PTPRC, RPL36A, RPL22L1, ERBB2, MAPK14, PSME1, TUBA1A, RPL15, RPL34, RPS6, RPS9, MYH10, RPL13, RPS4X, RPL35, NCBP1, CSNK2B, CFL1, CASC3, ZSWIM8, CREB1, PSMD5, MYO9B, RPL17, EPHA2, PSMD10, PLXND1, RPS17, PABPC1, MYO10, COL4A2, RPL26, MYL12B, COL5A2, SDC2, UNC5B, PRNP, LDB1, FARP2, COL3A1, RASA1, EFNA1, ITGA10, PMP22, RPS11, RPS27, ABLIM2, RPL7A, RPS28, AGRN, RPL19, HRAS, EFNB1, ABL1, RHOA, RPS15, DLG4, EPHB4, RPS16, RGMB, RPL8, FAU, RPS18, RPL13A, NRAS
REACTOME_TYPE_I_HEMIDESMOSOME_ASSEMBLY	0.363128491620112	0.720617398483314	0.438850263390426	1.09542850131017	194	9	LAMA3, ITGB4
REACTOME_BINDING_OF_TCF_LEF_CTNNB1_TO_TARGET_GENE_PROMOTERS	0.375700934579439	0.729865253745353	0.529599200126016	1.09420051998219	200	5	TCF7L2, MYC, CTNNB1
REACTOME_PROCESSIVE_SYNTHESIS_ON_THE_LAGGING_STRAND	0.342245989304813	0.7052300868601	0.39114483575833	1.09144343540429	191	13	LIG1, POLD1, POLA2, POLD2, POLD3, PCNA, RPA2, RPA3
REACTOME_P75NTR_REGULATES_AXONOGENESIS	0.385796545105566	0.737280305625629	0.573571881460636	1.09103042283242	200	4	NGFR, ARHGDIA, RHOA
REACTOME_SYNTHESIS_OF_GDP_MANNOSE	0.385796545105566	0.737280305625629	0.573523231232229	1.09093788189555	200	4	MPI, GMPPB, PMM1, GMPPA
REACTOME_HISTIDINE_CATABOLISM	0.402697495183044	0.743657395285761	0.630638128393099	1.0905676843449	208	3	HNMT, CARNS1
REACTOME_DEVELOPMENTAL_BIOLOGY	0.212359550561798	0.581156085014214	0.201779332071677	1.0890239804396	188	621	ACTG1, CEBPA, ROBO3, FES, MYH9, PLCG1, ACTB, KAT2A, MED17, SRGAP2, PML, VAV2, NR2F2, PSMB8, EBF1, MYL9, ARPC1B, MMP2, RRAS, SDCBP, PTPRA, RPL3, DPYSL2, ITGA5, RHOC, LIMK2, NAB1, SRC, CACNA1H, ARPC5, CACNA1C, SEMA4A, RBPJ, NR6A1, NUMB, FOXP1, CNTNAP1, JUN, WWTR1, TGFB1, CAP1, TUBB6, SPTAN1, FYN, PLXNB1, MYH11, DOCK1, PLXNA3, MAPK11, NRP2, CLTA, CDK2, SEMA6A, PIK3R2, MYL6, COL6A1, PSMB9, TCF4, FLI1, ARPC1A, FGF2, CEBPD, AP2A2, LGI4, CNOT9, COL6A2, VASP, PPARG, NFASC, DNM1, SLIT3, MAML2, RPS27A, COL6A3, COL5A1, CXCR4, ARHGEF7, FGFR1, RPL35A, MEIS1, ITGA9, MYOG, PAGR1, PERP, ROCK1, RPL10A, RPS8, MYC, HOXA3, RPL24, MED28, RPL28, BOC, CDKN1A, PKP4, RPS19, NTN1, RPL12, RPL31, MSN, UPF3A, ABL2, SCN5A, NAB2, SIAH2, PLIN1, CDH15, RPL18, HELZ2, PCGF2, EIF4A3, CXCL12, ZNF638, RPL11, NOTCH1, COL4A5, PSME2, SRGAP3, RPL36, PTPRC, RPL36A, RPL22L1, ERBB2, CCND3, MAPK14, PSME1, TUBA1A, RPL15, HOXB3, RPL34, RPS6, CEBPB, RPS9, MYH10, MAML1, RPL13, SMARCD3, RPS4X, RPL35, NCBP1, CSNK2B, PTGDS, CFL1, CASC3, ZSWIM8, CREB1, PSMD5, AKT3, CSF3R, ACVR2B, MYO9B, PKP1, MED12, RPL17, HOXA4, EPHA2, ZNF335, PSMD10, PLXND1, KDM6A, RPS17, FABP4, PABPC1, MYO10, COL4A2, MED23, RPL26, MYL12B, COL5A2, SDC2, UNC5B, PRNP, RARG, LDB1, FARP2, COL3A1, RASA1, CTNNA1, EFNA1, ITGA10, PMP22, PPL, RPS11, RPS27, KMT2A, EPAS1, TCF12, ABLIM2, RUNX1, POLR2H, RPL7A, PKNOX1, RPS28, AGRN, RPL19, TSC22D1, HRAS, EFNB1, ABL1, RHOA, RPS15, DLG4, EPHB4, RPS16, EZH2, RGMB, RPL8, FAU, RPS18, KLF4, RPL13A, NRAS
REACTOME_SYNTHESIS_OF_16_20_HYDROXYEICOSATETRAENOIC_ACIDS_HETE	0.398076923076923	0.74260100335441	0.708353301464921	1.08847180142072	206	2	CYP1B1, CYP2U1
REACTOME_DNA_METHYLATION	0.398076923076923	0.74260100335441	0.708332752707324	1.08844022573222	206	2	DNMT1, DNMT3A
REACTOME_SUMOYLATION_OF_RNA_BINDING_PROTEINS	0.337042925278219	0.700755531570426	0.286102310364608	1.08842476274132	211	44	HNRNPC, AAAS, NUP85, NUP210, CBX4, NOP58, NUP155, PCGF2, NUP107, UBE2I, NUP35, NUP160, RING1, PHC3, NUP50, SUMO2
REACTOME_INTERLEUKIN_37_SIGNALING	0.339622641509434	0.703803504962779	0.373791539659076	1.08765226122713	197	15	IL18BP, PTPN18, PTPN13, PTPN12
REACTOME_CARGO_TRAFFICKING_TO_THE_PERICILIARY_MEMBRANE	0.344370860927152	0.705756013745704	0.29807956063444	1.08730122537565	207	38	ASAP1, NPHP3, PKD2, BBS1, INPP5E, CCT3, BBIP1, ARF4, BBS7, SMO, ARL3, RAB11FIP3, CCT8, CCT4
REACTOME_ANCHORING_OF_THE_BASAL_BODY_TO_THE_PLASMA_MEMBRANE	0.299546142208775	0.671509774755631	0.260797846699546	1.08706138897845	197	74	HAUS5, OFD1, TTBK2, DYNLL1, SFI1, CNTRL, CSNK1E, CEP290, HAUS4, CEP164, CEP192, CEP131, MKS1, CEP78, CEP83, ALMS1, TUBA1A, TCTN3, CENPJ
REACTOME_EFFECTS_OF_PIP2_HYDROLYSIS	0.333901192504259	0.700399599052469	0.349911836331715	1.07981420231359	195	19	ITPR3, DGKH, DGKE, ITPR1, DGKQ, RASGRP2, PRKCH
REACTOME_SIGNALING_BY_NOTCH2	0.361525704809287	0.720617398483314	0.316287963797013	1.07958485647371	217	29	MDK, JAG1, RBPJ, NOTCH2, DLL1, MAML2, RPS27A, MAML1, CREB1, JAG2
REACTOME_METHIONINE_SALVAGE_PATHWAY	0.40188679245283	0.743657395285761	0.494086939772054	1.07917760580895	212	6	MTAP, MRI1, ENOPH1, ADI1, GOT1
REACTOME_SIGNALING_BY_FGFR2	0.335365853658537	0.70069869555463	0.273388635985559	1.07862260766846	219	54	FGF7, PLCG1, HNRNPH1, PTBP1, HNRNPM, SRC, CBL, FGF2, RPS27A, HNRNPA1, SPRY2, TIA1, NCBP1, BRAF
REACTOME_ATF4_ACTIVATES_GENES_IN_RESPONSE_TO_ENDOPLASMIC_RETICULUM_STRESS	0.341098169717138	0.7052300868601	0.32613380532923	1.07846997797822	204	25	NFYA, EXOSC2, ATF3, CEBPB, CCL2, EXOSC9, DDIT3, EXOSC8, EXOSC5
REACTOME_TRAFFICKING_OF_MYRISTOYLATED_PROTEINS_TO_THE_CILIUM	0.427745664739884	0.769351313456225	0.62154161177593	1.07483700360082	221	3	NPHP3, ARL3
REACTOME_RECOGNITION_OF_DNA_DAMAGE_BY_PCNA_CONTAINING_REPLICATION_COMPLEX	0.342762063227953	0.7052300868601	0.324878210623949	1.07431793617198	205	25	POLE, POLD1, RPS27A, RFC2, WDR48, DDB1, POLD2, POLD3, RFC4, PCNA, RBX1, UBE2B, RPA2, RPA3, UBA52
REACTOME_TRANSPORT_OF_VITAMINS_NUCLEOSIDES_AND_RELATED_MOLECULES	0.347107438016529	0.709384095689307	0.322245660705969	1.0741141590137	209	26	SLC25A6, APOD, SLCO2A1, SLC25A5, SLC33A1, SLC35D1, SLC35B3, SLCO4A1, SLC16A2, SLCO2B1, SLC29A1
REACTOME_NEF_MEDIATED_DOWNREGULATION_OF_MHC_CLASS_I_COMPLEX_CELL_SURFACE_EXPRESSION	0.382297551789077	0.73549580841239	0.450414773580865	1.07368125613949	202	8	HLA-A, B2M
REACTOME_AURKA_ACTIVATION_BY_TPX2	0.358255451713396	0.71661272464015	0.270274414919166	1.07359103845945	229	57	HAUS5, OFD1, DYNLL1, SFI1, CNTRL, CSNK1E, CEP290, HAUS4, CEP164, CEP192, CEP131, CEP78
REACTOME_RECRUITMENT_OF_MITOTIC_CENTROSOME_PROTEINS_AND_COMPLEXES	0.328290468986384	0.693202982321847	0.261604249048255	1.07322989418776	216	67	HAUS5, OFD1, DYNLL1, SFI1, CNTRL, CSNK1E, CEP290, HAUS4, CEP164, CEP192, TUBGCP2, CEP131, CEP78, TUBG2, MZT2A, ALMS1, TUBA1A, CENPJ
REACTOME_EXPORT_OF_VIRAL_RIBONUCLEOPROTEINS_FROM_NUCLEUS	0.362295081967213	0.720617398483314	0.30407271380671	1.07276067212515	220	32	AAAS, NUP85, HSPA1A, NUP210, NUP155, XPO1, NUP107, NUP35, NUP160
REACTOME_NUCLEOTIDE_BINDING_DOMAIN_LEUCINE_RICH_REPEAT_CONTAINING_RECEPTOR_NLR_SIGNALING_PATHWAYS	0.364951768488746	0.721732974996401	0.282770036742979	1.06878599892481	226	43	CASP4, NOD1, CASP2, NFKB2, MAPK11, BCL2L1, TNFAIP3, NLRP1, RPS27A, BIRC3
REACTOME_TFAP2A_ACTS_AS_A_TRANSCRIPTIONAL_REPRESSOR_DURING_RETINOIC_ACID_INDUCED_CELL_DIFFERENTIATION	0.435452793834297	0.7734375	0.617868997602352	1.06848592180852	225	3	NPM1, HSPD1, NOP2
REACTOME_FGFR2C_LIGAND_BINDING_AND_ACTIVATION	0.4373795761079	0.774424861928241	0.616623137064195	1.06633144496841	226	3	FGF2, FGF6, FGF1
REACTOME_DOPAMINE_NEUROTRANSMITTER_RELEASE_CYCLE	0.374331550802139	0.729865253745353	0.381866246815636	1.06555262958121	209	13	STXBP1, CPLX1, VAMP2, TSPOAP1, LIN7C, APBA1
REACTOME_PYROPTOSIS	0.357751277683135	0.71661272464015	0.345230240746595	1.06536698196432	209	19	CASP4, GSDMD, CHMP4A, TP53, IRF1, BAX, TP63
REACTOME_SEMA3A_PAK_DEPENDENT_AXON_REPULSION	0.367491166077739	0.725852116849198	0.371893287964536	1.06359409921209	207	14	FES, FYN, PLXNA3, CFL1
