pathway	pval	padj	ES	NES	nMoreExtreme	size	leadingEdge
REACTOME_SYNTHESIS_OF_BILE_ACIDS_AND_BILE_SALTS_VIA_27_HYDROXYCHOLESTEROL	0.264642082429501	0.629440792841493	-0.446863846021793	-1.17859453689483	121	9	RXRA, CYP27A1, AKR1C2, AKR1C1, NCOA2
REACTOME_SIGNALING_BY_ERBB4	0.210227272727273	0.566623207301173	-0.289962273397681	-1.18270122073679	73	43	TAB2, WWP1, PSEN2, NEDD4, APH1A, NRG4, SOS1, PIK3CA, NCOR1, PSENEN, GFAP, PIK3R1
REACTOME_PI3K_AKT_SIGNALING_IN_CANCER	0.162983425414365	0.505257466456083	-0.265605777769595	-1.18276349291913	58	65	FOXO4, MAPKAP1, CHUK, RAC1, MTOR, PTPN11, PIK3CB, GSK3B, STRN, MET, GSK3A, BAD, RPS6KB2
REACTOME_AMINO_ACID_CONJUGATION	0.220472440944882	0.578467295548453	-0.88489587909674	-1.1836756977049	111	1	ACSM5
REACTOME_SUMO_IS_PROTEOLYTICALLY_PROCESSED	0.293478260869565	0.662838714752035	-0.517526618372788	-1.18557025042098	134	6	SENP2, SUMO1
REACTOME_TRANSPORT_OF_SMALL_MOLECULES	0.0337837837837838	0.191843629343629	-0.203900872077443	-1.18572795032039	4	435	PSMB5, AFG3L2, PSMD7, PRKAR2A, ERLEC1, WWP1, PSMD14, PSMD6, STOML2, PSMC1, SLC25A26, WNK1, NIPA2, PSMC2, MAIP1, ABCB10, MMGT1, PSMD12, ATP2B1, RAF1, IREB2, ATP11A, CUL1, PSMA1, ADCY9, YME1L1, PSMB6, PSME4, NR1H2, ABCD1, SEL1L, SLC35B2, PSMA4, SLC39A3, ABCC1, PSMD2, PSMD1, PSMA2, PSMA6, PSMD3, CLCN4, SLC9A6, RYR1, PSMD11, ADD1, SLC30A6, SEM1, PSMA3, CYB5R4, VCP, ATP6V1E2, KCNJ11, GLRX3, GNG5, TRDN, HDLBP, MRS2, PSME3, EIF2S2, SLC17A5, SLC35C1, PSMC6, VDAC1, PSMA7, PEX3, PSMD8, PSMC4, ABCF1, TFRC, PSMB2, PHB2, ATP9A, ATP2A2, SLC38A2, ABCD3, SAR1B, AKAP1, ACO1, SLC25A4, ANO5, PSMA5, ATP2C1, PSMF1, PSMB7, ASPH, PCSK6, CAMK2G, ANO8, CLCN3, MICU2, DMTN, CALM1, SLC9A7, ANO6, FURIN, PSMC3, ATP6V0C, SLC29A2, FTH1, SLC20A2, CYB5R1, RAB11FIP2, WNK2, PRKACA, SLC40A1, VLDLR, PSMD13, SLC16A3, SLC30A5, ATP2A1, ATP6V0A2, MB, ABCA3
REACTOME_HATS_ACETYLATE_HISTONES	0.165217391304348	0.506635177687809	-0.260010332649595	-1.18758524377741	56	77	KANSL3, MSL3, BRPF3, KANSL2, KAT2B, TADA3, ELP3, TADA2B, KAT14, TAF6L, PHF20, EP300, ENY2, ELP6, ELP5, SAP130, MORF4L1, EPC1, CREBBP, SGF29, CLOCK, KAT7, TAF5L, ZZZ3, YEATS4, HCFC1, KAT6B, ATXN7L3, WDR5, BRPF1, NCOA2
REACTOME_ACYL_CHAIN_REMODELING_OF_DAG_AND_TAG	0.26984126984127	0.631759225429302	-0.607312357180524	-1.18861914590331	118	4	DGAT1, MGLL, DGAT2, PNPLA2
REACTOME_TRAF6_MEDIATED_INDUCTION_OF_TAK1_COMPLEX_WITHIN_TLR4_COMPLEX	0.24047619047619	0.600006659341391	-0.399275306752653	-1.19181912278221	100	14	TAB2, TAB3
REACTOME_SMAC_XIAP_REGULATED_APOPTOTIC_RESPONSE	0.264840182648402	0.629440792841493	-0.500045837429107	-1.19577439219546	115	7	XIAP, CYCS, CASP3, APAF1, DIABLO
REACTOME_TBC_RABGAPS	0.194736842105263	0.538489702517162	-0.304745419307284	-1.19772341198933	73	37	RABEP1, RAB4A, RAB7A, RAB5A, RABGAP1, OPTN, TBC1D25, TBC1D14, RAB6A, TSC1, TBC1D20, TBC1D7, RAB33B, TBC1D13, GABARAPL2, TBC1D15, ARF6
REACTOME_PROPIONYL_COA_CATABOLISM	0.258503401360544	0.61994028380583	-0.613543082700658	-1.20081379262593	113	4	MMAA, PCCB, PCCA
REACTOME_LYSOSOME_VESICLE_BIOGENESIS	0.179487179487179	0.522227430572164	-0.332349764360934	-1.20385156788782	69	28	AP4E1, AP1G1, VAMP7, DNM2, DNASE2, M6PR, HSPA8, AP1S2, CLTB, GNS
REACTOME_BETA_OXIDATION_OF_VERY_LONG_CHAIN_FATTY_ACIDS	0.243792325056433	0.600976429208882	-0.486652104776411	-1.20572837017307	107	8	ABCD1, HSD17B4, ACOX1
REACTOME_LOSS_OF_MECP2_BINDING_ABILITY_TO_THE_NCOR_SMRT_COMPLEX	0.257990867579909	0.619645739353557	-0.504427697387323	-1.20625286343954	112	7	HDAC3, NCOR1, GPS2, NCOR2, TBL1X
REACTOME_TRANSCRIPTIONAL_REGULATION_BY_E2F6	0.174358974358974	0.514082831573361	-0.333952324053496	-1.20965642832524	67	28	E2F6, TFDP2, PCGF6, TFDP1, BMI1, EPC1, YAF2, APAF1, CBX3
REACTOME_TRANSCRIPTIONAL_ACTIVITY_OF_SMAD2_SMAD3_SMAD4_HETEROTRIMER	0.174285714285714	0.514082831573361	-0.295787104049414	-1.20997565988332	60	44	USP9X, TFDP2, PPM1A, UBE2D1, TFDP1, PARP1, MAPK1, E2F4, CCNK, NCOR1, SMAD4, RNF111
REACTOME_BIOTIN_TRANSPORT_AND_METABOLISM	0.200455580865604	0.54952478202812	-0.432521606281879	-1.21068005165614	87	11	PC, MCCC1, MCCC2, ACACB, HLCS, PCCB, PCCA
REACTOME_SIGNALING_BY_INTERLEUKINS	0.0401785714285714	0.220668303619088	-0.216019716631124	-1.21233875595222	8	293	NKIRAS2, TAB2, PSMB5, PSMD7, PSMD14, CNTF, PSMD6, PSMC1, MAP2K4, CHUK, PSMC2, PSMD12, MAPK8, TAB3, IFNLR1, CUL1, PSMA1, MAPKAPK3, PSMB6, PTPN11, PIK3CB, PSME4, PSMA4, PSMD2, RPS6KA3, RAPGEF1, PSMD1, PSMA2, PELI3, DUSP3, PSMA6, PSMD3, JAK1, NKIRAS1, PSMD11, SEM1, NFKBIB, MAP2K7, PSMA3, ZEB1, MAPK9, BTRC, TBK1, PSME3, SOS2, PSMC6, ELK1, IRAK1, VAMP7, ATF1, PSMA7, PSMD8, PSMC4, FBXW11, PSMB2, MAPK1, CRKL, CANX, PSMA5, PSMF1, PSMB7, ITGB1, MEF2A, PTPN20, PAK2, SOS1, RPS6KA2, UBE2V1, PIK3CA, HSPA9
REACTOME_ACTIVATION_OF_CASPASES_THROUGH_APOPTOSOME_MEDIATED_CLEAVAGE	0.271739130434783	0.634457000574603	-0.530653283326835	-1.21564132870811	124	6	XIAP, CYCS, CASP3, APAF1
REACTOME_LOSS_OF_FUNCTION_OF_MECP2_IN_RETT_SYNDROME	0.186788154897494	0.52386766672481	-0.435705785596798	-1.21959295293432	81	11	HDAC3, CALM1, NCOR1, PRKACA, GPS2
REACTOME_REDUCTION_OF_CYTOSOLIC_CA_LEVELS	0.230248306997743	0.590485827941338	-0.493786473565498	-1.22340446931627	101	8	ATP2B1, ATP2A2, CALM1, ATP2A1
REACTOME_AMINO_ACIDS_REGULATE_MTORC1	0.166666666666667	0.507662835249042	-0.291677749507997	-1.22761627448312	60	47	RRAGD, MTOR, ATP6V1E2, SEC13, MLST8, RPTOR, RRAGC, ATP6V0C, MIOS, BMT2, FNIP2, DEPDC5, ATP6V0E1, ATP6V1E1, ATP6V0E2, LAMTOR3, ATP6V0B, ATP6V1D, FNIP1, LAMTOR1, ATP6V1F
REACTOME_PEROXISOMAL_LIPID_METABOLISM	0.178147268408551	0.519732397742378	-0.361989761706443	-1.22766384140022	74	21	ACBD5, ABCD1, NUDT19, HSD17B4, ACOX1, SCP2, ACOX3, PHYH
REACTOME_SIGNALING_BY_MEMBRANE_TETHERED_FUSIONS_OF_PDGFRA_OR_PDGFRB	0.217687074829932	0.575050280512332	-0.627540815155009	-1.22820986418244	95	4	GOLGA4
REACTOME_ARACHIDONATE_PRODUCTION_FROM_DAG	0.23956043956044	0.600006659341391	-0.581234297861769	-1.2332416127793	108	5	DAGLA, ABHD6, MGLL
REACTOME_FORMATION_OF_RNA_POL_II_ELONGATION_COMPLEX	0.146814404432133	0.485311648746552	-0.287778667734301	-1.23334192039965	52	54	ELOA, POLR2B, CTR9, POLR2J, TCEA1, RTF1, POLR2D, ELOC, LEO1, CCNK, SUPT4H1, CDK7, CTDP1, CCNH, ERCC3, GTF2H1, IWS1, SUPT6H, WDR61, MLLT1, POLR2C
REACTOME_HIV_ELONGATION_ARREST_AND_RECOVERY	0.169270833333333	0.50781379059702	-0.332126834129678	-1.23484774417415	64	31	ELOA, POLR2B, POLR2J, TCEA1, POLR2D, ELOC, CCNK, SUPT4H1
REACTOME_DISASSEMBLY_OF_THE_DESTRUCTION_COMPLEX_AND_RECRUITMENT_OF_AXIN_TO_THE_MEMBRANE	0.1825	0.522227430572164	-0.347810397410931	-1.23593865075154	72	25	APC, GSK3B, AMER1, PPP2R5E, PPP2R5C, PPP2CB, PPP2R5B, AXIN1, LRP6, DVL1
REACTOME_TRANSPORT_TO_THE_GOLGI_AND_SUBSEQUENT_MODIFICATION	0.0846905537459283	0.352507802240906	-0.239454510452801	-1.23792451865277	25	147	SEC23A, CNIH1, COG2, YKT6, DYNC1LI1, PPP6C, DCTN4, MIA3, TRAPPC10, ANKRD28, SEC13, TMED2, MAN2A2, LMAN1, CHST10, CAPZB, MCFD2, B4GALT2, PPP6R1, SEC22C, GOLGA2, DYNC1H1, GOSR1, USO1, CAPZA2, RAB1B, MAN1A2, SAR1B, ANK3, TUBA4A, SEC24C, F8, PPP6R3, ANK2, MGAT4B, DYNLL2, B4GALT5, COPB2
REACTOME_TICAM1_RIP1_MEDIATED_IKK_COMPLEX_RECRUITMENT	0.206496519721578	0.562207990337857	-0.38924873742913	-1.2393823213345	88	17	CHUK, UBE2D2, UBE2D1, BIRC2, UBE2V1, TICAM1, IKBKG, UBE2N, UBB, UBE2D3
REACTOME_INTRINSIC_PATHWAY_FOR_APOPTOSIS	0.14804469273743	0.487352094104584	-0.298976316847782	-1.23965188572369	52	46	YWHAG, MAPK8, TFDP2, PPP3CC, UACA, BAD, TFDP1, MAPK1, XIAP, AVEN, CYCS, BCL2, DYNLL2, CASP3, APIP, C1QBP, APAF1, PPP3R1, TP53BP2, YWHAE, AKT2, BAK1, BMF, YWHAB, PPP1R13B, DIABLO
REACTOME_ER_TO_GOLGI_ANTEROGRADE_TRANSPORT	0.0888888888888889	0.361466325660699	-0.244589134819035	-1.24156832294266	27	128	SEC23A, CNIH1, COG2, YKT6, DYNC1LI1, PPP6C, DCTN4, MIA3, TRAPPC10, ANKRD28, SEC13, TMED2, LMAN1, CAPZB, MCFD2, PPP6R1, SEC22C, GOLGA2, DYNC1H1, GOSR1, USO1, CAPZA2, RAB1B, SAR1B, ANK3, TUBA4A, SEC24C, F8, PPP6R3, ANK2, DYNLL2, COPB2, DCTN5, TBC1D20, NSF, SEC23IP, ACTR1A, COPG1, STX17, DCTN2
REACTOME_BMAL1_CLOCK_NPAS2_ACTIVATES_CIRCADIAN_GENE_EXPRESSION	0.168341708542714	0.50781379059702	-0.35781021748752	-1.24659970128675	66	24	PPARA, MED1, RXRA, NPAS2, CARM1, CREBBP, CHD9, CLOCK, TGS1
REACTOME_APOPTOTIC_FACTOR_MEDIATED_RESPONSE	0.190255220417633	0.530711930638662	-0.392355298444404	-1.2492737260643	81	17	UACA, MAPK1, XIAP, AVEN, CYCS, CASP3, APIP, C1QBP, APAF1, BAK1, DIABLO
REACTOME_SYNTHESIS_OF_DIPHTHAMIDE_EEF2	0.216704288939052	0.575050280512332	-0.505178241605212	-1.25162869310387	95	8	DNAJC24, DPH3
REACTOME_INACTIVATION_OF_CSF3_G_CSF_SIGNALING	0.159144893111639	0.498142397693246	-0.369210807079854	-1.25215352934127	66	21	CUL5, UBE2D2, JAK1, UBE2D1, ELOC, RNF7
REACTOME_RESPONSE_OF_MTB_TO_PHAGOCYTOSIS	0.164285714285714	0.506635177687809	-0.376392688299782	-1.25363085257156	68	20	KPNA1, KPNB1, GSK3A, RAB7A, RAB5A, MAPK1, PGK1
REACTOME_PI3K_EVENTS_IN_ERBB4_SIGNALING	0.230434782608696	0.590485827941338	-0.548538692533386	-1.256613924743	105	6	NRG4, PIK3CA, PIK3R1
REACTOME_ION_HOMEOSTASIS	0.152	0.495245901639344	-0.309561372348711	-1.25684163494163	56	40	ATP2B1, ORAI1, RYR1, KCNJ11, TRDN, STIM1, ATP2A2, ASPH, CAMK2G, CALM1, PRKACA, ATP2A1
REACTOME_PIWI_INTERACTING_RNA_PIRNA_BIOGENESIS	0.16301703163017	0.505257466456083	-0.419578883577379	-1.26688759180607	66	15	POLR2B, POLR2J, POLR2D
REACTOME_CONVERSION_FROM_APC_C_CDC20_TO_APC_C_CDH1_IN_LATE_ANAPHASE	0.158139534883721	0.498142397693246	-0.39150950500188	-1.26805895141626	67	18	UBE2D1, CDC27, CDC26, CDC16, UBE2S, ANAPC11, CDC23, ANAPC15, UBE2E1, ANAPC5
REACTOME_TRNA_PROCESSING_IN_THE_MITOCHONDRION	0.221739130434783	0.57987700228833	-0.554457774961736	-1.27017359063788	101	6	TRMT10C
REACTOME_TRIGLYCERIDE_CATABOLISM	0.167053364269142	0.50781379059702	-0.399069799745043	-1.27065294559255	71	17	PPP1CC, FABP3, PPP1CB, PRKACA, ABHD5, PPP1CA, PNPLA4, MGLL
REACTOME_ALPHA_LINOLENIC_OMEGA3_AND_LINOLEIC_OMEGA6_ACID_METABOLISM	0.161731207289294	0.503234089217177	-0.454960839369148	-1.2734901667548	70	11	ABCD1, HSD17B4, ACOX1, SCP2, ACSL1
REACTOME_TRNA_AMINOACYLATION	0.153266331658291	0.496276809203193	-0.366977721557523	-1.27853900116325	60	24	IARS2, AIMP2, HARS2, YARS2, PARS2, NARS2, AIMP1, PPA1, MARS2, PPA2, FARSB
REACTOME_MAPK_TARGETS_NUCLEAR_EVENTS_MEDIATED_BY_MAP_KINASES	0.1375	0.465002335836286	-0.348886517736992	-1.28292972454716	54	29	MAPK8, RPS6KA3, DUSP3, MAPK9, ELK1, ATF1, MAPK1, MEF2A, RPS6KA2, PPP2CB, MAPKAPK2
REACTOME_HIV_LIFE_CYCLE	0.053968253968254	0.264029304029304	-0.25047779135537	-1.28790236804977	16	138	TAF13, ELOA, GTF2A2, KPNA1, VTA1, CHMP3, HMGA1, VPS37C, POLR2B, CHMP2B, GTF2A1, GTF2E1, TAF3, POLR2J, SEC13, TCEA1, POLR2D, NUP37, ELOC, VPS37A, UBAP1, VPS4A, FEN1, CHMP7, CCNK, FURIN, NDC1, TAF11, SUPT4H1, CDK7, MVB12B, TSG101, LIG4, CHMP4B, CTDP1, VPS4B, CCNH, NUP58
REACTOME_NONCANONICAL_ACTIVATION_OF_NOTCH3	0.18058690744921	0.522227430572164	-0.520899581090762	-1.29057985523551	79	8	PSEN2, APH1A, YBX1, PSENEN
REACTOME_MAPK3_ERK1_ACTIVATION	0.173814898419865	0.514082831573361	-0.522694854020036	-1.29502782018169	76	8	PTPN11, JAK1
REACTOME_GLYCEROPHOSPHOLIPID_CATABOLISM	0.167800453514739	0.50781379059702	-0.661902598483731	-1.29546203362868	73	4	GDE1, PNPLA6, GDPD5
REACTOME_MRNA_DECAY_BY_5_TO_3_EXORIBONUCLEASE	0.13625304136253	0.462910973859879	-0.429864485534905	-1.29794421072632	55	15	LSM1, PATL1, LSM5, EDC3, LSM3, DDX6
REACTOME_ABERRANT_REGULATION_OF_MITOTIC_EXIT_IN_CANCER_DUE_TO_RB1_DEFECTS	0.121428571428571	0.433868378812199	-0.39530976168399	-1.2986384686591	50	19	UBE2D1, CDC27, CDC26, CDC16, UBE2S, ANAPC11, CDC23, ANAPC15, UBE2E1, ANAPC5
REACTOME_BETA_OXIDATION_OF_OCTANOYL_COA_TO_HEXANOYL_COA	0.186813186813187	0.52386766672481	-0.612727432539334	-1.30006259072936	84	5	ACADM, HADHA, HADHB, HADH, ECHS1
REACTOME_BETA_OXIDATION_OF_HEXANOYL_COA_TO_BUTANOYL_COA	0.186813186813187	0.52386766672481	-0.612727432539334	-1.30006259072936	84	5	ACADS, HADHA, HADHB, HADH, ECHS1
REACTOME_INTEGRATION_OF_PROVIRUS	0.171557562076749	0.511775841842461	-0.525789635454866	-1.30269544503903	75	8	KPNA1, HMGA1
REACTOME_RORA_ACTIVATES_GENE_EXPRESSION	0.132558139534884	0.454240176423416	-0.403146491629282	-1.30574995220133	56	18	PPARA, MED1, RXRA, EP300, CARM1, CREBBP, CHD9
REACTOME_SARS_COV_2_INFECTION	0.074585635359116	0.32669741107712	-0.29325617544112	-1.30589289622204	26	65	GALNT1, ZCRB1, BECN1, CHMP3, GSK3B, CHMP2B, ST3GAL1, PARP6, VCP, ST3GAL3, GSK3A, SUMO1, PIK3C3, RPN2, CHMP7, ST6GALNAC2, CANX
REACTOME_ZBP1_DAI_MEDIATED_INDUCTION_OF_TYPE_I_IFNS	0.148491879350348	0.48781423175011	-0.411440713354075	-1.31004239031382	63	17	NKIRAS2, CHUK, NKIRAS1, NFKBIB, TBK1
REACTOME_FORMATION_OF_ATP_BY_CHEMIOSMOTIC_COUPLING	0.12678936605317	0.445022278199867	-0.83804920913884	-1.32077358904369	61	2	MT-ATP8, MT-ATP6
REACTOME_INHIBITION_OF_THE_PROTEOLYTIC_ACTIVITY_OF_APC_C_REQUIRED_FOR_THE_ONSET_OF_ANAPHASE_BY_MITOTIC_SPINDLE_CHECKPOINT_COMPONENTS	0.134570765661253	0.459221691437682	-0.415205667979813	-1.322030144557	57	17	UBE2D1, CDC27, CDC26, CDC16, UBE2S, ANAPC11, CDC23, ANAPC15, UBE2E1, ANAPC5
REACTOME_SYNTHESIS_OF_SUBSTRATES_IN_N_GLYCAN_BIOSYTHESIS	0.0893854748603352	0.361635890656318	-0.318872219533888	-1.32214669181084	31	46	CMAS, GNPNAT1, ST3GAL1, SLC17A5, ST3GAL3, SLC35C1, DOLK, ST6GALNAC2, GNE, GFPT1, ST3GAL2, ALG5, NUS1
REACTOME_CHOLESTEROL_BIOSYNTHESIS	0.107142857142857	0.403938642675053	-0.398080884152918	-1.32586655826744	44	20	GGPS1, HMGCR, HMGCS1, SC5D, DHCR24, LSS
REACTOME_BETA_OXIDATION_OF_DECANOYL_COA_TO_OCTANOYL_COA_COA	0.169565217391304	0.50781379059702	-0.579480364551229	-1.32749631907854	77	6	ACADM, HADHA, HADHB, HADH, ECHS1
REACTOME_NEGATIVE_FEEDBACK_REGULATION_OF_MAPK_PATHWAY	0.169565217391304	0.50781379059702	-0.57986954774083	-1.32838787517474	77	6	RAF1, MAP2K2, MAPK1
REACTOME_GDP_FUCOSE_BIOSYNTHESIS	0.116564417177914	0.426094537001162	-0.84373342573183	-1.32973196889604	56	2	SLC35C1
REACTOME_YAP1_AND_WWTR1_TAZ_STIMULATED_GENE_EXPRESSION	0.143167028199566	0.478225997557374	-0.504686810016408	-1.33110145836056	65	9	KAT2B, HIPK2, TEAD1, HIPK1
REACTOME_RETROGRADE_TRANSPORT_AT_THE_TRANS_GOLGI_NETWORK	0.0743801652892562	0.32669741107712	-0.317470268569921	-1.33454111491666	26	48	GOLGA4, RGP1, NAA30, NAA35, COG2, VTI1A, VPS51, GCC1, SYS1, TGOLN2, GOLGA1, M6PR, RAB6A, IGF2R, NSF, RABEPK, GCC2, TMF1, NAA38, VAMP3, SCOC
REACTOME_ATTACHMENT_AND_ENTRY	0.13215859030837	0.454240176423416	-0.743905691240715	-1.33568012667427	59	3	VCP, FURIN
REACTOME_SIGNALING_BY_CSF3_G_CSF	0.120906801007557	0.432977057662196	-0.372618841090075	-1.33745463011759	47	26	CUL5, UBE2D2, PTPN11, JAK1, UBE2D1, ELOC, RNF7
REACTOME_REGULATION_OF_IFNG_SIGNALING	0.123006833712984	0.435592128293195	-0.480290201457259	-1.34439010089882	53	11	PTPN11, JAK1, SUMO1
REACTOME_TRANSCRIPTION_OF_THE_HIV_GENOME	0.0441988950276243	0.232702791701731	-0.302051093058854	-1.34505735856484	15	65	TAF13, ELOA, GTF2A2, POLR2B, GTF2A1, GTF2E1, TAF3, POLR2J, TCEA1, POLR2D, ELOC, CCNK, TAF11, SUPT4H1, CDK7
REACTOME_VESICLE_MEDIATED_TRANSPORT	0.00746268656716418	0.0630952380952381	-0.226283558881941	-1.34609194791491	0	528	GALNT1, GOLGA4, RABEP1, RGP1, NAA30, KIF5B, KIF1B, VTA1, NAA35, SEC23A, COPS3, CLINT1, KIF1C, AP4E1, RAB4A, CHMP3, CNIH1, COPS5, YWHAG, TBC1D1, RAC1, COG2, YKT6, ALS2, VPS37C, PAFAH1B1, CHM, EPS15, PRKAG1, KIF16B, VTI1A, DYNC1LI1, GOLGA5, BIN1, PPP6C, TRAPPC8, VPS51, CHMP2B, MON1A, RAB3GAP2, RHOQ, DENND1A, DCTN4, GCC1, FNBP1, MIA3, EPN1, TRAPPC10, EXOC5, ANKRD28, TRAPPC13, SEC13, AP1G1, UBQLN1, YIPF6, TMED2, MAN2A2, LMAN1, ARPC2, TOR1B, RAB10, SNF8, AGPAT3, RALGAPB, RAB3GAP1, COPS8, CAPZB, RAB7A, AP3B1, CCZ1, MCFD2, RAB5A, TBC1D4, VAMP7, ACTR2, PPP6R1, SEC22C, COPS2, GOLGA2, DYNC1H1, SORT1, GOSR1, DNM2, TFRC, VPS37A, UBAP1, USO1, SYS1, DNASE2, CAPZA2, VPS4A, RAB1B, MAN1A2, SAR1B, RABGAP1, CHMP7, RACGAP1, TRIP11, ANK3, TUBA4A, EPS15L1, GALNT2, TGOLN2, STAM, MYO5A, PRKAG3, SNAPIN, UBQLN2, SEC24C, OPTN, PRKAB2, SNAP29, F8, CALM1, SYNJ1, TBC1D25, CCZ1B, RAB12, TRIP10, GOLGA1, PPP6R3, FTH1, KIF21A, ANK2, M6PR, DYNLL2, DENND5B, COPB2, MVB12B, MADD, TOR1A, GRK2, BICD2, TSG101, TBC1D14, RAB6A, ITSN1, HSPA8, AP1S2, DCTN5, CLTB, SNX2, KIF2A, CHMP4B
REACTOME_GLUCONEOGENESIS	0.099009900990099	0.38303100383031	-0.38961555722847	-1.3467578060083	39	23	G6PC3, PC, GAPDH, SLC37A4, ENO3, ALDOA, MDH2, GOT2, PGK1
REACTOME_DARPP_32_EVENTS	0.0973871733966746	0.378595612960178	-0.399038830803884	-1.35331325831757	40	21	PRKAR2A, PPP3CC, CALM1, PPP3CB, PPP2CB, PRKACA, PPP1CA, CDK5, PPP3R1
REACTOME_CARGO_CONCENTRATION_IN_THE_ER	0.103015075376884	0.393957896413496	-0.389214466525363	-1.35601113102345	40	24	SEC23A, CNIH1, MIA3, TMED2, LMAN1, MCFD2, SAR1B, SEC24C, F8
REACTOME_VITAMIN_B2_RIBOFLAVIN_METABOLISM	0.117913832199546	0.428043363464107	-0.693579888179238	-1.35746016782968	51	4	RFK, FLAD1
REACTOME_CYTOSOLIC_TRNA_AMINOACYLATION	0.158695652173913	0.498142397693246	-0.59322945714775	-1.35899327899139	72	6	AIMP2, AIMP1, PPA1, FARSB, EEF1E1
REACTOME_GLYCOGEN_BREAKDOWN_GLYCOGENOLYSIS	0.131764705882353	0.454240176423416	-0.461491512946877	-1.36024836245984	55	13	PHKA1, PHKB, GYG1, CALM1, AGL, PGM2L1, PYGM, PHKG1
REACTOME_MOLYBDENUM_COFACTOR_BIOSYNTHESIS	0.147252747252747	0.485750763759063	-0.6419091148809	-1.36197921389994	66	5	MOCS3, MOCS2, GPHN, NFS1, MOCS1
REACTOME_SIGNALING_BY_ROBO_RECEPTORS	0.01171875	0.0891522129186603	-0.257186451712208	-1.363176166811	2	195	PSMB5, PSMD7, PRKAR2A, PSMD14, PSMD6, PSMC1, EIF4G1, CUL2, PSMC2, PSMD12, RAC1, NCK2, PSMA1, PSMB6, PSME4, PSMA4, PSMD2, PSMD1, PSMA2, PRKCA, PSMA6, PSMD3, GSPT1, PSMD11, SEM1, PSMA3, PSME3, GPC1, SOS2, PSMC6, UPF2, PSMA7, PSMD8, USP33, PSMC4, DAG1, ELOC, PSMB2
REACTOME_TRAF6_MEDIATED_NF_KB_ACTIVATION	0.0902612826603325	0.363330226404883	-0.402899564626209	-1.36640667646453	37	21	NKIRAS2, CHUK, MAVS, NKIRAS1, NFKBIB
REACTOME_O_LINKED_GLYCOSYLATION_OF_MUCINS	0.0928571428571429	0.370032223415682	-0.395546480559182	-1.36786982245893	38	22	GALNT1, ST3GAL1, ST3GAL3, ST6GALNAC2, GALNT2, C1GALT1C1, ST3GAL2, B4GALT5, GALNT11, C1GALT1
REACTOME_PHOSPHORYLATION_OF_THE_APC_C	0.104651162790698	0.398074997218204	-0.440147235491604	-1.37050434781843	44	16	UBE2D1, CDC27, CDC26, CDC16, UBE2S, ANAPC11, CDC23, ANAPC15, UBE2E1, ANAPC5
REACTOME_OVARIAN_TUMOR_DOMAIN_PROTEASES	0.0824742268041237	0.350625723579029	-0.362988310783906	-1.3730021268364	31	33	APC, MAVS, ZRANB1, OTUD7B, TRAF3, VCP, UBE2D1, RNF128, TNIP1, VCPIP1
REACTOME_TRANSLATION_OF_REPLICASE_AND_ASSEMBLY_OF_THE_REPLICATION_TRANSCRIPTION_COMPLEX	0.114942528735632	0.423052362707535	-0.477873228225757	-1.37311580858954	49	12	BECN1, CHMP3, CHMP2B, PIK3C3, CHMP7, CHMP4B, UVRAG
REACTOME_ER_QUALITY_CONTROL_COMPARTMENT_ERQC	0.0857142857142857	0.354204189970613	-0.412765615957653	-1.3747762034981	35	20	AMFR, RNF139, SEL1L, UGGT1, TRIM13
REACTOME_GASTRIN_CREB_SIGNALLING_PATHWAY_VIA_PKC_AND_MAPK	0.0900243309002433	0.363296157693875	-0.455526958642497	-1.37543016158702	36	15	RPS6KA3, PRKCA, MAPK1, SOS1, RPS6KA2
REACTOME_TRANSCRIPTION_OF_E2F_TARGETS_UNDER_NEGATIVE_CONTROL_BY_P107_RBL1_AND_P130_RBL2_IN_COMPLEX_WITH_HDAC1	0.114606741573034	0.423052362707535	-0.507866733673183	-1.38439008524178	50	10	TFDP2, LIN54, TFDP1, E2F4
REACTOME_CELL_CYCLE	0.00680272108843537	0.0604264051989511	-0.235659431994928	-1.38695127280198	0	463	PSMB5, HERC2, PSMD7, PSMD14, E2F6, PSMD6, PSMC1, RAD1, PSMC2, FBXL18, CHMP3, YWHAG, PSMD12, TFDP2, ENSA, LIN54, SSNA1, CUL1, PSMA1, PPP1CC, PAFAH1B1, PSMB6, E2F3, PSME4, POLR2B, PSMA4, CLIP1, DYNC1LI1, PSMD2, PPP6C, GSK3B, PSMD1, PSMA2, PRKCA, SPAST, PSMA6, PSMD3, CHMP2B, PSMD11, CEP70, HUS1, DHFR, SEM1, KPNB1, PSMA3, ANKRD28, POLR2J, MCPH1, BTRC, SEC13, RMI1, UBE2D1, PSME3, PCBP4, PHF20, CDC27, VRK2, RNF8, PSMC6, SUMO1, PPP1R12B, EP300, MZT1, POLR2D, NUP37, PSMA7, ARPP19, MIS12, TFDP1, PSMD8, PPP2R5E, PSMC4, GOLGA2, PPP2R5C, DYNC1H1, UBE2V2, FBXW11, PSMB2, TEN1, USO1, CDC26, VPS4A, CSNK2A1, RAB1B, PPP1CB, MAPK1, CTDNEP1, FEN1, BRCC3, CNEP1R1, CHMP7, E2F4, PCM1, GORASP2, TAOK1, NOP10, RFC1, SMARCA5, PSMA5, HAUS2, NEDD1, TUBA4A, PSMF1, PSMB7, NSD2, OPTN, INCENP, NCAPD2, PPP2R2A, WAPL, CDC16, UBE2S, ESCO1, PSMC3, NDC1, RAD17, PPP6R3, LPIN1, ANAPC11, CDK7, ATRX, PPP2CB, DYNLL2, PRKACA, KMT5A
REACTOME_MET_INTERACTS_WITH_TNS_PROTEINS	0.0947136563876652	0.374613715563153	-0.775026910576923	-1.39155816965028	42	3	MET, ITGB1
REACTOME_MET_ACTIVATES_PI3K_AKT_SIGNALING	0.12967032967033	0.45213996529786	-0.656332958311642	-1.39258319580611	58	5	MET, PIK3CA, PIK3R1
REACTOME_METABOLISM_OF_COFACTORS	0.0953488372093023	0.37525903753166	-0.447577431317042	-1.39364005074414	40	16	PTS, DHFR, CALM1, PDSS1, SPR, IDH1, PDSS2, COQ6, COQ9, COQ7, COQ2, AKT1
REACTOME_POST_TRANSLATIONAL_PROTEIN_MODIFICATION	0.0131578947368421	0.0968567251461988	-0.224200178862741	-1.39458210512569	0	1018	GALNT1, CMAS, WSB2, AGTPBP1, NGLY1, DCAF5, FOXO4, PSMB5, DCUN1D5, KTN1, HERC2, GNPNAT1, PSMD7, DNAJC24, PPARA, USP16, PSMD14, CUL3, AMFR, PEX2, USP14, APC, USP28, TTL, DPH3, PSMD6, PSMC1, SEC23A, COPS3, UCHL3, CUL2, ING2, USP25, USP9X, RAD23B, PIGX, PSMC2, BECN1, CUL5, FBXL18, RAB4A, PTP4A2, CNIH1, RNF139, COPS5, UBE2D2, FBXO6, DCAF6, PSMD12, STAMBP, PEX5, KEAP1, USP24, SENP2, CUL4A, MAVS, COG2, RAD23A, YKT6, CUL1, PSMA1, CHM, BTBD1, IDE, PSMB6, PSME4, LARGE1, NR1H2, SEL1L, UBE2F, PSMA4, DYNC1LI1, PSMD2, PPP6C, KAT2B, PSMD1, PSMA2, HIPK2, MITF, PSMA6, PSMD3, UBE2L3, USP19, UGGT1, ZRANB1, USP34, OTUD7B, PSMD11, TADA3, CTR9, ASB12, DCTN4, TULP4, MIA3, FBXO9, ST3GAL1, PIGH, SEM1, TADA2B, TRAF3, PSMA3, TRAPPC10, ANKRD28, DDA1, UBE2A, VCP, FEM1A, SOCS6, DCAF10, BTRC, SEC13, METTL22, UBE2M, UCHL5, TMED2, MAN2A2, LMAN1, UBE2D1, DCUN1D1, DCUN1D2, PIGC, PSME3, RAB10, MUL1, SLC17A5, TRIM13, MLEC, RNF128, ST3GAL3, CHST10, ARSB, RXRA, HRC, RTF1, COPS8, ASB2, SLC35C1, CAPZB, RAB7A, PEX13, DOLK, PSMC6, SUMO1, EP300, MCFD2, VDAC1, RAB5A, RNF123, NUP37, PSMA7, B4GALT2, PPP6R1, PSMD8, FBXW4, SEC22C, USP33, BIRC2, COPS2, PSMC4, DAG1, GOLGA2, DYNC1H1, COMMD9, UBE2V2, YY1, PARP1, UBE2E3, FBXW11, ELOC, TNIP1, GOSR1, SELENOS, TOP2B, AGBL1, PSMB2, USP47, USO1, ICMT, RPN2, USP7, CAPZA2, RAB1B, MAN1A2, VCPIP1, SAR1B, CALU, BRCC3, ASB13, DOHH, ASXL2, ST6GALNAC2, CANX, DCAF8, ANK3, PSMA5, TUBA4A, GALNT2, PSMF1, ADRM1, ASB14, POMGNT1, TGOLN2, UBE2R2, STAM, PSMB7, LEO1, BAP1, FBXO32, FBXL14, PIGS, ANO8, SEC24C, INCENP, RNF7, ALG3, F8, PIGW, MPDU1, CALM1, RHOT1, TGFBR1, UBE2S, PIGP, ACTR8, SMAD4, TNKS, FURIN, AXIN2, PSMC3, RAB12, WDR20, BMI1, ASB8, NDC1, GNE, GFPT1, PPP6R3, ANK2, PARK7, FOXK2, USP8, DCAF11, UBE2J2, ASB1, C1GALT1C1, MGAT4B, SNX3, ST3GAL2, ZBED1, UBE2T, RNF20, B4GAT1, WDTC1, ALG5, NUS1, CREBBP, UBXN1, FBXL4, DYNLL2, USP5
REACTOME_REGULATION_OF_LIPID_METABOLISM_BY_PPARALPHA	0.0214067278287462	0.140647509288043	-0.285322769360734	-1.39569092942677	6	104	PPARA, NFYB, NR1H2, MED1, MED11, ESRRA, MED10, HMGCR, ME1, HDAC3, MED18, HMGCS1, MED13, ALAS1, RXRA, ARNT2, EP300, MTF1, NPAS2, NCOA3, NCOR1, MED21, MED13L, MED7, TXNRD1, ACOX1, CARM1, CREBBP, PEX11A, CHD9, ARNT, MED15, GPS2, MED24, ACADM, CLOCK, SREBF2, TGS1, MED4, FDFT1, ACSL1, MED20
REACTOME_SIGNALING_BY_TGF_BETA_RECEPTOR_COMPLEX	0.0331491712707182	0.190278636535892	-0.308836760165734	-1.39737351443466	11	70	ZFYVE9, USP9X, TFDP2, PPP1CC, PPM1A, UBE2M, UCHL5, UBE2D1, TFDP1, PARD3, PARP1, PARD6A, PPP1CB, MAPK1, STRAP, E2F4, CCNK, NCOR1, TGFBR1, SMAD4, FURIN, RNF111
REACTOME_MAPK_FAMILY_SIGNALING_CASCADES	0.00425531914893617	0.0457159286946521	-0.258334195332081	-1.398122318281	0	233	PSMB5, PSMD7, PSMD14, CUL3, AGO4, PSMD6, PSMC1, MAPK6, PSMC2, PSMD12, RAF1, RAC1, PSMA1, PPP1CC, LYPLA1, PSMB6, PTPN11, SHOC2, PIK3CB, PSME4, PSMA4, ARAF, PSMD2, PSMD1, PSMA2, PSMA6, PSMD3, JAK1, PSMD11, RAP1A, SEM1, PSMA3, RANBP9, PSME3, MET, PSMC6, MAP2K2, PSMA7, PSMD8, PPP2R5E, PSMC4, BRAP, PPP2R5C, PSMB2, ICMT, VCL, PPP1CB, MAPK1, NRG4, MARK3, MAPK12, PSMA5, PSMF1, NCOA3, PSMB7, GOLGA7, PAK2, CAMK2G, SOS1, CALM1, PIK3CA
REACTOME_REGULATION_OF_FOXO_TRANSCRIPTIONAL_ACTIVITY_BY_ACETYLATION	0.112359550561798	0.417410479890791	-0.513788010493981	-1.40053084890904	49	10	FOXO4, KAT2B, EP300, CREBBP, SIRT1
REACTOME_AMPK_INHIBITS_CHREBP_TRANSCRIPTIONAL_ACTIVATION_ACTIVITY	0.127853881278539	0.447770200953473	-0.585674367112186	-1.40054042637106	55	7	ADIPOR1, PRKAB2, ADIPOR2, MLXIPL, PRKAG2
REACTOME_ESTABLISHMENT_OF_SISTER_CHROMATID_COHESION	0.112798264642082	0.418063498323802	-0.532415674547312	-1.40423578896565	51	9	WAPL, ESCO1, SMC3, PDS5A, STAG1
REACTOME_ACTIVATION_OF_GENE_EXPRESSION_BY_SREBF_SREBP	0.0434782608695652	0.230434782608696	-0.352088391968896	-1.4053626030748	15	39	GGPS1, PPARA, NFYB, MED1, HMGCR, HMGCS1, RXRA, MTF1, SC5D, LSS, CARM1, CREBBP, CHD9, ACACB, SREBF2, TGS1, FDFT1
REACTOME_RSK_ACTIVATION	0.118681318681319	0.428619000047571	-0.663489432548827	-1.40776754033386	53	5	RPS6KA3, MAPK1, RPS6KA2, PDPK1
REACTOME_GLYCOGEN_SYNTHESIS	0.101176470588235	0.389517162797322	-0.478125326963727	-1.40927660597704	42	13	EPM2A, GBE1, PGM1, GYG1, PGM2L1
REACTOME_TICAM1_TRAF6_DEPENDENT_INDUCTION_OF_TAK1_COMPLEX	0.10561797752809	0.400793757206833	-0.517109844882078	-1.40958581212437	46	10	TAB2, TAB3
REACTOME_MAP3K8_TPL2_DEPENDENT_MAPK1_3_ACTIVATION	0.0883720930232558	0.360286225402504	-0.452751256128432	-1.40974999947741	37	16	MAP2K4, CHUK, CUL1, BTRC, FBXW11
REACTOME_FORMATION_OF_TC_NER_PRE_INCISION_COMPLEX	0.0335195530726257	0.191025409983781	-0.332756594407019	-1.41081642711454	11	50	COPS3, COPS5, CUL4A, POLR2B, ISY1, POLR2J, TCEA1, COPS8, EP300, POLR2D, COPS2, USP7
REACTOME_RECYCLING_OF_EIF2_GDP	0.0925507900677201	0.369738080923806	-0.570948031630415	-1.41457980531605	40	8	EIF2S2, EIF2S1, EIF2B3
REACTOME_UBIQUINOL_BIOSYNTHESIS	0.0925507900677201	0.369738080923806	-0.572418380191914	-1.41822273823926	40	8	PDSS1, PDSS2, COQ6, COQ9, COQ7, COQ2
REACTOME_RNA_POLYMERASE_III_TRANSCRIPTION	0.0407608695652174	0.222450667899462	-0.356537742482635	-1.42312220822683	14	39	BRF2, GTF3C4, GTF3C6, POLR3F, GTF3C1, POLR1D, NFIC, SNAPC5, POLR3E, GTF3A
