pathway	pval	padj	ES	NES	nMoreExtreme	size	leadingEdge
REACTOME_FIBRONECTIN_MATRIX_FORMATION	0.720802919708029	0.922036500851469	0.450669687877784	0.796324592848742	394	3	ITGA5, FN1
REACTOME_TRAF6_MEDIATED_IRF7_ACTIVATION_IN_TLR7_8_OR_9_SIGNALING	0.735449735449735	0.928503787878788	0.294853337363038	0.794550277427217	416	12	MYD88, RPS27A, IRAK4, IRF7
REACTOME_TRANSPORT_OF_INORGANIC_CATIONS_ANIONS_AND_AMINO_ACIDS_OLIGOPEPTIDES	0.814352574102964	0.954016057696021	0.200081833088547	0.793422098575151	521	54	SLC25A29, SLC12A7, SLC9A9, SLC12A4, SLC20A1, SLC26A11, SLC8B1, SLC1A5, SRI, SLC7A5, SLC9A5, SLC36A4, SLC4A7
REACTOME_CHK1_CHK2_CDS1_MEDIATED_INACTIVATION_OF_CYCLIN_B_CDK1_COMPLEX	0.723404255319149	0.922627789841687	0.343720907669888	0.793124346263056	407	7	YWHAQ, YWHAZ, YWHAH
REACTOME_SUMOYLATION_OF_DNA_METHYLATION_PROTEINS	0.736568457538995	0.928742147095164	0.284678978864603	0.79285799748374	424	13	CBX4, PCGF2, DNMT1, UBE2I, RING1, PHC3
REACTOME_DEFENSINS	0.769980506822612	0.937022171253823	0.513391574173961	0.792168233856288	394	2	TLR2, ART1
REACTOME_CARGO_RECOGNITION_FOR_CLATHRIN_MEDIATED_ENDOCYTOSIS	0.853881278538813	0.957767039162388	0.187573717104988	0.792015865351266	560	79	NECAP2, STON1, DAB2, SH3GL1, NECAP1, CBL, GRK3, SGIP1, CLTA, AP2A2, RPS27A, AREG, AGTR1, FCHO2, SYT11, VAMP2, PICALM, ARRB2
REACTOME_COOPERATION_OF_PREFOLDIN_AND_TRIC_CCT_IN_ACTIN_AND_TUBULIN_FOLDING	0.775919732441472	0.938184315271437	0.242626564450617	0.79174821238769	463	23	ACTB, TUBB6, CCT3, TUBA1A, PFDN5, CCT8, CCT4
REACTOME_METHYLATION	0.744268077601411	0.929505751658638	0.293511677619131	0.790934866011942	421	12	TRMT112, NNMT, MTR, MAT2A, N6AMT1, AS3MT
REACTOME_AGGREPHAGY	0.790849673202614	0.94850863422292	0.229586962192301	0.788895265178303	483	28	VIM, DYNLL1, TUBB6, HDAC6, RPS27A, TUBA1A, IFT88
REACTOME_PURINE_CATABOLISM	0.745233968804159	0.929505751658638	0.283051597944009	0.788325587036745	429	13	NUDT5, NT5E, NUDT1, GDA, NT5C
REACTOME_NR1H2_AND_NR1H3_MEDIATED_SIGNALING	0.821543408360129	0.955562559833654	0.214259141596492	0.788244011337877	510	37	MOV10, NR1H3, APOD, PLTP, ABCA1, APOE, FASN, SCD, PLIN1
REACTOME_TP53_REGULATES_TRANSCRIPTION_OF_DNA_REPAIR_GENES	0.828173374613003	0.95597317484306	0.196692007940695	0.788173195192298	534	56	DDB2, ATM, JUN, FANCC, CCNT2, MDC1, TP53, FOS, NELFA, RAD51D, GTF2H4, NELFE, MSH2, NELFCD
REACTOME_GLUTAMATE_AND_GLUTAMINE_METABOLISM	0.744227353463588	0.929505751658638	0.300612019883762	0.78769781602298	418	11	GLS, RIMKLB, ALDH18A1
REACTOME_ZINC_INFLUX_INTO_CELLS_BY_THE_SLC39_GENE_FAMILY	0.714022140221402	0.918862690707351	0.356549536043516	0.787277463983911	386	6	SLC39A10, SLC39A14
REACTOME_ESR_MEDIATED_SIGNALING	0.916544655929722	0.980030936737228	0.170138338534097	0.786371228989414	625	135	MOV10, SPHK1, NOS3, MMP2, GNB1, SRC, GNB4, JUN, GNAI2, TLE3, PIK3R2, JUND, ZNF217, ZDHHC21, FOSB, AREG, CAV2, POU2F1, MYC, CXCL12, FOS, KCTD6, XPO1, GNG11, IGF1R, CREB1, AKT3, HDAC1, GNG12, PTGES3, CDKN1B, TNRC6C, GNAI3, CCND1, HSPB1, HRAS, POLR2H, RUNX1, S1PR3, NRAS, CAV1, GNB2
REACTOME_SHC_RELATED_EVENTS_TRIGGERED_BY_IGF1R	0.722719141323792	0.922627789841687	0.325710734447213	0.78515150177692	403	8	IGF1R, HRAS, NRAS, IGF2, SHC1, KRAS
REACTOME_NUCLEAR_ENVELOPE_BREAKDOWN	0.82398753894081	0.95597317484306	0.203933011738591	0.784786133085974	528	45	LPIN3, AAAS, NUP85, TMPO, NUP210, NUP155, NUP107, LPIN2, NUP35, NUP160, NEK6
REACTOME_FGFR3B_LIGAND_BINDING_AND_ACTIVATION	0.854251012145749	0.957767039162388	0.584043581407609	0.783451924028637	421	1	FGF1
REACTOME_INTERLEUKIN_7_SIGNALING	0.748700173310225	0.929505751658638	0.281058759020524	0.782775341337244	431	13	PIK3R2, SOCS2, CISH, STAT5A, PIK3R3, BRWD1, IRS1, IRS2, STAT3
REACTOME_CA2_ACTIVATED_K_CHANNELS	0.773879142300195	0.937795568465612	0.506678383128295	0.781809714235585	396	2	KCNMA1, KCNN3
REACTOME_RELEASE_OF_APOPTOTIC_FACTORS_FROM_THE_MITOCHONDRIA	0.711151736745887	0.918862690707351	0.377779947988976	0.781057616384345	388	5	GSDMD, BAX
REACTOME_REGULATION_OF_PTEN_MRNA_TRANSLATION	0.770794824399261	0.937022171253823	0.318463668372484	0.779814329578591	416	9	MOV10, PTEN, TNRC6C, TNRC6A
REACTOME_VITAMIN_D_CALCIFEROL_METABOLISM	0.719557195571956	0.921914537437075	0.353012170895826	0.779466802123119	389	6	UBE2I, CYP2R1, SUMO2
REACTOME_INLB_MEDIATED_ENTRY_OF_LISTERIA_MONOCYTOGENES_INTO_HOST_CELL	0.755632582322357	0.930117051042201	0.279397045487776	0.778147311304183	435	13	SH3GL1, CBL, RPS27A
REACTOME_PROTEIN_METHYLATION	0.763986013986014	0.933918080171771	0.262679835202253	0.777957500256788	436	16	EEF1A1, KIN, EEF1AKMT1, CAMKMT
REACTOME_FRS_MEDIATED_FGFR2_SIGNALING	0.763668430335097	0.933918080171771	0.28846564735149	0.777337174410696	432	12	FGF7, FGF2, HRAS, NRAS, FRS3, FGF6, KRAS, FGF1
REACTOME_SHC_MEDIATED_CASCADE_FGFR3	0.729874776386404	0.926177888630792	0.322065851917006	0.776365223985831	407	8	FGF2, HRAS, NRAS, SHC1, KRAS, FGF1
REACTOME_CTLA4_INHIBITORY_SIGNALING	0.767482517482518	0.936543382262499	0.260998077852493	0.772976776316365	438	16	SRC, PPP2R1B, FYN
REACTOME_RUNX1_REGULATES_ESTROGEN_RECEPTOR_MEDIATED_TRANSCRIPTION	0.734317343173432	0.928111745346388	0.349810286095801	0.772396896007676	397	6	KCTD6, RUNX1, ESR1, GPAM
REACTOME_INACTIVATION_OF_CDC42_AND_RAC1	0.734317343173432	0.928111745346388	0.34972757982526	0.772214276830409	397	6	SRGAP2, SRGAP3, CDC42
REACTOME_SENESCENCE_ASSOCIATED_SECRETORY_PHENOTYPE_SASP	0.844615384615385	0.95597317484306	0.201172578471359	0.771787299088647	548	43	JUN, IGFBP7, CDK2, ANAPC2, RPS27A, CDKN1A, FOS, ANAPC7, CEBPB, CDK6
REACTOME_RUNX1_REGULATES_GENES_INVOLVED_IN_MEGAKARYOCYTE_DIFFERENTIATION_AND_PLATELET_FUNCTION	0.812297734627832	0.954016057696021	0.219387485624319	0.770998030685355	501	31	MOV10, SIN3B, MYL9, KMT2E, THBS1, HDAC1, TNRC6C, NR4A3, KMT2A, RUNX1
REACTOME_MITOCHONDRIAL_UNCOUPLING	0.755793226381462	0.930117051042201	0.399003709532829	0.770867937303239	423	4	SLC25A27, UCP2
REACTOME_THE_FATTY_ACID_CYCLING_MODEL	0.755793226381462	0.930117051042201	0.399003709532829	0.770867937303239	423	4	SLC25A27, UCP2
REACTOME_PURINE_SALVAGE	0.777777777777778	0.938769914843599	0.285480494730843	0.769292992635072	440	12	HPRT1, AMPD2, GMPR2, APRT, DGUOK, ADA
REACTOME_CYTOSOLIC_SENSORS_OF_PATHOGEN_ASSOCIATED_DNA	0.850234009360374	0.957416483628184	0.19379038067122	0.768473419812135	544	54	IRF3, STAT6, IFI16, NFKB2, TRIM56, TRIM21, MYD88, RPS27A, DDX41, MRE11, IRF7, TRIM32, DTX4, DHX9, POLR2H, POLR1C
REACTOME_NR1H3_NR1H2_REGULATE_GENE_EXPRESSION_LINKED_TO_CHOLESTEROL_TRANSPORT_AND_EFFLUX	0.817152103559871	0.954016057696021	0.218400779199311	0.767530427652392	504	31	MOV10, NR1H3, APOD, PLTP, ABCA1
REACTOME_CHYLOMICRON_CLEARANCE	0.748175182481752	0.929505751658638	0.433007422671441	0.765115712980519	409	3	APOE, LDLR
REACTOME_CARBOXYTERMINAL_POST_TRANSLATIONAL_MODIFICATIONS_OF_TUBULIN	0.821305841924399	0.955562559833654	0.23794567149234	0.761324857904287	477	22	TTLL3, TPGS2, TUBB6, NICN1, TUBA1A
REACTOME_SUMOYLATION_OF_SUMOYLATION_PROTEINS	0.846153846153846	0.95597317484306	0.212002823110378	0.760264688022332	516	34	AAAS, NUP85, NUP210, NUP155, NUP107, UBE2I, NUP35, NUP160, NUP50, SUMO2
REACTOME_SIGNALING_BY_ERBB2_IN_CANCER	0.823024054982818	0.95597317484306	0.237549270833099	0.760056544538143	478	22	PLCG1, PTPN12, ERBB3, ERBB2, CDC37, HRAS, NRAS
REACTOME_ELEVATION_OF_CYTOSOLIC_CA2_LEVELS	0.762411347517731	0.933918080171771	0.328403704182535	0.757780418293004	429	7	ITPR3, ITPR1
REACTOME_ZINC_TRANSPORTERS	0.80461811722913	0.954016057696021	0.286496488699472	0.75071069524794	452	11	SLC30A7, SLC39A10, SLC39A14
REACTOME_REGULATION_OF_PTEN_LOCALIZATION	0.811460258780037	0.954016057696021	0.306216261974675	0.749824399932948	438	9	PML, RPS27A, PTEN
REACTOME_PHENYLALANINE_METABOLISM	0.793226381461676	0.94850863422292	0.386447530321673	0.746609626571626	444	4	ASRGL1, KYAT1, QDPR, PCBD1
REACTOME_NRCAM_INTERACTIONS	0.793226381461676	0.94850863422292	0.386369068492841	0.746458039739965	444	4	NRP2, DLG4
REACTOME_SYNTHESIS_SECRETION_AND_DEACYLATION_OF_GHRELIN	0.773049645390071	0.937565931479949	0.322813186813187	0.744880488917469	435	7	SEC11C, KLF4, SEC11A, ACHE, SPCS2, SPCS3, SPCS1
REACTOME_E2F_ENABLED_INHIBITION_OF_PRE_REPLICATION_COMPLEX_FORMATION	0.764168190127971	0.933918080171771	0.359673024523161	0.743621668400477	417	5	ORC3, ORC2, ORC5, ORC4
REACTOME_TRISTETRAPROLIN_TTP_ZFP36_BINDS_AND_DESTABILIZES_MRNA	0.80385288966725	0.954016057696021	0.247089139098949	0.743180661213555	458	17	EXOSC2, ZFP36, EXOSC9, EXOSC8, EXOSC5
REACTOME_CYCLIN_D_ASSOCIATED_EVENTS_IN_G1	0.869634340222575	0.961121143602895	0.199674015856416	0.74295143247634	546	38	CCND2, SRC, PPP2R1B, CDK2, RPS27A, CDKN1A, CCND3, CDK6, CDKN1B, CCND1, PPP2R3B, ABL1
REACTOME_CASPASE_ACTIVATION_VIA_DEPENDENCE_RECEPTORS_IN_THE_ABSENCE_OF_LIGAND	0.778175313059034	0.938769914843599	0.30764644388564	0.741606099790015	434	8	DAPK1, MAGED1, UNC5B, DAPK2
REACTOME_RAP1_SIGNALLING	0.814814814814815	0.954016057696021	0.275202235453254	0.741595854005023	461	12	RAPGEF3, YWHAZ, RAP1B, SIPA1, RASGRP2
REACTOME_APOPTOTIC_CLEAVAGE_OF_CELLULAR_PROTEINS	0.854098360655738	0.957767039162388	0.218095279888623	0.741552629577287	520	27	VIM, SPTAN1, TJP2, GSN, CASP7, ROCK1, DBNL, PKP1
REACTOME_HOMOLOGOUS_DNA_PAIRING_AND_STRAND_EXCHANGE	0.845514950166113	0.95597317484306	0.214208362896552	0.741160864043361	508	29	XRCC3, ATM, RFC2, RAD51D, MRE11, WRN, RFC4, RAD9A
REACTOME_ERCC6_CSB_AND_EHMT2_G9A_POSITIVELY_REGULATE_RRNA_EXPRESSION	0.805944055944056	0.954016057696021	0.249776832381463	0.739743726395771	460	16	CHD3, MTA1, HDAC1, EHMT2, MTA2, GATAD2A, MTA3, HDAC2
REACTOME_SIGNALING_BY_FGFR1_IN_DISEASE	0.864686468646865	0.960627079279393	0.212230329605717	0.738755312550047	523	30	PLCG1, CNTRL, CPSF6, FGF2, FGFR1
REACTOME_FORMATION_OF_SENESCENCE_ASSOCIATED_HETEROCHROMATIN_FOCI_SAHF	0.817005545286506	0.954016057696021	0.301601427536063	0.738524165773574	441	9	TP53, CDKN1A, CABIN1, EP400
REACTOME_REGULATION_OF_PTEN_GENE_TRANSCRIPTION	0.897832817337461	0.972448351203381	0.183435406416269	0.735052084221446	579	56	HDAC7, JUN, TP53, CHD3, PPARG, CBX4, RRAGB, EGR1, HDAC5, MECOM, PTEN, SNAI2, MTA1, HDAC1, RING1, PHC3, EZH2, MAPK3, EED, CBX6, MTA2, GATAD2A, MTA3, HDAC2, LAMTOR4
REACTOME_INTERLEUKIN_2_FAMILY_SIGNALING	0.851170568561873	0.957767039162388	0.224861256284271	0.733775784615531	508	23	IL3RA, IL15, PIK3R2, LGALS9, IL15RA, PTK2B, INPP5D
REACTOME_CYTOSOLIC_SULFONATION_OF_SMALL_MOLECULES	0.81149012567325	0.954016057696021	0.285540484441318	0.732909135415076	451	10	ABHD14B, PAPSS1, SLC35B3, PAPSS2
REACTOME_P38MAPK_EVENTS	0.825396825396825	0.95597317484306	0.271365694212833	0.731257409359288	467	12	SRC, MAPK11, MAPK14, RALGDS, HRAS, NRAS
REACTOME_G2_M_DNA_REPLICATION_CHECKPOINT	0.912955465587045	0.978826156630749	0.544767595114665	0.730766049191748	450	1	WEE1
REACTOME_MAP2K_AND_MAPK_ACTIVATION	0.870550161812298	0.961121143602895	0.207905882332757	0.730647992023336	537	31	ACTG1, ACTB, SRC, RAP1B, IQGAP1, ARRB2, BRAF, ARRB1, FN1, HRAS, VWF, NRAS, MAPK3
REACTOME_FLT3_SIGNALING	0.874587458745875	0.961668368549211	0.209897965159284	0.730636554836167	529	30	CBL, FYN, BCL2L11, RPS27A, SOCS2, ABL2, AKT3, CDKN1B, HRAS, NRAS
REACTOME_SIGNALLING_TO_RAS	0.816433566433566	0.954016057696021	0.246564016583641	0.730228591193501	466	16	SRC, MAPK11, SHC2, MAPK14, RALGDS, HRAS, NRAS
REACTOME_ACTIVATION_OF_THE_AP_1_FAMILY_OF_TRANSCRIPTION_FACTORS	0.826247689463956	0.95597317484306	0.298142933145773	0.730055433694658	446	9	JUN, MAPK11, FOS, MAPK14
REACTOME_SIGNALING_BY_LEPTIN	0.816876122082585	0.954016057696021	0.283414916766245	0.727453348751229	454	10	LEPR, SOCS3, STAT5A, SH2B1, IRS1, IRS2, STAT3
REACTOME_APOPTOTIC_CLEAVAGE_OF_CELL_ADHESION_PROTEINS	0.79520295202952	0.949941918652845	0.328907189758661	0.726241916095694	430	6	TJP2, PKP1, CTNNB1, DSP
REACTOME_VLDL_ASSEMBLY	0.826510721247563	0.95597317484306	0.47046835313967	0.725937282846103	423	2	APOC1, P4HB
REACTOME_TRANSPORT_OF_NUCLEOSIDES_AND_FREE_PURINE_AND_PYRIMIDINE_BASES_ACROSS_THE_PLASMA_MEMBRANE	0.806737588652482	0.954016057696021	0.314496921782124	0.725690989184021	454	7	SLC25A6, SLC25A5, SLC29A1, ARL2
REACTOME_PEXOPHAGY	0.820603907637655	0.955562559833654	0.276461453375902	0.724415753977307	461	11	ATM, RPS27A, EPAS1
REACTOME_INTEGRIN_SIGNALING	0.83041958041958	0.95597317484306	0.237067026732561	0.722346405918045	474	18	SRC, RAPGEF3, RAP1B, RASGRP2, FN1, VWF
REACTOME_RUNX1_REGULATES_TRANSCRIPTION_OF_GENES_INVOLVED_IN_INTERLEUKIN_SIGNALING	0.823529411764706	0.95597317484306	0.372912638425031	0.720460460664864	461	4	RUNX1, ELF1, CBFB, LIFR
REACTOME_ATF6_ATF6_ALPHA_ACTIVATES_CHAPERONES	0.839506172839506	0.95597317484306	0.266533207926624	0.718235161235155	475	12	NFYA, MBTPS1, HSP90B1, DDIT3
REACTOME_RUNX3_REGULATES_P14_ARF	0.810375670840787	0.954016057696021	0.297706111640532	0.717644142246141	452	8	TGFB1, CCND1, RUNX1, BRD2
REACTOME_GRB2_SOS_PROVIDES_LINKAGE_TO_MAPK_SIGNALING_FOR_INTEGRINS	0.839186691312384	0.95597317484306	0.291327899722727	0.713367625170039	453	9	SRC, RAP1B, FN1, VWF
REACTOME_SYNTHESIS_SECRETION_AND_INACTIVATION_OF_GLUCOSE_DEPENDENT_INSULINOTROPIC_POLYPEPTIDE_GIP	0.813653136531365	0.954016057696021	0.322784810126582	0.712723425611103	440	6	DPP4, SEC11C, SEC11A
REACTOME_WNT5A_DEPENDENT_INTERNALIZATION_OF_FZD4	0.844020797227036	0.95597317484306	0.255730630735827	0.712234098173071	486	13	CLTA, AP2A2, ARRB2, AP2B1
REACTOME_ACTIVATED_NTRK2_SIGNALS_THROUGH_RAS	0.821109123434705	0.955562559833654	0.294898655317835	0.710876546601252	458	8	NTRK2, HRAS, NRAS, SHC1, KRAS, NTF4
REACTOME_GLYCOSPHINGOLIPID_METABOLISM	0.893203883495146	0.969515180817876	0.202012525481343	0.709936844741457	551	31	SMPD3, UGCG, ARSG, GBA2, SUMF1, STS, ARSA, GLB1
REACTOME_DISEASES_OF_IMMUNE_SYSTEM	0.859106529209622	0.958993770400348	0.226686011002412	0.709732294417538	499	20	NFKB2, MYD88, TLR2, TLR4, IRAK4, UNC93B1, S100A8, NFKBIA, S100A9, RELA, HMGB1, CD14
REACTOME_TICAM1_DEPENDENT_ACTIVATION_OF_IRF3_IRF7	0.834829443447038	0.95597317484306	0.276431766463253	0.70952939425121	464	10	IRF3, RPS27A, IRF7
REACTOME_SYNTHESIS_OF_IP2_IP_AND_INS_IN_THE_CYTOSOL	0.844797178130511	0.95597317484306	0.263234474657479	0.709345964125844	478	12	INPP5B, ISYNA1
REACTOME_SIGNALING_BY_FGFR2_IN_DISEASE	0.883720930232558	0.965052389470994	0.203982522408226	0.705779459370763	531	29	FGF7, PLCG1, FGF2, NCBP1, HRAS, POLR2H, NRAS
REACTOME_RUNX3_REGULATES_IMMUNE_RESPONSE_AND_CELL_MIGRATION	0.847953216374269	0.95633345362685	0.457293497363796	0.705608351176203	434	2	RORC, CBFB
REACTOME_THROMBOXANE_SIGNALLING_THROUGH_TP_RECEPTOR	0.848324514991182	0.95633345362685	0.261494384665978	0.704656890575381	480	12	GNB1, GNB4, GNG11, GNG12, GNB2
REACTOME_PTK6_EXPRESSION	0.834224598930481	0.95597317484306	0.364707151453613	0.704607608510604	467	4	HIF1A, EPAS1, PELP1, NR3C1
REACTOME_DEACTIVATION_OF_THE_BETA_CATENIN_TRANSACTIVATING_COMPLEX	0.909967845659164	0.977600590944642	0.191144935076334	0.703208503725071	565	37	TCF7L2, TLE3, RPS27A, SOX7, YWHAZ, TLE4, XPO1, SOX4, SOX17, TLE1, HDAC1
REACTOME_CLEC7A_DECTIN_1_INDUCES_NFAT_ACTIVATION	0.843694493783304	0.95597317484306	0.26781452471008	0.70175808770033	474	11	ITPR3, ITPR1
REACTOME_MECP2_REGULATES_NEURONAL_RECEPTORS_AND_CHANNELS	0.845470692717584	0.95597317484306	0.26748511721238	0.700894936697186	475	11	SLC2A3, NOTCH1, CREB1, HDAC1, SIN3A, HDAC2
REACTOME_DOWNREGULATION_OF_ERBB2_SIGNALING	0.880794701986755	0.962631761844086	0.211375834376171	0.699423184546784	531	24	PTPN18, PTPN12, RPS27A, ERBB3, ERBB2, AKT3, CDC37
REACTOME_SIGNALING_BY_NTRK2_TRKB	0.888123924268503	0.967203451771862	0.221589063688985	0.699087739543049	515	21	PLCG1, SRC, FYN, NTRK2
REACTOME_MATURATION_OF_SARS_COV_1_SPIKE_PROTEIN	0.837294332723949	0.95597317484306	0.336567462872376	0.695851068070176	457	5	PRKCSH, MOGS, GANAB
REACTOME_P130CAS_LINKAGE_TO_MAPK_SIGNALING_FOR_INTEGRINS	0.861367837338262	0.958993770400348	0.283180389370854	0.693417012419608	465	9	SRC, RAP1B, FN1, VWF
REACTOME_SIGNALING_BY_ERBB2_ECD_MUTANTS	0.861888111888112	0.958993770400348	0.233204892480725	0.690663960034347	492	16	PLCG1, ERBB2, CDC37, HRAS, NRAS, SHC1, HSP90AA1, KRAS
REACTOME_DNA_DOUBLE_STRAND_BREAK_REPAIR	0.986745213549337	0.996617190995634	0.153603627455714	0.688169885852679	669	105	XRCC3, RAD52, POLE, POLM, ATM, POLD1, SPIDR, MDC1, RTEL1, CDK2, TP53, EME2, RPS27A, RFC2, EYA2, RAD51D, MRE11, WRN, UBE2I, POLL, POLD3, POLD2, UIMC1, PARP2, RFC4, RAD9A, XRCC1, RIF1, SUMO2, ABL1, PCNA, MUS81
REACTOME_MRNA_EDITING_C_TO_U_CONVERSION	0.977732793522267	0.99242012378722	0.510412090325982	0.684680641895946	482	1	APOBEC2
REACTOME_HUR_ELAVL1_BINDS_AND_STABILIZES_MRNA	0.84257602862254	0.95597317484306	0.283569340861272	0.683566337514131	470	8	ANP32A, XPO1, TNFSF13, PRKCD
REACTOME_SUMOYLATION_OF_TRANSCRIPTION_FACTORS	0.873096446700508	0.961373511256099	0.231430210126838	0.676576792918266	515	15	TP53, MDM2, MTA1, UBE2I, SUMO2, TP53BP1
REACTOME_ALK_MUTANTS_BIND_TKIS	0.867145421903052	0.961121143602895	0.263470499985098	0.676261149900587	482	10	HIP1, EML4, NPM1, FN1, EIF2AK3
REACTOME_SUMOYLATION_OF_DNA_REPLICATION_PROTEINS	0.947867298578199	0.990867195752358	0.178269036513677	0.676133431017489	599	41	AAAS, NUP85, NUP210, TOP1, NUP155, NUP107, UBE2I, NUP35, NUP160, NUP50, SUMO2, PCNA, RANGAP1
REACTOME_REGULATION_OF_CYTOSKELETAL_REMODELING_AND_CELL_SPREADING_BY_IPP_COMPLEX_COMPONENTS	0.853309481216458	0.957767039162388	0.279533640601452	0.673837962656921	476	8	ACTN1, PARVA, RSU1, PXN
REACTOME_P2Y_RECEPTORS	0.861060329067642	0.958993770400348	0.325314820203724	0.672586301616615	470	5	LPAR6, P2RY11
REACTOME_NUCLEOTIDE_LIKE_PURINERGIC_RECEPTORS	0.861060329067642	0.958993770400348	0.325314820203724	0.672586301616615	470	5	LPAR6, P2RY11
REACTOME_SIGNALING_BY_ERBB2	0.966153846153846	0.992386348545881	0.17453250691692	0.669584160724754	627	43	PTPN18, PLCG1, SRC, FYN, PTPN12, RPS27A, ERBB3, ERBB2, AKT3, CDC37, HRAS, RHOA, NRAS
REACTOME_HSF1_DEPENDENT_TRANSACTIVATION	0.939443535188216	0.989853164267109	0.18602409937744	0.667102219691628	573	34	SERPINH1, COL4A6, HSPA1B, HSPA1A, DNAJB1, PTGES3, HSPB1, TNFRSF21, HSPA1L, HSP90AB1, DEDD2, CRYAB
REACTOME_FOXO_MEDIATED_TRANSCRIPTION	0.960998439937597	0.992386348545881	0.168082635731618	0.66652966697483	615	54	ATXN3, NFYA, BTG1, BBC3, ABCA6, YWHAQ, BCL2L11, YWHAZ, CDKN1A, CCNG2, TXN, AKT3, HDAC1, DDIT3, CDKN1B, TXNIP, CITED2, CAV1, KLF4, GADD45A, BCL6, SMAD3, SIN3A, FOXO1, HDAC2, SREBF1
REACTOME_SMAD2_SMAD3_SMAD4_HETEROTRIMER_REGULATES_TRANSCRIPTION	0.942244224422442	0.989853164267109	0.191387257602525	0.666202392329701	570	30	WWTR1, CCNT2, SERPINE1, RPS27A, MYC, JUNB, HDAC1, TGIF1
REACTOME_VXPX_CARGO_TARGETING_TO_CILIUM	0.884615384615385	0.965366136951586	0.224523836689442	0.664953983256814	505	16	ASAP1, PKD2, ARF4, RAB11FIP3, PKD1, RAB11A
REACTOME_REGULATION_OF_TP53_ACTIVITY_THROUGH_ACETYLATION	0.925249169435216	0.983386483557482	0.19136756833271	0.662131722484821	556	29	PML, TP53, PIP4K2A, CHD3
REACTOME_SIGNALING_BY_FGFR_IN_DISEASE	0.962264150943396	0.992386348545881	0.170531417301913	0.660549881393301	611	47	FGF7, PLCG1, CNTRL, CPSF6, FGF2, FGFR1
REACTOME_NR1H2_NR1H3_REGULATE_GENE_EXPRESSION_LINKED_TO_GLUCONEOGENESIS	0.875222816399287	0.961668368549211	0.341504414759673	0.65978034162632	490	4	NR1H3, RXRB
REACTOME_FGFR1_MUTANT_RECEPTOR_ACTIVATION	0.919732441471572	0.980143821675469	0.202183305248008	0.659772234203676	549	23	CNTRL, CPSF6, FGF2, FGFR1
REACTOME_SYNTHESIS_OF_PIPS_AT_THE_PLASMA_MEMBRANE	0.964285714285714	0.992386348545881	0.170666974770645	0.659504210612254	620	46	PIK3C2A, PLEKHA2, PTPN13, PIK3R2, PIP4K2A, PLEKHA8, PI4K2B, PLEKHA5, PTEN, PIP5K1B, INPP5D, SBF2, OCRL, RAB14
REACTOME_METABOLIC_DISORDERS_OF_BIOLOGICAL_OXIDATION_ENZYMES	0.888111888111888	0.967203451771862	0.216371763124338	0.659287660495	507	18	CYP26B1, FDXR, CYP1B1, SLC35D1, CYP2R1, GSS
REACTOME_FRUCTOSE_CATABOLISM	0.872262773722628	0.961121143602895	0.37057312769101	0.654795525341066	477	3	TKFC, ALDH1A1
REACTOME_TRAFFICKING_OF_AMPA_RECEPTORS	0.905498281786942	0.975557906089265	0.210739903462698	0.653435546546286	526	19	MDM2, AP2A2, MYO6, DLG4, AP2B1, EPB41L1, GRIP2, TSPAN7
REACTOME_NEGATIVE_REGULATION_OF_MET_ACTIVITY	0.893356643356643	0.969515180817876	0.214183382420293	0.652619635176868	510	18	SH3GL1, CBL, RPS27A
REACTOME_NR1H2_NR1H3_REGULATE_GENE_EXPRESSION_LINKED_TO_LIPOGENESIS	0.878354203935599	0.962072018890201	0.269868355535369	0.650539028105022	490	8	NR1H3, FASN, SCD, RXRB
REACTOME_ZINC_EFFLUX_AND_COMPARTMENTALIZATION_BY_THE_SLC30_FAMILY	0.879341864716636	0.962252969648625	0.314083643023278	0.649365914922068	480	5	SLC30A7, SLC30A1, SLC30A2
REACTOME_HDMS_DEMETHYLATE_HISTONES	0.929553264604811	0.984468345019328	0.202322109584881	0.647344624361294	540	22	PHF8, KDM4C, KDM5B, KDM6B, KDM6A
REACTOME_HCMV_EARLY_EVENTS	0.970266040688576	0.992386348545881	0.158659597955194	0.645927850706977	619	63	PML, DYNLL1, AAAS, TUBB6, NUP85, NUP210, NUP155, TUBA1A, NUP107, TRIM28, CREB1, NUP35, NUP160
REACTOME_POTENTIAL_THERAPEUTICS_FOR_SARS	0.987841945288754	0.996617190995634	0.153611326762966	0.643136407098851	649	74	STAT2, IMPDH1, SIGMAR1, AP2A2, CHD3, S1PR1, IL1R1, ROCK1, PHF21A, TYK2, HMG20B, MTA1, ATP1B2, HDAC1, PTGES3, FKBP1A, IFNGR2, TUBB, IMPDH2, AP2B1, HSP90AB1, MTA2, GATAD2A, RBX1, NFE2L2, MTA3, HDAC2, SAP30, ARID4B, HSP90AA1, ATP1A1, SAP18, TLR9, VEGFA
REACTOME_SIGNALING_BY_MAPK_MUTANTS	0.909594095940959	0.977600590944642	0.286211293310425	0.631967450193193	492	6	DUSP16, DUSP8, DUSP10, DUSP6
REACTOME_FLT3_SIGNALING_IN_DISEASE	0.93687707641196	0.989133168323384	0.188636503142302	0.629968262357481	563	25	CBL, BCL2L1, RPS27A, PIM1, CDKN1A, ETV6
REACTOME_RUNX3_REGULATES_YAP1_MEDIATED_TRANSCRIPTION	0.909594095940959	0.977600590944642	0.285108317216852	0.629532029209566	492	6	WWTR1, TEAD3, TEAD2
REACTOME_ABC_TRANSPORTERS_IN_LIPID_HOMEOSTASIS	0.924162257495591	0.982888287236113	0.232625456489581	0.626862909687383	523	12	ABCA6, ABCA10, ABCA7, ABCA9, ABCA5
REACTOME_SHC1_EVENTS_IN_EGFR_SIGNALING	0.915619389587074	0.980005954416726	0.243690584935397	0.62549118477279	509	10	AREG, HRAS, NRAS, SHC1, KRAS
REACTOME_NEGATIVE_REGULATION_OF_ACTIVITY_OF_TFAP2_AP_2_FAMILY_TRANSCRIPTION_FACTORS	0.901459854014598	0.975048413525994	0.353906089747666	0.625345192733325	493	3	KCTD15, UBE2I
REACTOME_TRANSCRIPTIONAL_REGULATION_BY_VENTX	0.970540098199673	0.992386348545881	0.173791599136162	0.623235171870164	592	34	MOV10, TCF7L2, TP53, ANAPC2, ANAPC7, CEBPB, EHMT2, TNRC6C, CCND1
REACTOME_ERBB2_ACTIVATES_PTK6_SIGNALING	0.912343470483005	0.978826156630749	0.256503787722626	0.618322679735098	509	8	ERBB3, ERBB2, ERBB4
REACTOME_GROWTH_HORMONE_RECEPTOR_SIGNALING	0.942307692307692	0.989853164267109	0.208477987729385	0.617432297639597	538	16	SOCS2, SOCS3, CISH, MAPK3, STAT5A, SH2B1, IRS1, IRS2
REACTOME_KETONE_BODY_METABOLISM	0.919499105545617	0.980143821675469	0.255030504614705	0.61477121420944	513	8	BDH2, ACSS3
REACTOME_DEFECTIVE_FACTOR_IX_CAUSES_HEMOPHILIA_B	0.927875243664717	0.984468345019328	0.397804528429691	0.613816288693904	475	2	GGCX
REACTOME_SIGNALING_BY_FGFR4_IN_DISEASE	0.928952042628774	0.984468345019328	0.232939448085235	0.610374444086723	522	11	PLCG1, HRAS, NRAS, FGFR4
REACTOME_ESTROGEN_DEPENDENT_NUCLEAR_EVENTS_DOWNSTREAM_OF_ESR_MEMBRANE_SIGNALING	0.945017182130584	0.989853164267109	0.194033770965228	0.607501243030707	549	20	AREG, FOS, XPO1, CREB1, AKT3, CDKN1B, CCND1, MAPK3
REACTOME_CROSS_PRESENTATION_OF_PARTICULATE_EXOGENOUS_ANTIGENS_PHAGOSOMES	0.915904936014625	0.980005954416726	0.293135272919047	0.606055294260897	500	5	CYBA, CD36, ITGB5, CYBB, ITGAV
REACTOME_PP2A_MEDIATED_DEPHOSPHORYLATION_OF_KEY_METABOLIC_FACTORS	0.941489361702128	0.989853164267109	0.261620851366859	0.603681248591392	530	7	PPP2R1B, PPP2R1A, PPP2CA, PPP2R5D, MLXIPL, PFKFB1, PPP2CB
REACTOME_BETA_OXIDATION_OF_LAUROYL_COA_TO_DECANOYL_COA_COA	0.919561243144424	0.980143821675469	0.29128944361431	0.60223905402717	502	5	ACADL, ECHS1, HADH, HADHB, HADHA
REACTOME_LONG_TERM_POTENTIATION	0.929982046678636	0.984468345019328	0.234556518321427	0.602046380166653	517	10	SRC, DLG4, ERBB4
REACTOME_POSITIVE_EPIGENETIC_REGULATION_OF_RRNA_EXPRESSION	0.987361769352291	0.996617190995634	0.158411855955615	0.60081971482973	624	41	KAT2A, ACTB, MYO1C, CHD3, TAF1D, MTA1, HDAC1, SF3B1, EHMT2, POLR2H, TAF1C, POLR1C, MTA2, GATAD2A, MTA3, POLR1E, HDAC2
REACTOME_DOWNSTREAM_SIGNALING_OF_ACTIVATED_FGFR1	0.946735395189003	0.990335051546392	0.192300267095366	0.596260262369811	550	19	PLCG1, FGF2, FGFR1, FLRT2, HRAS, NRAS, FRS3, SHC1, FGF6
REACTOME_AMINO_ACID_TRANSPORT_ACROSS_THE_PLASMA_MEMBRANE	0.951890034364261	0.992386348545881	0.190286758588144	0.595769704415515	553	20	SLC25A29, SLC1A5, SLC7A5, SLC36A4, SLC43A1, SLC7A6
REACTOME_DOWNREGULATION_OF_ERBB2_ERBB3_SIGNALING	0.938271604938272	0.989853164267109	0.221044745498773	0.595656014717692	531	12	RPS27A, ERBB3, ERBB2, AKT3
REACTOME_SIGNALING_BY_TYPE_1_INSULIN_LIKE_GROWTH_FACTOR_1_RECEPTOR_IGF1R	0.97411003236246	0.99242012378722	0.169197364000872	0.594613836202176	601	31	FGF7, PIK3R2, FGF2, FGFR1, PIK3R4, IGF1R, HRAS, NRAS, IGF2, CILP, FGFR4, IRS1, SHC1, FGF6, IRS2
REACTOME_CREB1_PHOSPHORYLATION_THROUGH_THE_ACTIVATION_OF_CAMKII_CAMKK_CAMKIV_CASCASDE	0.953900709219858	0.992386348545881	0.255115255446189	0.588669806469318	537	7	CAMKK2, CREB1
REACTOME_THYROXINE_BIOSYNTHESIS	0.943469785575049	0.989853164267109	0.378734836564244	0.584391567126277	483	2	TPO, DIO2
REACTOME_CAMK_IV_MEDIATED_PHOSPHORYLATION_OF_CREB	0.955637707948244	0.992386348545881	0.236600591677649	0.579358181483993	516	9	CAMKK2, CREB1
REACTOME_NOTCH3_ACTIVATION_AND_TRANSMISSION_OF_SIGNAL_TO_THE_NUCLEUS	0.96523178807947	0.992386348545881	0.174124319715871	0.576161350525917	582	24	JAG1, DLL1, RPS27A, NOTCH3
REACTOME_POST_CHAPERONIN_TUBULIN_FOLDING_PATHWAY	0.963604852686308	0.992386348545881	0.205304184027109	0.571791654136099	555	13	TUBB6, TUBA1A, TBCD, TBCB, ARL2, TBCA
REACTOME_MISCELLANEOUS_SUBSTRATES	0.949317738791423	0.991731409118504	0.369683655536028	0.570425506033491	486	2	CYP4B1, CYP2U1
REACTOME_GAB1_SIGNALOSOME	0.965337954939341	0.992386348545881	0.204660902418423	0.57000005375129	556	13	SRC, AREG, PAG1, PXN
